Authors,Title,Year,Source title,Volume,Issue,Art. No.,Page start,Page end,Page count,Cited by,DOI,Link,Document Type,Source,EID
"Varela Miranda, L., Valdes, J.R., Cortes, D.D.","Solar bricks for lunar construction",2017,"Construction and Building Materials","139",,,"241","246",,,10.1016/j.conbuildmat.2017.02.029,"https://www.scopus.com/inward/record.uri?eid=2-s2.0-85013641711&doi=10.1016%2fj.conbuildmat.2017.02.029&partnerID=40&md5=614357d6c372fcf16699de10f0eb2998",Article,Scopus,2-s2.0-85013641711
"Vallejo, L.E., Lobo-Guerrero, S., Sbarro, C., Liu, Z., Valdes, J.R.","An evaluation of the progressive crushing of granular materials under compression",2015,"Geomechanics from Micro to Macro - Proceedings of the TC105 ISSMGE International Symposium on Geomechanics from Micro to Macro,  IS-Cambridge 2014","1",,,"263","268",,,,"https://www.scopus.com/inward/record.uri?eid=2-s2.0-84907344745&partnerID=40&md5=dd2d07fc6b4ba84843106d195b46935f",Conference Paper,Scopus,2-s2.0-84907344745
"Valdes, J.R., Cortes, D.D.","Heat-induced bonding of sands",2014,"Geotechnical Special Publication",,"234 GSP",,"3721","3733",,1,10.1061/9780784413272.361,"https://www.scopus.com/inward/record.uri?eid=2-s2.0-84906829817&doi=10.1061%2f9780784413272.361&partnerID=40&md5=1a8574c61b5748bf2110b9a1ac8abb12",Conference Paper,Scopus,2-s2.0-84906829817
"Ngo, A.T., Valdes, J.R.","Sorption-induced swelling of tire-derived aggregate: Experimental study",2013,"Journal of Materials in Civil Engineering","25","9",,"1271","1276",,,10.1061/(ASCE)MT.1943-5533.0000643,"https://www.scopus.com/inward/record.uri?eid=2-s2.0-84883349931&doi=10.1061%2f%28ASCE%29MT.1943-5533.0000643&partnerID=40&md5=1802ca1ef1d29bb7dd0c0e5426154ca6",Article,Scopus,2-s2.0-84883349931
"Valdes, J.R., Fernandes, F.L., Einav, I.","Periodic propagation of localized compaction in a brittle granular material",2012,"Granular Matter","14","1",,"71","76",,5,10.1007/s10035-011-0302-3,"https://www.scopus.com/inward/record.uri?eid=2-s2.0-84861234401&doi=10.1007%2fs10035-011-0302-3&partnerID=40&md5=1e302b599d37afc8d5cf24fa6da06762",Article,Scopus,2-s2.0-84861234401
"Evans, T.M., Valdes, J.R.","The microstructure of particulate mixtures in one-dimensional compression: Numerical studies",2011,"Granular Matter","13","5",,"657","669",,13,10.1007/s10035-011-0278-z,"https://www.scopus.com/inward/record.uri?eid=2-s2.0-80455174004&doi=10.1007%2fs10035-011-0278-z&partnerID=40&md5=fbbd34651332a7beaf99e710a0083cfd",Article,Scopus,2-s2.0-80455174004
"Patil, U., Valdes, J.R., Evans, T.M.","Swell mitigation with granulated tire rubber",2011,"Journal of Materials in Civil Engineering","23","5",,"721","727",,12,10.1061/(ASCE)MT.1943-5533.0000229,"https://www.scopus.com/inward/record.uri?eid=2-s2.0-79955842412&doi=10.1061%2f%28ASCE%29MT.1943-5533.0000229&partnerID=40&md5=a526027eb33461c0d5a51bf02b77af30",Article,Scopus,2-s2.0-79955842412
"Karanikola, V., Ngo, A.T., Valdes, J.R.","Plankton filtration with compressible crumb rubber packs",2011,"Chemosphere","82","4",,"597","602",,4,10.1016/j.chemosphere.2010.10.098,"https://www.scopus.com/inward/record.uri?eid=2-s2.0-78650268440&doi=10.1016%2fj.chemosphere.2010.10.098&partnerID=40&md5=988c77e5372d255039ae009d392dd851",Article,Scopus,2-s2.0-78650268440
"Fernandes, F., Syahrial, A.I., Valdes, J.R.","Monitoring the oedometric compression of sands with acoustic emissions",2010,"Geotechnical Testing Journal","33","5",,"","",,7,10.1520/GTJ102501,"https://www.scopus.com/inward/record.uri?eid=2-s2.0-77957794676&doi=10.1520%2fGTJ102501&partnerID=40&md5=719bbd633dfb6afd3b2ddfa9d6a0dd0d",Article,Scopus,2-s2.0-77957794676
"Beighley, R.E., Valdes, J.R.","Slope interrupter best management practice experiments on a tilting soil bed with simulated rainfall",2009,"Journal of Irrigation and Drainage Engineering","135","4",,"480","486",,2,10.1061/(ASCE)IR.1943-4774.0000015,"https://www.scopus.com/inward/record.uri?eid=2-s2.0-68049115593&doi=10.1061%2f%28ASCE%29IR.1943-4774.0000015&partnerID=40&md5=08997a2e6e95cd85b0c4b1d9277ed6c9",Article,Scopus,2-s2.0-68049115593
"Beighley, R.E., He, Y., Valdes, J.R.","Characterizing potential water quality impacts from soils treated with dust suppressants",2009,"Journal of Environmental Quality","38","2",,"502","512",,2,10.2134/jeq2008.0188,"https://www.scopus.com/inward/record.uri?eid=2-s2.0-63449091317&doi=10.2134%2fjeq2008.0188&partnerID=40&md5=af9d3fe55cf989202d6e8f118455fae4",Article,Scopus,2-s2.0-63449091317
"Valdes, J.R., Leleu, S.L.","Influence of mineral composition on the simple shear response of sands: Experimental study",2008,"Journal of Geotechnical and Geoenvironmental Engineering","134","12",,"1820","1824",,,10.1061/(ASCE)1090-0241(2008)134:12(1820),"https://www.scopus.com/inward/record.uri?eid=2-s2.0-56449129496&doi=10.1061%2f%28ASCE%291090-0241%282008%29134%3a12%281820%29&partnerID=40&md5=3a53236a68b4e3025ae82312606189e4",Article,Scopus,2-s2.0-56449129496
"Valdes, J.R., Koprulu, E.","Internal stability of crushed sands: Experimental study",2008,"Geotechnique","58","8",,"615","622",,3,10.1680/geot.2007.00112,"https://www.scopus.com/inward/record.uri?eid=2-s2.0-57849108645&doi=10.1680%2fgeot.2007.00112&partnerID=40&md5=204ecc0ae70e38cd0650eb9342d665f7",Article,Scopus,2-s2.0-57849108645
"Einav, I., Valdes, J.R.","On comminution and yield in brittle granular mixtures",2008,"Journal of the Mechanics and Physics of Solids","56","6",,"2136","2148",,6,10.1016/j.jmps.2008.02.002,"https://www.scopus.com/inward/record.uri?eid=2-s2.0-43049125083&doi=10.1016%2fj.jmps.2008.02.002&partnerID=40&md5=22054fdf90cc650610e70927ec4b618a",Article,Scopus,2-s2.0-43049125083
"Valdes, J.R., Evans, T.M.","Sand-rubber mixtures: Experiments and numerical simulations",2008,"Canadian Geotechnical Journal","45","4",,"588","595",,19,10.1139/T08-002,"https://www.scopus.com/inward/record.uri?eid=2-s2.0-43949091779&doi=10.1139%2fT08-002&partnerID=40&md5=51156cc1fda9519c152c1b67fc7fad39",Article,Scopus,2-s2.0-43949091779
"Valdes, J.R., Santamarina, J.C.","Clogging: Bridge formation and vibration-based destabilization",2008,"Canadian Geotechnical Journal","45","2",,"177","184",,18,10.1139/T07-088,"https://www.scopus.com/inward/record.uri?eid=2-s2.0-41549083389&doi=10.1139%2fT07-088&partnerID=40&md5=253809056862c607bceb3dd90d296834",Article,Scopus,2-s2.0-41549083389
"Valdes, J.R., Koprulu, E.","Characterization of fines produced by sand crushing",2007,"Journal of Geotechnical and Geoenvironmental Engineering","133","12",,"1626","1630",,2,10.1061/(ASCE)1090-0241(2007)133:12(1626),"https://www.scopus.com/inward/record.uri?eid=2-s2.0-36448963774&doi=10.1061%2f%28ASCE%291090-0241%282007%29133%3a12%281626%29&partnerID=40&md5=5ac89a91cdaa591cebc22b95fa7fa224",Article,Scopus,2-s2.0-36448963774
"Ngo, A.T., Valdes, J.R.","Creep of sand-rubber mixtures",2007,"Journal of Materials in Civil Engineering","19","12",,"1101","1105",,4,10.1061/(ASCE)0899-1561(2007)19:12(1101),"https://www.scopus.com/inward/record.uri?eid=2-s2.0-36448994386&doi=10.1061%2f%28ASCE%290899-1561%282007%2919%3a12%281101%29&partnerID=40&md5=e913897903b8b8b1e9a9e33acd18ad89",Article,Scopus,2-s2.0-36448994386
"Jacobson, D.E., Valdes, J.R., Evans, T.M.","A numerical view into direct shear specimen size effects",2007,"Geotechnical Testing Journal","30","6",,"512","516",,18,,"https://www.scopus.com/inward/record.uri?eid=2-s2.0-49249119671&partnerID=40&md5=28e5661768e28e9a5e50f66940c87753",Article,Scopus,2-s2.0-49249119671
"Valdes, J.R., Carlos Santamarina, J.","Particle transport in a nonuniform flow field: Retardation and clogging",2007,"Applied Physics Letters","90","24", 244101,"","",,7,10.1063/1.2748850,"https://www.scopus.com/inward/record.uri?eid=2-s2.0-34250647504&doi=10.1063%2f1.2748850&partnerID=40&md5=7eb056e3b1f54c8f5a8df9954e23c5e0",Article,Scopus,2-s2.0-34250647504
"Leleu, S.L., Valdes, J.R.","Experimental study of the influence of mineral composition on sand crushing",2007,"Geotechnique","57","3",,"313","317",,7,10.1680/geot.2007.57.3.313,"https://www.scopus.com/inward/record.uri?eid=2-s2.0-34147128575&doi=10.1680%2fgeot.2007.57.3.313&partnerID=40&md5=cb9dc11b0550b37d1da51ff2d06e7d7c",Article,Scopus,2-s2.0-34147128575
"Valdes, J.R., Lestas, C.A.","Clogging of pervious monolayers subjected to radial flow",2007,"International Journal of Geomechanics","7","1",,"25","33",,,10.1061/(ASCE)1532-3641(2007)7:1(25),"https://www.scopus.com/inward/record.uri?eid=2-s2.0-33846407578&doi=10.1061%2f%28ASCE%291532-3641%282007%297%3a1%2825%29&partnerID=40&md5=f6bcd11fc14392c94c5379769c21fb12",Article,Scopus,2-s2.0-33846407578
"Guimaraes, M.S., Valdes, J.R., Palomino, A.M., Santamarina, J.C.","Aggregate production: Fines generation during rock crushing",2007,"International Journal of Mineral Processing","81","4",,"237","247",,28,10.1016/j.minpro.2006.08.004,"https://www.scopus.com/inward/record.uri?eid=2-s2.0-33846151373&doi=10.1016%2fj.minpro.2006.08.004&partnerID=40&md5=c13e79d3bee86a4e616dc3507f4c4fc6",Article,Scopus,2-s2.0-33846151373
"Leleu, S., Valdes, J.R.","Crushing of sand mixtures",2006,"Proceedings of the International Symposium on Geomechanics and Geotechnics of Particulate Media - Geomechanics and Geotechnics of Particulate Media",,,,"139","142",,,,"https://www.scopus.com/inward/record.uri?eid=2-s2.0-56149091302&partnerID=40&md5=07a74e76d951787c33a1a3b7d43d9c5b",Conference Paper,Scopus,2-s2.0-56149091302
"Valdes, J.R., Caban, B.","Monitoring the hydraulic conductivity of crushing sands",2006,"Geotechnical Testing Journal","29","4",,"322","329",,5,,"https://www.scopus.com/inward/record.uri?eid=2-s2.0-33845589467&partnerID=40&md5=cd805b23a520cb87b4764082540cb41a",Article,Scopus,2-s2.0-33845589467
"Valdes, J.R., Liang, S.-H.","Stress-controlled filtration with compressible particles",2006,"Journal of Geotechnical and Geoenvironmental Engineering","132","7",,"861","868",,7,10.1061/(ASCE)1090-0241(2006)132:7(861),"https://www.scopus.com/inward/record.uri?eid=2-s2.0-33745240056&doi=10.1061%2f%28ASCE%291090-0241%282006%29132%3a7%28861%29&partnerID=40&md5=d602ba4fca67a3d1c42f0eadeeb08b5e",Article,Scopus,2-s2.0-33745240056
"Valdes, J.R., Santamarina, J.C.","Particle clogging in radial flow: Microscale mechanisms",2006,"SPE Journal","11","2",,"193","198",,39,,"https://www.scopus.com/inward/record.uri?eid=2-s2.0-33745241941&partnerID=40&md5=bb0f5d6d4245637fe28d31c234514284",Article,Scopus,2-s2.0-33745241941
"Santamarina, J.C., Valdes, J.R., Palomino, A.M., Alvarellos, J.","Viscous effects in particulates",2005,"Solid Mechanics and its Applications","125",,,"45","51",,,10.1007/1-4020-3865-8_3,"https://www.scopus.com/inward/record.uri?eid=2-s2.0-84884636993&doi=10.1007%2f1-4020-3865-8_3&partnerID=40&md5=0d3140e32d144a5f9e63832eb6b97e5c",Article,Scopus,2-s2.0-84884636993
