Authors,Title,Year,Source title,Volume,Issue,Art. No.,Page start,Page end,Page count,Cited by,DOI,Link,Document Type,Source,EID
"Fengel, C.V., Bradshaw, N.P., Severt, S.Y., Murphy, A.R., Leger, J.M.","Biocompatible silk-conducting polymer composite trilayer actuators",2017,"Smart Materials and Structures","26","5", 055004,"","",,,10.1088/1361-665X/aa65c4,"https://www.scopus.com/inward/record.uri?eid=2-s2.0-85018459440&doi=10.1088%2f1361-665X%2faa65c4&partnerID=40&md5=81180a82931774504ac6a5907f05f4dd",Article,Scopus,2-s2.0-85018459440
"Larson, J.D., Fengel, C.V., Bradshaw, N.P., Romero, I.S., Leger, J.M., Murphy, A.R.","Enhanced actuation performance of silk-polypyrrole composites",2017,"Materials Chemistry and Physics","186",,,"67","74",,1,10.1016/j.matchemphys.2016.10.030,"https://www.scopus.com/inward/record.uri?eid=2-s2.0-85002597399&doi=10.1016%2fj.matchemphys.2016.10.030&partnerID=40&md5=d623cbb61430121083792b26a450b89d",Article,Scopus,2-s2.0-85002597399
"Morrison, L.A., Stanfield, D., Jenkins, M., Baronov, A.A., Patrick, D.L., Leger, J.M.","High performance organic field-effect transistors using ambient deposition of tetracene single crystals",2016,"Organic Electronics: physics, materials, applications","33",,,"269","273",,1,10.1016/j.orgel.2016.03.021,"https://www.scopus.com/inward/record.uri?eid=2-s2.0-84962460046&doi=10.1016%2fj.orgel.2016.03.021&partnerID=40&md5=0a499dc925c095339bf359c6ba962444",Article,Scopus,2-s2.0-84962460046
"Severt, S.Y., Ostrovsky-Snider, N.A., Leger, J.M., Murphy, A.R.","Versatile Method for Producing 2D and 3D Conductive Biomaterial Composites Using Sequential Chemical and Electrochemical Polymerization",2015,"ACS Applied Materials and Interfaces","7","45",,"25281","25288",,6,10.1021/acsami.5b07332,"https://www.scopus.com/inward/record.uri?eid=2-s2.0-84947705700&doi=10.1021%2facsami.5b07332&partnerID=40&md5=1c39134a61a9a26c40c1d837e0a49374",Article,Scopus,2-s2.0-84947705700
"Bradshaw, N.P., Severt, S.Y., Wang, Z., Fengel, C.V., Larson, J.D., Zhu, Z., Murphy, A.R., Leger, J.M.","ToF-SIMS characterization of silk fibroin and polypyrrole composite actuators",2015,"Synthetic Metals","209",,,"490","495",,4,10.1016/j.synthmet.2015.08.031,"https://www.scopus.com/inward/record.uri?eid=2-s2.0-84942106094&doi=10.1016%2fj.synthmet.2015.08.031&partnerID=40&md5=c9ebc61a60058ec46ac6474882ca2057",Article,Scopus,2-s2.0-84942106094
"Romero, I.S., Bradshaw, N.P., Larson, J.D., Severt, S.Y., Roberts, S.J., Schiller, M.L., Leger, J.M., Murphy, A.R.","Biocompatible electromechanical actuators composed of silk-conducting polymer composites",2014,"Advanced Functional Materials","24","25",,"3866","3873",,22,10.1002/adfm.201303292,"https://www.scopus.com/inward/record.uri?eid=2-s2.0-84903549674&doi=10.1002%2fadfm.201303292&partnerID=40&md5=46f8f610c587e5ff9b089811652ebb92",Article,Scopus,2-s2.0-84903549674
"Shoji, T.D., Zhu, Z., Leger, J.M.","Characterizing ion profiles in dynamic junction light-emitting electrochemical cells",2013,"ACS Applied Materials and Interfaces","5","22",,"11509","11514",,15,10.1021/am403805j,"https://www.scopus.com/inward/record.uri?eid=2-s2.0-84889245670&doi=10.1021%2fam403805j&partnerID=40&md5=30311d8ef1a16e89b362d18a280ebbe1",Article,Scopus,2-s2.0-84889245670
"Toshner, S., Leger, J.","Ionic Carriers in Polymer Light-Emitting and Photovoltaic Devices",2013,"Organic Electronics: Emerging Concepts and Technologies",,,,"175","186",,,10.1002/9783527650965.ch07,"https://www.scopus.com/inward/record.uri?eid=2-s2.0-85017631737&doi=10.1002%2f9783527650965.ch07&partnerID=40&md5=39e7b1a244c2269b1b7605189472defc",Book Chapter,Scopus,2-s2.0-85017631737
"Toshner, S.B., Zhu, Z., Kosilkin, I.V., Leger, J.M.","Characterization of ion profiles in light-emitting electrochemical cells by secondary ion mass spectrometry",2012,"ACS Applied Materials and Interfaces","4","3",,"1149","1153",,13,10.1021/am201469t,"https://www.scopus.com/inward/record.uri?eid=2-s2.0-84859134503&doi=10.1021%2fam201469t&partnerID=40&md5=7dcef3e3c4991e73f7117c688307eb01",Article,Scopus,2-s2.0-84859134503
"Patel, D.G., Bastianon, N.M., Tongwa, P., Leger, J.M., Timofeeva, T.V., Bartholomew, G.P.","Modification of nonlinear optical dyes for dye sensitized solar cells: A new use for a familiar acceptor",2011,"Journal of Materials Chemistry","21","12",,"4242","4250",,11,10.1039/c0jm03774e,"https://www.scopus.com/inward/record.uri?eid=2-s2.0-79952600569&doi=10.1039%2fc0jm03774e&partnerID=40&md5=7f10234ac4f4b0f02379718a81c1d5d4",Article,Scopus,2-s2.0-79952600569
"Norell Bader, A.J., Ilkevich, A.A., Kosilkin, I.V., Leger, J.M.","Precise color tuning via hybrid light-emitting electrochemical cells",2011,"Nano Letters","11","2",,"461","465",,17,10.1021/nl103164z,"https://www.scopus.com/inward/record.uri?eid=2-s2.0-79851503330&doi=10.1021%2fnl103164z&partnerID=40&md5=f67c31df4a3b3b4a5222fed539bba9a8",Article,Scopus,2-s2.0-79851503330
"Kosilkin, I.V., Martens, M.S., Murphy, M.P., Leger, J.M.","Polymerizable ionic liquids for fixed-junction polymer light-emitting electrochemical cells",2010,"Chemistry of Materials","22","17",,"4838","4840",,23,10.1021/cm1015788,"https://www.scopus.com/inward/record.uri?eid=2-s2.0-77956405667&doi=10.1021%2fcm1015788&partnerID=40&md5=5b0a6ffd2769cc70ebe32a85f1857401",Article,Scopus,2-s2.0-77956405667
"Hill, Z.B., Rodovsky, D.B., Leger, J.M., Bartholomew, G.P.","Synthesis and utilization of perylene-based n-type small molecules in light-emitting electrochemical cells",2008,"Chemical Communications",,"48",,"6594","6596",,29,10.1039/b814913e,"https://www.scopus.com/inward/record.uri?eid=2-s2.0-57249104952&doi=10.1039%2fb814913e&partnerID=40&md5=6554a8d4b74c4ef6f7a4aa1f02a9adef",Article,Scopus,2-s2.0-57249104952
"Leger, J.M., Patel, D.G., Rodovsky, D.B., Bartholomew, G.P.","Polymer photovoltaic devices employing a chemically fixed p-i-n junction",2008,"Advanced Functional Materials","18","8",,"1212","1219",,25,10.1002/adfm.200700824,"https://www.scopus.com/inward/record.uri?eid=2-s2.0-43249083464&doi=10.1002%2fadfm.200700824&partnerID=40&md5=94c402c6bd01f3d6dd8e89b576bd9087",Article,Scopus,2-s2.0-43249083464
"Leger, J.M.","Organic electronics: The ions have it",2008,"Advanced Materials","20","4",,"837","841",,65,10.1002/adma.200701874,"https://www.scopus.com/inward/record.uri?eid=2-s2.0-49749142478&doi=10.1002%2fadma.200701874&partnerID=40&md5=f28b54cfa9924aee24a673b079a17271",Article,Scopus,2-s2.0-49749142478
"Leger, J.M., Rodovsky, D.B., Bartholomew, G.P.","Self-assembled, chemically fixed homojunctions in semiconducting polymers",2006,"Advanced Materials","18","23",,"3130","3134",,59,10.1002/adma.200601360,"https://www.scopus.com/inward/record.uri?eid=2-s2.0-33846120641&doi=10.1002%2fadma.200601360&partnerID=40&md5=b23a8360c4592dfe0f9e9c1cb7fd3eb7",Article,Scopus,2-s2.0-33846120641
"Leger, J.M., Holt, A.L., Carter, S.A.","Reversible thermochromic effects in poly(phenylene vinylene)-based polymers",2006,"Applied Physics Letters","88","11", 111901,"","",,11,10.1063/1.2183360,"https://www.scopus.com/inward/record.uri?eid=2-s2.0-33645151951&doi=10.1063%2f1.2183360&partnerID=40&md5=6bbc996aca579a5e2e444e0de7dd3fcc",Article,Scopus,2-s2.0-33645151951
"Leger, J.M., Carter, S.A., Ruhstaller, B.","Recombination profiles in poly[2-methoxy-5-(2-ethylhexyloxy)-1,4- phenylenevinylene] light-emitting electrochemical cells",2005,"Journal of Applied Physics","98","12", 124907,"","",,33,10.1063/1.2149162,"https://www.scopus.com/inward/record.uri?eid=2-s2.0-29744440128&doi=10.1063%2f1.2149162&partnerID=40&md5=6fe7ceac2cbae4ac495bc05e499f9652",Review,Scopus,2-s2.0-29744440128
"Holt, A.L., Leger, J.M., Carter, S.A.","Electrochemical and optical characterization of p- and n-doped poly[2-methoxy-5-(2-ethylhexyloxy)-1,4-phenylenevinylene]",2005,"Journal of Chemical Physics","123","4", 044704,"","",,66,10.1063/1.1949188,"https://www.scopus.com/inward/record.uri?eid=2-s2.0-23844540646&doi=10.1063%2f1.1949188&partnerID=40&md5=23120ddef3488d49f8ad9388a793c729",Article,Scopus,2-s2.0-23844540646
"Holt, A.L., Leger, J.M., Carter, S.A.","Solid-state electrochromic devices based on poly (phenylene vinylene) polymers",2005,"Applied Physics Letters","86","12", 123504,"1","3",,15,10.1063/1.1883321,"https://www.scopus.com/inward/record.uri?eid=2-s2.0-17944377712&doi=10.1063%2f1.1883321&partnerID=40&md5=0b7eb747f7a20c2fed4798f365b87d88",Article,Scopus,2-s2.0-17944377712
"Leger, J.M., Carter, S.A., Ruhstaller, B., Nothofer, H.-G., Scherf, U., Tillman, H., Hörhold, H.-H.","Thickness-dependent changes in the optical properties of PPV- and PF-based polymer light emitting diodes",2003,"Physical Review B - Condensed Matter and Materials Physics","68","5", 054209,"542091","542096",,48,,"https://www.scopus.com/inward/record.uri?eid=2-s2.0-0141761309&partnerID=40&md5=e3f6a4306036560582044a8e1ad65f76",Article,Scopus,2-s2.0-0141761309
