Authors,Title,Year,Source title,Volume,Issue,Art. No.,Page start,Page end,Page count,Cited by,DOI,Link,Document Type,Source,EID
"Dou, X., Kotov, V.N., Uchoa, B.","Designing Quantum Spin-Orbital Liquids in Artificial Mott Insulators",2016,"Scientific Reports","6",, 31737,"","",,,10.1038/srep31737,"https://www.scopus.com/inward/record.uri?eid=2-s2.0-84983616625&doi=10.1038%2fsrep31737&partnerID=40&md5=3d673857f4d1ef0d2719b1d9bbb79097",Article,Scopus,2-s2.0-84983616625
"Mullen, K., Uchoa, B., Glatzhofer, D.T.","Mullen, Uchoa, and Glatzhofer Reply",2016,"Physical Review Letters","116","24", 249702,"","",,,10.1103/PhysRevLett.116.249702,"https://www.scopus.com/inward/record.uri?eid=2-s2.0-84975506989&doi=10.1103%2fPhysRevLett.116.249702&partnerID=40&md5=dcbe9662777ccda1e637c07fa5b2be85",Note,Scopus,2-s2.0-84975506989
"Gan, Y., De La Peña, G.A., Kogar, A., Uchoa, B., Casa, D., Gog, T., Fradkin, E., Abbamonte, P.","Reexamination of the effective fine structure constant of graphene as measured in graphite",2016,"Physical Review B","93","19", 195150,"","",,,10.1103/PhysRevB.93.195150,"https://www.scopus.com/inward/record.uri?eid=2-s2.0-84970990739&doi=10.1103%2fPhysRevB.93.195150&partnerID=40&md5=38ec47c6cb490f50c61759e86f66d69b",Article,Scopus,2-s2.0-84970990739
"Mullen, K., Uchoa, B., Glatzhofer, D.T.","Line of Dirac Nodes in Hyperhoneycomb Lattices",2015,"Physical Review Letters","115","2", 026403,"","",,56,10.1103/PhysRevLett.115.026403,"https://www.scopus.com/inward/record.uri?eid=2-s2.0-84937854934&doi=10.1103%2fPhysRevLett.115.026403&partnerID=40&md5=c26a212dea71b1ab695c543dd1607d81",Article,Scopus,2-s2.0-84937854934
"Gunawardana, K.G.S.H., Uchoa, B.","Andreev reflection in edge states of time-reversal-invariant Landau levels",2015,"Physical Review B - Condensed Matter and Materials Physics","91","24", 241402,"","",,1,10.1103/PhysRevB.91.241402,"https://www.scopus.com/inward/record.uri?eid=2-s2.0-84931275429&doi=10.1103%2fPhysRevB.91.241402&partnerID=40&md5=a81b1b8b67876013082c8fe604412855",Article,Scopus,2-s2.0-84931275429
"Uchoa, B., Kotov, V.N., Kindermann, M.","Valley order and loop currents in graphene on hexagonal boron nitride",2015,"Physical Review B - Condensed Matter and Materials Physics","91","12", 121412,"","",,4,10.1103/PhysRevB.91.121412,"https://www.scopus.com/inward/record.uri?eid=2-s2.0-84926435526&doi=10.1103%2fPhysRevB.91.121412&partnerID=40&md5=40c15dcc1980b8f8fd9bc1184bb802fb",Article,Scopus,2-s2.0-84926435526
"Dou, X., Jaefari, A., Barlas, Y., Uchoa, B.","Quasiparticle renormalization in ABC graphene trilayers",2014,"Physical Review B - Condensed Matter and Materials Physics","90","16", 161411,"","",,,10.1103/PhysRevB.90.161411,"https://www.scopus.com/inward/record.uri?eid=2-s2.0-84912000383&doi=10.1103%2fPhysRevB.90.161411&partnerID=40&md5=34baa123d6e73e4b774b608a3ac20acd",Article,Scopus,2-s2.0-84912000383
"García, J.H., Uchoa, B., Covaci, L., Rappoport, T.G.","Adatoms and Anderson localization in graphene",2014,"Physical Review B - Condensed Matter and Materials Physics","90","8", 085425,"","",,4,10.1103/PhysRevB.90.085425,"https://www.scopus.com/inward/record.uri?eid=2-s2.0-84940337400&doi=10.1103%2fPhysRevB.90.085425&partnerID=40&md5=12f7bf30af78247ad7de82814f2ef1a4",Article,Scopus,2-s2.0-84940337400
"Uchoa, B., Yang, L., Tsai, S.-W., Peres, N.M.R., Neto, A.H.C.","Orbital symmetry fingerprints for magnetic adatoms in graphene",2014,"New Journal of Physics","16",, 013045,"","",,5,10.1088/1367-2630/16/1/013045,"https://www.scopus.com/inward/record.uri?eid=2-s2.0-84894203229&doi=10.1088%2f1367-2630%2f16%2f1%2f013045&partnerID=40&md5=b7b46ce4e7e2f41fd41d460852b75c2a",Article,Scopus,2-s2.0-84894203229
"Uchoa, B., Barlas, Y.","Superconducting states in pseudo-Landau-levels of strained graphene",2013,"Physical Review Letters","111","4", 046604,"","",,14,10.1103/PhysRevLett.111.046604,"https://www.scopus.com/inward/record.uri?eid=2-s2.0-84880879915&doi=10.1103%2fPhysRevLett.111.046604&partnerID=40&md5=524e7b02415125c2465350c7b3326d35",Article,Scopus,2-s2.0-84880879915
"Guinea, F., Uchoa, B.","Erratum: Odd-momentum pairing and superconductivity in vertical graphene heterostructures (Physical Review B (2012) 86 (134521) DOI:10.1103/PhysRevB.86. 134521)",2012,"Physical Review B - Condensed Matter and Materials Physics","86","13", 139905,"","",,,10.1103/PhysRevB.86.139905,"https://www.scopus.com/inward/record.uri?eid=2-s2.0-84869045351&doi=10.1103%2fPhysRevB.86.139905&partnerID=40&md5=605a34089fa30d1b8832e0991130e31d",Erratum,Scopus,2-s2.0-84869045351
"Guinea, F., Uchoa, B.","Odd-momentum pairing and superconductivity in vertical graphene heterostructures",2012,"Physical Review B - Condensed Matter and Materials Physics","86","13", 134521,"","",,14,10.1103/PhysRevB.86.134521,"https://www.scopus.com/inward/record.uri?eid=2-s2.0-84867793424&doi=10.1103%2fPhysRevB.86.134521&partnerID=40&md5=340a9aba1819acc483588329b1d968fc",Article,Scopus,2-s2.0-84867793424
"Kindermann, M., Uchoa, B., Miller, D.L.","Zero-energy modes and gate-tunable gap in graphene on hexagonal boron nitride",2012,"Physical Review B - Condensed Matter and Materials Physics","86","11", 115415,"","",,66,10.1103/PhysRevB.86.115415,"https://www.scopus.com/inward/record.uri?eid=2-s2.0-84866369889&doi=10.1103%2fPhysRevB.86.115415&partnerID=40&md5=2f04e12545d076590ff3cff26b7ea8f1",Article,Scopus,2-s2.0-84866369889
"Kotov, V.N., Uchoa, B., Pereira, V.M., Guinea, F., Castro Neto, A.H.","Electron-electron interactions in graphene: Current status and perspectives",2012,"Reviews of Modern Physics","84","3",,"1067","1125",,447,10.1103/RevModPhys.84.1067,"https://www.scopus.com/inward/record.uri?eid=2-s2.0-84864431490&doi=10.1103%2fRevModPhys.84.1067&partnerID=40&md5=ee7ed7f77cdf1a5a67df1c0a45486cd0",Article,Scopus,2-s2.0-84864431490
"Uchoa, B., Reed, J.P., Gan, Y., Joe, Y.I., Fradkin, E., Abbamonte, P., Casa, D.","The electron many-body problem in graphene",2012,"Physica Scripta T","T146",, 014014,"","",,,,"https://www.scopus.com/inward/record.uri?eid=2-s2.0-84858189408&partnerID=40&md5=5e929f9f42424986c1205f9c2543ec99",Conference Paper,Scopus,2-s2.0-84858189408
"Uchoa, B., Reed, J.P., Gan, Y., Joe, Y.I.I., Fradkin, E., Abbamonte, P., Casa, D.","The electron many-body problem in graphene",2012,"Physica Scripta",,"T146", 014014,"","",,2,10.1088/0031-8949/2012/T146/014014,"https://www.scopus.com/inward/record.uri?eid=2-s2.0-84857398194&doi=10.1088%2f0031-8949%2f2012%2fT146%2f014014&partnerID=40&md5=91c3ef8e39d9b55a713b4b1ec9886242",Article,Scopus,2-s2.0-84857398194
"Rappoport, T.G., Godoy, M., Uchoa, B., Dos Santos, R.R., Castro Neto, A.H.","Magnetic exchange mechanism for electronic gap opening in graphene",2011,"EPL","96","2", 27010,"","",,3,10.1209/0295-5075/96/27010,"https://www.scopus.com/inward/record.uri?eid=2-s2.0-80054061399&doi=10.1209%2f0295-5075%2f96%2f27010&partnerID=40&md5=e38835cea1174cd91acbaa7ca4065427",Article,Scopus,2-s2.0-80054061399
"Dirks, T., Hughes, T.L., Lal, S., Uchoa, B., Chen, Y.-F., Chialvo, C., Goldbart, P.M., Mason, N.","Transport through Andreev bound states in a graphene quantum dot",2011,"Nature Physics","7","5",,"386","390",,74,10.1038/nphys1911,"https://www.scopus.com/inward/record.uri?eid=2-s2.0-79955653550&doi=10.1038%2fnphys1911&partnerID=40&md5=89d8819e0477a7cdf7497754ab5ae4e6",Article,Scopus,2-s2.0-79955653550
"Uchoa, B., Rappoport, T.G., Castro Neto, A.H.","Erratum: Kondo quantum criticality of magnetic adatoms in graphene (Physical Review Letters (2011) 106 (016801))",2011,"Physical Review Letters","106","15", 159901,"","",,7,10.1103/PhysRevLett.106.159901,"https://www.scopus.com/inward/record.uri?eid=2-s2.0-79960625209&doi=10.1103%2fPhysRevLett.106.159901&partnerID=40&md5=7c7d4941f2b64a7ee9d71dd0cda5e672",Erratum,Scopus,2-s2.0-79960625209
"Uchoa, B., Rappoport, T.G., Castro Neto, A.H.","Kondo quantum criticality of magnetic adatoms in graphene",2011,"Physical Review Letters","106","1", 016801,"","",,91,10.1103/PhysRevLett.106.016801,"https://www.scopus.com/inward/record.uri?eid=2-s2.0-78650979308&doi=10.1103%2fPhysRevLett.106.016801&partnerID=40&md5=01c495a93e5247d83977de765fc940f2",Article,Scopus,2-s2.0-78650979308
"Reed, J.P., Uchoa, B., Joe, Y.I., Gan, Y., Casa, D., Fradkin, E., Abbamonte, P.","The effective fine-structure constant of freestanding graphene measured in graphite",2010,"Science","330","6005",,"805","808",,67,10.1126/science.1190920,"https://www.scopus.com/inward/record.uri?eid=2-s2.0-78149302862&doi=10.1126%2fscience.1190920&partnerID=40&md5=50bc1c61ca4b77c23427c050afcb0ba6",Article,Scopus,2-s2.0-78149302862
"Rappoport, T.G., Uchoa, B., Castro Neto, A.H.","Magnetism and magnetotransport in disordered graphene",2009,"Physical Review B - Condensed Matter and Materials Physics","80","24", 245408,"","",,27,10.1103/PhysRevB.80.245408,"https://www.scopus.com/inward/record.uri?eid=2-s2.0-77954692377&doi=10.1103%2fPhysRevB.80.245408&partnerID=40&md5=9d36ca8c7be8bfde715eec4fff724fc1",Article,Scopus,2-s2.0-77954692377
"Uchoa, B., Yang, L., Tsai, S.-W., Peres, N.M.R., Castro Neto, A.H.","Theory of scanning tunneling spectroscopy of magnetic adatoms in graphene",2009,"Physical Review Letters","103","20", 206804,"","",,43,10.1103/PhysRevLett.103.206804,"https://www.scopus.com/inward/record.uri?eid=2-s2.0-70449413381&doi=10.1103%2fPhysRevLett.103.206804&partnerID=40&md5=6b29ced84a87df57b708f16de8419679",Article,Scopus,2-s2.0-70449413381
"Castro Neto, A.H., Kotov, V.N., Nilsson, J., Pereira, V.M., Peres, N.M.R., Uchoa, B.","Adatoms in graphene",2009,"Solid State Communications","149","27-28",,"1094","1100",,36,10.1016/j.ssc.2009.02.040,"https://www.scopus.com/inward/record.uri?eid=2-s2.0-65849220829&doi=10.1016%2fj.ssc.2009.02.040&partnerID=40&md5=833be00bd5df2d8b8aa71970299868f6",Article,Scopus,2-s2.0-65849220829
"Uchoa, B., Neto, A.H.C.","Comment on ""bCS superconductivity of dirac electrons in graphene layers""",2009,"Physical Review Letters","102","10", 109701,"","",,8,10.1103/PhysRevLett.102.109701,"https://www.scopus.com/inward/record.uri?eid=2-s2.0-63149166799&doi=10.1103%2fPhysRevLett.102.109701&partnerID=40&md5=a6b045a3330360b57c4f641b032226f5",Article,Scopus,2-s2.0-63149166799
"Kotov, V.N., Pereira, V.M., Uchoa, B.","Polarization charge distribution in gapped graphene: Perturbation theory and exact diagonalization analysis",2008,"Physical Review B - Condensed Matter and Materials Physics","78","7", 075433,"","",,46,10.1103/PhysRevB.78.075433,"https://www.scopus.com/inward/record.uri?eid=2-s2.0-50449085878&doi=10.1103%2fPhysRevB.78.075433&partnerID=40&md5=f42a79689c8dd145b88b123934db7276",Article,Scopus,2-s2.0-50449085878
"Uchoa, B., Kotov, V.N., Peres, N.M.R., Castro Neto, A.H.","Erratum: Publisher's note: Localized magnetic states in graphene (Physical Review Letters (2008) 101 (026805))",2008,"Physical Review Letters","101","3", 039903,"","",,1,10.1103/PhysRevLett.101.039903,"https://www.scopus.com/inward/record.uri?eid=2-s2.0-47949089310&doi=10.1103%2fPhysRevLett.101.039903&partnerID=40&md5=ffbafce4d55bf7d1a9eb4e364d11a600",Erratum,Scopus,2-s2.0-47949089310
"Kotov, V.N., Uchoa, B., Castro Neto, A.H.","Electron-electron interactions in the vacuum polarization of graphene",2008,"Physical Review B - Condensed Matter and Materials Physics","78","3", 035119,"","",,43,10.1103/PhysRevB.78.035119,"https://www.scopus.com/inward/record.uri?eid=2-s2.0-47949125991&doi=10.1103%2fPhysRevB.78.035119&partnerID=40&md5=c1af337eb093a61bb3d9bf9cf4ba3cf8",Article,Scopus,2-s2.0-47949125991
"Uchoa, B., Kotov, V.N., Peres, N.M.R., Castro Neto, A.H.","Localized magnetic states in graphene",2008,"Physical Review Letters","101","2", 026805,"","",,142,10.1103/PhysRevLett.101.026805,"https://www.scopus.com/inward/record.uri?eid=2-s2.0-48249118757&doi=10.1103%2fPhysRevLett.101.026805&partnerID=40&md5=b4c84b892801912186a78c576e83c21f",Article,Scopus,2-s2.0-48249118757
"Uchoa, B., Lin, C.-Y., Castro Neto, A.H.","Tailoring graphene with metals on top",2008,"Physical Review B - Condensed Matter and Materials Physics","77","3", 035420,"","",,87,10.1103/PhysRevB.77.035420,"https://www.scopus.com/inward/record.uri?eid=2-s2.0-38349182748&doi=10.1103%2fPhysRevB.77.035420&partnerID=40&md5=8f46e184e8b3946d8844ee77378ee708",Article,Scopus,2-s2.0-38349182748
"Uchoa, B., Castro Neto, A.H.","Superconducting states of pure and doped graphene",2007,"Physical Review Letters","98","14", 146801,"","",,222,10.1103/PhysRevLett.98.146801,"https://www.scopus.com/inward/record.uri?eid=2-s2.0-34047267689&doi=10.1103%2fPhysRevLett.98.146801&partnerID=40&md5=4c7fd2dae7d4434170b5196fdb8648aa",Article,Scopus,2-s2.0-34047267689
"Ferraz, A., Kochetov, E., Uchoa, B.","Comment on ""new mean-field theory of the tt′t′′J model applied to high-Tc superconductors""",2007,"Physical Review Letters","98","6", 069701,"","",,9,10.1103/PhysRevLett.98.069701,"https://www.scopus.com/inward/record.uri?eid=2-s2.0-33846887587&doi=10.1103%2fPhysRevLett.98.069701&partnerID=40&md5=a705f166651a50def77a57a2ddc65254",Note,Scopus,2-s2.0-33846887587
"Granado, E., Uchoa, B., Malachias, A., Lora-Serrano, R., Pagliuso, P.G., Westfahl Jr., H.","Magnetic structure and critical behavior of GdRh In5: Resonant x-ray diffraction and renormalization group analysis",2006,"Physical Review B - Condensed Matter and Materials Physics","74","21", 214428,"","",,17,10.1103/PhysRevB.74.214428,"https://www.scopus.com/inward/record.uri?eid=2-s2.0-33846296951&doi=10.1103%2fPhysRevB.74.214428&partnerID=40&md5=979ff6ce3bc014006c97b30f364cf216",Article,Scopus,2-s2.0-33846296951
"Uchoa, B., Cabrera, G.G., Castro Neto, A.H.","Nodal liquid and s -wave superconductivity in transition metal dichalcogenides",2005,"Physical Review B - Condensed Matter and Materials Physics","71","18", 184509,"","",,36,10.1103/PhysRevB.71.184509,"https://www.scopus.com/inward/record.uri?eid=2-s2.0-28544441372&doi=10.1103%2fPhysRevB.71.184509&partnerID=40&md5=c61c8744f13c5027c0828952cf243dab",Article,Scopus,2-s2.0-28544441372
"Uchoa, B., Castro Neto, A.H., Cabrera, G.G.","Electromagnetic response of layered superconductors with broken lattice inversion symmetry",2004,"Physical Review B - Condensed Matter and Materials Physics","69","14", 144512,"144512","1-144512-9",,8,10.1103/PhysRevB.69.144512,"https://www.scopus.com/inward/record.uri?eid=2-s2.0-42749106981&doi=10.1103%2fPhysRevB.69.144512&partnerID=40&md5=3bda6ec87487b6543e4a037dcb4b3238",Article,Scopus,2-s2.0-42749106981
