Authors,Title,Year,Source title,Volume,Issue,Art. No.,Page start,Page end,Page count,Cited by,DOI,Link,Document Type,Source,EID
"Smith, P., Gronewoller, P., Rose, L.C.","Pricing efficiency on the New Zealand futures and options exchange",1998,"Journal of Multinational Financial Management","8","1",,"49","62",,1,,"https://www.scopus.com/inward/record.uri?eid=2-s2.0-0031635802&partnerID=40&md5=2c862357a46837df2427321690181686",Article,Scopus,2-s2.0-0031635802
"Cole, J.W., Hendler, R.W., Smith, P.D., Fredrickson, H.A., Pohida, T.J., Friauf, W.S.","A high speed optical multichannel analyzer",1997,"Journal of Biochemical and Biophysical Methods","35","3",,"161","174",,3,10.1016/S0165-022X(97)00037-7,"https://www.scopus.com/inward/record.uri?eid=2-s2.0-0031452761&doi=10.1016%2fS0165-022X%2897%2900037-7&partnerID=40&md5=29a1a86fe4832d82da303b3c1418b41a",Article,Scopus,2-s2.0-0031452761
"Dwore, R.B., Murray, B.P., Parsons, R., Smith, P., Vorderer, L., Gustafson, G.","Job satisfaction of selected categories of Utah hospital managers.",1997,"Hospital topics","75","1",,"14","21",,2,,"https://www.scopus.com/inward/record.uri?eid=2-s2.0-0031448745&partnerID=40&md5=a81fe652621ee9e42b316dc22788d8fd",Article,Scopus,2-s2.0-0031448745
"Pass, H.I., Temeck, B.K., Kranda, K., Thomas, G., Russo, A., Smith, P., Friauf, W., Steinberg, S.M.","Phase III randomized trial of surgery with or without intraoperative photodynamic therapy and postoperative immunochemotherapy for malignant pleural mesothelioma",1997,"Annals of Surgical Oncology","4","8",,"628","633",,135,,"https://www.scopus.com/inward/record.uri?eid=2-s2.0-0031300337&partnerID=40&md5=9dbe56df9b6cd4da376f037b28ef4691",Article,Scopus,2-s2.0-0031300337
"Saharay, M., Shields, D.A., Porter, J.B., Scurr, J.H., Smith, P.D.C.","Leukocyte activity in the microcirculation of the leg in patients with chronic venous disease",1997,"Journal of Vascular Surgery","26","2",,"265","273",,91,10.1016/S0741-5214(97)70188-5,"https://www.scopus.com/inward/record.uri?eid=2-s2.0-0030791544&doi=10.1016%2fS0741-5214%2897%2970188-5&partnerID=40&md5=f0b27bc8e33d2ba1197ae1f881eb478e",Article,Scopus,2-s2.0-0030791544
"Walther, M.M., Delaney, T.F., Smith, P.D., Friauf, W.S., Thomas, G.F., Shawker, T.H., Vargas, M.P., Choyke, P.L., Linehan, W.M., Abraham, E.H., Okunieff, P.G., Glatstein, E.","Phase I trial of photodynamic therapy in the treatment of recurrent superficial transitional cell carcinoma of the bladder",1997,"Urology","50","2",,"199","206",,27,10.1016/S0090-4295(97)00211-2,"https://www.scopus.com/inward/record.uri?eid=2-s2.0-18144436025&doi=10.1016%2fS0090-4295%2897%2900211-2&partnerID=40&md5=3ed29e26a9df61ec5b7e8b9cc5757a79",Article,Scopus,2-s2.0-18144436025
"Bose, S., Hendler, R.W., Shrager, R.I., Chan, S.I., Smith, P.D.","Multichannel analysis of single-turnover kinetics of cytochrome aa<inf>3</inf> reduction of O<inf>2</inf>",1997,"Biochemistry","36","9",,"2439","2449",,10,10.1021/bi9617419,"https://www.scopus.com/inward/record.uri?eid=2-s2.0-0031017654&doi=10.1021%2fbi9617419&partnerID=40&md5=b750860b4496604d44afd911b9062123",Article,Scopus,2-s2.0-0031017654
"Smith, P.D., Barker, K.T., Wang, J., Lu, Y.-J., Shipley, J., Crompton, M.R.","ICAAR, a novel member of a new family of transmembrane, tyrosine phosphatase-like proteins",1996,"Biochemical and Biophysical Research Communications","229","2",,"402","411",,22,10.1006/bbrc.1996.1817,"https://www.scopus.com/inward/record.uri?eid=2-s2.0-0030582750&doi=10.1006%2fbbrc.1996.1817&partnerID=40&md5=c8e25962e0683ab9f6b90b8bf1acf8d1",Article,Scopus,2-s2.0-0030582750
"Crossland, S., Smith, P.D., Crompton, M.R.","Molecular cloning and characterization of PTPπ, a novel receptor-like protein-tyrosine phosphatase",1996,"Biochemical Journal","319","1",,"249","254",,6,,"https://www.scopus.com/inward/record.uri?eid=2-s2.0-0029810116&partnerID=40&md5=8f27d16c129dfc623504aa91f966b3ea",Article,Scopus,2-s2.0-0029810116
"Saharay, M., Addison, I.E., Shields, D.A., Scurr, J.H., Smith, P.D.C.","Leukocyte migration in the leg in response to experimental venous hypertension",1996,"Journal of Vascular Surgery","24","5",,"725","731",,4,10.1016/S0741-5214(96)70004-6,"https://www.scopus.com/inward/record.uri?eid=2-s2.0-0029913566&doi=10.1016%2fS0741-5214%2896%2970004-6&partnerID=40&md5=4a76f03e24d96e9953d244c6343d8f59",Article,Scopus,2-s2.0-0029913566
"Hendler, R.W., Mukhopadhyay, A.K., Smith, P.D., Cascio, H.E.","A monitoring system for energy transduction by bacteriorhodopsin liposomes",1996,"Journal of Biochemical and Biophysical Methods","33","2",,"89","104",,2,10.1016/S0165-022X(96)00017-6,"https://www.scopus.com/inward/record.uri?eid=2-s2.0-0030589066&doi=10.1016%2fS0165-022X%2896%2900017-6&partnerID=40&md5=9908632ca944b5e38a432390e5f80ddc",Article,Scopus,2-s2.0-0030589066
"Emmert-Buck, M.R., Bonner, R.F., Smith, P.D., Chuaqui, R.F., Zhuang, Z., Goldstein, S.R., Weiss, R.A., Liotta, L.A.","Laser capture microdissection",1996,"Science","274","5289",,"998","1001",,1808,10.1126/science.274.5289.998,"https://www.scopus.com/inward/record.uri?eid=2-s2.0-0030575911&doi=10.1126%2fscience.274.5289.998&partnerID=40&md5=d19cebf0cfb80f441f4fa0cf8ac7f0f3",Article,Scopus,2-s2.0-0030575911
"Dabbs, M.F., Smith, P.","Critical forcing for homoclinic and heteroclinic orbits of a rotating pendulum",1996,"Journal of Sound and Vibration","189","2",,"231","248",,10,10.1006/jsvi.1996.0017,"https://www.scopus.com/inward/record.uri?eid=2-s2.0-0000629713&doi=10.1006%2fjsvi.1996.0017&partnerID=40&md5=70301d3b8cadabbbd1da0383e3ea8e31",Article,Scopus,2-s2.0-0000629713
"Smith, P.D.C.","Oxygen, oxygen free radicals and reperfusion injury",1996,"Wounds","8","1",,"9","15",,8,,"https://www.scopus.com/inward/record.uri?eid=2-s2.0-0006894542&partnerID=40&md5=83251acee065ed51efbb69bc02439e63",Article,Scopus,2-s2.0-0006894542
"Smith, P.D.C.","Another Consensus Statement?",1995,"Phlebology","10","2",,"41","",,1,10.1177/026835559501000201,"https://www.scopus.com/inward/record.uri?eid=2-s2.0-0029083637&doi=10.1177%2f026835559501000201&partnerID=40&md5=3ae89834af72669853d6e2df0c164e79",Editorial,Scopus,2-s2.0-0029083637
"Smith, P.D.C.","World Congress of the International Union of Phlebology in London",1995,"Phlebology","10","3",,"89","",,,10.1177/026835559501000301,"https://www.scopus.com/inward/record.uri?eid=2-s2.0-0029050826&doi=10.1177%2f026835559501000301&partnerID=40&md5=9695d7faa48301764e0f2f804934c58d",Editorial,Scopus,2-s2.0-0029050826
"Mays, G.C., Smith, P.D.","Blast effects on buildings. Design of buildings to optimize resistance to blast loading",1995,"Blast effects on buildings. Design of buildings to optimize resistance to blast loading",,,,"","",121,158,,"https://www.scopus.com/inward/record.uri?eid=2-s2.0-0028811945&partnerID=40&md5=c60c221ee6edf6955c062f7d65e5cfe4",Article,Scopus,2-s2.0-0028811945
"Abu-Own, A., Scurr, J.H., Smith, P.D.C.","Effect of Compression Stockings on the Skin Microcirculation in Chronic Venous Insufficiency",1995,"Phlebology","10","1",,"5","11",,16,10.1177/026835559501000103,"https://www.scopus.com/inward/record.uri?eid=2-s2.0-0028966427&doi=10.1177%2f026835559501000103&partnerID=40&md5=b632972c1adf99432cfe22a13d89f3b7",Article,Scopus,2-s2.0-0028966427
"Bernstein, E.F., Smith, P.D., homas, G.F., Xie, H., Mitchell, J.B., Glatstein, E., Russo, A.","A diffusing sphere which delivers homogeneous laser light for use in photodynamic therapy",1995,"Journal of Dermatological Science","9","3",,"195","202",,,10.1016/0923-1811(94)00377-Q,"https://www.scopus.com/inward/record.uri?eid=2-s2.0-0028923639&doi=10.1016%2f0923-1811%2894%2900377-Q&partnerID=40&md5=17ea9bda23f3893fee59556a552217de",Article,Scopus,2-s2.0-0028923639
"Theobald, J., Smith, P.D., Jacob, S.M., Moss, S.E.","Expression of annexin VI in A431 carcinoma cells suppresses proliferation: A possible role for annexin VI in cell growth regulation",1994,"BBA - Molecular Cell Research","1223","3",,"383","390",,41,10.1016/0167-4889(94)90099-X,"https://www.scopus.com/inward/record.uri?eid=2-s2.0-0027959124&doi=10.1016%2f0167-4889%2894%2990099-X&partnerID=40&md5=391277de0810613ece3316f8159fe5cf",Article,Scopus,2-s2.0-0027959124
"Smith, P.D., Moss, S.E.","Structural evolution of the annexin supergene family",1994,"Trends in Genetics","10","7",,"241","246",,49,10.1016/0168-9525(94)90171-6,"https://www.scopus.com/inward/record.uri?eid=2-s2.0-0028342872&doi=10.1016%2f0168-9525%2894%2990171-6&partnerID=40&md5=b177afd3ab61240f09a8aebb8ca109cf",Review,Scopus,2-s2.0-0028342872
"Smith, P.D., Davies, A., Crumpton, M.J., Moss, S.E.","Structure of the human annexin VI gene",1994,"Proceedings of the National Academy of Sciences of the United States of America","91","7",,"2713","2717",,36,,"https://www.scopus.com/inward/record.uri?eid=2-s2.0-0028213897&partnerID=40&md5=58ff7809687e5c3dd264b4ed3095898a",Article,Scopus,2-s2.0-0028213897
"Smythe, E., Smith, P.D., Jacob, S.M., Theobald, J., Moss, S.E.","Endocytosis occurs independently of annexin VI in human A431 cells",1994,"Journal of Cell Biology","124","3",,"301","306",,52,,"https://www.scopus.com/inward/record.uri?eid=2-s2.0-0028087187&partnerID=40&md5=8896c6b9f991c7272a060e53eaa5c049",Article,Scopus,2-s2.0-0028087187
"Smith, P.D., Moss, S.E.","Z-DNA-forming sequences at a putative duplication site in the human annexin VI-encoding gene",1994,"Gene","138","1-2",,"239","242",,11,10.1016/0378-1119(94)90815-X,"https://www.scopus.com/inward/record.uri?eid=2-s2.0-0028351442&doi=10.1016%2f0378-1119%2894%2990815-X&partnerID=40&md5=1b443751f2ca0cfc8659bb09489a4b02",Article,Scopus,2-s2.0-0028351442
"Smith, P.D., Moss, S.E.","Structural evolution of the annexin supergene family",1994,"Trends in Genetics","10","7",,"246","",,11,10.1016/0168-9525(94)90171-6,"https://www.scopus.com/inward/record.uri?eid=2-s2.0-43949149638&doi=10.1016%2f0168-9525%2894%2990171-6&partnerID=40&md5=43f37ca16b23fa405e2e9a566898ee9c",Review,Scopus,2-s2.0-43949149638
"BUTLER, C.M., SMITH, P.D.C.","Microcirculatory Aspects of Venous Ulceration",1994,"The Journal of Dermatologic Surgery and Oncology","20","7",,"474","480",,17,10.1111/j.1524-4725.1994.tb03220.x,"https://www.scopus.com/inward/record.uri?eid=2-s2.0-0027972902&doi=10.1111%2fj.1524-4725.1994.tb03220.x&partnerID=40&md5=79663c288a5da3f1f8cbd043c81f3216",Article,Scopus,2-s2.0-0027972902
"Sarin, S., Scurr, J.H., Smith, P.D.C.","Stripping of the long saphenous vein in the treatment of primary varicose veins",1994,"British Journal of Surgery","81","10",,"1455","1458",,137,10.1002/bjs.1800811017,"https://www.scopus.com/inward/record.uri?eid=2-s2.0-0027932654&doi=10.1002%2fbjs.1800811017&partnerID=40&md5=deb43550565064750bcc355c07340da3",Article,Scopus,2-s2.0-0027932654
"Andaz, S., Shields, D.A., Scurr, J.H., Smith, P.D.C.","Role of Low Molecular Weight Heparins in the Prevention and Treatment of Venous Thromboembolism after Surgery",1994,"Phlebology","9","1",,"2","7",,4,10.1177/026835559400900102,"https://www.scopus.com/inward/record.uri?eid=2-s2.0-0028213492&doi=10.1177%2f026835559400900102&partnerID=40&md5=26837a08c502263a12485a7615da92cd",Review,Scopus,2-s2.0-0028213492
"Shields, D.A., Andaz, S.K., Sarin, S., Scurr, J.H., Smith, P.D.C.","Plasma elastase in venous disease",1994,"British Journal of Surgery","81","10",,"1496","1499",,53,10.1002/bjs.1800811033,"https://www.scopus.com/inward/record.uri?eid=2-s2.0-0027993854&doi=10.1002%2fbjs.1800811033&partnerID=40&md5=79689c4b2e62f587a7a038fd367c55ed",Article,Scopus,2-s2.0-0027993854
"Sarin, S., Sommerville, K., Farrah, J., Scurr, J.H., Smith, P.D.C.","Duplex ultrasonography for assessment of venous valvular function of the lower limb",1994,"British Journal of Surgery","81","11",,"1591","1595",,74,10.1002/bjs.1800811108,"https://www.scopus.com/inward/record.uri?eid=2-s2.0-0028092104&doi=10.1002%2fbjs.1800811108&partnerID=40&md5=e53aed2ad2aa81a1ea4b60ad2c787e9d",Article,Scopus,2-s2.0-0028092104
"Shields, D.A., Andaz, S., Abeysinghe, R.D., Porter, J.B., Scurr, J.H., Smith, P.D.C.","Neutrophil Activation in Experimental Venous Hypertension",1994,"Phlebology","9","3",,"119","124",,18,10.1177/026835559400900307,"https://www.scopus.com/inward/record.uri?eid=2-s2.0-0027982071&doi=10.1177%2f026835559400900307&partnerID=40&md5=b6c34b87ac3cbf9178a03d588319f80b",Article,Scopus,2-s2.0-0027982071
"Tochner, Z.A., Pass, H.I., Smith, P.D., Delaney, T.F., Sprague, M., Deluca, A.M., Harrington, F., Thomas, G.F., Terrill, R., Bacher, J.D., Russo, A.","Intrathoracic photodynamic therapy: A canine normal tissue tolerance study and early clinical experience",1994,"Lasers in Surgery and Medicine","14","2",,"118","123",,18,10.1002/1096-9101(1994)14:2&lt;118::AID-LSM1900140204&gt;3.0.CO;2-5,"https://www.scopus.com/inward/record.uri?eid=2-s2.0-0028299646&doi=10.1002%2f1096-9101%281994%2914%3a2%26lt%3b118%3a%3aAID-LSM1900140204%26gt%3b3.0.CO%3b2-5&partnerID=40&md5=03ac106c147d2278563d016691a2adf9",Article,Scopus,2-s2.0-0028299646
"Bourg, J., Krishna, M.C., Mitchell, J.B., Tschudin, R.G., Pohida, T.J., Friauf, W.S., Smith, P.D., Metcalfe, J., Harrington, F., Subramanian, S.","Radiofrequency FT EPR Spectroscopy and Imaging",1993,"Journal of Magnetic Resonance, Series B","102","1",,"112","115",,39,10.1006/jmrb.1993.1071,"https://www.scopus.com/inward/record.uri?eid=2-s2.0-0000422520&doi=10.1006%2fjmrb.1993.1071&partnerID=40&md5=cbb6e86062212c4b9ba8dcde44b0e89b",Editorial,Scopus,2-s2.0-0000422520
"Hall, C., Sin, W.C., Teo, M., Michael, G.J., Smith, P., Dong, J.M., Lim, H.H., Manser, E., Spurr, N.K., Jones, T.A., Lim, L.","α2-Chimerin, an SH2-Containing GTPase-Activating Protein for the ras-Related Protein p21rac Derived by Alternate Splicing of the Human n-Chimerin Gene, Is Selectively Expressed in Brain Regions and Testes",1993,"Molecular and Cellular Biology","13","8",,"4986","4998",,73,,"https://www.scopus.com/inward/record.uri?eid=2-s2.0-0027282112&partnerID=40&md5=c3669680bdfccf54eb8b17b26660e630",Article,Scopus,2-s2.0-0027282112
"Delaney, T.F., Sindelar, W.F., Tochner, Z., Smith, P.D., Friauf, W.S., Thomas, G., Dachowski, L., Cole, J.W., Steinberg, S.M., Glatstein, E.","Phase I study of debulking surgery and photodynamic therapy for disseminated intraperitoneal tumors",1993,"International Journal of Radiation Oncology, Biology, Physics","25","3",,"445","457",,109,10.1016/0360-3016(93)90066-5,"https://www.scopus.com/inward/record.uri?eid=2-s2.0-0027403457&doi=10.1016%2f0360-3016%2893%2990066-5&partnerID=40&md5=c1d258c3587ecaffce2da87fc89c9ca8",Article,Scopus,2-s2.0-0027403457
"Smith, P.D.C.","Venous Valves and the Treatment of Varicose Veins",1993,"Phlebology","8","4",,"141","",,1,10.1177/026835559300800401,"https://www.scopus.com/inward/record.uri?eid=2-s2.0-0027724737&doi=10.1177%2f026835559300800401&partnerID=40&md5=f3e3240e53ed8d967846cb536d9ff83a",Editorial,Scopus,2-s2.0-0027724737
"Smith, P.D.C.","Pathogenesis of chronic venous insufficiency and possible effects of compression and pentoxifylline",1993,"Yale Journal of Biology and Medicine","66","1",,"47","59",,18,,"https://www.scopus.com/inward/record.uri?eid=2-s2.0-0027433599&partnerID=40&md5=699845f864b31b5b25721febe3007c0f",Conference Paper,Scopus,2-s2.0-0027433599
"Richardson, G., Smith, P.","The inter-rater reliability of the Gudjonsson Suggestibility Scale",1993,"Personality and Individual Differences","14","1",,"251","253",,11,10.1016/0191-8869(93)90197-B,"https://www.scopus.com/inward/record.uri?eid=2-s2.0-38249006365&doi=10.1016%2f0191-8869%2893%2990197-B&partnerID=40&md5=8fd347000abff0a31956625d32fc51ad",Article,Scopus,2-s2.0-38249006365
"Abu-Own, A., Scurr, J.H., Smith, P.D.C.","Assessment of Intermittent Pneumatic Compression by Strain-Gauge Plethysmography",1993,"Phlebology","8","2",,"68","71",,4,10.1177/026835559300800206,"https://www.scopus.com/inward/record.uri?eid=2-s2.0-0027202185&doi=10.1177%2f026835559300800206&partnerID=40&md5=b6bc28cdd64a0c0d60881084da9cbbd4",Article,Scopus,2-s2.0-0027202185
"Wilkinson, L.S., Bunker, C., Edwards, J.C.W., Scurr, J.H., Smith, P.D.C.","Leukocytes: Their role in the etiopathogenesis of skin damage in venous disease",1993,"Journal of Vascular Surgery","17","4",,"669","675",,114,10.1016/0741-5214(93)90109-Y,"https://www.scopus.com/inward/record.uri?eid=2-s2.0-0027154924&doi=10.1016%2f0741-5214%2893%2990109-Y&partnerID=40&md5=69704b2a9e79536e27d3f6d4bb0a4f3a",Article,Scopus,2-s2.0-0027154924
"Pogrebniak, H.W., Matthews, W., Black, C., Russo, A., Mitchell, J.B., Smith, P., Roth, J.A., Pass, H.I.","Targetted phototherapy with sensitizer-monoclonal antibody conjugate and light",1993,"Surgical Oncology","2","1",,"31","42",,16,10.1016/0960-7404(93)90042-W,"https://www.scopus.com/inward/record.uri?eid=2-s2.0-0027502848&doi=10.1016%2f0960-7404%2893%2990042-W&partnerID=40&md5=2b4ef6ffd4abd8c1d13bafcf61fbda9d",Article,Scopus,2-s2.0-0027502848
"Pass, Harvey I., DeLaney, Thomas F., Russo, Angelo, Mitchell, James, Smith, Paul D., Friauf, Walter, Thomas, Gunther F.","Feasibility of intrapleural photodynamic therapy: the first eight patients (Invited Paper)",1992,"Proceedings of SPIE - The International Society for Optical Engineering","1645",,,"2","9",,5,,"https://www.scopus.com/inward/record.uri?eid=2-s2.0-0027040184&partnerID=40&md5=23bb2e110ab9e079c6b9504d59a64712",Conference Paper,Scopus,2-s2.0-0027040184
"Blankenhorn, E.P., Smith, P.D., Williams, C.B., Gutman, G.A.","Alleles of the rat T-cell receptor β chain gene complex",1992,"Immunogenetics","35","5",,"324","331",,10,10.1007/BF00189895,"https://www.scopus.com/inward/record.uri?eid=2-s2.0-0026530369&doi=10.1007%2fBF00189895&partnerID=40&md5=c76e4a157a4985cc334d1f35bec18b56",Article,Scopus,2-s2.0-0026530369
"Smith, N.A., Smith, P.","Nitrate reduction and N‐nitrosation by Obesumbacterium proteus",1992,"Letters in Applied Microbiology","14","2",,"61","64",,7,10.1111/j.1472-765X.1992.tb00648.x,"https://www.scopus.com/inward/record.uri?eid=2-s2.0-0026500433&doi=10.1111%2fj.1472-765X.1992.tb00648.x&partnerID=40&md5=8a3b74feea23e4660a72da6eca15bc1f",Article,Scopus,2-s2.0-0026500433
"McMullin, G.M., Smith, P.D.C.","AN EVALUATION OF DOPPLER ULTRASOUND AND PHOTOPLETHYSMOGRAPHY IN THE INVESTIGATION OF VENOUS INSUFFICIENCY",1992,"Australian and New Zealand Journal of Surgery","62","4",,"270","275",,39,10.1111/j.1445-2197.1992.tb07554.x,"https://www.scopus.com/inward/record.uri?eid=2-s2.0-0026511705&doi=10.1111%2fj.1445-2197.1992.tb07554.x&partnerID=40&md5=fb5f03c8fecdc2f9fab32877988dc812",Article,Scopus,2-s2.0-0026511705
"Sarin, S., Scurr, J.H., Smith, P.D.C.","Mechanism of action of external compression on venous function",1992,"British Journal of Surgery","79","6",,"499","502",,54,10.1002/bjs.1800790608,"https://www.scopus.com/inward/record.uri?eid=2-s2.0-0026503215&doi=10.1002%2fbjs.1800790608&partnerID=40&md5=21dec9157a241e405ad57230170b9183",Article,Scopus,2-s2.0-0026503215
"Sarin, S., Scurr, J.H., Smith, P.D.C.","Assessment of stripping the long saphenous vein in the treatment of primary varicose veins",1992,"British Journal of Surgery","79","9",,"889","893",,154,10.1002/bjs.1800790911,"https://www.scopus.com/inward/record.uri?eid=2-s2.0-0026759820&doi=10.1002%2fbjs.1800790911&partnerID=40&md5=1c46a6d6622ec49cdcb1e36127c6a353",Article,Scopus,2-s2.0-0026759820
"Sarin, S., Shields, D.A., Abu-Own, A., Scurr, J.H., Smith, P.D.C.","Is the Normal Limb Normal in Unilateral Varicose Veins?",1992,"Phlebology","7","2",,"75","77",,2,10.1177/026835559200700208,"https://www.scopus.com/inward/record.uri?eid=2-s2.0-0026734690&doi=10.1177%2f026835559200700208&partnerID=40&md5=8b4f03de664e897b3301cb554f7d3634",Article,Scopus,2-s2.0-0026734690
"Cloude, Shane R., Smith, P.D., Milne, A., Parkes, David M., Trafford, Keith","Analysis of time-domain ultrawideband radar signals",1992,"Proceedings of SPIE - The International Society for Optical Engineering","1631",,,"111","122",,,,"https://www.scopus.com/inward/record.uri?eid=2-s2.0-0026491482&partnerID=40&md5=67a443f4d61c1532bbdba20c50aa179d",Conference Paper,Scopus,2-s2.0-0026491482
"Lawrence, J.B., Prevosti, L.G., Kramer, W.S., Smith, P.D., Bonner, R.F., Lu, D.Y., Leon, M.B.","Pulsed laser and thermal ablation of atherosclerotic plaque: Morphometrically defined surface thrombogenicity in studies using an annular perfusion chamber",1992,"Journal of the American College of Cardiology","19","5",,"1091","1100",,14,10.1016/0735-1097(92)90301-3,"https://www.scopus.com/inward/record.uri?eid=2-s2.0-0026521751&doi=10.1016%2f0735-1097%2892%2990301-3&partnerID=40&md5=99c6f1314f7c1996470bc236af8ee452",Article,Scopus,2-s2.0-0026521751
"Sarin, S., Cheatle, T.R., Smith, P.D., Scurr, J.H.","Disease mechanisms in venous ulceration.",1991,"British journal of hospital medicine","45","5",,"303","305",,15,,"https://www.scopus.com/inward/record.uri?eid=2-s2.0-0026164594&partnerID=40&md5=bef099a1771e7cc10f2079736d750ae9",Review,Scopus,2-s2.0-0026164594
"Mcmullin, G.M., Watkin, G.T., Smith, P.D.C., Scurr, J.H.","The Efficacy of Fibrinolytic Enhancement with Stanozolol in the Treatment of Venous Insufficiency",1991,"Phlebology","6","4",,"233","239",,6,10.1177/026835559100600406,"https://www.scopus.com/inward/record.uri?eid=2-s2.0-0026346222&doi=10.1177%2f026835559100600406&partnerID=40&md5=21fa9d4dac61ce289dc2bd56a6b93194",Article,Scopus,2-s2.0-0026346222
"Gourdie, R.G., Smith, P., Severs, N.J., Green, C.R.","Quantitative stereology of human intercalated disks labelled with antibody against cardiac gap junction protein",1991,"Scanning","13","SUPPL. 1",,"I104","I105",,,,"https://www.scopus.com/inward/record.uri?eid=2-s2.0-0025764874&partnerID=40&md5=89f36fcb8402c14b545e80c89f76587d",Conference Paper,Scopus,2-s2.0-0025764874
"PERRY, R.R., SMITH, P.D., EVANS, S., PASS, H.I.","INTRAVENOUS vs INTRAPERITONEAL SENSITIZER: IMPLICATIONS FOR INTRAPERITONEAL PHOTODYNAMIC THERAPY",1991,"Photochemistry and Photobiology","53","3",,"335","340",,14,10.1111/j.1751-1097.1991.tb03637.x,"https://www.scopus.com/inward/record.uri?eid=2-s2.0-0026133609&doi=10.1111%2fj.1751-1097.1991.tb03637.x&partnerID=40&md5=3e537968736bde3f3bf8aab3b6d6205a",Article,Scopus,2-s2.0-0026133609
"Blankenhorn, E.P., Stranford, S.A., Smith, P.D., Hickey, W.F.","Genetic differences in the T cell receptor alleles of LEW rats and their encephalomyelitis‐resistant derivative, LER, and their impact on the inheritance of EAE resistance",1991,"European Journal of Immunology","21","9",,"2033","2041",,31,10.1002/eji.1830210910,"https://www.scopus.com/inward/record.uri?eid=2-s2.0-0025896259&doi=10.1002%2feji.1830210910&partnerID=40&md5=e735e8ecc3b9b2bbed20bffa3b640bac",Article,Scopus,2-s2.0-0025896259
"Hearn, M., Smith, P.D.C., Scurr, J.H.","Venous stasis and vein lumen changes during surgery",1991,"British Journal of Surgery","78","4",,"505","505",,,10.1002/bjs.1800780442,"https://www.scopus.com/inward/record.uri?eid=2-s2.0-0025893942&doi=10.1002%2fbjs.1800780442&partnerID=40&md5=cf3edb537d6ebee597131f1e760d9762",Letter,Scopus,2-s2.0-0025893942
"McMullin, G.M., Watkin, G.T., Smith, P.D.C., Scurr, J.H.","EFFICACY OF FIBRINOLYTlC ENHANCEMENT WITH STANOZOLOL IN THE TREATMENT OF VENOUS INSUFFICIENCY",1991,"Australian and New Zealand Journal of Surgery","61","4",,"306","309",,27,10.1111/j.1445-2197.1991.tb00217.x,"https://www.scopus.com/inward/record.uri?eid=2-s2.0-0025976042&doi=10.1111%2fj.1445-2197.1991.tb00217.x&partnerID=40&md5=d5738e0714186d61fde029d53d4e1840",Article,Scopus,2-s2.0-0025976042
"Cheatle, T.R., Scott, H.J., Scurr, J.H., Smith, P.","White cells, skin blood flow and venous ulcers",1991,"British Journal of Dermatology","125","3",,"288","290",,11,10.1111/j.1365-2133.1991.tb14756.x,"https://www.scopus.com/inward/record.uri?eid=2-s2.0-0026006004&doi=10.1111%2fj.1365-2133.1991.tb14756.x&partnerID=40&md5=2697e3006180044c3cdf06c727315529",Article,Scopus,2-s2.0-0026006004
"Mcmullin, G.M., Smith, P.D.C., Scurr, J.H.","Which Way Does Blood Flow in the Perforating Veins of the Leg?",1991,"Phlebology","6","2",,"127","132",,12,10.1177/026835559100600211,"https://www.scopus.com/inward/record.uri?eid=2-s2.0-0025815024&doi=10.1177%2f026835559100600211&partnerID=40&md5=e0fbd1986092512d3686e8722c533e8f",Article,Scopus,2-s2.0-0025815024
"Mcmullin, G.M., Smith, P.D.C., Scurr, J.H.","A Study of Tourniquets in the Investigation of Venous Insufficiency",1991,"Phlebology","6","2",,"133","139",,20,10.1177/026835559100600212,"https://www.scopus.com/inward/record.uri?eid=2-s2.0-0025768264&doi=10.1177%2f026835559100600212&partnerID=40&md5=9885bc3471345c1738640e66a11ff430",Article,Scopus,2-s2.0-0025768264
"McMullin, G.M., Smith, P.D.C., Scurr, J.H.","Objective assessment of high ligation without stripping the long saphenous vein",1991,"British Journal of Surgery","78","9",,"1139","1142",,91,10.1002/bjs.1800780934,"https://www.scopus.com/inward/record.uri?eid=2-s2.0-0025864226&doi=10.1002%2fbjs.1800780934&partnerID=40&md5=6a7528ea08631ae384edf68c7af2ef13",Article,Scopus,2-s2.0-0025864226
"Cheatle, T.R., Stibe, E.C.L., Shami, S.K., Scurr, J.H., Smith, P.D.C.","Vasodilatory capacity of the skin in venous disease and its relationship to transcutaneous oxygen tension",1991,"British Journal of Surgery","78","5",,"607","610",,26,10.1002/bjs.1800780527,"https://www.scopus.com/inward/record.uri?eid=2-s2.0-0025852614&doi=10.1002%2fbjs.1800780527&partnerID=40&md5=7f82ca76369c50a9abfcb82444bb8633",Review,Scopus,2-s2.0-0025852614
"Pass, H.I., Evans, S., Matthews, W.A., Perry, R., Venzon, D., Roth, J.A., Smith, P.","Photodynamic therapy of oncogene-transformed cells",1991,"Journal of Thoracic and Cardiovascular Surgery","101","5",,"795","799",,8,,"https://www.scopus.com/inward/record.uri?eid=2-s2.0-0025875947&partnerID=40&md5=6bd68e4159db342c0185e8cd6613a5ae",Article,Scopus,2-s2.0-0025875947
