Authors,Title,Year,Source title,Volume,Issue,Art. No.,Page start,Page end,Page count,Cited by,DOI,Link,Document Type,Source,EID
"Bertoni, F., Conconi, A., Capella, C., Motta, T., Giardini, R., Ponzoni, M., Pedrinis, E., Novero, D., Rinaldi, P., Cazzaniga, G., Biondi, A., Wotherspoon, A., Hancock, B.W., Smith, P., Souhami, R., Cotter, F.E., Cavalli, F., Zucca, E.","Molecular follow-up in gastric mucosa-associated lymphoid tissue lymphomas: Early analysis of the LY03 cooperative trial",2002,"Blood","99","7",,"2541","2544",,87,10.1182/blood.V99.7.2541,"https://www.scopus.com/inward/record.uri?eid=2-s2.0-0036530051&doi=10.1182%2fblood.V99.7.2541&partnerID=40&md5=c10254b36a72af44e5214e5c1a520880",Article,Scopus,2-s2.0-0036530051
"Phillips, T.M., Smith, P.D.","Immunoaffinity analysis of substance P in complex biological fluids: Analysis of sub-microliter samples",2002,"Journal of Liquid Chromatography and Related Technologies","25","19",,"2889","2900",,10,10.1081/JLC-120015881,"https://www.scopus.com/inward/record.uri?eid=2-s2.0-0036449575&doi=10.1081%2fJLC-120015881&partnerID=40&md5=d68ea5ca666d31fe96e9f80c6ef476da",Article,Scopus,2-s2.0-0036449575
"Smith, P.D., Kucic, M., Hasler, P.","Accurate programming of analog floating-gate arrays",2002,"Proceedings - IEEE International Symposium on Circuits and Systems","5",,,"V/489","V/492",,35,,"https://www.scopus.com/inward/record.uri?eid=2-s2.0-0036291193&partnerID=40&md5=338c91c9085d47a368682fdd5f92a853",Conference Paper,Scopus,2-s2.0-0036291193
"Smith, P., Simpson, S., Hutchison, D.","Programmable resource discovery using peer-to-peer networks",2002,"Lecture Notes in Computer Science (including subseries Lecture Notes in Artificial Intelligence and Lecture Notes in Bioinformatics)","2546",,,"229","240",,,,"https://www.scopus.com/inward/record.uri?eid=2-s2.0-84957809658&partnerID=40&md5=5d460f68531b63bf583bad19740332da",Conference Paper,Scopus,2-s2.0-84957809658
"Hasler, P., Bandyopadhyay, A., Smith, P.","A matrix transform imager allowing high-fill factor",2002,"Proceedings - IEEE International Symposium on Circuits and Systems","3",,,"III/337","III/340",,9,,"https://www.scopus.com/inward/record.uri?eid=2-s2.0-0036290549&partnerID=40&md5=a5533a9f2149cd9b5f14fdb713b6cdd9",Conference Paper,Scopus,2-s2.0-0036290549
"Smith, P.D., Kucic, M., Ellis, R., Hasler, P., Anderson, D.V.","Mel-frequency cepstrum encoding in analog floating-gate circuitry",2002,"Proceedings - IEEE International Symposium on Circuits and Systems","4",,,"IV/671","IV/674",,23,,"https://www.scopus.com/inward/record.uri?eid=2-s2.0-0036287551&partnerID=40&md5=67bf48e212b13ccd6af104d6dcdb0f8e",Conference Paper,Scopus,2-s2.0-0036287551
"Hattery, D., Gerdelman, K., Hekmat, F., Chernomordik, V., Smith, P., Eidsath, A., Pursley, R., Atkinson, J., Mulshine, J., Gandjbakhche, A.","Diffuse reflectance spectroscopy to quantify inflammation of the oral epithelium in vivo",2002,"Proceedings of SPIE - The International Society for Optical Engineering","4613",,,"59","70",,1,10.1117/12.465230,"https://www.scopus.com/inward/record.uri?eid=2-s2.0-18544376882&doi=10.1117%2f12.465230&partnerID=40&md5=68eb1252843f31e8a8c685b324757631",Article,Scopus,2-s2.0-18544376882
"Kuhn, M.A., Smith, P.D., Wachtel, T.L., Wright, T.E., Rogazewski, A., Nguyen, K., Robson, M.C., Franz, M.G.","Abdominal wall repair is delayed during hepatic regeneration",2001,"Journal of Surgical Research","95","1",,"54","60",,13,10.1006/jsre.2000.6038,"https://www.scopus.com/inward/record.uri?eid=2-s2.0-0035746445&doi=10.1006%2fjsre.2000.6038&partnerID=40&md5=3767868328cfce103429b746b7ea541a",Conference Paper,Scopus,2-s2.0-0035746445
"Roberts, C., Tabakov, S., Lewis, C., Smith, D., Litchev, A., Jonsson, B.-A., Ljungberg, M., Strand, S.-E., Lamm, I.-L., Jonsson, L., Milano, F., Riccardi, L., Benini, A., Da Silva, G., Teixeira, N., Pascoal, A., Noel, A., Smith, P., Musilek, L., Sheahan, N.","Emerald structured training in medical radiation physics",2001,"Studies in Health Technology and Informatics","82",,,"38","44",,,10.3233/978-1-60750-926-4-i,"https://www.scopus.com/inward/record.uri?eid=2-s2.0-84887116519&doi=10.3233%2f978-1-60750-926-4-i&partnerID=40&md5=3874d9b7f5b17dc3f5e0588ba6642d02",Article,Scopus,2-s2.0-84887116519
"Wong, C.S., Garrison, A.W., Smith, P.D., Foreman, W.T.","Enantiomeric composition of chiral polychlorinated biphenyl atropisomers in aquatic and riparian biota",2001,"Environmental Science and Technology","35","12",,"2448","2454",,54,10.1021/es0018872,"https://www.scopus.com/inward/record.uri?eid=2-s2.0-0035874788&doi=10.1021%2fes0018872&partnerID=40&md5=a9c067d88aa48affbf1e78ac1c0c971d",Article,Scopus,2-s2.0-0035874788
"Hancock, B.W., Gregory, W.M., Cullen, M.H., Hudson, G.V., Burton, A., Selby, P., Maclennan, K.A., Jack, A., Bessell, E.M., Smith, P., Linch, D.C.","ChIVPP alternating with PABIOE is superior to PABIOE alone in the initial treatment of advanced hodgkin's disease: Results of a british national lymphoma investigation/central lymphoma group randomized controlled trial",2001,"British Journal of Cancer","84","10",,"1293","1300",,19,10.1054/bjoc.2001.1778,"https://www.scopus.com/inward/record.uri?eid=2-s2.0-17844380761&doi=10.1054%2fbjoc.2001.1778&partnerID=40&md5=8f9233295b66822c4013612859bfe8cc",Article,Scopus,2-s2.0-17844380761
"Mainwaring, P.N., Cunningham, D., Gregory, W., Hoskin, P., Hancock, B., Norton, A.J., MacLennan, K., Smith, P., Hudson, G.V., Linch, D.","Mitoxantrone is superior to doxorubicin in a multiagent weekly regimen for patients older than 60 with high-grade lymphoma: Results of a BNLI randomized trial of PAdriaCEBO versus PMitCEBO",2001,"Blood","97","10",,"2991","2997",,31,10.1182/blood.V97.10.2991,"https://www.scopus.com/inward/record.uri?eid=2-s2.0-0035874527&doi=10.1182%2fblood.V97.10.2991&partnerID=40&md5=ac4a1cb4b0ee12fdfb379704ac0efa60",Article,Scopus,2-s2.0-0035874527
"Vande Berg, J.S., Smith, P.D., Haywood-Reid, P.L., Munson, A.B., Soules, K.A., Robson, M.C.","Dynamic forces in the cell cycle affecting fibroblasts in pressure ulcers",2001,"Wound Repair and Regeneration","9","1",,"19","27",,10,10.1046/j.1524-475X.2001.00019.x,"https://www.scopus.com/inward/record.uri?eid=2-s2.0-0035069953&doi=10.1046%2fj.1524-475X.2001.00019.x&partnerID=40&md5=709a06d757235e8a84f75d9785393f84",Article,Scopus,2-s2.0-0035069953
"Franz, M.G., Smith, P.D., Wachtel, T.L., Wright, T.E., Kuhn, M.A., Ko, F., Robson, M.C.","Fascial incisions heal faster than skin: A new model of abdominal wall repair",2001,"Surgery","129","2",,"203","208",,33,10.1067/msy.2001.110220,"https://www.scopus.com/inward/record.uri?eid=2-s2.0-0035135743&doi=10.1067%2fmsy.2001.110220&partnerID=40&md5=46af6df27c8d9b107b4da27357201ba0",Article,Scopus,2-s2.0-0035135743
"Smith, P., Morton, G.","New labour's reform of Britain's employment law: The devil is not only in the detail but in the values and policy too",2001,"British Journal of Industrial Relations","39","1",,"119","138",,68,,"https://www.scopus.com/inward/record.uri?eid=2-s2.0-0035530766&partnerID=40&md5=b5001819d90b3c93e75f6425cc143e33",Article,Scopus,2-s2.0-0035530766
"Scurr, J.H., Smith, P.D.C., Machin, S.","Deep Vein Thrombosis in Airline Passengers — The Incidence of Deep Vein Thrombosis and the Efficacy of Elastic Compression Stockings",2001,"Vascular","9","2",,"159","161",,9,10.1177/096721090100900213,"https://www.scopus.com/inward/record.uri?eid=2-s2.0-0035092960&doi=10.1177%2f096721090100900213&partnerID=40&md5=fa4ec4c65fff44a83a6ca7821c2ed2d6",Article,Scopus,2-s2.0-0035092960
"Simpson, S., Banfield, M., Smith, P., Hutchison, D.","Component selection for heterogeneous active networking",2001,"Lecture Notes in Computer Science (including subseries Lecture Notes in Artificial Intelligence and Lecture Notes in Bioinformatics)","2207",,,"84","100",,3,,"https://www.scopus.com/inward/record.uri?eid=2-s2.0-84943223644&partnerID=40&md5=fc1bb37133146003ef23abe676fdc650",Article,Scopus,2-s2.0-84943223644
"Kuhn, M.A., Moffit, M.R., Smith, P.D., Lyle, W.G., Ko, F., Meltzer, D.D., Robson, M.C.","Silicone sheeting decreases fibroblast activity and downregulates TGFbeta2 in hypertrophic scar model.",2001,"International journal of surgical investigation","2","6",,"467","474",,22,,"https://www.scopus.com/inward/record.uri?eid=2-s2.0-0037809171&partnerID=40&md5=6a96a8b25a95b65d79903ca0e2f634c6",Article,Scopus,2-s2.0-0037809171
"Kuhn, M.A., Payne, W.G., Kierney, P.C., Pu, L.L., Smith, P.D., Siegler, K., Ko, F., Wang, X., Robson, M.C.","Cytokine manipulation of explanted Dupuytren's affected human palmar fascia.",2001,"International journal of surgical investigation","2","6",,"443","456",,12,,"https://www.scopus.com/inward/record.uri?eid=2-s2.0-0010071922&partnerID=40&md5=571241ba30bf550e900913ccbfda1830",Article,Scopus,2-s2.0-0010071922
"Roberts, C., Tabakov, S., Lewis, C., Bowring, S., Smith, D., Evans, D., Litchev, A., Jonsson, B.-A., Ljungberg, M., Strand, S.-E., Lamm, I.-L., Jonsson, L., Milano, F., Riccardi, L., Benini, A., Da Silva, G., Teixeira, N., Pascoal, A., Ferreira, P., Noel, A., Smith, P., Musilek, L., Sheahan, N., Blake, P.J., Young, J., Folkesson, M., Peterson, U.","EMERALD training in medical radiation physics",2001,"Physica Medica","17","SUPPL. 4",,"69","73",,1,,"https://www.scopus.com/inward/record.uri?eid=2-s2.0-18344365185&partnerID=40&md5=9f13f3bc178a9197fd3dde85a299c172",Conference Paper,Scopus,2-s2.0-18344365185
"Oughstun, Kurt E., Smith, Paul D.","On the accuracy of asymptotic approximations in ultrawideband signal, ultrashort-pulse, time-domain electromagnetics",2000,"IEEE Antennas and Propagation Society, AP-S International Symposium (Digest)","2",,,"685","688",,4,,"https://www.scopus.com/inward/record.uri?eid=2-s2.0-0034540632&partnerID=40&md5=b177dd946b9ccec85f012c83e8d4670c",Conference Paper,Scopus,2-s2.0-0034540632
"Sweetenham, J., Smith, P., MacMillan, A., Cunningham, D., Hoskin, P., Horwich, A., Linch, D.","Stanford V (SV) versus ABVD for adult patients with advanced hodgkin's disease (HD): Preliminary results of a randomized phase II trial from the BNLI",2000,"Blood","96","11 PART II",,"","",,,,"https://www.scopus.com/inward/record.uri?eid=2-s2.0-33748535072&partnerID=40&md5=ed2a1accd0f9dbfa7c2a660de221b7cd",Article,Scopus,2-s2.0-33748535072
"Pu, L.L.Q., Smith, P.D., Payne, W.G., Kuhn, M.A., Wang, X., Ko, F., Robson, M.C.","Overexpression of transforming growth factor beta-2 and its receptor in rhinophyma: An alternative mechanism of pathobiology",2000,"Annals of Plastic Surgery","45","5",,"515","519",,19,,"https://www.scopus.com/inward/record.uri?eid=2-s2.0-0033736385&partnerID=40&md5=af86107a1e03f8f855bee9a99e0b903b",Article,Scopus,2-s2.0-0033736385
"Ann Kuhn, M., Smith, P.D., Hill, D.P., Ko, F., Meltzer, D.D., Vande Berg, J.S., Robson, M.C.","In vitro fibroblast populated collagen lattices are not good models of in vivo clinical wound healing",2000,"Wound Repair and Regeneration","8","4",,"270","276",,11,10.1046/j.1524-475X.2000.00270.x,"https://www.scopus.com/inward/record.uri?eid=2-s2.0-0033852824&doi=10.1046%2fj.1524-475X.2000.00270.x&partnerID=40&md5=fa6cdd58313be4c5ec5f4ba29f90daa8",Article,Scopus,2-s2.0-0033852824
"Dwore, R.B., Murray, B.P., Fosbinder, D., Parsons, R., Smith, P., Dalley, K., Vorderer, L., Gustafson, G.","Integration of nurse executives into executive level administration in Utah hospitals.",2000,"The health care manager","18","4",,"22","36",,5,,"https://www.scopus.com/inward/record.uri?eid=2-s2.0-0034198475&partnerID=40&md5=3f94e7d32ea9f1766cba58eb557a6a01",Review,Scopus,2-s2.0-0034198475
"Kuhn, A., Singh, S., Smith, P.D., Francis, K., Falcone, R., Lyle, W.G., Maggi, S.P., Wells, K.E., Robson, M.C.","Periprosthetic breast capsules contain the fibrogenic cytokines TGF-β1 and TGF-β2, suggesting possible new treatment approaches",2000,"Annals of Plastic Surgery","44","4",,"387","391",,51,,"https://www.scopus.com/inward/record.uri?eid=2-s2.0-0034035461&partnerID=40&md5=1a87bafc6ee7c1ffd634c0249dfdf951",Article,Scopus,2-s2.0-0034035461
"Robson, M.C., Hill, D.P., Smith, P.D., Wang, X., Meyer-Siegler, K., Ko, F., VandeBerg, J.S., Payne, W.G., Ochs, D., Robson, L.E.","Sequential cytokine therapy for pressure ulcers: Clinical and mechanistic response",2000,"Annals of Surgery","231","4",,"600","611",,85,10.1097/00000658-200004000-00020,"https://www.scopus.com/inward/record.uri?eid=2-s2.0-0034031419&doi=10.1097%2f00000658-200004000-00020&partnerID=40&md5=5a9145d4d16e23cf5bdd57d0aea897d8",Article,Scopus,2-s2.0-0034031419
"Linch, D.C., Smith, P., Hancock, B.W., Hoskin, P.J., Cunningham, D.C., Newland, A.C., Milligan, D., Stevenson, P.A., Wood, J.K., Maclennan, K.A., Vaughan Hudson, B., Vaughan Hudson, G., Gregory, W.M.","A randomised British National Lymphoma Investigation trial of CHOP vs. a weekly multi-agent regimen (PACEBOM) in patients with histologically aggressive non-Hodgkin's lymphoma",2000,"Annals of Oncology","11","SUPPL. 1",,"S87","S90",,27,,"https://www.scopus.com/inward/record.uri?eid=2-s2.0-0033628809&partnerID=40&md5=8837f1f3861170db7a4a48cf24b1af68",Conference Paper,Scopus,2-s2.0-0033628809
"Smith, P.D.C.","New treatments for varicose veins",2000,"Phlebology","15","1",,"1","",,1,10.1007/s005230070030,"https://www.scopus.com/inward/record.uri?eid=2-s2.0-0033798597&doi=10.1007%2fs005230070030&partnerID=40&md5=538c33eab82f90af7b14a04fe80b6474",Editorial,Scopus,2-s2.0-0033798597
"Smith, P.D., Kuhn, M.A., Franz, M.G., Wachtel, T.L., Wright, T.E., Robson, M.C.","Initiating the inflammatory phase of incisional healing prior to tissue injury",2000,"Journal of Surgical Research","92","1",,"11","17",,29,10.1006/jsre.2000.5851,"https://www.scopus.com/inward/record.uri?eid=2-s2.0-0034235192&doi=10.1006%2fjsre.2000.5851&partnerID=40&md5=c84b772e3e61453b5904d93357415e77",Article,Scopus,2-s2.0-0034235192
"Wright, T.E., Hill, D.P., Ko, F., Soler, P.M., Smith, P.D., Franz, M., Nichols, E.H., Robson, M.C.","The effect of TGF-beta2 in various vehicles on incisional wound healing.",2000,"International journal of surgical investigation","2","2",,"133","143",,14,,"https://www.scopus.com/inward/record.uri?eid=2-s2.0-0000288692&partnerID=40&md5=6b2071ed818cf96fb4547ce64b1ccc85",Article,Scopus,2-s2.0-0000288692
"Smith, P.D., Polo, M., Soler, P.M., McClintock, J.S., Maggi, S.P., Kim, Y.J., Ko, F., Robson, M.C.","Efficacy of growth factors in the accelerated closure of interstices in explanted meshed human skin grafts",2000,"Journal of Burn Care and Rehabilitation","21","1",,"5","9",,27,,"https://www.scopus.com/inward/record.uri?eid=2-s2.0-0033984825&partnerID=40&md5=635bdccb6d2f17721b866573bf9f66f9",Article,Scopus,2-s2.0-0033984825
"Smith, P.D.C.","Duplex ultrasonography and the investigation of venous disease",1999,"Phlebology","14","4",,"137","138",,,,"https://www.scopus.com/inward/record.uri?eid=2-s2.0-0033358881&partnerID=40&md5=eed35154cbb5ea44ce7f0e4454509916",Editorial,Scopus,2-s2.0-0033358881
"Smith, P.","Exclusion and Disarticulation: The Transport and General Workers' Union in the Road Haulage Industry, 1979-1998",1999,"British Journal of Industrial Relations","37","4",,"615","636",,2,,"https://www.scopus.com/inward/record.uri?eid=2-s2.0-0033454773&partnerID=40&md5=8f663191dc04d7fd76978919c8a8b789",Article,Scopus,2-s2.0-0033454773
"Wang, X., Smith, P., Pu, L.L.Q., Kim, Y.J., Ko, F., Robson, M.C.","Exogenous transforming growth factor β2 modulates collagen I and collagen III synthesis in proliferative scar xenografts in nude rats",1999,"Journal of Surgical Research","87","2",,"194","200",,69,10.1006/jsre.1999.5757,"https://www.scopus.com/inward/record.uri?eid=2-s2.0-0033406340&doi=10.1006%2fjsre.1999.5757&partnerID=40&md5=d368d4e0b9d7a4fa071241731d1093eb",Article,Scopus,2-s2.0-0033406340
"Robson, M.C., Mannari, R.J., Smith, P.D., Payne, W.G.","Maintenance of wound bacterial balance",1999,"American Journal of Surgery","178","5",,"399","402",,65,10.1016/S0002-9610(99)00208-1,"https://www.scopus.com/inward/record.uri?eid=2-s2.0-0033406669&doi=10.1016%2fS0002-9610%2899%2900208-1&partnerID=40&md5=9d971478a1678056ec55472d6c99f398",Article,Scopus,2-s2.0-0033406669
"Goldstein, S.R., Pohida, T., Smith, P.D., Peterson, J.I., Wellner, E., Malekafzali, A., Suarez-Quian, C.A., Bonner, R.F.","An instrument for performing laser capture microdissection of single cells",1999,"Review of Scientific Instruments","70","11",,"4377","4385",,6,,"https://www.scopus.com/inward/record.uri?eid=2-s2.0-0008001679&partnerID=40&md5=9c682f027d2231221d97bba04a8c9eae",Article,Scopus,2-s2.0-0008001679
"Polo, M., Smith, P.D., Kim, Y.J., Wang, X., Ko, F., Robson, M.C.","Effect of TGF-β2 on proliferative scar fibroblast cell kinetics",1999,"Annals of Plastic Surgery","43","2",,"185","190",,61,,"https://www.scopus.com/inward/record.uri?eid=2-s2.0-0032587390&partnerID=40&md5=722f691125951b85a71531df2622c162",Article,Scopus,2-s2.0-0032587390
"Soler, P.M., Wright, T.E., Smith, P.D., Maggi, S.P., Hill, D.P., Ko, F., Jimenez, P.A., Robson, M.C.","In vivo characterization of keratinocyte growth factor-2 as a potential wound healing agent",1999,"Wound Repair and Regeneration","7","3",,"172","178",,29,10.1046/j.1524-475X.1999.00172.x,"https://www.scopus.com/inward/record.uri?eid=2-s2.0-0032808222&doi=10.1046%2fj.1524-475X.1999.00172.x&partnerID=40&md5=c19c6360b45e03ba8eea27310d6da967",Article,Scopus,2-s2.0-0032808222
"Burke, F., Smith, P.D., Crompton, M.R., Upton, C., Balkwill, F.R.","Cytotoxic response of ovarian cancer cell lines to IFN-γ is associated with sustained induction of IRF-1 and p21 mRNA",1999,"British Journal of Cancer","80","8",,"1236","1244",,37,10.1038/sj.bjc.6690491,"https://www.scopus.com/inward/record.uri?eid=2-s2.0-0032987795&doi=10.1038%2fsj.bjc.6690491&partnerID=40&md5=ead1e2ce016b5e3f4b874c023c5c104a",Article,Scopus,2-s2.0-0032987795
"Robson, M.C., Maggi, S.P., Smith, P.D., Wassermann, R.J., Mosiello, G.C., Hill, D.P., Cooper, D.M.","Ease of wound closure as an endpoint of treatment efficacy",1999,"Wound Repair and Regeneration","7","2",,"90","96",,19,10.1046/j.1524-475X.1999.00090.x,"https://www.scopus.com/inward/record.uri?eid=2-s2.0-0032924323&doi=10.1046%2fj.1524-475X.1999.00090.x&partnerID=40&md5=4ca64da1e32ccc27be3c82412a373134",Article,Scopus,2-s2.0-0032924323
"Maggi, S.P., Soler, P.M., Smith, P.D., Hill, D.P., Ko, F., Robson, M.C.","The efficacy of 5% Sulfamylon® solution for the treatment of contaminated explanted human meshed skin grafts",1999,"Burns","25","3",,"237","241",,15,10.1016/S0305-4179(98)00160-0,"https://www.scopus.com/inward/record.uri?eid=2-s2.0-0032964791&doi=10.1016%2fS0305-4179%2898%2900160-0&partnerID=40&md5=27fa6eeb459ae59d8c49da61e579abd5",Article,Scopus,2-s2.0-0032964791
"Smith, P.D., Crossland, S., Parker, G., Osin, P., Brooks, L., Waller, J., Philp, E., Crompton, M.R., Gusterson, B.A., Allday, M.J., Crook, T.","Novel p53 mutants selected in BRCA-associated tumours which dissociate transformation suppression from other wild-type p53 functions",1999,"Oncogene","18","15",,"2451","2459",,76,10.1038/sj.onc.1202565,"https://www.scopus.com/inward/record.uri?eid=2-s2.0-0033561618&doi=10.1038%2fsj.onc.1202565&partnerID=40&md5=0143bbb8b745ac56b5816adfdfbfc670",Article,Scopus,2-s2.0-0033561618
"Smith, P., Mosiello, G., Deluca, L., Ko, F., Maggi, S., Robson, M.C.","TGF-β2 activates proliferative scar fibroblasts",1999,"Journal of Surgical Research","82","2",,"319","323",,71,10.1006/jsre.1999.5580,"https://www.scopus.com/inward/record.uri?eid=2-s2.0-0032586290&doi=10.1006%2fjsre.1999.5580&partnerID=40&md5=52c4bd1c783e7d4b07cca7a1005803c3",Article,Scopus,2-s2.0-0032586290
"Suarez-Quian, C.A., Goldstein, S.R., Pohida, T., Smith, P.D., Peterson, J.I., Wellner, E., Ghany, M., Bonner, R.F.","Laser capture microdissection of single cells from complex tissues",1999,"BioTechniques","26","2",,"328","335",,95,,"https://www.scopus.com/inward/record.uri?eid=2-s2.0-0033006231&partnerID=40&md5=3b8be57f0896d9f88210c3a63dff0de8",Article,Scopus,2-s2.0-0033006231
"Hasler, Paul, Smith, Paul D.","Autozeroing floating-gate amplifier with gain adaptation",1999,"Proceedings - IEEE International Symposium on Circuits and Systems","2",,,"II","412 - II-415",,4,,"https://www.scopus.com/inward/record.uri?eid=2-s2.0-0032692258&partnerID=40&md5=54a002cde86f97425f17e924e9e7d261",Article,Scopus,2-s2.0-0032692258
"Smith, P.D.C.","European Congress on Microcirculation in Paris: Editorial",1998,"Phlebolymphology",,"21",,"2","",,,,"https://www.scopus.com/inward/record.uri?eid=2-s2.0-0032420995&partnerID=40&md5=814c9f8132038ca7c133f0233e0ee5ea",Editorial,Scopus,2-s2.0-0032420995
"Smith, Paul, Hardman, Vicky","Fine-grained scalable sound representations for collaborative composition and performance",1998,"IEE Colloquium (Digest)","470",,,"","",6,,,"https://www.scopus.com/inward/record.uri?eid=2-s2.0-0032255121&partnerID=40&md5=c2e4a8b74f3ee8d89850b871d61e322b",Conference Paper,Scopus,2-s2.0-0032255121
"Smith, P., Hardman, V.","Fine-grained scalable sound representations for collaborative composition and performance",1998,"IEE Colloquium (Digest)",,"470",,"11/1","11/6",,,,"https://www.scopus.com/inward/record.uri?eid=2-s2.0-2742524488&partnerID=40&md5=f6b03da5d3495e92863a111ca199d846",Article,Scopus,2-s2.0-2742524488
"Mosiello, G., Maggi, S.P., Smith, P., Robson, M.C.","The treatment of nonburn hypertrophyic scars using a custom fitted facemask",1998,"European Journal of Plastic Surgery","21","8",,"402","404",,,10.1007/s002380050127,"https://www.scopus.com/inward/record.uri?eid=2-s2.0-0031795699&doi=10.1007%2fs002380050127&partnerID=40&md5=ae9de2b4d76fe0d03c920a2709748d79",Article,Scopus,2-s2.0-0031795699
"Smith, P.D., Stadelmann, W.K., Wassermann, R.J., Kearney, R.E.","Benign symmetric lipomatosis (Madelung's disease)",1998,"Annals of Plastic Surgery","41","6",,"671","673",,29,,"https://www.scopus.com/inward/record.uri?eid=2-s2.0-0032436593&partnerID=40&md5=1ae73267c6d3c1b247bb0be3dae709a0",Article,Scopus,2-s2.0-0032436593
"Khan, J., Simon, R., Bittner, M., Chen, Y., Leighton, S.B., Pohida, T., Smith, P.D., Jiang, Y., Gooden, G.C., Trent, J.M., Meltzer, P.S.","Gene expression profiling of alveolar rhabdomyosarcoma with cDNA microarrays",1998,"Cancer Research","58","22",,"5009","5013",,390,,"https://www.scopus.com/inward/record.uri?eid=2-s2.0-0032534066&partnerID=40&md5=8fd8e813c24b28ac6abb2f4314fe3aad",Article,Scopus,2-s2.0-0032534066
"Smith, P.D., Oughstun, K.E.","Electromagnetic energy dissipation and propagation of an ultrawideband plane wave pulse in a causally dispersive dielectric",1998,"Radio Science","33","6",,"1489","1504",,12,,"https://www.scopus.com/inward/record.uri?eid=2-s2.0-0032204850&partnerID=40&md5=223c007db7be2902cccc39c137540a22",Article,Scopus,2-s2.0-0032204850
"Newsome, T.H., Walcott, W.A., Smith, P.D.","Urban activity spaces: Illustrations and application of a conceptual model for integrating the time and space dimensions",1998,"Transportation","25","2-4",,"357","377",,68,,"https://www.scopus.com/inward/record.uri?eid=2-s2.0-0032216316&partnerID=40&md5=b0dacc63a0ce300325d1e9c5ec5c1a1a",Article,Scopus,2-s2.0-0032216316
"Smith, P.D., Wright, T.E., Deluca, L., Kapp, D., Hill Jr., D.P., Strickland, T., Robson, M.C.","The effect of angiotensin II on acute incisional wound healing",1998,"Wounds","10","6",,"193","197",,,,"https://www.scopus.com/inward/record.uri?eid=2-s2.0-11644298116&partnerID=40&md5=d2c649b45224cb8145e67765c99eac8b",Article,Scopus,2-s2.0-11644298116
"Ko, F., Diaz, M., Smith, P., Emerson, E., Kim, Y.J., Krizek, T.J., Robson, M.C.","Toxic effects of capsaicin on keratinocytes and fibroblasts",1998,"Journal of Burn Care and Rehabilitation","19","5",,"409","413",,19,10.1097/00004630-199809000-00010,"https://www.scopus.com/inward/record.uri?eid=2-s2.0-0031702784&doi=10.1097%2f00004630-199809000-00010&partnerID=40&md5=5d1d7963b72d1a664f19957f05689a9e",Article,Scopus,2-s2.0-0031702784
"Crook, T., Brooks, L.A., Crossland, S., Osin, P., Barker, K.T., Waller, J., Philp, E., Smith, P.D., Yulug, I., Peto, J., Parker, G., Allday, M.J., Crompton, M.R., Gusterson, B.A.","p53 mutation with frequent novel codons but not a mutator phenotype in BRCA1- and BRCA2-associated breast tumours",1998,"Oncogene","17","13",,"1681","1689",,138,,"https://www.scopus.com/inward/record.uri?eid=2-s2.0-7844247959&partnerID=40&md5=a0f5c1afa27abd8edb5f4a60dfd594fe",Article,Scopus,2-s2.0-7844247959
"Solhaug, J.A., Oughstun, K.E., Stamnes, J.J., Smith, P.D.","Uniform asymptotic description of the Brillouin precursor in a single-resonance Lorentz model dielectric",1998,"Pure and Applied Optics (Print edition) (United Kingdom)","7","3",,"575","602",,13,10.1088/0963-9659/7/3/017,"https://www.scopus.com/inward/record.uri?eid=2-s2.0-0032069794&doi=10.1088%2f0963-9659%2f7%2f3%2f017&partnerID=40&md5=cb66ba3a43ce5275c2af348c6c6dc60b",Article,Scopus,2-s2.0-0032069794
"Smith, P.D., Crompton, M.R.","0Expression of v-src in mammary epithelial cells induces transcription via STAT3",1998,"Biochemical Journal","331","2",,"381","385",,17,,"https://www.scopus.com/inward/record.uri?eid=2-s2.0-0032522346&partnerID=40&md5=6c39b7ae90515d8dac927c40cd3f938f",Article,Scopus,2-s2.0-0032522346
"Smith, P.D., Crompton, M.R.","Expression of v-src in mammary epithelial cells induces transcription via STAT3.",1998,"The Biochemical journal","331",,,"Pt 2/","",,10,,"https://www.scopus.com/inward/record.uri?eid=2-s2.0-0032521769&partnerID=40&md5=9cf9bf1b4b3d62c144cb8361ccb8d158",Article,Scopus,2-s2.0-0032521769
"Wassermann, R.J., Polo, M., Smith, P., Wang, X., Ko, F., Robson, M.C.","Differential production of apoptosis-modulating proteins in patients with hypertrophic burn scar",1998,"Journal of Surgical Research","75","1",,"74","80",,39,10.1006/jsre.1998.5267,"https://www.scopus.com/inward/record.uri?eid=2-s2.0-0032519372&doi=10.1006%2fjsre.1998.5267&partnerID=40&md5=dc4a70c301e9589c7353caf2a2c60f67",Article,Scopus,2-s2.0-0032519372
