Authors,Title,Year,Source title,Volume,Issue,Art. No.,Page start,Page end,Page count,Cited by,DOI,Link,Document Type,Source,EID
"Pickett, A., Mohapatra, A., Laudari, A., Khanra, S., Ram, T., Patil, S., Guha, S.","Hybrid ZnO-organic semiconductor interfaces in photodetectors: A comparison of two near-infrared donor-acceptor copolymers",2017,"Organic Electronics: physics, materials, applications","45",,,"115","123",,,10.1016/j.orgel.2017.03.001,"https://www.scopus.com/inward/record.uri?eid=2-s2.0-85014845175&doi=10.1016%2fj.orgel.2017.03.001&partnerID=40&md5=85a563601c857e228239f4474dbb9ec1",Article,Scopus,2-s2.0-85014845175
"Basuray, S., Pathak, A., Bok, S., Chen, B., Hamm, S.C., Mathai, C.J., Guha, S., Gangopadhyay, K., Gangopadhyay, S.","Plasmonic nano-protrusions: Hierarchical nanostructures for single-molecule Raman spectroscopy",2017,"Nanotechnology","28","2", 025302,"","",,,10.1088/0957-4484/28/2/025302,"https://www.scopus.com/inward/record.uri?eid=2-s2.0-85003475032&doi=10.1088%2f0957-4484%2f28%2f2%2f025302&partnerID=40&md5=92d2d92a376812be20969d97884326d4",Article,Scopus,2-s2.0-85003475032
"Khanra, S., Ghosh, K., Ferreira, F.F., Alves, W.A., Punzo, F., Yu, P., Guha, S.","Probing nonlinear optical coefficients in self-assembled peptide nanotubes",2017,"Physical Chemistry Chemical Physics","19","4",,"3084","3093",,,10.1039/c6cp07879f,"https://www.scopus.com/inward/record.uri?eid=2-s2.0-85019116838&doi=10.1039%2fc6cp07879f&partnerID=40&md5=d07461acb0d8d87dc2f43351d4267122",Article,Scopus,2-s2.0-85019116838
"Knaapila, M., Guha, S.","Blue emitting organic semiconductors under high pressure: Status and outlook",2016,"Reports on Progress in Physics","79","6", 066601,"","",,,10.1088/0034-4885/79/6/066601,"https://www.scopus.com/inward/record.uri?eid=2-s2.0-84979524789&doi=10.1088%2f0034-4885%2f79%2f6%2f066601&partnerID=40&md5=2dd331a8ce232b3e82b754d60f82b4dc",Review,Scopus,2-s2.0-84979524789
"Li, Y., Moghe, D., Patil, S., Guha, S., Ullrich, C.A.","Visualisation of charge-transfer excitations in donor-acceptor molecules using the particle-hole map: A case study",2016,"Molecular Physics","114","7-8",,"1365","1373",,2,10.1080/00268976.2015.1137642,"https://www.scopus.com/inward/record.uri?eid=2-s2.0-84955065695&doi=10.1080%2f00268976.2015.1137642&partnerID=40&md5=b8977655dea61b5cc1162949df332c7a",Article,Scopus,2-s2.0-84955065695
"Khanra, S., Cipriano, T., Lam, T., White, T.A., Fileti, E.E., Alves, W.A., Guha, S.","Self-Assembled Peptide-Polyfluorene Nanocomposites for Biodegradable Organic Electronics",2015,"Advanced Materials Interfaces","2","14", 1500265,"","",,8,10.1002/admi.201500265,"https://www.scopus.com/inward/record.uri?eid=2-s2.0-84942197088&doi=10.1002%2fadmi.201500265&partnerID=40&md5=222a7cb9826478f9eded7f6f9a4cb651",Article,Scopus,2-s2.0-84942197088
"Souza, J.S., Krambrock, K., Pinheiro, M.V.B., Ando, R.A., Guha, S., Alves, W.A.","Visible-light photocatalytic activity of NH4NO3 ion-exchanged nitrogen-doped titanate and TiO2 nanotubes",2014,"Journal of Molecular Catalysis A: Chemical","394",,,"48","56",,6,10.1016/j.molcata.2014.06.036,"https://www.scopus.com/inward/record.uri?eid=2-s2.0-84904915844&doi=10.1016%2fj.molcata.2014.06.036&partnerID=40&md5=eff453adf56b6064c2b1f462339a8fb8",Article,Scopus,2-s2.0-84904915844
"Cipriano, T., Knotts, G., Laudari, A., Bianchi, R.C., Alves, W.A., Guha, S.","Bioinspired peptide nanostructures for organic field-effect transistors",2014,"ACS Applied Materials and Interfaces","6","23",,"21408","21415",,12,10.1021/am5064124,"https://www.scopus.com/inward/record.uri?eid=2-s2.0-84917727373&doi=10.1021%2fam5064124&partnerID=40&md5=b8788f3cd29ec838d280acd9d438f16e",Article,Scopus,2-s2.0-84917727373
"Knaapila, M., Torkkeli, M., Konoîpková, Z., Haase, D., Liermann, H.-P., Scherf, U., Guha, S.","Measuring structural inhomogeneity of conjugated polymer at high pressures up to 30 GPa",2013,"Macromolecules","46","20",,"8284","8288",,5,10.1021/ma401661t,"https://www.scopus.com/inward/record.uri?eid=2-s2.0-84886608672&doi=10.1021%2fma401661t&partnerID=40&md5=0fe60e0f505f2dafd21b5f8e1e760f4d",Article,Scopus,2-s2.0-84886608672
"Kumar, P., Guha, S., Shahedipour-Sandvik, F., Narayan, K.S.","Hybrid n-GaN and polymer interfaces: Model systems for tunable photodiodes",2013,"Organic Electronics: physics, materials, applications","14","11",,"2818","2825",,3,10.1016/j.orgel.2013.08.003,"https://www.scopus.com/inward/record.uri?eid=2-s2.0-84883166577&doi=10.1016%2fj.orgel.2013.08.003&partnerID=40&md5=72b37f7a17a7729028b9d3c9faf2317a",Article,Scopus,2-s2.0-84883166577
"Knaapila, M., Konôpková, Z., Torkkeli, M., Haase, D., Liermann, H.-P., Guha, S., Scherf, U.","Structural study of helical polyfluorene under high quasihydrostatic pressure",2013,"Physical Review E - Statistical, Nonlinear, and Soft Matter Physics","87","2", 022602,"","",,9,10.1103/PhysRevE.87.022602,"https://www.scopus.com/inward/record.uri?eid=2-s2.0-84874535256&doi=10.1103%2fPhysRevE.87.022602&partnerID=40&md5=2e0f82ce0f3969d44ff5fd7dd1c12e23",Article,Scopus,2-s2.0-84874535256
"Grandusky, J.R., Jindal, V., Raynolds, J.E., Guha, S., Shahedipour-Sandvik, F.","Density functional calculations of the strain effects on binding energies and adatom diffusion on (0 0 0 1) GaN surfaces",2009,"Materials Science and Engineering B: Solid-State Materials for Advanced Technology","158","1-3",,"13","18",,6,10.1016/j.mseb.2008.12.042,"https://www.scopus.com/inward/record.uri?eid=2-s2.0-61649128745&doi=10.1016%2fj.mseb.2008.12.042&partnerID=40&md5=321710052b2120fe77b2104a2e6737b6",Article,Scopus,2-s2.0-61649128745
"Jamil, M., Grandusky, J.R., Jindal, V., Shahedipour-Sandvik, F., Guha, S., Arif, M.","Development of low dislocation and strain reduced GaN on Sn (111) by substrate engineering",2005,"Proceedings of SPIE - The International Society for Optical Engineering","5941",, 59411E,"1","8",,,10.1117/12.617704,"https://www.scopus.com/inward/record.uri?eid=2-s2.0-31844437705&doi=10.1117%2f12.617704&partnerID=40&md5=c0b07b7364d74fea1fdc36ae825e2a9e",Conference Paper,Scopus,2-s2.0-31844437705
"Jamil, M., Grandusky, J.R., Jindal, V., Shahedipour-Sandvik, F., Guha, S., Arif, M.","Development of strain reduced GaN on Si (111) by substrate engineering",2005,"Applied Physics Letters","87","8", 082103,"","",,37,10.1063/1.2012538,"https://www.scopus.com/inward/record.uri?eid=2-s2.0-24344498683&doi=10.1063%2f1.2012538&partnerID=40&md5=264939e6daadc50e262ec70275511ba1",Article,Scopus,2-s2.0-24344498683
"Martin, C.M., Cai, Q., Guha, S., Graupner, W., Chandrasekhar, M., Chandrasekhar, H.R.","Raman modes in oligophenyls under hydrostatic pressure",2004,"Physica Status Solidi (B) Basic Research","241","14",,"3339","3344",,12,10.1002/pssb.200405220,"https://www.scopus.com/inward/record.uri?eid=2-s2.0-10844265519&doi=10.1002%2fpssb.200405220&partnerID=40&md5=6466230042f30b3e35a27190bc9f9797",Conference Paper,Scopus,2-s2.0-10844265519
"Guha, S., Rice, J.D., Martin, C.M., Graupner, W., Chandrasekhar, M., Chandrasekhar, H.R., Scherr, U.","Optical spectroscopic studies of a soluble fluorene-based conjugated polymer: A hydrostatic pressure and temperature study",2002,"Materials Research Society Symposium - Proceedings","708",,,"299","304",,,,"https://www.scopus.com/inward/record.uri?eid=2-s2.0-0036045668&partnerID=40&md5=a168fa21591cc48636da3959cfc5a41d",Article,Scopus,2-s2.0-0036045668
"Guha, S., Graupner, W., Yang, S., Chandrasekhar, M., Chandrasekhar, H.R.","Optical properties of organic wide band-gap semiconductors under high pressure",2001,"ACS Symposium Series","798",,,"127","142",,4,,"https://www.scopus.com/inward/record.uri?eid=2-s2.0-0041402558&partnerID=40&md5=f723036d12bc0f49aadcabc9931bd974",Article,Scopus,2-s2.0-0041402558
"Guha, S., Graupner, W., Resel, R., Chandrasekhar, M., Chandrasekhar, H.R., Glaser, R., Leising, G.","Tuning intermolecular interactions: A study of the structural and vibrational properties of p-hexaphenyl under pressure",2001,"Journal of Physical Chemistry A","105","25",,"6203","6211",,38,10.1021/jp0045540,"https://www.scopus.com/inward/record.uri?eid=2-s2.0-0035963829&doi=10.1021%2fjp0045540&partnerID=40&md5=1fd8953ec073096f5765a577889907df",Article,Scopus,2-s2.0-0035963829
"Chandrasekhar, M., Yang, S.C., Guha, S., Cai, Q., Martin, C.M., Chandrasekhar, H.R., Graupner, W., Leising, G.","Optical transitions in para-phenylenes under hydrostatic pressure",2001,"Synthetic Metals","119","1-3",,"657","658",,1,10.1016/S0379-6779(00)01005-5,"https://www.scopus.com/inward/record.uri?eid=2-s2.0-0035867391&doi=10.1016%2fS0379-6779%2800%2901005-5&partnerID=40&md5=28aa3c2474129e2fd11ad8792840ce3b",Article,Scopus,2-s2.0-0035867391
"Heimel, G., Cai, Q., Martin, C., Puschnig, P., Guha, S., Graupner, W., Ambrosch-Draxl, C., Chandrasekhar, M., Leising, G.","On the structure of oligophenylenes",2001,"Synthetic Metals","119","1-3",,"371","372",,6,10.1016/S0379-6779(00)01394-1,"https://www.scopus.com/inward/record.uri?eid=2-s2.0-0035867347&doi=10.1016%2fS0379-6779%2800%2901394-1&partnerID=40&md5=a2d68edd0a10650b139b324408944570",Article,Scopus,2-s2.0-0035867347
"Yang, S.-C., Graupner, W., Guha, S., Puschnig, P., Martin, C., Chandrasekhar, H.R., Chandrasekhar, M., Leising, G., Ambrosch-Draxl, C., Scherf, U.","Geometry-dependent electronic properties of highly fluorescent conjugated molecules",2000,"Physical Review Letters","85","11",,"2388","2391",,37,10.1103/PhysRevLett.85.2388,"https://www.scopus.com/inward/record.uri?eid=2-s2.0-0034273086&doi=10.1103%2fPhysRevLett.85.2388&partnerID=40&md5=25a182ce633fea294a84f523ab0f60b2",Article,Scopus,2-s2.0-0034273086
"Payne, D.J., Guha, S., Cai, Q., Chandrasekhar, M., Chandrasekhar, H.R., Venkateswaran, U.D., Jayaram, B., Ulanday, J.","High-pressure study of the Raman modes in YBa2(Cu0.96Ni0.04)4O8",1999,"Physical Review B - Condensed Matter and Materials Physics","60","6",,"4363","4369",,1,,"https://www.scopus.com/inward/record.uri?eid=2-s2.0-1642326149&partnerID=40&md5=fb2abc037434c9e597fb5dd1dd08d1a0",Article,Scopus,2-s2.0-1642326149
"Yang, Shu-Chun, Graupner, Willi, Guha, Suchismita, Puschnig, Peter, Martin, Chris, Chandrasekhar, H.R., Chandrasekhar, Meera, Leising, Gunther, Ambrosch-Draxl, Claudia","Influence of the molecular geometry on the photoexcitations of highly emissive organic semiconductors",1999,"Proceedings of SPIE - The International Society for Optical Engineering","3797",,,"26","37",,6,,"https://www.scopus.com/inward/record.uri?eid=2-s2.0-0033317806&partnerID=40&md5=30d3cfd7348658fa37e482cbad72e555",Conference Paper,Scopus,2-s2.0-0033317806
"Guha, S., Graupner, W., Resel, R., Chandrasekhar, M., Chandrasekhar, H.R., Glaser, R., Leising, G.","Planarity of para hexaphenyl",1999,"Physical Review Letters","82","18",,"3625","3628",,94,,"https://www.scopus.com/inward/record.uri?eid=2-s2.0-0001021092&partnerID=40&md5=a567e195874cbf07e149fcc463c5be7c",Article,Scopus,2-s2.0-0001021092
"Guha, S., Graupner, W., Resel, R., Chandrasekhar, M., Chandrasekhar, H.R., Glaser, R., Leising, G.","High pressure studies on the planarity of para-hexaphenyl",1999,"Synthetic Metals","101","1",,"180","181",,11,10.1016/S0379-6779(98)00837-6,"https://www.scopus.com/inward/record.uri?eid=2-s2.0-0032597421&doi=10.1016%2fS0379-6779%2898%2900837-6&partnerID=40&md5=d6273db7c19179d85cd73f867f45a6e6",Article,Scopus,2-s2.0-0032597421
"Guha, S., Graupner, W., Yang, S., Chandrasekhar, M., Chandrasekhar, H.R., Leising, G.","Optical properties of poly(para-phenylenes) under high pressure",1999,"Physica Status Solidi (B) Basic Research","211","1",,"177","188",,13,,"https://www.scopus.com/inward/record.uri?eid=2-s2.0-0032623282&partnerID=40&md5=2420690360a66b9efe473d1b921519a6",Article,Scopus,2-s2.0-0032623282
"Guha, S., Cai, Q., Chandrasekhar, M., Chandrasekhar, H.R., Kim, Hyunjung, Alvarenga, A.D., Vogelgesang, R., Ramdas, A.K., Melloch, M.R.","Temperature dependence of the intervalley deformation potential of GaAs/AlAs superlattices under hydrostatic pressure",1998,"Materials Research Society Symposium - Proceedings","499",,,"201","206",,,,"https://www.scopus.com/inward/record.uri?eid=2-s2.0-0032314582&partnerID=40&md5=59505d5872d32ed8f5ff2eaf0478c6f9",Conference Paper,Scopus,2-s2.0-0032314582
"Guha, S., Cai, Q., Chandrasekhar, M., Chandrasekhar, H.R., Kim, H., Alvarenga, A.D., Vogelgesang, R., Ramdas, A.K., Melloch, M.R.","Photoluminescence of short-period GaAs/AlAs superlattices: A hydrostatic pressure and temperature study",1998,"Physical Review B - Condensed Matter and Materials Physics","58","11",,"7222","7229",,23,,"https://www.scopus.com/inward/record.uri?eid=2-s2.0-0005423419&partnerID=40&md5=ab579d99169a856e2ea08a53da5cd20e",Article,Scopus,2-s2.0-0005423419
"Payne, D.J., Guha, S., Cai, Q., Chrndrasekhar, M., Chandrasekha, H.R., Jayaramt, B., Ulanday, J.","Raman Phonons under Hydrostatic Pressure in YBa2(Cu1.xNix)4O8",1998,"Review of High Pressure Science and Technology/Koatsuryoku No Kagaku To Gijutsu","7",,,"535","537",,,10.4131/jshpreview.7.535,"https://www.scopus.com/inward/record.uri?eid=2-s2.0-85024718140&doi=10.4131%2fjshpreview.7.535&partnerID=40&md5=614077564dcda37e5e0b31fd831f5991",Article,Scopus,2-s2.0-85024718140
"Guha, S., Menéndez, J., Page, J.B., Adams, G.B.","Isotope effect on the Raman spectrum of the pentagonal-pinch mode in C<inf>60</inf>",1997,"Physical Review B - Condensed Matter and Materials Physics","56","23",,"15431","15438",,11,,"https://www.scopus.com/inward/record.uri?eid=2-s2.0-0001369663&partnerID=40&md5=47170b6d7d21d83279f950fbb680294f",Article,Scopus,2-s2.0-0001369663
"Guha, S., Graupner, W., Resel, R., Chandrasekhar, M., Chandrasekhar, H.R., Leising, G.","Structural properties of hexaphenyl powder under high pressure",1997,"Materials Research Society Symposium - Proceedings","488",,,"867","872",,1,,"https://www.scopus.com/inward/record.uri?eid=2-s2.0-0031368338&partnerID=40&md5=d3c15085a0a68f5bc3c020de0f6c3cfa",Conference Paper,Scopus,2-s2.0-0031368338
"Graupner, W., Guha, S., Yang, S., Chandrasekhar, M., Chandrasekhar, H.R., Leising, G., Scherf, U., Mullen, K.","Electronic properties of poly(para-phenylenes) under high pressure",1997,"Materials Research Society Symposium - Proceedings","488",,,"873","878",,,,"https://www.scopus.com/inward/record.uri?eid=2-s2.0-0031382388&partnerID=40&md5=d5bcc431326c5a9e1253b72aca882c66",Conference Paper,Scopus,2-s2.0-0031382388
"Lorentzen, J.D., Guha, S., Menéndez, J., Giannozzi, P., Baroni, S.","Raman cross section for the pentagonal-pinch mode in buckminsterfullerene C<inf>60</inf>",1997,"Chemical Physics Letters","270","1-2",,"129","134",,9,,"https://www.scopus.com/inward/record.uri?eid=2-s2.0-0031574866&partnerID=40&md5=1fd7620456cb30ec3ec0074474c64a98",Article,Scopus,2-s2.0-0031574866
"Tsen, K.T., Grann, E.D., Guha, S., Menendez, J.","Electron-phonon interactions in solid C60 studied by transient picosecond Raman spectroscopy",1996,"Applied Physics Letters","68","8",,"1051","1053",,2,10.1063/1.116245,"https://www.scopus.com/inward/record.uri?eid=2-s2.0-21544476180&doi=10.1063%2f1.116245&partnerID=40&md5=545fb5b9fc2e026667b5a96bf06ccdc4",Article,Scopus,2-s2.0-21544476180
"Guha, S., Menéndez, J., Page, J.B., Adams, G.B.","Empirical bond polarizability model for fullerenes",1996,"Physical Review B - Condensed Matter and Materials Physics","53","19",,"13106","13114",,89,,"https://www.scopus.com/inward/record.uri?eid=2-s2.0-0001021053&partnerID=40&md5=f5e16e751ab206e952a3184cadc0c964",Article,Scopus,2-s2.0-0001021053
"Tsen, K.T., Grann, E.D., Guha, S., Menendez, J.","Electron-phonon interactions in solid C<inf>60</inf> studied by transient picosecond Raman spectroscopy",1995,"Applied Physics Letters",,,,"1051","",,,,"https://www.scopus.com/inward/record.uri?eid=2-s2.0-36449001247&partnerID=40&md5=625ab2243f6eedb1fe236dd75ade2132",Article,Scopus,2-s2.0-36449001247
"Menéndez, J., Page, J.B., Guha, S.","The isotope effect on the Raman spectrum of molecular CM<inf>60</inf>",1994,"Philosophical Magazine B: Physics of Condensed Matter; Statistical Mechanics, Electronic, Optical and Magnetic Properties","70","3",,"651","659",,20,10.1080/01418639408240239,"https://www.scopus.com/inward/record.uri?eid=2-s2.0-84866490352&doi=10.1080%2f01418639408240239&partnerID=40&md5=3abdae46ae94efba57dc31c21d8baf87",Article,Scopus,2-s2.0-84866490352
"Guha, S., Lorentzen, J., Sinha, K., Menndez, J., Adams, G.B., Page, J.B., Sankey, O.F.","Extrinsic nature of the 2.5 ev raman resonance in c60",1994,"Molecular Crystals and Liquid Crystals Science and Technology. Section A. Molecular Crystals and Liquid Crystals","256","1",,"391","398",,2,10.1080/10587259408039268,"https://www.scopus.com/inward/record.uri?eid=2-s2.0-0011030083&doi=10.1080%2f10587259408039268&partnerID=40&md5=b66d38d0338789637bcf426fddf67541",Article,Scopus,2-s2.0-0011030083
"Guha, S., Menéndez, J., Page, J.B., Adams, G.B., Spencer, G.S., Lehman, J.P., Giannozzi, P., Baroni, S.","Isotopically resolved Raman spectra of C60",1994,"Physical Review Letters","72","21",,"3359","3362",,31,10.1103/PhysRevLett.72.3359,"https://www.scopus.com/inward/record.uri?eid=2-s2.0-0028424186&doi=10.1103%2fPhysRevLett.72.3359&partnerID=40&md5=ce8f8145d27e52c20b45b67ce35afbb1",Article,Scopus,2-s2.0-0028424186
"Yota, J., Burrows, V.A., Guha, S.","Passivation of GaAs by electrochemical sulfur treatments",1993,"Materials Research Society Symposium Proceedings","315",,,"163","168",,1,,"https://www.scopus.com/inward/record.uri?eid=2-s2.0-0027886538&partnerID=40&md5=d5290b8ec149e5750a4ac7c18c3b87a0",Conference Paper,Scopus,2-s2.0-0027886538
"Sinha, K., Guha, S., Menéndez, J., Ramakrishna, B.L., Wright, D., Karcher, T.","Raman study of photoexcited C<inf>60</inf>",1993,"Solid State Communications","87","11",,"981","986",,9,10.1016/0038-1098(93)90544-W,"https://www.scopus.com/inward/record.uri?eid=2-s2.0-0027659209&doi=10.1016%2f0038-1098%2893%2990544-W&partnerID=40&md5=36694153cec18d59d4dbfd83e9565c45",Article,Scopus,2-s2.0-0027659209
