Authors,Title,Year,Source title,Volume,Issue,Art. No.,Page start,Page end,Page count,Cited by,DOI,Link,Document Type,Source,EID
"Hsu, L., Martin, R.L., McElroy, B., Litwin-Miller, K., Kim, W.","Data management, sharing, and reuse in experimental geomorphology: Challenges, strategies, and scientific opportunities",2015,"Geomorphology","244",,,"180","189",,7,10.1016/j.geomorph.2015.03.039,"https://www.scopus.com/inward/record.uri?eid=2-s2.0-84937977255&doi=10.1016%2fj.geomorph.2015.03.039&partnerID=40&md5=d035986e1957a80cf9cb85c56d73b371",Article,Scopus,2-s2.0-84937977255
"Hsu, L., Dietrich, W.E., Sklar, L.S.","Mean and fluctuating basal forces generated by granular flows: Laboratory observations in a large vertically rotating drum",2014,"Journal of Geophysical Research: Earth Surface","119","6",,"1283","1309",,6,10.1002/2013JF003078,"https://www.scopus.com/inward/record.uri?eid=2-s2.0-84904684139&doi=10.1002%2f2013JF003078&partnerID=40&md5=f2e4074623034fc064c6fd071883f446",Article,Scopus,2-s2.0-84904684139
"Kaitna, R., Dietrich, W.E., Hsu, L.","Surface slopes, velocity profiles and fluid pressure in coarse-grained debris flows saturated with water and mud",2014,"Journal of Fluid Mechanics","741",,,"377","403",,12,10.1017/jfm.2013.675,"https://www.scopus.com/inward/record.uri?eid=2-s2.0-84904607311&doi=10.1017%2fjfm.2013.675&partnerID=40&md5=6eb153e3770f9e0543f2548dc86bc7ad",Article,Scopus,2-s2.0-84904607311
"Chen, W.-P., Hsu, L.","Historic seismicity near the source zone of the great 2008 Wenchuan earthquake: Implications for seismic hazards",2013,"Tectonophysics","584",,,"114","118",,3,10.1016/j.tecto.2012.08.035,"https://www.scopus.com/inward/record.uri?eid=2-s2.0-84872400516&doi=10.1016%2fj.tecto.2012.08.035&partnerID=40&md5=a6fdc84ff4abc851916262e2edd18f4b",Article,Scopus,2-s2.0-84872400516
"Yohannes, B., Hsu, L., Dietrich, W.E., Hill, K.M.","Boundary stresses due to impacts from dry granular flows",2012,"Journal of Geophysical Research: Earth Surface","117","2", F02027,"","",,11,10.1029/2011JF002150,"https://www.scopus.com/inward/record.uri?eid=2-s2.0-84861674696&doi=10.1029%2f2011JF002150&partnerID=40&md5=cf203f34c99f41dee6bee2357973a02d",Article,Scopus,2-s2.0-84861674696
"Hsu, L., Kaitna, R., Dietrich, W.E., Sklar, L.S.","Boundary shear stress of granular flows",2011,"International Conference on Debris-Flow Hazards Mitigation: Mechanics, Prediction, and Assessment, Proceedings",,,,"331","338",,,10.4408/IJEGE.2011-03.B-038,"https://www.scopus.com/inward/record.uri?eid=2-s2.0-84861643768&doi=10.4408%2fIJEGE.2011-03.B-038&partnerID=40&md5=1840d4a82431b4e90a9fec292c7960e6",Conference Paper,Scopus,2-s2.0-84861643768
"Hill, K.M., Bereket, Y., Dietrich, W.E., Hsu, L.","Discrete element modeling and large scale experimental studies of bouldery debris flows",2011,"International Conference on Debris-Flow Hazards Mitigation: Mechanics, Prediction, and Assessment, Proceedings",,,,"435","447",,,10.4408/IJEGE.2011-03.B-049,"https://www.scopus.com/inward/record.uri?eid=2-s2.0-84861581945&doi=10.4408%2fIJEGE.2011-03.B-049&partnerID=40&md5=a4b3c745a4d9a9a4585311622d068729",Conference Paper,Scopus,2-s2.0-84861581945
"Kaitna, R., Hsu, L., Rickenmann, D., Dietrich, W.E.","On the development of an unsaturated front of debris flows",2011,"International Conference on Debris-Flow Hazards Mitigation: Mechanics, Prediction, and Assessment, Proceedings",,,,"351","358",,6,10.4408/IJEGE.2011-03.B-040,"https://www.scopus.com/inward/record.uri?eid=2-s2.0-84861648475&doi=10.4408%2fIJEGE.2011-03.B-040&partnerID=40&md5=9572c270b2073e1f4971cf77038ab6ea",Conference Paper,Scopus,2-s2.0-84861648475
"Schneider, D., Kaitna, R., Dietrich, W.E., Hsu, L., Huggel, C., McArdell, B.W.","Frictional behavior of granular gravel-ice mixtures in vertically rotating drum experiments and implications for rock-ice avalanches",2011,"Cold Regions Science and Technology","69","1",,"70","90",,16,10.1016/j.coldregions.2011.07.001,"https://www.scopus.com/inward/record.uri?eid=2-s2.0-80052577417&doi=10.1016%2fj.coldregions.2011.07.001&partnerID=40&md5=0813cda9d4254113225f44b1f921b3a6",Article,Scopus,2-s2.0-80052577417
"Hsu, L., Finnegan, N.J., Brodsky, E.E.","A seismic signature of river bedload transport during storm events",2011,"Geophysical Research Letters","38","13", L13407,"","",,30,10.1029/2011GL047759,"https://www.scopus.com/inward/record.uri?eid=2-s2.0-79960514586&doi=10.1029%2f2011GL047759&partnerID=40&md5=4a7957c3865c73db028f9558512c4ed1",Article,Scopus,2-s2.0-79960514586
"Hsu, L., Dietrich, W.E., Sklar, L.S.","Erratum: ""Experimental study of bedrock erosion by granular flows"" (Journal of Geophysical Research F: Earth Surface (2008) vol. 113 doi:10.1029/2007JF000778)",2008,"Journal of Geophysical Research: Earth Surface","113","2", F02017,"","",,,10.1029/2008JF001048,"https://www.scopus.com/inward/record.uri?eid=2-s2.0-50849137535&doi=10.1029%2f2008JF001048&partnerID=40&md5=28e86dc3304073c0325370f98fe3ebce",Erratum,Scopus,2-s2.0-50849137535
"Hsu, L., Dietrich, W.E., Sklar, L.S.","Experimental study of bedrock erosion by granular flows",2008,"Journal of Geophysical Research: Earth Surface","113","2", F02001,"","",,34,10.1029/2007JF000778,"https://www.scopus.com/inward/record.uri?eid=2-s2.0-50949099096&doi=10.1029%2f2007JF000778&partnerID=40&md5=9f31e2b7d0494f7e80064876877291f1",Article,Scopus,2-s2.0-50949099096
"Hsu, L., Dietrich, W.E., Sklar, L.S.","Normal stresses, longitudinal profiles, and bedrock surface erosion by debris flows - Initial findings from a large, vertically rotating drum",2007,"International Conference on Debris-Flow Hazards Mitigation: Mechanics, Prediction, and Assessment, Proceedings",,,,"141","150",,6,,"https://www.scopus.com/inward/record.uri?eid=2-s2.0-57849157051&partnerID=40&md5=ce90d84e442dfef58391658153521c07",Conference Paper,Scopus,2-s2.0-57849157051
"Hsu, L., Bürgmann, R.","Surface creep along the Longitudinal Valley fault, Taiwan from InSAR measurements",2006,"Geophysical Research Letters","33","6", L06312,"","",,21,10.1029/2005GL024624,"https://www.scopus.com/inward/record.uri?eid=2-s2.0-33646456372&doi=10.1029%2f2005GL024624&partnerID=40&md5=cb427f2c2568d7b266287380c7e33cab",Article,Scopus,2-s2.0-33646456372
"Araki, T., Enomoto, S., Furuno, K., Gando, Y., Ichimura, K., Ikeda, H., Inoue, K., Kishimoto, Y., Koga, M., Koseki, Y., Maeda, T., Mitsui, T., Motoki, M., Nakajima, K., Ogawa, H., Ogawa, M., Owada, K., Ricol, J.-S., Shimizu, I., Shirai, J., Suekane, F., Suzuki, A., Tada, K., Takeuchi, S., Tamae, K., Tsuda, Y., Watanabe, H., Busenitz, J., Classen, T., Djurcic, Z., Keefer, G., Leonard, D., Piepke, A., Yakushev, E., Berger, B.E., Chan, Y.D., Decowski, M.P., Dwyer, D.A., Freedman, S.J., Fujikawa, B.K., Goldman, J., Gray, F., Heeger, K.M., Hsu, L., Lesko, K.T., Luk, K.-B., Murayama, H., O'Donnell, T., Poon, A.W.P., Steiner, H.M., Winslow, L.A., Mauger, C., McKeown, R.D., Vogel, P., Lane, C.E., Miletic, T., Guillian, G., Learned, J.G., Maricic, J., Matsuno, S., Pakvasa, S., Horton-Smith, G.A., Dazeley, S., Hatakeyama, S., Rojas, A., Svoboda, R., Dieterle, B.D., Detwiler, J., Gratta, G., Ishii, K., Tolich, N., Uchida, Y., Batygov, M., Bugg, W., Efremenko, Y., Kamyshkov, Y., Kozlov, A., Nakamura, Y., Karwowski, H.J., Markoff, D.M., Nakamura, K., Rohm, R.M., Tornow, W., Wendell, R., Chen, M.-J., Wang, Y.-F., Piquemal, F.","Experimental investigation of geologically produced antineutrinos with KamLAND",2005,"Nature","436","7050",,"499","503",,243,10.1038/nature03980,"https://www.scopus.com/inward/record.uri?eid=2-s2.0-23444431955&doi=10.1038%2fnature03980&partnerID=40&md5=c2b014d04adae8ef932e48c4fc3a56fc",Article,Scopus,2-s2.0-23444431955
"Hsu, L., Pelletier, J.D.","Correlation and dating of Quaternary alluvial-fan surfaces using scarp diffusion",2004,"Geomorphology","60","3-4",,"319","335",,11,10.1016/j.geomorph.2003.08.007,"https://www.scopus.com/inward/record.uri?eid=2-s2.0-2442504623&doi=10.1016%2fj.geomorph.2003.08.007&partnerID=40&md5=712c75ce986a9b9bc5cafe795463f9b1",Article,Scopus,2-s2.0-2442504623
"Bell, N., Hsu, L., Jacob, D.J., Schultz, M.G., Blake, D.R., Butler, J.H., King, D.B., Lobert, J.M., Maier-Reimer, E.","Methyl iodide: Atmospheric budget and use as a tracer of marine convection in global models",2002,"Journal of Geophysical Research Atmospheres","107","17",,"XXXXIX","XXL",,20,10.1029/200IJD001151,"https://www.scopus.com/inward/record.uri?eid=2-s2.0-36448969764&doi=10.1029%2f200IJD001151&partnerID=40&md5=59966f9a4374b05208f671f0b4bbe7f0",Article,Scopus,2-s2.0-36448969764
"Bell, N., Hsu, L., Jacob, D.J., Schultz, M.G., Blake, D.R., Butler, J.H., King, D.B., Lobert, J.M., Maier-Reimer, E.","Methyl iodide: Atmospheric budget and use as a tracer of marine convection in global models",2002,"Journal of Geophysical Research Atmospheres","107","17",,"8","1-8-12",,57,10.1029/2001JD001151,"https://www.scopus.com/inward/record.uri?eid=2-s2.0-32144450122&doi=10.1029%2f2001JD001151&partnerID=40&md5=9aee07f7f960abcb2c10b5c6e6bbfcec",Article,Scopus,2-s2.0-32144450122
