Authors,Title,Year,Source title,Volume,Issue,Art. No.,Page start,Page end,Page count,Cited by,DOI,Link,Document Type,Source,EID
"He, Y., Widney, S., Ruan, M., Herbert, E., Li, X., Craft, C.","Accumulation of soil carbon drives denitrification potential and lab-incubated gas production along a chronosequence of salt marsh development",2016,"Estuarine, Coastal and Shelf Science","172",,,"72","80",,1,10.1016/j.ecss.2016.02.002,"https://www.scopus.com/inward/record.uri?eid=2-s2.0-84958158329&doi=10.1016%2fj.ecss.2016.02.002&partnerID=40&md5=4276227f6fdb9ef964de5fd39690240f",Article,Scopus,2-s2.0-84958158329
"Herbert, E.R., Boon, P., Burgin, A.J., Neubauer, S.C., Franklin, R.B., Ardon, M., Hopfensperger, K.N., Lamers, L.P.M., Gell, P., Langley, J.A.","A global perspective on wetland salinization: Ecological consequences of a growing threat to freshwater wetlands",2015,"Ecosphere","6","10", 206,"","",,25,10.1890/ES14-00534.1,"https://www.scopus.com/inward/record.uri?eid=2-s2.0-84946912075&doi=10.1890%2fES14-00534.1&partnerID=40&md5=34056411576a4ca2ee31fd9c27fa29c5",Review,Scopus,2-s2.0-84946912075
"Bannister, J.M., Herbert, E.R., Craft, C.B.","Spatial variability in sedimentation, carbon sequestration, and nutrient accumulation in an alluvial floodplain forest",2015,"The Role of Natural and Constructed Wetlands in Nutrient Cycling and Retention on the Landscape",,,,"41","55",,3,10.1007/978-3-319-08177-9_4,"https://www.scopus.com/inward/record.uri?eid=2-s2.0-84944605564&doi=10.1007%2f978-3-319-08177-9_4&partnerID=40&md5=e08c78ad60d8438c387e9136fcbe5db6",Book Chapter,Scopus,2-s2.0-84944605564
"Hopkinson, C.S., Covich, A.P., Craft, C.B., DeLong, K., Doyle, T.W., Flanagan, N., Freeman, M.C., Herbert, E.R., Mehring, A., Mohan, J.E., Pringle, C.M., Richardson, C.J.","The effects of climate change on natural ecosystems of the Southeast USA",2013,"Climate of the Southeast United States: Variability, Change, Impacts, and Vulnerability",,,,"237","270",,,10.5822/978-1-61091-509-0_11,"https://www.scopus.com/inward/record.uri?eid=2-s2.0-85025175167&doi=10.5822%2f978-1-61091-509-0_11&partnerID=40&md5=455721b3362bb60e2b80a72f0b71b974",Book Chapter,Scopus,2-s2.0-85025175167
"Parker, V.T., Callaway, J.C., Schile, L.M., Vasey, M.C., Herbert, E.R.","Tidal vegetation: Spatial and temporal dynamics",2012,"Ecology, Conservation, and Restoration of Tidal Marshes: The San Francisco Estuary",,,,"97","111",,1,,"https://www.scopus.com/inward/record.uri?eid=2-s2.0-84891456936&partnerID=40&md5=0ec5140e26841c677e17e449f9fd6bc7",Book Chapter,Scopus,2-s2.0-84891456936
"Parker, V.T., Callaway, J.C., Schile, L.M., Vasey, M.C., Herbert, E.R.","Tidal marshes in the context of climate change",2012,"Ecology, Conservation, and Restoration of Tidal Marshes: The San Francisco Estuary",,,,"87","94",,1,,"https://www.scopus.com/inward/record.uri?eid=2-s2.0-84891459035&partnerID=40&md5=725141aedab22b3e48605d905117968a",Book Chapter,Scopus,2-s2.0-84891459035
"Marton, J.M., Herbert, E.R., Craft, C.B.","Effects of salinity on denitrification and greenhouse gas production from laboratory-incubated tidal forest soils",2012,"Wetlands","32","2",,"347","357",,48,10.1007/s13157-012-0270-3,"https://www.scopus.com/inward/record.uri?eid=2-s2.0-84863716792&doi=10.1007%2fs13157-012-0270-3&partnerID=40&md5=bcbe44e852f758283e3d6636f5f9bac3",Article,Scopus,2-s2.0-84863716792
"Hossler, K., Bouchard, V., Fennessy, M.S., Frey, S.D., Anemaet, E., Herbert, E.","No-net-loss not met for nutrient function in freshwater marshes: Recommendations for wetland mitigation policies",2011,"Ecosphere","2","7", 82,"","",,20,10.1890/ES11-00009.1,"https://www.scopus.com/inward/record.uri?eid=2-s2.0-84863726845&doi=10.1890%2fES11-00009.1&partnerID=40&md5=25ac14b3d5bea69477a456e7a63377c0",Article,Scopus,2-s2.0-84863726845
