Authors,Title,Year,Source title,Volume,Issue,Art. No.,Page start,Page end,Page count,Cited by,DOI,Link,Document Type,Source,EID
"Henderson, B.S., Ice, L.D., Khaneft, D., O'Connor, C., Russell, R., Schmidt, A., Bernauer, J.C., Kohl, M., Akopov, N., Alarcon, R., Ates, O., Avetisyan, A., Beck, R., Belostotski, S., Bessuille, J., Brinker, F., Calarco, J.R., Carassiti, V., Cisbani, E., Ciullo, G., Contalbrigo, M., De Leo, R., Diefenbach, J., Donnelly, T.W., Dow, K., Elbakian, G., Eversheim, P.D., Frullani, S., Funke, C., Gavrilov, G., Gläser, B., Görrissen, N., Hasell, D.K., Hauschildt, J., Hoffmeister, P., Holler, Y., Ihloff, E., Izotov, A., Kaiser, R., Karyan, G., Kelsey, J., Kiselev, A., Klassen, P., Krivshich, A., Lehmann, I., Lenisa, P., Lenz, D., Lumsden, S., Ma, Y., Maas, F., Marukyan, H., Miklukho, O., Milner, R.G., Movsisyan, A., Murray, M., Naryshkin, Y., Perez Benito, R., Perrino, R., Redwine, R.P., Rodríguez Piñeiro, D., Rosner, G., Schneekloth, U., Seitz, B., Statera, M., Thiel, A., Vardanyan, H., Veretennikov, D., Vidal, C., Winnebeck, A., Yeganov, V.","Hard Two-Photon Contribution to Elastic Lepton-Proton Scattering Determined by the OLYMPUS Experiment",2017,"Physical Review Letters","118","9", 092501,"","",,7,10.1103/PhysRevLett.118.092501,"https://www.scopus.com/inward/record.uri?eid=2-s2.0-85014516545&doi=10.1103%2fPhysRevLett.118.092501&partnerID=40&md5=9b622e1aa9aa7fc6a08f9ade580ab6df",Article,Scopus,2-s2.0-85014516545
"Adamczyk, L., Adkins, J.K., Agakishiev, G., Aggarwal, M.M., Ahammed, Z., Alakhverdyants, A.V., Alekseev, I., Alford, J., Anson, C.D., Arkhipkin, D., Aschenauer, E., Averichev, G.S., Balewski, J., Banerjee, A., Barnovska, Z., Beavis, D.R., Bellwied, R., Betancourt, M.J., Betts, R.R., Bhasin, A., Bhati, A.K., Bichsel, H., Bielcik, J., Bielcikova, J., Bland, L.C., Bordyuzhin, I.G., Borowski, W., Bouchet, J., Brandin, A.V., Brovko, S.G., Bruna, E., Bültmann, S., Bunzarov, I., Burton, T.P., Butterworth, J., Cai, X.Z., Caines, H., Calderón De La Barca Sánchez, M., Cebra, D., Cendejas, R., Cervantes, M.C., Chaloupka, P., Chang, Z., Chattopadhyay, S., Chen, H.F., Chen, J.H., Chen, J.Y., Chen, L., Cheng, J., Cherney, M., Chikanian, A., Christie, W., Chung, P., Chwastowski, J., Codrington, M.J.M., Corliss, R., Cramer, J.G., Crawford, H.J., Cui, X., Das, S., Davila Leyva, A., De Silva, L.C., Debbe, R.R., Dedovich, T.G., Deng, J., Derradi De Souza, R., Dhamija, S., Didenko, L., Ding, F., Dion, A., Djawotho, P., Dong, X., Drachenberg, J.L., Draper, J.E., Du, C.M., Dunkelberger, L.E., Dunlop, J.C., Efimov, L.G., Elnimr, M., Engelage, J., Eppley, G., Eun, L., Evdokimov, O., Fatemi, R., Fazio, S., Fedorisin, J., Fersch, R.G., Filip, P., Finch, E., Fisyak, Y., Flores, E., Gagliardi, C.A., Gangadharan, D.R., Garand, D., Geurts, F., Gibson, A., Gliske, S., Gorbunov, Y.N., Grebenyuk, O.G., Grosnick, D., Gupta, A., Gupta, S., Guryn, W., Haag, B., Hajkova, O., Hamed, A., Han, L.-X., Harris, J.W., Hays-Wehle, J.P., Heppelmann, S., Hirsch, A., Hoffmann, G.W., Hofman, D.J., Horvat, S., Huang, B., Huang, H.Z., Huck, P., Humanic, T.J., Igo, G., Jacobs, W.W., Jena, C., Judd, E.G., Kabana, S., Kang, K., Kapitan, J., Kauder, K., Ke, H.W., Keane, D., Kechechyan, A., Kesich, A., Kikola, D.P., Kiryluk, J., Kisel, I., Kisiel, A., Kizka, V., Koetke, D.D., Kollegger, T., Konzer, J., Koralt, I., Koroleva, L., Korsch, W., Kotchenda, L., Kravtsov, P., Krueger, K., Kulakov, I., Kumar, L., Lamont, M.A.C., Landgraf, J.M., Landry, K.D., Lapointe, S., Lauret, J., Lebedev, A., Lednicky, R., Lee, J.H., Leight, W., Levine, M.J., Li, C., Li, W., Li, X., Li, X., Li, Y., Li, Z.M., Lima, L.M., Lisa, M.A., Liu, F., Ljubicic, T., Llope, W.J., Longacre, R.S., Lu, Y., Luo, X., Luszczak, A., Ma, G.L., Ma, Y.G., Madagodagettige Don, D.M.M.D., Mahapatra, D.P., Majka, R., Margetis, S., Markert, C., Masui, H., Matis, H.S., McDonald, D., McShane, T.S., Mioduszewski, S., Mitrovski, M.K., Mohammed, Y., Mohanty, B., Mondal, M.M., Morozov, B., Munhoz, M.G., Mustafa, M.K., Naglis, M., Nandi, B.K., Nasim, M., Nayak, T.K., Nelson, J.M., Nogach, L.V., Novak, J., Odyniec, G., Ogawa, A., Oh, K., Ohlson, A., Okorokov, V., Oldag, E.W., Oliveira, R.A.N., Olson, D., Ostrowski, P., Pachr, M., Page, B.S., Pal, S.K., Pan, Y.X., Pandit, Y., Panebratsev, Y., Pawlak, T., Pawlik, B., Pei, H., Perkins, C., Peryt, W., Pile, P., Planinic, M., Pluta, J., Poljak, N., Porter, J., Powell, C.B., Pruthi, N.K., Przybycien, M., Pujahari, P.R., Putschke, J., Qiu, H., Ramachandran, S., Raniwala, R., Raniwala, S., Ray, R.L., Redwine, R., Riley, C.K., Ritter, H.G., Roberts, J.B., Rogachevskiy, O.V., Romero, J.L., Ross, J.F., Ruan, L., Rusnak, J., Sahoo, N.R., Sahu, P.K., Sakrejda, I., Salur, S., Sandacz, A., Sandweiss, J., Sangaline, E., Sarkar, A., Schambach, J., Scharenberg, R.P., Schmah, A.M., Schmidke, B., Schmitz, N., Schuster, T.R., Seele, J., Seger, J., Selyuzhenkov, I., Seyboth, P., Shah, N., Shahaliev, E., Shao, M., Sharma, B., Sharma, M., Shi, S.S., Shou, Q.Y., Sichtermann, E.P., Singaraju, R.N., Skoby, M.J., Smirnov, D., Smirnov, N., Solanki, D., Sorensen, P., Desouza, U.G., Spinka, H.M., Srivastava, B., Stanislaus, T.D.S., Steadman, S.G., Stevens, J.R., Stock, R., Strikhanov, M., Stringfellow, B., Suaide, A.A.P., Suarez, M.C., Sumbera, M., Sun, X.M., Sun, Y., Sun, Z., Surrow, B., Svirida, D.N., Symons, T.J.M., Szanto De Toledo, A., Takahashi, J., Tang, A.H., Tang, Z., Tarini, L.H., Tarnowsky, T., Thomas, J.H., Tian, J., Timmins, A.R., Tlusty, D., Tokarev, M., Trentalange, S., Tribble, R.E., Tribedy, P., Trzeciak, B.A., Tsai, O.D., Turnau, J., Ullrich, T., Underwood, D.G., Van Buren, G., Van Nieuwenhuizen, G., Vanfossen Jr., J.A., Varma, R., Vasconcelos, G.M.S., Videbæk, F., Viyogi, Y.P., Vokal, S., Vossen, A., Wada, M., Wang, F., Wang, H., Wang, J.S., Wang, Q., Wang, X.L., Wang, Y., Webb, G., Webb, J.C., Westfall, G.D., Whitten Jr., C., Wieman, H., Wissink, S.W., Witt, R., Wu, Y.F., Xiao, Z., Xie, W., Xin, K., Xu, H., Xu, N., Xu, Q.H., Xu, W., Xu, Y., Xu, Z., Xue, L., Yang, Y., Yang, Y., Yepes, P., Yi, L., Yip, K., Yoo, I.-K., Zawisza, M., Zbroszczyk, H., Zhang, J.B., Zhang, S., Zhang, X.P., Zhang, Y., Zhang, Z.P., Zhao, F., Zhao, J., Zhong, C., Zhu, X., Zhu, Y.H., Zoulkarneeva, Y., Zyzak, M.","Measurement of charge multiplicity asymmetry correlations in high-energy nucleus-nucleus collisions at sNN =200 GeV",2014,"Physical Review C - Nuclear Physics","89","4", 044908,"","",,15,10.1103/PhysRevC.89.044908,"https://www.scopus.com/inward/record.uri?eid=2-s2.0-84899752374&doi=10.1103%2fPhysRevC.89.044908&partnerID=40&md5=c08285fc798f95897fe2e4d5db01fbdb",Article,Scopus,2-s2.0-84899752374
"Agakishiev, H., Aggarwal, M.M., Ahammed, Z., Alakhverdyants, A.V., Alekseev, I., Alford, J., Anderson, B.D., Anson, C.D., Arkhipkin, D., Averichev, G.S., Balewski, J., Beavis, D.R., Behera, N.K., Bellwied, R., Betancourt, M.J., Betts, R.R., Bhasin, A., Bhati, A.K., Bichsel, H., Bielcik, J., Bielcikova, J., Biritz, B., Bland, L.C., Borowski, W., Bouchet, J., Braidot, E., Brandin, A.V., Bridgeman, A., Brovko, S.G., Bruna, E., Bueltmann, S., Bunzarov, I., Burton, T.P., Cai, X.Z., Caines, H., De La Barca Sánchez, M.C., Cebra, D., Cendejas, R., Cervantes, M.C., Chajecki, Z., Chaloupka, P., Chattopadhyay, S., Chen, H.F., Chen, J.H., Chen, J.Y., Chen, L., Cheng, J., Cherney, M., Chikanian, A., Choi, K.E., Christie, W., Chung, P., Codrington, M.J.M., Corliss, R., Cramer, J.G., Crawford, H.J., Dash, S., Leyva, A.D., De Silva, L.C., Debbe, R.R., Dedovich, T.G., Derevschikov, A.A., De Souza, R.D., Didenko, L., Djawotho, P., Dogra, S.M., Dong, X., Drachenberg, J.L., Draper, J.E., Dunlop, J.C., Efimov, L.G., Elnimr, M., Engelage, J., Eppley, G., Estienne, M., Eun, L., Evdokimov, O., Fatemi, R., Fedorisin, J., Feng, A., Fersch, R.G., Filip, P., Finch, E., Fine, V., Fisyak, Y., Gagliardi, C.A., Gangadharan, D.R., Geromitsos, A., Geurts, F., Ghosh, P., Gorbunov, Y.N., Gordon, A., Grebenyuk, O., Grosnick, D., Guertin, S.M., Gupta, A., Guryn, W., Haag, B., Hajkova, O., Hamed, A., Han, L.-X., Harris, J.W., Hays-Wehle, J.P., Heinz, M., Heppelmann, S., Hirsch, A., Hjort, E., Hoffmann, G.W., Hofman, D.J., Huang, B., Huang, H.Z., Humanic, T.J., Huo, L., Igo, G., Jacobs, P., Jacobs, W.W., Jena, C., Jin, F., Joseph, J., Judd, E.G., Kabana, S., Kang, K., Kapitan, J., Kauder, K., Ke, H., Keane, D., Kechechyan, A., Kettler, D., Kikola, D.P., Kiryluk, J., Kisiel, A., Kizka, V., Knospe, A.G., Koetke, D.D., Kollegger, T., Konzer, J., Koralt, I., Koroleva, L., Korsch, W., Kotchenda, L., Kouchpil, V., Kravtsov, P., Krueger, K., Krus, M., Kumar, L., Kurnadi, P., Lamont, M.A.C., Landgraf, J.M., Lapointe, S., Lauret, J., Lebedev, A., Lednicky, R., Lee, J.H., Leight, W., Levine, M.J., Li, C., Li, L., Li, N., Li, W., Li, X., Li, X., Li, Y., Li, Z.M., Lisa, M.A., Liu, F., Liu, H., Liu, J., Ljubicic, T., Llope, W.J., Longacre, R.S., Love, W.A., Lu, Y., Lukashov, E.V., Luo, X., Ma, G.L., Ma, Y.G., Mahapatra, D.P., Majka, R., Mall, O.I., Mangotra, L.K., Manweiler, R., Margetis, S., Markert, C., Masui, H., Matis, H.S., Matulenko, Y.A., McDonald, D., McShane, T.S., Meschanin, A., Milner, R., Minaev, N.G., Mioduszewski, S., Mischke, A., Mitrovski, M.K., Mohanty, B., Mondal, M.M., Morozov, B., Morozov, D.A., Munhoz, M.G., Naglis, M., Nandi, B.K., Nayak, T.K., Netrakanti, P.K., Nogach, L.V., Nurushev, S.B., Odyniec, G., Ogawa, A., Oh, K., Ohlson, A., Okorokov, V., Oldag, E.W., Olson, D., Pachr, M., Page, B.S., Pal, S.K., Pandit, Y., Panebratsev, Y., Pawlak, T., Pei, H., Peitzmann, T., Perkins, C., Peryt, W., Phatak, S.C., Pile, P., Planinic, M., Ploskon, M.A., Pluta, J., Plyku, D., Poljak, N., Poskanzer, A.M., Potukuchi, B.V.K.S., Powell, C.B., Prindle, D., Pruthi, N.K., Pujahari, P.R., Putschke, J., Qiu, H., Raniwala, R., Raniwala, S., Redwine, R., Reed, R., Ritter, H.G., Roberts, J.B., Rogachevskiy, O.V., Romero, J.L., Rose, A., Ruan, L., Rusnak, J., Sahoo, N.R., Sakai, S., Sakrejda, I., Sakuma, T., Salur, S., Sandweiss, J., Sangaline, E., Sarkar, A., Schambach, J., Scharenberg, R.P., Schmah, A.M., Schmitz, N., Schuster, T.R., Seele, J., Seger, J., Selyuzhenkov, I., Seyboth, P., Shahaliev, E., Shao, M., Sharma, M., Shi, S.S., Shou, Q.Y., Sichtermann, E.P., Simon, F., Singaraju, R.N., Skoby, M.J., Smirnov, N., Spinka, H.M., Srivastava, B., Stanislaus, T.D.S., Staszak, D., Steadman, S.G., Stevens, J.R., Stock, R., Strikhanov, M., Stringfellow, B., Suaide, A.A.P., Suarez, M.C., Subba, N.L., Sumbera, M., Sun, X.M., Sun, Y., Sun, Z., Surrow, B., Svirida, D.N., Symons, T.J.M., De Toledo, A.S., Takahashi, J., Tang, A.H., Tang, Z., Tarini, L.H., Tarnowsky, T., Thein, D., Thomas, J.H., Tian, J., Timmins, A.R., Tlusty, D., Tokarev, M., Tram, V.N., Trentalange, S., Tribble, R.E., Tribedy, P., Tsai, O.D., Ullrich, T., Underwood, D.G., Van Buren, G., Van Nieuwenhuizen, G., Vanfossen, J.A., Varma, R., Vasconcelos, G.M.S., Vasiliev, A.N., Videbæk, F., Viyogi, Y.P., Vokal, S., Wada, M., Walker, M., Wang, F., Wang, G., Wang, H., Wang, J.S., Wang, Q., Wang, X.L., Wang, Y., Webb, G., Webb, J.C., Westfall, G.D., Whitten, C., Wieman, H., Wissink, S.W., Witt, R., Witzke, W., Wu, Y.F., Xiao, Z., Xie, W., Xu, H., Xu, N., Xu, Q.H., Xu, W., Xu, Y., Xu, Z., Xue, L., Yang, Y., Yepes, P., Yip, K., Yoo, I.-K., Zawisza, M., Zbroszczyk, H., Zhan, W., Zhang, J.B., Zhang, S., Zhang, W.M., Zhang, X.P., Zhang, Y., Zhang, Z.P., Zhao, J., Zhong, C., Zhou, W., Zhu, X., Zhu, Y.H., Zoulkarneev, R., Zoulkarneeva, Y.","Event-plane-dependent dihadron correlations with harmonic vn subtraction in Au + Au collisions at s NN =200 GeV",2014,"Physical Review C - Nuclear Physics","89","4", 041901,"","",,3,10.1103/PhysRevC.89.041901,"https://www.scopus.com/inward/record.uri?eid=2-s2.0-84899717564&doi=10.1103%2fPhysRevC.89.041901&partnerID=40&md5=536b50a3bc215b75d45e8f2a7696efa3",Article,Scopus,2-s2.0-84899717564
"Milner, R., Hasell, D.K., Kohl, M., Schneekloth, U., Akopov, N., Alarcon, R., Andreev, V.A., Ates, O., Avetisyan, A., Bayadilov, D., Beck, R., Belostotski, S., Bernauer, J.C., Bessuille, J., Brinker, F., Buck, B., Calarco, J.R., Carassiti, V., Cisbani, E., Ciullo, G., Contalbrigo, M., D'Ascenzo, N., De Leo, R., Diefenbach, J., Donnelly, T.W., Dow, K., Elbakian, G., Eversheim, D., Frullani, S., Funke, C., Gavrilov, G., Gläser, B., Görrissen, N., Hauschildt, J., Henderson, B.S., Hoffmeister, P., Holler, Y., Ice, L.D., Izotov, A., Kaiser, R., Karyan, G., Kelsey, J., Khaneft, D., Klassen, P., Kiselev, A., Krivshich, A., Lehmann, I., Lenisa, P., Lenz, D., Lumsden, S., Ma, Y., Maas, F., Marukyan, H., Miklukho, O., Movsisyan, A., Murray, M., Naryshkin, Y., O'Connor, C., Perez Benito, R., Perrino, R., Redwine, R.P., Rodríguez Piñeiro, D., Rosner, G., Russell, R.L., Schmidt, A., Seitz, B., Statera, M., Thiel, A., Vardanyan, H., Veretennikov, D., Vidal, C., Winnebeck, A., Yeganov, V.","The OLYMPUS experiment",2014,"Nuclear Instruments and Methods in Physics Research, Section A: Accelerators, Spectrometers, Detectors and Associated Equipment","741",,,"1","17",,23,10.1016/j.nima.2013.12.035,"https://www.scopus.com/inward/record.uri?eid=2-s2.0-84892532449&doi=10.1016%2fj.nima.2013.12.035&partnerID=40&md5=8a406d949267cca67d6e19664b1b539b",Article,Scopus,2-s2.0-84892532449
"Adamczyk, L., Adkins, J.K., Agakishiev, G., Aggarwal, M.M., Ahammed, Z., Alakhverdyants, A.V., Alekseev, I., Alford, J., Anson, C.D., Arkhipkin, D., Aschenauer, E., Averichev, G.S., Balewski, J., Banerjee, A., Barnovska, Z., Beavis, D.R., Bellwied, R., Betancourt, M.J., Betts, R.R., Bhasin, A., Bhati, A.K., Bichsel, H., Bielcik, J., Bielcikova, J., Bland, L.C., Bordyuzhin, I.G., Borowski, W., Bouchet, J., Brandin, A.V., Brovko, S.G., Bruna, E., Bültmann, S., Bunzarov, I., Burton, T.P., Butterworth, J., Cai, X.Z., Caines, H., Calderón De La Barca Sánchez, M., Cebra, D., Cendejas, R., Cervantes, M.C., Chaloupka, P., Chang, Z., Chattopadhyay, S., Chen, H.F., Chen, J.H., Chen, J.Y., Chen, L., Cheng, J., Cherney, M., Chikanian, A., Christie, W., Chung, P., Chwastowski, J., Codrington, M.J.M., Corliss, R., Cramer, J.G., Crawford, H.J., Cui, X., Das, S., Davila Leyva, A., De Silva, L.C., Debbe, R.R., Dedovich, T.G., Deng, J., Derradi De Souza, R., Dhamija, S., Didenko, L., Ding, F., Dion, A., Djawotho, P., Dong, X., Drachenberg, J.L., Draper, J.E., Du, C.M., Dunkelberger, L.E., Dunlop, J.C., Efimov, L.G., Elnimr, M., Engelage, J., Eppley, G., Eun, L., Evdokimov, O., Fatemi, R., Fazio, S., Fedorisin, J., Fersch, R.G., Filip, P., Finch, E., Fisyak, Y., Flores, E., Gagliardi, C.A., Gangadharan, D.R., Garand, D., Geurts, F., Gibson, A., Gliske, S., Gorbunov, Y.N., Grebenyuk, O.G., Grosnick, D., Gupta, A., Gupta, S., Guryn, W., Haag, B., Hajkova, O., Hamed, A., Han, L.-X., Harris, J.W., Hays-Wehle, J.P., Heppelmann, S., Hirsch, A., Hoffmann, G.W., Hofman, D.J., Horvat, S., Huang, B., Huang, H.Z., Huck, P., Humanic, T.J., Igo, G., Jacobs, W.W., Jena, C., Judd, E.G., Kabana, S., Kang, K., Kapitan, J., Kauder, K., Ke, H.W., Keane, D., Kechechyan, A., Kesich, A., Kikola, D.P., Kiryluk, J., Kisel, I., Kisiel, A., Kizka, V., Klein, S.R., Koetke, D.D., Kollegger, T., Konzer, J., Koralt, I., Koroleva, L., Korsch, W., Kotchenda, L., Kravtsov, P., Krueger, K., Kulakov, I., Kumar, L., Lamont, M.A.C., Landgraf, J.M., Landry, K.D., Lapointe, S., Lauret, J., Lebedev, A., Lednicky, R., Lee, J.H., Leight, W., Levine, M.J., Li, C., Li, W., Li, X., Li, X., Li, Y., Li, Z.M., Lima, L.M., Lisa, M.A., Liu, F., Ljubicic, T., Llope, W.J., Longacre, R.S., Lu, Y., Luo, X., Luszczak, A., Ma, G.L., Ma, Y.G., Madagodagettige Don, D.M.M.D., Mahapatra, D.P., Majka, R., Margetis, S., Markert, C., Masui, H., Matis, H.S., McDonald, D., McShane, T.S., Mioduszewski, S., Mitrovski, M.K., Mohammed, Y., Mohanty, B., Mondal, M.M., Morozov, B., Munhoz, M.G., Mustafa, M.K., Naglis, M., Nandi, B.K., Nasim, M., Nayak, T.K., Nelson, J.M., Nogach, L.V., Novak, J., Odyniec, G., Ogawa, A., Oh, K., Ohlson, A., Okorokov, V., Oldag, E.W., Oliveira, R.A.N., Olson, D., Ostrowski, P., Pachr, M., Page, B.S., Pal, S.K., Pan, Y.X., Pandit, Y., Panebratsev, Y., Pawlak, T., Pawlik, B., Pei, H., Perkins, C., Peryt, W., Pile, P., Planinic, M., Pluta, J., Poljak, N., Porter, J., Poskanzer, A.M., Powell, C.B., Pruneau, C., Pruthi, N.K., Przybycien, M., Pujahari, P.R., Putschke, J., Qiu, H., Quintero, A., Ramachandran, S., Raniwala, R., Raniwala, S., Redwine, R., Riley, C.K., Ritter, H.G., Roberts, J.B., Rogachevskiy, O.V., Romero, J.L., Ross, J.F., Ruan, L., Rusnak, J., Sahoo, N.R., Sahu, P.K., Sakrejda, I., Salur, S., Sandacz, A., Sandweiss, J., Sangaline, E., Sarkar, A., Schambach, J., Scharenberg, R.P., Schmah, A.M., Schmidke, B., Schmitz, N., Schuster, T.R., Seele, J., Seger, J., Seyboth, P., Shah, N., Shahaliev, E., Shao, M., Sharma, B., Sharma, M., Shi, S.S., Shou, Q.Y., Sichtermann, E.P., Singaraju, R.N., Skoby, M.J., Smirnov, D., Smirnov, N., Solanki, D., Sorensen, P., Desouza, U.G., Spinka, H.M., Srivastava, B., Stanislaus, T.D.S., Steadman, S.G., Stevens, J.R., Stock, R., Strikhanov, M., Stringfellow, B., Suaide, A.A.P., Suarez, M.C., Sumbera, M., Sun, X.M., Sun, Y., Sun, Z., Surrow, B., Svirida, D.N., Symons, T.J.M., Szanto De Toledo, A., Takahashi, J., Tang, A.H., Tang, Z., Tarini, L.H., Tarnowsky, T., Thomas, J.H., Tian, J., Timmins, A.R., Tlusty, D., Tokarev, M., Trentalange, S., Tribble, R.E., Tribedy, P., Trzeciak, B.A., Tsai, O.D., Turnau, J., Ullrich, T., Underwood, D.G., Van Buren, G., Van Nieuwenhuizen, G., Vanfossen, J.A., Varma, R., Vasconcelos, G.M.S., Videbæk, F., Viyogi, Y.P., Vokal, S., Voloshin, S.A., Vossen, A., Wada, M., Wang, F., Wang, G., Wang, H., Wang, J.S., Wang, Q., Wang, X.L., Wang, Y., Webb, G., Webb, J.C., Westfall, G.D., Whitten, C., Wieman, H., Wissink, S.W., Witt, R., Wu, Y.F., Xiao, Z., Xie, W., Xin, K., Xu, H., Xu, N., Xu, Q.H., Xu, W., Xu, Y., Xu, Z., Xue, L., Yang, Y., Yang, Y., Yepes, P., Yi, L., Yip, K., Yoo, I.-K., Zawisza, M., Zbroszczyk, H., Zhang, J.B., Zhang, S., Zhang, X.P., Zhang, Y., Zhang, Z.P., Zhao, F., Zhao, J., Zhong, C., Zhu, X., Zhu, Y.H., Zoulkarneeva, Y., Zyzak, M.","Third harmonic flow of charged particles in Au + Au collisions at √s<inf>NN</inf>=200 GeV",2013,"Physical Review C - Nuclear Physics","88","1", 014904,"","",,61,10.1103/PhysRevC.88.014904,"https://www.scopus.com/inward/record.uri?eid=2-s2.0-84881178243&doi=10.1103%2fPhysRevC.88.014904&partnerID=40&md5=2a5766b95dd5fe95753a5528661dba74",Article,Scopus,2-s2.0-84881178243
"Adamczyk, L., Adkins, J.K., Agakishiev, G., Aggarwal, M.M., Ahammed, Z., Alekseev, I., Alford, J., Anson, C.D., Aparin, A., Arkhipkin, D., Aschenauer, E., Averichev, G.S., Balewski, J., Banerjee, A., Barnovska, Z., Beavis, D.R., Bellwied, R., Betancourt, M.J., Betts, R.R., Bhasin, A., Bhati, A.K., Bhattarai, Bichsel, H., Bielcik, J., Bielcikova, J., Bland, L.C., Bordyuzhin, I.G., Borowski, W., Bouchet, J., Brandin, A.V., Brovko, S.G., Bruna, E., Bültmann, S., Bunzarov, I., Burton, T.P., Butterworth, J., Cai, X.Z., Caines, H., Calderón De La Barca Sánchez, M., Cebra, D., Cendejas, R., Cervantes, M.C., Chaloupka, P., Chang, Z., Chattopadhyay, S., Chen, H.F., Chen, J.H., Chen, J.Y., Chen, L., Cheng, J., Cherney, M., Chikanian, A., Christie, W., Chung, P., Chwastowski, J., Codrington, M.J.M., Corliss, R., Cramer, J.G., Crawford, H.J., Cui, X., Das, S., Davila Leyva, A., De Silva, L.C., Debbe, R.R., Dedovich, T.G., Deng, J., Derradi De Souza, R., Dhamija, S., Di Ruzza, B., Didenko, L., Ding, F., Dion, A., Djawotho, P., Dong, X., Drachenberg, J.L., Draper, J.E., Du, C.M., Dunkelberger, L.E., Dunlop, J.C., Efimov, L.G., Elnimr, M., Engelage, J., Eppley, G., Eun, L., Evdokimov, O., Fatemi, R., Fazio, S., Fedorisin, J., Fersch, R.G., Filip, P., Finch, E., Fisyak, Y., Flores, E., Gagliardi, C.A., Gangadharan, D.R., Garand, D., Geurts, F., Gibson, A., Gliske, S., Grebenyuk, O.G., Grosnick, D., Gupta, A., Gupta, S., Guryn, W., Haag, B., Hajkova, O., Hamed, A., Han, L.-X., Harris, J.W., Hays-Wehle, J.P., Heppelmann, S., Hirsch, A., Hoffmann, G.W., Hofman, D.J., Horvat, S., Huang, B., Huang, H.Z., Huck, P., Humanic, T.J., Igo, G., Jacobs, W.W., Jena, C., Judd, E.G., Kabana, S., Kang, K., Kapitan, J., Kauder, K., Ke, H.W., Keane, D., Kechechyan, A., Kesich, A., Kikola, D.P., Kiryluk, J., Kisel, I., Kisiel, A., Klein, S.R., Koetke, D.D., Kollegger, T., Konzer, J., Koralt, I., Korsch, W., Kotchenda, L., Kravtsov, P., Krueger, K., Kulakov, I., Kumar, L., Lamont, M.A.C., Landgraf, J.M., Landry, K.D., Lapointe, S., Lauret, J., Lebedev, A., Lednicky, R., Lee, J.H., Leight, W., Levine, M.J., Li, C., Li, W., Li, X., Li, X., Li, Y., Li, Z.M., Lima, L.M., Lisa, M.A., Liu, F., Ljubicic, T., Llope, W.J., Longacre, R.S., Lu, Y., Luo, X., Luszczak, A., Ma, G.L., Ma, Y.G., Madagodagettige Don, D.M.M.D., Mahapatra, D.P., Majka, R., Margetis, S., Markert, C., Masui, H., Matis, H.S., McDonald, D., McShane, T.S., Mioduszewski, S., Mitrovski, M.K., Mohammed, Y., Mohanty, B., Mondal, M.M., Munhoz, M.G., Mustafa, M.K., Naglis, M., Nandi, B.K., Nasim, M., Nayak, T.K., Nelson, J.M., Nogach, L.V., Novak, J., Odyniec, G., Ogawa, A., Oh, K., Ohlson, A., Okorokov, V., Oldag, E.W., Oliveira, R.A.N., Olson, D., Pachr, M., Page, B.S., Pal, S.K., Pan, Y.X., Pandit, Y., Panebratsev, Y., Pawlak, T., Pawlik, B., Pei, H., Perkins, C., Peryt, W., Pile, P., Planinic, M., Pluta, J., Poljak, N., Porter, J., Poskanzer, A.M., Powell, C.B., Pruneau, C., Pruthi, N.K., Przybycien, M., Pujahari, P.R., Putschke, J., Qiu, H., Ramachandran, S., Raniwala, R., Raniwala, S., Ray, R.L., Redwine, R., Riley, C.K., Ritter, H.G., Roberts, J.B., Rogachevskiy, O.V., Romero, J.L., Ross, J.F., Ruan, L., Rusnak, J., Sahoo, N.R., Sahu, P.K., Sakrejda, I., Salur, S., Sandacz, A., Sandweiss, J., Sangaline, E., Sarkar, A., Schambach, J., Scharenberg, R.P., Schmah, A.M., Schmidke, B., Schmitz, N., Schuster, T.R., Seele, J., Seger, J., Seyboth, P., Shah, N., Shahaliev, E., Shao, M., Sharma, B., Sharma, M., Shi, S.S., Shou, Q.Y., Sichtermann, E.P., Singaraju, R.N., Skoby, M.J., Smirnov, D., Smirnov, N., Solanki, D., Sorensen, P., Desouza, U.G., Spinka, H.M., Srivastava, B., Stanislaus, T.D.S., Steadman, S.G., Stevens, J.R., Stock, R., Strikhanov, M., Stringfellow, B., Suaide, A.A.P., Suarez, M.C., Sumbera, M., Sun, X.M., Sun, Y., Sun, Z., Surrow, B., Svirida, D.N., Symons, T.J.M., Szanto De Toledo, A., Takahashi, J., Tang, A.H., Tang, Z., Tarini, L.H., Tarnowsky, T., Thomas, J.H., Tian, J., Timmins, A.R., Tlusty, D., Tokarev, M., Trentalange, S., Tribble, R.E., Tribedy, P., Trzeciak, B.A., Tsai, O.D., Turnau, J., Ullrich, T., Underwood, D.G., Van Buren, G., Van Nieuwenhuizen, G., Vanfossen, J.A., Varma, R., Vasconcelos, G.M.S., Videbæk, F., Viyogi, Y.P., Vokal, S., Voloshin, S.A., Vossen, A., Wada, M., Wang, F., Wang, G., Wang, H., Wang, J.S., Wang, Q., Wang, X.L., Wang, Y., Webb, G., Webb, J.C., Westfall, G.D., Whitten, C., Wieman, H., Wissink, S.W., Witt, R., Wu, Y.F., Xiao, Z., Xie, W., Xin, K., Xu, H., Xu, N., Xu, Q.H., Xu, W., Xu, Y., Xu, Z., Xue, L., Yang, Y., Yang, Y., Yepes, P., Yi, L., Yip, K., Yoo, I.-K., Zawisza, M., Zbroszczyk, H., Zhang, J.B., Zhang, S., Zhang, X.P., Zhang, Y., Zhang, Z.P., Zhao, F., Zhao, J., Zhong, C., Zhu, X., Zhu, Y.H., Zoulkarneeva, Y., Zyzak, M.","System-size dependence of transverse momentum correlations at √s <inf>NN</inf>=62.4 and 200 GeV at the BNL Relativistic Heavy Ion Collider",2013,"Physical Review C - Nuclear Physics","87","6", 064902,"","",,3,10.1103/PhysRevC.87.064902,"https://www.scopus.com/inward/record.uri?eid=2-s2.0-84879679171&doi=10.1103%2fPhysRevC.87.064902&partnerID=40&md5=7e166048f89421c8683973bc4d865823",Article,Scopus,2-s2.0-84879679171
