Authors,Title,Year,Source title,Volume,Issue,Art. No.,Page start,Page end,Page count,Cited by,DOI,Link,Document Type,Source,EID
"Abelev, B.I., Aggarwal, M.M., Ahammed, Z., Anderson, B.D., Arkhipkin, D., Averichev, G.S., Bai, Y., Balewski, J., Barannikova, O., Barnby, L.S., Baudot, J., Baumgart, S., Beavis, D.R., Bellwied, R., Benedosso, F., Betancourt, M.J., Betts, R.R., Bharadwaj, S., Bhasin, A., Bhati, A.K., Bichsel, H., Bielcik, J., Bielcikova, J., Biritz, B., Bland, L.C., Bombara, M., Bonner, B.E., Botje, M., Bouchet, J., Braidot, E., Brandin, A.V., Bruna, E., Bueltmann, S., Burton, T.P., Bystersky, M., Cai, X.Z., Caines, H., Calderón de la Barca Sánchez, M., Callner, J., Catu, O., Cebra, D., Cendejas, R., Cervantes, M.C., Chajecki, Z., Chaloupka, P., Chattopadhyay, S., Chen, H.F., Chen, J.H., Chen, J.Y., Cheng, J., Cherney, M., Chikanian, A., Choi, K.E., Christie, W., Chung, S.U., Clarke, R.F., Codrington, M.J., Coffin, J.P., Corliss, R., Cormier, T.M., Cosentino, M.R., Cramer, J.G., Crawford, H.J., Das, D., Dash, S., Daugherity, M., De Silva, C., Dedovich, T.G., DePhillips, M., Derevschikov, A.A., Derradi de Souza, R., Didenko, L., Djawotho, P., Dogra, S.M., Dong, X., Drachenberg, J.L., Draper, J.E., Du, F., Dunlop, J.C., Dutta Mazumdar, M.R., Edwards, W.R., Efimov, L.G., Elhalhuli, E., Elnimr, M., Emelianov, V., Engelage, J., Eppley, G., Erazmus, B., Estienne, M., Eun, L., Fachini, P., Fatemi, R., Fedorisin, J., Feng, A., Filip, P., Finch, E., Fine, V., Fisyak, Y., Gagliardi, C.A., Gaillard, L., Gangadharan, D.R., Ganti, M.S., Garcia-Solis, E., Ghazikhanian, V., Ghosh, P., Gorbunov, Y.N., Gordon, A., Grebenyuk, O., Grosnick, D., Grube, B., Guertin, S.M., Guimaraes, K.S.F.F., Gupta, A., Gupta, N., Guryn, W., Haag, B., Hallman, T.J., Hamed, A., Harris, J.W., He, W., Heinz, M., Hepplemann, S., Hippolyte, B., Hirsch, A., Hjort, E., Hoffman, A.M., Hoffmann, G.W., Hofman, D.J., Hollis, R.S., Huang, H.Z., Humanic, T.J., Igo, G., Iordanova, A., Jacobs, P., Jacobs, W.W., Jakl, P., Jin, F., Jones, C.L., Jones, P.G., Joseph, J., Judd, E.G., Kabana, S., Kajimoto, K., Kang, K., Kapitan, J., Kaplan, M., Keane, D., Kechechyan, A., Kettler, D., Khodyrev, V.Yu., Kikola, D.P., Kiryluk, J., Kisiel, A., Klein, S.R., Knospe, A.G., Kocoloski, A., Koetke, D.D., Kopytine, M., Kotchenda, L., Kouchpil, V., Kravtsov, P., Kravtsov, V.I., Krueger, K., Krus, M., Kuhn, C., Kumar, L., Kurnadi, P., Lamont, M.A.C., Landgraf, J.M., LaPointe, S., Lauret, J., Lebedev, A., Lednicky, R., Lee, C.-H., Leight, W., LeVine, M.J., Li, C., Li, Y., Lin, G., Lin, X., Lindenbaum, S.J., Lisa, M.A., Liu, F., Liu, H., Liu, J., Liu, L., Ljubicic, T., Llope, W.J., Longacre, R.S., Love, W.A., Lu, Y., Ludlam, T., Lynn, D., Ma, G.L., Ma, Y.G., Mahapatra, D.P., Majka, R., Mall, O.I., Mangotra, L.K., Manweiler, R., Margetis, S., Markert, C., Matis, H.S., Matulenko, Yu.A., McShane, T.S., Meschanin, A., Millner, R., Minaev, N.G., Mioduszewski, S., Mischke, A., Mitchell, J., Mohanty, B., Morozov, D.A., Munhoz, M.G., Nandi, B.K., Nattrass, C., Nayak, T.K., Nelson, J.M., Nepali, C., Netrakanti, P.K., Ng, M.J., Nogach, L.V., Nurushev, S.B., Odyniec, G., Ogawa, A., Okada, H., Okorokov, V., Olson, D., Pachr, M., Page, B.S., Pal, S.K., Pandit, Y., Panebratsev, Y., Pawlak, T., Peitzmann, T., Perevoztchikov, V., Perkins, C., Peryt, W., Phatak, S.C., Planinic, M., Pluta, J., Poljak, N., Poskanzer, A.M., Potukuchi, B.V.K.S., Prindle, D., Pruneau, C., Pruthi, N.K., Putschke, J., Raniwala, R., Raniwala, S., Ray, R.L., Redwine, R., Reed, R., Ridiger, A., Ritter, H.G., Roberts, J.B., Rogachevskiy, O.V., Romero, J.L., Rose, A., Roy, C., Ruan, L., Russcher, M.J., Rykov, V., Sahoo, R., Sakrejda, I., Sakuma, T., Salur, S., Sandweiss, J., Sarsour, M., Savin, I., Schambach, J., Scharenberg, R.P., Schmitz, N., Seger, J., Selyuzhenkov, I., Seyboth, P., Shabetai, A., Shahaliev, E., Shao, M., Sharma, M., Shi, S.S., Shi, X.-H., Sichtermann, E., Simon, F., Singaraju, R.N., Skoby, M.J., Smirnov, N., Snellings, R., Sorensen, P., Sowinski, J., Spinka, H.M., Srivastava, B., Stadnik, A., Stanislaus, T.D.S., Staszak, D., Strikhanov, M., Stringfellow, B., Suaide, A.A.P., Suarez, M.C., Subba, N.L., Sumbera, M., Sun, X.M., Sun, Y., Sun, Z., Surrow, B., Symons, T.J.M., Szanto de Toledo, A., Takahashi, J., Tang, A.H., Tang, Z., Tarnowsky, T., Thein, D., Thomas, J.H., Tian, J., Timmins, A.R., Timoshenko, S., Tlusty, D., Tokarev, M., Trainor, T.A., Tram, V.N., Trattner, A.L., Trentalange, S., Tribble, R.E., Tsai, O.D., Ulery, J., Ullrich, T., Underwood, D.G., Van Buren, G., van Leeuwen, M., Molen, A.M.V., Vanfossen Jr., J.A., Varma, R., Vasconcelos, G.M.S., Vasilevski, I.M., Vasiliev, A.N., Videbaek, F., Vigdor, S.E., Viyogi, Y.P., Vokal, S., Voloshin, S.A., Wada, M., Waggoner, W.T., Walker, M., Wang, F., Wang, G., Wang, J.S., Wang, Q., Wang, X., Wang, X.L., Wang, Y., Webb, J.C., Westfall, G.D., Whitten Jr., C., Wieman, H., Wissink, S.W., Witt, R., Wu, Y., Xu, N., Xu, Q.H., Xu, Y., Xu, Z., Yepes, P., Yoo, I.-K., Yue, Q., Zawisza, M., Zbroszczyk, H., Zhan, W., Zhang, H., Zhang, S., Zhang, W.M., Zhang, Y., Zhang, Z.P., Zhao, Y., Zhong, C., Zhou, J., Zoulkarneev, R., Zoulkarneeva, Y., Zuo, J.X.","Energy and system size dependence of φ{symbol} meson production in Cu + Cu and Au + Au collisions",2009,"Physics Letters, Section B: Nuclear, Elementary Particle and High-Energy Physics","673","3",,"183","191",,59,10.1016/j.physletb.2009.02.037,"https://www.scopus.com/inward/record.uri?eid=2-s2.0-61549120376&doi=10.1016%2fj.physletb.2009.02.037&partnerID=40&md5=7af76a7745a1de5b0a8af0d6c68facad",Article,Scopus,2-s2.0-61549120376
"Abelev, B.I., Aggarwal, M.M., Ahammed, Z., Anderson, B.D., Arkhipkin, D., Averichev, G.S., Bai, Y., Balewski, J., Barannikova, O., Barnby, L.S., Baudot, J., Baumgart, S., Beavis, D.R., Bellwied, R., Benedosso, F., Betancourt, M.J., Betts, R.R., Bhardwaj, S., Bhasin, A., Bhati, A.K., Bichsel, H., Bielcik, J., Bielcikova, J., Biritz, B., Bland, L.C., Bombara, M., Bonner, B.E., Botje, M., Bouchet, J., Braidot, E., Brandin, A.V., Bruna, E., Bueltmann, S., Burton, T.P., Bystersky, M., Cai, X.Z., Caines, H., De La Barca Sánchez, M.C., Callner, J., Catu, O., Cebra, D., Cendejas, R., Cervantes, M.C., Chajecki, Z., Chaloupka, P., Chattopadhyay, S., Chen, H.F., Chen, J.H., Chen, J.Y., Cheng, J., Cherney, M., Chikanian, A., Choi, K.E., Christie, W., Chung, S.U., Clarke, R.F., Codrington, M.J.M., Coffin, J.P., Corliss, R., Cormier, T.M., Cosentino, M.R., Cramer, J.G., Crawford, H.J., Das, D., Dash, S., Daugherity, M., De Silva, C., Dedovich, T.G., Dephillips, M., Derevschikov, A.A., Derradi De Souza, R., Didenko, L., Djawotho, P., Dogra, S.M., Dong, X., Drachenberg, J.L., Draper, J.E., Du, F., Dunlop, J.C., Dutta Mazumdar, M.R., Edwards, W.R., Efimov, L.G., Elhalhuli, E., Elnimr, M., Emelianov, V., Engelage, J., Eppley, G., Erazmus, B., Estienne, M., Eun, L., Fachini, P., Fatemi, R., Fedorisin, J., Feng, A., Filip, P., Finch, E., Fine, V., Fisyak, Y., Gagliardi, C.A., Gaillard, L., Gangadharan, D.R., Ganti, M.S., Garcia-Solis, E., Ghazikhanian, V., Ghosh, P., Gorbunov, Y.N., Gordon, A., Grebenyuk, O., Grosnick, D., Grube, B., Guertin, S.M., Guimaraes, K.S.F.F., Gupta, A., Gupta, N., Guryn, W., Haag, B., Hallman, T.J., Hamed, A., Harris, J.W., He, W., Heinz, M., Heppelmann, S., Hippolyte, B., Hirsch, A., Hjort, E., Hoffman, A.M., Hoffmann, G.W., Hofman, D.J., Hollis, R.S., Huang, H.Z., Humanic, T.J., Igo, G., Iordanova, A., Jacobs, P., Jacobs, W.W., Jakl, P., Jin, F., Jones, C.L., Jones, P.G., Joseph, J., Judd, E.G., Kabana, S., Kajimoto, K., Kang, K., Kapitan, J., Kaplan, M., Keane, D., Kechechyan, A., Kettler, D., Khodyrev, V.Yu., Kikola, D.P., Kiryluk, J., Kisiel, A., Klein, S.R., Knospe, A.G., Kocoloski, A., Koetke, D.D., Kopytine, M., Kotchenda, L., Kouchpil, V., Kravtsov, P., Kravtsov, V.I., Krueger, K., Krus, M., Kuhn, C., Kumar, L., Kurnadi, P., Lamont, M.A.C., Landgraf, J.M., Lapointe, S., Lauret, J., Lebedev, A., Lednicky, R., Lee, C.-H., Leight, W., Levine, M.J., Li, C., Li, N., Li, Y., Lin, G., Lindenbaum, S.J., Lisa, M.A., Liu, F., Liu, H., Liu, J., Liu, L., Ljubicic, T., Llope, W.J., Longacre, R.S., Love, W.A., Lu, Y., Ludlam, T., Lynn, D., Ma, G.L., Ma, Y.G., Mahapatra, D.P., Majka, R., Mall, O.I., Mangotra, L.K., Manweiler, R., Margetis, S., Markert, C., Matis, H.S., Matulenko, Yu.A., McShane, T.S., Meschanin, A., Milner, R., Minaev, N.G., Mioduszewski, S., Mischke, A., Mitchell, J., Mohanty, B., Morozov, D.A., Munhoz, M.G., Nandi, B.K., Nattrass, C., Nayak, T.K., Nelson, J.M., Nepali, C., Netrakanti, P.K., Ng, M.J., Nogach, L.V., Nurushev, S.B., Odyniec, G., Ogawa, A., Okada, H., Okorokov, V., Olson, D., Pachr, M., Page, B.S., Pal, S.K., Pandit, Y., Panebratsev, Y., Pawlak, T., Peitzmann, T., Perevoztchikov, V., Perkins, C., Peryt, W., Phatak, S.C., Planinic, M., Pluta, J., Poljak, N., Poskanzer, A.M., Potukuchi, B.V.K.S., Prindle, D., Pruneau, C., Pruthi, N.K., Putschke, J., Raniwala, R., Raniwala, S., Ray, R.L., Redwine, R., Reed, R., Ridiger, A., Ritter, H.G., Roberts, J.B., Rogachevskiy, O.V., Romero, J.L., Rose, A., Roy, C., Ruan, L., Russcher, M.J., Rykov, V., Sahoo, R., Sakrejda, I., Sakuma, T., Salur, S., Sandweiss, J., Sarsour, M., Schambach, J., Scharenberg, R.P., Schmitz, N., Seger, J., Selyuzhenkov, I., Seyboth, P., Shabetai, A., Shahaliev, E., Shao, M., Sharma, M., Shi, S.S., Shi, X.-H., Sichtermann, E.P., Simon, F., Singaraju, R.N., Skoby, M.J., Smirnov, N., Snellings, R., Sorensen, P., Sowinski, J., Spinka, H.M., Srivastava, B., Stadnik, A., Stanislaus, T.D.S., Staszak, D., Strikhanov, M., Stringfellow, B., Suaide, A.A.P., Suarez, M.C., Subba, N.L., Sumbera, M., Sun, X.M., Sun, Y., Sun, Z., Surrow, B., Symons, T.J.M., Szanto De Toledo, A., Takahashi, J., Tang, A.H., Tang, Z., Tarnowsky, T., Thein, D., Thomas, J.H., Tian, J., Timmins, A.R., Timoshenko, S., Tlusty, D., Tokarev, M., Trainor, T.A., Tram, V.N., Trattner, A.L., Trentalange, S., Tribble, R.E., Tsai, O.D., Ulery, J., Ullrich, T., Underwood, D.G., Van Buren, G., Van Leeuwen, M., Vander Molen, A.M., Vanfossen, J.A., Varma, R., Vasconcelos, G.M.S., Vasilevski, I.M., Vasiliev, A.N., Videbaek, F., Vigdor, S.E., Viyogi, Y.P., Vokal, S., Voloshin, S.A., Wada, M., Waggoner, W.T., Walker, M., Wang, F., Wang, G., Wang, J.S., Wang, Q., Wang, X., Wang, X.L., Wang, Y., Webb, J.C., Westfall, G.D., Whitten, C., Wieman, H., Wissink, S.W., Witt, R., Wu, Y., Xie, W., Xu, N., Xu, Q.H., Xu, Y., Xu, Z., Yepes, P., Yoo, I.-K., Yue, Q., Zawisza, M., Zbroszczyk, H., Zhan, W., Zhang, H., Zhang, S., Zhang, W.M., Zhang, Y., Zhang, Z.P., Zhao, Y., Zhong, C., Zhou, J., Zoulkarneev, R., Zoulkarneeva, Y., Zuo, J.X.","Observation of two-source interference in the photoproduction reaction AuAu→AuAuρ0",2009,"Physical Review Letters","102","11", 112301,"","",,19,10.1103/PhysRevLett.102.112301,"https://www.scopus.com/inward/record.uri?eid=2-s2.0-63049105920&doi=10.1103%2fPhysRevLett.102.112301&partnerID=40&md5=125fc88bb7aece3aa3408e66504c36b0",Article,Scopus,2-s2.0-63049105920
"Geis, E., Kohl, M., Ziskin, V., Akdogan, T., Arenhövel, H., Alarcon, R., Bertozzi, W., Booth, E., Botto, T., Calarco, J., Clasie, B., Crawford, C.B., DeGrush, A., Donnelly, T.W., Dow, K., Farkhondeh, M., Fatemi, R., Filoti, O., Franklin, W., Gao, H., Gilad, S., Hasell, D., Karpius, P., Kolster, H., Lee, T., Maschinot, A., Matthews, J., McIlhany, K., Meitanis, N., Milner, R.G., Rapaport, J., Redwine, R.P., Seely, J., Shinozaki, A., Širca, S., Sindile, A., Six, E., Smith, T., Steadman, M., Tonguc, B., Tschalaer, C., Tsentalovich, E., Turchinetz, W., Xiao, Y., Xu, W., Zhang, C., Zhou, Z., Zwart, T.","Charge form factor of the neutron at low momentum transfer from the H→2(e→,e′n)H1 reaction",2008,"Physical Review Letters","101","4", 042501,"","",,44,10.1103/PhysRevLett.101.042501,"https://www.scopus.com/inward/record.uri?eid=2-s2.0-48849104296&doi=10.1103%2fPhysRevLett.101.042501&partnerID=40&md5=d470235af15ee834b668c308f8bcf8da",Article,Scopus,2-s2.0-48849104296
"Redwine, R.P.","Physics results from the blast detector at the bates accelerator",2007,"Chiral Dynamics 2006 - Proceedings of the 5th International Workshop on Chiral Dynamics, Theory and Experiment, CD 2006",,,,"158","169",,,,"https://www.scopus.com/inward/record.uri?eid=2-s2.0-84892960611&partnerID=40&md5=1c7826e00edaf552d734642644ed6552",Conference Paper,Scopus,2-s2.0-84892960611
"Shu, Q.S., Susta, J., Lu, F.H., Phipps, I., Shi, J.L., Redwine, R.P., Wang, F.H., Wang, D.","High Current, Large Aperture, Low HOM, Single Crystal Nb 2.85GHz Superconducting Cavity",2007,"Proceedings of the IEEE Particle Accelerator Conference",,, 4441287,"2472","2474",,,10.1109/PAC.2007.4441287,"https://www.scopus.com/inward/record.uri?eid=2-s2.0-51349099385&doi=10.1109%2fPAC.2007.4441287&partnerID=40&md5=c839052c7fa687153d88174697bb741d",Conference Paper,Scopus,2-s2.0-51349099385
"Crawford, C.B., Sindile, A., Akdogan, T., Alarcon, R., Bertozzi, W., Booth, E., Botto, T., Calarco, J., Clasie, B., Degrush, A., Donnelly, T.W., Dow, K., Dutta, D., Farkhondeh, M., Fatemi, R., Filoti, O., Franklin, W., Gao, H., Geis, E., Gilad, S., Haeberli, W., Hasell, D., Hersman, W., Holtrop, M., Karpius, P., Kohl, M., Kolster, H., Lee, T., Maschinot, A., Matthews, J., McIlhany, K., Meitanis, N., Milner, R.G., Redwine, R.P., Seely, J., Shinozaki, A., Širca, S., Six, E., Smith, T., Tonguc, B., Tschalaer, C., Tsentalovich, E., Turchinetz, W., Van Den Brand, J.F.J., Van Der Laan, J., Wang, F., Wise, T., Xiao, Y., Xu, W., Zhang, C., Zhou, Z., Ziskin, V., Zwart, T.","Measurement of the proton's electric to magnetic form factor ratio from H→1(e→,e′p)",2007,"Physical Review Letters","98","5", 052301,"","",,89,10.1103/PhysRevLett.98.052301,"https://www.scopus.com/inward/record.uri?eid=2-s2.0-33846699378&doi=10.1103%2fPhysRevLett.98.052301&partnerID=40&md5=c497d6ed4c0212aa3e57d7ac66a6f9be",Article,Scopus,2-s2.0-33846699378
"Lee, T.-S.H., Redwine, R.P.","Pion-nucleus interactions",2002,"Annual Review of Nuclear and Particle Science","52",,,"23","63",,29,10.1146/annurev.nucl.52.050102.090713,"https://www.scopus.com/inward/record.uri?eid=2-s2.0-0036958750&doi=10.1146%2fannurev.nucl.52.050102.090713&partnerID=40&md5=422e70d5bc01d5d2daa13eca53baae47",Review,Scopus,2-s2.0-0036958750
"Airapetian, A., Akopov, N., Akopov, Z., Amarian, M., Aschenauer, E.C., Avakian, H., Avakian, R., Avetissian, A., Avetissian, E., Bailey, P., Baturin, V., Baumgarten, C., Beckmann, M., Belostotski, S., Bernreuther, S., Bianchi, N., Böttcher, H., Borissov, A., Bouhali, O., Bouwhuis, M., Brack, J., Brauksiepe, S., Brüll, A., Brunn, I., Bulten, H.J., Capitani, G.P., Chumney, P., Cisbani, E., Ciullo, G., Court, G.R., Dalpiaz, P.F., De Leo, R., De Nardo, L., De Sanctis, E., De Schepper, D., Devitsin, E., de Witt Huberts, P.K.A., Di Nezza, P., Düren, M., Ehrenfried, M., Elbakian, G., Ellinghaus, F., Ely, J., Fabbri, R., Fantoni, A., Fechtchenko, A., Felawka, L., Filippone, B.W., Fischer, H., Fox, B., Franz, J., Frullani, S., Gärber, Y., Garibaldi, F., Garutti, E., Gavrilov, G., Gharibyan, V., Graw, G., Grebeniouk, O., Green, P.W., Greeniaus, L.G., Gute, A., Haeberli, W., Hafidi, K., Hartig, M., Hasch, D., Heesbeen, D., Heinsius, F.H., Henoch, M., Hertenberger, R., Hesselink, W.H.A., Hofman, G., Holler, Y., Holt, R.J., Hommez, B., Iarygin, G., Izotov, A., Jackson, H.E., Jgoun, A., Jung, P., Kaiser, R., Kisselev, A., Kitching, P., Königsmann, K., Kolster, H., Korotkov, V., Kotik, E., Kozlov, V., Krauss, B., Krivokhijine, V.G., Kyle, G., Lagamba, L., Laziev, A., Lenisa, P., Liebing, P., Lindemann, T., Lorenzon, W., Maas, A., Makins, N.C.R., Marukyan, H., Masoli, F., McIlhany, K., Meissner, F., Menden, F., Mexner, V., Meyners, N., Mikloukho, O., Milner, R., Muccifora, V., Nagaitsev, A., Nappi, E., Naryshkin, Y., Nass, A., Negodaeva, K., Nowak, W.-D., Oganessyan, K., O'Neill, T.G., Owen, B.R., Pate, S.F., Podiatchev, S., Potashov, S., Potterveld, D.H., Raithel, M., Rakness, G., Rappoport, V., Redwine, R., Reggiani, D., Reimer, P., Reolon, A.R., Rith, K., Robinson, D., Rostomyan, A., Ryckbosch, D., Sakemi, Y., Sanjiev, I., Sato, F., Savin, I., Scarlett, C., Schäfer, A., Schill, C., Schmidt, F., Schnell, G., Schüler, K.P., Schwind, A., Seibert, J., Seitz, B., Shibata, T.-A., Shutov, V., Simani, M.C., Simon, A., Sinram, K., Steffens, E., Steijger, J.J.M., Stewart, J., Stösslein, U., Suetsugu, K., Taroian, S., Terkulov, A., Tessarin, S., Thomas, E., Tipton, B., Tytgat, M., Urciuoli, G.M., van den Brand, J.F.J., van der Steenhoven, G., van de Vyver, R., Vetterli, M.C., Vikhrov, V., Vincter, M.G., Visser, J., Volmer, J., Weiskopf, C., Wendland, J., Wilbert, J., Wise, T., Yen, S., Yoneyama, S., Zohrabian, H.","Single-spin azimuthal asymmetry in exclusive electroproduction of π + mesons",2002,"Physics Letters, Section B: Nuclear, Elementary Particle and High-Energy Physics","535","1-4",,"85","92",,31,10.1016/S0370-2693(02)01780-X,"https://www.scopus.com/inward/record.uri?eid=2-s2.0-0037161931&doi=10.1016%2fS0370-2693%2802%2901780-X&partnerID=40&md5=49ee3e8a43d63ba6419e86d9b68f5b22",Article,Scopus,2-s2.0-0037161931
"Airapetian, A., Akopov, N., Amarian, M., Aschenauer, E.C., Avakian, H., Avakian, R., Avetissian, A., Bains, B., Baumgarten, C., Beckmann, M., Belostotski, S., Belz, J.E., Benisch, Th., Bernreuther, S., Bianchi, N., Blouw, J., Böttcher, H., Borissov, A., Bouwhuis, M., Brack, J., Brauksiepe, S., Braun, B., Bray, B., Brons, S., Brückner, W., Brüll, A., Bruins, E.E.W., Bulten, H.J., Capitani, G.P., Carter, P., Chumney, P., Cisbani, E., Court, G.R., Dalpiaz, P.F., De Sanctis, E., De Schepper, D., Devitsin, E., De Witt Huberts, P.K.A., Di Nezza, P., Düren, M., Dvoredsky, A., Elbakian, G., Ely, J., Fantoni, A., Fechtchenko, A., Ferstl, M., Fiedler, K., Filippone, B.W., Fischer, H., Fox, B., Franz, J., Frullani, S., Funk, M.-A., Gärber, Y., Gao, H., Garibaldi, F., Gavrilov, G., Geiger, P., Gharibyan, V., Golendukhin, A., Graw, G., Grebeniouk, O., Green, P.W., Greeniaus, L.G., Grosshauser, C., Guidal, M., Gute, A., Gyurjyan, V., Haas, J.P., Haeberli, W., Hausser, O., Hansen, J.-O., Hartig, M., Hasch, D., Heinsius, F.H., Henderson, R., Henoch, M., Hertenberger, R., Holler, Y., Holt, R.J., Hoprich, W., Ihssen, H., Iodice, M., Izotov, A., Jackson, H.E., Jgoun, A., Kaiser, R., Kinney, E., Kirsch, M., Kisselev, A., Kitching, P., Kobayashi, H., Koch, N., Königsmann, K., Kolstein, M., Kolster, H., Korotkov, V., Korsch, W., Kozlov, V., Kramer, L.H., Krivokhijine, V.G., Kurisuno, M., Kyle, G., Lachnit, W., Lenisa, P., Lorenzon, W., Makins, N.C.R., Manaenkov, S.I., Martens, F.K., Martin, J.W., Masoli, F., Mateos, A., McAndrew, M., McIlhany, K., McKeown, R.D., Meissner, F., Menden, F., Metz, A., Meyners, N., Mikloukho, O., Miller, C.A., Miller, M.A., Milner, R., Most, A., Muccifora, V., Mussa, R., Nagaitsev, A., Naryshkin, Y., Nathan, A.M., Neunreither, F., Niczyporuk, J.M., Nowak, W.-D., Nupieri, M., O'Neill, T.G., Openshaw, R., Ouyang, J., Owen, B.R., Papavassiliou, V., Pate, S.F., Pitt, M., Potashov, S., Potterveld, D.H., Rakness, G., Reali, A., Redwine, R., Reolon, A.R., Ristinen, R., Rith, K., Rossi, P., Rudnitsky, S., Ruh, M., Ryckbosch, D., Sakemi, Y., Savin, I., Scarlett, C., Schmidt, F., Schmitt, H., Schnell, G., Schüler, K.P., Schwind, A., Seibert, J., Shibata, T.-A., Shibatani, K., Shin, T., Shutov, V., Simani, C., Simon, A., Sinram, K., Slavich, P., Spengos, M., Steffens, E., Stenger, J., Stewart, J., Stösslein, U., Sutter, M., Tallini, H., Taroian, S., Terkulov, A., Thomas, E., Tipton, B., Tytgat, M., Urciuoli, G.M., Van Den Brand, J.F.J., Van Der Steenhoven, G., Van De Vyver, R., Van Hunen, J.J., Vetterli, M.C., Vikhrov, V., Vincter, M.G., Visser, J., Volk, E., Wander, W., Wendland, J., Williamson, S.E., Wise, T., Woller, K., Yoneyama, S., Zohrabian, H.","Measurement of longitudinal spin transfer to Λ hyperons in deep-inelastic lepton scattering",2001,"Physical Review D","64","11", 112005,"","",,39,,"https://www.scopus.com/inward/record.uri?eid=2-s2.0-0035581061&partnerID=40&md5=72f74602203a7018cc6653a6b53e8cf8",Article,Scopus,2-s2.0-0035581061
"Airapetian, A., Akopov, N., Akopov, Z., Amarian, M., Aschenauer, E.C., Avakian, H., Avakian, R., Avetissian, A., Avetissian, E., Bailey, P., Bains, B., Baturin, V., Baumgarten, C., Beckmann, M., Belostotski, S., Bernreuther, S., Bianchi, N., Böttcher, H., Borissov, A., Bouhali, O., Bouwhuis, M., Brack, J., Brauksiepe, S., Brückner, W., Brüll, A., Brunn, I., Bulten, H.J., Capitani, G.P., Chumney, P., Cisbani, E., Ciullo, G., Court, G.R., Dalpiaz, P.F., De Leo, R., De Nardo, L., De Sanctis, E., De Schepper, D., Devitsin, E., De Witt Huberts, P.K.A., Di Nezza, P., Djordjadze, V., Düren, M., Ehrenfried, M., Elbakian, G., Ellinghaus, F., Ely, J., Fantoni, A., Fechtchenko, A., Felawka, L., Filippone, B.W., Fischer, H., Fox, B., Franz, J., Frullani, S., Gärber, Y., Garibaldi, F., Garutti, E., Gavrilov, G., Gharibyan, V., Golendukhin, A., Graw, G., Grebeniouk, O., Green, P.W., Greeniaus, L.G., Gute, A., Haeberli, W., Hafidi, K., Hartig, M., Hasch, D., Heesbeen, D., Heinsius, F.H., Henoch, M., Hertenberger, R., Hesselink, W.H.A., Hofman, G., Holler, Y., Holt, R.J., Hommez, B., Iarygin, G., Izotov, A., Jackson, H.E., Jgoun, A., Jung, P., Kaiser, R., Kanesaka, J., Kinney, E., Kisselev, A., Kitching, P., Kobayashi, H., Koch, N., Königsmann, K., Kolster, H., Korotkov, V., Kotik, E., Kozlov, V., Krauss, B., Krivokhijine, V.G., Kyle, G., Lagamba, L., Laziev, A., Lenisa, P., Liebing, P., Lindemann, T., Lorenzon, W., Maas, A., Makins, N.C.R., Marukyan, H., Masoli, F., McAndrew, M., McIlhany, K., Meissner, F., Menden, F., Meyners, N., Mikloukho, O., Miller, C.A., Milner, R., Muccifora, V., Mussa, R., Nagaitsev, A., Nappi, E., Naryshkin, Y., Nass, A., Negodaeva, K., Nowak, W.-D., Oganessyan, K., O'Neill, T.G., Owen, B.R., Pate, S.F., Potashov, S., Potterveld, D.H., Raithel, M., Rakness, G., Rappoport, V., Redwine, R., Reggiani, D., Reolon, A.R., Rith, K., Robinson, D., Rostomyan, A., Ruh, M., Ryckbosch, D., Sakemi, Y., Sanjiev, I., Sato, F., Savin, I., Scarlett, C., Schäfer, A., Schill, C., Schmidt, F., Schnell, G., Schüler, K.P., Schwind, A., Seibert, J., Seitz, B., Shibata, T.-A., Shutov, V., Simani, M.C., Simon, A., Sinram, K., Steffens, E., Steijger, J.J.M., Stewart, J., Stösslein, U., Suetsugu, K., Taroian, S., Terkulov, A., Teryaev, O., Tessarin, S., Thomas, E., Tipton, B., Tytgat, M., Urciuoli, G.M., Van Den Brand, J.F.J., Van Der Steenhoven, G., Van De Vyver, R., Van Hunen, J.J., Vetterli, M.C., Vikhrov, V., Vincter, M.G., Visser, J., Weiskopf, C., Wendland, J., Wilbert, J., Wise, T., Yen, S., Yoneyama, S., Zohrabian, H.","Single-spin azimuthal asymmetries in electroproduction of neutral pions in semi-inclusive deep-inelastic scattering",2001,"Physical Review D","64","9", 097101,"","",,180,,"https://www.scopus.com/inward/record.uri?eid=2-s2.0-17944397217&partnerID=40&md5=8c1be2ac9ed2e6dcf2437a5b60962693",Article,Scopus,2-s2.0-17944397217
"Airapetian, A., Akopov, N., Akopov, Z., Amarian, M., Aschenauer, E.C., Avakian, H., Avakian, R., Avetissian, A., Avetissian, E., Bailey, P., Bains, B., Baturin, V., Baumgarten, C., Beckmann, M., Belostotski, S., Bernreuther, S., Bianchi, N., Böttcher, H., Borissov, A., Bouhali, O., Bouwhuis, M., Brack, J., Brauksiepe, S., Brückner, W., Brüll, A., Brunn, I., Bulten, H.J., Capitani, G.P., Chumney, P., Cisbani, E., Ciullo, G., Court, G.R., Dalpiaz, P.F., De Leo, R., De Nardo, L., De Sanctis, E., De Schepper, D., Devitsin, E., De Witt Huberts, P.K.A., Di Nezza, P., Düren, M., Ehrenfried, M., Elbakian, G., Ellinghaus, F., Ely, J., Fabbri, R., Fantoni, A., Fechtchenko, A., Felawka, L., Filippone, B.W., Fischer, H., Fox, B., Franz, J., Frullani, S., Gärber, Y., Garibaldi, F., Garutti, E., Gavrilov, G., Gharibyan, V., Golendukhin, A., Graw, G., Grebeniouk, O., Green, P.W., Greeniaus, L.G., Gute, A., Haeberli, W., Hafidi, K., Hartig, M., Hasch, D., Heesbeen, D., Heinsius, F.H., Henoch, M., Hertenberger, R., Hesselink, W.H.A., Hofman, G., Holler, Y., Holt, R.J., Hommez, B., Iarygin, G., Izotov, A., Jackson, H.E., Jgoun, A., Jung, P., Kaiser, R., Kanesaka, J., Kinney, E., Kisselev, A., Kitching, P., Kobayashi, H., Koch, N., Königsmann, K., Kolster, H., Korotkov, V., Kotik, E., Kozlov, V., Krauss, B., Krivokhijine, V.G., Kyle, G., Lagamba, L., Laziev, A., Lenisa, P., Liebing, P., Lindemann, T., Lorenzon, W., Maas, A., Makins, N.C.R., Marukyan, H., Masoli, F., McAndrew, M., McIlhany, K., Meissner, F., Menden, F., Meyners, N., Mikloukho, O., Miller, C.A., Milner, R., Muccifora, V., Mussa, R., Nagaitsev, A., Nappi, E., Naryshkin, Y., Nass, A., Negodaeva, K., Nowak, W.-D., Oganessyan, K., O'Neill, T.G., Owen, B.R., Pate, S.F., Potashov, S., Potterveld, D.H., Raithel, M., Rakness, G., Rappoport, V., Redwine, R., Reggiani, D., Reolon, A.R., Rith, K., Robinson, D., Rostomyan, A., Ruh, M., Ryckbosch, D., Sakemi, Y., Sanjiev, I., Sato, F., Savin, I., Scarlett, C., Schäfer, A., Schill, C., Schmidt, F., Schnell, G., Schüler, K.P., Schwind, A., Seibert, J., Seitz, B., Shibata, T.-A., Shutov, V., Simani, M.C., Simon, A., Sinram, K., Steffens, E., Steijger, J.J.M., Stewart, J., Stösslein, U., Suetsugu, K., Taroian, S., Terkulov, A., Tessarin, S., Thomas, E., Tipton, B., Tytgat, M., Urciuoli, G.M., Van Den Brand, J.F.J., Van Steenhoven, G., Van Vyver, R., Van Hunen, J.J., Vetterli, M.C., Vikhrov, V., Vincter, M.G., Visser, J., Weiskopf, C., Wendland, J., Wilbert, J., Wise, T., Yen, S., Yoneyama, S., Zohrabian, H.","Measurement of the beam-spin azimuthal asymmetry associated with deeply-virtual compton scattering",2001,"Physical Review Letters","87","18", 182001,"1820011","1820015",,250,,"https://www.scopus.com/inward/record.uri?eid=2-s2.0-0035968772&partnerID=40&md5=66484d39df7d8a8794e2083c4bea3358",Article,Scopus,2-s2.0-0035968772
