Authors,Title,Year,Source title,Volume,Issue,Art. No.,Page start,Page end,Page count,Cited by,DOI,Link,Document Type,Source,EID
"Balendra, N., Langenderfer, J.E.","Effect of hammer mass on upper extremity joint moments",2017,"Applied Ergonomics","60",,,"231","239",,,10.1016/j.apergo.2016.12.001,"https://www.scopus.com/inward/record.uri?eid=2-s2.0-85003561700&doi=10.1016%2fj.apergo.2016.12.001&partnerID=40&md5=320b8e5de6eb411bea7860c91cbf3aad",Article,Scopus,2-s2.0-85003561700
"Ustinova, K.I., Langenderfer, J.E., Balendra, N.","Enhanced arm swing alters interlimb coordination during overground walking in individuals with traumatic brain injury",2017,"Human Movement Science","52",,,"45","54",,,10.1016/j.humov.2017.01.001,"https://www.scopus.com/inward/record.uri?eid=2-s2.0-85009895020&doi=10.1016%2fj.humov.2017.01.001&partnerID=40&md5=6b94453a86f97911121b19d206f64148",Article,Scopus,2-s2.0-85009895020
"Chopp-Hurley, J.N., Langenderfer, J.E., Dickerson, C.R.","A probabilistic orthopaedic population model to predict fatigue-related subacromial geometric variability",2016,"Journal of Biomechanics","49","4",,"543","549",,,10.1016/j.jbiomech.2015.12.049,"https://www.scopus.com/inward/record.uri?eid=2-s2.0-84957043087&doi=10.1016%2fj.jbiomech.2015.12.049&partnerID=40&md5=582df7ca584d994d9360026f0c39f4e7",Article,Scopus,2-s2.0-84957043087
"Dickerson, C.R., Meszaros, K.A., Cudlip, A.C., Chopp-Hurley, J.N., Langenderfer, J.E.","The influence of cycle time on shoulder fatigue responses for a fixed total overhead workload",2015,"Journal of Biomechanics","48","11",,"2911","2918",,4,10.1016/j.jbiomech.2015.04.043,"https://www.scopus.com/inward/record.uri?eid=2-s2.0-84938743144&doi=10.1016%2fj.jbiomech.2015.04.043&partnerID=40&md5=ea328b91968ea7b0249dd2c319063b4a",Article,Scopus,2-s2.0-84938743144
"VanderHill, M.S., Wolf, E.E., Langenderfer, J.E., Ustinova, K.I.","The effect of actual and imaginary handgrip on postural stability during different balance conditions",2014,"Gait and Posture","40","4",,"652","657",,2,10.1016/j.gaitpost.2014.07.015,"https://www.scopus.com/inward/record.uri?eid=2-s2.0-84921943722&doi=10.1016%2fj.gaitpost.2014.07.015&partnerID=40&md5=65f2243a006bac99ee8064e54ccf0f3b",Article,Scopus,2-s2.0-84921943722
"Chopp-Hurley, J.N., Langenderfer, J.E., Dickerson, C.R.","Probabilistic evaluation of predicted force sensitivity to muscle attachment and glenohumeral stability uncertainty",2014,"Annals of Biomedical Engineering","42","9",,"1867","1879",,2,10.1007/s10439-014-1035-3,"https://www.scopus.com/inward/record.uri?eid=2-s2.0-84906950783&doi=10.1007%2fs10439-014-1035-3&partnerID=40&md5=d15e613071ebe57817ac065ca0ec1d83",Article,Scopus,2-s2.0-84906950783
"Ustinova, K.I., Langenderfer, J.E.","Postural stabilization by gripping a stick with different force levels",2013,"Gait and Posture","38","1",,"97","103",,6,10.1016/j.gaitpost.2012.10.020,"https://www.scopus.com/inward/record.uri?eid=2-s2.0-84878373950&doi=10.1016%2fj.gaitpost.2012.10.020&partnerID=40&md5=1fc2c15ac329ae1b95587e3b2b53f828",Article,Scopus,2-s2.0-84878373950
"DeJong, B.P., Langenderfer, J.","Enrollment and persistence of first-year students in a newly accredited engineering program",2012,"ASEE Annual Conference and Exposition, Conference Proceedings",,,,"","",15,2,,"https://www.scopus.com/inward/record.uri?eid=2-s2.0-84865009922&partnerID=40&md5=f66fc165a032c50bb7100d7830510cbc",Conference Paper,Scopus,2-s2.0-84865009922
"Dejong, B.P., Langenderfer, J.E.","First-year engineering students in newly accredited programs: Enrollment and persistence demographics",2012,"International Journal of Engineering Education","28","3",,"534","544",,,,"https://www.scopus.com/inward/record.uri?eid=2-s2.0-84861602925&partnerID=40&md5=6de06c2e1eae2a45f7582e4d895a9a2a",Article,Scopus,2-s2.0-84861602925
"Baldwin, M.A., Langenderfer, J.E., Rullkoetter, P.J., Laz, P.J.","Development of subject-specific and statistical shape models of the knee using an efficient segmentation and mesh-morphing approach",2010,"Computer Methods and Programs in Biomedicine","97","3",,"232","240",,41,10.1016/j.cmpb.2009.07.005,"https://www.scopus.com/inward/record.uri?eid=2-s2.0-76749151340&doi=10.1016%2fj.cmpb.2009.07.005&partnerID=40&md5=7a57db8a9de95596a9a9cf2fabb14448",Article,Scopus,2-s2.0-76749151340
"Langenderfer, J.E., Rullkoetter, P.J., Mell, A.G., Laz, P.J.","A multi-subject evaluation of uncertainty in anatomical landmark location on shoulder kinematic description",2009,"Computer Methods in Biomechanics and Biomedical Engineering","12","2",,"211","216",,13,10.1080/10255840802372094,"https://www.scopus.com/inward/record.uri?eid=2-s2.0-67649097259&doi=10.1080%2f10255840802372094&partnerID=40&md5=14d4a13fc26edf00ebd76e26848557cf",Article,Scopus,2-s2.0-67649097259
"Flieg, N.G., Gatti, C.J., Doro, L.C., Langenderfer, J.E., Carpenter, J.E., Hughes, R.E.","A stochastic analysis of glenoid inclination angle and superior migration of the humeral head",2008,"Clinical Biomechanics","23","5",,"554","561",,20,10.1016/j.clinbiomech.2008.01.001,"https://www.scopus.com/inward/record.uri?eid=2-s2.0-44549083305&doi=10.1016%2fj.clinbiomech.2008.01.001&partnerID=40&md5=52b76807693a7c65446bc074d03baec7",Article,Scopus,2-s2.0-44549083305
"Langenderfer, J.E., Laz, P.J., Petrella, A.J., Rullkoetter, P.J.","An efficient probabilistic methodology for incorporating uncertainty in body segment parameters and anatomical landmarks in joint loadings estimated from inverse dynamics.",2008,"Journal of biomechanical engineering","130","1",,"014502","",,6,10.1115/1.2838037,"https://www.scopus.com/inward/record.uri?eid=2-s2.0-45849096876&doi=10.1115%2f1.2838037&partnerID=40&md5=75e78bd4d43edc2b7dfa1a029ff24fb3",Article,Scopus,2-s2.0-45849096876
"Gatti, C.J., Doro, L.C., Langenderfer, J.E., Mell, A.G., Maratt, J.D., Carpenter, J.E., Hughes, R.E.","Evaluation of three methods for determining EMG-muscle force parameter estimates for the shoulder muscles",2008,"Clinical Biomechanics","23","2",,"166","174",,14,10.1016/j.clinbiomech.2007.08.026,"https://www.scopus.com/inward/record.uri?eid=2-s2.0-38849168219&doi=10.1016%2fj.clinbiomech.2007.08.026&partnerID=40&md5=1f42099eaf178ff14c9d2bde28f75a62",Article,Scopus,2-s2.0-38849168219
"Langenderfer, J.E., Laz, P.J., Petrella, A.J., Rullkoetter, P.J.","An efficient probabilistic methodology for incorporating uncertainty in body segment parameters and anatomical landmarks in joint loadings estimated from inverse dynamics",2008,"Journal of Biomechanical Engineering","130","1", 014502,"","",,11,10.1115/1.2838037,"https://www.scopus.com/inward/record.uri?eid=2-s2.0-47149108889&doi=10.1115%2f1.2838037&partnerID=40&md5=3753ba075afa26076a01e3494aabfc8a",Article,Scopus,2-s2.0-47149108889
"Baldwin, M.A., Langenderfer, J.E., Farr, J., Rullkoetter, P.J.","Computational simulation of anterior-medial tibial tuberosity transfer: Optimization with simulated annealing",2007,"Proceedings of the ASME Summer Bioengineering Conference 2007, SBC 2007",,,,"377","378",,,,"https://www.scopus.com/inward/record.uri?eid=2-s2.0-40449111895&partnerID=40&md5=acadce7de2ee772eed7b7d8dbf6558c4",Conference Paper,Scopus,2-s2.0-40449111895
"Adams, C.R., Baldwin, M.A., Laz, P.J., Rullkoetter, P.J., Langenderfer, J.E.","Development of a computational model to study effects of rotator cuff tear size and location on muscle moment arms",2007,"Proceedings of the ASME Summer Bioengineering Conference 2007, SBC 2007",,,,"373","374",,,,"https://www.scopus.com/inward/record.uri?eid=2-s2.0-40449117314&partnerID=40&md5=305582b48f2932b7d0eabebdaeab6b84",Conference Paper,Scopus,2-s2.0-40449117314
"Adams, C.R., Baldwin, M.A., Laz, P.J., Rullkoetter, P.J., Langenderfer, J.E.","Effects of rotator cuff tears on muscle moment arms: A computational study",2007,"Journal of Biomechanics","40","15",,"3373","3380",,7,10.1016/j.jbiomech.2007.05.017,"https://www.scopus.com/inward/record.uri?eid=2-s2.0-35448937666&doi=10.1016%2fj.jbiomech.2007.05.017&partnerID=40&md5=f6f708310384f9d153baff6b2ec81a39",Article,Scopus,2-s2.0-35448937666
"Pal, S., Langenderfer, J.E., Stowe, J.Q., Laz, P.J., Petrella, A.J., Rullkoetter, P.J.","Probabilistic modeling of knee muscle moment arms: Effects of methods, origin-insertion, and kinematic variability",2007,"Annals of Biomedical Engineering","35","9",,"1632","1642",,26,10.1007/s10439-007-9334-6,"https://www.scopus.com/inward/record.uri?eid=2-s2.0-35248820706&doi=10.1007%2fs10439-007-9334-6&partnerID=40&md5=74e46b0429d5bc166fac86818882ad60",Article,Scopus,2-s2.0-35248820706
"Srinivasan, R.C., Lungren, M.P., Langenderfer, J.E., Hughes, R.E.","Fiber type composition and maximum shortening velocity of muscles crossing the human shoulder",2007,"Clinical Anatomy","20","2",,"144","149",,19,10.1002/ca.20349,"https://www.scopus.com/inward/record.uri?eid=2-s2.0-33846978106&doi=10.1002%2fca.20349&partnerID=40&md5=6931cbbe9d3223938755d6e6133984cc",Article,Scopus,2-s2.0-33846978106
"Swaringen, J.C., Mell, A.G., Langenderfer, J., LaScalza, S., Hughes, R.E., Kuhn, J.E.","Electromyographic analysis of physical examination tests for type II superior labrum anterior-posterior lesions",2006,"Journal of Shoulder and Elbow Surgery","15","5",,"576","579",,6,10.1016/j.jse.2006.01.004,"https://www.scopus.com/inward/record.uri?eid=2-s2.0-33748413599&doi=10.1016%2fj.jse.2006.01.004&partnerID=40&md5=4c8269fe2677cb71edd300ea53927736",Article,Scopus,2-s2.0-33748413599
"Langenderfer, J.E., Patthanacharoenphon, C., Carpenter, J.E., Hughes, R.E.","Variation in external rotation momen arms among subregions of supraspinatus, infraspinatus, and teres minor muscles",2006,"Journal of Orthopaedic Research","24","8",,"1737","1744",,14,10.1002/jor.20188,"https://www.scopus.com/inward/record.uri?eid=2-s2.0-33746976064&doi=10.1002%2fjor.20188&partnerID=40&md5=513448f791fd264bbbced032f67df80b",Article,Scopus,2-s2.0-33746976064
"Langenderfer, J.E., Patthanacharoenphon, C., Carpenter, J.E., Hughes, R.E.","Variability in isometric force and moment generating capacity of glenohumeral external rotator muscles",2006,"Clinical Biomechanics","21","7",,"701","709",,15,10.1016/j.clinbiomech.2006.02.010,"https://www.scopus.com/inward/record.uri?eid=2-s2.0-33745492049&doi=10.1016%2fj.clinbiomech.2006.02.010&partnerID=40&md5=759fdb181934a5eb02f56b9f7095db68",Article,Scopus,2-s2.0-33745492049
"Langenderfer, J.E., Carpenter, J.E., Johnson, M.E., An, K.-N., Hughes, R.E.","A probabilistic model of glenohumeral external rotation strength for healthy normals and rotator cuff tear cases",2006,"Annals of Biomedical Engineering","34","3",,"465","476",,16,10.1007/s10439-005-9045-9,"https://www.scopus.com/inward/record.uri?eid=2-s2.0-33646417905&doi=10.1007%2fs10439-005-9045-9&partnerID=40&md5=d67d5bafa62a8f502975cbd043bdc794",Article,Scopus,2-s2.0-33646417905
"Langenderfer, J.E., Hughes, R.E., Carpenter, J.E.","A stochastic model of elbow flexion strength for subjects with and without long head biceps tear",2005,"Computer Methods in Biomechanics and Biomedical Engineering","8","5",,"315","322",,4,10.1080/10255840500294988,"https://www.scopus.com/inward/record.uri?eid=2-s2.0-33644664849&doi=10.1080%2f10255840500294988&partnerID=40&md5=68dac15752d29771f5c3261571a1a3df",Article,Scopus,2-s2.0-33644664849
"Carpenter, J.E., Wening, J.D., Mell, A.G., Langenderfer, J.E., Kuhn, J.E., Hughes, R.E.","Changes in the long head of the biceps tendon in rotator cuff tear shoulders",2005,"Clinical Biomechanics","20","2",,"162","165",,22,10.1016/j.clinbiomech.2004.09.009,"https://www.scopus.com/inward/record.uri?eid=2-s2.0-11144254616&doi=10.1016%2fj.clinbiomech.2004.09.009&partnerID=40&md5=cc98f32466efd5d8675a8b65819962a6",Article,Scopus,2-s2.0-11144254616
"Langenderfer, J., LaScalza, S., Mell, A., Carpenter, J.E., Kuhn, J.E., Hughes, R.E.","An EMG-driven model of the upper extremity and estimation of long head biceps force",2005,"Computers in Biology and Medicine","35","1",,"25","39",,31,10.1016/j.compbiomed.2003.12.002,"https://www.scopus.com/inward/record.uri?eid=2-s2.0-9344237638&doi=10.1016%2fj.compbiomed.2003.12.002&partnerID=40&md5=73e7ce50e372cacc96b18042da551ff4",Article,Scopus,2-s2.0-9344237638
"Langenderfer, J., Jerabek, S.A., Thangamani, V.B., Kuhn, J.E., Hughes, R.E.","Musculoskeletal parameters of muscles crossing the shoulder and elbow and the effect of sarcomere length sample size on estimation of optimal muscle length",2004,"Clinical Biomechanics","19","7",,"664","670",,60,10.1016/j.clinbiomech.2004.04.009,"https://www.scopus.com/inward/record.uri?eid=2-s2.0-3342962567&doi=10.1016%2fj.clinbiomech.2004.04.009&partnerID=40&md5=6653730cea5cfdf881c237819b81b0d1",Article,Scopus,2-s2.0-3342962567
