Authors,Title,Year,Source title,Volume,Issue,Art. No.,Page start,Page end,Page count,Cited by,DOI,Link,Document Type,Source,EID
"Hallquist, M., Wenger, J.C., Baltensperger, U., Rudich, Y., Simpson, D., Claeys, M., Dommen, J., Donahue, N.M., George, C., Goldstein, A.H., Hamilton, J.F., Herrmann, H., Hoffmann, T., Iinuma, Y., Jang, M., Jenkin, M.E., Jimenez, J.L., Kiendler-Scharr, A., Maenhaut, W., McFiggans, G., Mentel, T.F., Monod, A., Prévôt, A.S.H., Seinfeld, J.H., Surratt, J.D., Szmigielski, R., Wildt, J.","The formation, properties and impact of secondary organic aerosol: Current and emerging issues",2009,"Atmospheric Chemistry and Physics","9","14",,"5155","5236",,1402,,"https://www.scopus.com/inward/record.uri?eid=2-s2.0-80051983355&partnerID=40&md5=911a0fe02d2bf2d0cdc7b77554e43d36",Article,Scopus,2-s2.0-80051983355
"Claeys, M., Iinuma, Y., Szmigielski, R., Surratt, J.D., Blockhuys, F., Van Alsenoy, C., Böge, O., Sierau, B., Gómez-González, Y., Vermeylen, R., Van Der Veken, P., Shahgholi, M., Chan, A.W.H., Herrmann, H., Seinfeld, J.H., Maenhaut, W.","Terpenylic acid and related compounds from the oxidation of α-pinene: Implications for new particle formation and growth above forests",2009,"Environmental Science and Technology","43","18",,"6976","6982",,88,10.1021/es9007596,"https://www.scopus.com/inward/record.uri?eid=2-s2.0-70349147308&doi=10.1021%2fes9007596&partnerID=40&md5=1e03c8a457d9da49a382850c488471c3",Article,Scopus,2-s2.0-70349147308
"Chan, A.W.H., Kautzman, K.E., Chhabra, P.S., Surratt, J.D., Chan, M.N., Crounse, J.D., Kürten, A., Wennberg, P.O., Flagan, R.C., Seinfeld, J.H.","Secondary organic aerosol formation from photooxidation of naphthalene and alkylnaphthalenes: Implications for oxidation of intermediate volatility organic compounds (IVOCs)",2009,"Atmospheric Chemistry and Physics","9","9",,"3049","3060",,116,10.5194/acp-9-3049-2009,"https://www.scopus.com/inward/record.uri?eid=2-s2.0-70449100415&doi=10.5194%2facp-9-3049-2009&partnerID=40&md5=9d712523e8337cfb722f20f947c31537",Article,Scopus,2-s2.0-70449100415
"Surratt, J.D., Gómez-González, Y., Chan, A.W.H., Vermeylen, R., Shahgholi, M., Kleindienst, T.E., Edney, E.O., Offenberg, J.H., Lewandowski, M., Jaoui, M., Maenhaut, W., Claeys, M., Flagan, R.C., Seinfeld, J.H.","Organosulfate formation in biogenic secondary organic aerosol",2008,"Journal of Physical Chemistry A","112","36",,"8345","8378",,260,10.1021/jp802310p,"https://www.scopus.com/inward/record.uri?eid=2-s2.0-52349083383&doi=10.1021%2fjp802310p&partnerID=40&md5=6594b2657af893ec39c920f09cce348d",Article,Scopus,2-s2.0-52349083383
"Ng, N.L., Kwan, A.J., Surratt, J.D., Chan, A.W.H., Chhabra, P.S., Sorooshian, A., Pye, H.O.T., Crounse, J.D., Wennberg, P.O., Flagan, R.C., Seinfeld, J.H.","Secondary organic aerosol (SOA) formation from reaction of isoprene with nitrate radicals (NO3)",2008,"Atmospheric Chemistry and Physics","8","14",,"4117","4140",,121,,"https://www.scopus.com/inward/record.uri?eid=2-s2.0-49149109952&partnerID=40&md5=11c22fe6c69e291bca9da819894d76eb",Article,Scopus,2-s2.0-49149109952
"Jaoui, M., Edney, E.O., Kleindienst, T.E., Lewandowski, M., Offenberg, J.H., Surratt, J.D., Seinfeld, J.H.","Formation of secondary organic aerosol from irradiated α-pinene/toluene/NO&lt;inf&gt;x&lt;/inf&gt; mixtures and the effect of isoprene and sulfur dioxide",2008,"Journal of Geophysical Research Atmospheres","113","9", D09303,"","",,56,10.1029/2007JD009426,"https://www.scopus.com/inward/record.uri?eid=2-s2.0-46449115184&doi=10.1029%2f2007JD009426&partnerID=40&md5=dc1faab62ef76e78b704715dbef925ff",Article,Scopus,2-s2.0-46449115184
"Gómez-González, Y., Surratt, J.D., Cuyckens, F., Szmigielski, R., Vermeylen, R., Jaoui, M., Lewandowski, M., Offenberg, J.H., Kleindienst, T.E., Edney, E.O., Blockhuys, F., Van Alsenoy, C., Maenhaut, W., Claeys, M.","Characterization of organosulfates from the photooxidation of isoprene and unsaturated fatty acids in ambient aerosol using liquid chromatography/(-) electrospray ionization mass spectrometry",2008,"Journal of Mass Spectrometry","43","3",,"371","382",,130,10.1002/jms.1329,"https://www.scopus.com/inward/record.uri?eid=2-s2.0-40649101916&doi=10.1002%2fjms.1329&partnerID=40&md5=d18ced8f5036d95b8f88bf9e284b399a",Article,Scopus,2-s2.0-40649101916
"Szmigielski, R., Surratt, J.D., Gómez-González, Y., van der Veken, P., Kourtchev, I., Vermeylen, R., Blockhuys, F., Jaoui, M., Kleindienst, T.E., Lewandowski, M., Offenberg, J.H., Edney, E.O., Seinfeld, J.H., Maenhaut, W., Claeys, M.","3-methyl-1,2,3-butanetricarboxylic acid: An atmospheric tracer for terpene secondary organic aerosol",2007,"Geophysical Research Letters","34","24", L24811,"","",,120,10.1029/2007GL031338,"https://www.scopus.com/inward/record.uri?eid=2-s2.0-39549109521&doi=10.1029%2f2007GL031338&partnerID=40&md5=e4b7fdab17e9bf2e0efcc3e52ffc7ccd",Article,Scopus,2-s2.0-39549109521
"Ng, N.L., Chhabra, P.S., Chan, A.W.H., Surratt, J.D., Kroll, J.H., Kwan, A.J., McCabe, D.C., Wennberg, P.O., Sorooshian, A., Murphy, S.M., Dalleska, N.F., Flagan, R.C., Seinfeld, J.H.","Effect of NOx level on secondary organic aerosol (SOA) formation from the photooxidation of terpenes",2007,"Atmospheric Chemistry and Physics","7","19",,"5159","5174",,174,,"https://www.scopus.com/inward/record.uri?eid=2-s2.0-35048843777&partnerID=40&md5=f3487d734be33ade3962370ac26e487b",Article,Scopus,2-s2.0-35048843777
"Surratt, J.D., Lewandowski, M., Offenberg, J.H., Jaoui, M., Kleindienst, T.E., Edney, E.O., Seinfeld, J.H.","Effect of acidity on secondary organic aerosol formation from isoprene",2007,"Environmental Science and Technology","41","15",,"5363","5369",,209,10.1021/es0704176,"https://www.scopus.com/inward/record.uri?eid=2-s2.0-34547685897&doi=10.1021%2fes0704176&partnerID=40&md5=58d7a6e067a210826d706e88154ad94e",Article,Scopus,2-s2.0-34547685897
"Rissman, T.A., Varutbangkul, V., Surratt, J.D., Topping, D.O., McFiggans, G., Flagan, R.C., Seinfeld, J.H.","Cloud condensation nucleus (CCN) behavior of organic aerosol particles generated by atomization of water and methanol solutions",2007,"Atmospheric Chemistry and Physics","7","11",,"2949","2971",,27,,"https://www.scopus.com/inward/record.uri?eid=2-s2.0-34250324705&partnerID=40&md5=52ce4216946d1487f9aa2ddef115c072",Article,Scopus,2-s2.0-34250324705
"Murphy, S.M., Sorooshian, A., Kroll, J.H., Ng, N.L., Chhabra, P., Tong, C., Surratt, J.D., Knipping, E., Flagan, R.C., Seinfeld, J.H.","Secondary aerosol formation from atmospheric reactions of aliphatic amines",2007,"Atmospheric Chemistry and Physics","7","9",,"2313","2337",,149,,"https://www.scopus.com/inward/record.uri?eid=2-s2.0-34248352241&partnerID=40&md5=7bbc01c3f42d02e78515fa932162bd51",Article,Scopus,2-s2.0-34248352241
"Surratt, J.D., Kroll, J.H., Kleindienst, T.E., Edney, E.O., Claeys, M., Sorooshian, A., Ng, N.L., Offenberg, J.H., Lewandowski, M., Jaoui, M., Flagan, R.C., Seinfeld, J.H.","Evidence for organosulfates in secondary organic aerosol",2007,"Environmental Science and Technology","41","2",,"517","527",,284,10.1021/es062081q,"https://www.scopus.com/inward/record.uri?eid=2-s2.0-33846202070&doi=10.1021%2fes062081q&partnerID=40&md5=5cdfaf9a9cb83e11f9aba651161a2a9c",Article,Scopus,2-s2.0-33846202070
"Szmigielski, R., Surratt, J.D., Vermeylen, R., Szmigielska, K., Kroll, J.H., Ng, N.L., Murphy, S.M., Sorooshian, A., Seinfeld, J.H., Claeys, M.","Characterization of 2-methylglyceric acid oligomers in secondary organic aerosol formed from the photooxidation of isoprene using trimethylsilylation and gas chromatography/ion trap mass spectrometry",2007,"Journal of Mass Spectrometry","42","1",,"101","116",,82,10.1002/jms.1146,"https://www.scopus.com/inward/record.uri?eid=2-s2.0-33846578160&doi=10.1002%2fjms.1146&partnerID=40&md5=0d3494341a88c8d3cf0748714e6ef61b",Article,Scopus,2-s2.0-33846578160
"Surratt, J.D., Murphy, S.M., Kroll, J.H., Ng, N.L., Hildebrandt, L., Sorooshian, A., Szmigielski, R., Vermeylen, R., Maenhaut, W., Claeys, M., Flagan, R.C., Seinfeld, J.H.","Chemical composition of secondary organic aerosol formed from the photooxidation of isoprene",2006,"Journal of Physical Chemistry A","110","31",,"9665","9690",,306,10.1021/jp061734m,"https://www.scopus.com/inward/record.uri?eid=2-s2.0-33748262866&doi=10.1021%2fjp061734m&partnerID=40&md5=4ea1b834215d56a96a2ee6ab7172d79c",Article,Scopus,2-s2.0-33748262866
"Gao, S., Surratt, J.D., Knipping, E.M., Edgerton, E.S., Shahgholi, M., Seinfeld, J.H.","Characterization of polar organic components in fine aerosols in the southeastern United States: Identity, origin, and evolution",2006,"Journal of Geophysical Research Atmospheres","111","14", D14314,"","",,78,10.1029/2005JD006601,"https://www.scopus.com/inward/record.uri?eid=2-s2.0-33846084788&doi=10.1029%2f2005JD006601&partnerID=40&md5=bb17f50a9bb1bbc2a9fe70d9812a1f44",Article,Scopus,2-s2.0-33846084788
"Gao, S., Keywood, M., Ng, N.L., Surratt, J., Varutbangkul, V., Bahreini, R., Flagan, R.C., Seinfeld, J.H.","Low-molecular-weight and oligomeric components in secondary organic aerosol from the ozonolysis of cycloalkenes and α-pinene",2004,"Journal of Physical Chemistry A","108","46",,"10147","10164",,216,10.1021/jp047466e,"https://www.scopus.com/inward/record.uri?eid=2-s2.0-9944249167&doi=10.1021%2fjp047466e&partnerID=40&md5=78cf89560b1e3c9dc466030117de3024",Article,Scopus,2-s2.0-9944249167
"Negri, A.J., Adler, R.F., Xu, L., Surratt, J.","The impact of Amazonian deforestation on dry season rainfall",2004,"Journal of Climate","17","6",,"1306","1319",,69,,"https://www.scopus.com/inward/record.uri?eid=2-s2.0-1842739479&partnerID=40&md5=6c8da34dd1cc1ec28d70605796867f3d",Article,Scopus,2-s2.0-1842739479
