Authors,Title,Year,Source title,Volume,Issue,Art. No.,Page start,Page end,Page count,Cited by,DOI,Link,Document Type,Source,EID
"Karambelas, A., Pye, H.O.T., Budisulistiorini, S.H., Surratt, J.D., Pinder, R.W.","Contribution of Isoprene Epoxydiol to Urban Organic Aerosol: Evidence from Modeling and Measurements",2014,"Environmental Science and Technology Letters","1","6",,"278","283",,5,10.1021/ez5001353,"https://www.scopus.com/inward/record.uri?eid=2-s2.0-84969263597&doi=10.1021%2fez5001353&partnerID=40&md5=c2b2be7edeb9090c7e9e93e0c36c032e",Article,Scopus,2-s2.0-84969263597
"Kristensen, K., Cui, T., Zhang, H., Gold, A., Glasius, M., Surratt, J.D.","Dimers in α-pinene secondary organic aerosol: Effect of hydroxyl radical, ozone, relative humidity and aerosol acidity",2014,"Atmospheric Chemistry and Physics","14","8",,"4201","4218",,32,10.5194/acp-14-4201-2014,"https://www.scopus.com/inward/record.uri?eid=2-s2.0-84899476583&doi=10.5194%2facp-14-4201-2014&partnerID=40&md5=d8350cc3c521d5d5d71176a665f70ace",Article,Scopus,2-s2.0-84899476583
"Zhang, H., Zhang, Z., Cui, T., Lin, Y.-H., Bhathela, N.A., Ortega, J., Worton, D.R., Goldstein, A.H., Guenther, A., Jimenez, J.L., Gold, A., Surratt, J.D.","Secondary Organic Aerosol Formation via 2-Methyl-3-buten-2-ol Photooxidation: Evidence of Acid-Catalyzed Reactive Uptake of Epoxides",2014,"Environmental Science and Technology Letters","1","4",,"242","247",,7,10.1021/ez500055f,"https://www.scopus.com/inward/record.uri?eid=2-s2.0-84969217573&doi=10.1021%2fez500055f&partnerID=40&md5=ccd40c6a8e19e9d31bd74e7db3a108f4",Article,Scopus,2-s2.0-84969217573
"Alier, M., Osto, M.D., Lin, Y.-H., Surratt, J.D., Tauler, R., Grimalt, J.O., van Drooge, B.L.","On the origin of water-soluble organic tracer compounds in fine aerosols in two cities: the case of Los Angeles and Barcelona",2014,"Environmental Science and Pollution Research","21","20",,"11649","11660",,,10.1007/s11356-013-2460-9,"https://www.scopus.com/inward/record.uri?eid=2-s2.0-84891360748&doi=10.1007%2fs11356-013-2460-9&partnerID=40&md5=7e614fd3672459e028679ef95732bac8",Article,Scopus,2-s2.0-84891360748
"Lin, Y.-H., Sexton, K.G., Jaspers, I., Li, Y.-R., Surratt, J.D., Vizuete, W.","Application of chemical vapor generation systems to deliver constant gas concentrations for in vitro exposure to volatile organic compounds",2014,"Environmental Sciences: Processes and Impacts","16","12",,"2703","2710",,,10.1039/c4em00465e,"https://www.scopus.com/inward/record.uri?eid=2-s2.0-84912077203&doi=10.1039%2fc4em00465e&partnerID=40&md5=2f88ad39b74833bcca83c0ea2ccd9afb",Article,Scopus,2-s2.0-84912077203
"Lin, Y.-H., Budisulistiorini, S.H., Chu, K., Siejack, R.A., Zhang, H., Riva, M., Zhang, Z., Gold, A., Kautzman, K.E., Surratt, J.D.","Light-absorbing oligomer formation in secondary organic aerosol from reactive uptake of isoprene epoxydiols",2014,"Environmental Science and Technology","48","20",,"12012","12021",,44,10.1021/es503142b,"https://www.scopus.com/inward/record.uri?eid=2-s2.0-84908147836&doi=10.1021%2fes503142b&partnerID=40&md5=a58c625c6ddf0f3d5a29f98932dd5a75",Article,Scopus,2-s2.0-84908147836
"Staudt, S., Kundu, S., Lehmler, H.-J., He, X., Cui, T., Lin, Y.-H., Kristensen, K., Glasius, M., Zhang, X., Weber, R.J., Surratt, J.D., Stone, E.A.","Aromatic organosulfates in atmospheric aerosols: Synthesis, characterization, and abundance",2014,"Atmospheric Environment","94",,,"366","373",,20,10.1016/j.atmosenv.2014.05.049,"https://www.scopus.com/inward/record.uri?eid=2-s2.0-84901485073&doi=10.1016%2fj.atmosenv.2014.05.049&partnerID=40&md5=c89a4ba494c5f3b618e6e0d40ca176b9",Article,Scopus,2-s2.0-84901485073
"Surratt, J.D.","Radical regeneration from isoprene",2013,"Nature Geoscience","6","12",,"995","996",,2,10.1038/ngeo2022,"https://www.scopus.com/inward/record.uri?eid=2-s2.0-84889063941&doi=10.1038%2fngeo2022&partnerID=40&md5=be68c72c88988c80c75e84b30ec7465a",Note,Scopus,2-s2.0-84889063941
"Worton, D.R., Surratt, J.D., Lafranchi, B.W., Chan, A.W.H., Zhao, Y., Weber, R.J., Park, J.-H., Gilman, J.B., De Gouw, J., Park, C., Schade, G., Beaver, M., Clair, J.M.S., Crounse, J., Wennberg, P., Wolfe, G.M., Harrold, S., Thornton, J.A., Farmer, D.K., Docherty, K.S., Cubison, M.J., Jimenez, J.-L., Frossard, A.A., Russell, L.M., Kristensen, K., Glasius, M., Mao, J., Ren, X., Brune, W., Browne, E.C., Pusede, S.E., Cohen, R.C., Seinfeld, J.H., Goldstein, A.H.","Observational insights into aerosol formation from isoprene",2013,"Environmental Science and Technology","47","20",,"11403","11413",,37,10.1021/es4011064,"https://www.scopus.com/inward/record.uri?eid=2-s2.0-84886907447&doi=10.1021%2fes4011064&partnerID=40&md5=99a4fa2b49c6304eb85795c08b15b84d",Article,Scopus,2-s2.0-84886907447
"Pratt, K.A., Fiddler, M.N., Shepson, P.B., Carlton, A.G., Surratt, J.D.","Organosulfates in cloud water above the Ozarks' isoprene source region",2013,"Atmospheric Environment","77",,,"231","238",,14,10.1016/j.atmosenv.2013.05.011,"https://www.scopus.com/inward/record.uri?eid=2-s2.0-84878733496&doi=10.1016%2fj.atmosenv.2013.05.011&partnerID=40&md5=0f4503ed5b19c8c4d150119f3eda23a2",Article,Scopus,2-s2.0-84878733496
"Pye, H.O.T., Pinder, R.W., Piletic, I.R., Xie, Y., Capps, S.L., Lin, Y.-H., Surratt, J.D., Zhang, Z., Gold, A., Luecken, D.J., Hutzell, W.T., Jaoui, M., Offenberg, J.H., Kleindienst, T.E., Lewandowski, M., Edney, E.O.","Epoxide pathways improve model predictions of isoprene markers and reveal key role of acidity in aerosol formation",2013,"Environmental Science and Technology","47","19",,"11056","11064",,65,10.1021/es402106h,"https://www.scopus.com/inward/record.uri?eid=2-s2.0-84885134974&doi=10.1021%2fes402106h&partnerID=40&md5=63a3c8036be2260544c8fb80d69e3b73",Article,Scopus,2-s2.0-84885134974
"Lin, Y.-H., Knipping, E.M., Edgerton, E.S., Shaw, S.L., Surratt, J.D.","Investigating the influences of SO2 and NH3 levels on isoprene-derived secondary organic aerosol formation using conditional sampling approaches",2013,"Atmospheric Chemistry and Physics","13","16",,"8457","8470",,50,10.5194/acp-13-8457-2013,"https://www.scopus.com/inward/record.uri?eid=2-s2.0-84883202980&doi=10.5194%2facp-13-8457-2013&partnerID=40&md5=780323f4f0a9a7942c03f998b3fd5ab9",Article,Scopus,2-s2.0-84883202980
"Hayes, P.L., Ortega, A.M., Cubison, M.J., Froyd, K.D., Zhao, Y., Cliff, S.S., Hu, W.W., Toohey, D.W., Flynn, J.H., Lefer, B.L., Grossberg, N., Alvarez, S., Rappenglück, B., Taylor, J.W., Allan, J.D., Holloway, J.S., Gilman, J.B., Kuster, W.C., De Gouw, J.A., Massoli, P., Zhang, X., Liu, J., Weber, R.J., Corrigan, A.L., Russell, L.M., Isaacman, G., Worton, D.R., Kreisberg, N.M., Goldstein, A.H., Thalman, R., Waxman, E.M., Volkamer, R., Lin, Y.H., Surratt, J.D., Kleindienst, T.E., Offenberg, J.H., Dusanter, S., Griffith, S., Stevens, P.S., Brioude, J., Angevine, W.M., Jimenez, J.L.","Organic aerosol composition and sources in Pasadena, California, during the 2010 CalNex campaign",2013,"Journal of Geophysical Research Atmospheres","118","16",,"9233","9257",,83,10.1002/jgrd.50530,"https://www.scopus.com/inward/record.uri?eid=2-s2.0-84885144421&doi=10.1002%2fjgrd.50530&partnerID=40&md5=3b882e706ef6fbebc39a6fc77b4fca09",Article,Scopus,2-s2.0-84885144421
"Zhang, H., Parikh, H.M., Bapat, J., Lin, Y.-H., Surratt, J.D., Kamens, R.M.","Modelling of secondary organic aerosol formation from isoprene photooxidation chamber studies using different approaches",2013,"Environmental Chemistry","10","3",,"194","209",,3,10.1071/EN13029,"https://www.scopus.com/inward/record.uri?eid=2-s2.0-84879924471&doi=10.1071%2fEN13029&partnerID=40&md5=8ec1408de5aea81c3d5c60ddaf41ab1f",Article,Scopus,2-s2.0-84879924471
"Rollins, A.W., Pusede, S., Wooldridge, P., Min, K.-E., Gentner, D.R., Goldstein, A.H., Liu, S., Day, D.A., Russell, L.M., Rubitschun, C.L., Surratt, J.D., Cohen, R.C.","Gas/particle partitioning of total alkyl nitrates observed with TD-LIF in Bakersfield",2013,"Journal of Geophysical Research Atmospheres","118","12",,"6651","6662",,20,10.1002/jgrd.50522,"https://www.scopus.com/inward/record.uri?eid=2-s2.0-84880879393&doi=10.1002%2fjgrd.50522&partnerID=40&md5=6ca10d2e76094280b0e209b102e91d69",Article,Scopus,2-s2.0-84880879393
"Chan, A.W.H., Isaacman, G., Wilson, K.R., Worton, D.R., Ruehl, C.R., Nah, T., Gentner, D.R., Dallmann, T.R., Kirchstetter, T.W., Harley, R.A., Gilman, J.B., Kuster, W.C., De Gouw, J.A., Offenberg, J.H., Kleindienst, T.E., Lin, Y.H., Rubitschun, C.L., Surratt, J.D., Hayes, P.L., Jimenez, J.L., Goldstein, A.H.","Detailed chemical characterization of unresolved complex mixtures in atmospheric organics: Insights into emission sources, atmospheric processing, and secondary organic aerosol formation",2013,"Journal of Geophysical Research Atmospheres","118","12",,"6783","6796",,27,10.1002/jgrd.50533,"https://www.scopus.com/inward/record.uri?eid=2-s2.0-84880901951&doi=10.1002%2fjgrd.50533&partnerID=40&md5=00beb616ed552acfd959b98711a85322",Article,Scopus,2-s2.0-84880901951
"Ryerson, T.B., Andrews, A.E., Angevine, W.M., Bates, T.S., Brock, C.A., Cairns, B., Cohen, R.C., Cooper, O.R., De Gouw, J.A., Fehsenfeld, F.C., Ferrare, R.A., Fischer, M.L., Flagan, R.C., Goldstein, A.H., Hair, J.W., Hardesty, R.M., Hostetler, C.A., Jimenez, J.L., Langford, A.O., McCauley, E., McKeen, S.A., Molina, L.T., Nenes, A., Oltmans, S.J., Parrish, D.D., Pederson, J.R., Pierce, R.B., Prather, K., Quinn, P.K., Seinfeld, J.H., Senff, C.J., Sorooshian, A., Stutz, J., Surratt, J.D., Trainer, M., Volkamer, R., Williams, E.J., Wofsy, S.C.","The 2010 California Research at the Nexus of Air Quality and Climate Change (CalNex) field study",2013,"Journal of Geophysical Research Atmospheres","118","11",,"5830","5866",,97,10.1002/jgrd.50331,"https://www.scopus.com/inward/record.uri?eid=2-s2.0-84875876234&doi=10.1002%2fjgrd.50331&partnerID=40&md5=b25361e19a83959725ef3bff89a1c0bf",Article,Scopus,2-s2.0-84875876234
"Budisulistiorini, S.H., Canagaratna, M.R., Croteau, P.L., Marth, W.J., Baumann, K., Edgerton, E.S., Shaw, S.L., Knipping, E.M., Worsnop, D.R., Jayne, J.T., Gold, A., Surratt, J.D.","Real-time continuous characterization of secondary organic aerosol derived from isoprene epoxydiols in downtown Atlanta, Georgia, using the aerodyne aerosol chemical speciation monitor",2013,"Environmental Science and Technology","47","11",,"5686","5694",,83,10.1021/es400023n,"https://www.scopus.com/inward/record.uri?eid=2-s2.0-84878638068&doi=10.1021%2fes400023n&partnerID=40&md5=0c8d382a4c146673bb339401493a57aa",Article,Scopus,2-s2.0-84878638068
"Lund, A.K., Doyle-Eisele, M., Lin, Y.-H., Arashiro, M., Surratt, J.D., Holmes, T., Schilling, K.A., Seinfeld, J.H., Rohr, A.C., Knipping, E.M., McDonald, J.D.","The effects of α-pinene versus toluene-derived secondary organic aerosol exposure on the expression of markers associated with vascular disease",2013,"Inhalation Toxicology","25","6",,"309","324",,5,10.3109/08958378.2013.782080,"https://www.scopus.com/inward/record.uri?eid=2-s2.0-84878905211&doi=10.3109%2f08958378.2013.782080&partnerID=40&md5=ca014e8c2578466426153613348e4cd7",Article,Scopus,2-s2.0-84878905211
"Lin, Y.-H., Zhang, H., Pye, H.O.T., Zhang, Z., Marth, W.J., Park, S., Arashiro, M., Cui, T., Budisulistiorini, S.H., Sexton, K.G., Vizuete, W., Xie, Y., Luecken, D.J., Piletic, I.R., Edney, E.O., Bartolotti, L.J., Gold, A., Surratt, J.D.","Epoxide as a precursor to secondary organic aerosol formation from isoprene photooxidation in the presence of nitrogen oxides",2013,"Proceedings of the National Academy of Sciences of the United States of America","110","17",,"6718","6723",,93,10.1073/pnas.1221150110,"https://www.scopus.com/inward/record.uri?eid=2-s2.0-84876886238&doi=10.1073%2fpnas.1221150110&partnerID=40&md5=adcf982d60f0cef1b1ae6f2e71177840",Article,Scopus,2-s2.0-84876886238
"Zhang, X., Lin, Y.-H., Surratt, J.D., Weber, R.J.","Sources, composition and absorption Ångström exponent of light-absorbing organic components in aerosol extracts from the los angeles basin",2013,"Environmental Science and Technology","47","8",,"3685","3693",,81,10.1021/es305047b,"https://www.scopus.com/inward/record.uri?eid=2-s2.0-84876225604&doi=10.1021%2fes305047b&partnerID=40&md5=0a92334570d7aecc8dc1dc001b35b025",Article,Scopus,2-s2.0-84876225604
"Shaw, S.L., Baumann, K., Budisulistiorini, S., Canagaratna, M., Croteau, P., Edgerton, E., Jansen, J., Jayne, J., Knipping, E., Kollman, M., Mueller, S., Ng, S., Surratt, J., Tanner, R., Verma, V., Weber, R., Worsnop, D.","Operation of the Aerosol Chemical Speciation Monitor (ACSM) in the southeastern U.S.",2013,"Air and Waste Management Association - Air Quality Measurement Methods and Technology Conference 2013",,,,"319","331",,,,"https://www.scopus.com/inward/record.uri?eid=2-s2.0-84902289159&partnerID=40&md5=6c7dd47fa7c0854717338df7adda54d2",Conference Paper,Scopus,2-s2.0-84902289159
"Shaw, S.L., Baumann, K., Budisulistiorini, S., Canagaratna, M., Croteau, P., Edgerton, E., Jansen, J., Jayne, J., Knipping, E., Marth, W., Mueller, S., Ng, S., Surratt, J., Tanner, R., Weber, R.","Operation of the aerosol chemical speciation monitor (ACSM) in the southeastern U.S",2012,"Air and Waste Management Association - Air Quality Measurement Methods and Technology Conference 2012",,,,"110","114",,1,,"https://www.scopus.com/inward/record.uri?eid=2-s2.0-84879764698&partnerID=40&md5=103d8f7a3115231cddafe09d153699ff",Conference Paper,Scopus,2-s2.0-84879764698
"Zhang, Z., Lin, Y.-H., Zhang, H., Surratt, J.D., Ball, L.M., Gold, A.","Technical Note: Synthesis of isoprene atmospheric oxidation products: Isomeric epoxydiols and the rearrangement products cis-and trans-3-methyl-3,4- dihydroxytetrahydrofuran",2012,"Atmospheric Chemistry and Physics","12","18",,"8529","8535",,29,10.5194/acp-12-8529-2012,"https://www.scopus.com/inward/record.uri?eid=2-s2.0-84869061351&doi=10.5194%2facp-12-8529-2012&partnerID=40&md5=40c8bbf65585e7f3c7917267aa260906",Article,Scopus,2-s2.0-84869061351
"Zhang, H., Worton, D.R., Lewandowski, M., Ortega, J., Rubitschun, C.L., Park, J.-H., Kristensen, K., Campuzano-Jost, P., Day, D.A., Jimenez, J.L., Jaoui, M., Offenberg, J.H., Kleindienst, T.E., Gilman, J., Kuster, W.C., De Gouw, J., Park, C., Schade, G.W., Frossard, A.A., Russell, L., Kaser, L., Jud, W., Hansel, A., Cappellin, L., Karl, T., Glasius, M., Guenther, A., Goldstein, A.H., Seinfeld, J.H., Gold, A., Kamens, R.M., Surratt, J.D.","Organosulfates as tracers for secondary organic aerosol (SOA) formation from 2-methyl-3-buten-2-ol (MBO) in the atmosphere",2012,"Environmental Science and Technology","46","17",,"9437","9446",,46,10.1021/es301648z,"https://www.scopus.com/inward/record.uri?eid=2-s2.0-84865763274&doi=10.1021%2fes301648z&partnerID=40&md5=b696aeb6bea6ef9293a1bfd1b5155f3f",Article,Scopus,2-s2.0-84865763274
"McDonald, J.D., Doyle-Eisele, M., Kracko, D., Lund, A., Surratt, J.D., Hersey, S.P., Seinfeld, J.H., Rohr, A.C., Knipping, E.M.","Cardiopulmonary response to inhalation of secondary organic aerosol derived from gas-phase oxidation of toluene",2012,"Inhalation Toxicology","24","11",,"689","697",,10,10.3109/08958378.2012.712164,"https://www.scopus.com/inward/record.uri?eid=2-s2.0-84866102949&doi=10.3109%2f08958378.2012.712164&partnerID=40&md5=ed844793585a4ef2baa2cac992299b58",Article,Scopus,2-s2.0-84866102949
"Zhang, H., Lin, Y.-H., Zhang, Z., Zhang, X., Shaw, S.L., Knipping, E.M., Weber, R.J., Gold, A., Kamens, R.M., Surratt, J.D.","Secondary organic aerosol formation from methacrolein photooxidation: Roles of NOx level, relative humidity and aerosol acidity",2012,"Environmental Chemistry","9","3",,"247","262",,27,10.1071/EN12004,"https://www.scopus.com/inward/record.uri?eid=2-s2.0-84863512968&doi=10.1071%2fEN12004&partnerID=40&md5=9aadf50cdc26e0d2446511e55869ef6f",Article,Scopus,2-s2.0-84863512968
"Lin, Y.-H., Zhang, Z., Docherty, K.S., Zhang, H., Budisulistiorini, S.H., Rubitschun, C.L., Shaw, S.L., Knipping, E.M., Edgerton, E.S., Kleindienst, T.E., Gold, A., Surratt, J.D.","Isoprene epoxydiols as precursors to secondary organic aerosol formation: Acid-catalyzed reactive uptake studies with authentic compounds",2012,"Environmental Science and Technology","46","1",,"250","258",,145,10.1021/es202554c,"https://www.scopus.com/inward/record.uri?eid=2-s2.0-84855304107&doi=10.1021%2fes202554c&partnerID=40&md5=4a5efdb304009a9faada9c528094c1ef",Article,Scopus,2-s2.0-84855304107
"Liu, S., Ahlm, L., Day, D.A., Russell, L.M., Zhao, Y., Gentner, D.R., Weber, R.J., Goldstein, A.H., Jaoui, M., Offenberg, J.H., Kleindienst, T.E., Rubitschun, C., Surratt, J.D., Sheesley, R.J., Scheller, S.","Secondary organic aerosol formation from fossil fuel sources contribute majority of summertime organic mass at Bakersfield",2012,"Journal of Geophysical Research Atmospheres","117","23", D00V26,"","",,36,10.1029/2012JD018170,"https://www.scopus.com/inward/record.uri?eid=2-s2.0-84871386798&doi=10.1029%2f2012JD018170&partnerID=40&md5=635cc8f5feffa5bba62a6ce240029681",Article,Scopus,2-s2.0-84871386798
"Zhang, X., Lin, Y.-H., Surratt, J.D., Zotter, P., Prévôt, A.S.H., Weber, R.J.","Light-absorbing soluble organic aerosol in Los Angeles and Atlanta: A contrast in secondary organic aerosol",2011,"Geophysical Research Letters","38","21", L21810,"","",,89,10.1029/2011GL049385,"https://www.scopus.com/inward/record.uri?eid=2-s2.0-81155138232&doi=10.1029%2f2011GL049385&partnerID=40&md5=4ee5c061e03714208d2ab099670bfb0a",Article,Scopus,2-s2.0-81155138232
"Worton, D.R., Goldstein, A.H., Farmer, D.K., Docherty, K.S., Jimenez, J.L., Gilman, J.B., Kuster, W.C., De Gouw, J., Williams, B.J., Kreisberg, N.M., Hering, S.V., Bench, G., McKay, M., Kristensen, K., Glasius, M., Surratt, J.D., Seinfeld, J.H.","Origins and composition of fine atmospheric carbonaceous aerosol in the Sierra Nevada Mountains, California",2011,"Atmospheric Chemistry and Physics","11","19",,"10219","10241",,40,10.5194/acp-11-10219-2011,"https://www.scopus.com/inward/record.uri?eid=2-s2.0-79960574357&doi=10.5194%2facp-11-10219-2011&partnerID=40&md5=42423e44107b866e5b2c3ca7318a95e9",Article,Scopus,2-s2.0-79960574357
"Hatch, L.E., Creamean, J.M., Ault, A.P., Surratt, J.D., Chan, M.N., Seinfeld, J.H., Edgerton, E.S., Su, Y., Prather, K.A.","Measurements of isoprene-derived organosulfates in ambient aerosols by aerosol time-of-flight mass spectrometry - Part 2: Temporal variability and formation mechanisms",2011,"Environmental Science and Technology","45","20",,"8648","8655",,36,10.1021/es2011836,"https://www.scopus.com/inward/record.uri?eid=2-s2.0-80054704572&doi=10.1021%2fes2011836&partnerID=40&md5=e19c1f01a99b458db7ba09c96debf8ce",Article,Scopus,2-s2.0-80054704572
"Zhang, H., Surratt, J.D., Lin, Y.H., Bapat, J., Kamens, R.M.","Effect of relative humidity on SOA formation from isoprene/NO photooxidation: Enhancement of 2-methylglyceric acid and its corresponding oligoesters under dry conditions",2011,"Atmospheric Chemistry and Physics","11","13",,"6411","6424",,76,10.5194/acp-11-6411-2011,"https://www.scopus.com/inward/record.uri?eid=2-s2.0-79960157626&doi=10.5194%2facp-11-6411-2011&partnerID=40&md5=7a7c0ae6384169de839f4e24630ab2b1",Article,Scopus,2-s2.0-79960157626
"Hatch, L.E., Creamean, J.M., Ault, A.P., Surratt, J.D., Chan, M.N., Seinfeld, J.H., Edgerton, E.S., Su, Y., Prather, K.A.","Measurements of isoprene-derived organosulfates in ambient aerosols by aerosol time-of-flight mass spectrometry - Part 1: Single particle atmospheric observations in Atlanta",2011,"Environmental Science and Technology","45","12",,"5105","5111",,60,10.1021/es103944a,"https://www.scopus.com/inward/record.uri?eid=2-s2.0-79959263942&doi=10.1021%2fes103944a&partnerID=40&md5=a71db5ad7f3acec09997913221be8d1f",Article,Scopus,2-s2.0-79959263942
"Yasmeen, F., Szmigielski, R., Vermeylen, R., Gõmez-González, Y., Surratt, J.D., Chan, A.W.H., Seinfeld, J.H., Maenhaut, W., Claeys, M.","Mass spectrometric characterization of isomeric terpenoic acids from the oxidation of α-pinene, β-pinene, d-limonene, and Î"" 3-carene in fine forest aerosol",2011,"Journal of Mass Spectrometry","46","4",,"425","442",,36,10.1002/jms.1911,"https://www.scopus.com/inward/record.uri?eid=2-s2.0-79953204313&doi=10.1002%2fjms.1911&partnerID=40&md5=65f962cdcd6f1c6c42bc0838e01d955c",Article,Scopus,2-s2.0-79953204313
"Chan, M.N., Surratt, J.D., Chan, A.W.H., Schilling, K., Offenberg, J.H., Lewandowski, M., Edney, E.O., Kleindienst, T.E., Jaoui, M., Edgerton, E.S., Tanner, R.L., Shaw, S.L., Zheng, M., Knipping, E.M., Seinfeld, J.H.","Influence of aerosol acidity on the chemical composition of secondary organic aerosol from β-caryophyllene",2011,"Atmospheric Chemistry and Physics","11","4",,"1735","1751",,52,10.5194/acp-11-1735-2011,"https://www.scopus.com/inward/record.uri?eid=2-s2.0-79952097193&doi=10.5194%2facp-11-1735-2011&partnerID=40&md5=dbfac685482aa48a91d99e4d49401fe9",Article,Scopus,2-s2.0-79952097193
"Chan, A.W.H., Chan, M.N., Surratt, J.D., Chhabra, P.S., Loza, C.L., Crounse, J.D., Yee, L.D., Flagan, R.C., Wennberg, P.O., Seinfeld, J.H.","Role of aldehyde chemistry and NOx concentrations in secondary organic aerosol formation",2010,"Atmospheric Chemistry and Physics","10","15",,"7169","7188",,92,10.5194/acp-10-7169-2010,"https://www.scopus.com/inward/record.uri?eid=2-s2.0-77955328034&doi=10.5194%2facp-10-7169-2010&partnerID=40&md5=9006024c44943c257e468208f498add9",Article,Scopus,2-s2.0-77955328034
"Wang, X., Gao, S., Yang, X., Chen, H., Chen, J., Zhuang, G., Surratt, J.D., Chan, M.N., Seinfeld, J.H.","Evidence for high molecular weight nitrogen-containing organic salts in urban aerosols",2010,"Environmental Science and Technology","44","12",,"4441","4446",,57,10.1021/es1001117,"https://www.scopus.com/inward/record.uri?eid=2-s2.0-77953532950&doi=10.1021%2fes1001117&partnerID=40&md5=33a2d889110d0f123b0d02aef4a3748e",Article,Scopus,2-s2.0-77953532950
"Chan, M.N., Surratt, J.D., Claeys, M., Edgerton, E.S., Tanner, R.L., Shaw, S.L., Zheng, M., Knipping, E.M., Eddingsaas, N.C., Wennberg, P.O., Seinfeld, J.H.","Characterization and quantification of isoprene-derived epoxydiols in ambient aerosol in the southeastern united states",2010,"Environmental Science and Technology","44","12",,"4590","4596",,80,10.1021/es100596b,"https://www.scopus.com/inward/record.uri?eid=2-s2.0-77953531626&doi=10.1021%2fes100596b&partnerID=40&md5=15b6d581098dc727b3c0469e69946252",Article,Scopus,2-s2.0-77953531626
"Farmer, D.K., Matsunaga, A., Docherty, K.S., Surratt, J.D., Seinfeld, J.H., Ziemann, P.J., Jimenez, J.L.","Response of an aerosol mass spectrometer to organonitrates and organosulfates and implications for atmospheric chemistry",2010,"Proceedings of the National Academy of Sciences of the United States of America","107","15",,"6670","6675",,150,10.1073/pnas.0912340107,"https://www.scopus.com/inward/record.uri?eid=2-s2.0-77951067484&doi=10.1073%2fpnas.0912340107&partnerID=40&md5=ea7b5fa7eeaf15303f104e1e54e845ed",Article,Scopus,2-s2.0-77951067484
"Surratt, J.D., Chan, A.W.H., Eddingsaas, N.C., Chan, M., Loza, C.L., Kwan, A.J., Hersey, S.P., Flagan, R.C., Wennberg, P.O., Seinfeld, J.H.","Reactive intermediates revealed in secondary organic aerosol formation from isoprene",2010,"Proceedings of the National Academy of Sciences of the United States of America","107","15",,"6640","6645",,308,10.1073/pnas.0911114107,"https://www.scopus.com/inward/record.uri?eid=2-s2.0-77951058233&doi=10.1073%2fpnas.0911114107&partnerID=40&md5=d44a0414eec2240bd8de2fd05be239e0",Article,Scopus,2-s2.0-77951058233
"McDonald, J.D., Doyle-Eisele, M., Campen, M.J., Seagrave, J., Holmes, T., Lund, A., Surratt, J.D., Seinfeld, J.H., Rohr, A.C., Knipping, E.M.","Cardiopulmonary response to inhalation of biogenic secondary organic aerosol",2010,"Inhalation Toxicology","22","3",,"253","265",,21,10.3109/08958370903148114,"https://www.scopus.com/inward/record.uri?eid=2-s2.0-77149152786&doi=10.3109%2f08958370903148114&partnerID=40&md5=e3eeab5f97a2a19fe726e0adf559ecb4",Review,Scopus,2-s2.0-77149152786
"Kautzman, K.E., Surratt, J.D., Chan, M.N., Chan, A.W.H., Hersey, S.P., Chhabra, P.S., Dalleska, N.F., Wennberg, P.O., Flagan, R.C., Seinfeld, J.H.","Chemical composition of gas- and aerosol-phase products from the photooxidation of naphthalene",2010,"Journal of Physical Chemistry A","114","2",,"913","934",,90,10.1021/jp908530s,"https://www.scopus.com/inward/record.uri?eid=2-s2.0-75249095113&doi=10.1021%2fjp908530s&partnerID=40&md5=2cd9b023605abda55c72232a98b911cd",Article,Scopus,2-s2.0-75249095113
"Claeys, M., Wang, W., Vermeylen, R., Kourtchev, I., Chi, X., Farhat, Y., Surratt, J.D., Gómez-González, Y., Sciare, J., Maenhaut, W.","Chemical characterisation of marine aerosol at Amsterdam Island during the austral summer of 2006-2007",2010,"Journal of Aerosol Science","41","1",,"13","22",,50,10.1016/j.jaerosci.2009.08.003,"https://www.scopus.com/inward/record.uri?eid=2-s2.0-73649140296&doi=10.1016%2fj.jaerosci.2009.08.003&partnerID=40&md5=009918b7bf89783bde90e9fe7d35468b",Article,Scopus,2-s2.0-73649140296
"Chan, M.N., Chan, A.W.H., Chhabra, P.S., Surratt, J.D., Seinfeld, J.H.","Modeling of secondary organic aerosol yields from laboratory chamber data",2009,"Atmospheric Chemistry and Physics","9","15",,"5669","5680",,15,,"https://www.scopus.com/inward/record.uri?eid=2-s2.0-74049156578&partnerID=40&md5=66af41db27a7db8a491d035c7d6a44b0",Article,Scopus,2-s2.0-74049156578
"Galloway, M.M., Chhabra, P.S., Chan, A.W.H., Surratt, J.D., Flagan, R.C., Seinfeld, J.H., Keutsch, F.N.","Glyoxal uptake on ammonium sulphate seed aerosol: Reaction products and reversibility of uptake under dark and irradiated conditions",2009,"Atmospheric Chemistry and Physics","9","10",,"3331","3345",,197,,"https://www.scopus.com/inward/record.uri?eid=2-s2.0-70349112853&partnerID=40&md5=cbfa52af2454d2a9f34618dfba2f70ac",Article,Scopus,2-s2.0-70349112853
