Authors,Title,Year,Source title,Volume,Issue,Art. No.,Page start,Page end,Page count,Cited by,DOI,Link,Document Type,Source,EID
"Odegard, G., Searles, K., Kumosa, M.","A continuum elastic-plastic model for woven-fabric/polymer-matrix composite materials under biaxial stresses",2001,"Composites Science and Technology","61","16",,"2501","2510",,9,10.1016/S0266-3538(01)00168-3,"https://www.scopus.com/inward/record.uri?eid=2-s2.0-0035655643&doi=10.1016%2fS0266-3538%2801%2900168-3&partnerID=40&md5=e5b944cb932a3df829053790eb2f54f1",Article,Scopus,2-s2.0-0035655643
"Searles, K., Odegard, G., Kumosa, M.","Micro- and mesomechanics of 8-harness satin woven fabric composites: I - Evaluation of elastic behavior",2001,"Composites - Part A: Applied Science and Manufacturing","32","11",,"1627","1655",,32,10.1016/S1359-835X(00)00181-0,"https://www.scopus.com/inward/record.uri?eid=2-s2.0-0035501177&doi=10.1016%2fS1359-835X%2800%2900181-0&partnerID=40&md5=66845c17ef7c3bb1fe4769a9741e6221",Article,Scopus,2-s2.0-0035501177
"Odegard, G.M., Harik, V.M., Wise, K.E., Gates, T.S.","Constitutive modeling of nanotube-reinforced polymer composite systems",2001,"NASA Technical Memorandum",,"211044",,"1","10",,,,"https://www.scopus.com/inward/record.uri?eid=2-s2.0-27844560880&partnerID=40&md5=877033374ecf5ebf5b62d55f4083799e",Article,Scopus,2-s2.0-27844560880
"Odegard, G., Armentrout, D., Searles, K., Kumosa, L., Sutter, J.K., Kumosa, M.","Failure Analysis of ±45° Off-Axis Woven Fabric Composite Specimens",2001,"Journal of Composites Technology and Research","23","3",,"205","224",,11,,"https://www.scopus.com/inward/record.uri?eid=2-s2.0-0001609934&partnerID=40&md5=fa72f92eaa866f1511bcdacf0653acdf",Article,Scopus,2-s2.0-0001609934
"Odegard, G.M., Gates, T.S., Nicholson, L.M., Wise, K.E.","Equivalent-continuum modeling of nano-structured materials",2001,"NASA Technical Memorandum",,"210863",,"1","21",,4,,"https://www.scopus.com/inward/record.uri?eid=2-s2.0-16244422714&partnerID=40&md5=88ff0cfb587ba1bb574bd59ee214d179",Article,Scopus,2-s2.0-16244422714
"Odegard, G., Kumosa, M.","Elastic-plastic and failure properties of a unidirectional carbon/PMR-15 composite at room and elevated temperatures",2000,"Composites Science and Technology","60","16",,"2979","2988",,52,10.1016/S0266-3538(00)00163-9,"https://www.scopus.com/inward/record.uri?eid=2-s2.0-0034502047&doi=10.1016%2fS0266-3538%2800%2900163-9&partnerID=40&md5=46d5fbb2e011beeb97893b7faafd358c",Article,Scopus,2-s2.0-0034502047
"Odegard, G., Kumosa, M.","Determination of shear strength of unidirectional composite materials with the Iosipescu and 10°off-axis shear tests",2000,"Composites Science and Technology","60","16",,"2917","2943",,58,10.1016/S0266-3538(00)00141-X,"https://www.scopus.com/inward/record.uri?eid=2-s2.0-0034534983&doi=10.1016%2fS0266-3538%2800%2900141-X&partnerID=40&md5=db6ab209972d53f2b704b352323561ad",Article,Scopus,2-s2.0-0034534983
"Odegard, G., Searles, K., Kumosa, M.","Nonlinear analysis of woven fabric-reinforced graphite/pmr-15 composites under shear-dominated biaxial loads",2000,"Mechanics of Composite Materials and Structures","7","2",,"129","152",,23,10.1080/107594100305348,"https://www.scopus.com/inward/record.uri?eid=2-s2.0-0034386206&doi=10.1080%2f107594100305348&partnerID=40&md5=c2f535f410264a1083354f9be065ffcd",Article,Scopus,2-s2.0-0034386206
"Odegard, G., Kumosa, M.","Elasto-Plastic Analysis of the Iosipescu Shear Test",1999,"Journal of Composite Materials","33","21",,"1981","2001",,13,,"https://www.scopus.com/inward/record.uri?eid=2-s2.0-0000003516&partnerID=40&md5=3c2648ac217605b102ed38c981a772c2",Article,Scopus,2-s2.0-0000003516
"Searles, K., Odegard, G., Kumosa, M., Castelli, M.","Failure Investigation of Graphite/Polyimide Fabric Composites at Room and Elevated Temperatures Using the Biaxial Iosipescu Test",1999,"Journal of Composite Materials","33","22",,"2038","2079",,15,,"https://www.scopus.com/inward/record.uri?eid=2-s2.0-0001329637&partnerID=40&md5=6def9c81922b556e0afd5a48e6646cbb",Article,Scopus,2-s2.0-0001329637
"Odegard, G., Searles, K., Kumosa, M.","Critical examination of the iosipescu shear test as applied to 0° unidirectional composite materials",1999,"Mechanics of Composite Materials and Structures","6","3",,"229","256",,7,10.1080/107594199305548,"https://www.scopus.com/inward/record.uri?eid=2-s2.0-0000419739&doi=10.1080%2f107594199305548&partnerID=40&md5=2354ab7e6d49fa353424757fdecb4e8e",Article,Scopus,2-s2.0-0000419739
