Authors,Title,Year,Source title,Volume,Issue,Art. No.,Page start,Page end,Page count,Cited by,DOI,Link,Document Type,Source,EID
"Bandyopadhyay, A., Valavala, P.K., Clancy, T.C., Wise, K.E., Odegard, G.M.","Molecular modeling of crosslinked epoxy polymers: The effect of crosslink density on thermomechanical properties",2011,"Polymer","52","11",,"2445","2452",,95,10.1016/j.polymer.2011.03.052,"https://www.scopus.com/inward/record.uri?eid=2-s2.0-79955644512&doi=10.1016%2fj.polymer.2011.03.052&partnerID=40&md5=c90640c5dfd3220640867d3fa97b4e6d",Article,Scopus,2-s2.0-79955644512
"Odegard, G.M.","Multiscale modeling of polymer-carbon nanotube composites",2011,"Polymer-Carbon Nanotube Composites: Preparation, Properties and Applications",,,,"376","399",,,10.1533/9780857091390.2.376,"https://www.scopus.com/inward/record.uri?eid=2-s2.0-84904375353&doi=10.1533%2f9780857091390.2.376&partnerID=40&md5=b5ed813b6cc062731475fce73b0eb852",Book Chapter,Scopus,2-s2.0-84904375353
"Abraham, A.C., Moyer, J.T., Villegas, D.F., Odegard, G.M., Haut Donahue, T.L.","Hyperelastic properties of human meniscal attachments",2011,"Journal of Biomechanics","44","3",,"413","418",,19,10.1016/j.jbiomech.2010.10.001,"https://www.scopus.com/inward/record.uri?eid=2-s2.0-78651446195&doi=10.1016%2fj.jbiomech.2010.10.001&partnerID=40&md5=14a557f2d0036fdf39e81365553a54ae",Article,Scopus,2-s2.0-78651446195
"You, Z., Mills-Beale, J., Foley, J.M., Roy, S., Odegard, G.M., Dai, Q., Goh, S.W.","Nanoclay-modified asphalt materials: Preparation and characterization",2011,"Construction and Building Materials","25","2",,"1072","1078",,109,10.1016/j.conbuildmat.2010.06.070,"https://www.scopus.com/inward/record.uri?eid=2-s2.0-78649830500&doi=10.1016%2fj.conbuildmat.2010.06.070&partnerID=40&md5=a562e0788e7b8cb7789c6aa9219cfe00",Article,Scopus,2-s2.0-78649830500
"Bandyopadhyay, A., Jensen, B.D., Valavala, P.K., Odegard, G.M.","Atomistic modeling of cross-linked epoxy polymer",2010,"Collection of Technical Papers - AIAA/ASME/ASCE/AHS/ASC Structures, Structural Dynamics and Materials Conference",,, 2010-2811,"","",,4,,"https://www.scopus.com/inward/record.uri?eid=2-s2.0-84855628512&partnerID=40&md5=4dfc305754142c57be4ec716c8ce9a90",Conference Paper,Scopus,2-s2.0-84855628512
"Morrow, D.A., Haut Donahue, T.L., Odegard, G.M., Kaufman, K.R.","A validated finite element model of force in active and passive skeletal muscle",2010,"ASME 2010 Summer Bioengineering Conference, SBC 2010",,"PARTS A AND B",,"175","176",,,10.1115/SBC2010-19385,"https://www.scopus.com/inward/record.uri?eid=2-s2.0-84893808154&doi=10.1115%2fSBC2010-19385&partnerID=40&md5=da64763561361659b7f2e1eaeabf0754",Conference Paper,Scopus,2-s2.0-84893808154
"Momeni, K., Odegard, G.M., Yassar, R.S.","Nanocomposite electrical generator based on piezoelectric zinc oxide nanowires",2010,"Journal of Applied Physics","108","11", 114303,"","",,27,10.1063/1.3517095,"https://www.scopus.com/inward/record.uri?eid=2-s2.0-78751477315&doi=10.1063%2f1.3517095&partnerID=40&md5=56d6e2792d3f0d2f84cacf5bffdde4ea",Article,Scopus,2-s2.0-78751477315
"Bandyopadhyay, A., Valavala, P.K., Clancy, T.C., Wise, K.E., Odegard, G.M.","Molecular modeling of cross-linked epoxy polymers",2010,"25th Technical Conference of the American Society for Composites and 14th US-Japan Conference on Composite Materials 2010","2",,,"1275","1287",,,,"https://www.scopus.com/inward/record.uri?eid=2-s2.0-84867838768&partnerID=40&md5=f9571a48d43d3f9b14001c581776b021",Conference Paper,Scopus,2-s2.0-84867838768
"Richards, A.W., Odegard, G.M.","Constitutive modeling of electrostrictive polymers using a hyperelasticity-based approach",2010,"Journal of Applied Mechanics, Transactions ASME","77","1",,"1","5",,16,10.1115/1.3173766,"https://www.scopus.com/inward/record.uri?eid=2-s2.0-77955234650&doi=10.1115%2f1.3173766&partnerID=40&md5=0f787ea5c6f5b7ade7422df3ed359668",Article,Scopus,2-s2.0-77955234650
"Morrow, D.A., Donahue, T.H., Odegard, G.M., Kaufman, K.R.","A method for assessing the fit of a constitutive material model to experimental stress-strain data",2010,"Computer Methods in Biomechanics and Biomedical Engineering","13","2",,"247","256",,10,10.1080/10255840903170686,"https://www.scopus.com/inward/record.uri?eid=2-s2.0-77954672839&doi=10.1080%2f10255840903170686&partnerID=40&md5=0367d89c9f0ac9201680c92aa8465b0b",Article,Scopus,2-s2.0-77954672839
"Elangovan, S., Odegard, G.M.","Finite element modeling of Intraneural Ganglion Cysts of the common peroneal nerve",2010,"ASME International Mechanical Engineering Congress and Exposition, Proceedings","11",,,"103","105",,,10.1115/IMECE2009-11637,"https://www.scopus.com/inward/record.uri?eid=2-s2.0-78049368415&doi=10.1115%2fIMECE2009-11637&partnerID=40&md5=c2e8905a915b429c0f649a346b87573e",Conference Paper,Scopus,2-s2.0-78049368415
"Morrow, D.A., Haut Donahue, T.L., Odegard, G.M., Kaufman, K.R.","Transversely isotropic tensile material properties of skeletal muscle tissue",2010,"Journal of the Mechanical Behavior of Biomedical Materials","3","1",,"124","129",,63,10.1016/j.jmbbm.2009.03.004,"https://www.scopus.com/inward/record.uri?eid=2-s2.0-70350569984&doi=10.1016%2fj.jmbbm.2009.03.004&partnerID=40&md5=2b4eb027ca6dd786826d28eba99ffefb",Article,Scopus,2-s2.0-70350569984
"Odegard, G.M.","Multiscale modeling of nanocomposite materials",2009,"Virtual Testing and Predictive Modeling: For Fatigue and Fracture Mechanics Allowables",,,,"221","245",,2,10.1007/978-0-387-95924-5_8,"https://www.scopus.com/inward/record.uri?eid=2-s2.0-84892294951&doi=10.1007%2f978-0-387-95924-5_8&partnerID=40&md5=c591ae5f0175c8e81a3c5631f89010a7",Book Chapter,Scopus,2-s2.0-84892294951
"Valavala, P.K., Odegard, G.M.","Thermodynamically-consistent multiscale constitutive modeling of glassy polymer materials",2009,"IUTAM Bookseries","13",,,"43","51",,,10.1007/978-1-4020-9557-3_6,"https://www.scopus.com/inward/record.uri?eid=2-s2.0-84862295693&doi=10.1007%2f978-1-4020-9557-3_6&partnerID=40&md5=eb5aef46727340db4625530caa6e06b1",Conference Paper,Scopus,2-s2.0-84862295693
"Farahmand, B., Odegard, G.","Obtaining fracture properties by virtual testing and molecular dynamics techniques",2009,"Technical Proceedings of the 2009 NSTI Nanotechnology Conference and Expo, NSTI-Nanotech 2009","2",,,"519","522",,1,,"https://www.scopus.com/inward/record.uri?eid=2-s2.0-77958069993&partnerID=40&md5=9780e4a44a1a682fe49686c25f0750dc",Conference Paper,Scopus,2-s2.0-77958069993
"Valavala, P.K., Odegard, G.M.","Effect of chain length in multiscale constitutive modeling of polymer materials",2009,"Collection of Technical Papers - AIAA/ASME/ASCE/AHS/ASC Structures, Structural Dynamics and Materials Conference",,, 2009-2335,"","",,,,"https://www.scopus.com/inward/record.uri?eid=2-s2.0-84855628377&partnerID=40&md5=0f7ad20c40832d89c6f82a1a4299b5cf",Conference Paper,Scopus,2-s2.0-84855628377
"Morrow, D.A., Haut Donahue, T.L., Odegard, G.M., Kaufman, K.R.","Validation of a finite element model of passive force and pressure in skeletal muscle",2009,"Proceedings of the ASME Summer Bioengineering Conference 2009, SBC2009",,"PART A",,"339","340",,1,10.1115/SBC2009-206211,"https://www.scopus.com/inward/record.uri?eid=2-s2.0-77953940889&doi=10.1115%2fSBC2009-206211&partnerID=40&md5=be46cafce66412783e6378714972c3da",Conference Paper,Scopus,2-s2.0-77953940889
"Morrow, D.A., Haut Donahue, T.L., Odegard, G.M., Kaufman, K.R.","Tensile material properties of skeletal muscle tissue in longitudinal and transverse directions",2009,"Proceedings of the ASME Summer Bioengineering Conference, SBC2008",,"PART B",,"1027","1028",,3,,"https://www.scopus.com/inward/record.uri?eid=2-s2.0-77952619380&partnerID=40&md5=91a8348198c39c3af829d5799cc660a9",Conference Paper,Scopus,2-s2.0-77952619380
"Villegas, D.F., Hauch, K., Odegard, G.M., Haut Donahue, T.L.","Failure properties and material characterization of human meniscal attachments",2009,"Proceedings of the ASME Summer Bioengineering Conference, SBC2008",,"PART A",,"349","350",,1,,"https://www.scopus.com/inward/record.uri?eid=2-s2.0-77952652806&partnerID=40&md5=3d621f299eee3ede31660b9317412d3b",Conference Paper,Scopus,2-s2.0-77952652806
"Bandyopadhyay, A., Valavala, P.K., Odegard, G.M.","Atomistic modelling of crosslinked epoxy polymer",2009,"International SAMPE Technical Conference",,,,"","",,,,"https://www.scopus.com/inward/record.uri?eid=2-s2.0-77949509637&partnerID=40&md5=f4b92ac3da296bd2a55ef4d6a21223ac",Conference Paper,Scopus,2-s2.0-77949509637
"Bandyopadhyay, A., Valavala, P.K., Odegard, G.M.","Atomistic modelling of crosslinked epoxy polymer",2009,"ICCM International Conferences on Composite Materials",,,,"","",,,,"https://www.scopus.com/inward/record.uri?eid=2-s2.0-80052064961&partnerID=40&md5=d03df6b5e21e82b7ef310577418e7276",Conference Paper,Scopus,2-s2.0-80052064961
"Elangovan, S., Odegard, G.M., Morrow, D.A., Wang, H., Hébert-Blouin, M.-N., Spinner, R.J.","Intraneural ganglia: A clinical problem deserving a mechanistic explanation and model",2009,"Neurosurgical Focus","26","2",,"1","7",,2,10.3171/FOC.2009.26.2.E11,"https://www.scopus.com/inward/record.uri?eid=2-s2.0-70349750624&doi=10.3171%2fFOC.2009.26.2.E11&partnerID=40&md5=ef97e7f829442cd419eea3a5ed4abaec",Article,Scopus,2-s2.0-70349750624
"Hauch, K.N., Oyen, M.L., Odegard, G.M., Haut Donahue, T.L.","Nanoindentation of the insertional zones of human meniscal attachments into underlying bone",2009,"Journal of the Mechanical Behavior of Biomedical Materials","2","4",,"339","347",,21,10.1016/j.jmbbm.2008.10.005,"https://www.scopus.com/inward/record.uri?eid=2-s2.0-67349252279&doi=10.1016%2fj.jmbbm.2008.10.005&partnerID=40&md5=4be9ea37f6ab4beaa83c0741e8d464fd",Article,Scopus,2-s2.0-67349252279
"Valavala, P.K., Odegard, G.M., Aifantis, E.C.","Influence of representative volume element size on predicted elastic properties of polymer materials",2009,"Modelling and Simulation in Materials Science and Engineering","17","4", 045004,"","",,12,10.1088/0965-0393/17/4/045004,"https://www.scopus.com/inward/record.uri?eid=2-s2.0-67650718726&doi=10.1088%2f0965-0393%2f17%2f4%2f045004&partnerID=40&md5=5a3949dcb813fc4f7e0591ef714e2d6a",Article,Scopus,2-s2.0-67650718726
"Elangovan, S., Odegard, G.M., Morrow, D.A., Wang, H., Hébert-Blouin, M.N., Spinner, R.J.","Intraneural ganglia: a clinical problem deserving a mechanistic explanation and model.",2009,"Neurosurgical focus","26","2",,"","",,11,10.3171/FOC.2009.26.2.E11,"https://www.scopus.com/inward/record.uri?eid=2-s2.0-67650267185&doi=10.3171%2fFOC.2009.26.2.E11&partnerID=40&md5=cb58300863043c6769f64a208e510a23",Review,Scopus,2-s2.0-67650267185
"Valavala, P.K., Clancy, T.C., Odegard, G.M., Gates, T.S., Aifantis, E.C.","Multiscale modeling of polymer materials using a statistics-based micromechanics approach",2009,"Acta Materialia","57","2",,"525","532",,24,10.1016/j.actamat.2008.09.035,"https://www.scopus.com/inward/record.uri?eid=2-s2.0-57949086024&doi=10.1016%2fj.actamat.2008.09.035&partnerID=40&md5=9ced8b5c83f4919fcc1903aefea1814a",Article,Scopus,2-s2.0-57949086024
"Odegard, G.M., Donahue, T.L.H., Morrow, D.A., Kaufman, K.R.","Constitutive modeling of skeletal muscle tissue with an explicit strain-energy function",2008,"Journal of Biomechanical Engineering","130","6", 061017,"","",,27,10.1115/1.3002766,"https://www.scopus.com/inward/record.uri?eid=2-s2.0-58149195270&doi=10.1115%2f1.3002766&partnerID=40&md5=99b8655f6d8d23cb3a02c3f10bd68561",Article,Scopus,2-s2.0-58149195270
"Elangovan, S., Altan, B.S., Odegard, G.M.","An elastic micropolar mixture theory for predicting elastic properties of cellular materials",2008,"Mechanics of Materials","40","7",,"602","615",,8,10.1016/j.mechmat.2008.02.002,"https://www.scopus.com/inward/record.uri?eid=2-s2.0-41449093497&doi=10.1016%2fj.mechmat.2008.02.002&partnerID=40&md5=7849c2f84afac070e109b075731378c9",Article,Scopus,2-s2.0-41449093497
"Valavala, P.K., Odegard, G.M.","Multiscale constitutive modeling of polymer materials",2008,"ASME International Mechanical Engineering Congress and Exposition, Proceedings","1",,,"179","183",,,10.1115/IMECE2007-41206,"https://www.scopus.com/inward/record.uri?eid=2-s2.0-44349109539&doi=10.1115%2fIMECE2007-41206&partnerID=40&md5=ca09b8787b55d918f67cbb794e7fc92d",Conference Paper,Scopus,2-s2.0-44349109539
"Elangovan, S., Altan, B.S., Odegard, G.M.","An elastic micropolar mixture theory approach for predicting elastic properties of open cell foams",2008,"ASME International Mechanical Engineering Congress and Exposition, Proceedings","10 PART B",,,"913","923",,1,10.1115/IMECE2007-41435,"https://www.scopus.com/inward/record.uri?eid=2-s2.0-44349104235&doi=10.1115%2fIMECE2007-41435&partnerID=40&md5=fc43338f943ee28e655fb26960fce939",Conference Paper,Scopus,2-s2.0-44349104235
"Valavala, P.K., Odegard, G.M.","Multiscale constitutive modeling of polymer materials",2007,"International SAMPE Technical Conference",,,,"","",8,2,,"https://www.scopus.com/inward/record.uri?eid=2-s2.0-80053725529&partnerID=40&md5=98d8b9954d67c0efb4ce86458ee3b21f",Conference Paper,Scopus,2-s2.0-80053725529
"Odegard, G.M., Donahue, T.L.H., Morrow, D.A., Kaufman, K.R.","Constitutive modeling of skeletal muscle tissue",2007,"Proceedings of the ASME Summer Bioengineering Conference 2007, SBC 2007",,,,"873","874",,,,"https://www.scopus.com/inward/record.uri?eid=2-s2.0-40449128768&partnerID=40&md5=fd22d805ddf7eb156081a7bc4e704053",Conference Paper,Scopus,2-s2.0-40449128768
"Valavala, P.K., Clancy, T.C., Odegard, G.M., Gates, T.S.","Parametric studies in multiscale modeling of high-performance polymers",2007,"Collection of Technical Papers - AIAA/ASME/ASCE/AHS/ASC Structures, Structural Dynamics and Materials Conference","6",,,"5606","5617",,,,"https://www.scopus.com/inward/record.uri?eid=2-s2.0-34547507262&partnerID=40&md5=09ffdd68f4a67910a4f3a0c063630baa",Conference Paper,Scopus,2-s2.0-34547507262
"Valavala, P.K., Clancy, T.C., Odegard, G.M., Gates, T.S.","Nonlinear multiscale modeling of polymer materials",2007,"International Journal of Solids and Structures","44","3-4",,"1161","1179",,53,10.1016/j.ijsolstr.2006.06.011,"https://www.scopus.com/inward/record.uri?eid=2-s2.0-33750976373&doi=10.1016%2fj.ijsolstr.2006.06.011&partnerID=40&md5=ae46dd052e2edbe6a49b7221ec06234e",Article,Scopus,2-s2.0-33750976373
"Valavala, O., Odegard, G.M.","Multiscale constitutive modeling of polymer materials",2007,"ASME International Mechanical Engineering Congress and Exposition, Proceedings (IMECE)","1",,,"179","183",,1,10.1115/IMECE200741206,"https://www.scopus.com/inward/record.uri?eid=2-s2.0-84928714774&doi=10.1115%2fIMECE200741206&partnerID=40&md5=432e8e1d8f509ece832816bff4525d10",Conference Paper,Scopus,2-s2.0-84928714774
"Valavala, P.K., Odegard, G.M.","Multiscale modeling of polymer materials at cryogenic and elevated temperatures",2006,"Collection of Technical Papers - AIAA/ASME/ASCE/AHS/ASC Structures, Structural Dynamics and Materials Conference","2",,,"971","983",,1,,"https://www.scopus.com/inward/record.uri?eid=2-s2.0-34247175418&partnerID=40&md5=8d710c2d8eec2226cf13d04d4aca9e5c",Conference Paper,Scopus,2-s2.0-34247175418
"Gates, T.S., Su, X., Abdi, F., Odegard, G.M., Herring, H.M.","Facesheet delamination of composite sandwich materials at cryogenic temperatures",2006,"Composites Science and Technology","66","14",,"2423","2435",,18,10.1016/j.compscitech.2006.01.028,"https://www.scopus.com/inward/record.uri?eid=2-s2.0-33746578528&doi=10.1016%2fj.compscitech.2006.01.028&partnerID=40&md5=6fac32002a6725b202f8db3b0dbd70f8",Article,Scopus,2-s2.0-33746578528
"Odegard, G.M., Gates, T.S.","Modeling and testing of the viscoelastic properties of a graphite nanoplatelet/epoxy composite",2006,"Journal of Intelligent Material Systems and Structures","17","3",,"239","246",,19,10.1177/1045389X06057523,"https://www.scopus.com/inward/record.uri?eid=2-s2.0-33645675083&doi=10.1177%2f1045389X06057523&partnerID=40&md5=b453b70953ff1e90b804cda26a638a78",Article,Scopus,2-s2.0-33645675083
"Odegard, G.M., Clancy, T.C., Gates, T.S.","Prediction of mechanical properties of polymers with various force fields",2005,"Collection of Technical Papers - AIAA/ASME/ASCE/AHS/ASC Structures, Structural Dynamics and Materials Conference","1",,,"586","597",,5,,"https://www.scopus.com/inward/record.uri?eid=2-s2.0-28844433073&partnerID=40&md5=4588e033f4d349b22edc8df3f0de132f",Conference Paper,Scopus,2-s2.0-28844433073
"Gates, T.S., Odegard, G.M., Frankland, S.J.V., Clancy, T.C.","Computational materials: Multi-scale modeling and simulation of nanostructured materials",2005,"Composites Science and Technology","65","15-16 SPEC. ISS.",,"2416","2434",,143,10.1016/j.compscitech.2005.06.009,"https://www.scopus.com/inward/record.uri?eid=2-s2.0-27644540700&doi=10.1016%2fj.compscitech.2005.06.009&partnerID=40&md5=4c6c8df8cf3a435c54519c04f67471d8",Article,Scopus,2-s2.0-27644540700
"Chasiotis, I., Chen, Q., Odegard, G.M., Gates, T.S.","Structure-property relationships in polymer composites with micrometer and submicrometer graphite platelets",2005,"Experimental Mechanics","45","6",,"507","516",,21,10.1177/0014485105059992,"https://www.scopus.com/inward/record.uri?eid=2-s2.0-28844492693&doi=10.1177%2f0014485105059992&partnerID=40&md5=6574c74322b533006634023c65b395af",Article,Scopus,2-s2.0-28844492693
"Frankland, S.J.V., Herzog, M.N., Odegard, G.M., Gates, T.S., Fay, C.C.","Synthesis, characterization, and modeling of nanotube materials with variable stiffness tethers",2005,"Materials Research Society Symposium Proceedings","851",, NN2.8,"71","76",,,,"https://www.scopus.com/inward/record.uri?eid=2-s2.0-23844441886&partnerID=40&md5=67097178954886222a25a6f41b443879",Conference Paper,Scopus,2-s2.0-23844441886
"Odegard, G.M., Frankland, S.J.V., Gates, T.S.","Effect of nanotube functionalization on the elastic properties of polyethylene nanotube composites",2005,"AIAA Journal","43","8",,"1828","1835",,61,,"https://www.scopus.com/inward/record.uri?eid=2-s2.0-24144499579&partnerID=40&md5=5c2c40ddcae0769df928a1764c44f46d",Article,Scopus,2-s2.0-24144499579
"Valavala, P.K., Odegard, G.M.","Modeling techniques for determination of mechanical properties of polymer nanocomposites",2005,"Reviews on Advanced Materials Science","9","1",,"34","44",,119,,"https://www.scopus.com/inward/record.uri?eid=2-s2.0-18844446414&partnerID=40&md5=7ca487ce4f773fa67069022eccb4831b",Review,Scopus,2-s2.0-18844446414
"Odegard, G.M., Gates, T.S., Herring, H.M.","Characterization of viscoelastic properties of polymeric materials through nanoindentation",2005,"Experimental Mechanics","45","2",,"130","136",,122,10.1177/0014485105052320,"https://www.scopus.com/inward/record.uri?eid=2-s2.0-24144455290&doi=10.1177%2f0014485105052320&partnerID=40&md5=bc7c2bf412b7a96a70c80a454c27dbb4",Article,Scopus,2-s2.0-24144455290
"Odegard, G.M., Clancy, T.C., Gates, T.S.","Modeling of the mechanical properties of nanoparticle/polymer composites",2005,"Polymer","46","2",,"553","562",,323,10.1016/j.polymer.2004.11.022,"https://www.scopus.com/inward/record.uri?eid=2-s2.0-11144278536&doi=10.1016%2fj.polymer.2004.11.022&partnerID=40&md5=c46443a06022b3a48bf20265a45aef82",Article,Scopus,2-s2.0-11144278536
"Frankland, S.J.V., Odegard, G.M., Gates, T.S.","The effect of functionalization on double-walled nanotube materials",2005,"Clusters and Nano-Assemblies: Physical and Biological Systems: Richmond, Virginia, U.S.A., 10-13 November, 2003",,,,"181","186",,,10.1142/9789812701879_0021,"https://www.scopus.com/inward/record.uri?eid=2-s2.0-84967693023&doi=10.1142%2f9789812701879_0021&partnerID=40&md5=1000ccdfed5659456ec44182f072593e",Book Chapter,Scopus,2-s2.0-84967693023
"Gates, T.S., Odegard, G.M., Nemeth, M.P., Frankland, S.-J.V.","Predicting the influence of nano-scale material structure on the in-plane buckling of orthotropic plates",2004,"Collection of Technical Papers - AIAA/ASME/ASCE/AHS/ASC Structures, Structural Dynamics and Materials Conference","2",,,"1024","1038",,5,,"https://www.scopus.com/inward/record.uri?eid=2-s2.0-16244389980&partnerID=40&md5=3f23363644255e540d43e1670642b70b",Conference Paper,Scopus,2-s2.0-16244389980
"Odegard, G.M., Franklaruf, S.J.V., Herzog, M.N., Gates, T.S., Fay, C.C.","Constitutive modeling of crosslinked nanotube materials",2004,"Collection of Technical Papers - AIAA/ASME/ASCE/AHS/ASC Structures, Structural Dynamics and Materials Conference","2",,,"1011","1023",,7,,"https://www.scopus.com/inward/record.uri?eid=2-s2.0-16244402652&partnerID=40&md5=42925b37d00f5b59dd4e70d3ccc079e3",Conference Paper,Scopus,2-s2.0-16244402652
"Odegard, G.M.","Constitutive modeling of piezoelectric polymer composites",2004,"Acta Materialia","52","18",,"5315","5330",,113,10.1016/j.actamat.2004.07.037,"https://www.scopus.com/inward/record.uri?eid=2-s2.0-4544361043&doi=10.1016%2fj.actamat.2004.07.037&partnerID=40&md5=980135adf42b011a4c77772d04a7438f",Article,Scopus,2-s2.0-4544361043
"Odegard, G.M., Pipes, R.B., Hubert, P.","Comparison of two models of SWCN polymer composites",2004,"Composites Science and Technology","64","7-8",,"1011","1020",,47,10.1016/j.compscitech.2003.08.010,"https://www.scopus.com/inward/record.uri?eid=2-s2.0-1842734924&doi=10.1016%2fj.compscitech.2003.08.010&partnerID=40&md5=935699db5b04c15f309769aece9c750d",Article,Scopus,2-s2.0-1842734924
"Odegard, G.M., Frankland, S.J.V., Gates, T.S.","The effect of chemical functionalization on mechanical properties of nanotube/polymer composites",2003,"44th AIAA/ASME/ASCE/AHS/ASC Structures, Structural Dynamics, and Materials Conference",,,,"","",,1,,"https://www.scopus.com/inward/record.uri?eid=2-s2.0-84896855681&partnerID=40&md5=25e015cca065e1328cc0a4240a5fe201",Conference Paper,Scopus,2-s2.0-84896855681
"Frankland, S.J.V., Herzog, M.N., Odegard, G.M., Gates, T.S., Fay, C.C.","Modeling and characterization of elastic constants of functionalized nanotube materials",2003,"Materials Research Society Symposium - Proceedings","791",,,"323","328",,3,,"https://www.scopus.com/inward/record.uri?eid=2-s2.0-2442488729&partnerID=40&md5=f72f788e30190476ec3a9e979c0c400a",Conference Paper,Scopus,2-s2.0-2442488729
"Odegard, G.M., Frankland, S.J.V., Gates, T.S.","The effect of chemical functionalization on mechanical properties of nanotube/polymer composites",2003,"Collection of Technical Papers - AIAA/ASME/ASCE/AHS/ASC Structures, Structural Dynamics and Materials Conference","4",,,"2728","2741",,12,,"https://www.scopus.com/inward/record.uri?eid=2-s2.0-0041510190&partnerID=40&md5=f64cc5564db2834cbd15b1e40a01ee52",Conference Paper,Scopus,2-s2.0-0041510190
"Odegard, G.M., Gates, T.S., Wise, K.E., Park, C., Siochi, E.J.","Constitutive modeling of nanotube-reinforced polymer composites",2003,"Composites Science and Technology","63","11",,"1671","1687",,505,10.1016/S0266-3538(03)00063-0,"https://www.scopus.com/inward/record.uri?eid=2-s2.0-0042265786&doi=10.1016%2fS0266-3538%2803%2900063-0&partnerID=40&md5=3e5a679277faed2bc9515b10378825b0",Article,Scopus,2-s2.0-0042265786
"Frankland, S.J.V., Harik, V.M., Odegard, G.M., Brenner, D.W., Gates, T.S.","The stress-strain behavior of polymer-nanotube composites from molecular dynamics simulation",2003,"Composites Science and Technology","63","11",,"1655","1661",,312,10.1016/S0266-3538(03)00059-9,"https://www.scopus.com/inward/record.uri?eid=2-s2.0-0041845257&doi=10.1016%2fS0266-3538%2803%2900059-9&partnerID=40&md5=81f83b320a212a8732015c0b1695ac5f",Article,Scopus,2-s2.0-0041845257
"Wang, Y., Sun, C., Sun, X., Hinkley, J., Odegard, G.M., Gates, T.S.","2-D nano-scale finite element analysis of a polymer field",2003,"Composites Science and Technology","63","11",,"1581","1590",,33,10.1016/S0266-3538(03)00068-X,"https://www.scopus.com/inward/record.uri?eid=2-s2.0-0041344566&doi=10.1016%2fS0266-3538%2803%2900068-X&partnerID=40&md5=ee5326a3051ad7c66f22dcbf58da6c0b",Article,Scopus,2-s2.0-0041344566
"Odegard, G.M., Gates, T.S., Nicholson, L.M., Wise, K.E.","Equivalent-continuum modeling of nano-structured materials",2002,"Composites Science and Technology","62","14",,"1869","1880",,460,10.1016/S0266-3538(02)00113-6,"https://www.scopus.com/inward/record.uri?eid=2-s2.0-0036837197&doi=10.1016%2fS0266-3538%2802%2900113-6&partnerID=40&md5=61f10450b2ecb419ec6f718e362c8f19",Article,Scopus,2-s2.0-0036837197
"Searles, K., Odegard, G., Kumosa, M.","The effect of eccentric loads on the macroscopic strain and stress distributions in woven fabric composite Iosipescu specimens",2002,"Journal of Composite Materials","36","5",,"571","588",,7,10.1177/0021998302036005585,"https://www.scopus.com/inward/record.uri?eid=2-s2.0-0036269525&doi=10.1177%2f0021998302036005585&partnerID=40&md5=161f9451f6a44ed2424f2e214fd30add",Article,Scopus,2-s2.0-0036269525
"Odegard, G.M., Gates, T.S., Wise, K.E.","Constitutive modeling of nanotube-reinforced polymer composites",2002,"Collection of Technical Papers - AIAA/ASME/ASCE/AHS/ASC Structures, Structural Dynamics and Materials Conference","3",,,"1788","1800",,4,,"https://www.scopus.com/inward/record.uri?eid=2-s2.0-0036075138&partnerID=40&md5=d554ccd639e526670e80038a4f5e728b",Conference Paper,Scopus,2-s2.0-0036075138
"Kumosa, M., Odegard, G., Armentrout, D., Kumosa, L., Searles, K., Sutter, J.K.","Comparison of the ± 45° tensile and iosipescu shear tests for woven fabric composite materials",2002,"Journal of Composites Technology and Research","24","1",,"3","",,19,,"https://www.scopus.com/inward/record.uri?eid=2-s2.0-0036240508&partnerID=40&md5=8d6d712ce254ba98854e342f8203b5c9",Article,Scopus,2-s2.0-0036240508
"Wang, Y., Sun, C., Sun, X., Hinkley, J., Odegard, G.M., Gates, T.S.","Nano-scale finite element analysis of polymer networks",2002,"Collection of Technical Papers - AIAA/ASME/ASCE/AHS/ASC Structures, Structural Dynamics and Materials Conference","2",,,"917","926",,6,,"https://www.scopus.com/inward/record.uri?eid=2-s2.0-0036078309&partnerID=40&md5=f1123ef9c8efd52f6d527cc359dee4f2",Conference Paper,Scopus,2-s2.0-0036078309
