Authors,Title,Year,Source title,Volume,Issue,Art. No.,Page start,Page end,Page count,Cited by,DOI,Link,Document Type,Source,EID
"Aartsen, M.G., Abbasi, R., Abdou, Y., Ackermann, M., Adams, J., Aguilar, J.A., Ahlers, M., Altmann, D., Auffenberg, J., Bai, X., Baker, M., Barwick, S.W., Baum, V., Bay, R., Beatty, J.J., Bechet, S., Becker Tjus, J., Becker, K.-H., Bell, M., Benabderrahmane, M.L., Benzvi, S., Berdermann, J., Berghaus, P., Berley, D., Bernardini, E., Bernhard, A., Bertrand, D., Besson, D.Z., Binder, G., Bindig, D., Bissok, M., Blaufuss, E., Blumenthal, J., Boersma, D.J., Bohaichuk, S., Bohm, C., Bose, D., Böser, S., Botner, O., Brayeur, L., Bretz, H.-P., Brown, A.M., Bruijn, R., Brunner, J., Carson, M., Casey, J., Casier, M., Chirkin, D., Christov, A., Christy, B., Clark, K., Clevermann, F., Coenders, S., Cohen, S., Cowen, D.F., Cruz Silva, A.H., Danninger, M., Daughhetee, J., Davis, J.C., De Clercq, C., De Ridder, S., Desiati, P., De With, M., Deyoung, T., Díaz-Vélez, J.C., Dunkman, M., Eagan, R., Eberhardt, B., Eisch, J., Ellsworth, R.W., Euler, S., Evenson, P.A., Fadiran, O., Fazely, A.R., Fedynitch, A., Feintzeig, J., Feusels, T., Filimonov, K., Finley, C., Fischer-Wasels, T., Flis, S., Franckowiak, A., Franke, R., Frantzen, K., Fuchs, T., Gaisser, T.K., Gallagher, J., Gerhardt, L., Gladstone, L., Glüsenkamp, T., Goldschmidt, A., Golup, G., Gonzalez, J.G., Goodman, J.A., Góra, D., Grandmont, D.T., Grant, D., Groß, A., Ha, C., Haj Ismail, A., Hallen, P., Hallgren, A., Halzen, F., Hanson, K., Heereman, D., Heinen, D., Helbing, K., Hellauer, R., Hickford, S., Hill, G.C., Hoffman, K.D., Hoffmann, R., Homeier, A., Hoshina, K., Huelsnitz, W., Hulth, P.O., Hultqvist, K., Hussain, S., Ishihara, A., Jacobi, E., Jacobsen, J., Jagielski, K., Japaridze, G.S., Jero, K., Jlelati, O., Kaminsky, B., Kappes, A., Karg, T., Karle, A., Kelley, J.L., Kiryluk, J., Kislat, F., Kläs, J., Klein, S.R., Köhne, J.-H., Kohnen, G., Kolanoski, H., Köpke, L., Kopper, C., Kopper, S., Koskinen, D.J., Kowalski, M., Krasberg, M., Krings, K., Kroll, G., Kunnen, J., Kurahashi, N., Kuwabara, T., Labare, M., Landsman, H., Larson, M.J., Lesiak-Bzdak, M., Leuermann, M., Leute, J., Lünemann, J., Madsen, J., Maruyama, R., Mase, K., Matis, H.S., McNally, F., Meagher, K., Merck, M., Mészáros, P., Meures, T., Miarecki, S., Middell, E., Milke, N., Miller, J., Mohrmann, L., Montaruli, T., Morse, R., Nahnhauer, R., Naumann, U., Niederhausen, H., Nowicki, S.C., Nygren, D.R., Obertacke, A., Odrowski, S., Olivas, A., Olivo, M., O'Murchadha, A., Paul, L., Pepper, J.A., Pérez De Los Heros, C., Pfendner, C., Pieloth, D., Pinat, E., Pirk, N., Posselt, J., Price, P.B., Przybylski, G.T., Rädel, L., Rameez, M., Rawlins, K., Redl, P., Reimann, R., Resconi, E., Rhode, W., Ribordy, M., Richman, M., Riedel, B., Rodrigues, J.P., Rott, C., Ruhe, T., Ruzybayev, B., Ryckbosch, D., Saba, S.M., Salameh, T., Sander, H.-G., Santander, M., Sarkar, S., Schatto, K., Scheel, M., Scheriau, F., Schmidt, T., Schmitz, M., Schoenen, S., Schöneberg, S., Schönwald, A., Schukraft, A., Schulte, L., Schulz, O., Seckel, D., Sestayo, Y., Seunarine, S., Sheremata, C., Smith., M.W.E., Soldin, D., Spiczak, G.M., Spiering, C., Stamatikos, M., Stanev, T., Stasik, A., Stezelberger, T., Stokstad, R.G., Stößl, A., Strahler, E.A., Ström, R., Sullivan, G.W., Taavola, H., Taboada, I., Tamburro, A., Tepe, A., Ter-Antonyan, S., Tešić, G., Tilav, S., Toale, P.A., Toscano, S., Usner, M., Van Der Drift, D., Van Eijndhoven, N., Van Overloop, A., Van Santen, J., Vehring, M., Voge, M., Vraeghe, M., Walck, C., Waldenmaier, T., Wallraff, M., Wasserman, R., Weaver, C., Wellons, M., Wendt, C., Westerhoff, S., Whitehorn, N., Wiebe, K., Wiebusch, C.H., Williams, D.R., Wissing, H., Wolf, M., Wood, T.R., Woschnagg, K., Xu, C., Xu, D.L., Xu, X.W., Yanez, J.P., Yodh, G., Yoshida, S., Zarzhitsky, P., Ziemann, J., Zierke, S., Zoll, M.","Observation of the cosmic-ray shadow of the Moon with IceCube",2014,"Physical Review D - Particles, Fields, Gravitation and Cosmology","89","10", 102004,"","",,10,10.1103/PhysRevD.89.102004,"https://www.scopus.com/inward/record.uri?eid=2-s2.0-84901981447&doi=10.1103%2fPhysRevD.89.102004&partnerID=40&md5=a2d505ae429b83481b1f2db6fa6d26c3",Article,Scopus,2-s2.0-84901981447
"Aartsen, M.G., Abbasi, R., Ackermann, M., Adams, J., Aguilar, J.A., Ahlers, M., Altmann, D., Arguelles, C., Arlen, T.C., Auffenberg, J., Bai, X., Baker, M., Barwick, S.W., Baum, V., Bay, R., Beatty, J.J., Becker Tjus, J., Becker, K.-H., Benzvi, S., Berghaus, P., Berley, D., Bernardini, E., Bernhard, A., Besson, D.Z., Binder, G., Bindig, D., Bissok, M., Blaufuss, E., Blumenthal, J., Boersma, D.J., Bohm, C., Bose, D., Böser, S., Botner, O., Brayeur, L., Bretz, H.-P., Brown, A.M., Bruijn, R., Casey, J., Casier, M., Chirkin, D., Christov, A., Christy, B., Clark, K., Classen, L., Clevermann, F., Coenders, S., Cohen, S., Cowen, D.F., Cruz Silva, A.H., Danninger, M., Daughhetee, J., Davis, J.C., Day, M., De André, J.P.A.M., De Clercq, C., De Ridder, S., Desiati, P., De Vries, K.D., De With, M., Deyoung, T., Díaz-Vélez, J.C., Dunkman, M., Eagan, R., Eberhardt, B., Eichmann, B., Eisch, J., Euler, S., Evenson, P.A., Fadiran, O., Fazely, A.R., Fedynitch, A., Feintzeig, J., Feusels, T., Filimonov, K., Finley, C., Fischer-Wasels, T., Flis, S., Franckowiak, A., Frantzen, K., Fuchs, T., Gaisser, T.K., Gallagher, J., Gerhardt, L., Gladstone, L., Glüsenkamp, T., Goldschmidt, A., Golup, G., Gonzalez, J.G., Goodman, J.A., Góra, D., Grandmont, D.T., Grant, D., Gretskov, P., Groh, J.C., Groß, A., Ha, C., Haj Ismail, A., Hallen, P., Hallgren, A., Halzen, F., Hanson, K., Hebecker, D., Heereman, D., Heinen, D., Helbing, K., Hellauer, R., Hickford, S., Hill, G.C., Hoffman, K.D., Hoffmann, R., Homeier, A., Hoshina, K., Huang, F., Huelsnitz, W., Hulth, P.O., Hultqvist, K., Hussain, S., Ishihara, A., Jacobi, E., Jacobsen, J., Jagielski, K., Japaridze, G.S., Jero, K., Jlelati, O., Kaminsky, B., Kappes, A., Karg, T., Karle, A., Kauer, M., Kelley, J.L., Kiryluk, J., Kläs, J., Klein, S.R., Köhne, J.-H., Kohnen, G., Kolanoski, H., Köpke, L., Kopper, C., Kopper, S., Koskinen, D.J., Kowalski, M., Krasberg, M., Kriesten, A., Krings, K., Kroll, G., Kunnen, J., Kurahashi, N., Kuwabara, T., Labare, M., Landsman, H., Larson, M.J., Lesiak-Bzdak, M., Leuermann, M., Leute, J., Lünemann, J., Macías, O., Madsen, J., Maggi, G., Maruyama, R., Mase, K., Matis, H.S., McNally, F., Meagher, K., Merck, M., Meures, T., Miarecki, S., Middell, E., Milke, N., Miller, J., Mohrmann, L., Montaruli, T., Morse, R., Nahnhauer, R., Naumann, U., Niederhausen, H., Nowicki, S.C., Nygren, D.R., Obertacke, A., Odrowski, S., Olivas, A., Omairat, A., O'Murchadha, A., Palczewski, T., Paul, L., Pepper, J.A., Pérez De Los Heros, C., Pfendner, C., Pieloth, D., Pinat, E., Posselt, J., Price, P.B., Przybylski, G.T., Quinnan, M., Rädel, L., Rameez, M., Rawlins, K., Redl, P., Reimann, R., Resconi, E., Rhode, W., Ribordy, M., Richman, M., Riedel, B., Robertson, S., Rodrigues, J.P., Rott, C., Ruhe, T., Ruzybayev, B., Ryckbosch, D., Saba, S.M., Sander, H.-G., Santander, M., Sarkar, S., Schatto, K., Scheriau, F., Schmidt, T., Schmitz, M., Schoenen, S., Schöneberg, S., Schönwald, A., Schukraft, A., Schulte, L., Schulz, O., Seckel, D., Sestayo, Y., Seunarine, S., Shanidze, R., Sheremata, C., Smith, M.W.E., Soldin, D., Spiczak, G.M., Spiering, C., Stamatikos, M., Stanev, T., Stanisha, N.A., Stasik, A., Stezelberger, T., Stokstad, R.G., Stößl, A., Strahler, E.A., Ström, R., Strotjohann, N.L., Sullivan, G.W., Taavola, H., Taboada, I., Tamburro, A., Tepe, A., Ter-Antonyan, S., Tešić, G., Tilav, S., Toale, P.A., Tobin, M.N., Toscano, S., Tselengidou, M., Unger, E., Usner, M., Vallecorsa, S., Van Eijndhoven, N., Van Overloop, A., Van Santen, J., Vehring, M., Voge, M., Vraeghe, M., Walck, C., Waldenmaier, T., Wallraff, M., Weaver, C., Wellons, M., Wendt, C., Westerhoff, S., Whelan, B., Whitehorn, N., Wiebe, K., Wiebusch, C.H., Williams, D.R., Wissing, H., Wolf, M., Wood, T.R., Woschnagg, K., Xu, D.L., Xu, X.W., Yanez, J.P., Yodh, G., Yoshida, S., Zarzhitsky, P., Ziemann, J., Zierke, S., Zoll, M.","Search for neutrino-induced particle showers with IceCube-40",2014,"Physical Review D - Particles, Fields, Gravitation and Cosmology","89","10", 102001,"","",,18,10.1103/PhysRevD.89.102001,"https://www.scopus.com/inward/record.uri?eid=2-s2.0-84901049494&doi=10.1103%2fPhysRevD.89.102001&partnerID=40&md5=e21f9ca87f37b54a5ed17de1d6527562",Article,Scopus,2-s2.0-84901049494
"Aartsen, M.G., Abbasi, R., Ackermann, M., Adams, J., Aguilar, J.A., Ahlers, M., Altmann, D., Arguelles, C., Arlen, T.C., Auffenberg, J., Bai, X., Baker, M., Barwick, S.W., Baum, V., Bay, R., Beatty, J.J., Becker Tjus, J., Becker, K.-H., Benzvi, S., Berghaus, P., Berley, D., Bernardini, E., Bernhard, A., Besson, D.Z., Binder, G., Bindig, D., Bissok, M., Blaufuss, E., Blumenthal, J., Boersma, D.J., Bohm, C., Bose, D., Böser, S., Botner, O., Brayeur, L., Bretz, H.-P., Brown, A.M., Bruijn, R., Casey, J., Casier, M., Chirkin, D., Christov, A., Christy, B., Clark, K., Classen, L., Clevermann, F., Coenders, S., Cohen, S., Cowen, D.F., Cruz Silva, A.H., Danninger, M., Daughhetee, J., Davis, J.C., Day, M., De André, J.P.A.M., De Clercq, C., De Ridder, S., Desiati, P., De Vries, K.D., De With, M., Deyoung, T., Díaz-Vélez, J.C., Dunkman, M., Eagan, R., Eberhardt, B., Eichmann, B., Eisch, J., Euler, S., Evenson, P.A., Fadiran, O., Fazely, A.R., Fedynitch, A., Feintzeig, J., Feusels, T., Filimonov, K., Finley, C., Fischer-Wasels, T., Flis, S., Franckowiak, A., Frantzen, K., Fuchs, T., Gaisser, T.K., Gallagher, J., Gerhardt, L., Gladstone, L., Glüsenkamp, T., Goldschmidt, A., Golup, G., Gonzalez, J.G., Goodman, J.A., Góra, D., Grandmont, D.T., Grant, D., Gretskov, P., Groh, J.C., Groß, A., Ha, C., Haj Ismail, A., Hallen, P., Hallgren, A., Halzen, F., Hanson, K., Hebecker, D., Heereman, D., Heinen, D., Helbing, K., Hellauer, R., Hickford, S., Hill, G.C., Hoffman, K.D., Hoffmann, R., Homeier, A., Hoshina, K., Huang, F., Huelsnitz, W., Hulth, P.O., Hultqvist, K., Hussain, S., Ishihara, A., Jacobi, E., Jacobsen, J., Jagielski, K., Japaridze, G.S., Jero, K., Jlelati, O., Kaminsky, B., Kappes, A., Karg, T., Karle, A., Kauer, M., Kelley, J.L., Kiryluk, J., Kläs, J., Klein, S.R., Köhne, J.-H., Kohnen, G., Kolanoski, H., Köpke, L., Kopper, C., Kopper, S., Koskinen, D.J., Kowalski, M., Krasberg, M., Kriesten, A., Krings, K., Kroll, G., Kunnen, J., Kurahashi, N., Kuwabara, T., Labare, M., Landsman, H., Larson, M.J., Lesiak-Bzdak, M., Leuermann, M., Leute, J., Lünemann, J., Macías, O., Madsen, J., Maggi, G., Maruyama, R., Mase, K., Matis, H.S., McNally, F., Meagher, K., Merck, M., Meures, T., Miarecki, S., Middell, E., Milke, N., Miller, J., Mohrmann, L., Montaruli, T., Morse, R., Nahnhauer, R., Naumann, U., Niederhausen, H., Nowicki, S.C., Nygren, D.R., Obertacke, A., Odrowski, S., Olivas, A., Omairat, A., O'Murchadha, A., Palczewski, T., Paul, L., Pepper, J.A., Pérez De Los Heros, C., Pfendner, C., Pieloth, D., Pinat, E., Posselt, J., Price, P.B., Przybylski, G.T., Quinnan, M., Rädel, L., Rameez, M., Rawlins, K., Redl, P., Reimann, R., Resconi, E., Rhode, W., Ribordy, M., Richman, M., Riedel, B., Robertson, S., Rodrigues, J.P., Rott, C., Ruhe, T., Ruzybayev, B., Ryckbosch, D., Saba, S.M., Sander, H.-G., Santander, M., Sarkar, S., Schatto, K., Scheriau, F., Schmidt, T., Schmitz, M., Schoenen, S., Schöneberg, S., Schönwald, A., Schukraft, A., Schulte, L., Schulz, O., Seckel, D., Sestayo, Y., Seunarine, S., Shanidze, R., Sheremata, C., Smith, M.W.E., Soldin, D., Spiczak, G.M., Spiering, C., Stamatikos, M., Stanev, T., Stanisha, N.A., Stasik, A., Stezelberger, T., Stokstad, R.G., Stößl, A., Strahler, E.A., Ström, R., Strotjohann, N.L., Sullivan, G.W., Taavola, H., Taboada, I., Tamburro, A., Tepe, A., Ter-Antonyan, S., Tešić, G., Tilav, S., Toale, P.A., Tobin, M.N., Toscano, S., Tselengidou, M., Unger, E., Usner, M., Vallecorsa, S., Van Eijndhoven, N., Van Overloop, A., Van Santen, J., Vehring, M., Voge, M., Vraeghe, M., Walck, C., Waldenmaier, T., Wallraff, M., Weaver, C., Wellons, M., Wendt, C., Westerhoff, S., Whelan, B., Whitehorn, N., Wiebe, K., Wiebusch, C.H., Williams, D.R., Wissing, H., Wolf, M., Wood, T.R., Woschnagg, K., Xu, D.L., Xu, X.W., Yanez, J.P., Yodh, G., Yoshida, S., Zarzhitsky, P., Ziemann, J., Zierke, S., Zoll, M.","Search for a diffuse flux of astrophysical muon neutrinos with the IceCube 59-string configuration",2014,"Physical Review D - Particles, Fields, Gravitation and Cosmology","89","6", 062007,"","",,47,10.1103/PhysRevD.89.062007,"https://www.scopus.com/inward/record.uri?eid=2-s2.0-84898716972&doi=10.1103%2fPhysRevD.89.062007&partnerID=40&md5=58c3ac5f46b033680fb33973314c43ae",Article,Scopus,2-s2.0-84898716972
"Abbasi, R., Abdou, Y., Abu-Zayyad, T., Ackermann, M., Adams, J., Aguilar, J.A., Ahlers, M., Allen, M.M., Altmann, D., Andeen, K., Auffenberg, J., Bai, X., Baker, M., Barwick, S.W., Baum, V., Bay, R., Bazo Alba, J.L., Beattie, K., Beatty, J.J., Bechet, S., Becker, J.K., Becker, K.-H., Benabderrahmane, M.L., BenZvi, S., Berdermann, J., Berghaus, P., Berley, D., Bernardini, E., Bertrand, D., Besson, D.Z., Bindig, D., Bissok, M., Blaufuss, E., Blumenthal, J., Boersma, D.J., Bohm, C., Bose, D., Böser, S., Botner, O., Brown, A.M., Buitink, S., Caballero-Mora, K.S., Carson, M., Chirkin, D., Christy, B., Clevermann, F., Cohen, S., Colnard, C., Cowen, D.F., Cruz Silva, A.H., D'Agostino, M.V., Danninger, M., Daughhetee, J., Davis, J.C., De Clercq, C., Degner, T., Demirörs, L., Descamps, F., Desiati, P., De Vries-Uiterweerd, G., Deyoung, T., Díaz-Vélez, J.C., Dierckxsens, M., Dreyer, J., Dumm, J.P., Dunkman, M., Eisch, J., Ellsworth, R.W., Engdegård, O., Euler, S., Evenson, P.A., Fadiran, O., Fazely, A.R., Fedynitch, A., Feintzeig, J., Feusels, T., Filimonov, K., Finley, C., Fischer-Wasels, T., Fox, B.D., Franckowiak, A., Franke, R., Gaisser, T.K., Gallagher, J., Gerhardt, L., Gladstone, L., Glüsenkamp, T., Goldschmidt, A., Goodman, J.A., Góra, D., Grant, D., Griesel, T., Groß, A., Grullon, S., Gurtner, M., Ha, C., Hajismail, A., Hallgren, A., Halzen, F., Han, K., Hanson, K., Heinen, D., Helbing, K., Hellauer, R., Hickford, S., Hill, G.C., Hoffman, K.D., Hoffmann, B., Homeier, A., Hoshina, K., Huelsnitz, W., Hülß, J.-P., Hulth, P.O., Hultqvist, K., Hussain, S., Ishihara, A., Jakobi, E., Jacobsen, J., Japaridze, G.S., Johansson, H., Kampert, K.-H., Kappes, A., Karg, T., Karle, A., Kenny, P., Kiryluk, J., Kislat, F., Klein, S.R., Köhne, H., Kohnen, G., Kolanoski, H., Köpke, L., Kopper, S., Koskinen, D.J., Kowalski, M., Kowarik, T., Krasberg, M., Kroll, G., Kurahashi, N., Kuwabara, T., Labare, M., Laihem, K., Landsman, H., Larson, M.J., Lauer, R., Lünemann, J., Madsen, J., Marotta, A., Maruyama, R., Mase, K., Matis, H.S., Meagher, K., Merck, M., Mészáros, P., Meures, T., Miarecki, S., Middell, E., Milke, N., Miller, J., Montaruli, T., Morse, R., Movit, S.M., Nahnhauer, R., Nam, J.W., Naumann, U., Nygren, D.R., Odrowski, S., Olivas, A., Olivo, M., O'murchadha, A., Panknin, S., Paul, L., De Los Heros, C.P., Petrovic, J., Piegsa, A., Pieloth, D., Porrata, R., Posselt, J., Price, P.B., Przybylski, G.T., Rawlins, K., Redl, P., Resconi, E., Rhode, W., Ribordy, M., Richard, A.S., Richman, M., Rodrigues, J.P., Rothmaier, F., Rott, C., Ruhe, T., Rutledge, D., Ruzybayev, B., Ryckbosch, D., Sander, H.-G., Santander, M., Sarkar, S., Schatto, K., Schmidt, T., Schönwald, A., Schukraft, A., Schulte, L., Schultes, A., Schulz, O., Schunck, M., Seckel, D., Semburg, B., Seo, S.H., Sestayo, Y., Seunarine, S., Silvestri, A., Singh, K., Slipak, A., Spiczak, G.M., Spiering, C., Stamatikos, M., Stanev, T., Stezelberger, T., Stokstad, R.G., Stößl, A., Strahler, E.A., Ström, R., Stüer, M., Sullivan, G.W., Swillens, Q., Taavola, H., Taboada, I., Tamburro, A., Tepe, A., Ter-Antonyan, S., Tilav, S., Toale, P.A., Toscano, S., Tosi, D., Van Eijndhoven, N., Vandenbroucke, J., Van Overloop, A., Van Santen, J., Vehring, M., Voge, M., Walck, C., Waldenmaier, T., Wallraff, M., Walter, M., Weaver, C., Wendt, C., Westerhoff, S., Whitehorn, N., Wiebe, K., Wiebusch, C.H., Williams, D.R., Wischnewski, R., Wissing, H., Wolf, M., Wood, T.R., Woschnagg, K., Xu, C., Xu, D.L., Xu, X.W., Yanez, J.P., Yodh, G., Yoshida, S., Zarzhitsky, P., Zoll, M.","Erratum: IceCube sensitivity for low-energy neutrinos from nearby supernovae(Astronomy and Astrophysics (2011) 535 : A109 (DOI: 10.1051/0004-6361/201117810))",2014,"Astronomy and Astrophysics","563",, C1,"","",,2,10.1051/0004-6361/201117810e,"https://www.scopus.com/inward/record.uri?eid=2-s2.0-84894725258&doi=10.1051%2f0004-6361%2f201117810e&partnerID=40&md5=b13f03d178ecb820d0131d5509560d80",Erratum,Scopus,2-s2.0-84894725258
"Aartsen, M.G., Abbasi, R., Ackermann, M., Adams, J., Aguilar, J.A., Ahlers, M., Altmann, D., Arguelles, C., Auffenberg, J., Bai, X., Baker, M., Barwick, S.W., Baum, V., Bay, R., Beatty, J.J., Tjus, J.B., Becker, K.-H., Benzvi, S., Berghaus, P., Berley, D., Bernardini, E., Bernhard, A., Besson, D.Z., Binder, G., Bindig, D., Bissok, M., Blaufuss, E., Blumenthal, J., Boersma, D.J., Bohm, C., Bose, D., Böser, S., Botner, O., Brayeur, L., Bretz, H.-P., Brown, A.M., Bruijn, R., Casey, J., Casier, M., Chirkin, D., Christov, A., Christy, B., Clark, K., Classen, L., Clevermann, F., Coenders, S., Cohen, S., Cowen, D.F., Silva, A.H.C., Danninger, M., Daughhetee, J., Davis, J.C., Day, M., De Clercq, C., De Ridder, S., Desiati, P., De Vries, K.D., De With, M., Deyoung, T., Díaz-Vélez, J.C., Dunkman, M., Eagan, R., Eberhardt, B., Eichmann, B., Eisch, J., Euler, S., Evenson, P.A., Fadiran, O., Fazely, A.R., Fedynitch, A., Feintzeig, J., Feusels, T., Filimonov, K., Finley, C., Fischer-Wasels, T., Flis, S., Franckowiak, A., Frantzen, K., Fuchs, T., Gaisser, T.K., Gallagher, J., Gerhardt, L., Gladstone, L., Glüsenkamp, T., Goldschmidt, A., Golup, G., Gonzalez, J.G., Goodman, J.A., Góra, D., Grandmont, D.T., Grant, D., Gretskov, P., Groh, J.C., Groß, A., Ha, C., Ismail, A.H., Hallen, P., Hallgren, A., Halzen, F., Hanson, K., Hebecker, D., Heereman, D., Heinen, D., Helbing, K., Hellauer, R., Hickford, S., Hill, G.C., Hoffman, K.D., Hoffmann, R., Homeier, A., Hoshina, K., Huang, F., Huelsnitz, W., Hulth, P.O., Hultqvist, K., Hussain, S., Ishihara, A., Jackson, S., Jacobi, E., Jacobsen, J., Jagielski, K., Japaridze, G.S., Jero, K., Jlelati, O., Kaminsky, B., Kappes, A., Karg, T., Karle, A., Kauer, M., Kelley, J.L., Kiryluk, J., Kläs, J., Klein, S.R., Köhne, J.-H., Kohnen, G., Kolanoski, H., Köpke, L., Kopper, C., Kopper, S., Koskinen, D.J., Kowalski, M., Krasberg, M., Kriesten, A., Krings, K., Kroll, G., Kunnen, J., Kurahashi, N., Kuwabara, T., Labare, M., Landsman, H., Larson, M.J., Lesiak-Bzdak, M., Leuermann, M., Leute, J., Lünemann, J., Macías, O., Madsen, J., Maggi, G., Maruyama, R., Mase, K., Matis, H.S., Mcnally, F., Meagher, K., Merck, M., Meures, T., Miarecki, S., Middell, E., Milke, N., Miller, J., Mohrmann, L., Montaruli, T., Morse, R., Nahnhauer, R., Naumann, U., Niederhausen, H., Nowicki, S.C., Nygren, D.R., Obertacke, A., Odrowski, S., Olivas, A., Omairat, A., O'murchadha, A., Paul, L., Pepper, J.A., De Los Heros, C.P., Pfendner, C., Pieloth, D., Pinat, E., Posselt, J., Price, P.B., Przybylski, G.T., Quinnan, M., Rädel, L., Rameez, M., Rawlins, K., Redl, P., Reimann, R., Resconi, E., Rhode, W., Ribordy, M., Richman, M., Riedel, B., Robertson, S., Rodrigues, J.P., Rott, C., Ruhe, T., Ruzybayev, B., Ryckbosch, D., Saba, S.M., Sander, H.-G., Santander, M., Sarkar, S., Schatto, K., Scheriau, F., Schmidt, T., Schmitz, M., Schoenen, S., Schöneberg, S., Schönwald, A., Schukraft, A., Schulte, L., Schulz, O., Seckel, D., Sestayo, Y., Seunarine, S., Shanidze, R., Sheremata, C., Smith, M.W.E., Soldin, D., Spiczak, G.M., Spiering, C., Stamatikos, M., Stanev, T., Stanisha, N.A., Stasik, A., Stezelberger, T., Stokstad, R.G., Stößl, A., Strahler, E.A., Ström, R., Strotjohann, N.L., Sullivan, G.W., Taavola, H., Taboada, I., Tamburro, A., Tepe, A., Ter-Antonyan, S., Tešić, G., Tilav, S., Toale, P.A., Tobin, M.N., Toscano, S., Tselengidou, M., Unger, E., Usner, M., Van Vallecorsa, S., Van Eijndhoven, N., Van Overloop, A., Santen, J., Vehring, M., Voge, M., Vraeghe, M., Walck, C., Waldenmaier, T., Wallraff, M., Weaver, Ch., Wellons, M., Wendt, C., Westerhoff, S., Whelan, B., Whitehorn, N., Wiebe, K., Wiebusch, C.H., Williams, D.R., Wissing, H., Wolf, M., Wood, T.R., Woschnagg, K., Xu, D.L., Xu, X.W., Yanez, J.P., Yodh, G., Yoshida, S., Zarzhitsky, P., Ziemann, J., Zierke, S., Zoll, M.","Energy reconstruction methods in the IceCube neutrino telescope",2014,"Journal of Instrumentation","9","3", P03009,"","",,60,10.1088/1748-0221/9/03/P03009,"https://www.scopus.com/inward/record.uri?eid=2-s2.0-84896909834&doi=10.1088%2f1748-0221%2f9%2f03%2fP03009&partnerID=40&md5=872c75ef3b7462b47565daf16093687b",Article,Scopus,2-s2.0-84896909834
"Aartsen, M. G., Abbasi, R., Ackermann, M., Adams, J., Aguilar, J.A., Ahlers, M., Altmann, D., Arguelles, C., Arlen, T.C., Auffenberg, J., Bai, X., Baker, M., Barwick, S.W., Baum, V., Bay, R., Beatty, J.J., Becker Tjus, J., Becker, K.-H., Benabderrahmane, M.L., BenZvi, S., Berghaus, P., Berley, D., Bernardini, E., Bernhard, A., Besson, D.Z., Binder, G., Bindig, D., Bissok, M., Blaufuss, E., Blumenthal, J., Boersma, D.J., Bohm, C., Bose, D., Böser, S., Botner, O., Brayeur, L., Bretz, H.-P., Brown, A.M., Bruijn, R., Casey, J., Casier, M., Chirkin, D., Christov, A., Christy, B., Clark, K., Classen, L., Clevermann, F., Coenders, S., Cohen, S., Cowen, D.F., Cruz Silva, A.H., Danninger, M., Daughhetee, J., Davis, J.C., Day, M., de André, J.P.A.M., De Clercq, C., De Ridder, S., Desiati, P., de Vries, K.D., de With, M., DeYoung, T., Díaz-Vélez, J.C., Dunkman, M., Eagan, R., Eberhardt, B., Eichmann, B., Eisch, J., Euler, S., Evenson, P.A., Fadiran, O., Fazely, A.R., Fedynitch, A., Feintzeig, J., Feusels, T., Filimonov, K., Finley, C., Fischer-Wasels, T., Flis, S., Franckowiak, A., Frantzen, K., Fuchs, T., Gaisser, T.K., Gallagher, J., Gerhardt, L., Gladstone, L., Glüsenkamp, T., Goldschmidt, A., Golup, G., Gonzalez, J.G., Goodman, J.A., Góra, D., Grandmont, D.T., Grant, D., Gretskov, P., Groh, J.C., Groß, A., Ha, C., Haack, C., Haj Ismail, A., Hallen, P., Hallgren, A., Halzen, F., Hanson, K., Hebecker, D., Heereman, D., Heinen, D., Helbing, K., Hellauer, R., Hickford, S., Hill, G.C., Hoffman, K.D., Hoffmann, R., Homeier, A., Hoshina, K., Huang, F., Huelsnitz, W., Hulth, P.O., Hultqvist, K., Hussain, S., Ishihara, A., Jacobi, E., Jacobsen, J., Jagielski, K., Japaridze, G.S., Jero, K., Jlelati, O., Kaminsky, B., Kappes, A., Karg, T., Karle, A., Kauer, M., Kelley, J.L., Kiryluk, J., Kläs, J., Klein, S.R., Köhne, J.-H., Kohnen, G., Kolanoski, H., Köpke, L., Kopper, C., Kopper, S., Koskinen, D.J., Kowalski, M., Krasberg, M., Kriesten, A., Krings, K., Kroll, G., Kunnen, J., Kurahashi, N., Kuwabara, T., Labare, M., Landsman, H., Larson, M.J., Lesiak-Bzdak, M., Leuermann, M., Leute, J., Lünemann, J., Macías, O., Madsen, J., Maggi, G., Maruyama, R., Mase, K., Matis, H.S., McNally, F., Meagher, K., Meli, A., Merck, M., Meures, T., Miarecki, S., Middell, E., Milke, N., Miller, J., Mohrmann, L., Montaruli, T., Morse, R., Nahnhauer, R., Naumann, U., Niederhausen, H., Nowicki, S.C., Nygren, D.R., Obertacke, A., Odrowski, S., Olivas, A., Omairat, A., O’Murchadha, A., Palczewski, T., Paul, L., Pepper, J.A., Pérez de los Heros, C., Pfendner, C., Pieloth, D., Pinat, E., Posselt, J., Price, P.B., Przybylski, G.T., Quinnan, M., Rädel, L., Rameez, M., Rawlins, K., Redl, P., Reimann, R., Resconi, E., Rhode, W., Ribordy, M., Richman, M., Riedel, B., Robertson, S., Rodrigues, J.P., Rott, C., Ruhe, T., Ruzybayev, B., Ryckbosch, D., Saba, S.M., Sander, H.-G., Santander, M., Sarkar, S., Schatto, K., Scheriau, F., Schmidt, T., Schmitz, M., Schoenen, S., Schöneberg, S., Schönwald, A., Schukraft, A., Schulte, L., Schulz, O., Seckel, D., Sestayo, Y., Seunarine, S., Shanidze, R., Sheremata, C., E., M.W., Soldin, D., Spiczak, G.M., Spiering, C., Stamatikos, M., Stanev, T., Stanisha, N.A., Stasik, A., Stezelberger, T., Stokstad, R.G., Stößl, A., Strahler, E.A., Ström, R., Strotjohann, N.L., Sullivan, G.W., Taavola, H., Taboada, I., Tamburro, A., Tepe, A., Ter-Antonyan, S., Teši´c, G., Tilav, S., Toale, P.A., Tobin, M.N., Toscano, S., Tselengidou, M., Unger, E., Usner, M., Vallecorsa, S., van Eijndhoven, N., van Santen, J., Vehring, M., Voge, M., Vraeghe, M., Walck, C., Wallraff, M., Weaver, C., Wellons, M., Wendt, C., Westerhoff, S., Whelan, B.J., Whitehorn, N., Wiebe, K., Wiebusch, C.H., Williams, D.R., Wissing, H., Wolf, M., Wood, T.R., Woschnagg, K., Xu, D.L., Xu, X.W., Yanez, J.P., Yodh, G., Yoshida, S., Zarzhitsky, P., Ziemann, J., Zierke, S., Zoll, M.","Search for non-relativistic magnetic monopoles with IceCube",2014,"European Physical Journal C","74","7",,"1","19",,3,10.1140/epjc/s10052-014-2938-8,"https://www.scopus.com/inward/record.uri?eid=2-s2.0-84903428817&doi=10.1140%2fepjc%2fs10052-014-2938-8&partnerID=40&md5=05600d2b6fcf24edb8456ab3c8df3337",Article,Scopus,2-s2.0-84903428817
