Authors,Title,Year,Source title,Volume,Issue,Art. No.,Page start,Page end,Page count,Cited by,DOI,Link,Document Type,Source,EID
"Condon, B.J., Leng, Y., Wu, D., Bushley, K.E., Ohm, R.A., Otillar, R., Martin, J., Schackwitz, W., Grimwood, J., MohdZainudin, N.A.I., Xue, C., Wang, R., Manning, V.A., Dhillon, B., Tu, Z.J., Steffenson, B.J., Salamov, A., Sun, H., Lowry, S., LaButti, K., Han, J., Copeland, A., Lindquist, E., Barry, K., Schmutz, J., Baker, S.E., Ciuffetti, L.M., Grigoriev, I.V., Zhong, S., Turgeon, B.G.","Comparative Genome Structure, Secondary Metabolite, and Effector Coding Capacity across Cochliobolus Pathogens",2013,"PLoS Genetics","9","1", e1003233,"","",,64,10.1371/journal.pgen.1003233,"https://www.scopus.com/inward/record.uri?eid=2-s2.0-84873498227&doi=10.1371%2fjournal.pgen.1003233&partnerID=40&md5=fca441fc6d35f2f582604aab3d0f62ac",Article,Scopus,2-s2.0-84873498227
"Paterson, A.H., Wendel, J.F., Gundlach, H., Guo, H., Jenkins, J., Jin, D., Llewellyn, D., Showmaker, K.C., Shu, S., Udall, J., Yoo, M.-J., Byers, R., Chen, W., Doron-Faigenboim, A., Duke, M.V., Gong, L., Grimwood, J., Grover, C., Grupp, K., Hu, G., Lee, T.-H., Li, J., Lin, L., Liu, T., Marler, B.S., Page, J.T., Roberts, A.W., Romanel, E., Sanders, W.S., Szadkowski, E., Tan, X., Tang, H., Xu, C., Wang, J., Wang, Z., Zhang, D., Zhang, L., Ashrafi, H., Bedon, F., Bowers, J.E., Brubaker, C.L., Chee, P.W., Das, S., Gingle, A.R., Haigler, C.H., Harker, D., Hoffmann, L.V., Hovav, R., Jones, D.C., Lemke, C., Mansoor, S., Rahman, M.U., Rainville, L.N., Rambani, A., Reddy, U.K., Rong, J.-K., Saranga, Y., Scheffler, B.E., Scheffler, J.A., Stelly, D.M., Triplett, B.A., Van Deynze, A., Vaslin, M.F.S., Waghmare, V.N., Walford, S.A., Wright, R.J., Zaki, E.A., Zhang, T., Dennis, E.S., Mayer, K.F.X., Peterson, D.G., Rokhsar, D.S., Wang, X., Schmutz, J.","Repeated polyploidization of Gossypium genomes and the evolution of spinnable cotton fibres",2012,"Nature","492","7429",,"423","427",,363,10.1038/nature11798,"https://www.scopus.com/inward/record.uri?eid=2-s2.0-84871428041&doi=10.1038%2fnature11798&partnerID=40&md5=3f34b5cd550c0653b87fc9e945ac6697",Article,Scopus,2-s2.0-84871428041
"Curtis, B.A., Tanifuji, G., Maruyama, S., Gile, G.H., Hopkins, J.F., Eveleigh, R.J.M., Nakayama, T., Malik, S.-B., Onodera, N.T., Slamovits, C.H., Spencer, D.F., Lane, C.E., Gray, M.W., Archibald, J.M., Burki, F., Hirakawa, Y., Reyes-Prieto, A., Keeling, P.J., Fast, N.M., Green, B.R., Grisdale, C.J., Gruber, A., Kroth, P.G., Irimia, M., Arias, M.C., Ball, S.G., Kuo, A., Schmutz, J., Grimwood, J., Lindquist, E., Lucas, S., Salamov, A., Grigoriev, I.V., Rensing, S.A., Symeonidi, A., Elias, M., Herman, E.K., Klute, M.J., Dacks, J.B., Oborník, M., Kořený, L., Durnford, D.G., Neilson, J.A.D., Armbrust, E.V., Rocap, G., Aves, S.J., Liu, Y., Beiko, R.G., Coutinho, P., Henrissat, B., Hempel, F., Maier, U.G., Zauner, S., Häppner, M.P., Ishida, K.-I., Shirato, S., Suzuki, S., Kim, E., Richards, T.A., Mc Rose, D., Worden, A.Z., Mock, T., Poole, A.M., Pritham, E.J., Roy, S.W., Schaack, S., Bell, C., Bharti, A.K., Crow, J.A., Kramer, R., Mc Fadden, G.I.","Algal genomes reveal evolutionary mosaicism and the fate of nucleomorphs",2012,"Nature","492","7427",,"59","65",,150,10.1038/nature11681,"https://www.scopus.com/inward/record.uri?eid=2-s2.0-84870564943&doi=10.1038%2fnature11681&partnerID=40&md5=59a64d4eff55c3ef6d7985d1c4de9a03",Article,Scopus,2-s2.0-84870564943
"Sharma, M.K., Sharma, R., Cao, P., Jenkins, J., Bartley, L.E., Qualls, M., Grimwood, J., Schmutz, J., Rokhsar, D., Ronald, P.C.","A genome-wide survey of switchgrass genome structure and organization.",2012,"PloS one","7","4", e33892,"","",,29,,"https://www.scopus.com/inward/record.uri?eid=2-s2.0-84862025029&partnerID=40&md5=8fa08c767623208af8c0a4e8103986b1",Article,Scopus,2-s2.0-84862025029
"Sumiyama, K., Miyake, T., Grimwood, J., Stuart, A., Dickson, M., Schmutz, J., Ruddle, F.H., Myers, R.M., Amemiya, C.T.","Theria-Specific Homeodomain and cis-Regulatory Element Evolution of the Dlx3-4 Bigene Cluster in 12 Different Mammalian Species",2012,"Journal of Experimental Zoology Part B: Molecular and Developmental Evolution","318","8",,"639","650",,3,10.1002/jez.b.22469,"https://www.scopus.com/inward/record.uri?eid=2-s2.0-84870395102&doi=10.1002%2fjez.b.22469&partnerID=40&md5=dcfae87634348acc76789f8fc8f2a58f",Article,Scopus,2-s2.0-84870395102
"Morin, E., Kohler, A., Baker, A.R., Foulongne-Oriol, M., Lombard, V., Nagy, L.G., Ohm, R.A., Patyshakuliyeva, A., Brun, A., Aerts, A.L., Bailey, A.M., Billette, C., Coutinho, P.M., Deakin, G., Doddapaneni, H., Floudas, D., Grimwood, J., Hildén, K., Kües, U., LaButti, K.M., Lapidus, A., Lindquist, E.A., Lucas, S.M., Murat, C., Riley, R.W., Salamov, A.A., Schmutz, J., Subramanian, V., Wösten, H.A.B., Xu, J., Eastwood, D.C., Foster, G.D., Sonnenberg, A.S.M., Cullen, D., De Vries, R.P., Lundell, T., Hibbett, D.S., Henrissat, B., Burton, K.S., Kerrigan, R.W., Challen, M.P., Grigoriev, I.V., Martin, F.","Genome sequence of the button mushroom Agaricus bisporus reveals mechanisms governing adaptation to a humic-rich ecological niche",2012,"Proceedings of the National Academy of Sciences of the United States of America","109","43",,"17501","17506",,108,10.1073/pnas.1206847109,"https://www.scopus.com/inward/record.uri?eid=2-s2.0-84867919345&doi=10.1073%2fpnas.1206847109&partnerID=40&md5=8f14bdafe1353b8a3026938df3ffd1bc",Article,Scopus,2-s2.0-84867919345
"Wark, A.R., Mills, M.G., Dang, L.H., Chan, Y.F., Jones, F.C., Brady, S.D., Absher, D.M., Grimwood, J., Schmutz, J., Myers, R.M., Kingsley, D.M., Peichel, C.L.","Genetic architecture of variation in the lateral line sensory system of threespine sticklebacks.",2012,"G3 (Bethesda, Md.)","2","9",,"1047","1056",,20,,"https://www.scopus.com/inward/record.uri?eid=2-s2.0-84872789225&partnerID=40&md5=e34cc167ffd99a8371cb7d1ecf3ef62a",Article,Scopus,2-s2.0-84872789225
"Wark, A.R., Mills, M.G., Dang, L.-H., Chan, Y.F., Jones, F.C., Brady, S.D., Absher, D.M., Grimwood, J., Schmutz, J., Myers, R.M., Kingsley, D.M., Peichel, C.L.","Genetic architecture of variation in the lateral line sensory system of threespine sticklebacks",2012,"G3: Genes, Genomes, Genetics","2","9",,"1047","1056",,6,10.1534/g3.112.003079,"https://www.scopus.com/inward/record.uri?eid=2-s2.0-84883167399&doi=10.1534%2fg3.112.003079&partnerID=40&md5=5b06b7aa946e11f0ae139f5d547b50bd",Article,Scopus,2-s2.0-84883167399
"Bennetzen, J.L., Schmutz, J., Wang, H., Percifield, R., Hawkins, J., Pontaroli, A.C., Estep, M., Feng, L., Vaughn, J.N., Grimwood, J., Jenkins, J., Barry, K., Lindquist, E., Hellsten, U., Deshpande, S., Wang, X., Wu, X., Mitros, T., Triplett, J., Yang, X., Ye, C.-Y., Mauro-Herrera, M., Wang, L., Li, P., Sharma, M., Sharma, R., Ronald, P.C., Panaud, O., Kellogg, E.A., Brutnell, T.P., Doust, A.N., Tuskan, G.A., Rokhsar, D., Devos, K.M.","Reference genome sequence of the model plant Setaria",2012,"Nature Biotechnology","30","6",,"555","561",,248,10.1038/nbt.2196,"https://www.scopus.com/inward/record.uri?eid=2-s2.0-84862018035&doi=10.1038%2fnbt.2196&partnerID=40&md5=6a756ad7c6041c9713aa621e635094f7",Article,Scopus,2-s2.0-84862018035
"Olson, Å., Aerts, A., Asiegbu, F., Belbahri, L., Bouzid, O., Broberg, A., Canbäck, B., Coutinho, P.M., Cullen, D., Dalman, K., Deflorio, G., van Diepen, L.T.A., Dunand, C., Duplessis, S., Durling, M., Gonthier, P., Grimwood, J., Fossdal, C.G., Hansson, D., Henrissat, B., Hietala, A., Himmelstrand, K., Hoffmeister, D., Högberg, N., James, T.Y., Karlsson, M., Kohler, A., Kües, U., Lee, Y.-H., Lin, Y.-C., Lind, M., Lindquist, E., Lombard, V., Lucas, S., Lundén, K., Morin, E., Murat, C., Park, J., Raffaello, T., Rouzé, P., Salamov, A., Schmutz, J., Solheim, H., Ståhlberg, J., Vélëz, H., de Vries, R.P., Wiebenga, A., Woodward, S., Yakovlev, I., Garbelotto, M., Martin, F., Grigoriev, I.V., Stenlid, J.","Insight into trade-off between wood decay and parasitism from the genome of a fungal forest pathogen",2012,"New Phytologist","194","4",,"1001","1013",,80,10.1111/j.1469-8137.2012.04128.x,"https://www.scopus.com/inward/record.uri?eid=2-s2.0-84860511529&doi=10.1111%2fj.1469-8137.2012.04128.x&partnerID=40&md5=91e7ca2c7a9fc84980917a99b8f82cef",Article,Scopus,2-s2.0-84860511529
"Blanc, G., Agarkova, I., Grimwood, J., Kuo, A., Brueggeman, A., Dunigan, D.D., Gurnon, J., Ladunga, I., Lindquist, E., Lucas, S., Pangilinan, J., Pröschold, T., Salamov, A., Schmutz, J., Weeks, D., Yamada, T., Lomsadze, A., Borodovsky, M., Claverie, J.-M., Grigoriev, I.V., Van Etten, J.L.","The genome of the polar eukaryotic microalga Coccomyxa subellipsoidea reveals traits of cold adaptation",2012,"Genome Biology","13","5", R39,"","",,86,10.1186/gb-2012-13-5-r39,"https://www.scopus.com/inward/record.uri?eid=2-s2.0-84861408399&doi=10.1186%2fgb-2012-13-5-r39&partnerID=40&md5=f46e908096f09c9149ca21a3f3d9a738",Article,Scopus,2-s2.0-84861408399
"Jones, F.C., Grabherr, M.G., Chan, Y.F., Russell, P., Mauceli, E., Johnson, J., Swofford, R., Pirun, M., Zody, M.C., White, S., Birney, E., Searle, S., Schmutz, J., Grimwood, J., Dickson, M.C., Myers, R.M., Miller, C.T., Summers, B.R., Knecht, A.K., Brady, S.D., Zhang, H., Pollen, A.A., Howes, T., Amemiya, C., Baldwin, J., Bloom, T., Jaffe, D.B., Nicol, R., Wilkinson, J., Lander, E.S., Di Palma, F., Lindblad-Toh, K., Kingsley, D.M.","The genomic basis of adaptive evolution in threespine sticklebacks",2012,"Nature","484","7392",,"55","61",,600,10.1038/nature10944,"https://www.scopus.com/inward/record.uri?eid=2-s2.0-84859462157&doi=10.1038%2fnature10944&partnerID=40&md5=467e4b0b034b6e039d249c6454c0c00f",Article,Scopus,2-s2.0-84859462157
"Jones, F.C., Chan, Y.F., Schmutz, J., Grimwood, J., Brady, S.D., Southwick, A.M., Absher, D.M., Myers, R.M., Reimchen, T.E., Deagle, B.E., Schluter, D., Kingsley, D.M.","A genome-wide SNP genotyping array reveals patterns of global and repeated species-pair divergence in sticklebacks",2012,"Current Biology","22","1",,"83","90",,105,10.1016/j.cub.2011.11.045,"https://www.scopus.com/inward/record.uri?eid=2-s2.0-84855708550&doi=10.1016%2fj.cub.2011.11.045&partnerID=40&md5=560a1e7bb448a989875e28889bf57dca",Article,Scopus,2-s2.0-84855708550
"Berka, R.M., Grigoriev, I.V., Otillar, R., Salamov, A., Grimwood, J., Reid, I., Ishmael, N., John, T., Darmond, C., Moisan, M.-C., Henrissat, B., Coutinho, P.M., Lombard, V., Natvig, D.O., Lindquist, E., Schmutz, J., Lucas, S., Harris, P., Powlowski, J., Bellemare, A., Taylor, D., Butler, G., De Vries, R.P., Allijn, I.E., Van Den Brink, J., Ushinsky, S., Storms, R., Powell, A.J., Paulsen, I.T., Elbourne, L.D.H., Baker, S.E., Magnuson, J., Laboissiere, S., Clutterbuck, A.J., Martinez, D., Wogulis, M., De Leon, A.L., Rey, M.W., Tsang, A.","Comparative genomic analysis of the thermophilic biomass-degrading fungi Myceliophthora thermophila and Thielavia terrestris",2011,"Nature Biotechnology","29","10",,"922","929",,145,10.1038/nbt.1976,"https://www.scopus.com/inward/record.uri?eid=2-s2.0-80054733932&doi=10.1038%2fnbt.1976&partnerID=40&md5=f57903af470633715700a99e0cb2da73",Article,Scopus,2-s2.0-80054733932
"Smith, D.R., Burki, F., Yamada, T., Grimwood, J., Grigoriev, I.V., van Etten, J.L., Keeling, P.J.","The GC-rich mitochondrial and plastid genomes of the green alga coccomyxa give insight into the evolution of organelle DNA nucleotide landscape",2011,"PLoS ONE","6","8", e23624,"","",,25,10.1371/journal.pone.0023624,"https://www.scopus.com/inward/record.uri?eid=2-s2.0-80052067631&doi=10.1371%2fjournal.pone.0023624&partnerID=40&md5=be6f77834516ae95c45ba232fc2cc76a",Article,Scopus,2-s2.0-80052067631
"Greenwood, A.K., Jones, F.C., Chan, Y.F., Brady, S.D., Absher, D.M., Grimwood, J., Schmutz, J., Myers, R.M., Kingsley, D.M., Peichel, C.L.","The genetic basis of divergent pigment patterns in juvenile threespine sticklebacks",2011,"Heredity","107","2",,"155","166",,33,10.1038/hdy.2011.1,"https://www.scopus.com/inward/record.uri?eid=2-s2.0-79960697527&doi=10.1038%2fhdy.2011.1&partnerID=40&md5=1c38a3868ed106260a6d962bc9f2c6cf",Article,Scopus,2-s2.0-79960697527
"Goodwin, S.B., M'Barek, S.B., Dhillon, B., Wittenberg, A.H.J., Crane, C.F., Hane, J.K., Foster, A.J., van der Lee, T.A.J., Grimwood, J., Aerts, A., Antoniw, J., Bailey, A., Bluhm, B., Bowler, J., Bristow, J., van der Burgt, A., Canto-Canché, B., Churchill, A.C.L., Conde-Ferràez, L., Cools, H.J., Coutinho, P.M., Csukai, M., Dehal, P., de Wit, P., Donzelli, B., van de Geest, H.C., van Ham, R.C.H.J., Hammond-Kosack, K.E., Henrissat, B., Kilian, A., Kobayashi, A.K., Koopmann, E., Kourmpetis, Y., Kuzniar, A., Lindquist, E., Lombard, V., Maliepaard, C., Martins, N., Mehrabi, R., Nap, J.P.H., Ponomarenko, A., Rudd, J.J., Salamov, A., Schmutz, J., Schouten, H.J., Shapiro, H., Stergiopoulos, I., Torriani, S.F.F., Tu, H., de Vries, R.P., Waalwijk, C., Ware, S.B., Wiebenga, A., Zwiers, L.-H., Oliver, R.P., Grigoriev, I.V., Kema, G.H.J.","Finished genome of the fungal wheat pathogen Mycosphaerella graminicola reveals dispensome structure, chromosome plasticity, and stealth pathogenesis",2011,"PLoS Genetics","7","6", e1002070,"","",,205,10.1371/journal.pgen.1002070,"https://www.scopus.com/inward/record.uri?eid=2-s2.0-79959834134&doi=10.1371%2fjournal.pgen.1002070&partnerID=40&md5=e4aa189aff66227dd64c881480d4a402",Article,Scopus,2-s2.0-79959834134
"Andersen, M.R., Salazar, M.P., Schaap, P.J., Van De Vondervoort, P.J.I., Culley, D., Thykaer, J., Frisvad, J.C., Nielsen, K.F., Albang, R., Albermann, K., Berka, R.M., Braus, G.H., Braus-Stromeyer, S.A., Corrochano, L.M., Dai, Z., Van Dijck, P.W.M., Hofmann, G., Lasure, L.L., Magnuson, J.K., Menke, H., Meijer, M., Meijer, S.L., Nielsen, J.B., Nielsen, M.L., Van Ooyen, A.J.J., Pel, H.J., Poulsen, L., Samson, R.A., Stam, H., Tsang, A., Van Den Brink, J.M., Atkins, A., Aerts, A., Shapiro, H., Pangilinan, J., Salamov, A., Lou, Y., Lindquist, E., Lucas, S., Grimwood, J., Grigoriev, I.V., Kubicek, C.P., Martinez, D., Van Peij, N.N.M.E., Roubos, J.A., Nielsen, J., Baker, S.E.","Comparative genomics of citric-acid-producing Aspergillus niger ATCC 1015 versus enzyme-producing CBS 513.88",2011,"Genome Research","21","6",,"885","897",,136,10.1101/gr.112169.110,"https://www.scopus.com/inward/record.uri?eid=2-s2.0-79957958102&doi=10.1101%2fgr.112169.110&partnerID=40&md5=abee4c50d3b54dd150fc2b0b715e6281",Article,Scopus,2-s2.0-79957958102
"Hu, T.T., Pattyn, P., Bakker, E.G., Cao, J., Cheng, J.-F., Clark, R.M., Fahlgren, N., Fawcett, J.A., Grimwood, J., Gundlach, H., Haberer, G., Hollister, J.D., Ossowski, S., Ottilar, R.P., Salamov, A.A., Schneeberger, K., Spannagl, M., Wang, X., Yang, L., Nasrallah, M.E., Bergelson, J., Carrington, J.C., Gaut, B.S., Schmutz, J., Mayer, K.F.X., Van De Peer, Y., Grigoriev, I.V., Nordborg, M., Weigel, D., Guo, Y.-L.","The Arabidopsis lyrata genome sequence and the basis of rapid genome size change",2011,"Nature Genetics","43","5",,"476","483",,378,10.1038/ng.807,"https://www.scopus.com/inward/record.uri?eid=2-s2.0-79955468851&doi=10.1038%2fng.807&partnerID=40&md5=6d665027b46af4026f9e2e39d7967400",Article,Scopus,2-s2.0-79955468851
"Prochnik, S.E., Umen, J., Nedelcu, A.M., Hallmann, A., Miller, S.M., Nishii, I., Ferris, P., Kuo, A., Mitros, T., Fritz-Laylin, L.K., Hellsten, U., Chapman, J., Simakov, O., Rensing, S.A., Terry, A., Pangilinan, J., Kapitonov, V., Jurka, J., Salamov, A., Shapiro, H., Schmutz, J., Grimwood, J., Lindquist, E., Lucas, S., Grigoriev, I.V., Schmitt, R., Kirk, D., Rokhsar, D.S.","Genomic analysis of organismal complexity in the multicellular green alga volvox carteri",2010,"Science","329","5988",,"223","226",,263,10.1126/science.1188800,"https://www.scopus.com/inward/record.uri?eid=2-s2.0-77954606278&doi=10.1126%2fscience.1188800&partnerID=40&md5=5a18333c3fdd512615fd5b2c5f1868d7",Article,Scopus,2-s2.0-77954606278
"Rosa, S.F.P., Powell, A.E., Rosengarten, R.D., Nicotra, M.L., Moreno, M.A., Grimwood, J., Lakkis, F.G., Dellaporta, S.L., Buss, L.W.","Hydractinia allodeterminant alr1 resides in an immunoglobulin superfamily-like gene complex",2010,"Current Biology","20","12",,"1122","1127",,31,10.1016/j.cub.2010.04.050,"https://www.scopus.com/inward/record.uri?eid=2-s2.0-77955716625&doi=10.1016%2fj.cub.2010.04.050&partnerID=40&md5=7b1add53994827988300a7359c6575b6",Article,Scopus,2-s2.0-77955716625
"Schmutz, J., Cannon, S.B., Schlueter, J., Ma, J., Mitros, T., Nelson, W., Hyten, D.L., Song, Q., Thelen, J.J., Cheng, J., Xu, D., Hellsten, U., May, G.D., Yu, Y., Sakurai, T., Umezawa, T., Bhattacharyya, M.K., Sandhu, D., Valliyodan, B., Lindquist, E., Peto, M., Grant, D., Shu, S., Goodstein, D., Barry, K., Futrell-Griggs, M., Abernathy, B., Du, J., Tian, Z., Zhu, L., Gill, N., Joshi, T., Libault, M., Sethuraman, A., Zhang, X.-C., Shinozaki, K., Nguyen, H.T., Wing, R.A., Cregan, P., Specht, J., Grimwood, J., Rokhsar, D., Stacey, G., Shoemaker, R.C., Jackson, S.A.","Erratum: Genome sequence of the palaeopolyploid soybean (Nature (2010) 463 (178-183))",2010,"Nature","465","7294",,"120","",,9,10.1038/nature08957,"https://www.scopus.com/inward/record.uri?eid=2-s2.0-77952071621&doi=10.1038%2fnature08957&partnerID=40&md5=19326be17ccc75724889fb5d94fa1420",Erratum,Scopus,2-s2.0-77952071621
"Hellsten, U., Harland, R.M., Gilchrist, M.J., Hendrix, D., Jurka, J., Kapitonov, V., Ovcharenko, I., Putnam, N.H., Shu, S., Taher, L., Blitz, I.L., Blumberg, B., Dichmann, D.S., Dubchak, L., Amaya, E., Detter, J.C., Fletcher, R., Gerhard, D.S., Goodstein, D., Graves, T., Grigoriev, I.V., Grimwood, J., Kawashima, T., Lindquist, E., Lucas, S.M., Mead, P.E., Mitros, T., Ogino, H., Ohta, Y., Poliakov, A.V., Pollet, N., Robert, J., Salamov, A., Sater, A.K., Schmutz, J., Terry, A., Vize, P.D., Warren, W.C., Wells, D., Wills, A., Wilson, R.K., Zimmerman, L.B., Zorn, A.M., Grainger, R., Grammer, T., Khokha, M.K., Richardson, P.M., Rokhsar, D.S.","The genome of the western clawed frog xenopus tropicalis",2010,"Science","328","5978",,"633","636",,359,10.1126/science.1183670,"https://www.scopus.com/inward/record.uri?eid=2-s2.0-77951823093&doi=10.1126%2fscience.1183670&partnerID=40&md5=1abcf0066f69e14620cf2117af103140",Article,Scopus,2-s2.0-77951823093
"Ferris, P., Olson, B.J.S.C., De Hoff, P.L., Douglass, S., Casero, D., Prochnik, S., Geng, S., Rai, R., Grimwood, J., Schmutz, J., Nishfi, I., Hamaji, T., Nozaki, H., Pellegrini, M., Umen, J.G.","Evolution of an expanded sex-determining locus in Volvox",2010,"Science","328","5976",,"351","354",,70,10.1126/science.1186222,"https://www.scopus.com/inward/record.uri?eid=2-s2.0-77951185385&doi=10.1126%2fscience.1186222&partnerID=40&md5=b21b61558eb713d8a610b10f0b553378",Article,Scopus,2-s2.0-77951185385
"Amemiya, C.T., Powers, T.P., Prohaska, S.J., Grimwood, J., Schmutz, J., Dickson, M., Miyake, T., Schoenborn, M.A., Myers, R.M., Ruddle, F.H., Stadler, P.F.","Complete HOX cluster characterization of the coelacanth provides further evidence for slow evolution of its genome",2010,"Proceedings of the National Academy of Sciences of the United States of America","107","8",,"3622","3627",,42,10.1073/pnas.0914312107,"https://www.scopus.com/inward/record.uri?eid=2-s2.0-77649267002&doi=10.1073%2fpnas.0914312107&partnerID=40&md5=8901e68b550e43bd7596c8bc8bbcc0cb",Article,Scopus,2-s2.0-77649267002
"Vogel, J.P., Garvin, D.F., Mockler, T.C., Schmutz, J., Rokhsar, D., Bevan, M.W., Barry, K., Lucas, S., Harmon-Smith, M., Lail, K., Tice, H., Grimwood, J., McKenzie, N., Huo, N., Gu, Y.Q., Lazo, G.R., Anderson, O.D., You, F.M., Luo, M.-C., Dvorak, J., Wright, J., Febrer, M., Idziak, D., Hasterok, R., Lindquist, E., Wang, M., Fox, S.E., Priest, H.D., Filichkin, S.A., Givan, S.A., Bryant, D.W., Chang, J.H., Wu, H., Wu, W., Hsia, A.-P., Schnable, P.S., Kalyanaraman, A., Barbazuk, B., Michael, T.P., Hazen, S.P., Bragg, J.N., Laudencia-Chingcuanco, D., Weng, Y., Haberer, G., Spannagl, M., Mayer, K., Rattei, T., Mitros, T., Lee, S.-J., Rose, J.K.C., Mueller, L.A., York, T.L., Wicker, T., Buchmann, J.P., Tanskanen, J., Schulman, A.H., Gundlach, H., Beven, M., Costa De Oliveira, A., Da C. Maia, L., Belknap, W., Jiang, N., Lai, J., Zhu, L., Ma, J., Sun, C., Pritham, E., Salse, J., Murat, F., Abrouk, M., Bruggmann, R., Messing, J., Fahlgren, N., Sullivan, C.M., Carrington, J.C., Chapman, E.J., May, G.D., Zhai, J., Ganssmann, M., Gurazada, S.G.R., German, M., Meyers, B.C., Green, P.J., Tyler, L., Wu, J., Thomson, J., Chen, S., Scheller, H.V., Harholt, J., Ulvskov, P., Kimbrel, J.A., Bartley, L.E., Cao, P., Jung, K.-H., Sharma, M.K., Vega-Sanchez, M., Ronald, P., Dardick, C.D., De Bodt, S., Verelst, W., Inzé, D., Heese, M., Schnittger, A., Yang, X., Kalluri, U.C., Tuskan, G.A., Hua, Z., Vierstra, R.D., Cui, Y., Ouyang, S., Sun, Q., Liu, Z., Yilmaz, A., Grotewold, E., Sibout, R., Hematy, K., Mouille, G., Höfte, H., Micheel, T., Pelloux, J., O'Connor, D., Schnable, J., Rowe, S., Harmon, F., Cass, C.L., Sedbrook, J.C., Byrne, M.E., Walsh, S., Higgins, J., Li, P., Brutnell, T., Unver, T., Budak, H., Belcram, H., Charles, M., Chalhoub, B., Baxter, I.","Genome sequencing and analysis of the model grass Brachypodium distachyon",2010,"Nature","463","7282",,"763","768",,888,10.1038/nature08747,"https://www.scopus.com/inward/record.uri?eid=2-s2.0-76749150030&doi=10.1038%2fnature08747&partnerID=40&md5=2dd7dc679ba86d0d44e882c85e1adddd",Article,Scopus,2-s2.0-76749150030
"Chan, Y.F., Marks, M.E., Jones, F.C., Villarreal Jr., G., Shapiro, M.D., Brady, S.D., Southwick, A.M., Absher, D.M., Grimwood, J., Schmutz, J., Myers, R.M., Petrov, D., Jónsson, B., Schluter, D., Bell, M.A., Kingsley, D.M.","Adaptive evolution of pelvic reduction in sticklebacks by recurrent deletion of a pitxl enhancer",2010,"Science","327","5963",,"302","305",,437,10.1126/science.1182213,"https://www.scopus.com/inward/record.uri?eid=2-s2.0-74549118236&doi=10.1126%2fscience.1182213&partnerID=40&md5=705a95b02beb836b680cfeb8dfa42ec1",Article,Scopus,2-s2.0-74549118236
"Schmutz, J., Cannon, S.B., Schlueter, J., Ma, J., Mitros, T., Nelson, W., Hyten, D.L., Song, Q., Thelen, J.J., Cheng, J., Xu, D., Hellsten, U., May, G.D., Yu, Y., Sakurai, T., Umezawa, T., Bhattacharyya, M.K., Sandhu, D., Valliyodan, B., Lindquist, E., Peto, M., Grant, D., Shu, S., Goodstein, D., Barry, K., Futrell-Griggs, M., Abernathy, B., Du, J., Tian, Z., Zhu, L., Gill, N., Joshi, T., Libault, M., Sethuraman, A., Zhang, X.-C., Shinozaki, K., Nguyen, H.T., Wing, R.A., Cregan, P., Specht, J., Grimwood, J., Rokhsar, D., Stacey, G., Shoemaker, R.C., Jackson, S.A.","Genome sequence of the palaeopolyploid soybean",2010,"Nature","463","7278",,"178","183",,1670,10.1038/nature08670,"https://www.scopus.com/inward/record.uri?eid=2-s2.0-74549221016&doi=10.1038%2fnature08670&partnerID=40&md5=005a3d147a4fac49a72fcb839ee6be58",Article,Scopus,2-s2.0-74549221016
"Temple, G., Gerhard, D.S., Rasooly, R., Feingold, E.A., Good, P.J., Robinson, C., Mandich, A., Derge, J.G., Lewis, J., Shoaf, D., Collins, F.S., Jang, W., Wagner, L., Shenmen, C.M., Misquitta, L., Schaefer, C.F., Buetow, K.H., Bonner, T.I., Yankie, L., Ward, M., Phan, L., Astashyn, A., Brown, G., Farrell, C., Hart, J., Landrum, M., Maidak, B.L., Murphy, M., Murphy, T., Rajput, B., Riddick, L., Webb, D., Weber, J., Wu, W., Pruitt, K.D., Maglott, D., Siepel, A., Brejova, B., Diekhans, M., Harte, R., Baertsch, R., Kent, J., Haussler, D., Brent, M., Langton, L., Comstock, C.L.G., Stevens, M., Wei, C., Van Baren, M.J., Salehi-Ashtiani, K., Murray, R.R., Ghamsari, L., Mello, E., Lin, C., Pennacchio, C., Schreiber, K., Shapiro, N., Marsh, A., Pardes, E., Moore, T., Lebeau, A., Muratet, M., Simmons, B., Kloske, D., Sieja, S., Hudson, J., Sethupathy, P., Brownstein, M., Bhat, N., Lazar, J., Jacob, H., Gruber, C.E., Smith, M.R., McPherson, J., Garcia, A.M., Gunaratne, P.H., Wu, J., Muzny, D., Gibbs, R.A., Young, A.C., Bouffard, G.G., Blakesley, R.W., Mullikin, J., Green, E.D., Dickson, M.C., Rodriguez, A.C., Grimwood, J., Schmutz, J., Myers, R.M., Hirst, M., Zeng, T., Tse, K., Moksa, M., Deng, M., Ma, K., Mah, D., Pang, J., Taylor, G., Chuah, E., Deng, A., Fichter, K., Go, A., Lee, S., Wang, J., Griffith, M., Morin, R., Moore, R.A., Mayo, M., Munro, S., Wagner, S., Jones, S.J.M., Holt, R.A., Marra, M.A., Lu, S., Yang, S., Hartigan, J., Graf, M., Wagner, R., Letovksy, S., Pulido, J.C., Robison, K., Esposito, D., Hartley, J., Wall, V.E., Hopkins, R.F., Ohara, O., Wiemann, S.","The completion of the Mammalian Gene Collection",2009,"Genome Research","19","12",,"2324","2333",,66,10.1101/gr.095976.109,"https://www.scopus.com/inward/record.uri?eid=2-s2.0-73249119724&doi=10.1101%2fgr.095976.109&partnerID=40&md5=427d5d571c889f68f69e5a470c74e686",Article,Scopus,2-s2.0-73249119724
"Kitano, J., Ross, J.A., Mori, S., Kume, M., Jones, F.C., Chan, Y.F., Absher, D.M., Grimwood, J., Schmutz, J., Myers, R.M., Kingsley, D.M., Peichel, C.L.","A role for a neo-sex chromosome in stickleback speciation",2009,"Nature","461","7267",,"1079","1083",,146,10.1038/nature08441,"https://www.scopus.com/inward/record.uri?eid=2-s2.0-70350569405&doi=10.1038%2fnature08441&partnerID=40&md5=629aa928d9905cb45ed69a492e54005d",Article,Scopus,2-s2.0-70350569405
"O'Rourke, J.A., Nelson, R.T., Grant, D., Schmutz, J., Grimwood, J., Cannon, S., Vance, C.P., Graham, M.A., Shoemaker, R.C.","Integrating microarray analysis and the soybean genome to understand the soybeans iron deficiency response",2009,"BMC Genomics","10",, 376,"","",,28,10.1186/1471-2164-10-376,"https://www.scopus.com/inward/record.uri?eid=2-s2.0-69549111116&doi=10.1186%2f1471-2164-10-376&partnerID=40&md5=acf9d2c6dc1da7ef32aaac2bc263de65",Article,Scopus,2-s2.0-69549111116
