Authors,Title,Year,Source title,Volume,Issue,Art. No.,Page start,Page end,Page count,Cited by,DOI,Link,Document Type,Source,EID
"Collaboration, I., Aartsen, M.G., Ackermann, M., Adams, J., Aguilar, J.A., Ahlers, M., Ahrens, M., Samarai, I.A., Altmann, D., Andeen, K., Anderson, T., Ansseau, I., Anton, G., Archinger, M., Argüelles, C., Auffenberg, J., Axani, S., Bai, X., Barwick, S.W., Baum, V., Bay, R., Beatty, J.J., Tjus, J.B., Becker, K.-H., Benzvi, S., Berley, D., Bernardini, E., Besson, D.Z., Binder, G., Bindig, D., Blaufuss, E., Blot, S., Bohm, C., Börner, M., Bos, F., Bose, D., Böser, S., Botner, O., Braun, J., Brayeur, L., Bretz, H.-P., Bron, S., Burgman, A., Carver, T., Casier, M., Cheung, E., Chirkin, D., Christov, A., Clark, K., Classen, L., Coenders, S., Collin, G.H., Conrad, J.M., Cowen, D.F., Cross, R., Day, M., De André, J.P.A.M., De Clercq, C., Del Pino Rosendo, E., Dembinski, H., Ridder, S.D., Desiati, P., De Vries, K.D., De Wasseige, G., De With, M., Deyoung, T., Díaz-Vélez, J.C., Lorenzo, V.D., Dujmovic, H., Dumm, J.P., Dunkman, M., Eberhardt, B., Ehrhardt, T., Eichmann, B., Eller, P., Euler, S., Evenson, P.A., Fahey, S., Fazely, A.R., Feintzeig, J., Felde, J., Filimonov, K., Finley, C., Flis, S., Fösig, C.-C., Franckowiak, A., Friedman, E., Fuchs, T., Gaisser, T.K., Gallagher, J., Gerhardt, L., Ghorbani, K., Giang, W., Gladstone, L., Glauch, T., Glüsenkamp, T., Goldschmidt, A., Gonzalez, J.G., Grant, D., Griffith, Z., Haack, C., Hallgren, A., Halzen, F., Hansen, E., Hansmann, T., Hanson, K., Hebecker, D., Heereman, D., Helbing, K., Hellauer, R., Hickford, S., Hignight, J., Hill, G.C., Hoffman, K.D., Hoffmann, R., Hoshina, K., Huang, F., Huber, M., Hultqvist, K., In, S., Ishihara, A., Jacobi, E., Japaridze, G.S., Jeong, M., Jero, K., Jones, B.J.P., Kang, W., Kappes, A., Karg, T., Karle, A., Katz, U., Kauer, M., Keivani, A., Kelley, J.L., Kheirandish, A., Kim, J., Kim, M., Kintscher, T., Kiryluk, J., Kittler, T., Klein, S.R., Kohnen, G., Koirala, R., Kolanoski, H., Konietz, R., Köpke, L., Kopper, C., Kopper, S., Koskinen, D.J., Kowalski, M., Krings, K., Kroll, M., Krückl, G., Krüger, C., Kunnen, J., Kunwar, S., Kurahashi, N., Kuwabara, T., Kyriacou, A., Labare, M., Lanfranchi, J.L., Larson, M.J., Lauber, F., Lennarz, D., Lesiak-Bzdak, M., Leuermann, M., Lu, L., Lünemann, J., Madsen, J., Maggi, G., Mahn, K.B.M., Mancina, S., Mandelartz, M., Maruyama, R., Mase, K., Maunu, R., McNally, F., Meagher, K., Medici, M., Meier, M., Menne, T., Merino, G., Meures, T., Miarecki, S., Micallef, J., Momenté, G., Montaruli, T., Moulai, M., Nahnhauer, R., Naumann, U., Neer, G., Niederhausen, H., Nowicki, S.C., Nygren, D.R., Pollmann, A.O., Olivas, A., O'Murchadha, A., Palczewski, T., Pandya, H., Pankova, D.V., Peiffer, P., Penek, Ö., Pepper, J.A., Heros, C.P.D.L., Pieloth, D., Pinat, E., Price, P.B., Przybylski, G.T., Quinnan, M., Raab, C., Rädel, L., Rameez, M., Rawlins, K., Reimann, R., Relethford, B., Relich, M., Resconi, E., Rhode, W., Richman, M., Riedel, B., Robertson, S., Rongen, M., Rott, C., Ruhe, T., Ryckbosch, D., Rysewyk, D., Sabbatini, L., Herrera, S.E.S., Sandrock, A., Sandroos, J., Sarkar, S., Satalecka, K., Schlunder, P., Schmidt, T., Schoenen, S., Schöneberg, S., Schumacher, L., Seckel, D., Seunarine, S., Soldin, D., Song, M., Spiczak, G.M., Spiering, C., Stachurska, J., Stanev, T., Stasik, A., Stettner, J., Steuer, A., Stezelberger, T., Stokstad, R.G., Stößl, A., Ström, R., Strotjohann, N.L., Sullivan, G.W., Sutherland, M., Taavola, H., Taboada, I., Tatar, J., Tenholt, F., Ter-Antonyan, S., Terliuk, A., Tešić, G., Tilav, S., Toale, P.A., Tobin, M.N., Toscano, S., Tosi, D., Tselengidou, M., Tung, C.F., Turcati, A., Unger, E., Usner, M., Vandenbroucke, J., Eijndhoven, N.V., Vanheule, S., Rossem, M.V., Santen, J.V., Vehring, M., Voge, M., Vogel, E., Vraeghe, M., Walck, C., Wallace, A., Wallraff, M., Wandkowsky, N., Waza, A., Weaver, C., Weiss, M.J., Wendt, C., Westerhoff, S., Whelan, B.J., Wickmann, S., Wiebe, K., Wiebusch, C.H., Wille, L., Williams, D.R., Wills, L., Wolf, M., Wood, T.R., Woolsey, E., Woschnagg, K., Xu, D.L., Xu, X.W., Xu, Y., Yanez, J.P., Yodh, G., Yoshida, S., Zoll, M.","Extending the Search for Muon Neutrinos Coincident with Gamma-Ray Bursts in IceCube Data",2017,"Astrophysical Journal","843","2", 112,"","",,,10.3847/1538-4357/aa7569,"https://www.scopus.com/inward/record.uri?eid=2-s2.0-85025104720&doi=10.3847%2f1538-4357%2faa7569&partnerID=40&md5=16b0e38cfbd835582acf74b76c9235f2",Article,Scopus,2-s2.0-85025104720
"Aartsen, M.G., Ackermann, M., Adams, J., Aguilar, J.A., Ahlers, M., Ahrens, M., Al Samarai, I., Altmann, D., Andeen, K., Anderson, T., Ansseau, I., Anton, G., Archinger, M., Argüelles, C., Auffenberg, J., Axani, S., Bai, X., Barwick, S.W., Baum, V., Bay, R., Beatty, J.J., Becker Tjus, J., Becker, K.-H., Benzvi, S., Berley, D., Bernardini, E., Besson, D.Z., Binder, G., Bindig, D., Blaufuss, E., Blot, S., Bohm, C., Börner, M., Bos, F., Bose, D., Böser, S., Botner, O., Braun, J., Brayeur, L., Bretz, H.-P., Bron, S., Burgman, A., Carver, T., Casier, M., Cheung, E., Chirkin, D., Christov, A., Clark, K., Classen, L., Coenders, S., Collin, G.H., Conrad, J.M., Cowen, D.F., Cross, R., Day, M., De André, J.P.A.M., De Clercq, C., Del Pino Rosendo, E., Dembinski, H., De Ridder, S., Desiati, P., De Vries, K.D., De Wasseige, G., De With, M., Deyoung, T., Díaz-Vélez, J.C., Di Lorenzo, V., Dujmovic, H., Dumm, J.P., Dunkman, M., Eberhardt, B., Ehrhardt, T., Eichmann, B., Eller, P., Euler, S., Evenson, P.A., Fahey, S., Fazely, A.R., Feintzeig, J., Felde, J., Filimonov, K., Finley, C., Flis, S., Fösig, C.-C., Franckowiak, A., Friedman, E., Fuchs, T., Gaisser, T.K., Gallagher, J., Gerhardt, L., Ghorbani, K., Giang, W., Gladstone, L., Glauch, T., Glüsenkamp, T., Goldschmidt, A., Gonzalez, J.G., Grant, D., Griffith, Z., Haack, C., Hallgren, A., Halzen, F., Hansen, E., Hansmann, T., Hanson, K., Hebecker, D., Heereman, D., Helbing, K., Hellauer, R., Hickford, S., Hignight, J., Hill, G.C., Hoffman, K.D., Hoffmann, R., Hoshina, K., Huang, F., Huber, M., Hultqvist, K., In, S., Ishihara, A., Jacobi, E., Japaridze, G.S., Jeong, M., Jero, K., Jones, B.J.P., Kang, W., Kappes, A., Karg, T., Karle, A., Katz, U., Kauer, M., Keivani, A., Kelley, J.L., Kheirandish, A., Kim, J., Kim, M., Kintscher, T., Kiryluk, J., Kittler, T., Klein, S.R., Kohnen, G., Koirala, R., Kolanoski, H., Konietz, R., Köpke, L., Kopper, C., Kopper, S., Koskinen, D.J., Kowalski, M., Krings, K., Kroll, M., Krückl, G., Krüger, C., Kunnen, J., Kunwar, S., Kurahashi, N., Kuwabara, T., Kyriacou, A., Labare, M., Lanfranchi, J.L., Larson, M.J., Lauber, F., Lennarz, D., Lesiak-Bzdak, M., Leuermann, M., Lu, L., Lünemann, J., Madsen, J., Maggi, G., Mahn, K.B.M., Mancina, S., Mandelartz, M., Maruyama, R., Mase, K., Maunu, R., McNally, F., Meagher, K., Medici, M., Meier, M., Menne, T., Merino, G., Meures, T., Miarecki, S., Micallef, J., Momenté, G., Montaruli, T., Moulai, M., Nahnhauer, R., Naumann, U., Neer, G., Niederhausen, H., Nowicki, S.C., Nygren, D.R., Obertacke Pollmann, A., Olivas, A., O'Murchadha, A., Palczewski, T., Pandya, H., Pankova, D.V., Peiffer, P., Penek, Ö., Pepper, J.A., Pérez De Los Heros, C., Pieloth, D., Pinat, E., Price, P.B., Przybylski, G.T., Quinnan, M., Raab, C., Rädel, L., Rameez, M., Rawlins, K., Reimann, R., Relethford, B., Relich, M., Resconi, E., Rhode, W., Richman, M., Riedel, B., Robertson, S., Rongen, M., Rott, C., Ruhe, T., Ryckbosch, D., Rysewyk, D., Sabbatini, L., Sanchez Herrera, S.E., Sandrock, A., Sandroos, J., Sarkar, S., Satalecka, K., Schlunder, P., Schmidt, T., Schoenen, S., Schöneberg, S., Schumacher, L., Seckel, D., Seunarine, S., Soldin, D., Song, M., Spiczak, G.M., Spiering, C., Stachurska, J., Stanev, T., Stasik, A., Stettner, J., Steuer, A., Stezelberger, T., Stokstad, R.G., Stößl, A., Ström, R., Strotjohann, N.L., Sullivan, G.W., Sutherland, M., Taavola, H., Taboada, I., Tatar, J., Tenholt, F., Ter-Antonyan, S., Terliuk, A., Tešić, G., Tilav, S., Toale, P.A., Tobin, M.N., Toscano, S., Tosi, D., Tselengidou, M., Tung, C.F., Turcati, A., Unger, E., Usner, M., Vandenbroucke, J., Van Eijndhoven, N., Vanheule, S., Van Rossem, M., Van Santen, J., Vehring, M., Voge, M., Vogel, E., Vraeghe, M., Walck, C., Wallace, A., Wallraff, M., Wandkowsky, N., Waza, A., Weaver, C., Weiss, M.J., Wendt, C., Westerhoff, S., Whelan, B.J., Wickmann, S., Wiebe, K., Wiebusch, C.H., Wille, L., Williams, D.R., Wills, L., Wolf, M., Wood, T.R., Woolsey, E., Woschnagg, K., Xu, D.L., Xu, X.W., Xu, Y., Yanez, J.P., Yodh, G., Yoshida, S., Zoll, M.","Search for sterile neutrino mixing using three years of IceCube DeepCore data",2017,"Physical Review D","95","11", 112002,"","",,,10.1103/PhysRevD.95.112002,"https://www.scopus.com/inward/record.uri?eid=2-s2.0-85022325935&doi=10.1103%2fPhysRevD.95.112002&partnerID=40&md5=104c20c242b05cbe5a4a185cd67a3e30",Article,Scopus,2-s2.0-85022325935
"Aartsen, M.G., Ackermann, M., Adams, J., Aguilar, J.A., Ahlers, M., Ahrens, M., Altmann, D., Andeen, K., Anderson, T., Ansseau, I., Anton, G., Archinger, M., Argüelles, C., Auffenberg, J., Axani, S., Bai, X., Barwick, S.W., Baum, V., Bay, R., Beatty, J.J., Becker Tjus, J., Becker, K.-H., BenZvi, S., Berley, D., Bernardini, E., Bernhard, A., Besson, D.Z., Binder, G., Bindig, D., Bissok, M., Blaufuss, E., Blot, S., Bohm, C., Börner, M., Bos, F., Bose, D., Böser, S., Botner, O., Braun, J., Brayeur, L., Bretz, H.-P., Bron, S., Burgman, A., Carver, T., Casier, M., Cheung, E., Chirkin, D., Christov, A., Clark, K., Classen, L., Coenders, S., Collin, G.H., Conrad, J.M., Cowen, D.F., Cross, R., Day, M., de André, J.P.A.M., De Clercq, C., del Pino Rosendo, E., Dembinski, H., De Ridder, S., Desiati, P., de Vries, K.D., de Wasseige, G., de With, M., DeYoung, T., Díaz-Vélez, J.C., di Lorenzo, V., Dujmovic, H., Dumm, J.P., Dunkman, M., Eberhardt, B., Ehrhardt, T., Eichmann, B., Eller, P., Euler, S., Evenson, P.A., Fahey, S., Fazely, A.R., Feintzeig, J., Felde, J., Filimonov, K., Finley, C., Flis, S., Fösig, C.-C., Franckowiak, A., Friedman, E., Fuchs, T., Gaisser, T.K., Gallagher, J., Gerhardt, L., Ghorbani, K., Giang, W., Gladstone, L., Glauch, T., Glüsenkamp, T., Goldschmidt, A., Gonzalez, J.G., Grant, D., Griffith, Z., Haack, C., Hallgren, A., Halzen, F., Hansen, E., Hansmann, T., Hanson, K., Hebecker, D., Heereman, D., Helbing, K., Hellauer, R., Hickford, S., Hignight, J., Hill, G.C., Hoffman, K.D., Hoffmann, R., Hoshina, K., Huang, F., Huber, M., Hultqvist, K., In, S., Ishihara, A., Jacobi, E., Japaridze, G.S., Jeong, M., Jero, K., Jones, B.J.P., Kang, W., Kappes, A., Karg, T., Karle, A., Katz, U., Kauer, M., Keivani, A., Kelley, J.L., Kheirandish, A., Kim, J., Kim, M., Kintscher, T., Kiryluk, J., Kittler, T., Klein, S.R., Kohnen, G., Koirala, R., Kolanoski, H., Konietz, R., Köpke, L., Kopper, C., Kopper, S., Koskinen, D.J., Kowalski, M., Krings, K., Kroll, M., Krückl, G., Krüger, C., Kunnen, J., Kunwar, S., Kurahashi, N., Kuwabara, T., Labare, M., Lanfranchi, J.L., Larson, M.J., Lauber, F., Lennarz, D., Lesiak-Bzdak, M., Leuermann, M., Lu, L., Lünemann, J., Madsen, J., Maggi, G., Mahn, K.B.M., Mancina, S., Mandelartz, M., Maruyama, R., Mase, K., Maunu, R., McNally, F., Meagher, K., Medici, M., Meier, M., Meli, A., Menne, T., Merino, G., Meures, T., Miarecki, S., Montaruli, T., Moulai, M., Nahnhauer, R., Naumann, U., Neer, G., Niederhausen, H., Nowicki, S.C., Nygren, D.R., Obertacke Pollmann, A., Olivas, A., O'Murchadha, A., Palczewski, T., Pandya, H., Pankova, D.V., Peiffer, P., Penek, Ö., Pepper, J.A., Pérez de los Heros, C., Pieloth, D., Pinat, E., Price, P.B., Przybylski, G.T., Quinnan, M., Raab, C., Rädel, L., Rameez, M., Rawlins, K., Reimann, R., Relethford, B., Relich, M., Resconi, E., Rhode, W., Richman, M., Riedel, B., Robertson, S., Rongen, M., Rott, C., Ruhe, T., Ryckbosch, D., Rysewyk, D., Sabbatini, L., Sanchez Herrera, S.E., Sandrock, A., Sandroos, J., Sarkar, S., Satalecka, K., Schlunder, P., Schmidt, T., Schoenen, S., Schöneberg, S., Schumacher, L., Seckel, D., Seunarine, S., Soldin, D., Song, M., Spiczak, G.M., Spiering, C., Stanev, T., Stasik, A., Stettner, J., Steuer, A., Stezelberger, T., Stokstad, R.G., Stößl, A., Ström, R., Strotjohann, N.L., Sullivan, G.W., Sutherland, M., Taavola, H., Taboada, I., Tatar, J., Tenholt, F., Ter-Antonyan, S., Terliuk, A., Tešić, G., Tilav, S., Toale, P.A., Tobin, M.N., Toscano, S., Tosi, D., Tselengidou, M., Turcati, A., Unger, E., Usner, M., Vandenbroucke, J., van Eijndhoven, N., Vanheule, S., van Rossem, M., van Santen, J., Vehring, M., Voge, M., Vogel, E., Vraeghe, M., Walck, C., Wallace, A., Wallraff, M., Wandkowsky, N., Weaver, C., Weiss, M.J., Wendt, C., Westerhoff, S., Whelan, B.J., Wickmann, S., Wiebe, K., Wiebusch, C.H., Wille, L., Williams, D.R., Wills, L., Wolf, M., Wood, T.R., Woolsey, E., Woschnagg, K., Xu, D.L., Xu, X.W., Xu, Y., Yanez, J.P., Yodh, G., Yoshida, S., Zoll, M.","The IceCube realtime alert system",2017,"Astroparticle Physics","92",,,"30","41",,,10.1016/j.astropartphys.2017.05.002,"https://www.scopus.com/inward/record.uri?eid=2-s2.0-85019389273&doi=10.1016%2fj.astropartphys.2017.05.002&partnerID=40&md5=488c0a6476e2995f06566f70590faab0",Article,Scopus,2-s2.0-85019389273
"Aartsen, M.G., Abraham, K., Ackermann, M., Adams, J., Aguilar, J.A., Ahlers, M., Ahrens, M., Altmann, D., Andeen, K., Anderson, T., Ansseau, I., Anton, G., Archinger, M., Arguelles, C., Arlen, T.C., Auffenberg, J., Axani, S., Bai, X., Bartos, I., Barwick, S.W., Baum, V., Bay, R., Beatty, J.J., Becker Tjus, J., Becker, K.-H., Benzvi, S., Berghaus, P., Berley, D., Bernardini, E., Bernhard, A., Besson, D.Z., Binder, G., Bindig, D., Bissok, M., Blaufuss, E., Blot, S., Boersma, D.J., Bohm, C., Börner, M., Bos, F., Bose, D., Böser, S., Botner, O., Braun, J., Brayeur, L., Bretz, H.-P., Burgman, A., Carver, T., Casier, M., Cheung, E., Chirkin, D., Christov, A., Clark, K., Classen, L., Coenders, S., Collin, G.H., Conrad, J.M., Cowen, D.F., Cross, R., Day, M., De André, J.P.A.M., De Clercq, C., Del Rosendo, E.P., Dembinski, H., De Ridder, S., Desiati, P., De Vries, K.D., De Wasseige, G., De With, M., Deyoung, T., Díaz-Vélez, J.C., Di Lorenzo, V., Dujmovic, H., Dumm, J.P., Dunkman, M., Eberhardt, B., Ehrhardt, T., Eichmann, B., Eller, P., Euler, S., Evans, J.J., Evenson, P.A., Fahey, S., Fazely, A.R., Feintzeig, J., Felde, J., Filimonov, K., Finley, C., Flis, S., Fösig, C.-C., Franckowiak, A., Friedman, E., Fuchs, T., Gaisser, T.K., Gallagher, J., Gerhardt, L., Ghorbani, K., Giang, W., Gladstone, L., Glagla, M., Glüsenkamp, T., Goldschmidt, A., Golup, G., Gonzalez, J.G., Grant, D., Griffith, Z., Haack, C., Haj Ismail, A., Hallgren, A., Halzen, F., Hansen, E., Hansmann, B., Hansmann, T., Hanson, K., Haugen, J., Hebecker, D., Heereman, D., Helbing, K., Hellauer, R., Hickford, S., Hignight, J., Hill, G.C., Hoffman, K.D., Hoffmann, R., Holzapfel, K., Hoshina, K., Huang, F., Huber, M., Hultqvist, K., In, S., Ishihara, A., Jacobi, E., Japaridze, G.S., Jeong, M., Jero, K., Jones, B.J.P., Jurkovic, M., Kalekin, O., Kappes, A., Karagiorgi, G., Karg, T., Karle, A., Katori, T., Katz, U., Kauer, M., Keivani, A., Kelley, J.L., Kemp, J., Kheirandish, A., Kim, M., Kintscher, T., Kiryluk, J., Kittler, T., Klein, S.R., Kohnen, G., Koirala, R., Kolanoski, H., Konietz, R., Köpke, L., Kopper, C., Kopper, S., Koskinen, D.J., Kowalski, M., Krauss, C.B., Krings, K., Kroll, M., Krückl, G., Krüger, C., Kunnen, J., Kunwar, S., Kurahashi, N., Kuwabara, T., Labare, M., Lanfranchi, J.L., Larson, M.J., Lauber, F., Lennarz, D., Lesiak-Bzdak, M., Leuermann, M., Leuner, J., Losecco, J., Lu, L., Lünemann, J., Madsen, J., Maggi, G., Mahn, K.B.M., Mancina, S., Mandalia, S., Mandelartz, M., Marka, S., Marka, Z., Maruyama, R., Mase, K., Maunu, R., McNally, F., Meagher, K., Medici, M., Meier, M., Meli, A., Menne, T., Merino, G., Meures, T., Miarecki, S., Mohrmann, L., Montaruli, T., Moore, R.W., Moulai, M., Nahnhauer, R., Naumann, U., Neer, G., Niederhausen, H., Nowicki, S.C., Nygren, D.R., Obertacke Pollmann, A., Olivas, A., O'Murchadha, A., Palazzo, A., Palczewski, T., Pandya, H., Pankova, D.V., Penek, Ö., Pepper, J.A., Pérez De Los Heros, C., Petersen, T.C., Pieloth, D., Pinat, E., Pinfold, J.L., Price, P.B., Przybylski, G.T., Quinnan, M., Raab, C., Rädel, L., Rameez, M., Rawlins, K., Reimann, R., Relethford, B., Relich, M., Resconi, E., Rhode, W., Richman, M., Riedel, B., Robertson, S., Rongen, M., Rott, C., Ruhe, T., Ryckbosch, D., Rysewyk, D., Sabbatini, L., Sanchez Herrera, S.E., Sandrock, A., Sandroos, J., Sandstrom, P., Sarkar, S., Satalecka, K., Schimp, M., Schlunder, P., Schmidt, T., Schoenen, S., Schöneberg, S., Schumacher, L., Seckel, D., Seunarine, S., Shaevitz, M.H., Soldin, D., Söldner-Rembold, S., Song, M., Spiczak, G.M., Spiering, C., Stahlberg, M., Stanev, T., Stasik, A., Steuer, A., Stezelberger, T., Stokstad, R.G., Stößl, A., Ström, R., Strotjohann, N.L., Sullivan, G.W., Sutherland, M., Taavola, H., Taboada, I., Taketa, A., Tanaka, H.K.M., Tatar, J., Tenholt, F., Ter-Antonyan, S., Terliuk, A., Tešić, G., Tilav, S., Toale, P.A., Tobin, M.N., Toscano, S., Tosi, D., Tselengidou, M., Turcati, A., Unger, E., Usner, M., Vandenbroucke, J., Van Eijndhoven, N., Vanheule, S., Van Rossem, M., Van Santen, J., Veenkamp, J., Vehring, M., Voge, M., Vraeghe, M., Walck, C., Wallace, A., Wallraff, M., Wandkowsky, N., Weaver, C., Weiss, M.J., Wendt, C., Westerhoff, S., Whelan, B.J., Wickmann, S., Wiebe, K., Wiebusch, C.H., Wille, L., Williams, D.R., Wills, L., Wolf, M., Wood, T.R., Woolsey, E., Woschnagg, K., Wren, S., Xu, D.L., Xu, X.W., Xu, Y., Yanez, J.P., Yodh, G., Yoshida, S., Zoll, M.","PINGU: A vision for neutrino and particle physics at the South Pole",2017,"Journal of Physics G: Nuclear and Particle Physics","44","5", 054006,"","",,1,10.1088/1361-6471/44/5/054006,"https://www.scopus.com/inward/record.uri?eid=2-s2.0-85018480096&doi=10.1088%2f1361-6471%2f44%2f5%2f054006&partnerID=40&md5=89a52f160924a7288033a81c6a40d27f",Article,Scopus,2-s2.0-85018480096
"Aartsen, M.G., Ackermann, M., Adams, J., Aguilar, J.A., Ahlers, M., Ahrens, M., Altmann, D., Andeen, K., Anderson, T., Ansseau, I., Anton, G., Archinger, M., Argüelles, C., Auer, R., Auffenberg, J., Axani, S., Baccus, J., Bai, X., Barnet, S., Barwick, S.W., Baum, V., Bay, R., Beattie, K., Beatty, J.J., Tjus, J.B., Becker, K.-H., Bendfelt, T., Benzvi, S., Berley, D., Bernardini, E., Bernhard, A., Besson, D.Z., Binder, G., Bindig, D., Bissok, M., Blaufuss, E., Blot, S., Boersma, D., Bohm, C., Börner, M., Bos, F., Bose, D., Böser, S., Botner, O., Bouchta, A., Braun, J., Brayeur, L., Bretz, H.-P., Bron, S., Burgman, A., Burreson, C., Carver, T., Casier, M., Cheung, E., Chirkin, D., Christov, A., Clark, K., Classen, L., Coenders, S., Collin, G.H., Conrad, J.M., Cowen, D.F., Cross, R., Day, C., Day, M., De André, J.P.A.M., Clercq, C.D., Rosendo, E.D.P., Dembinski, H., Ridder, S.D., Descamps, F., Desiati, P., De Vries, K.D., De Wasseige, G., De With, M., DeYoung, T., Díaz-Vélez, J.C., Di Lorenzo, V., Dujmovic, H., Dumm, J.P., Dunkman, M., Eberhardt, B., Edwards, W.R., Ehrhardt, T., Eichmann, B., Eller, P., Euler, S., Evenson, P.A., Fahey, S., Fazely, A.R., Feintzeig, J., Felde, J., Filimonov, K., Finley, C., Flis, S., Fösig, C.-C., Franckowiak, A., Frère, M., Friedman, E., Fuchs, T., Gaisser, T.K., Gallagher, J., Gerhardt, L., Ghorbani, K., Giang, W., Gladstone, L., Glauch, T., Glowacki, D., Glüsenkamp, T., Goldschmidt, A., Gonzalez, J.G., Grant, D., Griffith, Z., Gustafsson, L., Haack, C., Hallgren, A., Halzen, F., Hansen, E., Hansmann, T., Hanson, K., Haugen, J., Hebecker, D., Heereman, D., Helbing, K., Hellauer, R., Heller, R., Hickford, S., Hignight, J., Hill, G.C., Hoffman, K.D., Hoffmann, R., Hoshina, K., Huang, F., Huber, M., Hulth, P.O., Hultqvist, K., In, S., Inaba, M., Ishihara, A., Jacobi, E., Jacobsen, J., Japaridze, G.S., Jeong, M., Jero, K., Jones, A., Jones, B.J.P., Joseph, J., Kang, W., Kappes, A., Karg, T., Karle, A., Katz, U., Kauer, M., Keivani, A., Kelley, J.L., Kemp, J., Kheirandish, A., Kim, J., Kim, M., Kintscher, T., Kiryluk, J., Kitamura, N., Kittler, T., Klein, S.R., Kleinfelder, S., Kleist, M., Kohnen, G., Koirala, R., Kolanoski, H., Konietz, R., Köpke, L., Kopper, C., Kopper, S., Koskinen, D.J., Kowalski, M., Krasberg, M., Krings, K., Kroll, M., Krückl, G., Krüger, C., Kunnen, J., Kunwar, S., Kurahashi, N., Kuwabara, T., Labare, M., Laihem, K., Landsman, H., Lanfranchi, J.L., Larson, M.J., Lauber, F., Laundrie, A., Lennarz, D., Leich, H., Lesiak-Bzdak, M., Leuermann, M., Lu, L., Ludwig, J., Lünemann, J., Mackenzie, C., Madsen, J., Maggi, G., Mahn, K.B.M., Mancina, S., Mandelartz, M., Maruyama, R., Mase, K., Matis, H., Maunu, R., McNally, F., McParland, C.P., Meade, P., Meagher, K., Medici, M., Meier, M., Meli, A., Menne, T., Merino, G., Meures, T., Miarecki, S., Minor, R.H., Montaruli, T., Moulai, M., Murray, T., Nahnhauer, R., Naumann, U., Neer, G., Newcomb, M., Niederhausen, H., Nowicki, S.C., Nygren, D.R., Pollmann, A.O., Olivas, A., O'Murchadha, A., Palczewski, T., Pandya, H., Pankova, D.V., Patton, S., Peiffer, P., Penek, Ö., Pepper, J.A., Heros, C.P.D.L., Pettersen, C., Pieloth, D., Pinat, E., Price, P.B., Przybylski, G.T., Quinnan, M., Raab, C., Rädel, L., Rameez, M., Rawlins, K., Reimann, R., Relethford, B., Relich, M., Resconi, E., Rhode, W., Richman, M., Riedel, B., Robertson, S., Rongen, M., Roucelle, C., Rott, C., Ruhe, T., Ryckbosch, D., Rysewyk, D., Sabbatini, L., Herrera, S.E.S., Sandrock, A., Sandroos, J., Sandstrom, P., Sarkar, S., Satalecka, K., Schlunder, P., Schmidt, T., Schoenen, S., Schöneberg, S., Schukraft, A., Schumacher, L., Seckel, D., Seunarine, S., Solarz, M., Soldin, D., Song, M., Spiczak, G.M., Spiering, C., Stanev, T., Stasik, A., Stettner, J., Steuer, A., Stezelberger, T., Stokstad, R.G., Stößl, A., Ström, R., Strotjohann, N.L., Sulanke, K.-H., Sullivan, G.W., Sutherland, M., Taavola, H., Taboada, I., Tatar, J., Tenholt, F., Ter-Antonyan, S., Terliuk, A., Tešić, G., Thollander, L., Tilav, S., Toale, P.A., Tobin, M.N., Toscano, S., Tosi, D., Tselengidou, M., Turcati, A., Unger, E., Usner, M., Vandenbroucke, J., Eijndhoven, N.V., Vanheule, S., Rossem, M.V., Santen, J.V., Vehring, M., Voge, M., Vogel, E., Vraeghe, M., Wahl, D., Walck, C., Wallace, A., Wallraff, M., Wandkowsky, N., Weaver, C., Weiss, M.J., Wendt, C., Westerhoff, S., Wharton, D., Whelan, B.J., Wickmann, S., Wiebe, K., Wiebusch, C.H., Wille, L., Williams, D.R., Wills, L., Wisniewski, P., Wolf, M., Wood, T.R., Woolsey, E., Woschnagg, K., Xu, D.L., Xu, X.W., Xu, Y., Yanez, J.P., Yodh, G., Yoshida, S., Zoll, M.","The IceCube Neutrino Observatory: Instrumentation and online systems",2017,"Journal of Instrumentation","12","3", P03012,"","",,2,10.1088/1748-0221/12/03/P03012,"https://www.scopus.com/inward/record.uri?eid=2-s2.0-85017394006&doi=10.1088%2f1748-0221%2f12%2f03%2fP03012&partnerID=40&md5=29124143e97c12b72f8a6b6a981110a7",Review,Scopus,2-s2.0-85017394006
