Authors,Title,Year,Source title,Volume,Issue,Art. No.,Page start,Page end,Page count,Cited by,DOI,Link,Document Type,Source,EID
"Abbasi, R., Abdou, Y., Abu-Zayyad, T., Adams, J., Aguilar, J.A., Ahlers, M., Andeen, K., Auffenberg, J., Bai, X., Baker, M., Barwick, S.W., Bay, R., Alba, J.L.B., Beattie, K., Beatty, J.J., Bechet, S., Becker, J.K., Becker, K.-H., Benabderrahmane, M.L., Berdermann, J., Berghaus, P., Berley, D., Bernardini, E., Bertrand, D., Besson, D.Z., Bissok, M., Blaufuss, E., Boersma, D.J., Bohm, C., Botner, O., Bradley, L., Braun, J., Breder, D., Carson, M., Castermans, T., Chirkin, D., Christy, B., Clem, J., Cohen, S., Cowen, D.F., D'Agostino, M.V., Danninger, M., Day, C.T., De Clercq, C., Demirörs, L., Depaepe, O., Descamps, F., Desiati, P., De Vries-Uiterweerd, G., Deyoung, T., Díaz-Vélez, J.C., Dreyer, J., Dumm, J.P., Duvoort, M.R., Edwards, W.R., Ehrlich, R., Eisch, J., Ellsworth, R.W., Engdegård, O., Euler, S., Evenson, P.A., Fadiran, O., Fazely, A.R., Feusels, T., Filimonov, K., Finley, C., Foerster, M.M., Fox, B.D., Franckowiak, A., Franke, R., Gaisser, T.K., Gallagher, J., Ganugapati, R., Gerhardt, L., Gladstone, L., Goldschmidt, A., Goodman, J.A., Gozzini, R., Grant, D., Griesel, T., Groß, A., Grullon, S., Gunasingha, R.M., Gurtner, M., Ha, C., Hallgren, A., Halzen, F., Han, K., Hanson, K., Hasegawa, Y., Helbing, K., Herquet, P., Hickford, S., Hill, G.C., Hoffman, K.D., Homeier, A., Hoshina, K., Hubert, D., Huelsnitz, W., Hülß, J.-P., Hulth, P.O., Hultqvist, K., Hussain, S., Imlay, R.L., Inaba, M., Ishihara, A., Jacobsen, J., Japaridze, G.S., Johansson, H., Joseph, J.M., Kampert, K.-H., Kappes, A., Karg, T., Karle, A., Kelley, J.L., Kemming, N., Kenny, P., Kiryluk, J., Kislat, F., Klein, S.R., Knops, S., Kohnen, G., Kolanoski, H., Köpke, L., Koskinen, D.J., Kowalski, M., Kowarik, T., Krasberg, M., Krings, T., Kroll, G., Kuehn, K., Kuwabara, T., Labare, M., Lafebre, S., Laihem, K., Landsman, H., Lauer, R., Lehmann, R., Lennarz, D., Lundberg, J., Lünemann, J., Madsen, J., Majumdar, P., Maruyama, R., Mase, K., Matis, H.S., McParland, C.P., Meagher, K., Merck, M., Mészáros, P., Meures, T., Middell, E., Milke, N., Miyamoto, H., Montaruli, T., Morse, R., Movit, S.M., Nahnhauer, R., Nam, J.W., Nießen, P., Nygren, D.R., Odrowski, S., Olivas, A., Olivo, M., Ono, M., Panknin, S., Patton, S., Paul, L., De Los Heros, C.P., Petrovic, J., Piegsa, A., Pieloth, D., Pohl, A.C., Porrata, R., Potthoff, N., Price, P.B., Prikockis, M., Przybylski, G.T., Rawlins, K., Redl, P., Resconi, E., Rhode, W., Ribordy, M., Rizzo, A., Rodrigues, J.P., Roth, P., Rothmaier, F., Rott, C., Roucelle, C., Rutledge, D., Ruzybayev, B., Ryckbosch, D., Sander, H.-G., Sarkar, S., Schatto, K., Schlenstedt, S., Schmidt, T., Schneider, D., Schukraft, A., Schulz, O., Schunck, M., Seckel, D., Semburg, B., Seo, S.H., Sestayo, Y., Seunarine, S., Silvestri, A., Slipak, A., Spiczak, G.M., Spiering, C., Stamatikos, M., Stanev, T., Stephens, G., Stezelberger, T., Stokstad, R.G., Stoufer, M.C., Stoyanov, S., Strahler, E.A., Straszheim, T., Sullivan, G.W., Swillens, Q., Taboada, I., Tamburro, A., Tarasova, O., Tepe, A., Ter-Antonyan, S., Terranova, C., Tilav, S., Toale, P.A., Tooker, J., Tosi, D., Turčan, D., Van Eijndhoven, N., Vandenbroucke, J., Van Overloop, A., Van Santen, J., Voigt, B., Walck, C., Waldenmaier, T., Wallraff, M., Walter, M., Wendt, C., Westerhoff, S., Whitehorn, N., Wiebe, K., Wiebusch, C.H., Wiedemann, A., Wikström, G., Williams, D.R., Wischnewski, R., Wissing, H., Woschnagg, K., Xu, C., Xu, X.W., Yodh, G., Yoshida, S.","Extending the search for neutrino point sources with iceCube above the horizon",2009,"Physical Review Letters","103","22", 221102,"","",,35,10.1103/PhysRevLett.103.221102,"https://www.scopus.com/inward/record.uri?eid=2-s2.0-72649098574&doi=10.1103%2fPhysRevLett.103.221102&partnerID=40&md5=5655054163864be69ff1ea745974d374",Article,Scopus,2-s2.0-72649098574
"Adamová, D., Agakichiev, G., Andronic, A., Antończyk, D., Appelshäuser, H., Belaga, V., Bielčíková, J., Braun-Munzinger, P., Busch, O., Cherlin, A., Damjanović, S., Dietel, T., Dietrich, L., Drees, A., Dubitzky, W., Esumi, S.I., Filimonov, K., Fomenko, K., Fraenkel, Z., Garabatos, C., Glässel, P., Holeczek, J., Kalisky, M., Kniege, S., Kushpil, V., Marín, A., Milošević, J., Miśkowiec, D., Panebrattsev, Y., Petchenova, O., Petráček, V., Płoskoń, M., Radomski, S., Rak, J., Ravinovich, I., Rehak, P., Sako, H., Schmitz, W., Schuchmann, S., Schukraft, J., Sedykh, S., Shimansky, S., Soualah, R., Stachel, J., Šumbera, M., Tilsner, H., Tserruya, I., Tsiledakis, G., Wessels, J.P., Wurm, J.P., Yurevich, S., Yurevich, V.","The CERES Collaboration",2009,"Nuclear Physics A","830","1-4",,"","",,,10.1016/j.nuclphysa.2009.10.146,"https://www.scopus.com/inward/record.uri?eid=2-s2.0-71649108806&doi=10.1016%2fj.nuclphysa.2009.10.146&partnerID=40&md5=f65a9dab5e013ad9950010cda5641322",Conference Paper,Scopus,2-s2.0-71649108806
"Adamová, D., Agakichiev, G., Antończyk, D., Appelshäuser, H., Belaga, V., Bielčíková, J., Braun-Munzinger, P., Busch, O., Cherlin, A., Damjanović, S., Dietel, T., Dietrich, L., Drees, A., Dubitzky, W., Esumi, S.I., Filimonov, K., Fomenko, K., Fraenkel, Z., Garabatos, C., Glässel, P., Holeczek, J., Kalisky, M., Kniege, S., Kushpil, V., Maas, A., Marín, A., Milošević, J., Milov, A., Miśkowiec, D., Panebrattsev, Yu., Petchenova, O., Petráček, V., Pfeiffer, A., Płoskoń, M., Rak, J., Ravinovich, I., Rehak, P., Sako, H., Schmitz, W., Schuchmann, S., Sedykh, S., Shimansky, S., Stachel, J., Šumbera, M., Tilsner, H., Tserruya, I., Wessels, J.P., Wienold, T., Wurm, J.P., Xie, W., Yurevich, S., Yurevich, V.","Modification of jet-like correlations in Pb-Au collisions at 158 A GeV / c",2009,"Physics Letters, Section B: Nuclear, Elementary Particle and High-Energy Physics","678","3",,"259","263",,4,10.1016/j.physletb.2009.05.048,"https://www.scopus.com/inward/record.uri?eid=2-s2.0-67649544352&doi=10.1016%2fj.physletb.2009.05.048&partnerID=40&md5=3fb0e55a916722b88c822c1b1bac8a75",Article,Scopus,2-s2.0-67649544352
"Abbasi, R., Abdou, Y., Ackermann, M., Adams, J., Ahlers, M., Andeen, K., Auffenberg, J., Bai, X., Baker, M., Barwick, S.W., Bay, R., Bazo Alba, J.L., Beattie, K., Beatty, J.J., Bechet, S., Becker, J.K., Becker, K.-H., Benabderrahmane, M.L., Berdermann, J., Berghaus, P., Berley, D., Bernardini, E., Bertrand, D., Besson, D.Z., Bissok, M., Blaufuss, E., Boersma, D.J., Bohm, C., Bolmont, J., Böser, S., Botner, O., Bradley, L., Braun, J., Breder, D., Burgess, T., Castermans, T., Chirkin, D., Christy, B., Clem, J., Cohen, S., Cowen, D.F., D'Agostino, M.V., Danninger, M., Day, C.T., De Clercq, C., Demirörs, L., Depaepe, O., Descamps, F., Desiati, P., De Vries-Uiterweerd, G., Deyoung, T., Diaz-Velez, J.C., Dreyer, J., Dumm, J.P., Duvoort, M.R., Edwards, W.R., Ehrlich, R., Eisch, J., Ellsworth, R.W., Engdegård, O., Euler, S., Evenson, P.A., Fadiran, O., Fazely, A.R., Feusels, T., Filimonov, K., Finley, C., Foerster, M.M., Fox, B.D., Franckowiak, A., Franke, R., Gaisser, T.K., Gallagher, J., Ganugapati, R., Gerhardt, L., Gladstone, L., Goldschmidt, A., Goodman, J.A., Gozzini, R., Grant, D., Griesel, T., Groß, A., Grullon, S., Gunasingha, R.M., Gurtner, M., Ha, C., Hallgren, A., Halzen, F., Han, K., Hanson, K., Hasegawa, Y., Heise, J., Helbing, K., Herquet, P., Hickford, S., Hill, G.C., Hoffman, K.D., Hoshina, K., Hubert, D., Huelsnitz, W., Hülß, J.-P., Hulth, P.O., Hultqvist, K., Hussain, S., Imlay, R.L., Inaba, M., Ishihara, A., Jacobsen, J., Japaridze, G.S., Johansson, H., Joseph, J.M., Kampert, K.-H., Kappes, A., Karg, T., Karle, A., Kelley, J.L., Kenny, P., Kiryluk, J., Kislat, F., Klein, S.R., Klepser, S., Knops, S., Kohnen, G., Kolanoski, H., Köpke, L., Kowalski, M., Kowarik, T., Krasberg, M., Kuehn, K., Kuwabara, T., Labare, M., Lafebre, S., Laihem, K., Landsman, H., Lauer, R., Leich, H., Lennarz, D., Lucke, A., Lundberg, J., Lünemann, J., Madsen, J., Majumdar, P., Maruyama, R., Mase, K., Matis, H.S., McParland, C.P., Meagher, K., Merck, M., Mészáros, P., Middell, E., Milke, N., Miyamoto, H., Mohr, A., Montaruli, T., Morse, R., Movit, S.M., Münich, K., Nahnhauer, R., Nam, J.W., Nießen, P., Nygren, D.R., Odrowski, S., Olivas, A., Olivo, M., Ono, M., Panknin, S., Patton, S., Pérez De Los Heros, C., Petrovic, J., Piegsa, A., Pieloth, D., Pohl, A.C., Porrata, R., Potthoff, N., Price, P.B., Prikockis, M., Przybylski, G.T., Rawlins, K., Redl, P., Resconi, E., Rhode, W., Ribordy, M., Rizzo, A., Rodrigues, J.P., Roth, P., Rothmaier, F., Rott, C., Roucelle, C., Rutledge, D., Ryckbosch, D., Sander, H.-G., Sarkar, S., Satalecka, K., Schlenstedt, S., Schmidt, T., Schneider, D., Schukraft, A., Schulz, O., Schunck, M., Seckel, D., Semburg, B., Seo, S.H., Sestayo, Y., Seunarine, S., Silvestri, A., Slipak, A., Spiczak, G.M., Spiering, C., Stamatikos, M., Stanev, T., Stephens, G., Stezelberger, T., Stokstad, R.G., Stoufer, M.C., Stoyanov, S., Strahler, E.A., Straszheim, T., Sulanke, K.-H., Sullivan, G.W., Swillens, Q., Taboada, I., Tarasova, O., Tepe, A., Ter-Antonyan, S., Terranova, C., Tilav, S., Tluczykont, M., Toale, P.A., Tosi, D., Turčan, D., Van Eijndhoven, N., Vandenbroucke, J., Van Overloop, A., Voigt, B., Walck, C., Waldenmaier, T., Walter, M., Wendt, C., Westerhoff, S., Whitehorn, N., Wiebusch, C.H., Wiedemann, A., Wikström, G., Williams, D.R., Wischnewski, R., Wissing, H., Woschnagg, K., Xu, X.W., Yodh, G., Yoshida, S.","Limits on a muon flux from neutralino annihilations in the sun with the IceCube 22-string detector",2009,"Physical Review Letters","102","20", 201302,"","",,127,10.1103/PhysRevLett.102.201302,"https://www.scopus.com/inward/record.uri?eid=2-s2.0-66149168831&doi=10.1103%2fPhysRevLett.102.201302&partnerID=40&md5=d685355340d27c0c481a485d6c7694c5",Article,Scopus,2-s2.0-66149168831
"Abbasi, R., Abdou, Y., Ackermann, M., Adams, J., Ahlers, M., Andeen, K., Auffenberg, J., Bai, X., Baker, M., Barwick, S.W., Bay, R., Bazo Alba, J.L., Beattie, K., Bechet, S., Becker, J.K., Becker, K.-H., Benabderrahmane, M.L., Berdermann, J., Berghaus, P., Berley, D., Bernardini, E., Bertrand, D., Besson, D.Z., Bissok, M., Blaufuss, E., Boersma, D.J., Bohm, C., Bolmont, J., Böser, S., Botner, O., Bradley, L., Braun, J., Breder, D., Burgess, T., Castermans, T., Chirkin, D., Christy, B., Clem, J., Cohen, S., Cowen, D.F., D'Agostino, M.V., Danninger, M., Day, C.T., De Clercq, C., Demirörs, L., Depaepe, O., Descamps, F., Desiati, P., De Vries-Uiterweerd, G., Deyoung, T., Diaz-Velez, J.C., Dreyer, J., Dumm, J.P., Duvoort, M.R., Edwards, W.R., Ehrlich, R., Eisch, J., Ellsworth, R.W., Engdegård, O., Euler, S., Evenson, P.A., Fadiran, O., Fazely, A.R., Feusels, T., Filimonov, K., Finley, C., Foerster, M.M., Fox, B.D., Franckowiak, A., Franke, R., Gaisser, T.K., Gallagher, J., Ganugapati, R., Gerhardt, L., Gladstone, L., Goldschmidt, A., Goodman, J.A., Gozzini, R., Grant, D., Griesel, T., Groß, A., Grullon, S., Gunasingha, R.M., Gurtner, M., Ha, C., Hallgren, A., Halzen, F., Han, K., Hanson, K., Hasegawa, Y., Heise, J., Helbing, K., Herquet, P., Hickford, S., Hill, G.C., Hoffman, K.D., Hoshina, K., Hubert, D., Huelsnitz, W., Hülß, J.-P., Hulth, P.O., Hultqvist, K., Hussain, S., Imlay, R.L., Inaba, M., Ishihara, A., Jacobsen, J., Japaridze, G.S., Johansson, H., Joseph, J.M., Kampert, K.-H., Kappes, A., Karg, T., Karle, A., Kelley, J.L., Kenny, P., Kiryluk, J., Kislat, F., Klein, S.R., Klepser, S., Knops, S., Kohnen, G., Kolanoski, H., Köpke, L., Kowalski, M., Kowarik, T., Krasberg, M., Kuehn, K., Kuwabara, T., Labare, M., Laihem, K., Landsman, H., Lauer, R., Leich, H., Lennarz, D., Lucke, A., Lundberg, J., Lünemann, J., Madsen, J., Majumdar, P., Maruyama, R., Mase, K., Matis, H.S., McParland, C.P., Meagher, K., Merck, M., Mészáros, P., Middell, E., Milke, N., Miyamoto, H., Mohr, A., Montaruli, T., Morse, R., Movit, S.M., Münich, K., Nahnhauer, R., Nam, J.W., Nießen, P., Nygren, D.R., Odrowski, S., Olivas, A., Olivo, M., Ono, M., Panknin, S., Patton, S., Pérez De Los Heros, C., Petrovic, J., Piegsa, A., Pieloth, D., Pohl, A.C., Porrata, R., Potthoff, N., Price, P.B., Prikockis, M., Przybylski, G.T., Rawlins, K., Redl, P., Resconi, E., Rhode, W., Ribordy, M., Rizzo, A., Rodrigues, J.P., Roth, P., Rothmaier, F., Rott, C., Roucelle, C., Rutledge, D., Ryckbosch, D., Sander, H.-G., Sarkar, S., Satalecka, K., Schlenstedt, S., Schmidt, T., Schneider, D., Schukraft, A., Schulz, O., Schunck, M., Seckel, D., Semburg, B., Seo, S.H., Sestayo, Y., Seunarine, S., Silvestri, A., Slipak, A., Spiczak, G.M., Spiering, C., Stanev, T., Stephens, G., Stezelberger, T., Stokstad, R.G., Stoufer, M.C., Stoyanov, S., Strahler, E.A., Straszheim, T., Sulanke, K.-H., Sullivan, G.W., Swillens, Q., Taboada, I., Tarasova, O., Tepe, A., Ter-Antonyan, S., Terranova, C., Tilav, S., Tluczykont, M., Toale, P.A., Tosi, D., Turčan, D., Van Eijndhoven, N., Vandenbroucke, J., Van Overloop, A., Voigt, B., Walck, C., Waldenmaier, T., Walter, M., Wendt, C., Westerhoff, S., Whitehorn, N., Wiebusch, C.H., Wiedemann, A., Wikström, G., Williams, D.R., Wischnewski, R., Wissing, H., Woschnagg, K., Xu, X.W., Yodh, G., Yoshida, S.","Determination of the atmospheric neutrino flux and searches for new physics with AMANDA-II",2009,"Physical Review D - Particles, Fields, Gravitation and Cosmology","79","10", 102005,"","",,65,10.1103/PhysRevD.79.102005,"https://www.scopus.com/inward/record.uri?eid=2-s2.0-67649438962&doi=10.1103%2fPhysRevD.79.102005&partnerID=40&md5=ed441d4362f038d0157a33aea29c0b02",Article,Scopus,2-s2.0-67649438962
"Abbasi, R., Ackermann, M., Adams, J., Ahlers, M., Ahrens, J., Andeen, K., Auffenberg, J., Bai, X., Baker, M., Barwick, S.W., Bay, R., Bazo Alba, J.L., Beattie, K., Becka, T., Becker, J.K., Becker, K.-H., Berghaus, P., Berley, D., Bernardini, E., Bertrand, D., Besson, D.Z., Bingham, B., Blaufuss, E., Boersma, D.J., Bohm, C., Bolmont, J., Böser, S., Botner, O., Braun, J., Breeder, D., Burgess, T., Carithers, W., Castermans, T., Chen, H., Chirkin, D., Christy, B., Clem, J., Cowen, D.F., D'Agostino, M.V., Danninger, M., Davour, A., Day, C.T., Depaepe, O., De Clercq, C., Demirörs, L., Descamps, F., Desiati, P., de Vries-Uiterweerd, G., DeYoung, T., Diaz-Velez, J.C., Dreyer, J., Dumm, J.P., Duvoort, M.R., Edwards, W.R., Ehrlich, R., Eisch, J., Ellsworth, R.W., Engdegård, O., Euler, S., Evenson, P.A., Fadiran, O., Fazely, A.R., Feusels, T., Filimonov, K., Finley, C., Foerster, M.M., Fox, B.D., Franckowiak, A., Franke, R., Gaisser, T.K., Gallagher, J., Ganugapati, R., Gerhardt, L., Gladstone, L., Glowacki, D., Goldschmidt, A., Goodman, J.A., Gozzini, R., Grant, D., Griesel, T., Groß, A., Grullon, S., Gunasingha, R.M., Gurtner, M., Ha, C., Hallgren, A., Halzen, F., Han, K., Hanson, K., Hardtke, R., Hasegawa, Y., Haugen, J., Hays, D., Heise, J., Helbing, K., Hellwig, M., Herquet, P., Hickford, S., Hill, G.C., Hodges, J., Hoffman, K.D., Hoshina, K., Hubert, D., Huelsnitz, W., Hughey, B., Hülß, J.-P., Hulth, P.O., Hultqvist, K., Hussain, S., Imlay, R.L., Inaba, M., Ishihara, A., Jacobsen, J., Japaridze, G.S., Johansson, H., Jones, A., Joseph, J.M., Kampert, K.-H., Kappes, A., Karg, T., Karle, A., Kawai, H., Kelley, J.L., Kiryluk, J., Kislat, F., Klein, S.R., Kleinfelder, S., Klepser, S., Kohnen, G., Kolanoski, H., Köpke, L., Kowalski, M., Kowarik, T., Krasberg, M., Kuehn, K., Kujawski, E., Kuwabara, T., Labare, M., Laihem, K., Landsman, H., Lauer, R., Laundrie, A., Leich, H., Leier, D., Lewis, C., Lucke, A., Ludvig, J., Lundberg, J., Lünemann, J., Madsen, J., Maruyama, R., Mase, K., Matis, H.S., McParland, C.P., Meagher, K., Meli, A., Merck, M., Messarius, T., Mészáros, P., Minor, R.H., Miyamoto, H., Mohr, A., Mokhtarani, A., Montaruli, T., Morse, R., Movit, S.M., Münich, K., Muratas, A., Nahnhauer, R., Nam, J.W., Nießen, P., Nygren, D.R., Odrowski, S., Olivas, A., Olivo, M., Ono, M., Panknin, S., Patton, S., Pérez de los Heros, C., Petrovic, J., Piegsa, A., Pieloth, D., Pohl, A.C., Porrata, R., Potthoff, N., Pretz, J., Price, P.B., Przybylski, G.T., Rawlins, K., Razzaque, S., Redl, P., Resconi, E., Rhode, W., Ribordy, M., Rizzo, A., Robbins, W.J., Rodrigues, J.P., Roth, P., Rothmaier, F., Rott, C., Roucelle, C., Rutledge, D., Ryckbosch, D., Sander, H.-G., Sarkar, S., Satalecka, K., Sandstrom, P., Schlenstedt, S., Schmidt, T., Schneider, D., Schulz, O., Seckel, D., Semburg, B., Seo, S.H., Sestayo, Y., Seunarine, S., Silvestri, A., Smith, A.J., Song, C., Sopher, J.E., Spiczak, G.M., Spiering, C., Stanev, T., Stezelberger, T., Stokstad, R.G., Stoufer, M.C., Stoyanov, S., Strahler, E.A., Straszheim, T., Sulanke, K.-H., Sullivan, G.W., Swillens, Q., Taboada, I., Tarasova, O., Tepe, A., Ter-Antonyan, S., Tilav, S., Tluczykont, M., Toale, P.A., Tosi, D., Turčan, D., van Eijndhoven, N., Vandenbroucke, J., Van Overloop, A., Viscomi, V., Vogt, C., Voigt, B., Vu, C.Q., Wahl, D., Walck, C., Waldenmaier, T., Waldmann, H., Walter, M., Wendt, C., Westerhof, S., Whitehorn, N., Wharton, D., Wiebusch, C.H., Wiedemann, C., Wikström, G., Williams, D.R., Wischnewski, R., Wissing, H., Woschnagg, K., Xu, X.W., Yodh, G., Yoshida, S.","The IceCube data acquisition system: Signal capture, digitization, and timestamping",2009,"Nuclear Instruments and Methods in Physics Research, Section A: Accelerators, Spectrometers, Detectors and Associated Equipment","601","3",,"294","316",,199,10.1016/j.nima.2009.01.001,"https://www.scopus.com/inward/record.uri?eid=2-s2.0-61649104021&doi=10.1016%2fj.nima.2009.01.001&partnerID=40&md5=8d316aa60fea058bffe043b647ea393e",Article,Scopus,2-s2.0-61649104021
"Abbasi, R., Ackermann, M., Adams, J., Ahlers, M., Ahrens, J., Andeen, K., Auffenberg, J., Bai, X., Baker, M., Baret, B., Barwick, S.W., Bay, R., Bazo Alba, J.L., Beattie, K., Becka, T., Becker, J.K., Becker, K.-H., Berdermann, J., Berghaus, P., Berley, D., Bernardini, E., Bertrand, D., Besson, D.Z., Blaufuss, E., Boersma, D.J., Bohm, C., Bolmont, J., Böser, S., Botner, O., Braun, J., Breder, D., Burgess, T., Castermans, T., Chirkin, D., Christy, B., Clem, J., Cowen, D.F., D'Agostino, M.V., Danninger, M., Davour, A., Day, C.T., Depaepe, O., De Clercq, C., Demirörs, L., Descamps, F., Desiati, P., De Vries-Uiterweerd, G., Deyoung, T., Diaz-Velez, J.C., Dreyer, J., Dumm, J.P., Duvoort, M.R., Edwards, W.R., Ehrlich, R., Eisch, J., Ellsworth, R.W., Engdegård, O., Euler, S., Evenson, P.A., Fadiran, O., Fazely, A.R., Filimonov, K., Finley, C., Foerster, M.M., Fox, B.D., Franckowiak, A., Franke, R., Gaisser, T.K., Gallagher, J., Ganugapati, R., Gerhardt, L., Gladstone, L., Goldschmidt, A., Goodman, J.A., Gozzini, R., Grant, D., Griesel, T., Groß, A., Grullon, S., Gunasingha, R.M., Gurtner, M., Ha, C., Hallgren, A., Halzen, F., Han, K., Hanson, K., Hardtke, R., Hasegawa, Y., Heise, J., Helbing, K., Hellwig, M., Herquet, P., Hickford, S., Hill, G.C., Hodges, J., Hoffman, K.D., Hoshina, K., Hubert, D., Huelsnitz, W., Hughey, B., Hülß, J.-P., Hulth, P.O., Hultqvist, K., Hundertmark, S., Hussain, S., Imlay, R.L., Inaba, M., Ishihara, A., Jacobsen, J., Japaridze, G.S., Johansson, H., Joseph, J.M., Kampert, K.-H., Kappes, A., Karg, T., Karle, A., Kawai, H., Kelley, J.L., Kiryluk, J., Kislat, F., Klein, S.R., Klepser, S., Kohnen, G., Kolanoski, H., Köpke, L., Kowalski, M., Kowarik, T., Krasberg, M., Kuehn, K., Kuwabara, T., Labare, M., Laihem, K., Landsman, H., Lauer, R., Leich, H., Leier, D., Lewis, C., Lucke, A., Lundberg, J., Lünemann, J., Madsen, J., Maruyama, R., Mase, K., Matis, H.S., McParland, C.P., Meagher, K., Meli, A., Merck, M., Messarius, T., Mészáros, P., Miyamoto, H., Mohr, A., Montaruli, T., Morse, R., Movit, S.M., Münich, K., Nahnhauer, R., Nam, J.W., Nießen, P., Nygren, D.R., Odrowski, S., Olivas, A., Olivo, M., Ono, M., Panknin, S., Patton, S., Pérez De Los Heros, C., Petrovic, J., Piegsa, A., Pieloth, D., Pohl, A.C., Porrata, R., Potthoff, N., Pretz, J., Price, P.B., Przybylski, G.T., Rawlins, K., Razzaque, S., Redl, P., Resconi, E., Rhode, W., Ribordy, M., Rizzo, A., Robbins, W.J., Rodriguez, J., Roth, P., Rothmaier, F., Rott, C., Roucelle, C., Rutledge, D., Ryckbosch, D., Sander, H.-G., Sarkar, S., Satalecka, K., Schlenstedt, S., Schmidt, T., Schneider, D., Schultz, O., Seckel, D., Semburg, B., Seo, S.H., Sestayo, Y., Seunarine, S., Silvestri, A., Smith, A.J., Song, C., Spiczak, G.M., Spiering, C., Stamatikos, M., Stanev, T., Stezelberger, T., Stokstad, R.G., Stoufer, M.C., Stoyanov, S., Strahler, E.A., Straszheim, T., Sulanke, K.-H., Sullivan, G.W., Swillens, Q., Taboada, I., Tarasova, O., Tepe, A., Ter-Antonyan, S., Tilav, S., Tluczykont, M., Toale, P.A., Tosi, D., Turčan, D., Van Eijndhoven, N., Vandenbroucke, J., Van Overloop, A., Viscomi, V., Vogt, C., Voigt, B., Walck, C., Waldenmaier, T., Walter, M., Wendt, C., Westerhoff, S., Whitehorn, N., Wiebusch, C.H., Wiedemann, C., Wikström, G., Williams, D.R., Wischnewski, R., Wissing, H., Woschnagg, K., Xu, X.W., Yodh, G., Yoshida, S.","Search for point sources of high energy neutrinos with final data from AMANDA-II",2009,"Physical Review D - Particles, Fields, Gravitation and Cosmology","79","6", 062001,"","",,59,10.1103/PhysRevD.79.062001,"https://www.scopus.com/inward/record.uri?eid=2-s2.0-64849103799&doi=10.1103%2fPhysRevD.79.062001&partnerID=40&md5=7e51e24fa49de056e14e33de82adf589",Article,Scopus,2-s2.0-64849103799
"Abbasi, R., Abdou, Y., Abu-Zayyad, T., Adams, J., Aguilar, J.A., Ahlers, M., Andeen, K., Auffenberg, J., Bai, X., Baker, M., Barwick, S.W., Bay, R., Alba, J.L.B., Beattie, K., Beatty, J.J., Bechet, S., Becker, J.K., Becker, K.-H., Benabderrahmane, M.L., Berdermann, J., Berghaus, P., Berley, D., Bernardini, E., Bertrand, D., Besson, D.Z., Bissok, M., Blaufuss, E., Boersma, D.J., Bohm, C., Bolmont, J., Botner, O., Bradley, L., Braun, J., Breder, D., Castermans, T., Chirkin, D., Christy, B., Clem, J., Cohen, S., Cowen, D.F., D'Agostino, M.V., Danninger, M., Day, C.T., De Clercq, C., Demirörs, L., Depaepe, O., Descamps, F., Desiati, P., De Vries-Uiterweerd, G., Deyoung, T., Diaz-Velez, J.C., Dreyer, J., Dumm, J.P., Duvoort, M.R., Edwards, W.R., Ehrlich, R., Eisch, J., Ellsworth, R.W., Engdegrd, O., Euler, S., Evenson, P.A., Fadiran, O., Fazely, A.R., Feusels, T., Filimonov, K., Finley, C., Foerster, M.M., Fox, B.D., Franckowiak, A., Franke, R., Gaisser, T.K., Gallagher, J., Ganugapati, R., Gerhardt, L., Gladstone, L., Goldschmidt, A., Goodman, J.A., Gozzini, R., Grant, D., Griesel, T., Gro, A., Grullon, S., Gunasingha, R.M., Gurtner, M., Ha, C., Hallgren, A., Halzen, F., Han, K., Hanson, K., Hasegawa, Y., Heise, J., Helbing, K., Herquet, P., Hickford, S., Hill, G.C., Hoffman, K.D., Hoshina, K., Hubert, D., Huelsnitz, W., Hül, J.-P., Hulth, P.O., Hultqvist, K., Hussain, S., Imlay, R.L., Inaba, M., Ishihara, A., Jacobsen, J., Japaridze, G.S., Johansson, H., Joseph, J.M., Kampert, K.-H., Kappes, A., Karg, T., Karle, A., Kelley, J.L., Kenny, P., Kiryluk, J., Kislat, F., Klein, S.R., Knops, S., Kohnen, G., Kolanoski, H., Köpke, L., Kowalski, M., Kowarik, T., Krasberg, M., Kuehn, K., Kuwabara, T., Labare, M., Lafebre, S., Laihem, K., Landsman, H., Lauer, R., Lennarz, D., Lucke, A., Lundberg, J., Lünemann, J., Madsen, J., Majumdar, P., Maruyama, R., Mase, K., Matis, H.S., McParland, C.P., Meagher, K., Merck, M., Mészros, P., Middell, E., Milke, N., Miyamoto, H., Mohr, A., Montaruli, T., Morse, R., Movit, S.M., Münich, K., Nahnhauer, R., Nam, J.W., Nieen, P., Nygren, D.R., Odrowski, S., Olivas, A., Olivo, M., Ono, M., Panknin, S., Patton, S., Heros, C.P.D.L., Petrovic, J., Piegsa, A., Pieloth, D., Pohl, A.C., Porrata, R., Potthoff, N., Price, P.B., Prikockis, M., Przybylski, G.T., Rawlins, K., Redl, P., Resconi, E., Rhode, W., Ribordy, M., Rizzo, A., Rodrigues, J.P., Roth, P., Rothmaier, F., Rott, C., Roucelle, C., Rutledge, D., Ryckbosch, D., Sander, H.-G., Sarkar, S., Schlenstedt, S., Schmidt, T., Schneider, D., Schukraft, A., Schulz, O., Schunck, M., Seckel, D., Semburg, B., Seo, S.H., Sestayo, Y., Seunarine, S., Silvestri, A., Slipak, A., Spiczak, G.M., Spiering, C., Stamatikos, M., Stanev, T., Stephens, G., Stezelberger, T., Stokstad, R.G., Stoufer, M.C., Stoyanov, S., Strahler, E.A., Straszheim, T., Sulanke, K.-H., Sullivan, G.W., Swillens, Q., Taboada, I., Tamburro, A., Tarasova, O., Tepe, A., Ter-Antonyan, S., Terranova, C., Tilav, S., Toale, P.A., Tosi, D., Turan, D., Van Eijndhoven, N., Vandenbroucke, J., Van Overloop, A., Voigt, B., Walck, C., Waldenmaier, T., Walter, M., Wendt, C., Westerhoff, S., Whitehorn, N., Wiebusch, C.H., Wiedemann, A., Wikström, G., Williams, D.R., Wischnewski, R., Wissing, H., Woschnagg, K., Xu, X.W., Yodh, G., Yoshida, S.","Search for high-energy muon neutrinos from the ""naked-eye"" grb080319b with the icecube neutrino telescope",2009,"Astrophysical Journal","701","2",,"1721","1731",,23,10.1088/0004-637X/701/2/1721,"https://www.scopus.com/inward/record.uri?eid=2-s2.0-70549088110&doi=10.1088%2f0004-637X%2f701%2f2%2f1721&partnerID=40&md5=8000aa37982c1a9a2941d026f327f548",Article,Scopus,2-s2.0-70549088110
