Authors,Title,Year,Source title,Volume,Issue,Art. No.,Page start,Page end,Page count,Cited by,DOI,Link,Document Type,Source,EID
"Cukier, R.I.","Theory and simulation of proton-coupled electron transfer, hydrogen-atom transfer, and proton translocation in proteins",2004,"Biochimica et Biophysica Acta - Bioenergetics","1655","1-3",,"37","44",,65,10.1016/j.bbabio.2003.06.011,"https://www.scopus.com/inward/record.uri?eid=2-s2.0-1942504857&doi=10.1016%2fj.bbabio.2003.06.011&partnerID=40&md5=0d77297d6f51dc1378fb69c84622e4d9",Review,Scopus,2-s2.0-1942504857
"Seibold, S.A., Ball, T., Hsi, L.C., Mills, D.A., Abeysinghe, R.D., Micielli, R., Rieke, C.J., Cukier, R.I., Smith, W.L.","Histidine 386 and Its Role in Cyclooxygenase and Peroxidase Catalysis by Prostaglandin-endoperoxide H Synthases",2003,"Journal of Biological Chemistry","278","46",,"46163","46170",,10,10.1074/jbc.M306319200,"https://www.scopus.com/inward/record.uri?eid=2-s2.0-0242664180&doi=10.1074%2fjbc.M306319200&partnerID=40&md5=9605d7427c64a80f3807db7394f9be63",Article,Scopus,2-s2.0-0242664180
"Cukier, R.I., Seibold, S.A.","Molecular dynamics simulations of prostaglandin endoperoxide H synthase-1. Role of water and the mechanism of compound I formation from hydrogen peroxide",2002,"Journal of Physical Chemistry B","106","46",,"12031","12044",,14,10.1021/jp021232i,"https://www.scopus.com/inward/record.uri?eid=2-s2.0-0037153237&doi=10.1021%2fjp021232i&partnerID=40&md5=edc7ac06a25063d576bd054a547c077b",Article,Scopus,2-s2.0-0037153237
"Cukier, R.I.","A theory that connects proton-coupled electron-transfer and hydrogen-atom transfer reactions",2002,"Journal of Physical Chemistry B","106","7",,"1746","1757",,88,10.1021/jp012396m,"https://www.scopus.com/inward/record.uri?eid=2-s2.0-0037149128&doi=10.1021%2fjp012396m&partnerID=40&md5=40a08d1392d10f61ea34ae3a1d757808",Article,Scopus,2-s2.0-0037149128
"Casado-Pascual, J., Denk, C., Morillo, M., Cukier, R.I.","Path-integral approach to a semiclassical stochastic description of quantum dissipative systems",2001,"Chemical Physics","268","1-3",,"165","176",,4,10.1016/S0301-0104(01)00301-9,"https://www.scopus.com/inward/record.uri?eid=2-s2.0-0035876851&doi=10.1016%2fS0301-0104%2801%2900301-9&partnerID=40&md5=1995052ef0c08ab4b09a6e3d9f9acb8c",Article,Scopus,2-s2.0-0035876851
"Westphal, K.L., Lydakis-Simantiris, N., Cukier, R.I., Babcock, G.T.","Effects of Sr2+-substitution on the reduction rates of Yz· in PSII membranes - Evidence for concerted hydrogen-atom transfer in oxygen evolution",2000,"Biochemistry","39","51",,"16220","16229",,41,10.1021/bi0018077,"https://www.scopus.com/inward/record.uri?eid=2-s2.0-0034719030&doi=10.1021%2fbi0018077&partnerID=40&md5=933edb1a2b7532c5f1c248f39fbd5992",Article,Scopus,2-s2.0-0034719030
"Casado-Pascual, J., Denk, C., Morillo, M., Cukier, R.I.","Relaxation in charge-transfer systems with very large tunnel splitting: A semiclassical stochastic approach",2000,"Journal of Chemical Physics","113","24",,"11176","11186",,10,10.1063/1.1326907,"https://www.scopus.com/inward/record.uri?eid=2-s2.0-0034514226&doi=10.1063%2f1.1326907&partnerID=40&md5=2ca3e32133dccad62b889eec1ffccf33",Article,Scopus,2-s2.0-0034514226
"Morillo, M., Cukier, R.I.","Effect of inhomogeneous broadening on optical strong field spectroscopy",2000,"Journal of Chemical Physics","113","5",,"1916","1924",,2,10.1063/1.481995,"https://www.scopus.com/inward/record.uri?eid=2-s2.0-0034249546&doi=10.1063%2f1.481995&partnerID=40&md5=5e37d987ea6ea8cc5f5be1189ca88a6f",Article,Scopus,2-s2.0-0034249546
"Westphal, K.L., Tommos, C., Cukier, R.I., Babcock, G.T.","Concerted hydrogen-atom abstraction in photosynthetic water oxidation",2000,"Current Opinion in Plant Biology","3","3",,"236","242",,43,10.1016/S1369-5266(00)00070-4,"https://www.scopus.com/inward/record.uri?eid=2-s2.0-0034022993&doi=10.1016%2fS1369-5266%2800%2900070-4&partnerID=40&md5=e60dacb5e2d7613d7cee4b05e98d45e9",Review,Scopus,2-s2.0-0034022993
"Cukier, R.I., Morillo, M.","Comparison between quantum and approximate semiclassical dynamics of an externally driven spin-harmonic oscillator system",2000,"Physical Review A - Atomic, Molecular, and Optical Physics","61","2", 024103,"241031","241034",,1,,"https://www.scopus.com/inward/record.uri?eid=2-s2.0-0345847532&partnerID=40&md5=e88ffeceb74df25353344945d434fc23",Article,Scopus,2-s2.0-0345847532
"Cukier, R.I., Denk, C., Morillo, M.","The effect of a strong external field on the electronic dephasing of a solute that is strongly coupled to a solvent",1999,"Journal of Chemical Physics","111","12",,"5408","5417",,4,,"https://www.scopus.com/inward/record.uri?eid=2-s2.0-0004909041&partnerID=40&md5=ddd633bfa6c552edfcf29daaf152315b",Article,Scopus,2-s2.0-0004909041
"Cukier, R.I.","A Theory for the Rate Constant of a Dissociative Proton-Coupled Electron-Transfer Reaction",1999,"Journal of Physical Chemistry A","103","30",,"5989","5995",,43,,"https://www.scopus.com/inward/record.uri?eid=2-s2.0-0000639934&partnerID=40&md5=d9bb62641dbbd793b8c456c4135e01dc",Article,Scopus,2-s2.0-0000639934
"Cukier, R.I., Zhu, J.","Simulation of excited state proton transfer reaction kinetics",1999,"Journal of Chemical Physics","110","19",,"9587","9597",,15,,"https://www.scopus.com/inward/record.uri?eid=2-s2.0-0006639788&partnerID=40&md5=8a9488d6cc765160a805c1abd745aa11",Article,Scopus,2-s2.0-0006639788
"Morillo, M., Cukier, R.I.","Strong external field effects on electronic dephasing of molecular transitions in condensed media",1999,"Journal of Chemical Physics","110","16",,"7966","7976",,8,,"https://www.scopus.com/inward/record.uri?eid=2-s2.0-0001586295&partnerID=40&md5=56cafdc12c0100fde51661eb14739f67",Article,Scopus,2-s2.0-0001586295
"Cukier, R.I., Nocera, D.G.","Proton-coupled electron transfer",1998,"Annual Review of Physical Chemistry","49","1",,"337","369",,611,,"https://www.scopus.com/inward/record.uri?eid=2-s2.0-0032234424&partnerID=40&md5=d5869a4de24c23344e2b581d6dc81c00",Article,Scopus,2-s2.0-0032234424
"Cukier, R.I., Morillo, M.","External-field effects on molecular electronic transitions in charge-transfer systems",1998,"Physical Review B - Condensed Matter and Materials Physics","57","12",,"6972","6977",,3,,"https://www.scopus.com/inward/record.uri?eid=2-s2.0-0004882007&partnerID=40&md5=9f72f3d15f612e7bea7eb460026b7e70",Article,Scopus,2-s2.0-0004882007
"Cukier, R.I., Zhu, J.","Simulation of proton transfer reaction rates: The role of solvent electronic polarization",1997,"Journal of Physical Chemistry B","101","36",,"7180","7190",,33,,"https://www.scopus.com/inward/record.uri?eid=2-s2.0-0031552994&partnerID=40&md5=e38d3a6d462640c676a6b07e03107ab9",Article,Scopus,2-s2.0-0031552994
"Cukier, R.I., Denk, C., Morillo, M.","Control of tunneling processes with an external field in a four-level system: An analytic approach",1997,"Chemical Physics","217","2-3 SPEC. ISS.",,"179","199",,17,,"https://www.scopus.com/inward/record.uri?eid=2-s2.0-0039331408&partnerID=40&md5=3e0472c4cb2c87ec565fd876b73058ee",Article,Scopus,2-s2.0-0039331408
"Spirina, O.B., Cukier, R.I.","Anisotropic dynamical effects on two-dimensional potential energy surface reactions: Bond breaking electron transfer reactions",1996,"Journal of Chemical Physics","104","2",,"538","550",,21,,"https://www.scopus.com/inward/record.uri?eid=2-s2.0-0001372040&partnerID=40&md5=4858fa486aa514946ee870c8fd5f8cf8",Article,Scopus,2-s2.0-0001372040
"Morillo, M., Cukier, R.I.","Controlling low-temperature tunneling dynamics with external fields",1996,"Physical Review B - Condensed Matter and Materials Physics","54","19",,"13962","13973",,25,,"https://www.scopus.com/inward/record.uri?eid=2-s2.0-0000442751&partnerID=40&md5=3edd6d94edac55ab47490b9fc5ffb91d",Article,Scopus,2-s2.0-0000442751
"Morillo, M., Denk, C., Cukier, R.I.","Control of tunneling reactions with an external field in a four-level system: A general Redfield approach",1996,"Chemical Physics","212","1 SPEC. ISSUE",,"157","175",,18,10.1016/S0301-0104(96)00187-5,"https://www.scopus.com/inward/record.uri?eid=2-s2.0-0030588748&doi=10.1016%2fS0301-0104%2896%2900187-5&partnerID=40&md5=a820c998a1c03f191b4f5b8cbcfd68a9",Article,Scopus,2-s2.0-0030588748
"Cukier, R.I.","Proton-coupled electron transfer reactions: Evaluation of rate constants",1996,"Journal of Physical Chemistry","100","38",,"15428","15443",,131,,"https://www.scopus.com/inward/record.uri?eid=2-s2.0-33748381480&partnerID=40&md5=0c7945d17a0d3e96383551a0a77ac4b7",Review,Scopus,2-s2.0-33748381480
"Cukier, R.I.","Proton-coupled electron transfer through an asymmetric hydrogen-bonded interface",1995,"Journal of Physical Chemistry","99","43",,"16101","16115",,63,,"https://www.scopus.com/inward/record.uri?eid=2-s2.0-0001077676&partnerID=40&md5=72d5a4385aaea5c0817dd763c6bd0e78",Article,Scopus,2-s2.0-0001077676
"Zhao, X.G., Cukier, R.I.","Molecular dynamics and quantum chemistry study of a proton-coupled electron transfer reaction",1995,"Journal of Physical Chemistry","99","3",,"945","954",,55,,"https://www.scopus.com/inward/record.uri?eid=2-s2.0-0000012384&partnerID=40&md5=2003ebf0f594f35ce288635c5b34a939",Article,Scopus,2-s2.0-0000012384
"Zhu, J., Cukier, R.I.","On the role of solvent electronic polarization in charge transfer reactions",1995,"The Journal of Chemical Physics","102","21",,"8398","8413",,14,,"https://www.scopus.com/inward/record.uri?eid=2-s2.0-0003172962&partnerID=40&md5=324d86a5ba0f0671adceb0977e91c800",Article,Scopus,2-s2.0-0003172962
"Zhu, J., Cukier, R.I.","An imaginary energy method-based formulation of a quantum rate theory",1995,"The Journal of Chemical Physics","102","10",,"4123","4130",,8,,"https://www.scopus.com/inward/record.uri?eid=2-s2.0-26244446597&partnerID=40&md5=811b61475f535958b166f6716ba8ab70",Article,Scopus,2-s2.0-26244446597
"Cukier, R.I., Morillo, M., Chun, K., Birge, N.O.","Temperature dependence of the rate of defect tunneling in metals",1995,"Physical Review B","51","19",,"13767","13769",,9,10.1103/PhysRevB.51.13767,"https://www.scopus.com/inward/record.uri?eid=2-s2.0-0001318841&doi=10.1103%2fPhysRevB.51.13767&partnerID=40&md5=db66e64ee19678b787234de9b8efd201",Article,Scopus,2-s2.0-0001318841
"Cukier, R.I.","Mechanism for proton-coupled electron-transfer reactions",1994,"Journal of Physical Chemistry","98","9",,"2377","2381",,114,,"https://www.scopus.com/inward/record.uri?eid=2-s2.0-33751158124&partnerID=40&md5=f0bb6167ec4344e2b5ce5fcbb886a6d6",Article,Scopus,2-s2.0-33751158124
"Zhu, J., Spirina, O.B., Cukier, R.I.","Solvent dynamical effects on bond-breaking electron transfer reactions",1994,"The Journal of Chemical Physics","100","11",,"8109","8124",,23,,"https://www.scopus.com/inward/record.uri?eid=2-s2.0-34247165669&partnerID=40&md5=8c814fbcfc47881ff341976317327ee7",Article,Scopus,2-s2.0-34247165669
"Cukier, R.I., Morillo, M.","Modification of tunneling dynamics by the application of random external fields",1994,"Chemical Physics","183","2-3",,"375","384",,31,10.1016/0301-0104(94)00020-4,"https://www.scopus.com/inward/record.uri?eid=2-s2.0-11644306047&doi=10.1016%2f0301-0104%2894%2900020-4&partnerID=40&md5=329982343cc2382336e967e8a2f3b265",Article,Scopus,2-s2.0-11644306047
"Morillo, M., Cukier, R.I.","Control of proton-transfer reactions with external fields",1993,"The Journal of Chemical Physics","98","6",,"4548","4556",,51,,"https://www.scopus.com/inward/record.uri?eid=2-s2.0-36449001731&partnerID=40&md5=8bdc52830a2fd1ac260c209722d14754",Article,Scopus,2-s2.0-36449001731
"Zhu, J., Cukier, R.I.","A mean-field theory of a localized excess electron in a classical fluid",1993,"The Journal of Chemical Physics","99","2",,"1288","1299",,15,,"https://www.scopus.com/inward/record.uri?eid=2-s2.0-0000917952&partnerID=40&md5=053c0c23b0d5a672cd15bdc0d5065666",Article,Scopus,2-s2.0-0000917952
"Zhu, J., Cukier, R.I.","A quantum molecular dynamics simulation of an excess electron in methanol",1993,"The Journal of Chemical Physics","98","7",,"5679","5693",,50,,"https://www.scopus.com/inward/record.uri?eid=2-s2.0-0001474176&partnerID=40&md5=1984334251e0f5b29ab1e13b20b97e51",Article,Scopus,2-s2.0-0001474176
"Zhu, J., Cukier, R.I.","A mean-field theory of a localized excess electron in a polar fluid",1993,"The Journal of Chemical Physics","99","7",,"5384","5395",,22,,"https://www.scopus.com/inward/record.uri?eid=2-s2.0-0038509490&partnerID=40&md5=5711204f4eb61efc1db6ea1a3db3923f",Article,Scopus,2-s2.0-0038509490
"Zaleski, J.M., Wu, W., Chang, C.K., Leroi, G.E., Cukier, R.I., Nocera, D.G.","Dynamical solvent effects in inverted region electron transfer",1993,"Chemical Physics","176","2-3",,"483","491",,9,10.1016/0301-0104(93)80256-9,"https://www.scopus.com/inward/record.uri?eid=2-s2.0-21144468914&doi=10.1016%2f0301-0104%2893%2980256-9&partnerID=40&md5=4c5e255c852df00a94487cc4c19956f3",Article,Scopus,2-s2.0-21144468914
"Cukier, R.I., Nocera, D.G.","On the separation of static and dynamic solvent effects for electron transfer reactions",1992,"The Journal of Chemical Physics","97","10",,"7371","7376",,13,,"https://www.scopus.com/inward/record.uri?eid=2-s2.0-0010820998&partnerID=40&md5=027510da171d87f1fdfe26a7ebf68fb1",Article,Scopus,2-s2.0-0010820998
"Cukier, R.I., Morillo, M., Casado, J.M.","Dynamics of single and multiple Zener transitions",1992,"Physical Review B","45","3",,"1213","1222",,6,10.1103/PhysRevB.45.1213,"https://www.scopus.com/inward/record.uri?eid=2-s2.0-4243938365&doi=10.1103%2fPhysRevB.45.1213&partnerID=40&md5=7c25b02f8975116d9329147cdecbcf68",Article,Scopus,2-s2.0-4243938365
"Morillo, M., Cukier, R.I., Tij, M.","A projection operator approach to a dissipative two-level system",1991,"Physica A: Statistical Mechanics and its Applications","179","3",,"411","427",,15,10.1016/0378-4371(91)90086-R,"https://www.scopus.com/inward/record.uri?eid=2-s2.0-0000836685&doi=10.1016%2f0378-4371%2891%2990086-R&partnerID=40&md5=25c93a5c73fb686994d424660941669e",Article,Scopus,2-s2.0-0000836685
"Dardi, P.S., Cukier, R.I.","Can the independent binary collision theory describe the nonlinear solvent density dependence of the vibrational energy relaxation rate?",1991,"The Journal of Chemical Physics","95","1",,"9","21",,12,,"https://www.scopus.com/inward/record.uri?eid=2-s2.0-36449000576&partnerID=40&md5=d90ab5a468ad9e139565bef59a9be0f1",Article,Scopus,2-s2.0-36449000576
"Sheu, S.-Y., Cukier, R.I.","Equilibrium, dynamic, and trapping properties of an excess electron in dense helium",1991,"The Journal of Chemical Physics","94","12",,"8258","8269",,8,,"https://www.scopus.com/inward/record.uri?eid=2-s2.0-0010020884&partnerID=40&md5=c1cf448ec7a48acef9e83d74ee7ad2b9",Article,Scopus,2-s2.0-0010020884
"Newsham, M.D., Cukier, R.I., Nocera, D.G.","Contribution of long-range Coulomb interactions to bimolecular luminescence quenching reactions",1991,"Journal of Physical Chemistry","95","24",,"9660","9666",,14,,"https://www.scopus.com/inward/record.uri?eid=2-s2.0-0004945281&partnerID=40&md5=3650cd8cf415930981dece6651150f68",Article,Scopus,2-s2.0-0004945281
"Dardi, P.S., Cukier, R.I.","Can the independent binary collision theory describe the nonlinear solvent density dependence of the vibrational energy relaxation rate?",1991,"Journal of Chemical Physics","95","1",,"98","101",,3,10.1063/1.461429,"https://www.scopus.com/inward/record.uri?eid=2-s2.0-84975747528&doi=10.1063%2f1.461429&partnerID=40&md5=9b30bdfbc73cfd119d93494c03602d07",Article,Scopus,2-s2.0-84975747528
"Cukier, R.I., Morillo, M.","Influence of conduction electrons on impurity tunneling in small metal particles at low temperatures",1991,"Physical Review B","43","13",,"10663","10667",,1,10.1103/PhysRevB.43.10663,"https://www.scopus.com/inward/record.uri?eid=2-s2.0-35949009729&doi=10.1103%2fPhysRevB.43.10663&partnerID=40&md5=410ce565b9677b1710a54afcfc17c3ae",Article,Scopus,2-s2.0-35949009729
"Cukier, R.I., Morillo, M.","A theoretical analysis of nuclear magnetic resonance experiments on proton transfer in benzoic acid crystals",1990,"The Journal of Chemical Physics","93","4",,"2364","2369",,16,,"https://www.scopus.com/inward/record.uri?eid=2-s2.0-0037783055&partnerID=40&md5=5f167aa24d688f234fe647b12dfaeaaf",Article,Scopus,2-s2.0-0037783055
"Morillo, M., Cukier, R.I.","On the effects of solvent and intermolecular fluctuations in proton transfer reactions",1990,"The Journal of Chemical Physics","92","8",,"4833","4838",,66,,"https://www.scopus.com/inward/record.uri?eid=2-s2.0-0000084371&partnerID=40&md5=da4676e773eab68388ab8c36d9b3ec94",Article,Scopus,2-s2.0-0000084371
"Sheu, S.-Y., Kumar, S., Cukier, R.I.","Simulation of the dielectric constant of a composite material",1990,"Physical Review B","42","2",,"1431","1438",,20,10.1103/PhysRevB.42.1431,"https://www.scopus.com/inward/record.uri?eid=2-s2.0-0013107140&doi=10.1103%2fPhysRevB.42.1431&partnerID=40&md5=79bcf3b2eed46fdd36018a62666bcbb0",Article,Scopus,2-s2.0-0013107140
"Cukier, R.I., Karkheck, J., Kumar, S., Sheu, S.Y.","Effect of disorder on the frequency-dependent dielectric constant of a composite material",1990,"Physical Review B","41","3",,"1630","1635",,14,10.1103/PhysRevB.41.1630,"https://www.scopus.com/inward/record.uri?eid=2-s2.0-0038170834&doi=10.1103%2fPhysRevB.41.1630&partnerID=40&md5=a1267a35f4cf52dbc8552b20d399bcdd",Article,Scopus,2-s2.0-0038170834
"Cukier, R.I., Sheu, S.Y., Tobochnik, J.","Random-walk simulation of the dielectric constant of a composite material",1990,"Physical Review B","42","8",,"5342","5344",,12,10.1103/PhysRevB.42.5342,"https://www.scopus.com/inward/record.uri?eid=2-s2.0-0001276152&doi=10.1103%2fPhysRevB.42.5342&partnerID=40&md5=22b065f2771e133c6573525c603766fc",Article,Scopus,2-s2.0-0001276152
"Yang, D.Y., Cukier, R.I.","The transition from nonadiabatic to solvent controlled adiabatic electron transfer: Solvent dynamical effects in the inverted regime",1989,"The Journal of Chemical Physics","91","1",,"281","292",,65,,"https://www.scopus.com/inward/record.uri?eid=2-s2.0-0000458375&partnerID=40&md5=bd4c384bd4b769b47034f68fe6133e27",Article,Scopus,2-s2.0-0000458375
"Kumar, S., Cukier, R.I.","Simulation of the frequency-dependent dielectric constant of a composite material",1989,"Journal of Physical Chemistry®","93","10",,"4334","4337",,10,,"https://www.scopus.com/inward/record.uri?eid=2-s2.0-0542379484&partnerID=40&md5=64a9334591163b02f6dca7c98e623af9",Article,Scopus,2-s2.0-0542379484
"Cukier, R.I., Morillo, M.","Solvent effects on proton-transfer reactions",1989,"The Journal of Chemical Physics","91","2",,"857","863",,62,,"https://www.scopus.com/inward/record.uri?eid=2-s2.0-36549096145&partnerID=40&md5=a1ed29f734ad50c502520e835697df7f",Article,Scopus,2-s2.0-36549096145
"Morillo, M., Yang, D.Y., Cukier, R.I.","Solvent dynamical effects on nonadiabatic electron transfer reactions at low temperature",1989,"The Journal of Chemical Physics","90","10",,"5711","5719",,17,,"https://www.scopus.com/inward/record.uri?eid=2-s2.0-1442324601&partnerID=40&md5=e2594fa864b4cef5c4d83eabb0ded2d8",Article,Scopus,2-s2.0-1442324601
"Cukier, R.I.","Non-Arrhenius rate constants for nonadiabatic electron transfers: The role of quantum and solvent dynamics",1988,"The Journal of Chemical Physics","88","9",,"5594","5605",,30,,"https://www.scopus.com/inward/record.uri?eid=2-s2.0-0012915729&partnerID=40&md5=05fea06c9e7b4a9b7359d030cdedc34c",Article,Scopus,2-s2.0-0012915729
"Morillo, M., Cukier, R.I.","The transition from nonadiabatic to solvent controlled adiabatic electron transfer kinetics: The role of quantum and solvent dynamics",1988,"The Journal of Chemical Physics","89","11",,"6736","6743",,37,,"https://www.scopus.com/inward/record.uri?eid=2-s2.0-36549103141&partnerID=40&md5=fd59177300d7243e7a00e94845c325f7",Article,Scopus,2-s2.0-36549103141
"Dardi, P.S., Cukier, R.I.","Vibrational relaxation in fluids: A critical analysis of the independent binary collision theory",1988,"The Journal of Chemical Physics","89","7",,"4145","4153",,40,,"https://www.scopus.com/inward/record.uri?eid=2-s2.0-0001347348&partnerID=40&md5=a6990c2838043c1feec4a85241e48247",Article,Scopus,2-s2.0-0001347348
"Dardi, P.S., Cukier, R.I.","Solvent influenced nonadiabatic transitions: A classical kinetic theory",1988,"The Journal of Chemical Physics","89","1",,"459","473",,2,,"https://www.scopus.com/inward/record.uri?eid=2-s2.0-36549102530&partnerID=40&md5=4568fb00682367312b72d2ad61e3681a",Article,Scopus,2-s2.0-36549102530
"Sridharan, S., Cukier, R.I.","Effective diffusion coefficient of a two-phase material",1987,"Journal of Physical Chemistry","91","11",,"2962","2969",,8,,"https://www.scopus.com/inward/record.uri?eid=2-s2.0-33845283333&partnerID=40&md5=df6719c70b887e4c38c4adc06b3887f1",Article,Scopus,2-s2.0-33845283333
"Yang, D.Y., Cukier, R.I.","Concentration dependent fluorescence quenching with ionic reactants",1987,"The Journal of Chemical Physics","86","5",,"2833","2838",,12,,"https://www.scopus.com/inward/record.uri?eid=2-s2.0-0010956088&partnerID=40&md5=1911fc8f763a89a26b57280b84f4181f",Article,Scopus,2-s2.0-0010956088
"Dardi, P.S., Cukier, R.I.","Vibrational relaxation in fluids: A many body scattering formalism",1986,"The Journal of Chemical Physics","86","4",,"2264","2275",,4,,"https://www.scopus.com/inward/record.uri?eid=2-s2.0-36549097632&partnerID=40&md5=8551e055bbed7384e8ef96e04b0444fd",Article,Scopus,2-s2.0-36549097632
"Dardi, P.S., Cukier, R.I.","Vibrational relaxation in fluids: Calculations based on a many-body scattering formalism",1986,"The Journal of Chemical Physics","86","12",,"6893","6907",,17,,"https://www.scopus.com/inward/record.uri?eid=2-s2.0-36549097390&partnerID=40&md5=b0b617db0e65ff8436826a4d7794d2cb",Article,Scopus,2-s2.0-36549097390
"Cukier, R.I.","Diffusion-influenced reactions",1986,"Journal of Statistical Physics","42","1-2",,"69","82",,19,10.1007/BF01010841,"https://www.scopus.com/inward/record.uri?eid=2-s2.0-0002529481&doi=10.1007%2fBF01010841&partnerID=40&md5=c8eb305bb8d7cdd62a6f4dd6a0d3f998",Article,Scopus,2-s2.0-0002529481
"Cukier, R.I.","Diffusion-controlled reactions with ellipsoids: Effective medium theory",1985,"Journal of Physical Chemistry","89","2",,"246","252",,4,,"https://www.scopus.com/inward/record.uri?eid=2-s2.0-33845378300&partnerID=40&md5=d67c95e3cea5aa1349f6f0d5b94ec848",Article,Scopus,2-s2.0-33845378300
"Cukier, R.I.","DIFFUSION IN SPHERE, ROD AND POLYMER SUSPENSIONS.",1985,"American Chemical Society, Polymer Preprints, Division of Polymer Chemistry","26","1",,"303","",,,,"https://www.scopus.com/inward/record.uri?eid=2-s2.0-0022051726&partnerID=40&md5=58505b6f8a3e4d06bcda68831eb362ec",Conference Paper,Scopus,2-s2.0-0022051726
"Cukier, R.I.","On the Quencher Concentration Dependence of Fluorescence Quenching: The Role of Solution Dielectric Constant and Ionic Strength",1985,"Journal of the American Chemical Society","107","14",,"4115","4117",,21,10.1021/ja00300a003,"https://www.scopus.com/inward/record.uri?eid=2-s2.0-33845378665&doi=10.1021%2fja00300a003&partnerID=40&md5=4b6ac7e8059dc88b6f9510139414bc65",Article,Scopus,2-s2.0-33845378665
"Cukier, R.I.","Concentration-dependent fluorescence quenching and electron scavenging in liquids",1984,"The Journal of Chemical Physics","82","12",,"5457","5469",,11,,"https://www.scopus.com/inward/record.uri?eid=2-s2.0-36549095177&partnerID=40&md5=8578a0c8773657183e51b020f838ae4f",Article,Scopus,2-s2.0-36549095177
"Cukier, R.I.","Erratum: Diffusion of interacting Brownian particles in a fluid with fixed macroparticles (The Journal of Chemical Physics (1983) 79 (3911))",1984,"The Journal of Chemical Physics","80","10",,"5346","",,,,"https://www.scopus.com/inward/record.uri?eid=2-s2.0-36549092324&partnerID=40&md5=bf932d84b6bcf9cdca35a4261ed07d5e",Erratum,Scopus,2-s2.0-36549092324
"Sridharan, S., Cukier, R.I.","The mutual diffusion coefficient of a fluid in the presence of macroparticles",1984,"Journal of Physical Chemistry","88","6",,"1237","1242",,6,,"https://www.scopus.com/inward/record.uri?eid=2-s2.0-33845471848&partnerID=40&md5=9973bac46930c07380fb1ad1b0b19894",Article,Scopus,2-s2.0-33845471848
"Cukier, R.I.","Diffusion of Brownian Spheres in Semidilute Polymer Solutions",1984,"Macromolecules","17","2",,"252","255",,170,10.1021/ma00132a023,"https://www.scopus.com/inward/record.uri?eid=2-s2.0-33845470371&doi=10.1021%2fma00132a023&partnerID=40&md5=a040ea7e9372b7c294c9dcc4ee5f0769",Article,Scopus,2-s2.0-33845470371
"Cukier, R.I.","Diffusion of interacting Brownian particles in a fluid with fixed macroparticles",1983,"The Journal of Chemical Physics","79","8",,"3911","3920",,12,,"https://www.scopus.com/inward/record.uri?eid=2-s2.0-1542460762&partnerID=40&md5=69d125e4a5862a25c0721903c6e41578",Article,Scopus,2-s2.0-1542460762
"Cukier, R.I.","The effect of surface diffusion on surface reaction rates",1983,"The Journal of Chemical Physics","79","5",,"2430","2435",,32,,"https://www.scopus.com/inward/record.uri?eid=2-s2.0-0001731495&partnerID=40&md5=a042fb52b5a3a8221df111f639b6b861",Article,Scopus,2-s2.0-0001731495
"Cukier, R.I.","Effective medium theory of rate processes among stationary reactive sinks with the radiation boundary condition",1983,"Journal of Physical Chemistry","87","4",,"582","586",,15,,"https://www.scopus.com/inward/record.uri?eid=2-s2.0-0006692051&partnerID=40&md5=81c1cef3246f05d8a57eff1565c5020e",Article,Scopus,2-s2.0-0006692051
"Cukier, R.I., Freed, K.F.","Diffusion controlled processes among stationary reactive sinks: Effective medium approach",1983,"The Journal of Chemical Physics","78","5",,"2573","2578",,46,,"https://www.scopus.com/inward/record.uri?eid=2-s2.0-0000544563&partnerID=40&md5=f79224f2006d3afdd8ed757e5a2ea740",Article,Scopus,2-s2.0-0000544563
"Cukier, R.I.","Diffusion-controlled reactions among stationary sinks",1983,"Journal of Statistical Physics","30","2",,"383","389",,4,10.1007/BF01012312,"https://www.scopus.com/inward/record.uri?eid=2-s2.0-34250143686&doi=10.1007%2fBF01012312&partnerID=40&md5=931636a1b9597ef12e4ef58737ce62f2",Article,Scopus,2-s2.0-34250143686
