Authors,Title,Year,Source title,Volume,Issue,Art. No.,Page start,Page end,Page count,Cited by,DOI,Link,Document Type,Source,EID
"Coleman, J.J., Rounsley, S.D., Rodriguez-Carres, M., Kuo, A., Wasmann, C.C., Grimwood, J., Schmutz, J., Taga, M., White, G.J., Zhou, S., Schwartz, D.C., Freitag, M., Ma, L.-J., Danchin, E.G.J., Henrissat, B., Coutinho, P.M., Nelson, D.R., Straney, D., Napoli, C.A., Barker, B.M., Gribskov, M., Rep, M., Kroken, S., Molnár, I., Rensing, C., Kennell, J.C., Zamora, J., Farman, M.L., Selker, E.U., Salamov, A., Shapiro, H., Pangilinan, J., Lindquist, E., Lamers, C., Grigoriev, I.V., Geiser, D.M., Covert, S.F., Temporini, E., Vanetten, H.D.","The genome of Nectria haematococca: Contribution of supernumerary chromosomes to gene expansion",2009,"PLoS Genetics","5","8", e1000618,"","",,182,10.1371/journal.pgen.1000618,"https://www.scopus.com/inward/record.uri?eid=2-s2.0-70149110707&doi=10.1371%2fjournal.pgen.1000618&partnerID=40&md5=cd2fe39be05ec087d3907c26f17e7d04",Article,Scopus,2-s2.0-70149110707
"Nicotra, M.L., Powell, A.E., Rosengarten, R.D., Moreno, M., Grimwood, J., Lakkis, F.G., Dellaporta, S.L., Buss, L.W.","A Hypervariable Invertebrate Allodeterminant",2009,"Current Biology","19","7",,"583","589",,55,10.1016/j.cub.2009.02.040,"https://www.scopus.com/inward/record.uri?eid=2-s2.0-64049118707&doi=10.1016%2fj.cub.2009.02.040&partnerID=40&md5=0d47803a955a97607306aa2f4682b97f",Article,Scopus,2-s2.0-64049118707
"Worden, A.Z., Lee, J.-H., Mock, T., Rouzé, P., Simmons, M.P., Aerts, A.L., Allen, A.E., Cuvelier, M.L., Derelle, E., Everett, M.V., Foulon, E., Grimwood, J., Gundlach, H., Henrissat, B., Napoli, C., McDonald, S.M., Parker, M.S., Rombauts, S., Salamov, A., Von Dassow, P., Badger, J.H., Coutinho, P.M., Demir, E., Dubchak, I., Gentemann, C., Eikrem, W., Gready, J.E., John, U., Lanier, W., Lindquist, E.A., Lucas, S., Mayer, K.F.X., Moreau, H., Not, F., Otillar, R., Panaud, O., Pangilinan, J., Paulsen, I., Piegu, B., Poliakov, A., Robbens, S., Schmutz, J., Toulza, E., Wyss, T., Zelensky, A., Zhou, K., Armbrust, E.V., Bhattacharya, D., Goodenough, U.W., Van De Peer, Y., Grigoriev, I.V.","Green evolution and dynamic adaptations revealed by genomes of the marine picoeukaryotes micromonas",2009,"Science","324","5924",,"268","272",,310,10.1126/science.1167222,"https://www.scopus.com/inward/record.uri?eid=2-s2.0-64849088316&doi=10.1126%2fscience.1167222&partnerID=40&md5=3fb7ed57a55399b32216ac32653ca727",Article,Scopus,2-s2.0-64849088316
"Paterson, A.H., Bowers, J.E., Bruggmann, R., Dubchak, I., Grimwood, J., Gundlach, H., Haberer, G., Hellsten, U., Mitros, T., Poliakov, A., Schmutz, J., Spannagl, M., Tang, H., Wang, X., Wicker, T., Bharti, A.K., Chapman, J., Feltus, F.A., Gowik, U., Grigoriev, I.V., Lyons, E., Maher, C.A., Martis, M., Narechania, A., Otillar, R.P., Penning, B.W., Salamov, A.A., Wang, Y., Zhang, L., Carpita, N.C., Freeling, M., Gingle, A.R., Hash, C.T., Keller, B., Klein, P., Kresovich, S., McCann, M.C., Ming, R., Peterson, D.G., Mehboob-Ur-Rahman, Ware, D., Westhoff, P., Mayer, K.F.X., Messing, J., Rokhsar, D.S.","The Sorghum bicolor genome and the diversification of grasses",2009,"Nature","457","7229",,"551","556",,1340,10.1038/nature07723,"https://www.scopus.com/inward/record.uri?eid=2-s2.0-58449137410&doi=10.1038%2fnature07723&partnerID=40&md5=b2516ffc9d35e88ed1244577aba424dc",Article,Scopus,2-s2.0-58449137410
"Bowler, C., Allen, A.E., Badger, J.H., Grimwood, J., Jabbari, K., Kuo, A., Maheswari, U., Martens, C., Maumus, F., Otillar, R.P., Rayko, E., Salamov, A., Vandepoele, K., Beszteri, B., Gruber, A., Heijde, M., Katinka, M., Mock, T., Valentin, K., Verret, F., Berges, J.A., Brownlee, C., Cadoret, J.-P., Chiovitti, A., Choi, C.J., Coesel, S., De Martino, A., Detter, J.C., Durkin, C., Falciatore, A., Fournet, J., Haruta, M., Huysman, M.J.J., Jenkins, B.D., Jiroutova, K., Jorgensen, R.E., Joubert, Y., Kaplan, A., Kröger, N., Kroth, P.G., La Roche, J., Lindquist, E., Lommer, M., Martin-Jézéquel, V., Lopez, P.J., Lucas, S., Mangogna, M., McGinnis, K., Medlin, L.K., Montsant, A., Secq, M.-P.O.-L., Napoli, C., Obornik, M., Parker, M.S., Petit, J.-L., Porcel, B.M., Poulsen, N., Robison, M., Rychlewski, L., Rynearson, T.A., Schmutz, J., Shapiro, H., Siaut, M., Stanley, M., Sussman, M.R., Taylor, A.R., Vardi, A., Von Dassow, P., Vyverman, W., Willis, A., Wyrwicz, L.S., Rokhsar, D.S., Weissenbach, J., Armbrust, E.V., Green, B.R., Van De Peer, Y., Grigoriev, I.V.","The Phaeodactylum genome reveals the evolutionary history of diatom genomes",2008,"Nature","456","7219",,"239","244",,698,10.1038/nature07410,"https://www.scopus.com/inward/record.uri?eid=2-s2.0-56249098614&doi=10.1038%2fnature07410&partnerID=40&md5=eb4965b7cba72a1d6ffe638daa689eaa",Article,Scopus,2-s2.0-56249098614
"Labbé, J., Zhang, X., Yin, T., Schmutz, J., Grimwood, J., Martin, F., Tuskan, G.A., Le Tacon, F.","A genetic linkage map for the ectomycorrhizal fungus Laccaria bicolor and its alignment to the whole-genome sequence assemblies",2008,"New Phytologist","180","2",,"316","328",,23,10.1111/j.1469-8137.2008.02614.x,"https://www.scopus.com/inward/record.uri?eid=2-s2.0-52649109258&doi=10.1111%2fj.1469-8137.2008.02614.x&partnerID=40&md5=7fe3fef2eb491b9c96bdc44e85b18f5b",Article,Scopus,2-s2.0-52649109258
"Srivastava, M., Begovic, E., Chapman, J., Putnam, N.H., Hellsten, U., Kawashima, T., Kuo, A., Mitros, T., Salamov, A., Carpenter, M.L., Signorovitch, A.Y., Moreno, M.A., Kamm, K., Grimwood, J., Schmutz, J., Shapiro, H., Grigoriev, I.V., Buss, L.W., Schierwater, B., Dellaporta, S.L., Rokhsar, D.S.","The Trichoplax genome and the nature of placozoans",2008,"Nature","454","7207",,"955","960",,446,10.1038/nature07191,"https://www.scopus.com/inward/record.uri?eid=2-s2.0-50049092481&doi=10.1038%2fnature07191&partnerID=40&md5=a6bdb93b856a15b6370d9f98bbcbb48c",Article,Scopus,2-s2.0-50049092481
"Martin, F., Aerts, A., Ahrén, D., Brun, A., Danchin, E.G.J., Duchaussoy, F., Gibon, J., Kohler, A., Lindquist, E., Pereda, V., Salamov, A., Shapiro, H.J., Wuyts, J., Blaudez, D., Buée, M., Brokstein, P., Canbäck, B., Cohen, D., Courty, P.E., Coutinho, P.M., Delaruelle, C., Detter, J.C., Deveau, A., DiFazio, S., Duplessis, S., Fraissinet-Tachet, L., Lucic, E., Frey-Klett, P., Fourrey, C., Feussner, I., Gay, G., Grimwood, J., Hoegger, P.J., Jain, P., Kilaru, S., Labbé, J., Lin, Y.C., Legué, V., Le Tacon, F., Marmeisse, R., Melayah, D., Montanini, B., Muratet, M., Nehls, U., Niculita-Hirzel, H., Secq, M.P.O.-L., Peter, M., Quesneville, H., Rajashekar, B., Reich, M., Rouhier, N., Schmutz, J., Yin, T., Chalot, M., Henrissat, B., Kües, U., Lucas, S., Van De Peer, Y., Podila, G.K., Polle, A., Pukkila, P.J., Richardson, P.M., Rouzé, P., Sanders, I.R., Stajich, J.E., Tunlid, A., Tuskan, G., Grigoriev, I.V.","The genome of Laccaria bicolor provides insights into mycorrhizal symbiosis",2008,"Nature","452","7183",,"88","92",,529,10.1038/nature06556,"https://www.scopus.com/inward/record.uri?eid=2-s2.0-40449120632&doi=10.1038%2fnature06556&partnerID=40&md5=f9934387c92980e7693d12ac69250da8",Article,Scopus,2-s2.0-40449120632
"Merchant, S.S., Prochnik, S.E., Vallon, O., Harris, E.H., Karpowicz, S.J., Witman, G.B., Terry, A., Salamov, A., Fritz-Laylin, L.K., Maréchal-Drouard, L., Marshall, W.F., Qu, L.-H., Nelson, D.R., Sanderfoot, A.A., Spalding, M.H., Kapitonov, V.V., Ren, Q., Ferris, P., Lindquist, E., Shapiro, H., Lucas, S.M., Grimwood, J., Schmutz, J., Grigoriev, I.V., Rokhsar, D.S., Grossman, A.R., Cardol, P., Cerutti, H., Chanfreau, G., Chen, C.-L., Cognat, V., Croft, M.T., Dent, R., Dutcher, S., Fernández, E., Fukuzawa, H., González-Ballester, D., González-Halphen, D., Hallmann, A., Hanikenne, M., Hippler, M., Inwood, W., Jabbari, K., Kalanon, M., Kuras, R., Lefebvre, P.A., Lemaire, S.D., Lobanov, A.V., Lohr, M., Manuell, A., Meier, I., Mets, L., Mittag, M., Mittelmeier, T., Moroney, J.V., Moseley, J., Napoli, C., Nedelcu, A.M., Niyogi, K., Novoselov, S.V., Paulsen, I.T., Pazour, G., Purton, S., Ral, J.-P., Riaño-Pachón, D.M., Riekhof, W., Rymarquis, L., Schroda, M., Stern, D., Umen, J., Willows, R., Wilson, N., Zimmer, S.L., Allmer, J., Balk, J., Bisova, K., Chen, C.-J., Elias, M., Gendler, K., Hauser, C., Lamb, M.R., Ledford, H., Long, J.C., Minagawa, J., Page, M.D., Pan, J., Pootakham, W., Roje, S., Rose, A., Stahlberg, E., Terauchi, A.M., Yang, P., Ball, S., Bowler, C., Dieckmann, C.L., Gladyshev, V.N., Green, P., Jorgensen, R., Mayfield, S., Mueller-Roeber, B., Rajamani, S., Sayre, R.T., Brokstein, P., Dubchak, I., Goodstein, D., Hornick, L., Huang, Y.W., Jhaveri, J., Luo, Y., Martínez, D., Ngau, W.C.A., Otillar, B., Poliakov, A., Porter, A., Szajkowski, L., Werner, G., Zhou, K.","The Chlamydomonas genome reveals the evolution of key animal and plant functions",2007,"Science","318","5848",,"245","251",,1204,10.1126/science.1143609,"https://www.scopus.com/inward/record.uri?eid=2-s2.0-35348896591&doi=10.1126%2fscience.1143609&partnerID=40&md5=1b877c388122161c59a3e538e81ad177",Article,Scopus,2-s2.0-35348896591
"Kelleher, C.T., Chiu, R., Shin, H., Bosdet, I.E., Krzywinski, M.I., Fjell, C.D., Wilkin, J., Yin, T., DiFazio, S.P., Ali, J., Asano, J.K., Chan, S., Cloutier, A., Girn, N., Leach, S., Lee, D., Mathewson, C.A., Olson, T., O'Connor, K., Prabhu, A.-L., Smailus, D.E., Stott, J.M., Tsai, M., Wye, N.H., Yang, G.S., Zhuang, J., Holt, R.A., Putnam, N.H., Vrebalov, J., Giovannoni, J.J., Grimwood, J., Schmutz, J., Rokhsar, D., Jones, S.J.M., Marra, M.A., Tuskan, G.A., Bohlmann, J., Ellis, B.E., Ritland, K., Douglas, C.J., Schein, J.E.","A physical map of the highly heterozygous Populus genome: Integration with the genome sequence and genetic map and analysis of haplotype variation",2007,"Plant Journal","50","6",,"1063","1078",,41,10.1111/j.1365-313X.2007.03112.x,"https://www.scopus.com/inward/record.uri?eid=2-s2.0-34250162519&doi=10.1111%2fj.1365-313X.2007.03112.x&partnerID=40&md5=51b078423a6899df2cfb08e4b9d190ef",Article,Scopus,2-s2.0-34250162519
"Palenik, B., Grimwood, J., Aerts, A., Rouzé, P., Salamov, A., Putnam, N., Dupont, C., Jorgensen, R., Derelle, E., Rombauts, S., Zhou, K., Otillar, R., Merchant, S.S., Podell, S., Gaasterland, T., Napoli, C., Gendler, K., Manuell, A., Tai, V., Vallon, O., Piganeau, G., Jancek, S., Heijde, M., Jabbari, K., Bowler, C., Lohr, M., Robbens, S., Werner, G., Dubchak, I., Pazour, G.J., Ren, Q., Paulsen, I., Delwiche, C., Schmutz, J., Rokhsar, D., Van De Peer, Y., Moreau, H., Grigoriev, I.V.","The tiny eukaryote Ostreococcus provides genomic insights into the paradox of plankton speciation",2007,"Proceedings of the National Academy of Sciences of the United States of America","104","18",,"7705","7710",,332,10.1073/pnas.0611046104,"https://www.scopus.com/inward/record.uri?eid=2-s2.0-34250689932&doi=10.1073%2fpnas.0611046104&partnerID=40&md5=fafa6046e24c0e9ad25f2705ba6fb183",Article,Scopus,2-s2.0-34250689932
"Oudot-Le Secq, M.-P., Grimwood, J., Shapiro, H., Armbrust, E.V., Bowler, C., Green, B.R.","Chloroplast genomes of the diatoms Phaeodactylum tricornutum and Thalassiosira pseudonana: Comparison with other plastid genomes of the red lineage",2007,"Molecular Genetics and Genomics","277","4",,"427","439",,94,10.1007/s00438-006-0199-4,"https://www.scopus.com/inward/record.uri?eid=2-s2.0-33947414878&doi=10.1007%2fs00438-006-0199-4&partnerID=40&md5=6794ef3d33aee7ddea4cffb47f609bd1",Article,Scopus,2-s2.0-33947414878
"Jeffries, T.W., Grigoriev, I.V., Grimwood, J., Laplaza, J.M., Aerts, A., Salamov, A., Schmutz, J., Lindquist, E., Dehal, P., Shapiro, H., Jin, Y.-S., Passoth, V., Richardson, P.M.","Genome sequence of the lignocellulose-bioconverting and xylose-fermenting yeast Pichia stipitis",2007,"Nature Biotechnology","25","3",,"319","326",,282,10.1038/nbt1290,"https://www.scopus.com/inward/record.uri?eid=2-s2.0-33947156343&doi=10.1038%2fnbt1290&partnerID=40&md5=2d0eb0ddafb4fa2de8c5496d1c959968",Article,Scopus,2-s2.0-33947156343
"Jackson, S.A., Rokhsar, D., Stacey, G., Shoemaker, R.C., Schmutz, J., Grimwood, J.","Toward a reference sequence of the soybean genome: A multiagency effort",2006,"Crop Science","46","SUPPL. 1",,"S","55-S-61",,34,10.2135/cropsci2006.08.0514tpg,"https://www.scopus.com/inward/record.uri?eid=2-s2.0-33845574866&doi=10.2135%2fcropsci2006.08.0514tpg&partnerID=40&md5=ba1cb66f65950b4b411768770729314d",Article,Scopus,2-s2.0-33845574866
"Tuskan, G.A., DiFazio, S., Jansson, S., Bohlmann, J., Grigoriev, I., Hellsten, U., Putnam, M., Ralph, S., Rombauts, S., Salamov, A., Schein, J., Sterck, L., Aerts, A., Bhalerao, R.R., Bhalerao, R.P., Blaudez, D., Boerjan, W., Brun, A., Brunner, A., Busov, V., Campbell, M., Carlson, J., Chalot, M., Chapman, J., Chen, G.-L., Cooper, D., Coutinho, P.M., Couturier, J., Covert, S., Cronk, Q., Cunningham, R., Davis, J., Degroeve, S., Dŕjardin, A., DePamphilis, C., Detter, J., Dirks, B., Dubchak, I., Duplessis, S., Ehlting, J., Ellis, B., Gendler, K., Goodstein, D., Gribskov, M., Grimwood, J., Groover, A., Gunter, L., Hamberger, B., Heinze, B., Helariutta, Y., Henrissat, B., Holligan, D., Holt, R., Huang, W., Islam-Faridi, N., Jones, S., Jones-Rhoades, M., Jorgensen, R., Joshi, C., Kangasjärvi, J., Karlsson, J., Kelleher, C., Kirkpatrick, R., Kirst, M., Kohler, A., Kalluri, U., Larimer, F., Leebens-Mack, J., Leplé, J.-C., Locascio, P., Lou, Y., Lucas, S., Martin, F., Montanini, B., Napoli, C., Nelson, D.R., Nelson, C., Nieminen, K., Nilsson, O., Pereda, V., Peter, G., Philippe, R., Pilate, G., Poliakov, A., Razumovskaya, J., Richardson, P., Rinaldi, C., Ritland, K., Rouzé, P., Ryaboy, D., Schmutz, J., Schrader, J., Segerman, B., Shin, H., Siddiqui, A., Sterky, F., Terry, A., Tsai, C.-J., Uberbacher, E., Unneberg, P., Vahala, J., Wall, K., Wessler, S., Yang, G., Yin, T., Douglas, C., Marra, M., Sandberg, G., Van De Peer, Y., Rokhsar, D.","The genome of black cottonwood, Populus trichocarpa (Torr. &amp; Gray)",2006,"Science","313","5793",,"1596","1604",,2155,10.1126/science.1128691,"https://www.scopus.com/inward/record.uri?eid=2-s2.0-33748760611&doi=10.1126%2fscience.1128691&partnerID=40&md5=775cddd886525b84da2a19586cc04ea9",Article,Scopus,2-s2.0-33748760611
"Morin, R.D., Chang, E., Petrescu, A., Liao, N., Griffith, M., Chow, W., Kirkpatrick, R., Butterfield, Y.S., Young, A.C., Stott, J., Barber, S., Babakaiff, R., Dickson, M.C., Matsuo, C., Wong, D., Yang, G.S., Smailus, D.E., Wetherby, K.D., Kwong, P.N., Grimwood, J., Brinkley III, C.P., Brown-John, M., Reddix-Dugue, N.D., Mayo, M., Schmutz, J., Beland, J., Park, M., Gibson, S., Olson, T., Bouffard, G.G., Tsai, M., Featherstone, R., Chand, S., Siddiqui, A.S., Jang, W., Lee, E., Klein, S.L., Blakesley, R.W., Zeeberg, B.R., Narasimhan, S., Weinstein, J.N., Pennacchio, C.P., Myers, R.M., Green, E.D., Wagner, L., Gerhard, D.S., Marra, M.A., Jones, S.J.M., Holt, R.A.","Erratum: Sequencing and analysis of 10,967 full-length cDNA clones from Xenopus laevis and Xenopus tropicalis reveals post-tetraploidization transcriptome remodeling (Genome Research (2006) 16, (796-803))",2006,"Genome Research","16","7",,"947","",,,,"https://www.scopus.com/inward/record.uri?eid=2-s2.0-33745589836&partnerID=40&md5=f2975d6479097cdbc6ec93f244155bc0",Erratum,Scopus,2-s2.0-33745589836
"Morin, R.D., Chang, E., Petrescu, A., Liao, N., Griffith, M., Kirkpatrick, R., Butterfield, Y.S., Young, A.C., Stott, J., Barber, S., Babakaiff, R., Dickson, M.C., Matsuo, C., Wong, D., Yang, G.S., Smailus, D.E., Wetherby, K.D., Kwong, P.N., Grimwood, J., Brinkley III, C.P., Brown-John, M., Reddix-Dugue, N.D., Mayo, M., Schmutz, J., Beland, J., Park, M., Gibson, S., Olson, T., Bouffard, G.G., Tsai, M., Featherstone, R., Chand, S., Siddiqui, A.S., Jang, W., Lee, E., Klein, S.L., Blakesley, R.W., Zeeberg, B.R., Narasimhan, S., Weinstein, J.N., Pennacchio, C.P., Myers, R.M., Green, E.D., Wagner, L., Gerhard, D.S., Marra, M.A., Jones, S.J.M., Holt, R.A.","Sequencing and analysis of 10,967 full-length cDNA clones from Xenopus laevis and Xenopus tropicalis reveals post-tetraploidization transcriptome remodeling",2006,"Genome Research","16","6",,"796","803",,51,10.1101/gr.4871006,"https://www.scopus.com/inward/record.uri?eid=2-s2.0-33744807179&doi=10.1101%2fgr.4871006&partnerID=40&md5=0d9bd67ee4b4410cceed1f7867d605f5",Article,Scopus,2-s2.0-33744807179
"Colosimo, P.F., Hosemann, K.E., Balabhadra, S., Villarreal Jr., G., Dickson, H., Grimwood, J., Schmutz, J., Myers, R.M., Schluter, D., Kingsley, D.M.","Widespread parallel evolution in sticklebacks by repeated fixation of ectodysplasin alleles",2005,"Science","307","5717",,"1928","1933",,766,10.1126/science.1107239,"https://www.scopus.com/inward/record.uri?eid=2-s2.0-20144371089&doi=10.1126%2fscience.1107239&partnerID=40&md5=c7b5772db45db9e776be1d4d17b341d1",Article,Scopus,2-s2.0-20144371089
"Martin, J., Han, C., Gordon, L.A., Terry, A., Prabhakar, S., She, X., Xie, G., Hellsten, U., Chan, Y.M., Altherr, M., Cournne, O., Aests, A., Bajorek, E., Black, S., Blumer, H., Branscomb, E., Brown, N.C., Bruno, W.J., Buckingham, J.M., Callen, D.F., Campbell, C.S., Campbell, M.L., Campbell, E.W., Caoile, C., Challacombe, J.F., Chasteen, L.A., Chertkov, O., Chi, H.C., Christensen, M., Clark, L.M., Cohn, J.D., Denys, M., Detter, J.C., Dickson, M., Dimitrijevic-Bussod, M., Escobar, J., Fawcett, J.J., Flowers, D., Fotopulos, D., Glavina, T., Gomez, M., Gonzales, E., Goodstoin, D., Goodwin, L.A., Grady, D.L., Grigorlev, I., Groza, M., Hammon, N., Hawkins, T., Haydu, L., Hildebrand, C.E., Huang, W., Israni, S., Jett, J., Jewott, P.B., Kadner, K., Kimball, H., Kobayashi, A., Krawczyk, M.-C., Leyba, T., Longmire, J.L., Lopez, F., Lou, Y., Lowry, S., Ludeman, T., Manohar, C.F., Mark, G.A., McMurray, K.L., Meincke, L.J., Morgan, J., Moyzis, R.K., Mundt, M.O., Munk, A.C., Handkeshwar, R.D., Pitluck, S., Pollard, M., Predki, P., Parson-Quintana, B., Ramirez, L., Rash, S., Retterer, J., Ricke, D.O., Robinson, D.L., Rodgriguez, A., Salamov, A., Saunders, E.H., Scott, D., Shough, T., Stallings, R.L., Stalvey, M., Sutherland, R.D., Tapla, R., Tesmer, J.G., Thayer, H., Thompson, L.D., Tice, H., Torney, D.C., Tran-Gyamfi, M., Tsai, M., Ulanovsky, L.E., Ustaszewska, A., Vo, N., Whito, P.S., Williams, A.L., Wills, P.L., Wu, J.-R., Wu, K., Yang, J., Dejong, P., Bruce, D., Doggerr, N.A., Deaven, L., Schmutz, J., Grimwood, J., Richardson, P., Rokhsar, D.S., Eicher, E.E., Gilna, P., Lucas, S.M., Myers, R.M., Rubin, E.M., Pennacchio, L.A.","The sequence and analysis of duplication-rich human chromosome 16",2004,"Nature","432","7020",,"988","994",,90,10.1038/nature03187,"https://www.scopus.com/inward/record.uri?eid=2-s2.0-19944419749&doi=10.1038%2fnature03187&partnerID=40&md5=506d3c60751f167f07a5aac5a8014c8a",Article,Scopus,2-s2.0-19944419749
"Schmutz, J., Grimwood, J.","Fowl sequence",2004,"Nature","432","7018",,"679","680",,16,10.1038/432679a,"https://www.scopus.com/inward/record.uri?eid=2-s2.0-16544371181&doi=10.1038%2f432679a&partnerID=40&md5=be37377dbca83103ae9aa936bc96b0cb",Short Survey,Scopus,2-s2.0-16544371181
"Noonan, J.P., Grimwood, J., Danke, J., Schmutz, J., Dickson, M., Amemiya, C.T., Myers, R.M.","Coelacanth genome sequence reveals the evolutionary history of vertebrate genes",2004,"Genome Research","14","12",,"2397","2405",,54,10.1101/gr.2972804,"https://www.scopus.com/inward/record.uri?eid=2-s2.0-10944274061&doi=10.1101%2fgr.2972804&partnerID=40&md5=f79d9c2252691965ebf145e4a88f05a0",Article,Scopus,2-s2.0-10944274061
"Kingsley, D.M., Zhu, B., Osoegawa, K., De Jong, P.J., Schein, J., Marra, M., Peichel, C., Amemiya, C., Schluter, D., Balabhadra, S., Friedlander, B., Cha, Y.M., Dickson, M., Grimwood, J., Schmutz, J., Talbot, W.S., Myers, R.","New genomic tools for molecular studies of evolutionary change in threespine sticklebacks",2004,"Behaviour","141","11-12",,"1331","1344",,66,10.1163/1568539042948150,"https://www.scopus.com/inward/record.uri?eid=2-s2.0-19944432273&doi=10.1163%2f1568539042948150&partnerID=40&md5=f446cf09812d01ec08f437ba57129b61",Conference Paper,Scopus,2-s2.0-19944432273
"Feingold, E.A., Good, P.J., Guyer, M.S., Kamholz, S., Liefer, L., Wetterstrand, K., Collins, F.S., Gingeras, T.R., Kampa, D., Sekinger, E.A., Cheng, J., Hirsch, H., Ghosh, S., Zhu, Z., Patel, S., Piccolboni, A., Yang, A., Tammana, H., Bekiranov, S., Kapranov, P., Harrison, R., Church, G., Struhl, K., Ren, B., Kim, T.H., Barrera, L.O., Qu, C., van Calcar, S., Luna, R., Glass, C.K., Rosenfeld, M.G., Guigo, R., Antonarakis, S.E., Birney, E., Brent, M., Pachter, L., Reymond, A., Dermitzakis, E.T., Dewey, C., Keefe, D., Denoeud, F., Lagarde, J., Ashurst, J., Hubbard, T., Wesselink, J.J., Castelo, R., Eyras, E., Myers, R.M., Sidow, A., Batzoglou, S., Trinklein, N.D., Hartman, S.J., Aldred, S.F., Anton, E., Schroeder, D.I., Marticke, S.S., Nguyen, L., Schmutz, J., Grimwood, J., Dickson, M., Cooper, G.M., Stone, E.A., Asimenos, G., Brudno, M., Dutta, A., Karnani, N., Taylor, C.M., Kim, H.K., Robins, G., Stamatoyannopoulos, G., Stamatoyannopoulos, J.A., Dorschner, M., Sabo, P., Hawrylycz, M., Humbert, R., Wallace, J., Yu, M., Navas, P.A., McArthur, M., Noble, W.S., Dunham, I., Koch, C.M., Andrews, R.M., Clelland, G.K., Wilcox, S., Fowler, J.C., James, K.D., Groth, P., Dovey, O.M., Ellis, P.D., Wraight, V.L., Mungall, A.J., Dhami, P., Fiegler, H., Langford, C.F., Carter, N.P., Vetrie, D., Snyder, M., Euskirchen, G., Urban, A.E., Nagalakshmi, U., Rinn, J., Popescu, G., Bertone, P., Hartman, S., Rozowsky, J., Emanuelsson, O., Royce, T., Chung, S., Gerstein, M., Lian, Z., Lian, J., Nakayama, Y., Weissman, S., Stolc, V., Tongprasit, W., Sethi, H., Jones, S., Marra, M., Shin, H., Schein, J., Clamp, M., Lindblad-Toh, K., Chang, J., Jaffe, D.B., Kamal, M., Lander, E.S., Mikkelsen, T.S., Vinson, J., Zody, M.C., de Jong, P.J., Osoegawa, K., Nefedov, M., Zhu, B., Baxevanis, A.D., Wolfsberg, T.G., Crawford, G.E., Whittle, J., Holt, I.E., Vasicek, T.J., Zhou, D., Luo, S., Green, E.D., Bouffard, G.G., Margulies, E.H., Portnoy, M.E., Hansen, N.F., Thomas, P.J., McDowell, J.C., Maskeri, B., Young, A.C., Idol, J.R., Blakesley, R.W., Schuler, G., Miller, W., Hardison, R., Elnitski, L., Shah, P., Salzberg, S.L., Pertea, M., Majoros, W.H., Haussler, D., Thomas, D., Rosenbloom, K.R., Clawson, H., Siepel, A., Kent, W.J., Weng, Z., Jin, S., Halees, A., Burden, H., Karaoz, U., Fu, Y., Yu, Y., Ding, C., Cantor, C.R., Kingston, R.E., Dennis, J., Green, R.D., Singer, M.A., Richmond, T.A., Norton, J.E., Farnham, P.J., Oberley, M.J., Inman, D.R., McCormick, M.R., Kim, H., Middle, C.L., Pirrung, M.C., Fu, X.D., Kwon, Y.S., Ye, Z., Dekker, J., Tabuchi, T.M., Gheldof, N., Dostie, J., Harvey, S.C.","The ENCODE (ENCyclopedia of DNA Elements) Project",2004,"Science","306","5696",,"636","640",,1011,10.1126/science.1105136,"https://www.scopus.com/inward/record.uri?eid=2-s2.0-7444260846&doi=10.1126%2fscience.1105136&partnerID=40&md5=db9c6574f2dd20f444a9939c69a8abfc",Review,Scopus,2-s2.0-7444260846
"Gerhard, D.S., Wagner, L., Feingold, E.A., Shenmen, C.M., Grouse, L.H., Schuler, G., Klein, S.L., Old, S., Rasooly, R., Good, P., Guyer, M., Peck, A.M., Derge, J.G., Lipman, D., Collins, F.S., Jang, W., Sherry, S., Feolo, M., Misquitta, L., Lee, E., Rotmistrovsky, K., Greenhut, S.F., Schaefer, C.F., Buetow, K.H., Bonner, T.I., Haussler, D., Kent, J., Diekhans, M., Furey, T., Brent, M., Prange, C., Schreiber, K., Shapiro, N., Bhat, N.K., Hopkins, R.F., Hsie, F., Driscoll, T., Soares, M.B., Bonaldo, M.F., Casavant, T.L., Scheetz, T.E., Brownstein, M.J., Usdin, T.B., Toshiyuki, S., Carninci, P., Piao, Y., Dudekula, D.B., Ko, M.S.H., Kawakami, K., Suzuki, Y., Sugano, S., Gruber, C.E., Smith, M.R., Simmons, B., Moore, T., Waterman, R., Johnson, S.L., Ruan, Y., Lin Wei, C., Mathavan, S., Gunaratne, P.H., Wu, J., Garcia, A.M., Hulyk, S.W., Fuh, E., Yuan, Y., Sneed, A., Kowis, C., Hodgson, A., Muzny, D.M., McPherson, J., Gibbs, R.A., Fahey, J., Helton, E., Ketteman, M., Madan, A., Rodrigues, S., Sanchez, A., Whiting, M., Madan, A., Young, A.C., Wetherby, K.D., Granite, S.J., Kwong, P.N., Brinkley, C.P., Pearson, R.L., Bouffard, G.G., Blakesly, R.W., Green, E.D., Dickson, M.C., Rodriguez, A.C., Grimwood, J., Schmutz, J., Myers, R.M., Butterfield, Y.S.N., Griffith, M., Griffith, O.L., Krzywinski, M.I., Liao, N., Morrin, R., Palmquist, D., Petrescu, A.S., Skalska, U., Smailus, D.E., Stott, J.M., Schnerch, A., Schein, J.E., Jones, S.J.M., Holt, R.A., Baross, A., Marra, M.A., Clifton, S., Makowski, K.A., Bosak, S., Malek, J.","The status, quality, and expansion of the NIH full-length cDNA project: The Mammalian Gene Collection (MGC)",2004,"Genome Research","14","10 B",,"2121","2127",,329,,"https://www.scopus.com/inward/record.uri?eid=2-s2.0-7444262496&partnerID=40&md5=7ffd045d9a914a60862ea71bae4006e1",Article,Scopus,2-s2.0-7444262496
