Authors,Title,Year,Source title,Volume,Issue,Art. No.,Page start,Page end,Page count,Cited by,DOI,Link,Document Type,Source,EID
"Schmutz, J., Martin, J., Terry, A., Couronne, O., Grimwood, J., Lowry, S., Gordon, L.A., Scott, D., Xie, G., Huang, W., Hellsten, U., Tran-Gyamfi, M., She, X., Prabhakar, S., Aerts, A., Altherr, M., Bajorek, E., Black, S., Branscomb, E., Caoile, C., Challacombe, J.F., Chan, Y.M., Denys, M., Detter, J.C., Escobar, J., Flowers, D., Fotopulos, D., Glavina, T., Gomez, M., Gonzales, E., Goodstein, D., Grigoriev, I., Groza, M., Hammon, N., Hawkins, T., Haydu, L., Israni, S., Jett, J., Kadner, K., Kimball, H., Kobayashi, A., Lopez, F., Lou, Y., Martinez, D., Medina, C., Morgan, J., Nandkeshwar, R., Noonan, J.P., Pitluck, S., Pollard, M., Predki, P., Priest, J., Ramirez, L., Retterer, J., Rodriguez, A., Rogers, S., Salamov, A., Salazar, A., Thayer, N., Tice, H., Tsai, M., Ustaszewska, A., Vo, N., Wheeler, J., Wu, K., Yang, J., Dickson, M., Cheng, J.-F., Eichler, E.E., Olsen, A., Pennacchio, L.A., Rokhsar, D.S., Richardson, P., Lucas, S.M., Myers, R.M., Rubin, E.M.","The DNA sequence and comparative analysis of human chromosome 5",2004,"Nature","431","7006",,"268","274",,54,10.1038/nature02919,"https://www.scopus.com/inward/record.uri?eid=2-s2.0-4644268484&doi=10.1038%2fnature02919&partnerID=40&md5=29e35896fa14b50042f795c8675930c3",Article,Scopus,2-s2.0-4644268484
"Peichel, C.L., Ross, J.A., Matson, C.K., Dickson, M., Grimwood, J., Schmutz, J., Myers, R.M., Mori, S., Schluter, D., Kingsley, D.M.","The master sex-determination locus in threespine sticklebacks is on a nascent Y chromosome",2004,"Current Biology","14","16",,"1416","1424",,241,10.1016/j.cub.2004.08.030,"https://www.scopus.com/inward/record.uri?eid=2-s2.0-4344561299&doi=10.1016%2fj.cub.2004.08.030&partnerID=40&md5=6077d7b95d34dc4c5fbfb9e242fe9e2a",Article,Scopus,2-s2.0-4344561299
"Schmutz, J., Wheeler, J., Grimwood, J., Dickson, M., Yang, J., Caolle, C., Bajorek, E., Black, S., Chan, Y.M., Denys, M., Escobar, J., Flowers, D., Fotopulos, D., Garcia, C., Gomez, M., Gonzales, E., Haydu, L., Lopez, F., Ramirez, L., Retterer, J., Rodriguez, A., Rogers, S., Salazar, A., Tsai, M., Myers, R.M.","Quality assessment of the human genome sequence",2004,"Nature","429","6990",,"365","368",,89,10.1038/nature02390,"https://www.scopus.com/inward/record.uri?eid=2-s2.0-2642580020&doi=10.1038%2fnature02390&partnerID=40&md5=2d26f52da55a5a2066400caaa260979b",Review,Scopus,2-s2.0-2642580020
"Schmutz, J., Grimwood, J., Myers, R.M.","Quality assessment of finished BAC sequences.",2004,"Methods in molecular biology (Clifton, N.J.)","255",,,"343","349",,,,"https://www.scopus.com/inward/record.uri?eid=2-s2.0-2342448435&partnerID=40&md5=a06d9f2bbc2d2e7b2d1b80f731f66c16",Article,Scopus,2-s2.0-2342448435
"Schmutz, J., Grimwood, J., Myers, R.M.","Assembly of DNA sequencing data.",2004,"Methods in molecular biology (Clifton, N.J.)","255",,,"319","332",,,,"https://www.scopus.com/inward/record.uri?eid=2-s2.0-2342473795&partnerID=40&md5=3e7b7757ed81c13702546be6ea4bd1ef",Article,Scopus,2-s2.0-2342473795
"Schmutz, J., Grimwood, J., Myers, R.M.","Sequence finishing.",2004,"Methods in molecular biology (Clifton, N.J.)","255",,,"333","342",,1,,"https://www.scopus.com/inward/record.uri?eid=2-s2.0-2342618726&partnerID=40&md5=2f17ce89b11635ac8c1abac15024f40a",Article,Scopus,2-s2.0-2342618726
"Grimwood, J., Gordon, L.A., Olsen, A., Terry, A., Schmutz, J., Lamerdin, J., Hellsten, U., Goodstein, D., Couronne, O., Tran-Gyamil, M., Aerts, A., Altherr, M., Ashworth, L., Bajorek, E., Black, S., Branscomb, E., Caenepeel, S., Carrano, A., Caoile, C., Chan, Y.M., Christensen, M., Cleland, C.A., Copeland, A., Dalin, E., Dehal, P., Denys, M., Detter, J.C., Escobar, J., Flowers, D., Fotopolus, D., Garcia, C., Georgescu, A.M., Glavina, T., Gomez, M., Gonzales, E., Groza, M., Hammon, N., Hawkins, T., Haydu, L., Ho, I., Huang, W., Israni, S., Jett, J., Kadner, K., Kimball, H., Kobayashi, A., Larionov, V., Leem, S.-H., Lopez, F., Lou, Y., Lowry, S., Malfatti, S., Martinez, D., McCready, P., Medina, C., Morgan, J., Nelson, K., Nolan, M., Ovcharenko, I., Pitluck, S., Pollard, M., Popkie, A.P., Predki, P., Quan, G., Ramirez, L., Rash, S., Retterer, J., Rodriguez, A., Rogers, S., Salamov, A., Salazar, A., She, X., Smith, D., Slezak, T., Solovyev, V., Thayer, N., Tice, H., Tsai, M., Ustaszewska, A., Vo, N., Wagner, M., Wheeler, J., Wu, K., Xie, G., Yang, J., Dubchak, I., Furey, T.S., DeJong, P., Dickson, M., Gordon, D., Eichler, E.E., Pennacchio, L.A., Richardson, P., Stubbs, L., Rokhsar, D.S., Myers, R.M., Rubin, E.M., Lucas, S.M.","The DNA sequence and biology of human chromosome 19",2004,"Nature","428","6982",,"529","535",,144,10.1038/nature02399,"https://www.scopus.com/inward/record.uri?eid=2-s2.0-1842536305&doi=10.1038%2fnature02399&partnerID=40&md5=b58834afc810b500641f78ed16fcaf02",Article,Scopus,2-s2.0-1842536305
"Noonan, J.P., Grimwood, J., Schmutz, J., Dickson, M., Myers, R.M.","Gene conversion and the evolution of protocadherin gene cluster diversity",2004,"Genome Research","14","3",,"354","366",,78,10.1101/gr.2133704,"https://www.scopus.com/inward/record.uri?eid=2-s2.0-1542316918&doi=10.1101%2fgr.2133704&partnerID=40&md5=40164452607f41c69b1ffca3b1d7c370",Review,Scopus,2-s2.0-1542316918
"Leem, S.-H., Kouprina, N., Grimwood, J., Kim, J.-H., Mullokandov, M., Yoon, Y.-H., Chae, J.-Y., Morgan, J., Lucas, S., Richardson, P., Detter, C., Glavina, T., Rubin, E., Barrett, J.C., Larionov, V.","Closing the gaps on human chromosome 19 revealed genes with a high density of repetitive tandemly arrayed elements",2004,"Genome Research","14","2",,"239","246",,31,10.1101/gr.1929904,"https://www.scopus.com/inward/record.uri?eid=2-s2.0-10744221353&doi=10.1101%2fgr.1929904&partnerID=40&md5=e27d19c6e52abcb80d21d116ef3331ab",Article,Scopus,2-s2.0-10744221353
"Murphy, E., Yu, D., Grimwood, J., Schmutz, J., Dickson, M., Jarvis, M.A., Hahn, G., Nelson, J.A., Myers, R.M., Shenk, T.E.","Coding potential of laboratory and clinical strains of human cytomegalovirus",2003,"Proceedings of the National Academy of Sciences of the United States of America","100","25",,"14976","14981",,299,10.1073/pnas.2136652100,"https://www.scopus.com/inward/record.uri?eid=2-s2.0-10744225986&doi=10.1073%2fpnas.2136652100&partnerID=40&md5=9ebd49c932ae8f197668380e9505f4c6",Article,Scopus,2-s2.0-10744225986
"Schmutz, J., Wheeler, J., Grimwood, J., Dickson, M., Myers, R.M.","Assessing the quality of finished genomic sequence",2003,"Cold Spring Harbor Symposia on Quantitative Biology","68",,,"31","37",,2,,"https://www.scopus.com/inward/record.uri?eid=2-s2.0-3242659790&partnerID=40&md5=23fce11d6c71a3d207d70f643452761d",Conference Paper,Scopus,2-s2.0-3242659790
"Grimwood, J., Schmutz, J.","Six is seventh",2003,"Nature","425","6960",,"775","776",,3,10.1038/425775a,"https://www.scopus.com/inward/record.uri?eid=2-s2.0-0642343716&doi=10.1038%2f425775a&partnerID=40&md5=f9c40246701571ac1352dc6d73bf4ad5",Short Survey,Scopus,2-s2.0-0642343716
"Noonan, J.P., Li, J., Nguyen, L., Caoile, C., Dickson, M., Grimwood, J., Schmutz, J., Feldman, M.W., Myers, R.M.","Extensive linkage disequilibrium, a common 16.7-kilobase deletion, and evidence of balancing selection in the human protocadherin α cluster",2003,"American Journal of Human Genetics","72","3",,"621","635",,40,10.1086/368060,"https://www.scopus.com/inward/record.uri?eid=2-s2.0-0037371323&doi=10.1086%2f368060&partnerID=40&md5=22e303a4e962d12a0e9dc38af0314484",Article,Scopus,2-s2.0-0037371323
"Taylor, R.N., Grimwood, J., Taylor, R.S., McMaster, M.T., Fisher, S.J., North, R.A.","Longitudinal serum concentrations of placental growth factor: Evidence for abnormal placental angiogenesis in pathologic pregnancies",2003,"American Journal of Obstetrics and Gynecology","188","1",,"177","182",,277,10.1067/mob.2003.111,"https://www.scopus.com/inward/record.uri?eid=2-s2.0-0037245823&doi=10.1067%2fmob.2003.111&partnerID=40&md5=d6b185a75dc058b09e8e03b2dd1d8530",Article,Scopus,2-s2.0-0037245823
"Strausberg, R.L., Feingold, E.A., Grouse, L.H., Derge, J.G., Klausner, R.D., Collins, F.S., Wagner, L., Shenmen, C.M., Schuler, G.D., Altschul, S.F., Zeeberg, B., Buetow, K.H., Schaefer, C.F., Bhat, N.K., Hopkins, R.F., Jordan, H., Moore, T., Max, S.I., Wang, J., Hsieh, F., Diatchenko, L., Marusina, K., Farmer, A.A., Rubin, G.M., Hong, L., Stapleton, M., Soares, M.B., Bonaldo, M.F., Casavant, T.L., Scheetz, T.E., Brownstein, M.J., Usdin, T.B., Toshiyuki, S., Carninci, P., Prange, C., Raha, S.S., Loquellano, N.A., Peters, G.J., Abramson, R.D., Mullahy, S.J., Bosak, S.A., McEwan, P.J., McKernan, K.J., Malek, J.A., Gunaratne, P.H., Richards, S., Worley, K.C., Hale, S., Garcia, A.M., Gay, L.J., Hulyk, S.W., Villalon, D.K., Muzny, D.M., Sodergren, E.J., Lu, X., Gibbs, R.A., Fahey, J., Helton, E., Ketteman, M., Madan, A., Rodrigues, S., Sanchez, A., Whiting, M., Madan, A., Young, A.C., Shevchenko, Y., Bouffard, G.G., Blakesley, R.W., Touchman, J.W., Green, E.D., Dickson, M.C., Rodriguez, A.C., Grimwood, J., Schmutzs, J., Myers, R.M., Butterfield, Y.S.N., Krzywinski, M.I., Skalska, U., Smailus, D.E., Schnerch, A., Schein, J.E., Jones, S.J.M., Marra, M.A.","Generation and initial analysis of more than 15,000 full-length human and mouse cDNA sequences",2002,"Proceedings of the National Academy of Sciences of the United States of America","99","26",,"16899","16903",,1250,10.1073/pnas.242603899,"https://www.scopus.com/inward/record.uri?eid=2-s2.0-0037168586&doi=10.1073%2fpnas.242603899&partnerID=40&md5=f8272f0c79b90737f56da39296cb7314",Article,Scopus,2-s2.0-0037168586
"Wu, Q., Zhang, T., Cheng, J.-F., Kim, Y., Grimwood, J., Schmutz, J., Dickson, M., Noonan, J.P., Zhang, M.Q., Myers, R.M., Maniatis, T.","Comparative DNA sequence analysis of mouse and human protocadherin gene clusters [3]",2001,"Genome Research","11","3",,"389","404",,154,10.1101/gr.167301,"https://www.scopus.com/inward/record.uri?eid=2-s2.0-17744391752&doi=10.1101%2fgr.167301&partnerID=40&md5=39a880e38eed606e2db321c0410f50b4",Letter,Scopus,2-s2.0-17744391752
"Grimwood, J., Olinger, L., Stephens, R.S.","Expression of Chlamydia pneumoniae polymorphic membrane protein family genes",2001,"Infection and Immunity","69","4",,"2383","2389",,56,10.1128/IAI.69.4.2383-2389.2001,"https://www.scopus.com/inward/record.uri?eid=2-s2.0-0035077459&doi=10.1128%2fIAI.69.4.2383-2389.2001&partnerID=40&md5=8bd9ae189281c051afc543c5e1cbcca6",Article,Scopus,2-s2.0-0035077459
"Lander, E.S., Linton, L.M., Birren, B., Nusbaum, C., Zody, M.C., Baldwin, J., Devon, K., Dewar, K., Doyle, M., Fitzhugh, W., Funke, R., Gage, D., Harris, K., Heaford, A., Howland, J., Kann, L., Lehoczky, J., Levine, R., McEwan, P., McKernan, K., Meldrim, J., Mesirov, J.P., Miranda, C., Morris, W., Naylor, J., Raymond, C., Rosetti, M., Santos, R., Sheridan, A., Sougnez, C., Stange-Thomann, N., Stojanovic, N., Subramanian, A., Wyman, D., Rogers, J., Sulston, J., Ainscough, R., Beck, S., Bentley, D., Burton, J., Clee, C., Carter, N., Coulson, A., Deadman, R., Deloukas, P., Dunham, A., Dunham, I., Durbin, R., French, L., Grafham, D., Gregory, S., Hubbard, T., Humphray, S., Hunt, A., Jones, M., Lloyd, C., McMurray, A., Matthews, L., Mercer, S., Milne, S., Mullikin, J.C., Mungall, A., Plumb, R., Ross, M., Shownkeen, R., Sims, S., Waterston, R.H., Wilson, R.K., Hillier, L.W., McPherson, J.D., Marra, M.A., Mardis, E.R., Fulton, L.A., Chinwalla, A.T., Pepin, K.H., Gish, W.R., Chissoe, S.L., Wendl, M.C., Delehaunty, K.D., Miner, T.L., Delehaunty, A., Kramer, J.B., Cook, L.L., Fulton, R.S., Johnson, D.L., Minx, P.J., Clifton, S.W., Hawkins, T., Branscomb, E., Predki, P., Richardson, P., Wenning, S., Slezak, T., Doggett, N., Cheng, J.-F., Olsen, A., Lucas, S., Elkin, C., Uberbacher, E., Frazier, M., Gibbs, R.A., Muzny, D.M., Scherer, S.E., Bouck, J.B., Sodergren, E.J., Worley, K.C., Rives, C.M., Gorrell, J.H., Metzker, M.L., Naylor, S.L., Kucherlapati, R.S., Nelson, D.L., Weinstock, G.M., Sakaki, Y., Fujiyama, A., Hattori, M., Yada, T., Toyoda, A., Itoh, T., Kawagoe, C., Watanabe, H., Totoki, Y., Taylor, T., Weissenbach, J., Heilig, R., Saurin, W., Artiguenave, F., Brottier, P., Bruls, T., Pelletier, E., Robert, C., Wincker, P., Rosenthal, A., Platzer, M., Nyakatura, G., Taudien, S., Rump, A., Smith, D.R., Doucette-Stamm, L., Rubenfield, M., Weinstock, K., Hong, M.L., Dubois, J., Yang, H., Yu, J., Wang, J., Huang, G., Gu, J., Hood, L., Rowen, L., Madan, A., Qin, S., Davis, R.W., Federspiel, N.A., Abola, A.P., Proctor, M.J., Roe, B.A., Chen, F., Pan, H., Ramser, J., Lehrach, H., Reinhardt, R., McCombie, W.R., De La Bastide, M., Dedhia, N., Blöcker, H., Hornischer, K., Nordsiek, G., Agarwala, R., Aravind, L., Bailey, J.A., Bateman, A., Batzoglou, S., Birney, E., Bork, P., Brown, D.G., Burge, C.B., Cerutti, L., Chen, H.-C., Church, D., Clamp, M., Copley, R.R., Doerks, T., Eddy, S.R., Eichler, E.E., Furey, T.S., Galagan, J., Gilbert, J.G.R., Harmon, C., Hayashizaki, Y., Haussler, D., Hermjakob, H., Hokamp, K., Jang, W., Johnson, L.S., Jones, T.A., Kasif, S., Kaspryzk, A., Kennedy, S., Kent, W.J., Kitts, P., Koonin, E.V., Korf, I., Kulp, D., Lancet, D., Lowe, T.M., McLysaght, A., Mikkelsen, T., Moran, J.V., Mulder, N., Pollara, V.J., Ponting, C.P., Schuler, G., Schultz, J., Slater, G., Smit, A.F.A., Stupka, E., Szustakowki, J., Thierry-Mieg, D., Thierry-Mieg, J., Wagner, L., Wallis, J., Wheeler, R., Williams, A., Wolf, Y.I., Wolfe, K.H., Yang, S.-P., Yeh, R.-F., Collins, F., Guyer, M.S., Peterson, J., Felsenfeld, A., Wetterstrand, K.A., Myers, R.M., Schmutz, J., Dickson, M., Grimwood, J., Cox, D.R., Olson, M.V., Kaul, R., Raymond, C., Shimizu, N., Kawasaki, K., Minoshima, S., Evans, G.A., Athanasiou, M., Schultz, R., Patrinos, A., Morgan, M.J.","Initial sequencing and analysis of the human genome",2001,"Nature","409","6822",,"860","921",,13585,10.1038/35057062,"https://www.scopus.com/inward/record.uri?eid=2-s2.0-2042437650&doi=10.1038%2f35057062&partnerID=40&md5=e5c568d6b016f06399e5274f70140861",Article,Scopus,2-s2.0-2042437650
"Dutta, C., Grimwood, J., Kasper, L.H.","Attachment of Toxoplasma gondii to a specific membrane fraction of CHO cells",2000,"Infection and Immunity","68","12",,"7198","7201",,3,10.1128/IAI.68.12.7198-7201.2000,"https://www.scopus.com/inward/record.uri?eid=2-s2.0-0034444405&doi=10.1128%2fIAI.68.12.7198-7201.2000&partnerID=40&md5=058aeb47a6aa7650cf9c31e0ec7afb19",Article,Scopus,2-s2.0-0034444405
"Grimwood, J., Stephens, R.S.","Computational analysis of the polymorphic membrane protein superfamily of Chlamydia trachomatis and Chlamydia pneumoniae",1999,"Microbial and Comparative Genomics","4","3",,"187","201",,80,,"https://www.scopus.com/inward/record.uri?eid=2-s2.0-0032707996&partnerID=40&md5=6b2742c0fed10c2e537e2bf69674bfc1",Article,Scopus,2-s2.0-0032707996
"Kalman, S., Mitchell, W., Marathe, R., Lammel, C., Jun, F., Hyman, R.W., Olinger, L., Grimwood, J., Davis, R.W., Stephens, R.S.","Comparative genomes of Chlamydia pneumoniae and C. trachomatis",1999,"Nature Genetics","21","4",,"385","389",,535,10.1038/7716,"https://www.scopus.com/inward/record.uri?eid=2-s2.0-0032953228&doi=10.1038%2f7716&partnerID=40&md5=78cd3c8bbfd91e8ed299df85a9a65767",Article,Scopus,2-s2.0-0032953228
"Grimwood, J., Mineo, J.R., Kasper, L.H.","Attachment of Toxoplasma gondii to host cells is host cell cycle dependent",1996,"Infection and Immunity","64","10",,"4099","4104",,32,,"https://www.scopus.com/inward/record.uri?eid=2-s2.0-0029796640&partnerID=40&md5=79e7c3b39f3553c62e30767c0382c423",Article,Scopus,2-s2.0-0029796640
"Grimwood, J., Smith, J.E.","Toxoplasma gondii: The role of parasite surface and secreted proteins in host cell invasion",1996,"International Journal for Parasitology","26","2",,"169","173",,74,10.1016/0020-7519(95)00103-4,"https://www.scopus.com/inward/record.uri?eid=2-s2.0-0030069954&doi=10.1016%2f0020-7519%2895%2900103-4&partnerID=40&md5=56ea0fbccc4a8801e28a8eab73cbdc80",Article,Scopus,2-s2.0-0030069954
"Grimwood, J., Smith, J.E.","Toxoplasma gondii: redistribution of tachyzoite surface protein during host cell invasion and intracellular development",1995,"Parasitology Research","81","8",,"657","661",,15,10.1007/BF00931842,"https://www.scopus.com/inward/record.uri?eid=2-s2.0-0028851494&doi=10.1007%2fBF00931842&partnerID=40&md5=e81cba64d51c2453910fef5ded855a0e",Article,Scopus,2-s2.0-0028851494
"Grimwood, J., Bicknell, R., Rees, M.C.P.","Uterus: The isolation, characterization and culture of human decidual endothelium",1995,"Human Reproduction","10","8",,"2142","2148",,31,,"https://www.scopus.com/inward/record.uri?eid=2-s2.0-0029078590&partnerID=40&md5=1b91fed4738464444f5074d69c35a00e",Article,Scopus,2-s2.0-0029078590
"Grimwood, J., Smith, J.E.","Toxoplasma gondii: The role of a 30-kDa surface protein in host cell invasion",1992,"Experimental Parasitology","74","1",,"106","111",,64,10.1016/0014-4894(92)90144-Y,"https://www.scopus.com/inward/record.uri?eid=2-s2.0-0026816093&doi=10.1016%2f0014-4894%2892%2990144-Y&partnerID=40&md5=5641683b961c8e86e6050e868d22cef0",Article,Scopus,2-s2.0-0026816093
"Grimwood, J., Smith, J.E.","Kinetics of the growth and variation in infectivity of Toxoplasma gondii in mice",1991,"Annals of Tropical Medicine and Parasitology","85","6",,"659","661",,5,,"https://www.scopus.com/inward/record.uri?eid=2-s2.0-0026336958&partnerID=40&md5=562648286f462efd49e501b6cef0439e",Article,Scopus,2-s2.0-0026336958
