Authors,Title,Year,Source title,Volume,Issue,Art. No.,Page start,Page end,Page count,Cited by,DOI,Link,Document Type,Source,EID
"Tokuyama, M., Cukier, R.I.","Hydrodynamics of a Suspension of Nondilute Stationary Spheres",1982,"Physical Review Letters","48","23",,"1604","1607",,8,10.1103/PhysRevLett.48.1604,"https://www.scopus.com/inward/record.uri?eid=2-s2.0-26144468434&doi=10.1103%2fPhysRevLett.48.1604&partnerID=40&md5=a969bf854744da03f2768bc2929d1279",Article,Scopus,2-s2.0-26144468434
"Tokuyama, M., Cukier, R.I.","Dynamics of diffusion-controlled reactions among stationary sinks: Scaling expansion approach",1981,"The Journal of Chemical Physics","76","12",,"6202","6214",,23,,"https://www.scopus.com/inward/record.uri?eid=2-s2.0-36749114696&partnerID=40&md5=6e583fd8a18e850818ae061efc284545",Article,Scopus,2-s2.0-36749114696
"Cukier, R.I., Kapral, R., Mehaffey, J.R.","Kinetic theory of the hydrodynamic interaction between two particles",1981,"The Journal of Chemical Physics","74","4",,"2494","2504",,12,,"https://www.scopus.com/inward/record.uri?eid=2-s2.0-0007094526&partnerID=40&md5=4d3651025e00d38e8748af3aaafb70b5",Article,Scopus,2-s2.0-0007094526
"Schell, M., Kapral, R., Cukier, R.I.","Recombination kinetics: Langevin dynamics with a space dependent friction coefficient",1981,"The Journal of Chemical Physics","75","12",,"5879","5882",,16,,"https://www.scopus.com/inward/record.uri?eid=2-s2.0-33244469574&partnerID=40&md5=465cbfe8af154d86a0684a8d13774835",Article,Scopus,2-s2.0-33244469574
"Muthukumar, M., Cukier, R.I.","Concentration dependence of diffusion-controlled processes among stationary reactive sinks",1981,"Journal of Statistical Physics","26","3",,"453","469",,42,10.1007/BF01011428,"https://www.scopus.com/inward/record.uri?eid=2-s2.0-0006008895&doi=10.1007%2fBF01011428&partnerID=40&md5=9ad9696167debccd9239094b78e01f5a",Article,Scopus,2-s2.0-0006008895
"Pierce, T.H., Cukier, R.I.","Global nonlinear sensitivity analysis using walsh functions",1981,"Journal of Computational Physics","41","2",,"427","443",,10,10.1016/0021-9991(81)90104-2,"https://www.scopus.com/inward/record.uri?eid=2-s2.0-3743066406&doi=10.1016%2f0021-9991%2881%2990104-2&partnerID=40&md5=d115776793f9c61190b2325174ab5ca2",Article,Scopus,2-s2.0-3743066406
"Pierce, T.H., Cukier, R.I., Dye, J.L.","Application of nonlinear sensitivity analysis to enzyme mechanisms",1981,"Mathematical Biosciences","56","3-4",,"175","208",,3,10.1016/0025-5564(81)90053-5,"https://www.scopus.com/inward/record.uri?eid=2-s2.0-0019631996&doi=10.1016%2f0025-5564%2881%2990053-5&partnerID=40&md5=2926e20f1a67b48905db1b67f4f46e18",Article,Scopus,2-s2.0-0019631996
"Cukier, R.I., Kapral, R., Mehaffey, J.R.","Effect of static correlations on the pair friction coefficient",1980,"The Journal of Chemical Physics","73","10",,"5254","5258",,24,,"https://www.scopus.com/inward/record.uri?eid=2-s2.0-0039324381&partnerID=40&md5=c5e157d1c90d012cea9b8b1689fcad46",Article,Scopus,2-s2.0-0039324381
"Cukier, R.I., Kapral, R., Mehaffey, J.R., Shin, K.J.","Microscopic theory of condensed phase chemical reactions. I. Pair phase space kinetic equation",1980,"The Journal of Chemical Physics","72","3",,"1830","1843",,18,,"https://www.scopus.com/inward/record.uri?eid=2-s2.0-2342582419&partnerID=40&md5=60bfd5568f86f2ceac9d15032fb7250c",Article,Scopus,2-s2.0-2342582419
"Cukier, R.I., Kapral, R., Lebenhaft, J.R., Mehaffey, J.R.","On the microscopic origin of Stokes' law",1980,"The Journal of Chemical Physics","73","10",,"5244","5253",,29,,"https://www.scopus.com/inward/record.uri?eid=2-s2.0-0007299182&partnerID=40&md5=45e6cbb198caa387491eccbbe70a34f5",Article,Scopus,2-s2.0-0007299182
"Cukier, R.I., Kapral, R., Mehaffey, J.R., Shin, K.J.","Microscopic theory of condensed phase chemical reactions. II. Configuration space equations",1980,"The Journal of Chemical Physics","72","3",,"1844","1850",,12,,"https://www.scopus.com/inward/record.uri?eid=2-s2.0-0038798539&partnerID=40&md5=ca5ee6b8395dfc3be57ba6ce5f95f146",Article,Scopus,2-s2.0-0038798539
"Cukier, R.I., Mehaffey, J.R., Kapral, R.","Kinetic theory derivation of a pair configuration space diffusion equation",1978,"The Journal of Chemical Physics","69","11",,"4962","4975",,20,,"https://www.scopus.com/inward/record.uri?eid=2-s2.0-0040509638&partnerID=40&md5=0705a39667469b1c60b9a9f175e85d6d",Article,Scopus,2-s2.0-0040509638
"Natrajan, K.M., Samulski, E.T., Cukier, R.I.","Molecular morphology of polyethylene determined by NMR [10]",1978,"Nature","275","5680",,"527","530",,6,10.1038/27527a0,"https://www.scopus.com/inward/record.uri?eid=2-s2.0-0018074076&doi=10.1038%2f27527a0&partnerID=40&md5=691fd78449d1193a35d1a92682aa9637",Letter,Scopus,2-s2.0-0018074076
"Cukier, R.I., Mehaffey, J.R.","Kinetic theory of self-diffusion in a hard-sphere fluid",1978,"Physical Review A","18","3",,"1202","1213",,30,10.1103/PhysRevA.18.1202,"https://www.scopus.com/inward/record.uri?eid=2-s2.0-0004974102&doi=10.1103%2fPhysRevA.18.1202&partnerID=40&md5=57a14da3557437b434812e2977526607",Article,Scopus,2-s2.0-0004974102
"Mehaffey, J.R., Cukier, R.I.","Kinetic theory of single-particle motion in a fluid",1978,"Physical Review A","17","3",,"1181","1204",,42,10.1103/PhysRevA.17.1181,"https://www.scopus.com/inward/record.uri?eid=2-s2.0-0009298405&doi=10.1103%2fPhysRevA.17.1181&partnerID=40&md5=1ebd62a66061505a992786672ab8839c",Article,Scopus,2-s2.0-0009298405
"Cukier, R.I., Levine, H.B., Shuler, K.E.","Nonlinear sensitivity analysis of multiparameter model systems",1978,"Journal of Computational Physics","26","1",,"1","42",,360,10.1016/0021-9991(78)90097-9,"https://www.scopus.com/inward/record.uri?eid=2-s2.0-0040102388&doi=10.1016%2f0021-9991%2878%2990097-9&partnerID=40&md5=a00ba61a26b86827ce0692686ce0994b",Review,Scopus,2-s2.0-0040102388
"Lindenberg, K., Cukier, R.I.","A stochastic theory of translational correlation functions in gases and liquid",1977,"The Journal of Chemical Physics","67","2",,"568","578",,8,,"https://www.scopus.com/inward/record.uri?eid=2-s2.0-0039110309&partnerID=40&md5=c914e2a62132d1a2c7833d15108d635f",Article,Scopus,2-s2.0-0039110309
"Cukier, R.I., Levine, H.B., Shuler, K.E.","Nonlinear sensitivity analysis of multiparameter model systems",1977,"Journal of Physical Chemistry","81","25",,"2365","2366",,17,,"https://www.scopus.com/inward/record.uri?eid=2-s2.0-33847088577&partnerID=40&md5=b67db44bcac55177337698330e78ac05",Conference Paper,Scopus,2-s2.0-33847088577
"Mehaffey, J.R., Cukier, R.I.","Kinetic-theory derivation of the stokes-einstein law",1977,"Physical Review Letters","38","19",,"1039","1042",,28,10.1103/PhysRevLett.38.1039,"https://www.scopus.com/inward/record.uri?eid=2-s2.0-4243166085&doi=10.1103%2fPhysRevLett.38.1039&partnerID=40&md5=4b56495933dc798d9132ea89e1d07604",Article,Scopus,2-s2.0-4243166085
"Grubbs, R., Lau, C.P., Cukier, R., Brubaker, C.","Polymer Attached Metallocenes. Evidence for Site Isolation",1977,"Journal of the American Chemical Society","99","13",,"4517","4518",,67,10.1021/ja00455a059,"https://www.scopus.com/inward/record.uri?eid=2-s2.0-33847088953&doi=10.1021%2fja00455a059&partnerID=40&md5=2b5f2d969f2781a8a8f1a7b47c1fcc98",Article,Scopus,2-s2.0-33847088953
"Cukier, R.I., Hynes, J.T.","On exponential time decay in relaxation",1976,"The Journal of Chemical Physics","64","6",,"2674","2683",,16,,"https://www.scopus.com/inward/record.uri?eid=2-s2.0-36749119121&partnerID=40&md5=1e490a64f14fbc0bdfde0d2af2d48867",Article,Scopus,2-s2.0-36749119121
"Cukier, R.I., Schaibly, J.H., Shuler, K.E.","Study of the sensitivity of coupled reaction systems to uncertainties in rate coefficients. III. Analysis of the approximations",1975,"The Journal of Chemical Physics","63","3",,"1140","1149",,147,,"https://www.scopus.com/inward/record.uri?eid=2-s2.0-0001762397&partnerID=40&md5=06b0b43a6313a2ae706bc468e14f54f9",Article,Scopus,2-s2.0-0001762397
"Cukier, R.I., Lindenberg, K.","Equations of motion for rotational motion in liquids",1975,"Journal of Statistical Physics","13","5",,"451","455",,,10.1007/BF01013119,"https://www.scopus.com/inward/record.uri?eid=2-s2.0-34250410034&doi=10.1007%2fBF01013119&partnerID=40&md5=53de7fda704d76bce27019a8ae5ba29c",Article,Scopus,2-s2.0-34250410034
"Cukier, R.I.","Rotational relaxation of molecules in isotropic and anisotropic fluids",1974,"The Journal of Chemical Physics","60","3",,"734","743",,23,,"https://www.scopus.com/inward/record.uri?eid=2-s2.0-0345793624&partnerID=40&md5=2d654308dbfbf98fc6da6d25acc83180",Article,Scopus,2-s2.0-0345793624
"Lindenberg, K., Cukier, R.I.","Generalized stochastic model for molecular rotational motion in dense media",1974,"The Journal of Chemical Physics","62","8",,"3271","3280",,16,,"https://www.scopus.com/inward/record.uri?eid=2-s2.0-36749119023&partnerID=40&md5=2132252b4d81baef1010bf3de3a26262",Article,Scopus,2-s2.0-36749119023
"Cukier, R.I., Wheeler, J.C.","Time autocorrelation functions for harmonic solids from Gaussian quadratures",1974,"The Journal of Chemical Physics",,,,"4639","4649",,5,,"https://www.scopus.com/inward/record.uri?eid=2-s2.0-36749121374&partnerID=40&md5=fb001e3113657fbfe7a437d395f42ae2",Article,Scopus,2-s2.0-36749121374
"Cukier, R.I., Fortuin, C.M., Shuler, K.E., Petschek, A.G., Schaibly, J.H.","Study of the sensitivity of coupled reaction systems to uncertainties in rate coefficients. I Theory",1973,"Journal of Chemical Physics","59","8",,"3873","3878",,307,10.1063/1.1680571,"https://www.scopus.com/inward/record.uri?eid=2-s2.0-84953649167&doi=10.1063%2f1.1680571&partnerID=40&md5=03eeb52d4fba0e5283a28911c149a53f",Article,Scopus,2-s2.0-84953649167
"Cukier, R.I., Lakatos-Lindenberg, K., Shuler, K.E.","Orthogonal polynomial solutions of the Fokker-Planck equation",1973,"Journal of Statistical Physics","9","2",,"137","144",,18,10.1007/BF01016844,"https://www.scopus.com/inward/record.uri?eid=2-s2.0-0343423115&doi=10.1007%2fBF01016844&partnerID=40&md5=6d44c9045a94ba92aeb834f1eeff93f2",Article,Scopus,2-s2.0-0343423115
"Cukier, R.I.","Equivalence of the projection-operator, Laplace-transform, and Green's-function approaches to harmonic lattices",1973,"Physical Review B","7","12",,"5329","5331",,,10.1103/PhysRevB.7.5329,"https://www.scopus.com/inward/record.uri?eid=2-s2.0-35949039139&doi=10.1103%2fPhysRevB.7.5329&partnerID=40&md5=42ac596455497c7d6f6a0d0e082109ec",Article,Scopus,2-s2.0-35949039139
"Cukier, R.I., Shuler, K.E.","On the microscopic conditions for linear macroscopic laws",1972,"The Journal of Chemical Physics","57","1",,"316","319",,11,,"https://www.scopus.com/inward/record.uri?eid=2-s2.0-36849099834&partnerID=40&md5=25671a7f9682f01ed482a7a14d2f0352",Article,Scopus,2-s2.0-36849099834
"Cukier, R.I., Lakatos-Lindenberg, K.","Rotational relaxation of molecules in fluids for reorientations of arbitrary angle",1972,"The Journal of Chemical Physics","57","8",,"3427","3435",,34,,"https://www.scopus.com/inward/record.uri?eid=2-s2.0-0000391699&partnerID=40&md5=5e18bd1f0202648f8a586b13ebca487d",Article,Scopus,2-s2.0-0000391699
"Cukier, R.I.","Dynamic and ergodic properties of an impurity in a harmonic-oscillator chain",1972,"Physica","61","3",,"321","345",,9,10.1016/0031-8914(72)90054-7,"https://www.scopus.com/inward/record.uri?eid=2-s2.0-49649133281&doi=10.1016%2f0031-8914%2872%2990054-7&partnerID=40&md5=ef3c936f1b9ac16df2f92a78ff5cf48d",Article,Scopus,2-s2.0-49649133281
"Cukier, R.I., Shuler, K.E., Weeks, J.D.","On the validity of stochastic rate equations in finite systems with finite-strength interactions",1972,"Journal of Statistical Physics","5","1-2",,"99","112",,11,10.1007/BF01008373,"https://www.scopus.com/inward/record.uri?eid=2-s2.0-0002088033&doi=10.1007%2fBF01008373&partnerID=40&md5=94f1561b3929caafc620207437cf3d59",Article,Scopus,2-s2.0-0002088033
"Cukier, R.I., Mazur, P.","The ergodic properties of an impurity in a harmonic oscillator chain",1971,"Physica","53","2",,"157","182",,21,10.1016/0031-8914(71)90068-1,"https://www.scopus.com/inward/record.uri?eid=2-s2.0-0342866151&doi=10.1016%2f0031-8914%2871%2990068-1&partnerID=40&md5=0510aae58e2c930978c778abe94995db",Article,Scopus,2-s2.0-0342866151
"Cukier, R.I., Fortuin, C.M., Shuler, K.E., Petschek, A.G., Schaibly, J.H.","Study of the sensitivity of coupled reaction systems to uncertainties in rate coefficients. I Theory",1970,"The Journal of Chemical Physics",,,,"3873","3878",,145,,"https://www.scopus.com/inward/record.uri?eid=2-s2.0-36849101283&partnerID=40&md5=fb280f6663add04ffb73ecb80ef3970d",Article,Scopus,2-s2.0-36849101283
"Cukier, R.I., Deutch, J.M.","Spin relaxation: The multiple-time-scale point of view",1969,"The Journal of Chemical Physics","50","1",,"142","150",,4,,"https://www.scopus.com/inward/record.uri?eid=2-s2.0-36849112414&partnerID=40&md5=1df1b28d18d6b598ce7239e81c059d7a",Article,Scopus,2-s2.0-36849112414
"Cukier, R.I., Deutch, J.M.","Microscopic theory of brownian motion: The multiple-time-scale point of view",1969,"Physical Review","177","1",,"240","244",,41,10.1103/PhysRev.177.240,"https://www.scopus.com/inward/record.uri?eid=2-s2.0-36049053583&doi=10.1103%2fPhysRev.177.240&partnerID=40&md5=831d8c2f1fe55494155da78799ef0167",Article,Scopus,2-s2.0-36049053583
"Chapoy, L.L., Samulski, E.T., Cukier, R., Giacin, J.R.","For cleaner air [4]",1968,"Chemical and Engineering News","46","32",,"6","",,,,"https://www.scopus.com/inward/record.uri?eid=2-s2.0-33947326952&partnerID=40&md5=73bb48fca5ae33cb7ba791a5b55567c3",Letter,Scopus,2-s2.0-33947326952
"Cukier, R.I., Deutch, J.M.","Entropy production in canonically invariant systems",1967,"The Journal of Chemical Physics","46","9",,"3686","3687",,1,,"https://www.scopus.com/inward/record.uri?eid=2-s2.0-36849116052&partnerID=40&md5=699cc066eaa763f2cc386c212fa5e2af",Note,Scopus,2-s2.0-36849116052
"Norcross, B.E., Becker, D., Cukier, R.I., Schultz, R.M.","Paracyclophane Phenols and Derivatives. I. Synthesis and pK<inf>A</inf> Values of 4-Hydroxy-and 4-Amino[2.2]Paracyclophane",1967,"Journal of Organic Chemistry","32","1",,"220","222",,16,10.1021/jo01277a056,"https://www.scopus.com/inward/record.uri?eid=2-s2.0-0042997413&doi=10.1021%2fjo01277a056&partnerID=40&md5=d24003a43ca580b300e799a443b6b9a6",Article,Scopus,2-s2.0-0042997413
"Hayes, D.H., Cukier, R., Gros, F.","Synthèse du poly U par la RNA polymérase avec l'acide octoadénylique (hepta adénylyl‐(3′,5′)‐adénosine) comme matrice",1967,"European Journal of Biochemistry","1","2",,"125","134",,3,10.1111/j.1432-1033.1967.tb00053.x,"https://www.scopus.com/inward/record.uri?eid=2-s2.0-0014081259&doi=10.1111%2fj.1432-1033.1967.tb00053.x&partnerID=40&md5=c4d310868bdab0f01f5dffab717a4d7d",Article,Scopus,2-s2.0-0014081259
