Authors,Title,Year,Source title,Volume,Issue,Art. No.,Page start,Page end,Page count,Cited by,DOI,Link,Document Type,Source,EID
"Doran, J.W., Elliott, E.T., Paustian, K.","Soil microbial activity, nitrogen cycling, and long-term changes in organic carbon pools as related to fallow tillage management",1998,"Soil and Tillage Research","49","1-2",,"3","18",,154,10.1016/S0167-1987(98)00150-0,"https://www.scopus.com/inward/record.uri?eid=2-s2.0-0032541981&doi=10.1016%2fS0167-1987%2898%2900150-0&partnerID=40&md5=ef3c0c0fcaef3d4f0837123a848ba0da",Article,Scopus,2-s2.0-0032541981
"Rosenberg, N.J., Cole, C.V., Paustian, K.","Mitigation of greenhouse gas emissions by the agriculture sector: New technologies, policies and measures offer potential to mitigate emissions while improving productivity and ecosystem health: An introductory editorial",1998,"Climatic Change","40","1",,"1","5",,8,10.1023/A:1005374330361,"https://www.scopus.com/inward/record.uri?eid=2-s2.0-0031687594&doi=10.1023%2fA%3a1005374330361&partnerID=40&md5=c659dd65f08df9e6080c7e299179abf5",Article,Scopus,2-s2.0-0031687594
"Six, J., Elliott, E.T., Paustian, K., Doran, J.W.","Aggregation and soil organic matter accumulation in cultivated and native grassland soils",1998,"Soil Science Society of America Journal","62","5",,"1367","1377",,729,,"https://www.scopus.com/inward/record.uri?eid=2-s2.0-0032170648&partnerID=40&md5=1f569e52eee21b86a9f2a6101d696382",Article,Scopus,2-s2.0-0032170648
"Paustian, K., Elliott, E.T., Carter, M.R.","Tillage and crop management impacts on soil C storage: Use of long-term experimental data",1998,"Soil and Tillage Research","47","3-4",,"vii","xii",,18,10.1016/S0167-1987(98)00104-4,"https://www.scopus.com/inward/record.uri?eid=2-s2.0-0032490668&doi=10.1016%2fS0167-1987%2898%2900104-4&partnerID=40&md5=85e1f696c7f7c11942e4cb1c93467ae4",Review,Scopus,2-s2.0-0032490668
"Paustian, K., Cole, C.V., Sauerbeck, D., Sampson, N.","CO<inf>2</inf> mitigation by agriculture: An overview",1998,"Climatic Change","40","1",,"135","162",,174,10.1023/A:1005347017157,"https://www.scopus.com/inward/record.uri?eid=2-s2.0-0031713260&doi=10.1023%2fA%3a1005347017157&partnerID=40&md5=929ff8164937cbac7019e3928865a18a",Article,Scopus,2-s2.0-0031713260
"Paustian, K., Andrén, O., Janzen, H.H., Lal, R., Smith, P., Tian, G., Tiessen, H., Van Noordwijk, M., Woomer, P.L.","Agricultural soils as a sink to mitigate CO<inf>2</inf> emissions",1997,"Soil Use and Management","13","4 SUPPL.",,"230","244",,499,,"https://www.scopus.com/inward/record.uri?eid=2-s2.0-0031414815&partnerID=40&md5=e1684783357cbe7e1c9274084ebae287",Review,Scopus,2-s2.0-0031414815
"Cole, C.V., Duxbury, J., Freney, J., Heinemeyer, O., Minami, K., Mosier, A., Paustian, K., Rosenberg, N., Sampson, N., Sauerbeck, D., Zhao, Q.","Global estimates of potential mitigation of greenhouse gas emissions by agriculture",1997,"Nutrient Cycling in Agroecosystems","49","1-3",,"221","228",,204,,"https://www.scopus.com/inward/record.uri?eid=2-s2.0-0000051059&partnerID=40&md5=b7c79231fb9e4203f390bca894a5565b",Article,Scopus,2-s2.0-0000051059
"Paustian, K., Levine, E., Post, W.M., Ryzhova, I.M.","The use of models to integrate information and understanding of soil C at the regional scale",1997,"Geoderma","79","1-4",,"227","260",,109,10.1016/S0016-7061(97)00043-8,"https://www.scopus.com/inward/record.uri?eid=2-s2.0-0030853191&doi=10.1016%2fS0016-7061%2897%2900043-8&partnerID=40&md5=313dc6dfb0afc957b10989f7d9f32910",Conference Paper,Scopus,2-s2.0-0030853191
"Paustian, K., Elliott, E.T., Peterson, G.A., Killian, K.","Modelling climate, CO2 and management impacts on soil carbon in semi-arid agroecosystems",1996,"Plant and Soil","187","2",,"351","365",,30,,"https://www.scopus.com/inward/record.uri?eid=2-s2.0-0030300675&partnerID=40&md5=1c44cfddbfbe7034dbab078563155bf5",Article,Scopus,2-s2.0-0030300675
"Tottewitz, F., Stubbe, C., Ahrens, M., Dobiáš, K., Goretzki, J., Paustian, K.H.","Counting droppings as a method of estimating the population of ruminant game [Die Losungszählung als Methode der Bestandesschätzung von wiederkäuenden Schalenwildarten]",1996,"Zeitschrift fur Jagdwissenschaft","42","2",,"111","122",,6,,"https://www.scopus.com/inward/record.uri?eid=2-s2.0-18144393115&partnerID=40&md5=51296dce4a5ad6765f76ac962a1ea53c",Article,Scopus,2-s2.0-18144393115
"Tottewitz, F., Stubbe, C., Ahrens, M., Dobiáš, K., Goretzki, J., Paustian, K.-H.","Counting droppings as a method of estimating the population of ruminant game [Die losungszählung als methode der bestandesschätzung von wiederkauenden schalenwildarten]",1996,"European Journal of Wildlife Research","42","2",,"111","122",,1,,"https://www.scopus.com/inward/record.uri?eid=2-s2.0-53349117624&partnerID=40&md5=9998315b0b1e9e795cf591bb231d8fc8",Article,Scopus,2-s2.0-53349117624
"Paustian, K., Elliott, E.T., Peterson, G.A., Killian, K.","Modelling climate, CO<inf>2</inf> and management impacts on soil carbon in semi-arid agroecosystems",1995,"Plant and Soil: An International Journal on Plant-Soil Relationships","187","2",,"351","365",,1,10.1007/BF00017100,"https://www.scopus.com/inward/record.uri?eid=2-s2.0-84951631621&doi=10.1007%2fBF00017100&partnerID=40&md5=19af0b31d94ab3554cbfb444fc2f6ee4",Article,Scopus,2-s2.0-84951631621
"Paustian, K., Elliott, E.T., Collins, H.P., Cole, C.V., Paul, E.A.","Use of a Network of Long-Term Experiments for Analysis of Soil Carbon Dynamics and Global Change: The North American Model",1995,"Australian Journal of Experimental Agriculture","35","7",,"929","939",,22,10.1071/EA9950929,"https://www.scopus.com/inward/record.uri?eid=2-s2.0-0029476836&doi=10.1071%2fEA9950929&partnerID=40&md5=05e5fdc9c48041b2c506d61f1aa00bcc",Article,Scopus,2-s2.0-0029476836
"Cole, C.V., Paustian, K., Elliott, E.T., Metherell, A.K., Ojima, D.S., Parton, W.J.","Analysis of agroecosystem carbon pools",1993,"Water, Air, &amp; Soil Pollution","70","1-4",,"357","371",,35,10.1007/BF01105007,"https://www.scopus.com/inward/record.uri?eid=2-s2.0-0027676207&doi=10.1007%2fBF01105007&partnerID=40&md5=f22fd365250e8d752fe85d464f85dd95",Article,Scopus,2-s2.0-0027676207
"Paustian, K., Parton, W.J., Persson, J.","Modeling soil organic matter in organic-amended and nitrogen- fertilized long-term plots",1992,"Soil Science Society of America Journal","56","2",,"476","488",,354,,"https://www.scopus.com/inward/record.uri?eid=2-s2.0-0027059942&partnerID=40&md5=c5061b770e93ab7e4b42c0efa2b10869",Article,Scopus,2-s2.0-0027059942
"Barnwell Jr., T.O., Jackson IV, R.B., Elliott, E.T., Burke, I.C., Cole, C.V., Paustian, K., Paul, E.A., Donigian, A.S., Patwardhan, A.S., Rowell, A., Weinrich, K.","An approach to assessment of management impacts on agricultural soil carbon",1992,"Water, Air, &amp; Soil Pollution","64","1-2",,"423","435",,19,10.1007/BF00477114,"https://www.scopus.com/inward/record.uri?eid=2-s2.0-0026906139&doi=10.1007%2fBF00477114&partnerID=40&md5=1c8f87b6844543e5031571cdea72fcdc",Article,Scopus,2-s2.0-0026906139
"Svensson, B.H., Klemedtsson, L., Simkins, S., Paustian, K., Rosswall, T.","Soil denitrification in three cropping systems characterized by differences in nitrogen and carbon supply - I. Rate-distribution frequencies, comparison between systems and seasonal N losses",1991,"Plant and Soil","138","2",,"257","271",,41,10.1007/BF00012253,"https://www.scopus.com/inward/record.uri?eid=2-s2.0-0026282078&doi=10.1007%2fBF00012253&partnerID=40&md5=5a517cee696a19a359dd229591828cc9",Article,Scopus,2-s2.0-0026282078
"Paustian, K.","Carbon and nitrogen budgets of four agro-ecosystems with annual and perennial crops, with and without N fertilization",1990,"Journal of Applied Ecology","27","1",,"60","84",,128,,"https://www.scopus.com/inward/record.uri?eid=2-s2.0-0025232031&partnerID=40&md5=549bed903d9ed83a9adc0e152d704747",Article,Scopus,2-s2.0-0025232031
"Lagerlof, J., Andren, O., Paustian, K.","Dynamics and contribution to carbon flows of Enchytraeidae (Oligochaeta) under four cropping systems",1989,"Journal of Applied Ecology","26","1",,"183","199",,16,,"https://www.scopus.com/inward/record.uri?eid=2-s2.0-0024880968&partnerID=40&md5=8b3f8cd6c7e6e7f0a90dc8ee5e31de7f",Article,Scopus,2-s2.0-0024880968
"Paustian, K., Bergstrom, L., Jansson, P.-E., Johnsson, H.","Ecosystem dynamics",1989,"Ecology of arable land",,,,"153","180",,1,,"https://www.scopus.com/inward/record.uri?eid=2-s2.0-0024938463&partnerID=40&md5=bf1baaa8b326bc698aa8a43e8508d63f",Article,Scopus,2-s2.0-0024938463
"Andren, O., Lindberg, T., Paustian, K., Rosswall, T.","Ecology of arable land - organisms, carbon and nitrogen cycling",1989,"Ecology of arable land - organisms, carbon and nitrogen cycling",,,,"","",222,4,,"https://www.scopus.com/inward/record.uri?eid=2-s2.0-0024871383&partnerID=40&md5=7517054914b33d5473cc3f2626bbfd68",Article,Scopus,2-s2.0-0024871383
"Andrén, O., Paustian, K., Rosswall, T.","Soil biotic interactions in the functioning of agroecosystems",1988,"Agriculture, Ecosystems and Environment","24","1-3",,"57","67",,28,10.1016/0167-8809(88)90056-4,"https://www.scopus.com/inward/record.uri?eid=2-s2.0-0024259028&doi=10.1016%2f0167-8809%2888%2990056-4&partnerID=40&md5=a092c704745650d2a48543b86da414ee",Article,Scopus,2-s2.0-0024259028
"Andren, O., Paustian, K.","Barley straw decomposition in the field: a comparison of models.",1987,"Ecology","68","5",,"1190","1200",,173,,"https://www.scopus.com/inward/record.uri?eid=2-s2.0-0023470316&partnerID=40&md5=0ca46ee141ea45c2dea6d980a6078238",Article,Scopus,2-s2.0-0023470316
"Paustian, K., Schnürer, J.","Fungal growth response to carbon and nitrogen limitation: Application of a model to laboratory and field data",1987,"Soil Biology and Biochemistry","19","5",,"621","629",,44,10.1016/0038-0717(87)90108-8,"https://www.scopus.com/inward/record.uri?eid=2-s2.0-38249036393&doi=10.1016%2f0038-0717%2887%2990108-8&partnerID=40&md5=143c6233872d86d92bd415e8f0ab157a",Article,Scopus,2-s2.0-38249036393
"Paustian, K., Schnürer, J.","Fungal growth response to carbon and nitrogen limitation: A theoretical model",1987,"Soil Biology and Biochemistry","19","5",,"613","620",,72,10.1016/0038-0717(87)90107-6,"https://www.scopus.com/inward/record.uri?eid=2-s2.0-0023488051&doi=10.1016%2f0038-0717%2887%2990107-6&partnerID=40&md5=0a44f9f425e73453d1ff243a1fba3eab",Article,Scopus,2-s2.0-0023488051
"Hansson, A.‐C., Pettersson, R., Paustian, K.","Shoot and Root Production and Nitrogen Uptake in Barley, with and without Nitrogen Fertilization",1987,"Journal of Agronomy and Crop Science","158","3",,"163","171",,44,10.1111/j.1439-037X.1987.tb00258.x,"https://www.scopus.com/inward/record.uri?eid=2-s2.0-85024995540&doi=10.1111%2fj.1439-037X.1987.tb00258.x&partnerID=40&md5=a2dd716b119fa098c87fa7a8735e8798",Article,Scopus,2-s2.0-85024995540
"Johnsson, H., Bergstrom, L., Jansson, P.-E., Paustian, K.","Simulated nitrogen dynamics and losses in a layered agricultural soil",1987,"Agriculture, Ecosystems and Environment","18","4",,"333","356",,386,10.1016/0167-8809(87)90099-5,"https://www.scopus.com/inward/record.uri?eid=2-s2.0-0000600536&doi=10.1016%2f0167-8809%2887%2990099-5&partnerID=40&md5=0e37e4bcd82e7947415473c0dc53c99b",Article,Scopus,2-s2.0-0000600536
"Rosswall, T., Paustian, K.","Cycling of nitrogen in modern agricultural systems",1984,"Plant and Soil","76","1-3",,"3","21",,47,10.1007/BF02205563,"https://www.scopus.com/inward/record.uri?eid=2-s2.0-0021581088&doi=10.1007%2fBF02205563&partnerID=40&md5=eb6ce7ac1bf6bb2fe205c4fb732865af",Article,Scopus,2-s2.0-0021581088
