Authors,Title,Year,Source title,Volume,Issue,Art. No.,Page start,Page end,Page count,Cited by,DOI,Link,Document Type,Source,EID
"Scrinzi, A., Szalewicz, K.","Energy shift in the [(td)e] system due to the finite size of the muonic molecular ion",1989,"Physical Review A","39","10",,"4983","4990",,19,10.1103/PhysRevA.39.4983,"https://www.scopus.com/inward/record.uri?eid=2-s2.0-0011294735&doi=10.1103%2fPhysRevA.39.4983&partnerID=40&md5=cd487a57b44afda4e760479ef0db8371",Article,Scopus,2-s2.0-0011294735
"Scrinzi, A., Szalewicz, K.","Auger transition rates for the muonic molecular ion td",1989,"Physical Review A","39","6",,"2855","2861",,24,10.1103/PhysRevA.39.2855,"https://www.scopus.com/inward/record.uri?eid=2-s2.0-0011324514&doi=10.1103%2fPhysRevA.39.2855&partnerID=40&md5=2086d37f26438d5139ccdff09111586f",Article,Scopus,2-s2.0-0011324514
"Haywood, S.E., Monkhorst, H.J., Szalewicz, K.","Variational sticking-fraction calculations for the excited states of the td1/4 molecular ion",1989,"Physical Review A","39","4",,"1634","1638",,15,10.1103/PhysRevA.39.1634,"https://www.scopus.com/inward/record.uri?eid=2-s2.0-4243468114&doi=10.1103%2fPhysRevA.39.1634&partnerID=40&md5=2646aae49bb8db06327f629446bc55f5",Article,Scopus,2-s2.0-4243468114
"Szalewicz, K., Morgan III, J.D., Monkhorst, H.J.","Fusion rates for hydrogen isotopic molecules of relevance for cold fusion",1989,"Physical Review A","40","5",,"2824","2827",,14,10.1103/PhysRevA.40.2824,"https://www.scopus.com/inward/record.uri?eid=2-s2.0-26344449051&doi=10.1103%2fPhysRevA.40.2824&partnerID=40&md5=effaa3dceb4371b9d18908002daa4711",Article,Scopus,2-s2.0-26344449051
"Alexander, S.A., Monkhorst, H.J., Szalewicz, K.","Random tempering of Gaussian-type geminals. III. Coupled pair calculations on lithium hydride and beryllium",1988,"The Journal of Chemical Physics","89","1",,"355","359",,38,,"https://www.scopus.com/inward/record.uri?eid=2-s2.0-0347381354&partnerID=40&md5=68ce64a477b6a0d5b333f7d5b097e32f",Article,Scopus,2-s2.0-0347381354
"Szalewicz, K., Cole, S.J., Kołos, W., Bartlett, R.J.","A theoretical study of the water dimer interaction",1988,"The Journal of Chemical Physics","89","6",,"3662","3673",,230,,"https://www.scopus.com/inward/record.uri?eid=2-s2.0-3643123303&partnerID=40&md5=62d3b3776e6593de26e47bfecc548c98",Article,Scopus,2-s2.0-3643123303
"Froelich, P., Szalewicz, K.","Three-body resonances of dtμ above dμ threshold",1988,"Physics Letters A","129","5-6",,"321","325",,14,10.1016/0375-9601(88)90341-6,"https://www.scopus.com/inward/record.uri?eid=2-s2.0-0038812150&doi=10.1016%2f0375-9601%2888%2990341-6&partnerID=40&md5=fe02c01c290ffbdef934c7c2e906dcaf",Article,Scopus,2-s2.0-0038812150
"Haywood, S.E., Monkhorst, H.J., Szalewicz, K.","Variational sticking-fraction calculations for the ground state of the td molecular ion",1988,"Physical Review A","37","9",,"3393","3398",,45,10.1103/PhysRevA.37.3393,"https://www.scopus.com/inward/record.uri?eid=2-s2.0-0000787437&doi=10.1103%2fPhysRevA.37.3393&partnerID=40&md5=77addb6041bf14807fa831dd45224f06",Article,Scopus,2-s2.0-0000787437
"Scrinzi, A., Szalewicz, K., Monkhorst, H.J.","Nonadiabatic rovibrational levels of hydrogenlike molecules formed in the process of muon-catalyzed fusion",1988,"Physical Review A","37","7",,"2270","2276",,23,10.1103/PhysRevA.37.2270,"https://www.scopus.com/inward/record.uri?eid=2-s2.0-0011374881&doi=10.1103%2fPhysRevA.37.2270&partnerID=40&md5=719d03709dfac663eadc117e84ef6f56",Article,Scopus,2-s2.0-0011374881
"Kolos, W., Jeziorski, B., Rychlewski, J., Szalewicz, K., Monkhorst, H.J., Fackler, O.","Molecular effects in tritium decay. IV. Effect of crystal excitations on neutrino mass determination",1988,"Physical Review A","37","7",,"2297","2303",,33,10.1103/PhysRevA.37.2297,"https://www.scopus.com/inward/record.uri?eid=2-s2.0-33749319990&doi=10.1103%2fPhysRevA.37.2297&partnerID=40&md5=533bccdd5ec6df6c8279d0b4efb92196",Article,Scopus,2-s2.0-33749319990
"Moszynski, R., Szalewicz, K.","Accurate electron densities of the hydrogen molecule",1987,"Journal of Physics B: Atomic and Molecular Physics","20","17", 015,"4347","4364",,18,10.1088/0022-3700/20/17/015,"https://www.scopus.com/inward/record.uri?eid=2-s2.0-4243104863&doi=10.1088%2f0022-3700%2f20%2f17%2f015&partnerID=40&md5=c3471939aec94f9f0ccf5ad2c3aa5d19",Article,Scopus,2-s2.0-4243104863
"Rybak, S., Szalewicz, K., Jeziorski, B., Jaszunski, M.","Intraatomic correlation effects for the He-He dispersion and exchange-dispersion energies using explicitly correlated Gaussian geminals",1987,"The Journal of Chemical Physics","86","10",,"5652","5659",,74,,"https://www.scopus.com/inward/record.uri?eid=2-s2.0-0011447051&partnerID=40&md5=ed9cf7b17a8fc619e3163c4515263f35",Article,Scopus,2-s2.0-0011447051
"Alexander, S.A., Monkhorst, H.J., Szalewicz, K.","Random tempering of Gaussian-type geminals. II. Molecular systems",1987,"The Journal of Chemical Physics","87","7",,"3976","3980",,38,,"https://www.scopus.com/inward/record.uri?eid=2-s2.0-0342975639&partnerID=40&md5=b4ae29bcdadeed0cbf3e3fcb325cf465",Article,Scopus,2-s2.0-0342975639
"Froelich, P., Szalewicz, K., Jeziorski, B., Kolos, W., Monkhorst, H.J.","Electronic resonances of HeT+ resulting from the beta decay of the tritium molecule",1987,"Journal of Physics B: Atomic and Molecular Physics","20","23", 010,"6173","6187",,18,10.1088/0022-3700/20/23/010,"https://www.scopus.com/inward/record.uri?eid=2-s2.0-0009166966&doi=10.1088%2f0022-3700%2f20%2f23%2f010&partnerID=40&md5=0f6a75b84a815b685dae55763dd26d55",Article,Scopus,2-s2.0-0009166966
"Szalewicz, K., Monkhorst, H.J., Kolos, W., Scrinzi, A.","Variational calculation of the energy levels for the td ion",1987,"Physical Review A","36","11",,"5494","5497",,56,10.1103/PhysRevA.36.5494,"https://www.scopus.com/inward/record.uri?eid=2-s2.0-4243243350&doi=10.1103%2fPhysRevA.36.5494&partnerID=40&md5=a93786ff194abf222d31f7b55dfbab36",Article,Scopus,2-s2.0-4243243350
"Szalewicz, K., Fackler, O., Jeziorski, B., Kolos, W., Monkhorst, H.J.","Molecular effects in tritium decay. III. Electronic resonances of the HeT+ ion and dependence of neutrino mass on the accuracy of the theoretical model",1987,"Physical Review A","35","3",,"965","979",,29,10.1103/PhysRevA.35.965,"https://www.scopus.com/inward/record.uri?eid=2-s2.0-0009231571&doi=10.1103%2fPhysRevA.35.965&partnerID=40&md5=7ffdfcc51e9ba47f432b2c0ce26931c8",Article,Scopus,2-s2.0-0009231571
"Cole, S.J., Szalewicz, K., Purvis III, G.D., Bartlett, R.J.","Correlated calculation of the interaction in the nitromethane dimer",1986,"The Journal of Chemical Physics","84","12",,"6833","6836",,20,,"https://www.scopus.com/inward/record.uri?eid=2-s2.0-0038888888&partnerID=40&md5=50405d0edd103151a0eee29bde164e14",Article,Scopus,2-s2.0-0038888888
"Kołos, W., Szalewicz, K., Monkhorst, H.J.","New Born-Oppenheimer potential energy curve and vibrational energies for the electronic ground state of the hydrogen molecule",1986,"The Journal of Chemical Physics","84","6",,"3278","3283",,240,,"https://www.scopus.com/inward/record.uri?eid=2-s2.0-36549093242&partnerID=40&md5=41d3b0704a862390da180d03057ff449",Article,Scopus,2-s2.0-36549093242
"Alexander, S.A., Monkhorst, H.J., Szalewicz, K.","Random tempering of Gaussian-type geminals. I. Atomic systems",1986,"The Journal of Chemical Physics","85","10",,"5821","5825",,60,,"https://www.scopus.com/inward/record.uri?eid=2-s2.0-0010027331&partnerID=40&md5=6b6d265123a999276b4b073e7e53a14c",Article,Scopus,2-s2.0-0010027331
"Wenzel, K.B., Zabolitzky, J.G., Szalewicz, K., Jeziorski, B., Monkhorst, H.J.","Atomic and molecular correlation energies with explicitly correlated Gaussian geminals. V. Cartesian Gaussian geminals and the neon atom",1986,"The Journal of Chemical Physics","85","7",,"3964","3974",,69,,"https://www.scopus.com/inward/record.uri?eid=2-s2.0-0000742168&partnerID=40&md5=3ffb9eedb52f8b5841813d5bf0ca91ad",Article,Scopus,2-s2.0-0000742168
"Cole, S.J., Szalewicz, K., Bartlett, R.J.","Nitromethane dimer potential energy surface studies",1986,"International Journal of Quantum Chemistry","30","5",,"695","711",,2,10.1002/qua.560300512,"https://www.scopus.com/inward/record.uri?eid=2-s2.0-84987063963&doi=10.1002%2fqua.560300512&partnerID=40&md5=bcf8c6e030a44e1f56dcb8041f94c384",Article,Scopus,2-s2.0-84987063963
"Kolos, W., Jeziorski, B., Szalewicz, K., Monkhorst, H.J.","Molecular effects in tritium decay: Transitions to the discrete electronic states of the HeT+ molecule",1985,"Physical Review A","31","2",,"551","555",,40,10.1103/PhysRevA.31.551,"https://www.scopus.com/inward/record.uri?eid=2-s2.0-0037500200&doi=10.1103%2fPhysRevA.31.551&partnerID=40&md5=4fdea3b424af6f27a86dc67a0ca0b5eb",Article,Scopus,2-s2.0-0037500200
"Kolos, W., Jeziorski, B., Monkhorst, H.J., Szalewicz, K.","Quantum chemical contribution to electron neutrino mass determination",1985,"International Journal of Quantum Chemistry","28","19 S",,"421","441",,,10.1002/qua.560280840,"https://www.scopus.com/inward/record.uri?eid=2-s2.0-84987141274&doi=10.1002%2fqua.560280840&partnerID=40&md5=c89a071f2870e06482c7d34ab5609d98",Article,Scopus,2-s2.0-84987141274
"Fackler, O., Jeziorski, B., Kołos, W., Monkhorst, H.J., Szalewicz, K.","Accurate theoretical -decay energy spectrum of the tritium molecule and its neutrino mass dependence",1985,"Physical Review Letters","55","13",,"1388","1391",,51,10.1103/PhysRevLett.55.1388,"https://www.scopus.com/inward/record.uri?eid=2-s2.0-4243694618&doi=10.1103%2fPhysRevLett.55.1388&partnerID=40&md5=ff576f5be71252e541932699a720c95e",Article,Scopus,2-s2.0-4243694618
"Jeziorski, B., Kolos, W., Szalewicz, K., Fackler, O., Monkhorst, H.J.","Molecular effects in tritium decay. II. Rotation-vibration excitation, dissociation, and rotational predissociation in the decay of the T2 and TH molecules",1985,"Physical Review A","32","5",,"2573","2583",,26,10.1103/PhysRevA.32.2573,"https://www.scopus.com/inward/record.uri?eid=2-s2.0-11644309561&doi=10.1103%2fPhysRevA.32.2573&partnerID=40&md5=22f6fe7c294e17efc95a4034dcc52257",Article,Scopus,2-s2.0-11644309561
"Szalewicz, K., Zabolitzky, J.G., Jeziorski, B., Monkhorst, H.J.","Atomic and molecular correlation energies with explicitly correlated Gaussian geminals. IV. A simplified treatment of strong orthogonality in MBPT and coupled cluster calculations",1984,"The Journal of Chemical Physics","81","6",,"2723","2731",,78,,"https://www.scopus.com/inward/record.uri?eid=2-s2.0-0006631851&partnerID=40&md5=a4cc1d1be3e26e2a67e41d3e1f34cf5a",Article,Scopus,2-s2.0-0006631851
"Jeziorski, B., Monkhorst, H.J., Szalewicz, K., Zabolitzky, J.G.","Atomic and molecular correlation energies with explicitly correlated Gaussian geminals. III. Coupled cluster treatment for He, Be, H<inf>2</inf>, and LiH",1984,"The Journal of Chemical Physics","81","1",,"368","388",,80,,"https://www.scopus.com/inward/record.uri?eid=2-s2.0-0038078953&partnerID=40&md5=9423190a6dd13767d152408137601a21",Article,Scopus,2-s2.0-0038078953
"Szalewicz, K., Jeziorski, B., Monkhorst, H.J., Zabolitzky, J.G.","Atomic and molecular correlation energies with explicitly correlated Gaussian geminals. II. Perturbation treatment through third-order for He, Be, H<inf>2</inf>, and LiH",1983,"The Journal of Chemical Physics","79","11",,"5543","5552",,64,,"https://www.scopus.com/inward/record.uri?eid=2-s2.0-0012919092&partnerID=40&md5=644f6fcaa93e5b391f805f956493ce7c",Article,Scopus,2-s2.0-0012919092
"Szalewicz, K., Kołos, W., Monkhorst, H.J., Jackson, C.","Effect of vibrations on the energy unresolved electron scattering by H <inf>2</inf> and D<inf>2</inf>",1983,"The Journal of Chemical Physics","80","4",,"1435","1439",,4,,"https://www.scopus.com/inward/record.uri?eid=2-s2.0-36549093657&partnerID=40&md5=4f6f9c516e045552b8eedb99ca05f780",Article,Scopus,2-s2.0-36549093657
"Szalewicz, K., Jeziorski, B., Monkhorst, H.J., Zabolitzky, J.G.","Atomic and molecular correlation energies with explicitly correlated Gaussian geminals. I. Second-order perturbation treatment for He, Be, H 2, and LiH",1983,"The Journal of Chemical Physics","78","3",,"1420","1430",,110,,"https://www.scopus.com/inward/record.uri?eid=2-s2.0-0000675546&partnerID=40&md5=137fd842d9462f39eaddb409d9219c78",Article,Scopus,2-s2.0-0000675546
"Kołos, W., Monkhorst, H.J., Szalewicz, K.","Generalized oscillator strengths for X-B transitions in the hydrogen molecule",1983,"Atomic Data and Nuclear Data Tables","28","2",,"239","263",,10,10.1016/0092-640X(83)90016-5,"https://www.scopus.com/inward/record.uri?eid=2-s2.0-0013239596&doi=10.1016%2f0092-640X%2883%2990016-5&partnerID=40&md5=86ac7a9f3b6a971cdb0dc34af5ac13e0",Review,Scopus,2-s2.0-0013239596
"Kołos, W., Monkhorst, H.J., Szalewicz, K.","Energy unresolved differential cross section for electron scattering by H<inf>2</inf>",1982,"The Journal of Chemical Physics","77","3",,"1323","1334",,48,,"https://www.scopus.com/inward/record.uri?eid=2-s2.0-0000160656&partnerID=40&md5=9888778dae90c44241542ed853735d23",Article,Scopus,2-s2.0-0000160656
"Kołos, W., Monkhorst, H.J., Szalewicz, K.","Inelastic high-energy electron scattering from a hydrogen molecule. I. X-B and X-E transitions",1982,"The Journal of Chemical Physics","77","3",,"1335","1344",,20,,"https://www.scopus.com/inward/record.uri?eid=2-s2.0-0013285302&partnerID=40&md5=2b05b56673b0d281170efaddfeebc021",Article,Scopus,2-s2.0-0013285302
"Szalewicz, K., Jeziorski, B., Monkhorst, H.J., Zabolitzky, J.G.","A new functional for variational calculation of atomic and molecular second-order correlation energies",1982,"Chemical Physics Letters","91","3",,"169","172",,52,10.1016/0009-2614(82)83634-8,"https://www.scopus.com/inward/record.uri?eid=2-s2.0-0347381412&doi=10.1016%2f0009-2614%2882%2983634-8&partnerID=40&md5=09b7cecc6275ead3a71bc0301531b482",Article,Scopus,2-s2.0-0347381412
"Monkhorst, H.J., Szalewicz, K.","Wave functions in momentum space. I. Iterative computation for the helium atom in Hartree-Fock approximation",1981,"The Journal of Chemical Physics","75","12",,"5782","5784",,16,,"https://www.scopus.com/inward/record.uri?eid=2-s2.0-0242282836&partnerID=40&md5=b94eae0504a73767afb9a829c842dd5d",Article,Scopus,2-s2.0-0242282836
"Szalewicz, K., Monkhorst, H.J.","On application of 0s orbitals in SCF calculations",1981,"The Journal of Chemical Physics","75","12",,"5785","5788",,56,,"https://www.scopus.com/inward/record.uri?eid=2-s2.0-0042713094&partnerID=40&md5=a04a6b47776bed9a0c91a8e1665cc0e3",Article,Scopus,2-s2.0-0042713094
"Jeziorski, B., Schwalm, W.A., Szalewicz, K.","Analytic continuation in exchange perturbation theory",1980,"The Journal of Chemical Physics","73","12",,"6215","6224",,53,,"https://www.scopus.com/inward/record.uri?eid=2-s2.0-0001018258&partnerID=40&md5=94b3419a8f421fe1cb81e518dbcba239",Article,Scopus,2-s2.0-0001018258
"Chałasińaski, G., Szalewicz, K.","Degenerate symmetry‐adapted perturbation theory. Convergence properties of perturbation expansions for excited states of H<inf>2</inf>+ ion",1980,"International Journal of Quantum Chemistry","18","4",,"1071","1089",,14,10.1002/qua.560180414,"https://www.scopus.com/inward/record.uri?eid=2-s2.0-84859401600&doi=10.1002%2fqua.560180414&partnerID=40&md5=8dbf3a06510688d2cca8d89c9b01a8e6",Article,Scopus,2-s2.0-84859401600
"Szalewicz, K., Adamowicz, L., Sadlej, A.J.","Molecular electric polarizabilities. CI and explicitly correlated electric-field-variant functions. Calculation of the polarizability of H<inf>2</inf>",1979,"Chemical Physics Letters","61","3",,"548","552",,22,10.1016/0009-2614(79)87170-5,"https://www.scopus.com/inward/record.uri?eid=2-s2.0-0344626066&doi=10.1016%2f0009-2614%2879%2987170-5&partnerID=40&md5=578c30c875e6c672da868cb5f2fd5a55",Article,Scopus,2-s2.0-0344626066
"Jeziorski, B., Szalewicz, K., Jaszuński, M.","Padé approximants and the convergence problem in the perturbation theory of intermolecular interactions",1979,"Chemical Physics Letters","61","2",,"391","395",,10,10.1016/0009-2614(79)80670-3,"https://www.scopus.com/inward/record.uri?eid=2-s2.0-26744465795&doi=10.1016%2f0009-2614%2879%2980670-3&partnerID=40&md5=7de0c647289729311e5b6d7d9a0a8bdf",Article,Scopus,2-s2.0-26744465795
"Jeziorski, B., Szalewicz, K.","High-accuracy Compton profile of molecular hydrogen from explicitly correlated Gaussian wave function",1979,"Physical Review A","19","6",,"2360","2365",,72,10.1103/PhysRevA.19.2360,"https://www.scopus.com/inward/record.uri?eid=2-s2.0-0001479130&doi=10.1103%2fPhysRevA.19.2360&partnerID=40&md5=1837bf450d40ab39aafef54b9db8c37e",Article,Scopus,2-s2.0-0001479130
"Szalewicz, K., Jeziorski, B.","Symmetry-adapted double-perturbation analysis of intramolecular correlation effects in weak intermolecular interactions: The he-he interaction",1979,"Molecular Physics","38","1",,"191","208",,185,10.1080/00268977900101601,"https://www.scopus.com/inward/record.uri?eid=2-s2.0-84947156464&doi=10.1080%2f00268977900101601&partnerID=40&md5=eaf53981316ca9866ffa9aecaf2f776e",Article,Scopus,2-s2.0-84947156464
"Jeziorski, B., Szalewicz, K., Chałasiński, G.","Symmetry forcing and convergence properties of perturbation expansions for molecular interaction energies",1978,"International Journal of Quantum Chemistry","14","3",,"271","287",,15,10.1002/qua.560140306,"https://www.scopus.com/inward/record.uri?eid=2-s2.0-84987159609&doi=10.1002%2fqua.560140306&partnerID=40&md5=7fd57f300d542609ab9733e1288e0794",Article,Scopus,2-s2.0-84987159609
"ChaŁasiŃsfski, G., Jeziorski, B., Andzelm, J., Szalewicz, K.","On the multipole structure of exchange dispersion energy in the interaction of two helium atoms",1977,"Molecular Physics","33","4",,"971","977",,44,10.1080/00268977700100881,"https://www.scopus.com/inward/record.uri?eid=2-s2.0-84863831923&doi=10.1080%2f00268977700100881&partnerID=40&md5=f645a2be0d001080357d8be58fef502e",Article,Scopus,2-s2.0-84863831923
"Chałasiński, G., Jeziorski, B., Szalewicz, K.","On the convergence properties of the Rayleigh–Schrödinger and the Hirschfelder–Silbey perturbation expansions for molecular interaction energies",1977,"International Journal of Quantum Chemistry","11","2",,"247","257",,12,10.1002/qua.560110205,"https://www.scopus.com/inward/record.uri?eid=2-s2.0-84987159562&doi=10.1002%2fqua.560110205&partnerID=40&md5=53b066f8aa7d215dbe527f8329636f7a",Article,Scopus,2-s2.0-84987159562
