Authors,Title,Year,Source title,Volume,Issue,Art. No.,Page start,Page end,Page count,Cited by,DOI,Link,Document Type,Source,EID
"Nguyen, T.H., Williams, S., Paustian, K.","Impact of ecosystem carbon stock change on greenhouse gas emissions and carbon payback periods of cassava-based ethanol in Vietnam",2017,"Biomass and Bioenergy","100",,,"126","137",,,10.1016/j.biombioe.2017.02.009,"https://www.scopus.com/inward/record.uri?eid=2-s2.0-85013213394&doi=10.1016%2fj.biombioe.2017.02.009&partnerID=40&md5=1eea97d9df0f71e77bedb17d1a746a45",Article,Scopus,2-s2.0-85013213394
"Minasny, B., Malone, B.P., McBratney, A.B., Angers, D.A., Arrouays, D., Chambers, A., Chaplot, V., Chen, Z.-S., Cheng, K., Das, B.S., Field, D.J., Gimona, A., Hedley, C.B., Hong, S.Y., Mandal, B., Marchant, B.P., Martin, M., McConkey, B.G., Mulder, V.L., O'Rourke, S., Richer-de-Forges, A.C., Odeh, I., Padarian, J., Paustian, K., Pan, G., Poggio, L., Savin, I., Stolbovoy, V., Stockmann, U., Sulaeman, Y., Tsui, C.-C., Vågen, T.-G., van Wesemael, B., Winowiecki, L.","Soil carbon 4 per mille",2017,"Geoderma","292",,,"59","86",,6,10.1016/j.geoderma.2017.01.002,"https://www.scopus.com/inward/record.uri?eid=2-s2.0-85009919368&doi=10.1016%2fj.geoderma.2017.01.002&partnerID=40&md5=8ea1baf4f6daef2d4bc9e2b0d7c6b27b",Review,Scopus,2-s2.0-85009919368
"Conant, R.T., Cerri, C.E.P., Osborne, B.B., Paustian, K.","Grassland management impacts on soil carbon stocks: A new synthesis: A",2017,"Ecological Applications","27","2",,"662","668",,,10.1002/eap.1473,"https://www.scopus.com/inward/record.uri?eid=2-s2.0-85014577096&doi=10.1002%2feap.1473&partnerID=40&md5=6edbc033b0e718741f3e97a0bc9b7096",Article,Scopus,2-s2.0-85014577096
"Álvaro-Fuentes, J., Arrúe, J.L., Bielsa, A., Cantero-Martínez, C., Plaza-Bonilla, D., Paustian, K.","Simulating climate change and land use effects on soil nitrous oxide emissions in Mediterranean conditions using the Daycent model",2017,"Agriculture, Ecosystems and Environment","238",,,"78","88",,1,10.1016/j.agee.2016.07.017,"https://www.scopus.com/inward/record.uri?eid=2-s2.0-84997824568&doi=10.1016%2fj.agee.2016.07.017&partnerID=40&md5=2305ef90a75ce7d006fe93474d96fb71",Article,Scopus,2-s2.0-84997824568
"Oliveira, D.M.D.S., Paustian, K., Cotrufo, M.F., Fiallos, A.R., Cerqueira, A.G., Cerri, C.E.P.","Assessing labile organic carbon in soils undergoing land use change in Brazil: A comparison of approaches",2017,"Ecological Indicators","72",,,"411","419",,2,10.1016/j.ecolind.2016.08.041,"https://www.scopus.com/inward/record.uri?eid=2-s2.0-84984854012&doi=10.1016%2fj.ecolind.2016.08.041&partnerID=40&md5=e5ab3277203b51147e097f52457bf406",Article,Scopus,2-s2.0-84984854012
"Silva-Olaya, A.M., Cerri, C.E.P., Williams, S., Cerri, C.C., Davies, C.A., Paustian, K.","Modelling SOC response to land use change and management practices in sugarcane cultivation in South-Central Brazil",2017,"Plant and Soil","410","1-2",,"483","498",,,10.1007/s11104-016-3030-y,"https://www.scopus.com/inward/record.uri?eid=2-s2.0-84986252837&doi=10.1007%2fs11104-016-3030-y&partnerID=40&md5=5714d3b6037bb0e7c0ae500713b189e1",Article,Scopus,2-s2.0-84986252837
"Minasny, B., Arrouays, D., McBratney, A., Angers, D.A., Chambers, A., Chaplot, V., Chen, Z.-S., Cheng, K., Das, B.S., Field, D.J., Gimona, A., Hedley, C., Hong, S.Y., Mandal, B., Malone, B.P., Marchant, B.P., Martin, M., McConkey, B.G., Mulder, V.L., O'Rourke, S., Richer-de-Forges, A.C., Odeh, I., Padarian, J., Paustian, K., Pan, G., Poggio, L., Savin, I., Stolbovoy, V., Stockmann, U., Sulaeman, Y., Tsui, C.-C., Vågen, T.-G., van Wesemael, B., Winowiecki, L.","Rejoinder to Comments on Minasny et al., 2017 Soil carbon 4 per mille Geoderma 292, 59-86",2017,"Geoderma",,,,"","",,,10.1016/j.geoderma.2017.05.026,"https://www.scopus.com/inward/record.uri?eid=2-s2.0-85021304417&doi=10.1016%2fj.geoderma.2017.05.026&partnerID=40&md5=41468fe512948277e2603ba7ec9d513c",Article in Press,Scopus,2-s2.0-85021304417
"Ogle, S.M., McCarl, B.A., Baker, J., Del Grosso, S.J., Adler, P.R., Paustian, K., Parton, W.J.","Managing the nitrogen cycle to reduce greenhouse gas emissions from crop production and biofuel expansion",2016,"Mitigation and Adaptation Strategies for Global Change","21","8",,"1197","1212",,,10.1007/s11027-015-9645-0,"https://www.scopus.com/inward/record.uri?eid=2-s2.0-84925422753&doi=10.1007%2fs11027-015-9645-0&partnerID=40&md5=08bf12595fba8b3492fa8bc7e27bf1e4",Article,Scopus,2-s2.0-84925422753
"Field, J.L., Marx, E., Easter, M., Adler, P.R., Paustian, K.","Ecosystem model parameterization and adaptation for sustainable cellulosic biofuel landscape design",2016,"GCB Bioenergy","8","6",,"1106","1123",,2,10.1111/gcbb.12316,"https://www.scopus.com/inward/record.uri?eid=2-s2.0-84952889242&doi=10.1111%2fgcbb.12316&partnerID=40&md5=db382ef254f2a08eb90cca810a778acb",Article,Scopus,2-s2.0-84952889242
"Ziegler, J., Easter, M., Swan, A., Brandle, J., Ballesteros, W., Domke, G., Chambers, A., Eve, M., Paustian, K.","A model for estimating windbreak carbon within COMET-Farm™",2016,"Agroforestry Systems","90","5",,"875","887",,,10.1007/s10457-016-9977-0,"https://www.scopus.com/inward/record.uri?eid=2-s2.0-84975157044&doi=10.1007%2fs10457-016-9977-0&partnerID=40&md5=9131b62e2a97c9ab85297c289c295376",Article,Scopus,2-s2.0-84975157044
"Campbell, E.E., Parton, W.J., Soong, J.L., Paustian, K., Hobbs, N.T., Cotrufo, M.F.","Using litter chemistry controls on microbial processes to partition litter carbon fluxes with the Litter Decomposition and Leaching (LIDEL) model",2016,"Soil Biology and Biochemistry","100",,,"160","174",,2,10.1016/j.soilbio.2016.06.007,"https://www.scopus.com/inward/record.uri?eid=2-s2.0-84975853015&doi=10.1016%2fj.soilbio.2016.06.007&partnerID=40&md5=5275ed09421c0062a8a81ebf7d99f974",Article,Scopus,2-s2.0-84975853015
"Oliveira, D.M.S., Paustian, K., Davies, C.A., Cherubin, M.R., Franco, A.L.C., Cerri, C.C., Cerri, C.E.P.","Soil carbon changes in areas undergoing expansion of sugarcane into pastures in south-central Brazil",2016,"Agriculture, Ecosystems and Environment","228",,,"38","48",,4,10.1016/j.agee.2016.05.005,"https://www.scopus.com/inward/record.uri?eid=2-s2.0-84969263635&doi=10.1016%2fj.agee.2016.05.005&partnerID=40&md5=9d1b662def1f35c7cc3ae294610252b2",Article,Scopus,2-s2.0-84969263635
"Milne, E., Aynekulu, E., Bationo, A., Batjes, N.H., Boone, R., Conant, R., Davies, J., Hanan, N., Hoag, D., Herrick, J.E., Knausenberger, W., Neely, C., Njoka, J., Ngugi, M., Parton, B., Paustian, K., Reid, R., Said, M., Shepherd, K., Swift, D., Thornton, P., Williams, S., Miller, S., Nkonya, E.","Grazing lands in Sub-Saharan Africa and their potential role in climate change mitigation: What we do and don't know",2016,"Environmental Development","19",,,"70","74",,1,10.1016/j.envdev.2016.06.001,"https://www.scopus.com/inward/record.uri?eid=2-s2.0-84991383890&doi=10.1016%2fj.envdev.2016.06.001&partnerID=40&md5=320b83b4f24be3f11f0ec74be7f3a522",Article,Scopus,2-s2.0-84991383890
"Nichols, K.L., Del Grosso, S.J., Derner, J.D., Follett, R.F., Archibeque, S.L., Stewart, C.E., Paustian, K.H.","Nitrous oxide and methane fluxes from cattle excrement on C3 pasture and C4-dominated shortgrass steppe",2016,"Agriculture, Ecosystems and Environment","225",,,"104","115",,2,10.1016/j.agee.2016.03.026,"https://www.scopus.com/inward/record.uri?eid=2-s2.0-84964317426&doi=10.1016%2fj.agee.2016.03.026&partnerID=40&md5=9e8e320c2b9593c35a416ad5eccbe64c",Article,Scopus,2-s2.0-84964317426
"Chambers, A., Lal, R., Paustian, K.","Soil carbon sequestration potential of US croplands and grasslands: Implementing the 4 per ThoUSAnd Initiative",2016,"Journal of Soil and Water Conservation","71","3",,"68A","74A",,5,10.2489/jswc.71.3.68A,"https://www.scopus.com/inward/record.uri?eid=2-s2.0-84968665586&doi=10.2489%2fjswc.71.3.68A&partnerID=40&md5=34f279ec2decad57d9d641df60c2b25b",Article,Scopus,2-s2.0-84968665586
"Lugato, E., Paustian, K., Panagos, P., Jones, A., Borrelli, P.","Quantifying the erosion effect on current carbon budget of European agricultural soils at high spatial resolution",2016,"Global Change Biology","22","5",,"1976","1984",,4,10.1111/gcb.13198,"https://www.scopus.com/inward/record.uri?eid=2-s2.0-84959218230&doi=10.1111%2fgcb.13198&partnerID=40&md5=095cc0e631d5c3712ebb7ab356d5281a",Article,Scopus,2-s2.0-84959218230
"Paustian, K., Lehmann, J., Ogle, S., Reay, D., Robertson, G.P., Smith, P.","Climate-smart soils",2016,"Nature","532","7597",,"49","57",,53,10.1038/nature17174,"https://www.scopus.com/inward/record.uri?eid=2-s2.0-84963615213&doi=10.1038%2fnature17174&partnerID=40&md5=2493ab43af690129b069e4f9b8fcaab0",Review,Scopus,2-s2.0-84963615213
"Smith, P., House, J.I., Bustamante, M., Sobocká, J., Harper, R., Pan, G., West, P.C., Clark, J.M., Adhya, T., Rumpel, C., Paustian, K., Kuikman, P., Cotrufo, M.F., Elliott, J.A., Mcdowell, R., Griffiths, R.I., Asakawa, S., Bondeau, A., Jain, A.K., Meersmans, J., Pugh, T.A.M.","Global change pressures on soils from land use and management",2016,"Global Change Biology","22","3",,"1008","1028",,31,10.1111/gcb.13068,"https://www.scopus.com/inward/record.uri?eid=2-s2.0-84959466542&doi=10.1111%2fgcb.13068&partnerID=40&md5=ec51326810ab5877f3f95026e6d93394",Article,Scopus,2-s2.0-84959466542
"Oliveira, D.M.S., Williams, S., Cerri, C.E.P., Paustian, K.","Predicting soil C changes over sugarcane expansion in Brazil using the DayCent model",2016,"GCB Bioenergy",,,,"","",,,10.1111/gcbb.12427,"https://www.scopus.com/inward/record.uri?eid=2-s2.0-85010674346&doi=10.1111%2fgcbb.12427&partnerID=40&md5=1a6306acf4483261609fafe4b6830ae0",Article in Press,Scopus,2-s2.0-85010674346
"Borrelli, P., Paustian, K., Panagos, P., Jones, A., Schütt, B., Lugato, E.","Effect of Good Agricultural and Environmental Conditions on erosion and soil organic carbon balance: A national case study",2016,"Land Use Policy","50",,,"408","421",,11,10.1016/j.landusepol.2015.09.033,"https://www.scopus.com/inward/record.uri?eid=2-s2.0-84945376931&doi=10.1016%2fj.landusepol.2015.09.033&partnerID=40&md5=58b9f6195a1d17801e3bddb3c9680568",Article,Scopus,2-s2.0-84945376931
"Campbell, E.E., Paustian, K.","Current developments in soil organic matter modeling and the expansion of model applications: A review",2015,"Environmental Research Letters","10","12", 123004,"","",,10,10.1088/1748-9326/10/12/123004,"https://www.scopus.com/inward/record.uri?eid=2-s2.0-84952939137&doi=10.1088%2f1748-9326%2f10%2f12%2f123004&partnerID=40&md5=ae32edb6199818f67137482f6deacbc7",Review,Scopus,2-s2.0-84952939137
"Wang, Y., Zhao, C., Ma, Q., Li, Y., Jing, H., Sun, T., Milne, E., Easter, M., Paustian, K., Au Yong, H.W., McDonagh, J.","Carbon benefits of wolfberry plantation on secondary saline land in Jingtai oasis, Gansu - A case study on application of the CBP model",2015,"Journal of Environmental Management","157",,,"303","310",,1,10.1016/j.jenvman.2015.04.020,"https://www.scopus.com/inward/record.uri?eid=2-s2.0-84928819565&doi=10.1016%2fj.jenvman.2015.04.020&partnerID=40&md5=3eb8d78cefe0559fc22243ac1b9ee0b2",Article,Scopus,2-s2.0-84928819565
"Boot, C.M., Haddix, M., Paustian, K., Cotrufo, M.F.","Distribution of black carbon in ponderosa pine forest floor and soils following the High Park wildfire",2015,"Biogeosciences","12","10",,"3029","3039",,6,10.5194/bg-12-3029-2015,"https://www.scopus.com/inward/record.uri?eid=2-s2.0-84930226838&doi=10.5194%2fbg-12-3029-2015&partnerID=40&md5=41d9bcd5224c65591ec9af5c203e6b9a",Article,Scopus,2-s2.0-84930226838
"Brandani, C.B., Abbruzzini, T.F., Williams, S., Easter, M., Pellegrino Cerri, C.E., Paustian, K.","Simulation of management and soil interactions impacting SOC dynamics in sugarcane using the CENTURY Model",2015,"GCB Bioenergy","7","4",,"646","657",,4,10.1111/gcbb.12175,"https://www.scopus.com/inward/record.uri?eid=2-s2.0-84931575655&doi=10.1111%2fgcbb.12175&partnerID=40&md5=93626df4ce046eb803cf15c3224fc9f9",Article,Scopus,2-s2.0-84931575655
"Manning, D.T., Means, P., Zimmerle, D., Galvin, K., Loomis, J., Paustian, K.","Using contingent behavior analysis to measure benefits from rural electrification in developing countries: An example from Rwanda",2015,"Energy Policy","86",,,"393","401",,2,10.1016/j.enpol.2015.06.032,"https://www.scopus.com/inward/record.uri?eid=2-s2.0-84943631644&doi=10.1016%2fj.enpol.2015.06.032&partnerID=40&md5=33d4c8a23f1df32bd6dd95b537c0af86",Article,Scopus,2-s2.0-84943631644
"Milne, E., Banwart, S.A., Noellemeyer, E., Abson, D.J., Ballabio, C., Bampa, F., Bationo, A., Batjes, N.H., Bernoux, M., Bhattacharyya, T., Black, H., Buschiazzo, D.E., Cai, Z., Cerri, C.E., Cheng, K., Compagnone, C., Conant, R., Coutinho, H.L.C., de Brogniez, D., Balieiro, F.D.C., Duffy, C., Feller, C., Fidalgo, E.C.C., da Silva, C.F., Funk, R., Gaudig, G., Gicheru, P.T., Goldhaber, M., Gottschalk, P., Goulet, F., Goverse, T., Grathwohl, P., Joosten, H., Kamoni, P.T., Kihara, J., Krawczynski, R., La Scala, N., Lemanceau, P., Li, L., Li, Z., Lugato, E., Maron, P.-A., Martius, C., Melillo, J., Montanarella, L., Nikolaidis, N., Nziguheba, G., Pan, G., Pascual, U., Paustian, K., Piñeiro, G., Powlson, D., Quiroga, A., Richter, D., Sigwalt, A., Six, J., Smith, J., Smith, P., Stocking, M., Tanneberger, F., Termansen, M., van Noordwijk, M., van Wesemael, B., Vargas, R., Victoria, R.L., Waswa, B., Werner, D., Wichmann, S., Wichtmann, W., Zhang, X., Zhao, Y., Zheng, J., Zheng, J.","Soil carbon, multiple benefits",2015,"Environmental Development","13",,,"33","38",,6,10.1016/j.envdev.2014.11.005,"https://www.scopus.com/inward/record.uri?eid=2-s2.0-84920844184&doi=10.1016%2fj.envdev.2014.11.005&partnerID=40&md5=b0bf3e93276611fad9b0d262941d147d",Article,Scopus,2-s2.0-84920844184
"Frazão, L.A., Paustian, K., Cerri, C.E.P., Cerri, C.C.","Soil carbon stocks under oil palm plantations in Bahia State, Brazil",2014,"Biomass and Bioenergy","62",,,"1","7",,3,10.1016/j.biombioe.2014.01.031,"https://www.scopus.com/inward/record.uri?eid=2-s2.0-84896713756&doi=10.1016%2fj.biombioe.2014.01.031&partnerID=40&md5=07cb2bf390f000e18fdcab68352f4079",Article,Scopus,2-s2.0-84896713756
"Six, J., Paustian, K.","Aggregate-associated soil organic matter as an ecosystem property and a measurement tool",2014,"Soil Biology and Biochemistry","68",,,"A4","A9",,92,10.1016/j.soilbio.2013.06.014,"https://www.scopus.com/inward/record.uri?eid=2-s2.0-84890239039&doi=10.1016%2fj.soilbio.2013.06.014&partnerID=40&md5=85833716ef0824e016f3fff10150aafc",Article,Scopus,2-s2.0-84890239039
"Paustian, K., Rumpel, C., Pan, G.","Enhancing carbon sequestration for mitigation and co-benefits in agriculture: Actions and novel practices",2014,"Carbon Management","5","2",,"127","129",,1,10.1080/17583004.2014.912829,"https://www.scopus.com/inward/record.uri?eid=2-s2.0-84921893342&doi=10.1080%2f17583004.2014.912829&partnerID=40&md5=cfc2924616c1b4c3f87c2bd6117b569a",Review,Scopus,2-s2.0-84921893342
"Campbell, E.E., Johnson, J.M.F., Jin, V.L., Lehman, R.M., Osborne, S.L., Varvel, G.E., Paustian, K.","Assessing the Soil Carbon, Biomass Production, and Nitrous Oxide Emission Impact of Corn Stover Management for Bioenergy Feedstock Production Using DAYCENT",2014,"Bioenergy Research","7","2",,"491","502",,10,10.1007/s12155-014-9414-z,"https://www.scopus.com/inward/record.uri?eid=2-s2.0-84899955379&doi=10.1007%2fs12155-014-9414-z&partnerID=40&md5=346d063ef5f6ea1556257903f7522017",Article,Scopus,2-s2.0-84899955379
"Sheehan, J.J., Adler, P.R., Del Grosso, S.J., Easter, M., Parton, W., Paustian, K., Williams, S.","To the editor",2014,"Nature Climate Change","4","11",,"932","933",,,10.1038/nclimate2403,"https://www.scopus.com/inward/record.uri?eid=2-s2.0-84908538102&doi=10.1038%2fnclimate2403&partnerID=40&md5=abc7a50f6fd73a509ba0839b4f4e545f",Letter,Scopus,2-s2.0-84908538102
"Basso, B., Gargiulo, O., Paustian, K., Robertson, G.P., Porter, C., Grace, P.R., Jones, J.W.","Erratum: Procedures for initializing organic carbon pools in the Dssatcentury model for agricultural systems",2014,"Soil Science Society of America Journal","78","4",,"1490","",,,10.2136/sssaj2010.0115er,"https://www.scopus.com/inward/record.uri?eid=2-s2.0-84906279611&doi=10.2136%2fsssaj2010.0115er&partnerID=40&md5=0ac6c2f54d2c2674a5076faa9bc3c53d",Erratum,Scopus,2-s2.0-84906279611
"Mello, F.F.C., Cerri, C.E.P., Davies, C.A., Holbrook, N.M., Paustian, K., Maia, S.M.F., Galdos, M.V., Bernoux, M., Cerri, C.C.","Payback time for soil carbon and sugar-cane ethanol",2014,"Nature Climate Change","4","7",,"605","609",,32,10.1038/nclimate2239,"https://www.scopus.com/inward/record.uri?eid=2-s2.0-84903486903&doi=10.1038%2fnclimate2239&partnerID=40&md5=620d3017dd17b1b19ced9a2668b507fb",Article,Scopus,2-s2.0-84903486903
"Ogle, S.M., Olander, L., Wollenberg, L., Rosenstock, T., Tubiello, F., Paustian, K., Buendia, L., Nihart, A., Smith, P.","Reducing greenhouse gas emissions and adapting agricultural management for climate change in developing countries: Providing the basis for action",2014,"Global Change Biology","20","1",,"1","6",,19,10.1111/gcb.12361,"https://www.scopus.com/inward/record.uri?eid=2-s2.0-84889691120&doi=10.1111%2fgcb.12361&partnerID=40&md5=5118cba917dafc5be2c4b9d2c5fedae3",Article,Scopus,2-s2.0-84889691120
"Pan, G., Huang, Z., Wang, J., Li, H., Chabbi, A., Paustian, K., Smith, P.","Conference Report: Soil organic matter dynamics: Beyond carbon: A report of the 4th International Symposium on Soil Organic Matter Dynamics",2013,"Carbon Management","4","5",,"485","489",,,10.4155/cmt.13.43,"https://www.scopus.com/inward/record.uri?eid=2-s2.0-84885195369&doi=10.4155%2fcmt.13.43&partnerID=40&md5=9fd50e7f87ed936659b0a4600ee299e2",Conference Paper,Scopus,2-s2.0-84885195369
"Suddick, E.C., Ngugi, M.K., Paustian, K., Six, J.","Monitoring soil carbon will prepare growers for a carbon trading system",2013,"California Agriculture","67","3",,"162","171",,2,10.3733/ca.v067n03p162,"https://www.scopus.com/inward/record.uri?eid=2-s2.0-84886886601&doi=10.3733%2fca.v067n03p162&partnerID=40&md5=50a96e89b4516134f1ed56162239e33a",Article,Scopus,2-s2.0-84886886601
"Frazão, L.A., Paustian, K., Pellegrino Cerri, C.E., Cerri, C.C.","Soil carbon stocks and changes after oil palm introduction in the Brazilian Amazon",2013,"GCB Bioenergy","5","4",,"384","390",,24,10.1111/j.1757-1707.2012.01196.x,"https://www.scopus.com/inward/record.uri?eid=2-s2.0-84878730334&doi=10.1111%2fj.1757-1707.2012.01196.x&partnerID=40&md5=cbd72dcd73e4e09f26196fa24f9bebdd",Article,Scopus,2-s2.0-84878730334
"Paustian, K.","Bridging the data gap: Engaging developing country farmers in greenhouse gas accounting",2013,"Environmental Research Letters","8","2", 021001,"","",,4,10.1088/1748-9326/8/2/021001,"https://www.scopus.com/inward/record.uri?eid=2-s2.0-84876500143&doi=10.1088%2f1748-9326%2f8%2f2%2f021001&partnerID=40&md5=d753ca435116b29e5022354a59bdb607",Review,Scopus,2-s2.0-84876500143
"Olander, L.P., Del Grosso, S., Haugen-Kozyra, K., César Izaurralde, R., Malin, D., Paustian, K., Salas, W.","Using biogeochemical process models to quantify greenhouse gas mitigation from agricultural management",2013,"Climate Change Mitigation and Agriculture",,,,"227","241",,,10.4324/9780203144510,"https://www.scopus.com/inward/record.uri?eid=2-s2.0-84920364902&doi=10.4324%2f9780203144510&partnerID=40&md5=afbe0b53c643fd3d6f4588ee18eb608a",Book Chapter,Scopus,2-s2.0-84920364902
"Milne, E., Neufeldt, H., Rosenstock, T., Smalligan, M., Cerri, C.E., Malin, D., Easter, M., Bernoux, M., Ogle, S., Casarim, F., Pearson, T., Bird, D.N., Steglich, E., Ostwald, M., Denef, K., Paustian, K.","Methods for the quantification of GHG emissions at the landscape level for developing countries in smallholder contexts",2013,"Environmental Research Letters","8","1", 015019,"","",,7,10.1088/1748-9326/8/1/015019,"https://www.scopus.com/inward/record.uri?eid=2-s2.0-84876196476&doi=10.1088%2f1748-9326%2f8%2f1%2f015019&partnerID=40&md5=1c7413abb7f72969f50b16f317c0fdbb",Article,Scopus,2-s2.0-84876196476
"Paustian, K., Schuler, J., Killian, K., Chambers, A., Del Grosso, S., Easter, M., Alvaro-Fuentes, J., Gurung, R., Johnson, G., Merwin, M., Ogle, S., Olson, C., Swan, A., Williams, S., Vining, R.","COMET2.0-Decision support system for agricultural greenhouse gas accounting",2012,"Managing Agricultural Greenhouse Gases",,,,"251","270",,1,10.1016/B978-0-12-386897-8.00015-2,"https://www.scopus.com/inward/record.uri?eid=2-s2.0-84882746271&doi=10.1016%2fB978-0-12-386897-8.00015-2&partnerID=40&md5=dbc5f1fc6edd77283f1a3106a371cccd",Book Chapter,Scopus,2-s2.0-84882746271
"Álvaro-Fuentes, J., Easter, M., Paustian, K.","Climate change effects on organic carbon storage in agricultural soils of northeastern Spain",2012,"Agriculture, Ecosystems and Environment","155",,,"87","94",,28,10.1016/j.agee.2012.04.001,"https://www.scopus.com/inward/record.uri?eid=2-s2.0-84860586907&doi=10.1016%2fj.agee.2012.04.001&partnerID=40&md5=14821fe9d472e1b3c7c68ead78cbe46d",Article,Scopus,2-s2.0-84860586907
"Paustian, K.","Agriculture, farmers and GHG mitigation: A new social network?",2012,"Carbon Management","3","3",,"253","257",,4,10.4155/cmt.12.23,"https://www.scopus.com/inward/record.uri?eid=2-s2.0-84861829067&doi=10.4155%2fcmt.12.23&partnerID=40&md5=49c9d33e93791c070285caa9cf828332",Note,Scopus,2-s2.0-84861829067
"Ogle, S.M., Swan, A., Paustian, K.","No-till management impacts on crop productivity, carbon input and soil carbon sequestration",2012,"Agriculture, Ecosystems and Environment","149",,,"37","49",,65,10.1016/j.agee.2011.12.010,"https://www.scopus.com/inward/record.uri?eid=2-s2.0-84855794618&doi=10.1016%2fj.agee.2011.12.010&partnerID=40&md5=42d8b6d1246c94b8bcb5ed571fac0d5f",Article,Scopus,2-s2.0-84855794618
"Lokupitiya, E., Paustian, K., Easter, M., Williams, S., Andrén, O., Kätterer, T.","Carbon balances in US croplands during the last two decades of the twentieth century",2012,"Biogeochemistry","107","1-3",,"207","225",,24,10.1007/s10533-010-9546-y,"https://www.scopus.com/inward/record.uri?eid=2-s2.0-83555176466&doi=10.1007%2fs10533-010-9546-y&partnerID=40&md5=bac3219981b00937f99b42f01d7a6361",Article,Scopus,2-s2.0-83555176466
"Grace, P.R., Antle, J., Aggarwal, P.K., Ogle, S., Paustian, K., Basso, B.","Soil carbon sequestration and associated economic costs for farming systems of the Indo-Gangetic Plain: A meta-analysis",2012,"Agriculture, Ecosystems and Environment","146","1",,"137","146",,17,10.1016/j.agee.2011.10.019,"https://www.scopus.com/inward/record.uri?eid=2-s2.0-81355138359&doi=10.1016%2fj.agee.2011.10.019&partnerID=40&md5=4f211aeff044860db3c64a14ec0eafea",Article,Scopus,2-s2.0-81355138359
"De Gryze, S., Lee, J., Ogle, S., Paustian, K., Six, J.","Assessing the potential for greenhouse gas mitigation in intensively managed annual cropping systems at the regional scale",2011,"Agriculture, Ecosystems and Environment","144","1",,"150","158",,17,10.1016/j.agee.2011.05.023,"https://www.scopus.com/inward/record.uri?eid=2-s2.0-80052867210&doi=10.1016%2fj.agee.2011.05.023&partnerID=40&md5=8ba7e39edcb8199761f00c309bb51296",Article,Scopus,2-s2.0-80052867210
"Álvaro-Fuentes, J., Easter, M., Cantero-Martinez, C., Paustian, K.","Modelling soil organic carbon stocks and their changes in the northeast of Spain",2011,"European Journal of Soil Science","62","5",,"685","695",,16,10.1111/j.1365-2389.2011.01390.x,"https://www.scopus.com/inward/record.uri?eid=2-s2.0-80052963871&doi=10.1111%2fj.1365-2389.2011.01390.x&partnerID=40&md5=7f589ea23a171f9b65ed5fffaf159766",Article,Scopus,2-s2.0-80052963871
"Conant, R.T., Ogle, S.M., Paul, E.A., Paustian, K.","Measuring and monitoring soil organic carbon stocks in agricultural lands for climate mitigation",2011,"Frontiers in Ecology and the Environment","9","3",,"169","173",,49,10.1890/090153,"https://www.scopus.com/inward/record.uri?eid=2-s2.0-79955426473&doi=10.1890%2f090153&partnerID=40&md5=72014ddc21fa6e0e50b624ebbbc596ec",Review,Scopus,2-s2.0-79955426473
"Gärdenäs, A.I., Ågren, G.I., Bird, J.A., Clarholm, M., Hallin, S., Ineson, P., Kätterer, T., Knicker, H., Nilsson, S.I., Näsholm, T., Ogle, S., Paustian, K., Persson, T., Stendahl, J.","Knowledge gaps in soil carbon and nitrogen interactions - From molecular to global scale",2011,"Soil Biology and Biochemistry","43","4",,"702","717",,100,10.1016/j.soilbio.2010.04.006,"https://www.scopus.com/inward/record.uri?eid=2-s2.0-79951721006&doi=10.1016%2fj.soilbio.2010.04.006&partnerID=40&md5=42abcd6ae3c73c89019daa2c0432995f",Review,Scopus,2-s2.0-79951721006
"Álvaro-Fuentes, J., Paustian, K.","Potential soil carbon sequestration in a semiarid Mediterranean agroecosystem under climate change: Quantifying management and climate effects",2011,"Plant and Soil","338","1",,"261","272",,36,10.1007/s11104-010-0304-7,"https://www.scopus.com/inward/record.uri?eid=2-s2.0-78650310876&doi=10.1007%2fs11104-010-0304-7&partnerID=40&md5=9a5fe0be4b406bc680f38b5df5cc87f1",Article,Scopus,2-s2.0-78650310876
"Cotrufo, M.F., Conant, R.T., Paustian, K.","Soil organic matter dynamics: Land use, management and global change",2011,"Plant and Soil","338","1",,"1","3",,14,10.1007/s11104-010-0617-6,"https://www.scopus.com/inward/record.uri?eid=2-s2.0-78650307696&doi=10.1007%2fs11104-010-0617-6&partnerID=40&md5=7ab9833209bb8b40befac71679df2454",Editorial,Scopus,2-s2.0-78650307696
"Basso, B., Gargiulo, O., Paustian, K., Philip Robertson, G., Porter, C., Grace, P.R., Jones, J.W.","Procedures for initializing soil organic carbon pools in the DSSAT-CENTURY model for agricultural systems",2011,"Soil Science Society of America Journal","75","1",,"69","78",,25,10.2136/sssaj2010.0115,"https://www.scopus.com/inward/record.uri?eid=2-s2.0-78751517441&doi=10.2136%2fsssaj2010.0115&partnerID=40&md5=981dd9a8d4e5a0c8d0561fa2314c37b9",Article,Scopus,2-s2.0-78751517441
