Authors,Title,Year,Source title,Volume,Issue,Art. No.,Page start,Page end,Page count,Cited by,DOI,Link,Document Type,Source,EID
"Campbell, C.A., Janzen, H.H., Paustian, K., Gregorich, E.G., Sherrod, L., Liang, B.C., Zentner, R.P.","Carbon storage in soils of the North American Great Plains: Effect of cropping frequency",2005,"Agronomy Journal","97","2",,"349","363",,47,,"https://www.scopus.com/inward/record.uri?eid=2-s2.0-15944385365&partnerID=40&md5=b722558c2cf9673c342cd6c617d4b596",Conference Paper,Scopus,2-s2.0-15944385365
"Zotarelli, L., Alves, B.J.R., Urquiaga, S., Torres, E., Dos Santos, H.P., Paustian, K., Boddey, R.M., Six, J.","Impact of tillage and crop rotation on aggregate-associated carbon in two oxisols",2005,"Soil Science Society of America Journal","69","2",,"482","491",,47,,"https://www.scopus.com/inward/record.uri?eid=2-s2.0-15744382272&partnerID=40&md5=ececeb47012015b722feeeecafdbe2de",Article,Scopus,2-s2.0-15744382272
"Ogle, S.M., Breidt, F.J., Paustian, K.","Agricultural management impacts on soil organic carbon storage under moist and dry climatic conditions of temperate and tropical regions",2005,"Biogeochemistry","72","1",,"87","121",,243,10.1007/s10533-004-0360-2,"https://www.scopus.com/inward/record.uri?eid=2-s2.0-19944419813&doi=10.1007%2fs10533-004-0360-2&partnerID=40&md5=756faf1863c8126d31a78df65f1b0777",Article,Scopus,2-s2.0-19944419813
"Bricklemyer, R.S., Miller, P.R., Paustian, K., Keck, T., Nielsen, G.A., Antle, J.M.","Soil organic carbon variability and sampling optimization in Montana dryland wheat fields",2005,"Journal of Soil and Water Conservation","60","1",,"42","51",,10,,"https://www.scopus.com/inward/record.uri?eid=2-s2.0-13744259192&partnerID=40&md5=d2dd942a21f50aa1df6c0b573d2545b7",Article,Scopus,2-s2.0-13744259192
"Capalbo, S.M., Antle, J.M., Mooney, S., Paustian, K.","Sensitivity of carbon sequestration costs to economic and biological uncertainties",2004,"Environmental Management","33","SUPPL. 1",,"S238","S251",,8,10.1007/s00267-003-9134-1,"https://www.scopus.com/inward/record.uri?eid=2-s2.0-27544483186&doi=10.1007%2fs00267-003-9134-1&partnerID=40&md5=6785bff2363b7be2161fcc064ba93193",Article,Scopus,2-s2.0-27544483186
"Mooney, S., Antle, J., Capalbo, S., Paustian, K.","Influence of project scale and carbon variability on the costs of measuring soil carbon credits",2004,"Environmental Management","33","SUPPL. 1",,"S252","S263",,13,10.1007/s00267-003-9135-0,"https://www.scopus.com/inward/record.uri?eid=2-s2.0-13944282532&doi=10.1007%2fs00267-003-9135-0&partnerID=40&md5=93461142d003a583950ef450cd596334",Article,Scopus,2-s2.0-13944282532
"Cerri, C.E.P., Cerri, C.C., Paustian, K., Bernoux, M., Mellilo, J.M.","Combining soil C and N spatial variability and modeling approaches for measuring and monitoring soil carbon sequestration",2004,"Environmental Management","33","SUPPL. 1",,"S274","S288",,14,10.1007/s00267-003-9137-y,"https://www.scopus.com/inward/record.uri?eid=2-s2.0-27544512661&doi=10.1007%2fs00267-003-9137-y&partnerID=40&md5=949adc15185755b48a2fd4d1e338f739",Article,Scopus,2-s2.0-27544512661
"Denef, K., Six, J., Merckx, R., Paustian, K.","Carbon sequestration in microaggregates of no-tillage soils with different clay mineralogy",2004,"Soil Science Society of America Journal","68","6",,"1935","1944",,153,,"https://www.scopus.com/inward/record.uri?eid=2-s2.0-4143063475&partnerID=40&md5=b2c36999ada6173621187eb0152442e3",Article,Scopus,2-s2.0-4143063475
"Mooney, S., Antle, J., Capalbo, S., Paustian, K.","Design and costs of a measurement protocol for trades in soil carbon credits",2004,"Canadian Journal of Agricultural Economics","52","3",,"257","287",,28,10.1111/j.1744-7976.2004.tb00370.x,"https://www.scopus.com/inward/record.uri?eid=2-s2.0-13944251810&doi=10.1111%2fj.1744-7976.2004.tb00370.x&partnerID=40&md5=1fd0f1e1b3e3051eccdbb5fa246a63c3",Article,Scopus,2-s2.0-13944251810
"Cerri, C.E.P., Bernoux, M., Chaplot, V., Volkoff, B., Victoria, R.L., Melillo, J.M., Paustian, K., Cerri, C.C.","Assessment of soil property spatial variation in an Amazon pasture: Basis for selecting an agronomic experimental area",2004,"Geoderma","123","1-2",,"51","68",,49,10.1016/j.geoderma.2004.01.027,"https://www.scopus.com/inward/record.uri?eid=2-s2.0-5444227645&doi=10.1016%2fj.geoderma.2004.01.027&partnerID=40&md5=b34f92fdb010c58061fd91fb3e3138a0",Article,Scopus,2-s2.0-5444227645
"Conant, R.T., Six, J., Paustian, K.","Land use effects on soil carbon fractions in the southeastern United States. II. Changes in soil carbon fractions along a forest to pasture chronosequence",2004,"Biology and Fertility of Soils","40","3",,"194","200",,36,10.1007/s00374-004-0754-2,"https://www.scopus.com/inward/record.uri?eid=2-s2.0-4444259018&doi=10.1007%2fs00374-004-0754-2&partnerID=40&md5=3f2c23b9ac1275c968daf4aa08f4e26f",Article,Scopus,2-s2.0-4444259018
"Degryze, S., Six, J., Paustian, K., Morris, S.J., Paul, E.A., Merckx, R.","Soil organic carbon pool changes following land-use conversions",2004,"Global Change Biology","10","7",,"1120","1132",,183,10.1111/j.1365-2486.2004.00786.x,"https://www.scopus.com/inward/record.uri?eid=2-s2.0-3242725655&doi=10.1111%2fj.1365-2486.2004.00786.x&partnerID=40&md5=b5aab87b8c49114d4901d7b3726afa35",Article,Scopus,2-s2.0-3242725655
"Antle, J.M., Capalbo, S.M., Elliott, E.T., Paustian, K.H.","Adaptation, spatial heterogeneity, and the vulnerability of agricultural systems to climate change and CO2 fertilization: An integrated assessment approach",2004,"Climatic Change","64","3",,"289","315",,55,10.1023/B:CLIM.0000025748.49738.93,"https://www.scopus.com/inward/record.uri?eid=2-s2.0-3343001220&doi=10.1023%2fB%3aCLIM.0000025748.49738.93&partnerID=40&md5=b52425346242e80aa5621f3a8d5c2c14",Review,Scopus,2-s2.0-3343001220
"Sheehan, J., Aden, A., Paustian, K., Killian, K., Brenner, J., Walsh, M., Nelson, R.","Energy and environmental aspects of using corn stover for fuel ethanol",2004,"Journal of Industrial Ecology","7","3-4",,"117","146",,339,10.1162/108819803323059433,"https://www.scopus.com/inward/record.uri?eid=2-s2.0-2342533751&doi=10.1162%2f108819803323059433&partnerID=40&md5=656ba705514d64f140b4d155b37b6156",Review,Scopus,2-s2.0-2342533751
"Cerri, C.E.P., Paustian, K., Bernoux, M., Victoria, R.L., Melillo, J.M., Cerri, C.C.","Modeling changes in soil organic matter in Amazon forest to pasture conversion with the Century model",2004,"Global Change Biology","10","5",,"815","832",,56,10.1111/j.1365-2486.2004.00759.x,"https://www.scopus.com/inward/record.uri?eid=2-s2.0-2642560503&doi=10.1111%2fj.1365-2486.2004.00759.x&partnerID=40&md5=78d8a801ba266b03d73f1ba2cda311e8",Article,Scopus,2-s2.0-2642560503
"Conant, R.T., Paustian, K.","Grassland management activity data: Current sources and future needs",2004,"Environmental Management","33","4",,"467","473",,8,,"https://www.scopus.com/inward/record.uri?eid=2-s2.0-3042778329&partnerID=40&md5=358ca5b93babc2aba20fc3c2e2f84d14",Conference Paper,Scopus,2-s2.0-3042778329
"Ogle, S.M., Conant, R.T., Paustian, K.","Deriving grassland management factors for a carbon accounting method developed by the intergovernmental panel on climate change",2004,"Environmental Management","33","4",,"474","484",,41,,"https://www.scopus.com/inward/record.uri?eid=2-s2.0-3042742138&partnerID=40&md5=3ea0dbdd5bddd9450fc5e0984524b74a",Conference Paper,Scopus,2-s2.0-3042742138
"Six, J., Ogle, S.M., Breidt, F.J., Conant, R.T., Mosiers, A.R., Paustian, K.","The potential to mitigate global warming with no-tillage management is only realized when practised in the long term",2004,"Global Change Biology","10","2",,"155","160",,406,10.1111/j.1529-8817.2003.00730.x,"https://www.scopus.com/inward/record.uri?eid=2-s2.0-1642529675&doi=10.1111%2fj.1529-8817.2003.00730.x&partnerID=40&md5=8f3979293bbfe9627fd58495939dc458",Article,Scopus,2-s2.0-1642529675
"Paul, E.A., Collins, H.P., Paustian, K., Elliott, E.T., Frey, S., Juma, N., Janzen, H., Campbell, C.A., Zentner, R.P., Lafond, G.P., Moulin, A.P.","Management effects on the dynamics and storage rates of organic matter in long-term crop rotations",2004,"Canadian Journal of Soil Science","84","1",,"49","61",,19,,"https://www.scopus.com/inward/record.uri?eid=2-s2.0-2442473185&partnerID=40&md5=5b6608b9fdc1999a6e15634a07886b17",Article,Scopus,2-s2.0-2442473185
"Ogle, S.M., Breidt, F.J., Eve, M.D., Paustian, K.","Uncertainty in estimating land use and management impacts on soil organic carbon storage for US agricultural lands between 1982 and 1997",2003,"Global Change Biology","9","11",,"1521","1542",,124,10.1046/j.1365-2486.2003.00683.x,"https://www.scopus.com/inward/record.uri?eid=2-s2.0-0344494603&doi=10.1046%2fj.1365-2486.2003.00683.x&partnerID=40&md5=75a63ad1be797dd50f15d158c48b8c39",Article,Scopus,2-s2.0-0344494603
"Conant, R.T., Six, J., Paustian, K.","Land use effects on soil carbon fractions in the southeastern United States. I. Management-intensive versus extensive grazing",2003,"Biology and Fertility of Soils","38","6",,"386","392",,71,10.1007/s00374-003-0652-z,"https://www.scopus.com/inward/record.uri?eid=2-s2.0-0242370093&doi=10.1007%2fs00374-003-0652-z&partnerID=40&md5=474d8ffd34056721a105aae31a2dced5",Article,Scopus,2-s2.0-0242370093
"Paul, E.A., Morris, S.J., Six, J., Paustian, K., Gregorich, E.G.","Interpretation of soil carbon and nitrogen dynamics in agricultural and afforested soils",2003,"Soil Science Society of America Journal","67","5",,"1620","1628",,75,,"https://www.scopus.com/inward/record.uri?eid=2-s2.0-0141456198&partnerID=40&md5=d251b34c63ccdd68a70f728f2c4e1f15",Conference Paper,Scopus,2-s2.0-0141456198
"Antle, J., Capalbo, S., Mooney, S., Elliott, E., Paustian, K.","Spatial heterogeneity, contract design, and the efficiency of carbon sequestration policies for agriculture",2003,"Journal of Environmental Economics and Management","46","2",,"231","250",,105,10.1016/S0095-0696(02)00038-4,"https://www.scopus.com/inward/record.uri?eid=2-s2.0-0042922588&doi=10.1016%2fS0095-0696%2802%2900038-4&partnerID=40&md5=8a81589962c3a3b598149678b8aa4f20",Article,Scopus,2-s2.0-0042922588
"Hunt, H.W., Antle, J.M., Paustian, K.","False determinations of chaos in short noisy time series",2003,"Physica D: Nonlinear Phenomena","180","1-2",,"115","127",,10,10.1016/S0167-2789(03)00044-7,"https://www.scopus.com/inward/record.uri?eid=2-s2.0-0038623881&doi=10.1016%2fS0167-2789%2803%2900044-7&partnerID=40&md5=3d23a2e7c4c7253c0185f39c69544428",Article,Scopus,2-s2.0-0038623881
"Sperow, M., Eve, M., Paustian, K.","Potential soil C sequestration on U.S. agricultural soils",2003,"Climatic Change","57","3",,"319","339",,92,10.1023/A:1022888832630,"https://www.scopus.com/inward/record.uri?eid=2-s2.0-0037384229&doi=10.1023%2fA%3a1022888832630&partnerID=40&md5=cb5255c1ae47e2e8668f50fb2f832c21",Article,Scopus,2-s2.0-0037384229
"Reilly, J., Tubiello, F., McCarl, B., Abler, D., Darwin, R., Fuglie, K., Hollinger, S., Izaurralde, C., Jagtap, S., Jones, J., Mearns, L., Ojima, D., Paul, E., Paustian, K., Riha, S., Rosenberg, N., Rosenzweig, C.","U.S. Agriculture and climate change: New results",2003,"Climatic Change","57","1-2",,"43","69",,153,10.1023/A:1022103315424,"https://www.scopus.com/inward/record.uri?eid=2-s2.0-0037371002&doi=10.1023%2fA%3a1022103315424&partnerID=40&md5=a4651733dffb1469b24803279e30f160",Article,Scopus,2-s2.0-0037371002
"Conant, R.T., Smith, G.R., Paustian, K.","Spatial variability of soil carbon in forested and cultivated sites: Implications for change detection",2003,"Journal of Environmental Quality","32","1",,"278","286",,96,,"https://www.scopus.com/inward/record.uri?eid=2-s2.0-0037231676&partnerID=40&md5=aaa165879b9009ffa3d28dbdffd46217",Article,Scopus,2-s2.0-0037231676
"Conant, R.T., Paustian, K.","Potential soil carbon sequestration in overgrazed grassland ecosystems",2002,"Global Biogeochemical Cycles","16","4",,"90","1 - 90-9",,93,,"https://www.scopus.com/inward/record.uri?eid=2-s2.0-20244370686&partnerID=40&md5=f78d6e37524b40b9dcd94b100f1c2002",Article,Scopus,2-s2.0-20244370686
"Six, J., Callewaert, P., Lenders, S., De Gryz, S., Morris, S.J., Gregorich, E.G., Paul, E.A., Paustian, K.","Measuring and understanding carbon storage in afforested soils by physical fractionation",2002,"Soil Science Society of America Journal","66","6",,"1981","1987",,275,,"https://www.scopus.com/inward/record.uri?eid=2-s2.0-0036852935&partnerID=40&md5=d14f5006fb92858011598d0bf9791ebd",Article,Scopus,2-s2.0-0036852935
"Denef, K., Six, J., Merckx, R., Paustian, K.","Short-term effects of biological and physical forces on aggregate formation in soils with different clay mineralogy",2002,"Plant and Soil","246","2",,"185","200",,101,10.1023/A:1020668013524,"https://www.scopus.com/inward/record.uri?eid=2-s2.0-0012171414&doi=10.1023%2fA%3a1020668013524&partnerID=40&md5=b2e8cd160d2465f09a835b0651f3928e",Article,Scopus,2-s2.0-0012171414
"Antle, J.M., Capalbo, S.M., Mooney, S., Elliott, E.T., Paustian, K.H.","A comparative examination of the efficiency of sequestering carbon in US agricultural soils",2002,"American Journal of Alternative Agriculture","17","3",,"109","115",,16,,"https://www.scopus.com/inward/record.uri?eid=2-s2.0-0036732389&partnerID=40&md5=2493924e1ceeae373a9bcf57c097bae2",Article,Scopus,2-s2.0-0036732389
"Six, J., Conant, R.T., Paul, E.A., Paustian, K.","Stabilization mechanisms of soil organic matter: Implications for C-saturation of soils",2002,"Plant and Soil","241","2",,"155","176",,1381,10.1023/A:1016125726789,"https://www.scopus.com/inward/record.uri?eid=2-s2.0-0036326452&doi=10.1023%2fA%3a1016125726789&partnerID=40&md5=f60a82c293ab12c32b30b5fdd3e59e02",Review,Scopus,2-s2.0-0036326452
"Mayer, B., Boyer, E.W., Goodale, C., Jaworski, N.A., Van Breemen, N., Howarth, R.W., Seitzinger, S., Billen, G., Lajtha, K., Nadelhoffer, K., Van Dam, D., Hetling, L.J., Nosal, M., Paustian, K.","Sources of nitrate in rivers draining sixteen watersheds in the northeastern U.S.: Isotopic constraints",2002,"Biogeochemistry","57-58",,,"171","197",,242,10.1023/A:1015744002496,"https://www.scopus.com/inward/record.uri?eid=2-s2.0-10744225107&doi=10.1023%2fA%3a1015744002496&partnerID=40&md5=11fbf198c00beae2fb2637e028a6fd74",Conference Paper,Scopus,2-s2.0-10744225107
"Van Breemen, N., Boyer, E.W., Goodale, C.L., Jaworski, N.A., Paustian, K., Seitzinger, S.P., Lajtha, K., Mayer, B., Van Dam, D., Howarth, R.W., Nadelhoffer, K.J., Eve, M., Billen, G.","Where did all the nitrogen go? Fate of nitrogen inputs to large watersheds in the northeastern U.S.A.",2002,"Biogeochemistry","57-58",,,"267","293",,223,10.1023/A:1015775225913,"https://www.scopus.com/inward/record.uri?eid=2-s2.0-18444362735&doi=10.1023%2fA%3a1015775225913&partnerID=40&md5=6c87fb6ef848b6652675593f8ed7e927",Article,Scopus,2-s2.0-18444362735
"Eve, M.D., Sperow, M., Howerton, K., Paustian, K., Follett, R.F.","Predicted impact of management changes on soil carbon storage for each cropland region of the conterminous United States",2002,"Journal of Soil and Water Conservation","57","4",,"196","204",,42,,"https://www.scopus.com/inward/record.uri?eid=2-s2.0-0036629832&partnerID=40&md5=e3acc274e44ebf5ed9dd3d1ca7ef1871",Review,Scopus,2-s2.0-0036629832
"Conant, R.T., Paustian, K.","Spatial variability of soil organic carbon in grasslands: Implications for detecting change at different scales",2002,"Environmental Pollution","116","SUPPL. 1",,"S127","S135",,93,10.1016/S0269-7491(01)00265-2,"https://www.scopus.com/inward/record.uri?eid=2-s2.0-0036148942&doi=10.1016%2fS0269-7491%2801%2900265-2&partnerID=40&md5=fe3003d0871259b90433b278fe83fae5",Article,Scopus,2-s2.0-0036148942
"Eve, M.D., Sperow, M., Paustian, K., Follett, R.F.","National-scale estimation of changes in soil carbon stocks on agricultural lands",2002,"Environmental Pollution","116","3",,"431","438",,49,10.1016/S0269-7491(01)00220-2,"https://www.scopus.com/inward/record.uri?eid=2-s2.0-0036131930&doi=10.1016%2fS0269-7491%2801%2900220-2&partnerID=40&md5=70bf0b40a7d501a8a42fe1d4fed4040d",Conference Paper,Scopus,2-s2.0-0036131930
"Antle, J., Capalbo, S., Mooney, S., Elliott, E.T., Paustian, K.H.","Sensitivity of carbon sequestration costs to soil carbon rates",2002,"Environmental Pollution","116","3",,"413","422",,24,10.1016/S0269-7491(01)00218-4,"https://www.scopus.com/inward/record.uri?eid=2-s2.0-0036131920&doi=10.1016%2fS0269-7491%2801%2900218-4&partnerID=40&md5=2c7a6ccf540fd6ee9116bb87c5ddfe82",Conference Paper,Scopus,2-s2.0-0036131920
"Denef, K., Six, J., Paustian, K., Merckx, R.","Importance of macroaggregate dynamics in controlling soil carbon stabilization: Short-term effects of physical disturbance induced by dry-wet cycles",2001,"Soil Biology and Biochemistry","33","15",,"2145","2153",,140,10.1016/S0038-0717(01)00153-5,"https://www.scopus.com/inward/record.uri?eid=2-s2.0-0035206375&doi=10.1016%2fS0038-0717%2801%2900153-5&partnerID=40&md5=17bffcdb322bc7bd906dc69420f4b7a7",Article,Scopus,2-s2.0-0035206375
"Antle, J.M., Capalbo, S.M., Mooney, S., Elliott, E.T., Paustian, K.H.","Economic Analysis of Agricultural Soil Carbon Sequestration: An Integrated Assessment Approach",2001,"Journal of Agricultural and Resource Economics","26","2",,"344","367",,62,,"https://www.scopus.com/inward/record.uri?eid=2-s2.0-0035563370&partnerID=40&md5=6dca922680d1a22c48b90cd3eda33084",Article,Scopus,2-s2.0-0035563370
"Six, J., Guggenberger, G., Paustian, K., Haumaier, L., Elliott, E.T., Zech, W.","Sources and composition of soil organic matter fractions between and within soil aggregates",2001,"European Journal of Soil Science","52","4",,"607","618",,149,10.1046/j.1365-2389.2001.00406.x,"https://www.scopus.com/inward/record.uri?eid=2-s2.0-0035677308&doi=10.1046%2fj.1365-2389.2001.00406.x&partnerID=40&md5=40e669b73aff1ff79cd83d051f9d57bc",Article,Scopus,2-s2.0-0035677308
"Antle, J.M., Capalbo, S.M., Elliott, E.T., Hunt, H.W., Mooney, S., Paustian, K.H.","Research needs for understanding and predicting the behavior of managed ecosystems: Lessons from the study of agroecosystems",2001,"Ecosystems","4","8",,"723","735",,36,10.1007/s10021-001-0041-0,"https://www.scopus.com/inward/record.uri?eid=2-s2.0-0035689835&doi=10.1007%2fs10021-001-0041-0&partnerID=40&md5=2dd089e1af9b7726df248ceb290f9a5d",Conference Paper,Scopus,2-s2.0-0035689835
"Frey, S.D., Gupta, V.V.S.R., Elliott, E.T., Paustian, K.","Protozoan grazing affects estimates of carbon utilization efficiency of the soil microbial community",2001,"Soil Biology and Biochemistry","33","12-13",,"1759","1768",,44,10.1016/S0038-0717(01)00101-8,"https://www.scopus.com/inward/record.uri?eid=2-s2.0-0034790341&doi=10.1016%2fS0038-0717%2801%2900101-8&partnerID=40&md5=529165a5103a61e31d745b3e131ae356",Article,Scopus,2-s2.0-0034790341
"Denef, K., Six, J., Bossuyt, H., Frey, S.D., Elliott, E.T., Merckx, R., Paustian, K.","Influence of dry-wet cycles on the interrelationship between aggregate, particulate organic matter, and microbial community dynamics",2001,"Soil Biology and Biochemistry","33","12-13",,"1599","1611",,312,10.1016/S0038-0717(01)00076-1,"https://www.scopus.com/inward/record.uri?eid=2-s2.0-0034797323&doi=10.1016%2fS0038-0717%2801%2900076-1&partnerID=40&md5=017640c5867e52310f1c612d08bc470a",Article,Scopus,2-s2.0-0034797323
"Conant, R.T., Paustian, K., Elliott, E.T.","Grassland management and conversion into grassland: Effects on soil carbon",2001,"Ecological Applications","11","2",,"343","355",,644,,"https://www.scopus.com/inward/record.uri?eid=2-s2.0-0035065678&partnerID=40&md5=253e7b4661d9cb3b2eb37fd872172b5a",Article,Scopus,2-s2.0-0035065678
"Bossuyt, H., Denef, K., Six, J., Frey, S.D, Merckx, R., Paustian, K.","Influence of microbial populations and residue quality on aggregate stability",2001,"Applied Soil Ecology","16","3",,"195","208",,202,10.1016/S0929-1393(00)00116-5,"https://www.scopus.com/inward/record.uri?eid=2-s2.0-0035103908&doi=10.1016%2fS0929-1393%2800%2900116-5&partnerID=40&md5=f99e48bf335893cb4e3752271df25dd8",Article,Scopus,2-s2.0-0035103908
"Six, J., Elliott, E.T., Paustian, K.","Soil macroaggregate turnover and microaggregate formation: A mechanism for C sequestration under no-tillage agriculture",2000,"Soil Biology and Biochemistry","32","14",,"2099","2103",,943,10.1016/S0038-0717(00)00179-6,"https://www.scopus.com/inward/record.uri?eid=2-s2.0-0034509260&doi=10.1016%2fS0038-0717%2800%2900179-6&partnerID=40&md5=3e2fca29f4b1c20e43a508f4ad31a654",Article,Scopus,2-s2.0-0034509260
"Six, J., Merckx, R., Kimpe, K., Paustian, K., Elliott, E.T.","A re-evaluation of the enriched labile soil organic matter fraction",2000,"European Journal of Soil Science","51","2",,"283","293",,50,10.1046/j.1365-2389.2000.00304.x,"https://www.scopus.com/inward/record.uri?eid=2-s2.0-0034092425&doi=10.1046%2fj.1365-2389.2000.00304.x&partnerID=40&md5=3525bcb2fb6d00d89624a87b7a76cf43",Article,Scopus,2-s2.0-0034092425
"Frey, S.D., Elliott, E.T., Paustian, K., Peterson, G.A.","Fungal translocation as a mechanism for soil nitrogen inputs to surface residue decomposition in a no-tillage agroecosystem",2000,"Soil Biology and Biochemistry","32","5",,"689","698",,126,10.1016/S0038-0717(99)00205-9,"https://www.scopus.com/inward/record.uri?eid=2-s2.0-0034118819&doi=10.1016%2fS0038-0717%2899%2900205-9&partnerID=40&md5=b7ac219029c4ab988830c9e4399c9170",Article,Scopus,2-s2.0-0034118819
"Six, J., Elliott, E.T., Paustian, K.","Soil structure and soil organic matter: II. A normalized stability index and the effect of mineralogy",2000,"Soil Science Society of America Journal","64","3",,"1042","1049",,184,,"https://www.scopus.com/inward/record.uri?eid=2-s2.0-0034194748&partnerID=40&md5=f8fae36833ad715211678d59f649bef1",Article,Scopus,2-s2.0-0034194748
"Six, J., Paustian, K., Elliott, E.T., Combrink, C.","Soil structure and organic matter: I. Distribution of aggregate-size classes and aggregate-associated carbon",2000,"Soil Science Society of America Journal","64","2",,"681","689",,572,,"https://www.scopus.com/inward/record.uri?eid=2-s2.0-0034163132&partnerID=40&md5=9d237d22a767e659886f65accc2111a8",Article,Scopus,2-s2.0-0034163132
"Collins, H.P., Elliott, E.T., Paustian, K., Bundy, L.G., Dick, W.A., Huggins, D.R., Smucker, A.J.M., Paul, E.A.","Soil carbon pools and fluxes in long-term Corn Belt agroecosystems",2000,"Soil Biology and Biochemistry","32","2",,"157","168",,184,10.1016/S0038-0717(99)00136-4,"https://www.scopus.com/inward/record.uri?eid=2-s2.0-0033963910&doi=10.1016%2fS0038-0717%2899%2900136-4&partnerID=40&md5=03867fede1ece8099d090d7433ee77d9",Article,Scopus,2-s2.0-0033963910
"Paustian, K., Six, J., Elliott, E.T., Hunt, H.W.","Management options for reducing CO<inf>2</inf> emissions from agricultural soils",2000,"Biogeochemistry","48","1",,"147","163",,421,10.1023/A:1006271331703,"https://www.scopus.com/inward/record.uri?eid=2-s2.0-0033979564&doi=10.1023%2fA%3a1006271331703&partnerID=40&md5=b39343ede13f62242ceeed3e4ed77581",Article,Scopus,2-s2.0-0033979564
"Six, J., Elliott, E.T., Paustian, K.","Aggregate and soil organic matter dynamics under conventional and no-tillage systems",1999,"Soil Science Society of America Journal","63","5",,"1350","1358",,673,,"https://www.scopus.com/inward/record.uri?eid=2-s2.0-0032757929&partnerID=40&md5=43e55c093603d6b6cbf3e604a9f366c3",Article,Scopus,2-s2.0-0032757929
"Guggenberger, G., Frey, S.D., Six, J., Paustian, K., Elliott, E.T.","Bacterial and fungal cell-wall residues in conventional and no-tillage agroecosystems",1999,"Soil Science Society of America Journal","63","5",,"1188","1198",,195,,"https://www.scopus.com/inward/record.uri?eid=2-s2.0-0032730510&partnerID=40&md5=de8f8eab9349367148e4fd45c1fe84dd",Article,Scopus,2-s2.0-0032730510
"Frey, S.D., Elliott, E.T., Paustian, K.","Bacterial and fungal abundance and biomass in conventional and no-tillage agroecosystems along two climatic gradients",1999,"Soil Biology and Biochemistry","31","4",,"573","585",,339,10.1016/S0038-0717(98)00161-8,"https://www.scopus.com/inward/record.uri?eid=2-s2.0-0033033017&doi=10.1016%2fS0038-0717%2898%2900161-8&partnerID=40&md5=99a0801ec6716dc594ecf5880d9f0770",Article,Scopus,2-s2.0-0033033017
"Guggenberger, G., Elliott, E.T., Frey, S.D., Six, J., Paustian, K.","Microbial contributions to the aggregation of a cultivated grassland soil amended with starch",1999,"Soil Biology and Biochemistry","31","3",,"407","419",,64,10.1016/S0038-0717(98)00143-6,"https://www.scopus.com/inward/record.uri?eid=2-s2.0-0033065145&doi=10.1016%2fS0038-0717%2898%2900143-6&partnerID=40&md5=05d4b1ea7679762015fc4f4a14f4a86c",Article,Scopus,2-s2.0-0033065145
"Bruce, J.P., Frome, M., Haites, E., Janzen, H., Lal, R., Paustian, K.","Carbon sequestration in soils",1999,"Journal of Soil and Water Conservation","54","1",,"382","389",,232,,"https://www.scopus.com/inward/record.uri?eid=2-s2.0-0033434104&partnerID=40&md5=d5b554c5da73cbec084b9c4006e2d69a",Review,Scopus,2-s2.0-0033434104
"Frey, S.D., Elliott, E.T., Paustian, K.","Application of the hexokinase-glucose-6-phosphate dehydrogenase enzymatic assay for measurement of glucose in amended soil",1999,"Soil Biology and Biochemistry","31","6",,"933","935",,6,10.1016/S0038-0717(98)00176-X,"https://www.scopus.com/inward/record.uri?eid=2-s2.0-0032892802&doi=10.1016%2fS0038-0717%2898%2900176-X&partnerID=40&md5=10bde0a5c5e1a55a9f66a191bdde94f2",Article,Scopus,2-s2.0-0032892802
"Whalen, J.K., Paustian, K.H., Parmelee, R.W.","Simulation of growth and flux of carbon and nitrogen through earthworms",1999,"Pedobiologia","43","6",,"537","546",,7,,"https://www.scopus.com/inward/record.uri?eid=2-s2.0-0033398183&partnerID=40&md5=cdf8f61b28ca5e9b00fd5452744a2d47",Article,Scopus,2-s2.0-0033398183
