Authors,Title,Year,Source title,Volume,Issue,Art. No.,Page start,Page end,Page count,Cited by,DOI,Link,Document Type,Source,EID
"Somers, W., Bogaerts, A., Van Duin, A.C.T., Huygh, S., Bal, K.M., Neyts, E.C.","Temperature influence on the reactivity of plasma species on a nickel catalyst surface: An atomic scale study",2013,"Catalysis Today","211",,,"131","136",,17,10.1016/j.cattod.2013.02.010,"https://www.scopus.com/inward/record.uri?eid=2-s2.0-84879210202&doi=10.1016%2fj.cattod.2013.02.010&partnerID=40&md5=337a893234c31c137a5bafb6c3fe80a5",Article,Scopus,2-s2.0-84879210202
"Senftle, T.P., Meyer, R.J., Janik, M.J., Van Duin, A.C.T.","Development of a ReaxFF potential for Pd/O and application to palladium oxide formation",2013,"Journal of Chemical Physics","139","4", 044109,"","",,23,10.1063/1.4815820,"https://www.scopus.com/inward/record.uri?eid=2-s2.0-84903362833&doi=10.1063%2f1.4815820&partnerID=40&md5=44a9ef873ac8699e2c519516e49c966f",Article,Scopus,2-s2.0-84903362833
"Verners, O., Shin, Y.K., Van Duin, A.C.T.","Molecular dynamics simulation of Al grain mixing in Fe/Ni matrices and its influence on oxidation",2013,"Journal of Applied Physics","114","2", 023501,"","",,1,10.1063/1.4812387,"https://www.scopus.com/inward/record.uri?eid=2-s2.0-84880379760&doi=10.1063%2f1.4812387&partnerID=40&md5=a0fad429888ce292fd785b69b08cc9fb",Conference Paper,Scopus,2-s2.0-84880379760
"Kim, S.-Y., Van Duin, A.C.T.","Simulation of titanium metal/titanium dioxide etching with chlorine and hydrogen chloride gases using the ReaxFF reactive force field",2013,"Journal of Physical Chemistry A","117","27",,"5655","5663",,6,10.1021/jp4031943,"https://www.scopus.com/inward/record.uri?eid=2-s2.0-84880169848&doi=10.1021%2fjp4031943&partnerID=40&md5=f66055186b1fb32ca5527874bdeff29a",Article,Scopus,2-s2.0-84880169848
"Liang, T., Shin, Y.K., Cheng, Y.-T., Yilmaz, D.E., Vishnu, K.G., Verners, O., Zou, C., Phillpot, S.R., Sinnott, S.B., Van Duin, A.C.T.","Reactive potentials for advanced atomistic simulations",2013,"Annual Review of Materials Research","43",,,"109","129",,49,10.1146/annurev-matsci-071312-121610,"https://www.scopus.com/inward/record.uri?eid=2-s2.0-84880216933&doi=10.1146%2fannurev-matsci-071312-121610&partnerID=40&md5=5cfafb7098c061eee30496208cfb4628",Review,Scopus,2-s2.0-84880216933
"Kim, S.-Y., Kumar, N., Persson, P., Sofo, J., Van Duin, A.C.T., Kubicki, J.D.","Development of a ReaxFF reactive force field for titanium dioxide/water systems",2013,"Langmuir","29","25",,"7838","7846",,29,10.1021/la4006983,"https://www.scopus.com/inward/record.uri?eid=2-s2.0-84879548063&doi=10.1021%2fla4006983&partnerID=40&md5=2c042b479b69ea536cb8ece7ef4f5c4a",Article,Scopus,2-s2.0-84879548063
"Bryantsev, V.S., Giordani, V., Walker, W., Uddin, J., Lee, I., Van Duin, A.C.T., Chase, G.V., Addison, D.","Investigation of fluorinated amides for solid-electrolyte interphase stabilization in Li-O2 batteries using amide-based electrolytes",2013,"Journal of Physical Chemistry C","117","23",,"11977","11988",,22,10.1021/jp402844r,"https://www.scopus.com/inward/record.uri?eid=2-s2.0-84879118970&doi=10.1021%2fjp402844r&partnerID=40&md5=f49ec3bc6aab800cdeb15b91e8ec2c69",Article,Scopus,2-s2.0-84879118970
"Raju, M., Kim, S.-Y., Van Duin, A.C.T., Fichthorn, K.A.","ReaxFF reactive force field study of the dissociation of water on titania surfaces",2013,"Journal of Physical Chemistry C","117","20",,"10558","10572",,43,10.1021/jp402139h,"https://www.scopus.com/inward/record.uri?eid=2-s2.0-84878135513&doi=10.1021%2fjp402139h&partnerID=40&md5=3cd0daa70f2bdb43d404f57bee1e7777",Article,Scopus,2-s2.0-84878135513
"Khalilov, U., Pourtois, G., Huygh, S., Van Duin, A.C.T., Neyts, E.C., Bogaerts, A.","New mechanism for oxidation of native silicon oxide",2013,"Journal of Physical Chemistry C","117","19",,"9819","9825",,11,10.1021/jp400433u,"https://www.scopus.com/inward/record.uri?eid=2-s2.0-84878056507&doi=10.1021%2fjp400433u&partnerID=40&md5=03899bead7200ccb196ccad99c0f1b6a",Article,Scopus,2-s2.0-84878056507
"Poovathingal, S., Schwartzentruber, T.E., Srinivasan, S.G., Van Duin, A.C.T.","Large scale computational chemistry modeling of the oxidation of highly oriented pyrolytic graphite",2013,"Journal of Physical Chemistry A","117","13",,"2692","2703",,17,10.1021/jp3125999,"https://www.scopus.com/inward/record.uri?eid=2-s2.0-84875864862&doi=10.1021%2fjp3125999&partnerID=40&md5=faf0e609ee6db0e0041f3de556a8e9e3",Article,Scopus,2-s2.0-84875864862
"Castro-Marcano, F., van Duin, A.C.T.","Comparison of thermal and catalytic cracking of 1-heptene from ReaxFF reactive molecular dynamics simulations",2013,"Combustion and Flame","160","4",,"766","775",,15,10.1016/j.combustflame.2012.12.007,"https://www.scopus.com/inward/record.uri?eid=2-s2.0-84874327281&doi=10.1016%2fj.combustflame.2012.12.007&partnerID=40&md5=02d544e203d3d3da2e0ef645cafb3280",Article,Scopus,2-s2.0-84874327281
"Singh, S.K., Srinivasan, S.G., Neek-Amal, M., Costamagna, S., Van Duin, A.C.T., Peeters, F.M.","Thermal properties of fluorinated graphene",2013,"Physical Review B - Condensed Matter and Materials Physics","87","10", 104114,"","",,32,10.1103/PhysRevB.87.104114,"https://www.scopus.com/inward/record.uri?eid=2-s2.0-84875723747&doi=10.1103%2fPhysRevB.87.104114&partnerID=40&md5=e33d8d6995cf42ae9fa4a197d5af4186",Article,Scopus,2-s2.0-84875723747
"Yusupov, M., Bogaerts, A., Huygh, S., Snoeckx, R., Van Duin, A.C.T., Neyts, E.C.","Plasma-induced destruction of bacterial cell wall components: A reactive molecular dynamics simulation",2013,"Journal of Physical Chemistry C","117","11",,"5993","5998",,39,10.1021/jp3128516,"https://www.scopus.com/inward/record.uri?eid=2-s2.0-84875414905&doi=10.1021%2fjp3128516&partnerID=40&md5=b805c3681578c5f40f0492ee9da0b8ba",Article,Scopus,2-s2.0-84875414905
"Yang, H., Huang, X., Liang, W., Van Duin, A.C.T., Raju, M., Zhang, S.","Self-weakening in lithiated graphene electrodes",2013,"Chemical Physics Letters","563",,,"58","62",,16,10.1016/j.cplett.2013.01.048,"https://www.scopus.com/inward/record.uri?eid=2-s2.0-84874937019&doi=10.1016%2fj.cplett.2013.01.048&partnerID=40&md5=8cc7f49ef6298c27d081fa647a89e488",Article,Scopus,2-s2.0-84874937019
"Newsome, D.A., Sengupta, D., Van Duin, A.C.T.","High-temperature oxidation of SiC-based composite: Rate constant calculation from ReaxFF MD simulations, Part II",2013,"Journal of Physical Chemistry C","117","10",,"5014","5027",,7,10.1021/jp307680t,"https://www.scopus.com/inward/record.uri?eid=2-s2.0-84875239199&doi=10.1021%2fjp307680t&partnerID=40&md5=819b420d2cef62b616f40f41cea07824",Article,Scopus,2-s2.0-84875239199
"Gouissem, A., Fan, W., Van Duin, A.C.T., Sharma, P.","A reactive force-field for Zirconium and Hafnium Di-Boride",2013,"Computational Materials Science","70",,,"171","177",,2,10.1016/j.commatsci.2012.12.038,"https://www.scopus.com/inward/record.uri?eid=2-s2.0-84873681065&doi=10.1016%2fj.commatsci.2012.12.038&partnerID=40&md5=945cc65f946c55eb963dcd3e614e3ad7",Article,Scopus,2-s2.0-84873681065
"Kim, S.-Y., Van Duin, A.C.T., Kubicki, J.D.","Molecular dynamics simulations of the interactions between TiO<inf>2</inf> nanoparticles and water with Na+ and Cl-, methanol, and formic acid using a reactive force field",2013,"Journal of Materials Research","28","3",,"513","520",,13,10.1557/jmr.2012.367,"https://www.scopus.com/inward/record.uri?eid=2-s2.0-84873316391&doi=10.1557%2fjmr.2012.367&partnerID=40&md5=a5d9edd77268316be3b9389a59dfcea9",Article,Scopus,2-s2.0-84873316391
"Jeon, B., Van Overmeere, Q., Van Duin, A.C.T., Ramanathan, S.","Nanoscale oxidation and complex oxide growth on single crystal iron surfaces and external electric field effects",2013,"Physical Chemistry Chemical Physics","15","6",,"1821","1830",,11,10.1039/c2cp43490c,"https://www.scopus.com/inward/record.uri?eid=2-s2.0-84872742715&doi=10.1039%2fc2cp43490c&partnerID=40&md5=f8537554f3ce0fec7e29e92c6db14dd1",Article,Scopus,2-s2.0-84872742715
"Neyts, E.C., Ostrikov, K., Han, Z.J., Kumar, S., Van Duin, A.C.T., Bogaerts, A.","Defect healing and enhanced nucleation of carbon nanotubes by low-energy ion bombardment",2013,"Physical Review Letters","110","6", 065501,"","",,32,10.1103/PhysRevLett.110.065501,"https://www.scopus.com/inward/record.uri?eid=2-s2.0-84873438174&doi=10.1103%2fPhysRevLett.110.065501&partnerID=40&md5=b4452c5a1791c7fe62a1d8b508e40183",Article,Scopus,2-s2.0-84873438174
"Sen, F.G., Qi, Y., Van Duin, A.C.T., Alpas, A.T.","Oxidation induced softening in Al nanowires",2013,"Applied Physics Letters","102","5", 051912,"","",,13,10.1063/1.4790181,"https://www.scopus.com/inward/record.uri?eid=2-s2.0-84874066795&doi=10.1063%2f1.4790181&partnerID=40&md5=877d8f24e0e52e5032d337c96f852057",Article,Scopus,2-s2.0-84874066795
"Parsons, N., Levin, D.A., Van Duin, A.C.T.","Molecular dynamics based chemistry models of hypervelocity collisions of O(3P) + SO<inf>2</inf>(X, 1A<inf>1</inf>) in DSMC",2013,"Journal of Chemical Physics","138","4", 044316,"","",,4,10.1063/1.4775481,"https://www.scopus.com/inward/record.uri?eid=2-s2.0-84873600859&doi=10.1063%2f1.4775481&partnerID=40&md5=7cbb302cdb5fe5e5460337895d88369b",Article,Scopus,2-s2.0-84873600859
"Paupitz, R., Autreto, P.A.S., Legoas, S.B., Srinivasan, S.G., Van Duin, A.C.T., Galvão, D.S.","Graphene to fluorographene and fluorographane: A theoretical study",2013,"Nanotechnology","24","3", 035706,"","",,36,10.1088/0957-4484/24/3/035706,"https://www.scopus.com/inward/record.uri?eid=2-s2.0-84871546671&doi=10.1088%2f0957-4484%2f24%2f3%2f035706&partnerID=40&md5=9d769364aff23cc6007138ba8fb9aebc",Article,Scopus,2-s2.0-84871546671
"Huang, L., Bandosz, T., Joshi, K.L., Van Duin, A.C.T., Gubbins, K.E.","Reactive adsorption of ammonia and ammonia/water on CuBTC metal-organic framework: A ReaxFF molecular dynamics simulation",2013,"Journal of Chemical Physics","138","3", 034102,"","",,11,10.1063/1.4774332,"https://www.scopus.com/inward/record.uri?eid=2-s2.0-84872790508&doi=10.1063%2f1.4774332&partnerID=40&md5=a560ba2a6b177161ba56fcff22671a04",Article,Scopus,2-s2.0-84872790508
"Khalilov, U., Pourtois, G., Bogaerts, A., Van Duin, A.C.T., Neyts, E.C.","Reactive molecular dynamics simulations on SiO&lt;inf&gt;2&lt;/inf&gt;-coated ultra-small Si-nanowires",2013,"Nanoscale","5","2",,"719","725",,9,10.1039/c2nr32387g,"https://www.scopus.com/inward/record.uri?eid=2-s2.0-84871805681&doi=10.1039%2fc2nr32387g&partnerID=40&md5=a0fd629b00021b5cb84e048a811b9264",Article,Scopus,2-s2.0-84871805681
"Weismiller, M.R., Russo Jr., M.F., Van Duin, A.C.T., Yetter, R.A.","Using molecular dynamics simulations with a ReaxFF reactive force field to develop a kinetic mechanism for ammonia borane oxidation",2013,"Proceedings of the Combustion Institute","34","2",,"3489","3497",,3,10.1016/j.proci.2012.06.030,"https://www.scopus.com/inward/record.uri?eid=2-s2.0-84872048523&doi=10.1016%2fj.proci.2012.06.030&partnerID=40&md5=9172ed227e80859a0288fc23393fab5d",Article,Scopus,2-s2.0-84872048523
"Kulkarni, A.D., Truhlar, D.G., Goverapet Srinivasan, S., Van Duin, A.C.T., Norman, P., Schwartzentruber, T.E.","Oxygen interactions with silica surfaces: Coupled cluster and density functional investigation and the development of a new ReaxFF potential",2013,"Journal of Physical Chemistry C","117","1",,"258","269",,21,10.1021/jp3086649,"https://www.scopus.com/inward/record.uri?eid=2-s2.0-84872388993&doi=10.1021%2fjp3086649&partnerID=40&md5=084f8e695b523e45a78cdc2fad728e88",Article,Scopus,2-s2.0-84872388993
"Rygg, A.D., van Duin, A.C., Craven, B.A.","Molecular dynamics simulations of water/mucus partition coefficients for feeding stimulants in fish and the implications for olfaction",2013,"PloS one","8","9",,"e72271","",,1,10.1371/journal.pone.0072271,"https://www.scopus.com/inward/record.uri?eid=2-s2.0-84927565525&doi=10.1371%2fjournal.pone.0072271&partnerID=40&md5=56dd497738f3140b775f5837d0637b8a",Article,Scopus,2-s2.0-84927565525
"Jacobs, I., Van Duin, A.C.T., Kleij, A.W., Kuil, M., Tooke, D.M., Spek, A.L., Reek, J.N.H.","Conformational studies of ligand-template assemblies and the consequences for encapsulation of rhodium complexes and hydroformylation catalysis",2013,"Catalysis Science and Technology","3","8",,"1955","1963",,2,10.1039/c3cy20665c,"https://www.scopus.com/inward/record.uri?eid=2-s2.0-84880015730&doi=10.1039%2fc3cy20665c&partnerID=40&md5=60daeb5e6704322ead8b7ddb6674f639",Article,Scopus,2-s2.0-84880015730
"Shin, Y.K., Kwak, H., Zou, C., Vasenkov, A.V., Van Duin, A.C.T.","Development and validation of a ReaxFF reactive force field for Fe/Al/Ni alloys: Molecular dynamics study of elastic constants, diffusion, and segregation",2012,"Journal of Physical Chemistry A","116","49",,"12163","12174",,20,10.1021/jp308507x,"https://www.scopus.com/inward/record.uri?eid=2-s2.0-84871008901&doi=10.1021%2fjp308507x&partnerID=40&md5=ee426d231cb5676b4f64130fc2a5d28d",Article,Scopus,2-s2.0-84871008901
"Liu, Y., Zybin, S.V., Guo, J., Van Duin, A.C.T., Goddard, W.A.","Reactive dynamics study of hypergolic bipropellants: Monomethylhydrazine and dinitrogen tetroxide",2012,"Journal of Physical Chemistry B","116","48",,"14136","14145",,7,10.1021/jp308351g,"https://www.scopus.com/inward/record.uri?eid=2-s2.0-84870786130&doi=10.1021%2fjp308351g&partnerID=40&md5=f5ae7d95883c7a943134d9dbbc4574ff",Article,Scopus,2-s2.0-84870786130
"Assowe, O., Politano, O., Vignal, V., Arnoux, P., Diawara, B., Verners, O., Van Duin, A.C.T.","Reactive molecular dynamics of the initial oxidation stages of Ni(111) in pure water: Effect of an applied electric field",2012,"Journal of Physical Chemistry A","116","48",,"11796","11805",,16,10.1021/jp306932a,"https://www.scopus.com/inward/record.uri?eid=2-s2.0-84870846767&doi=10.1021%2fjp306932a&partnerID=40&md5=3723dbc0cd1e5bec0f9e5d23ed35bfb0",Article,Scopus,2-s2.0-84870846767
"Kwak, H., Shin, Y.K., Van Duin, A.C.T., Vasenkov, A.V.","Ab initio based multiscale modeling of alloy surface segregation",2012,"Journal of Physics Condensed Matter","24","48", 485006,"","",,1,10.1088/0953-8984/24/48/485006,"https://www.scopus.com/inward/record.uri?eid=2-s2.0-84869034123&doi=10.1088%2f0953-8984%2f24%2f48%2f485006&partnerID=40&md5=d5061bb98fda74fc02ae193d1cd1b00d",Article,Scopus,2-s2.0-84869034123
"Zou, C., Van Duin, A.","Investigation of complex iron surface catalytic chemistry using the ReaxFF reactive force field method",2012,"JOM","64","12",,"1426","1437",,7,10.1007/s11837-012-0463-5,"https://www.scopus.com/inward/record.uri?eid=2-s2.0-84869873091&doi=10.1007%2fs11837-012-0463-5&partnerID=40&md5=bef3f156763adecc9417be57d9538de3",Article,Scopus,2-s2.0-84869873091
"Zhang, B., Van Duin, A.C.T., Johnson, J.K.","Development of reaxff force field for carbon dioxide capture with ionic liquids: A combined first principles and classical simulation",2012,"29th Annual International Pittsburgh Coal Conference 2012, PCC 2012","2",,,"932","941",,,,"https://www.scopus.com/inward/record.uri?eid=2-s2.0-84877632881&partnerID=40&md5=50bfd0162e886b2d922ff11ad9df86f0",Conference Paper,Scopus,2-s2.0-84877632881
"Castro-Marcano, F., Van Duin, A.C.T., Mathews, J.P.","ReaxFF molecular dynamics pyrolysis simulations of a large-scale model of Illinois no. 6 coal including the role of organic sulfur",2012,"29th Annual International Pittsburgh Coal Conference 2012, PCC 2012","3",,,"1964","1974",,3,,"https://www.scopus.com/inward/record.uri?eid=2-s2.0-84877593829&partnerID=40&md5=47cf961e1b864c2ff51144bee4d2783b",Conference Paper,Scopus,2-s2.0-84877593829
"Kwak, H., Shin, Y., Van Duin, A.C.T., Vasenkov, A.V.","Ab initio multiscale modeling of alloy surface segregation",2012,"Materials Science and Technology Conference and Exhibition 2012, MS and T 2012","1",,,"662","668",,,,"https://www.scopus.com/inward/record.uri?eid=2-s2.0-84875776277&partnerID=40&md5=792d36a4ae6d1fd426f6e677b2e454a4",Conference Paper,Scopus,2-s2.0-84875776277
"Parsons, N., Levin, D.A., van Duin, A.C.T.","Analysis of molecular dynamics based chemistry models for DSMC simulation of the atmosphere of Io",2012,"43rd AIAA Thermophysics Conference 2012",,,,"","",,1,,"https://www.scopus.com/inward/record.uri?eid=2-s2.0-84880777579&partnerID=40&md5=e06674ff1036d9ea3e91ff69a93f0891",Conference Paper,Scopus,2-s2.0-84880777579
"Parsons, N., Levin, D.A., Van Duin, A.C.T.","Development of a chemistry model for DSMC simulation of the atmosphere of Io",2012,"50th AIAA Aerospace Sciences Meeting Including the New Horizons Forum and Aerospace Exposition",,, AIAA 2012-0227,"","",,1,10.2514/6.2012-227,"https://www.scopus.com/inward/record.uri?eid=2-s2.0-84862287820&doi=10.2514%2f6.2012-227&partnerID=40&md5=999d9bc0400311705a9d242525c27287",Conference Paper,Scopus,2-s2.0-84862287820
"Parsons, N., Levin, D.A., Van Duin, A.C.T.","Development of a chemistry model for DSMC simulation of the atmosphere of Io using molecular dynamics",2012,"AIP Conference Proceedings","1501","1",,"579","586",,,10.1063/1.4769594,"https://www.scopus.com/inward/record.uri?eid=2-s2.0-84873121237&doi=10.1063%2f1.4769594&partnerID=40&md5=09f4de048f947fa09168c2b45db9b53e",Conference Paper,Scopus,2-s2.0-84873121237
"Khalilov, U., Pourtois, G., Van Duin, A.C.T., Neyts, E.C.","On the c -Si| a -SiO 2 interface in hyperthermal Si oxidation at room temperature",2012,"Journal of Physical Chemistry C","116","41",,"21856","21863",,18,10.1021/jp306920p,"https://www.scopus.com/inward/record.uri?eid=2-s2.0-84867492494&doi=10.1021%2fjp306920p&partnerID=40&md5=245e9da558dc2fe69f9d3c5e8d0525d7",Article,Scopus,2-s2.0-84867492494
"Somers, W., Bogaerts, A., Van Duin, A.C.T., Neyts, E.C.","Plasma species interacting with nickel surfaces: Toward an atomic scale understanding of plasma-catalysis",2012,"Journal of Physical Chemistry C","116","39",,"20958","20965",,24,10.1021/jp307380w,"https://www.scopus.com/inward/record.uri?eid=2-s2.0-84867177651&doi=10.1021%2fjp307380w&partnerID=40&md5=62f69293c208834e0d2f2b20e058ddb8",Article,Scopus,2-s2.0-84867177651
"Yusupov, M., Neyts, E.C., Khalilov, U., Snoeckx, R., Van Duin, A.C.T., Bogaerts, A.","Atomic-scale simulations of reactive oxygen plasma species interacting with bacterial cell walls",2012,"New Journal of Physics","14",, 093043,"","",,34,10.1088/1367-2630/14/9/093043,"https://www.scopus.com/inward/record.uri?eid=2-s2.0-84866977690&doi=10.1088%2f1367-2630%2f14%2f9%2f093043&partnerID=40&md5=a64ac25a3c7cdd4a28033f1296ff5c5d",Article,Scopus,2-s2.0-84866977690
"Nomura, K., Kalia, R.K., Nakano, A., Vashishta, P., Van Duin, A.C.T.","Mechanochemistry of shock-induced nanobubble collapse near silica in water",2012,"Applied Physics Letters","101","7", 073108,"","",,3,10.1063/1.4746270,"https://www.scopus.com/inward/record.uri?eid=2-s2.0-84865411397&doi=10.1063%2f1.4746270&partnerID=40&md5=9b82beca53dd4ccca9fbd3be51159202",Article,Scopus,2-s2.0-84865411397
"Hubin, P.O., Jacquemin, D., Leherte, L., André, J.-M., van Duin, A.C.T., Vercauteren, D.P.","Ab initio quantum chemical and ReaxFF-based study of the intramolecular iminium-enamine conversion in a proline-catalyzed reaction",2012,"Theoretical Chemistry Accounts","131","8",,"1","11",,2,10.1007/s00214-012-1261-4,"https://www.scopus.com/inward/record.uri?eid=2-s2.0-84864773637&doi=10.1007%2fs00214-012-1261-4&partnerID=40&md5=450c9ea0b0c065087be4221cb91867c0",Article,Scopus,2-s2.0-84864773637
"Newsome, D.A., Sengupta, D., Foroutan, H., Russo, M.F., Van Duin, A.C.T.","Oxidation of silicon carbide by O <inf>2</inf> and H <inf>2</inf>O: A ReaxFF reactive molecular dynamics study, part i",2012,"Journal of Physical Chemistry C","116","30",,"16111","16121",,45,10.1021/jp306391p,"https://www.scopus.com/inward/record.uri?eid=2-s2.0-84864468597&doi=10.1021%2fjp306391p&partnerID=40&md5=f8e5715427c746cbfeafcb9c7b2d8b66",Article,Scopus,2-s2.0-84864468597
"Vasenkov, A., Newsome, D., Verners, O., Russo Jr., M.F., Zaharieva, R., Van Duin, A.C.T.","Reactive molecular dynamics study of Mo-based alloys under high-pressure, high-temperature conditions",2012,"Journal of Applied Physics","112","1", 013511,"","",,4,10.1063/1.4731793,"https://www.scopus.com/inward/record.uri?eid=2-s2.0-84864121251&doi=10.1063%2f1.4731793&partnerID=40&md5=75d0e1bffef657e21c102edeb203a396",Article,Scopus,2-s2.0-84864121251
"Zou, C., Van Duin, A.C.T., Sorescu, D.C.","Theoretical investigation of hydrogen adsorption and dissociation on iron and iron carbide surfaces using the ReaxFF reactive force field method",2012,"Topics in Catalysis","55","5-6",,"391","401",,13,10.1007/s11244-012-9796-0,"https://www.scopus.com/inward/record.uri?eid=2-s2.0-84866142464&doi=10.1007%2fs11244-012-9796-0&partnerID=40&md5=811dff0a5f67f84a458f5a54dfcf10d5",Conference Paper,Scopus,2-s2.0-84866142464
"Aktulga, H.M., Pandit, S.A., Van Duin, A.C.T., Grama, A.Y.","Reactive molecular dynamics: Numerical methods and algorithmic techniques",2012,"SIAM Journal on Scientific Computing","34","1",,"C1","C23",,18,10.1137/100808599,"https://www.scopus.com/inward/record.uri?eid=2-s2.0-84861403772&doi=10.1137%2f100808599&partnerID=40&md5=b0fc6bcfe1d3712c9db9d4cf7b373cd3",Article,Scopus,2-s2.0-84861403772
"Huang, X., Yang, H., Van Duin, A.C.T., Hsia, K.J., Zhang, S.","Chemomechanics control of tearing paths in graphene",2012,"Physical Review B - Condensed Matter and Materials Physics","85","19", 195453,"","",,15,10.1103/PhysRevB.85.195453,"https://www.scopus.com/inward/record.uri?eid=2-s2.0-84861672470&doi=10.1103%2fPhysRevB.85.195453&partnerID=40&md5=2bac1536d910be71bcbf54e595c92c01",Article,Scopus,2-s2.0-84861672470
"Krishnasamy Bharathi, A., Kamat, A., Van Duin, A.C.T.","Study of effect of water vapor and mechanical strain on thermal conductivity of zinc oxide using the ReaxFF reactive force field",2012,"Computational and Theoretical Chemistry","987",,,"71","76",,2,10.1016/j.comptc.2012.02.004,"https://www.scopus.com/inward/record.uri?eid=2-s2.0-84859163783&doi=10.1016%2fj.comptc.2012.02.004&partnerID=40&md5=342bef4654df1472c47e76c4e3c72340",Article,Scopus,2-s2.0-84859163783
"Shin, Y.K., Shan, T.-R., Liang, T., Noordhoek, M.J., Sinnott, S.B., Van Duin, A.C.T., Phillpot, S.R.","Variable charge many-body interatomic potentials",2012,"MRS Bulletin","37","5",,"504","512",,26,10.1557/mrs.2012.95,"https://www.scopus.com/inward/record.uri?eid=2-s2.0-84861029995&doi=10.1557%2fmrs.2012.95&partnerID=40&md5=94cacbeffcecad2dfc41a00f87decaea",Article,Scopus,2-s2.0-84861029995
"Khalilov, U., Pourtois, G., Van Duin, A.C.T., Neyts, E.C.","Hyperthermal oxidation of Si(100)2 × 1 surfaces: Effect of growth temperature",2012,"Journal of Physical Chemistry C","116","15",,"8649","8656",,27,10.1021/jp300506g,"https://www.scopus.com/inward/record.uri?eid=2-s2.0-84860148633&doi=10.1021%2fjp300506g&partnerID=40&md5=f2a752c003b56795ccc1ed2ffea0e854",Article,Scopus,2-s2.0-84860148633
"Jeon, B., Sankaranarayanan, S.K.R.S., Van Duin, A.C.T., Ramanathan, S.","Reactive molecular dynamics study of chloride ion interaction with copper oxide surfaces in aqueous media",2012,"ACS Applied Materials and Interfaces","4","3",,"1225","1232",,10,10.1021/am201345v,"https://www.scopus.com/inward/record.uri?eid=2-s2.0-84859141626&doi=10.1021%2fam201345v&partnerID=40&md5=923e38c2d4e9c0a37a2b36765581158a",Article,Scopus,2-s2.0-84859141626
"Bedrov, D., Smith, G.D., Van Duin, A.C.T.","Reactions of singly-reduced ethylene carbonate in lithium battery electrolytes: A molecular dynamics simulation study using the ReaxFF",2012,"Journal of Physical Chemistry A","116","11",,"2978","2985",,55,10.1021/jp210345b,"https://www.scopus.com/inward/record.uri?eid=2-s2.0-84858775402&doi=10.1021%2fjp210345b&partnerID=40&md5=406aded8e81da687b5c3030491aa2fc5",Conference Paper,Scopus,2-s2.0-84858775402
"Kumar, S., Joshi, K.L., Van Duin, A.C.T., Haque, M.A.","Can amorphization take place in nanoscale interconnects?",2012,"Nanotechnology","23","9", 095701,"","",,2,10.1088/0957-4484/23/9/095701,"https://www.scopus.com/inward/record.uri?eid=2-s2.0-84863163048&doi=10.1088%2f0957-4484%2f23%2f9%2f095701&partnerID=40&md5=06127fb8fe0202cbeb05d28113aa93dd",Article,Scopus,2-s2.0-84863163048
"Manzano, H., Pellenq, R.J.M., Ulm, F.-J., Buehler, M.J., Van Duin, A.C.T.","Hydration of calcium oxide surface predicted by reactive force field molecular dynamics",2012,"Langmuir","28","9",,"4187","4197",,44,10.1021/la204338m,"https://www.scopus.com/inward/record.uri?eid=2-s2.0-84857817735&doi=10.1021%2fla204338m&partnerID=40&md5=d806e1280ba35ea2e6920b1c652a2e3a",Article,Scopus,2-s2.0-84857817735
"Monti, S., Van Duin, A.C.T., Kim, S.-Y., Barone, V.","Exploration of the conformational and reactive dynamics of glycine and diglycine on TiO <inf>2</inf>: Computational investigations in the gas phase and in solution",2012,"Journal of Physical Chemistry C","116","8",,"5141","5150",,48,10.1021/jp2121593,"https://www.scopus.com/inward/record.uri?eid=2-s2.0-84863249254&doi=10.1021%2fjp2121593&partnerID=40&md5=81ee11669fba4557d8d93b89dbc84c17",Article,Scopus,2-s2.0-84863249254
"Castro-Marcano, F., Kamat, A.M., Russo, M.F., van Duin, A.C.T., Mathews, J.P.","Combustion of an Illinois No. 6 coal char simulated using an atomistic char representation and the ReaxFF reactive force field",2012,"Combustion and Flame","159","3",,"1272","1285",,68,10.1016/j.combustflame.2011.10.022,"https://www.scopus.com/inward/record.uri?eid=2-s2.0-84856230245&doi=10.1016%2fj.combustflame.2011.10.022&partnerID=40&md5=7dc5e8c5e6f991582d350a35530ab415",Article,Scopus,2-s2.0-84856230245
"Pitman, M.C., Van Duin, A.C.T.","Dynamics of confined reactive water in smectite clay-zeolite composites",2012,"Journal of the American Chemical Society","134","6",,"3042","3053",,36,10.1021/ja208894m,"https://www.scopus.com/inward/record.uri?eid=2-s2.0-84856876315&doi=10.1021%2fja208894m&partnerID=40&md5=ed9bbbe18e44b3edace9247fda6dfe11",Article,Scopus,2-s2.0-84856876315
