Authors,Title,Year,Source title,Volume,Issue,Art. No.,Page start,Page end,Page count,Cited by,DOI,Link,Document Type,Source,EID
"van Wesemael, B., Paustian, K., Andrén, O., Cerri, C.E.P., Dodd, M., Etchevers, J., Goidts, E., Grace, P., Kätterer, T., McConkey, B.G., Ogle, S., Pan, G., Siebner, C.","How can soil monitoring networks be used to improve predictions of organic carbon pool dynamics and CO<inf>2</inf> fluxes in agricultural soils?",2011,"Plant and Soil","338","1",,"247","259",,33,10.1007/s11104-010-0567-z,"https://www.scopus.com/inward/record.uri?eid=2-s2.0-78650370590&doi=10.1007%2fs11104-010-0567-z&partnerID=40&md5=fa6dadd698b5a7673d2fd369246744f6",Article,Scopus,2-s2.0-78650370590
"Brown, D.J., Hunt, E.R., Izaurralde, R.C., Paustian, K.H., Rice, C.W., Schumaker, B.L., West, T.O.","Soil organic carbon change monitored over large areas",2010,"Eos","91","47",,"441","442",,10,10.1029/2010EO470001,"https://www.scopus.com/inward/record.uri?eid=2-s2.0-78650261087&doi=10.1029%2f2010EO470001&partnerID=40&md5=6fc539ee26c546a9f891072b30e7c2b4",Article,Scopus,2-s2.0-78650261087
"Grace, P.R., Antle, J., Ogle, S., Paustian, K., Basso, B.","Soil carbon sequestration rates and associated economic costs for farming systems of south-eastern Australia",2010,"Australian Journal of Soil Research","48","8",,"720","729",,21,10.1071/SR10063,"https://www.scopus.com/inward/record.uri?eid=2-s2.0-78649529900&doi=10.1071%2fSR10063&partnerID=40&md5=89ea982ec88d6aa94ce19e2630f3a4fa",Article,Scopus,2-s2.0-78649529900
"Conant, R.T., Haddix, M., Paustian, K.","Partitioning soil carbon responses to warming: Model-derived guidance for data interpretation",2010,"Soil Biology and Biochemistry","42","11",,"2034","2036",,9,10.1016/j.soilbio.2010.07.025,"https://www.scopus.com/inward/record.uri?eid=2-s2.0-77956733724&doi=10.1016%2fj.soilbio.2010.07.025&partnerID=40&md5=8369bab30fe0de4223a60e0faf1a5940",Article,Scopus,2-s2.0-77956733724
"Bhattacharyya, T., Pal, D.K., Williams, S., Telpande, B.A., Deshmukh, A.S., Chandran, P., Ray, S.K., Mandal, C., Easter, M., Paustian, K.","Evaluating the Century C model using two long-term fertilizer trials representing humid and semi-arid sites from India",2010,"Agriculture, Ecosystems and Environment","139","1-2",,"264","272",,5,10.1016/j.agee.2010.08.012,"https://www.scopus.com/inward/record.uri?eid=2-s2.0-77957363924&doi=10.1016%2fj.agee.2010.08.012&partnerID=40&md5=18cca3c874914a9866eefe08cfaee46a",Article,Scopus,2-s2.0-77957363924
"Van Wesemael, B., Paustian, K., Meersmans, J., Goidts, E., Barancikova, G., Easter, M.","Agricultural management explains historic changes in regional soil carbon stocks",2010,"Proceedings of the National Academy of Sciences of the United States of America","107","33",,"14926","14930",,78,10.1073/pnas.1002592107,"https://www.scopus.com/inward/record.uri?eid=2-s2.0-77957061505&doi=10.1073%2fpnas.1002592107&partnerID=40&md5=1fd83a10a6c7b20583af82520fdc3de3",Article,Scopus,2-s2.0-77957061505
"Lokupitiya, E., Lefsky, M., Paustian, K.","Use of AVHRR NDVI time series and ground-based surveys for estimating county-level crop biomass",2010,"International Journal of Remote Sensing","31","1",,"141","158",,1,10.1080/01431160902882579,"https://www.scopus.com/inward/record.uri?eid=2-s2.0-77649109520&doi=10.1080%2f01431160902882579&partnerID=40&md5=166f7b50972afa6ca58be1a6f49ca167",Article,Scopus,2-s2.0-77649109520
"Ogle, S.M., Jay Breidt, F., Easter, M., Williams, S., Killian, K., Paustian, K.","Scale and uncertainty in modeled soil organic carbon stock changes for US croplands using a process-based model",2010,"Global Change Biology","16","2",,"810","822",,83,10.1111/j.1365-2486.2009.01951.x,"https://www.scopus.com/inward/record.uri?eid=2-s2.0-78149256016&doi=10.1111%2fj.1365-2486.2009.01951.x&partnerID=40&md5=9c6fd45d1f82d4899d3eafe46fc2b5d0",Article,Scopus,2-s2.0-78149256016
"Galdos, M.V., Cerri, C.C., Cerri, C.E.P., Paustian, K., van Antwerpen, R.","Simulation of sugarcane residue decomposition and aboveground growth",2010,"Plant and Soil","326","1",,"243","259",,14,10.1007/s11104-009-0004-3,"https://www.scopus.com/inward/record.uri?eid=2-s2.0-72149095458&doi=10.1007%2fs11104-009-0004-3&partnerID=40&md5=dd16ef1cd36bda8ac6064446775cd525",Article,Scopus,2-s2.0-72149095458
"Morgan, J.A., Follett, R.F., Allen Jr., L.H., Del Grosso, S., Derner, J.D., Dijkstra, F., Franzluebbers, A., Fry, R., Paustian, K., Schoeneberger, M.M.","Carbon sequestration in agricultural lands of the United States",2010,"Journal of Soil and Water Conservation","65","1",,"6A","13A",,59,10.2489/jswc.65.1.6A,"https://www.scopus.com/inward/record.uri?eid=2-s2.0-77949625538&doi=10.2489%2fjswc.65.1.6A&partnerID=40&md5=5110e6fe00aa849a6fc1b34a8ce8dc6f",Review,Scopus,2-s2.0-77949625538
"Álvaro-Fuentes, J., López, M.V., Arrúe, J.L., Moret, D., Paustian, K.","Tillage and cropping effects on soil organic carbon in Mediterranean semiarid agroecosystems: Testing the Century model",2009,"Agriculture, Ecosystems and Environment","134","3-4",,"211","217",,44,10.1016/j.agee.2009.07.001,"https://www.scopus.com/inward/record.uri?eid=2-s2.0-70349145762&doi=10.1016%2fj.agee.2009.07.001&partnerID=40&md5=1464cf11a7d499b3f54f88debb84ccca",Article,Scopus,2-s2.0-70349145762
"Lokupitiya, E., Denning, S., Paustian, K., Baker, I., Schaefer, K., Verma, S., Meyers, T., Bernacchi, C.J., Suyker, A., Fischer, M.","Erratum: Incorporation of crop phenology in Simple Biosphere Model (SiBcrop) to improve land-atmosphere carbon exchanges from croplands (Biogeosciences (2009) 6 (969-986))",2009,"Biogeosciences","6","6",,"1103","",,4,,"https://www.scopus.com/inward/record.uri?eid=2-s2.0-80051971577&partnerID=40&md5=62c83456c57880ecf1d8130f3da6d227",Erratum,Scopus,2-s2.0-80051971577
"Lokupitiya, E., Denning, S., Paustian, K., Baker, I., Schaefer, K., Verma, S., Meyers, T., Bernacchi, C.J., Suyker, A., Fischer, M.","Incorporation of crop phenology in Simple Biosphere model (SiBcrop) to improve land-atmosphere carbon exchanges from croplands",2009,"Biogeosciences","6","6",,"969","986",,70,,"https://www.scopus.com/inward/record.uri?eid=2-s2.0-80051955228&partnerID=40&md5=6ab80939fee19173012c4c1876cdb54d",Article,Scopus,2-s2.0-80051955228
"Arrouays, D., Bellamy, P.H., Paustian, K.","Soil inventory and monitoring. Current issues and gaps",2009,"European Journal of Soil Science","60","5",,"721","722",,8,10.1111/j.1365-2389.2009.01193.x,"https://www.scopus.com/inward/record.uri?eid=2-s2.0-70349206296&doi=10.1111%2fj.1365-2389.2009.01193.x&partnerID=40&md5=dbe34736e988f4b9da5eacda6281982f",Editorial,Scopus,2-s2.0-70349206296
"Álvaro-Fuentes, J., Cantero-Martínez, C., López, M.V., Paustian, K., Denef, K., Stewart, C.E., Arrúe, J.L.","Soil aggregation and soil organic carbon stabilization: Effects of management in semiarid mediterranean agroecosystems",2009,"Soil Science Society of America Journal","73","5",,"1519","1529",,52,10.2136/sssaj2008.0333,"https://www.scopus.com/inward/record.uri?eid=2-s2.0-69949180729&doi=10.2136%2fsssaj2008.0333&partnerID=40&md5=a5f8458f466d5b5ba9145bd7b081bcec",Article,Scopus,2-s2.0-69949180729
"Shrestha, B.M., Williams, S., Easter, M., Paustian, K., Singh, B.R.","Modeling soil organic carbon stocks and changes in a Nepalese watershed",2009,"Agriculture, Ecosystems and Environment","132","1-2",,"91","97",,7,10.1016/j.agee.2009.03.003,"https://www.scopus.com/inward/record.uri?eid=2-s2.0-67349236441&doi=10.1016%2fj.agee.2009.03.003&partnerID=40&md5=fbd1a24922b83ead1ed1b6f308e12a53",Article,Scopus,2-s2.0-67349236441
"Galdos, M.V., Cerri, C.C., Cerri, C.E.P., Paustian, K., Van Antwerpen, R.","Simulation of Soil Carbon Dynamics under Sugarcane with the CENTURY Model",2009,"Soil Science Society of America Journal","73","3",,"802","811",,27,10.2136/sssaj2007.0285,"https://www.scopus.com/inward/record.uri?eid=2-s2.0-65949122336&doi=10.2136%2fsssaj2007.0285&partnerID=40&md5=39286de03cedfcab637013845969d268",Article,Scopus,2-s2.0-65949122336
"Stewart, C.E., Paustian, K., Conant, R.T., Plante, A.F., Six, J.","Soil carbon saturation: Implications for measurable carbon pool dynamics in long-term incubations",2009,"Soil Biology and Biochemistry","41","2",,"357","366",,63,10.1016/j.soilbio.2008.11.011,"https://www.scopus.com/inward/record.uri?eid=2-s2.0-58149505693&doi=10.1016%2fj.soilbio.2008.11.011&partnerID=40&md5=99704f168c908b709b569596f7644314",Article,Scopus,2-s2.0-58149505693
"Paustian, K., Brenner, J., Easter, M., Killian, K., Ogle, S., Olson, C., Schuler, J., Vining, R., Williams, S.","Counting carbon on the farm: Reaping the benefits of carbon offset programs",2009,"Journal of Soil and Water Conservation","64","1",,"36A","40A",,19,10.2489/jswc.64.1.36A,"https://www.scopus.com/inward/record.uri?eid=2-s2.0-70350550823&doi=10.2489%2fjswc.64.1.36A&partnerID=40&md5=47f67776bafaf0e9d77745865fa0c127",Short Survey,Scopus,2-s2.0-70350550823
"Stewart, C.E., Paustian, K., Conant, R.T., Plante, A.F., Six, J.","Soil carbon saturation: Evaluation and corroboration by long-term incubations",2008,"Soil Biology and Biochemistry","40","7",,"1741","1750",,65,10.1016/j.soilbio.2008.02.014,"https://www.scopus.com/inward/record.uri?eid=2-s2.0-46549086019&doi=10.1016%2fj.soilbio.2008.02.014&partnerID=40&md5=51d6afbf115a5e3de1f7745f7fe4a20c",Article,Scopus,2-s2.0-46549086019
"Denef, K., Stewart, C.E., Brenner, J., Paustian, K.","Does long-term center-pivot irrigation increase soil carbon stocks in semi-arid agro-ecosystems?",2008,"Geoderma","145","1-2",,"121","129",,37,10.1016/j.geoderma.2008.03.002,"https://www.scopus.com/inward/record.uri?eid=2-s2.0-43649098830&doi=10.1016%2fj.geoderma.2008.03.002&partnerID=40&md5=a7faf1f32a31e33e43337de2760cfff3",Article,Scopus,2-s2.0-43649098830
"Stewart, C.E., Plante, A.F., Paustian, K., Conant, R.T., Six, J.","Soil carbon saturation: Linking concept and measurable carbon pools",2008,"Soil Science Society of America Journal","72","2",,"379","392",,93,10.2136/sssaj2007.0104,"https://www.scopus.com/inward/record.uri?eid=2-s2.0-40849088289&doi=10.2136%2fsssaj2007.0104&partnerID=40&md5=a476d8f2b093c2924ce791e2a921a501",Article,Scopus,2-s2.0-40849088289
"Olchin, G.P., Ogle, S., Frey, S.D., Filley, T.R., Paustian, K., Six, J.","Residue carbon stabilization in soil aggregates of no-till and tillage management of dryland cropping systems",2008,"Soil Science Society of America Journal","72","2",,"507","513",,32,10.2136/sssaj2006.0417,"https://www.scopus.com/inward/record.uri?eid=2-s2.0-40849088277&doi=10.2136%2fsssaj2006.0417&partnerID=40&md5=6878bbbf13afd13a9080781d051433fa",Article,Scopus,2-s2.0-40849088277
"Stewart, C.E., Paustian, K., Conant, R.T., Plante, A.F., Six, J.","Soil carbon saturation: Concept, evidence and evaluation",2007,"Biogeochemistry","86","1",,"19","31",,209,10.1007/s10533-007-9140-0,"https://www.scopus.com/inward/record.uri?eid=2-s2.0-34548564595&doi=10.1007%2fs10533-007-9140-0&partnerID=40&md5=7cb9171e91df2388dda14995472e890a",Article,Scopus,2-s2.0-34548564595
"Conant, R.T., Easter, M., Paustian, K., Swan, A., Williams, S.","Impacts of periodic tillage on soil C stocks: A synthesis",2007,"Soil and Tillage Research","95","1-2",,"1","10",,93,10.1016/j.still.2006.12.006,"https://www.scopus.com/inward/record.uri?eid=2-s2.0-34548674455&doi=10.1016%2fj.still.2006.12.006&partnerID=40&md5=2b2abdddcb3fa34b263f9efa545b2536",Review,Scopus,2-s2.0-34548674455
"Kamoni, P.T., Gicheru, P.T., Wokabi, S.M., Easter, M., Milne, E., Coleman, K., Falloon, P., Paustian, K., Killian, K., Kihanda, F.M.","Evaluation of two soil carbon models using two Kenyan long term experimental datasets",2007,"Agriculture, Ecosystems and Environment","122","1",,"95","104",,26,10.1016/j.agee.2007.01.011,"https://www.scopus.com/inward/record.uri?eid=2-s2.0-34047160966&doi=10.1016%2fj.agee.2007.01.011&partnerID=40&md5=ad29a6ffd4cfd48c52a2d3118017dd1f",Article,Scopus,2-s2.0-34047160966
"Kamoni, P.T., Gicheru, P.T., Wokabi, S.M., Easter, M., Milne, E., Coleman, K., Falloon, P., Paustian, K.","Predicted soil organic carbon stocks and changes in Kenya between 1990 and 2030",2007,"Agriculture, Ecosystems and Environment","122","1",,"105","113",,14,10.1016/j.agee.2007.01.024,"https://www.scopus.com/inward/record.uri?eid=2-s2.0-34047149860&doi=10.1016%2fj.agee.2007.01.024&partnerID=40&md5=33551dfb42e1d6ecd77d43ef80bff431",Article,Scopus,2-s2.0-34047149860
"Al-Adamat, R., Rawajfih, Z., Easter, M., Paustian, K., Coleman, K., Milne, E., Falloon, P., Powlson, D.S., Batjes, N.H.","Predicted soil organic carbon stocks and changes in Jordan between 2000 and 2030 made using the GEFSOC Modelling System",2007,"Agriculture, Ecosystems and Environment","122","1",,"35","45",,18,10.1016/j.agee.2007.01.006,"https://www.scopus.com/inward/record.uri?eid=2-s2.0-34047125293&doi=10.1016%2fj.agee.2007.01.006&partnerID=40&md5=f5336284e7330cd7fbada7f88cde6d63",Article,Scopus,2-s2.0-34047125293
"Bhattacharyya, T., Pal, D.K., Easter, M., Williams, S., Paustian, K., Milne, E., Chandran, P., Ray, S.K., Mandal, C., Coleman, K., Falloon, P., Powlson, D., Gajbhiye, K.S.","Evaluating the Century C model using long-term fertilizer trials in the Indo-Gangetic Plains, India",2007,"Agriculture, Ecosystems and Environment","122","1",,"73","83",,16,10.1016/j.agee.2007.01.009,"https://www.scopus.com/inward/record.uri?eid=2-s2.0-34047140366&doi=10.1016%2fj.agee.2007.01.009&partnerID=40&md5=1b5ad6c244ba87863034bdfd6cc89641",Article,Scopus,2-s2.0-34047140366
"Cerri, C.E.P., Easter, M., Paustian, K., Killian, K., Coleman, K., Bernoux, M., Falloon, P., Powlson, D.S., Batjes, N., Milne, E., Cerri, C.C.","Simulating SOC changes in 11 land use change chronosequences from the Brazilian Amazon with RothC and Century models",2007,"Agriculture, Ecosystems and Environment","122","1",,"46","57",,46,10.1016/j.agee.2007.01.007,"https://www.scopus.com/inward/record.uri?eid=2-s2.0-34047181052&doi=10.1016%2fj.agee.2007.01.007&partnerID=40&md5=37c0371c923a6cdc0cb2120ecc3db160",Article,Scopus,2-s2.0-34047181052
"Bhattacharyya, T., Pal, D.K., Easter, M., Batjes, N.H., Milne, E., Gajbhiye, K.S., Chandran, P., Ray, S.K., Mandal, C., Paustian, K., Williams, S., Killian, K., Coleman, K., Falloon, P., Powlson, D.S.","Modelled soil organic carbon stocks and changes in the Indo-Gangetic Plains, India from 1980 to 2030",2007,"Agriculture, Ecosystems and Environment","122","1",,"84","94",,32,10.1016/j.agee.2007.01.010,"https://www.scopus.com/inward/record.uri?eid=2-s2.0-34047119138&doi=10.1016%2fj.agee.2007.01.010&partnerID=40&md5=f21a607cfb3d63cf3d16911150a0c21f",Article,Scopus,2-s2.0-34047119138
"Falloon, P., Jones, C.D., Cerri, C.E., Al-Adamat, R., Kamoni, P., Bhattacharyya, T., Easter, M., Paustian, K., Killian, K., Coleman, K., Milne, E.","Climate change and its impact on soil and vegetation carbon storage in Kenya, Jordan, India and Brazil",2007,"Agriculture, Ecosystems and Environment","122","1",,"114","124",,33,10.1016/j.agee.2007.01.013,"https://www.scopus.com/inward/record.uri?eid=2-s2.0-34047098759&doi=10.1016%2fj.agee.2007.01.013&partnerID=40&md5=282ac788b00430fe52bd2faf0b54d876",Article,Scopus,2-s2.0-34047098759
"Cerri, C.E.P., Easter, M., Paustian, K., Killian, K., Coleman, K., Bernoux, M., Falloon, P., Powlson, D.S., Batjes, N.H., Milne, E., Cerri, C.C.","Predicted soil organic carbon stocks and changes in the Brazilian Amazon between 2000 and 2030",2007,"Agriculture, Ecosystems and Environment","122","1",,"58","72",,67,10.1016/j.agee.2007.01.008,"https://www.scopus.com/inward/record.uri?eid=2-s2.0-34047110720&doi=10.1016%2fj.agee.2007.01.008&partnerID=40&md5=272e89f2d567894a8533b7b328abe250",Article,Scopus,2-s2.0-34047110720
"Milne, E., Paustian, K., Easter, M., Sessay, M., Al-Adamat, R., Batjes, N.H., Bernoux, M., Bhattacharyya, T., Cerri, C.C., Cerri, C.E.P., Coleman, K., Falloon, P., Feller, C., Gicheru, P., Kamoni, P., Killian, K., Pal, D.K., Powlson, D.S., Williams, S., Rawajfih, Z.","An increased understanding of soil organic carbon stocks and changes in non-temperate areas: National and global implications",2007,"Agriculture, Ecosystems and Environment","122","1",,"125","136",,13,10.1016/j.agee.2007.01.012,"https://www.scopus.com/inward/record.uri?eid=2-s2.0-34047163470&doi=10.1016%2fj.agee.2007.01.012&partnerID=40&md5=4a815b9d9bd1ee49feda122a8629ef50",Article,Scopus,2-s2.0-34047163470
"Easter, M., Paustian, K., Killian, K., Williams, S., Feng, T., Al-Adamat, R., Batjes, N.H., Bernoux, M., Bhattacharyya, T., Cerri, C.C., Cerri, C.E.P., Coleman, K., Falloon, P., Feller, C., Gicheru, P., Kamoni, P., Milne, E., Pal, D.K., Powlson, D.S., Rawajfih, Z., Sessay, M., Wokabi, S.","The GEFSOC soil carbon modelling system: A tool for conducting regional-scale soil carbon inventories and assessing the impacts of land use change on soil carbon",2007,"Agriculture, Ecosystems and Environment","122","1",,"13","25",,43,10.1016/j.agee.2007.01.004,"https://www.scopus.com/inward/record.uri?eid=2-s2.0-34047262329&doi=10.1016%2fj.agee.2007.01.004&partnerID=40&md5=3cef0ca37804243aea5d21655e37d67e",Article,Scopus,2-s2.0-34047262329
"Milne, E., Adamat, R.A., Batjes, N.H., Bernoux, M., Bhattacharyya, T., Cerri, C.C., Cerri, C.E.P., Coleman, K., Easter, M., Falloon, P., Feller, C., Gicheru, P., Kamoni, P., Killian, K., Pal, D.K., Paustian, K., Powlson, D.S., Rawajfih, Z., Sessay, M., Williams, S., Wokabi, S.","National and sub-national assessments of soil organic carbon stocks and changes: The GEFSOC modelling system",2007,"Agriculture, Ecosystems and Environment","122","1",,"3","12",,56,10.1016/j.agee.2007.01.002,"https://www.scopus.com/inward/record.uri?eid=2-s2.0-34047265138&doi=10.1016%2fj.agee.2007.01.002&partnerID=40&md5=64581c3309dbde14041d4e656f0799fb",Article,Scopus,2-s2.0-34047265138
"Ogle, S.M., Breidt, F.J., Easter, M., Williams, S., Paustian, K.","An empirically based approach for estimating uncertainty associated with modelling carbon sequestration in soils",2007,"Ecological Modelling","205","3-4",,"453","463",,42,10.1016/j.ecolmodel.2007.03.007,"https://www.scopus.com/inward/record.uri?eid=2-s2.0-34248653218&doi=10.1016%2fj.ecolmodel.2007.03.007&partnerID=40&md5=b7002280cf66fac9e31218fd3125f154",Article,Scopus,2-s2.0-34248653218
"Lugato, E., Paustian, K., Giardini, L.","Modelling soil organic carbon dynamics in two long-term experiments of north-eastern Italy",2007,"Agriculture, Ecosystems and Environment","120","2-4",,"423","432",,39,10.1016/j.agee.2006.11.006,"https://www.scopus.com/inward/record.uri?eid=2-s2.0-33846794858&doi=10.1016%2fj.agee.2006.11.006&partnerID=40&md5=477d81608c4df1f27957c736a90efcd8",Article,Scopus,2-s2.0-33846794858
"Lokupitiya, E., Breidt, F.J., Lokupitiya, R., Williams, S., Paustian, K.","Deriving comprehensive county-level crop yield and area data for U.S. cropland",2007,"Agronomy Journal","99","3",,"673","681",,10,10.2134/agronj2006.0143,"https://www.scopus.com/inward/record.uri?eid=2-s2.0-34249097480&doi=10.2134%2fagronj2006.0143&partnerID=40&md5=6a7f4060c1c37330dd28d42fde2d2d33",Article,Scopus,2-s2.0-34249097480
"Gillabel, J., Denef, K., Brenner, J., Merckx, R., Paustian, K.","Carbon sequestration and soil aggregation in center-pivot irrigated and dryland cultivated farming systems",2007,"Soil Science Society of America Journal","71","3",,"1020","1028",,27,10.2136/sssaj2006.0215,"https://www.scopus.com/inward/record.uri?eid=2-s2.0-34249019233&doi=10.2136%2fsssaj2006.0215&partnerID=40&md5=92f8db175f6f512ec208541cb0d8f868",Article,Scopus,2-s2.0-34249019233
"Bricklemyer, R.S., Miller, P.R., Turk, P.J., Paustian, K., Keck, T., Nielsen, G.A.","Sensitivity of the century model to scale-related soil texture variability",2007,"Soil Science Society of America Journal","71","3",,"784","792",,30,10.2136/sssaj2006.0168,"https://www.scopus.com/inward/record.uri?eid=2-s2.0-34249046403&doi=10.2136%2fsssaj2006.0168&partnerID=40&md5=6c8b93d9fe214b7d2a2f88fd9522b911",Article,Scopus,2-s2.0-34249046403
"Antle, J.M., Capalbo, S.M., Paustian, K., Ali, Md.K.","Estimating the economic potential for agricultural soil carbon sequestration in the Central United States using an aggregate econometric-process simulation model",2007,"Climatic Change","80","1-2",,"145","171",,26,10.1007/s10584-006-9176-5,"https://www.scopus.com/inward/record.uri?eid=2-s2.0-33751209826&doi=10.1007%2fs10584-006-9176-5&partnerID=40&md5=c46d2427f7083569d824ac7b1437c26c",Article,Scopus,2-s2.0-33751209826
"Mooney, S., Gerow, K., Antle, J., Capalbo, S., Paustian, K.","Reducing standard errors by incorporating spatial autocorrelation into a measurement scheme for soil carbon credits",2007,"Climatic Change","80","1-2",,"55","72",,11,10.1007/s10584-006-9142-2,"https://www.scopus.com/inward/record.uri?eid=2-s2.0-33846413902&doi=10.1007%2fs10584-006-9142-2&partnerID=40&md5=b98416118eea2b3e8846074ec1a1c31d",Article,Scopus,2-s2.0-33846413902
"Antle, J., Capalbo, S., Paustian, K.","Ecological and economic impacts of climate change in agricultural systems: An integrated assessment approach",2006,"Regional Climate Change and Variability: Impacts and Responses",,,,"128","160",,1,,"https://www.scopus.com/inward/record.uri?eid=2-s2.0-78650611392&partnerID=40&md5=c34ca9afd5ebdcc0c7861541734984a4",Book Chapter,Scopus,2-s2.0-78650611392
"Plante, A.F., Conant, R.T., Paul, E.A., Paustian, K., Six, J.","Acid hydrolysis of easily dispersed and microaggregate-derived silt- and clay-sized fractions to isolate resistant soil organic matter",2006,"European Journal of Soil Science","57","4",,"456","467",,47,10.1111/j.1365-2389.2006.00792.x,"https://www.scopus.com/inward/record.uri?eid=2-s2.0-33646701798&doi=10.1111%2fj.1365-2389.2006.00792.x&partnerID=40&md5=9054e91e27296eab346c6b6b6baf1a9f",Article,Scopus,2-s2.0-33646701798
"Lokupitiya, E., Paustian, K.","Agricultural soil greenhouse gas emissions: A review of national inventory methods",2006,"Journal of Environmental Quality","35","4",,"1413","1427",,69,10.2134/jeq2005.0157,"https://www.scopus.com/inward/record.uri?eid=2-s2.0-33746450887&doi=10.2134%2fjeq2005.0157&partnerID=40&md5=bc6d0d558e8410610de177b8b34d9174",Conference Paper,Scopus,2-s2.0-33746450887
"Ojima, D.S., Wall, D.H., Moore, J., Galvin, K., Hobbs, N.T., Hunt, W.H., Paustian, K., Swift, D., Boone, R.B., Conant, R.T., Klein, J., Christensen, L., Sankaran, M., Ratnam, J., Ayres, E., Steltzer, H., Simmons, B., Williams, G.","Don't sell social science short [1]",2006,"Science","312","5779",,"1470","",,2,,"https://www.scopus.com/inward/record.uri?eid=2-s2.0-33744983089&partnerID=40&md5=cc73c50b06802e3bbff1681894c5a3fa",Letter,Scopus,2-s2.0-33744983089
"Lokupitiya, R.S., Lokupitiya, E., Paustian, K.","Comparison of missing value imputation methods for crop yield data",2006,"Environmetrics","17","4",,"339","349",,5,10.1002/env.773,"https://www.scopus.com/inward/record.uri?eid=2-s2.0-33745141590&doi=10.1002%2fenv.773&partnerID=40&md5=ffd1da2112eccd837eaa552a03c82e5a",Article,Scopus,2-s2.0-33745141590
"Cerri, C.E.P., Piccolo, M.C., Feigl, B.J., Paustian, K., Cerri, C.C., Victoria, R.L., Melillo, J.M.","Interrelationships among soil total C and N, microbial biomass, trace gas fluxes, and internal N-cycling in soils under pasture of the Amazon Region",2006,"Journal of Sustainable Agriculture","27","4",,"45","69",,11,10.1300/J064v27n04_05,"https://www.scopus.com/inward/record.uri?eid=2-s2.0-33745700875&doi=10.1300%2fJ064v27n04_05&partnerID=40&md5=5ca62ab8034be56496b09deca9d5aa9f",Article,Scopus,2-s2.0-33745700875
"Ogle, S.M., Breidt, F.J., Paustian, K.","Bias and variance in model results associated with spatial scaling of measurements for parameterization in regional assessments",2006,"Global Change Biology","12","3",,"516","523",,19,10.1111/j.1365-2486.2006.01106.x,"https://www.scopus.com/inward/record.uri?eid=2-s2.0-33644995618&doi=10.1111%2fj.1365-2486.2006.01106.x&partnerID=40&md5=581f5a5679c92f18490b5fc54a21084c",Article,Scopus,2-s2.0-33644995618
"Plante, A.F., Stewart, C.E., Conant, R.T., Paustian, K., Six, J.","Soil management effects on organic carbon in isolated fractions of a Gray Luvisol",2006,"Canadian Journal of Soil Science","86","1",,"141","151",,11,,"https://www.scopus.com/inward/record.uri?eid=2-s2.0-33745651471&partnerID=40&md5=a4830ac73ae69558706d46b4f379922d",Article,Scopus,2-s2.0-33745651471
"Plante, A.F., Conant, R.T., Stewart, C.E., Paustian, K., Six, J.","Impact of soil texture on the distribution of soil organic matter in physical and chemical fractions",2006,"Soil Science Society of America Journal","70","1",,"287","296",,114,10.2136/sssaj2004.0363,"https://www.scopus.com/inward/record.uri?eid=2-s2.0-32044473051&doi=10.2136%2fsssaj2004.0363&partnerID=40&md5=39ac0aee0cac414750102fb1dbcb9a61",Article,Scopus,2-s2.0-32044473051
"Ogle, S.M., Paustian, K.","Soil organic carbon as an indicator of environmental quality at the national scale: Inventory monitoring methods and policy relevance",2005,"Canadian Journal of Soil Science","85","4",,"531","540",,27,,"https://www.scopus.com/inward/record.uri?eid=2-s2.0-31144452516&partnerID=40&md5=bddfb3e5090cf130e2e47e9e53a2c50b",Conference Paper,Scopus,2-s2.0-31144452516
"Bruun, S., Six, J., Jensen, L.S., Paustian, K.","Estimating turnover of soil organic carbon fractions based on radiocarbon measurements",2005,"Radiocarbon","47","1",,"99","113",,21,,"https://www.scopus.com/inward/record.uri?eid=2-s2.0-17144402165&partnerID=40&md5=bb158e7571249cc09e8222d71cd5663d",Article,Scopus,2-s2.0-17144402165
"Conant, R.T., Paustian, K., Del Grosso, S.J., Parton, W.J.","Nitrogen pools and fluxes in grassland soils sequestering carbon",2005,"Nutrient Cycling in Agroecosystems","71","3",,"239","248",,51,10.1007/s10705-004-5085-z,"https://www.scopus.com/inward/record.uri?eid=2-s2.0-21144431900&doi=10.1007%2fs10705-004-5085-z&partnerID=40&md5=d0fca26ffb001affbc713f653d1cb870",Review,Scopus,2-s2.0-21144431900
