Authors,Title,Year,Source title,Volume,Issue,Art. No.,Page start,Page end,Page count,Cited by,DOI,Link,Document Type,Source,EID
"Agrawalla, S., Van Duin, A.C.T.","Development and application of a ReaxFF reactive force field for hydrogen combustion",2010,"Western States Section of the Combustion Institute Spring Technical Meeting 2010",,,,"659","676",,,,"https://www.scopus.com/inward/record.uri?eid=2-s2.0-84943404376&partnerID=40&md5=e8480d39c91a70280426f95ae887787f",Conference Paper,Scopus,2-s2.0-84943404376
"Kamat, A., Van Duin, A.C.T.","Molecular dynamics simulations of Laser Induced Incandescence (LII) of soot using the ReaxFF reactive force field",2010,"Western States Section of the Combustion Institute Spring Technical Meeting 2010",,,,"649","658",,,,"https://www.scopus.com/inward/record.uri?eid=2-s2.0-84943418774&partnerID=40&md5=c3e27e9649a0826792b94666d2d80158",Conference Paper,Scopus,2-s2.0-84943418774
"Davis, S., Belonoshko, A.B., Rosengren, A., van Duin, A.C.T., Johansson, B.","Molecular dynamics simulation of zirconia melting",2010,"Central European Journal of Physics","8","5",,"789","797",,7,10.2478/s11534-009-0152-3,"https://www.scopus.com/inward/record.uri?eid=2-s2.0-77955050839&doi=10.2478%2fs11534-009-0152-3&partnerID=40&md5=b968b1dbb091973f93fc6adfd4ad4dd0",Article,Scopus,2-s2.0-77955050839
"Mueller, J.E., Van Duin, A.C.T., Goddard III, W.A.","Structures, energetics, and reaction barriers for CH<inf>x</inf> bound to the nickel (111) surface",2009,"Journal of Physical Chemistry C","113","47",,"20290","20306",,45,10.1021/jp810555y,"https://www.scopus.com/inward/record.uri?eid=2-s2.0-71049183019&doi=10.1021%2fjp810555y&partnerID=40&md5=2ca9d29cdfe7934c166b4b78215f9deb",Article,Scopus,2-s2.0-71049183019
"Daily, J.W., Van Duin, A.C.T., Goddard III, W.A.","Prediction of thermal decomposition of biomass using reaction MD",2009,"ACS National Meeting Book of Abstracts",,,,"","",1,,,"https://www.scopus.com/inward/record.uri?eid=2-s2.0-78649514697&partnerID=40&md5=ae2dcbdad369c9da8ecd91c324c962c5",Conference Paper,Scopus,2-s2.0-78649514697
"Salmon, E., van Duin, A.C.T., Lorant, F., Marquaire, P.-M., Goddard III, W.A.","Early maturation processes in coal. Part 2: Reactive dynamics simulations using the ReaxFF reactive force field on Morwell Brown coal structures",2009,"Organic Geochemistry","40","12",,"1195","1209",,60,10.1016/j.orggeochem.2009.09.001,"https://www.scopus.com/inward/record.uri?eid=2-s2.0-70350566025&doi=10.1016%2fj.orggeochem.2009.09.001&partnerID=40&md5=ca6d225a0889c90bb610565cc7e54c1c",Article,Scopus,2-s2.0-70350566025
"Kua, J., Daly, R.C., Tomlin, K.M., Van Duin, A.C.T., Brill, T.B., Beal, R.W., Rheingold, A.L.","Self-assembly of SbCl<inf>3</inf> and 1,4-dioxane: Cubic structure connected by very weak bonds",2009,"Journal of Physical Chemistry A","113","42",,"11443","11453",,4,10.1021/jp908205x,"https://www.scopus.com/inward/record.uri?eid=2-s2.0-70350337899&doi=10.1021%2fjp908205x&partnerID=40&md5=c946bdce84be0f98e58deee2982d7471",Article,Scopus,2-s2.0-70350337899
"Zhang, L., Zybin, S.V., Van Duin, A.C.T., Dasgupta, S., Goddard III, W.A., Kober, E.M.","Carbon cluster formation during thermal decomposition of octahydro-l,3,5,7-tetranitro-l,3,5,7-tetrazocine and l,3,5-triamino-2,4,6- trinitrobenzene high explosives from ReaxFF reactive molecular dynamics simulations",2009,"Journal of Physical Chemistry A","113","40",,"10619","10640",,117,10.1021/jp901353a,"https://www.scopus.com/inward/record.uri?eid=2-s2.0-70349686771&doi=10.1021%2fjp901353a&partnerID=40&md5=41fb8f8679299b5bc3fd25527c3c1af6",Article,Scopus,2-s2.0-70349686771
"Chenoweth, K., Van Duin, A.C.T., Goddard III, W.A.","The ReaxFF monte carlo reactive dynamics method for predicting atomistic structures of disordered Ceramics: Application to the Mo<inf>3</inf>VO <inf>x</inf> catalyst",2009,"Angewandte Chemie - International Edition","48","41",,"7630","7634",,30,10.1002/anie.200902574,"https://www.scopus.com/inward/record.uri?eid=2-s2.0-70349992660&doi=10.1002%2fanie.200902574&partnerID=40&md5=f787dd038d895fb5b84fcdab41779b71",Article,Scopus,2-s2.0-70349992660
"Ojwang, J.G.O., Van Santen, R.A., Kramer, G.J., Van Duin, A.C.T., Goddard, W.A.","Parametrization of a reactive force field for aluminum hydride",2009,"Journal of Chemical Physics","131","4", 044501,"","",,19,10.1063/1.3182853,"https://www.scopus.com/inward/record.uri?eid=2-s2.0-68249110877&doi=10.1063%2f1.3182853&partnerID=40&md5=daf41a731c96069ba441d00840f5724e",Article,Scopus,2-s2.0-68249110877
"Zhang, L., Van Duin, A.C.T., Zybin, S.V., Goddard III, W.A.","Thermal decomposition of hydrazines from reactive dynamics using the reaxff reactive force field",2009,"Journal of Physical Chemistry B","113","31",,"10770","10778",,40,10.1021/jp900194d,"https://www.scopus.com/inward/record.uri?eid=2-s2.0-68149166296&doi=10.1021%2fjp900194d&partnerID=40&md5=8d5e41cc9a35f3c57b9680f6086ccde4",Article,Scopus,2-s2.0-68149166296
"Jiang, D.-E., Van Duin, A.C.T., Goddard Iii, W.A., Dai, S.","Simulating the initial stage of phenolic resin carbonization via the ReaxFF reactive force field",2009,"Journal of Physical Chemistry A","113","25",,"6891","6894",,60,10.1021/jp902986u,"https://www.scopus.com/inward/record.uri?eid=2-s2.0-67549119252&doi=10.1021%2fjp902986u&partnerID=40&md5=be1c1a60fffcef668017f1ea429b7a97",Article,Scopus,2-s2.0-67549119252
"Van Duin, A.","Reactive Force Fields: Concepts of ReaxFF",2009,"Computational Methods in Catalysis and Materials Science: An Introduction for Scientists and Engineers",,,,"167","181",,4,10.1002/9783527625482.ch9,"https://www.scopus.com/inward/record.uri?eid=2-s2.0-84889282786&doi=10.1002%2f9783527625482.ch9&partnerID=40&md5=eb1dc3343e35ff22b33f236ea77cfdfb",Book Chapter,Scopus,2-s2.0-84889282786
"Bryantsev, V.S., Diallo, M.S., Van Duin, A.C.T., Goddard III, W.A.","Evaluation of B3LYP, X3LYP, and M06-Class density functionals for predicting the binding energies of neutral, protonated, and deprotonated water clusters",2009,"Journal of Chemical Theory and Computation","5","4",,"1016","1026",,165,10.1021/ct800549f,"https://www.scopus.com/inward/record.uri?eid=2-s2.0-65249149630&doi=10.1021%2fct800549f&partnerID=40&md5=6ffdbc7905b6cd39a7918e4b030a5067",Article,Scopus,2-s2.0-65249149630
"Chenoweth, K., Van Duin, A.C.T., Dasgupta, S., Goddard III, W.A.","Initiation mechanisms and kinetics of pyrolysis and combustion of JP-10 hydrocarbon jet fuel",2009,"Journal of Physical Chemistry A","113","9",,"1740","1746",,113,10.1021/jp8081479,"https://www.scopus.com/inward/record.uri?eid=2-s2.0-63049091264&doi=10.1021%2fjp8081479&partnerID=40&md5=97e92f6bf6e07b14fb5303653f284411",Article,Scopus,2-s2.0-63049091264
"Jaramillo-Botero, A., Abrol, R., van Duin, A., Goddard, W.A.","Multiscale-multiparadigm modeling and simulation of nanometer scale systems and processes for nanomedical applications",2009,"Nanomedicine: A Systems Engineering Approach",,,,"246","301",,,10.4032/9789814241373,"https://www.scopus.com/inward/record.uri?eid=2-s2.0-84880190509&doi=10.4032%2f9789814241373&partnerID=40&md5=7bd86bf7796505308b872add444a7fbe",Book Chapter,Scopus,2-s2.0-84880190509
"Salmon, E., van Duin, A.C.T., Lorant, F., Marquaire, P.-M., Goddard III, W.A.","Thermal decomposition process in algaenan of Botryococcus braunii race L. Part 2: Molecular dynamics simulations using the ReaxFF reactive force field",2009,"Organic Geochemistry","40","3",,"416","427",,43,10.1016/j.orggeochem.2008.08.012,"https://www.scopus.com/inward/record.uri?eid=2-s2.0-60249097248&doi=10.1016%2fj.orggeochem.2008.08.012&partnerID=40&md5=d99fa8a0d97d62ead35537a23696d47a",Article,Scopus,2-s2.0-60249097248
"Ning, N., Calvo, F., Van Duin, A.C.T., Wales, D.J., Vach, H.","Spontaneous self-assembly of silica nanocages into inorganic framework materials",2009,"Journal of Physical Chemistry C","113","2",,"518","523",,13,10.1021/jp804528z,"https://www.scopus.com/inward/record.uri?eid=2-s2.0-65249159605&doi=10.1021%2fjp804528z&partnerID=40&md5=d9c4f29599f8e6e9693d689d37f9e05b",Article,Scopus,2-s2.0-65249159605
"Davis, S.M., Belonoshko, A.B., Johansson, B., Skorodumova, N.V., Van Duin, A.C.T.","High-pressure melting curve of hydrogen",2008,"Journal of Chemical Physics","129","19", 194508,"","",,19,10.1063/1.3013704,"https://www.scopus.com/inward/record.uri?eid=2-s2.0-56849103616&doi=10.1063%2f1.3013704&partnerID=40&md5=6d6460e166c20415a4859ff1580dac15",Article,Scopus,2-s2.0-56849103616
"Zhang, L., Lee, R., Van Duin, A.","Study on gas combustions in a downhole steam generator by reactive dynamics simulations",2008,"AIChE Annual Meeting, Conference Proceedings",,,,"","",1,,,"https://www.scopus.com/inward/record.uri?eid=2-s2.0-79952306182&partnerID=40&md5=8cf3233d6c7f0ac4a7b9779b6adf51ce",Conference Paper,Scopus,2-s2.0-79952306182
"Ojwang', J.G.O., Van Santen, R., Kramer, G.J., Van Duin, A.C.T., Goddard III, W.A.","Predictions of melting, crystallization, and local atomic arrangements of aluminum clusters using a reactive force field",2008,"Journal of Chemical Physics","129","24", 244506,"","",,32,10.1063/1.3050278,"https://www.scopus.com/inward/record.uri?eid=2-s2.0-58149215846&doi=10.1063%2f1.3050278&partnerID=40&md5=5d10cca9967a1c574d56ba77afd9ff46",Article,Scopus,2-s2.0-58149215846
"Raymand, D., Edvinsson, T., Spångberg, D., Van Duin, A., Hermansson, K.","Water adsorption beyond monolayer coverage on ZnO surfaces and nanoclusters",2008,"Proceedings of SPIE - The International Society for Optical Engineering","7044",, 70440E,"","",,6,10.1117/12.795337,"https://www.scopus.com/inward/record.uri?eid=2-s2.0-56249116246&doi=10.1117%2f12.795337&partnerID=40&md5=6b33636850d925ac5f9f2253a1cf4e0e",Conference Paper,Scopus,2-s2.0-56249116246
"Van Duin, A.C.T., Merinov, B.V., Han, S.S., Dorso, C.O., Goddard III, W.A.","ReaxFF reactive force field for the Y-doped BaZrO3 proton conductor with applications to diffusion rates for multigranular systems",2008,"Journal of Physical Chemistry A","112","45",,"11414","11422",,55,10.1021/jp801082q,"https://www.scopus.com/inward/record.uri?eid=2-s2.0-57049154900&doi=10.1021%2fjp801082q&partnerID=40&md5=079e5d36f6ac843ef686523b0d9b3947",Article,Scopus,2-s2.0-57049154900
"Goddard III, W.A., Chenoweth, K., Pudar, S., Van Duin, A.C.T., Cheng, M.-J.","Structures, mechanisms, and kinetics of selective ammoxidation and oxidation of propane over multi-metal oxide catalysts",2008,"Topics in Catalysis","50","1-4",,"2","18",,38,10.1007/s11244-008-9096-x,"https://www.scopus.com/inward/record.uri?eid=2-s2.0-55149116165&doi=10.1007%2fs11244-008-9096-x&partnerID=40&md5=cd512114e34e59a8aea7f48b4c3f7aae",Article,Scopus,2-s2.0-55149116165
"Järvi, T.T., Kuronen, A., Hakala, M., Nordlund, K., Van Duin, A.C.T., Goddard III, W.A., Jacob, T.","Development of a ReaxFF description for gold",2008,"European Physical Journal B","66","1",,"75","79",,34,10.1140/epjb/e2008-00378-3,"https://www.scopus.com/inward/record.uri?eid=2-s2.0-59349114468&doi=10.1140%2fepjb%2fe2008-00378-3&partnerID=40&md5=9c659cbedbcc0522945c2b47c26dd4e4",Article,Scopus,2-s2.0-59349114468
"Ojwang', J.G.O., Van Santen, R., Kramer, G.J., Van Duin, A.C.T., Goddard III, W.A.","Modeling of hydrogen storage materials: A reactive force field for NaH",2008,"AIP Conference Proceedings","1046",,,"23","27",,2,10.1063/1.2997304,"https://www.scopus.com/inward/record.uri?eid=2-s2.0-54049126135&doi=10.1063%2f1.2997304&partnerID=40&md5=26262c7674452f685659607aca3ac714",Conference Paper,Scopus,2-s2.0-54049126135
"Bryantsev, V.S., Diallo, M.S., Van Duin, A.C.T., Goddard III, W.A.","Hydration of copper(II): New insights from density functional theory and the COSMO solvation model",2008,"Journal of Physical Chemistry A","112","38",,"9104","9112",,51,10.1021/jp804373p,"https://www.scopus.com/inward/record.uri?eid=2-s2.0-53849126514&doi=10.1021%2fjp804373p&partnerID=40&md5=2e48e11ace6e292e67c52c18b55851f6",Article,Scopus,2-s2.0-53849126514
"Chenoweth, K., Van Duin, A.C.T., Persson, P., Cheng, M.-J., Oxgaard, J., Goddard III, W.A.","Development and application of a ReaxFF reactive force field for oxidative dehydrogenation on vanadium oxide catalysts (The Journal of Physical Chemistry A (2008) 112C)",2008,"Journal of Physical Chemistry A","112","37",,"8886","",,1,10.1021/jp806988b,"https://www.scopus.com/inward/record.uri?eid=2-s2.0-53049098878&doi=10.1021%2fjp806988b&partnerID=40&md5=313548f14deaa63d443acd7d98d3484b",Erratum,Scopus,2-s2.0-53049098878
"Chenoweth, K., Van Duin, A.C.T., Persson, P., Cheng, M.-J., Oxgaard, J., Goddard III, W.A.","Development and application of a ReaxFF reactive force field for oxidative dehydrogenation on vanadium oxide catalysts",2008,"Journal of Physical Chemistry C","112","37",,"14645","14654",,65,10.1021/jp802134x,"https://www.scopus.com/inward/record.uri?eid=2-s2.0-53149142090&doi=10.1021%2fjp802134x&partnerID=40&md5=bca7b06db2ea850bdd2920c08093a42d",Article,Scopus,2-s2.0-53149142090
"Liu, B., Lusk, M.T., Ely, J.F., Van Duin, A.C.T., Goddard III, W.A.","Reactive molecular dynamics force field for the dissociation of light hydrocarbons on Ni(111)",2008,"Molecular Simulation","34","10-15",,"967","972",,5,10.1080/08927020802178609,"https://www.scopus.com/inward/record.uri?eid=2-s2.0-56749091904&doi=10.1080%2f08927020802178609&partnerID=40&md5=03464004634f076b593d54fa49c42245",Article,Scopus,2-s2.0-56749091904
"Sanz-Navarro, C.F., Åstrand, P.-O., Chen, D., Rønning, M., Van Duin, A.C.T., Mueller, J.E., Goddard III, W.A.","Molecular dynamics simulations of carbon-supported Ni clusters using the reax reactive force field",2008,"Journal of Physical Chemistry C","112","33",,"12663","12668",,21,10.1021/jp711825a,"https://www.scopus.com/inward/record.uri?eid=2-s2.0-51049106179&doi=10.1021%2fjp711825a&partnerID=40&md5=b8a6800f6af3e307070f4a5aeebc9b94",Article,Scopus,2-s2.0-51049106179
"Zhu, R., Janetzko, F., Zhang, Y., Van Duin, A.C.T., Goddard III, W.A., Salahub, D.R.","Characterization of the active site of yeast RNA polymerase II by DFT and ReaxFF calculations",2008,"Theoretical Chemistry Accounts","120","4-6",,"479","489",,31,10.1007/s00214-008-0440-9,"https://www.scopus.com/inward/record.uri?eid=2-s2.0-45449112338&doi=10.1007%2fs00214-008-0440-9&partnerID=40&md5=468778a75d4fbd31cda50367f9a246f0",Article,Scopus,2-s2.0-45449112338
"Ojwang, J.G.O., Van Santen, R., Kramer, G.J., Van Duin, A.C.T., Goddard III, W.A.","Modeling the sorption dynamics of NaH using a reactive force field",2008,"Journal of Chemical Physics","128","16", 164714,"","",,20,10.1063/1.2908737,"https://www.scopus.com/inward/record.uri?eid=2-s2.0-42949109633&doi=10.1063%2f1.2908737&partnerID=40&md5=e280407a3ee0e666a087e020e26a7065",Article,Scopus,2-s2.0-42949109633
"Raymand, D., van Duin, A.C.T., Baudin, M., Hermansson, K.","A reactive force field (ReaxFF) for zinc oxide",2008,"Surface Science","602","5",,"1020","1031",,77,10.1016/j.susc.2007.12.023,"https://www.scopus.com/inward/record.uri?eid=2-s2.0-39749190130&doi=10.1016%2fj.susc.2007.12.023&partnerID=40&md5=cbb3cff7df02976e73fc6ca08cd6d449",Article,Scopus,2-s2.0-39749190130
"Nakano, A., Kalia, R.K., Nomura, K.-I., Sharma, A., Vashishta, P., Shimojo, F., van Duin, A.C.T., Goddard III, W.A., Biswas, R., Srivastava, D., Yang, L.H.","De novo ultrascale atomistic simulations on high-end parallel supercomputers",2008,"International Journal of High Performance Computing Applications","22","1",,"113","128",,35,10.1177/1094342007085015,"https://www.scopus.com/inward/record.uri?eid=2-s2.0-38849100280&doi=10.1177%2f1094342007085015&partnerID=40&md5=0baa2e383381d4a55a6fcaa0ee95c013",Conference Paper,Scopus,2-s2.0-38849100280
"Sanz-Navarro, C.F., Åstrand, P.-O., Chen, D., Rønning, M., Van Duin, A.C.T., Jacob, T., Goddard III, W.A.","Molecular dynamics simulations of the interactions between platinum clusters and carbon platelets",2008,"Journal of Physical Chemistry A","112","7",,"1392","1402",,50,10.1021/jp074806y,"https://www.scopus.com/inward/record.uri?eid=2-s2.0-40049104795&doi=10.1021%2fjp074806y&partnerID=40&md5=caa8ccf70a79b86a94cf6418d577c39e",Article,Scopus,2-s2.0-40049104795
"Chenoweth, K., Van Duin, A.C.T., Goddard III, W.A.","ReaxFF reactive force field for molecular dynamics simulations of hydrocarbon oxidation",2008,"Journal of Physical Chemistry A","112","5",,"1040","1053",,546,10.1021/jp709896w,"https://www.scopus.com/inward/record.uri?eid=2-s2.0-39649123288&doi=10.1021%2fjp709896w&partnerID=40&md5=38b856636d3ffdce39a3bf02ca1b2cb8",Article,Scopus,2-s2.0-39649123288
"Pudar, S., Oxgaard, J., Chenoweth, K., Van Duin, A.C.T., Goddard III, W.A.","Mechanism of selective oxidation of propene to acrolein on bismuth molybdates from quantum mechanical calculations",2007,"Journal of Physical Chemistry C","111","44",,"16405","16415",,33,10.1021/jp074452a,"https://www.scopus.com/inward/record.uri?eid=2-s2.0-36348963672&doi=10.1021%2fjp074452a&partnerID=40&md5=384cc13dbeacf28080c27a4992771810",Article,Scopus,2-s2.0-36348963672
"Buehler, M.J., Tang, H., Van Duin, A.C.T., Goddard, W.A.","Threshold crack speed controls dynamical fracture of silicon single crystals",2007,"Physical Review Letters","99","16", 165502,"","",,72,10.1103/PhysRevLett.99.165502,"https://www.scopus.com/inward/record.uri?eid=2-s2.0-35348999510&doi=10.1103%2fPhysRevLett.99.165502&partnerID=40&md5=d7923dfa62a612d28e9d1a96fb30ab2b",Article,Scopus,2-s2.0-35348999510
"Nomura, K.-I., Kalia, R.K., Nakano, A., Vashishta, P., Van Duin, A.C.T., Goddard, W.A.","Dynamic transition in the structure of an energetic crystal during chemical reactions at shock front prior to detonation",2007,"Physical Review Letters","99","14", 148303,"","",,83,10.1103/PhysRevLett.99.148303,"https://www.scopus.com/inward/record.uri?eid=2-s2.0-35148879083&doi=10.1103%2fPhysRevLett.99.148303&partnerID=40&md5=e337011af30da1cfac580402f94abc61",Article,Scopus,2-s2.0-35148879083
"Tang, H., Rye, J., Buehler, M.J., Van Duin, A., Goddard III, W.A.","Quantization of crack speeds in dynamic fracture of silicon: Multiparadigm ReaxFF modeling",2007,"Materials Research Society Symposium Proceedings","910",,,"149","154",,1,,"https://www.scopus.com/inward/record.uri?eid=2-s2.0-34249944641&partnerID=40&md5=12f3e070107383aad078f02aeb1b3a7a",Conference Paper,Scopus,2-s2.0-34249944641
"Su, H., Nielsen, R.J., Van Duin, A.C.T., Goddard III, W.A.","Simulations on the effects of confinement and Ni-catalysis on the formation of tubular fullerene structures from peapod precursors",2007,"Physical Review B - Condensed Matter and Materials Physics","75","13", 134107,"","",,21,10.1103/PhysRevB.75.134107,"https://www.scopus.com/inward/record.uri?eid=2-s2.0-34247480598&doi=10.1103%2fPhysRevB.75.134107&partnerID=40&md5=5b7d8c1fd7389410891704a62893a502",Article,Scopus,2-s2.0-34247480598
"Cheng, M.-J., Chenoweth, K., Oxgaard, J., Van Duin, A., Goddard III, W.A.","Single-site vanadyl activation, functionalization, and reoxidation reaction mechanism for propane oxidative dehydrogenation on the cubic v <inf>4</inf>O<inf>10</inf> cluster",2007,"Journal of Physical Chemistry C","111","13",,"5115","5127",,58,10.1021/jp0663917,"https://www.scopus.com/inward/record.uri?eid=2-s2.0-34247389311&doi=10.1021%2fjp0663917&partnerID=40&md5=f7377f6f0790d96e019671bf9af53631",Article,Scopus,2-s2.0-34247389311
"Nakano, A., Kalia, R.K., Nomura, K.-i., Sharma, A., Vashishta, P., Shimojo, F., van Duin, A.C.T., Goddard, W.A., Biswas, R., Srivastava, D.","A divide-and-conquer/cellular-decomposition framework for million-to-billion atom simulations of chemical reactions",2007,"Computational Materials Science","38","4",,"642","652",,68,10.1016/j.commatsci.2006.04.012,"https://www.scopus.com/inward/record.uri?eid=2-s2.0-33846340428&doi=10.1016%2fj.commatsci.2006.04.012&partnerID=40&md5=0217be2f518c60aef1d227fedc0b4ef5",Article,Scopus,2-s2.0-33846340428
"Buehler, M.J., Tang, H., Van Duin, A.C.T., Goddard, W.A.","Threshold crack speed in dynamic fracture of silicon",2006,"Materials Research Society Symposium Proceedings","978",,,"268","273",,,,"https://www.scopus.com/inward/record.uri?eid=2-s2.0-41549152205&partnerID=40&md5=ac7425059d1bd1f868bf064655ee4657",Conference Paper,Scopus,2-s2.0-41549152205
"Zhang, L., Zybin, S.V., Van Duin, A.C.T., Dasgupta, S., Goddard III, W.A.","Thermal decomposition of energetic materials by reaxFF reactive molecular dynamics",2006,"AIP Conference Proceedings","845 I",,,"589","592",,8,10.1063/1.2263391,"https://www.scopus.com/inward/record.uri?eid=2-s2.0-33846251966&doi=10.1063%2f1.2263391&partnerID=40&md5=d1e5bf451f6c4bae60978f88cd7145fc",Conference Paper,Scopus,2-s2.0-33846251966
"Zybin, S.V., Zhang, L., Kim, H., Van Duin, A.C.T., Goddard, W.A.","Analysis of shock decomposition and sensitivity of energetic materials with reaxff molecular dynamics",2006,"Proceedings of the 13th International Detonation Symposium, IDS 2006",,,,"848","856",,3,,"https://www.scopus.com/inward/record.uri?eid=2-s2.0-84883314257&partnerID=40&md5=219bf22799e799c80085e93353757691",Conference Paper,Scopus,2-s2.0-84883314257
"Zhang, L., Zybin, S.V., Van Duin, A.C.T., Dasgupta, S., Goddard III, W.A.","Shock induced decomposition and sensitivity of energetic materials by reaxFF molecular dynamics",2006,"AIP Conference Proceedings","845 I",,,"585","588",,4,10.1063/1.2263390,"https://www.scopus.com/inward/record.uri?eid=2-s2.0-33846201293&doi=10.1063%2f1.2263390&partnerID=40&md5=bdffc91a153148ce5e9c8342350420e8",Conference Paper,Scopus,2-s2.0-33846201293
"Oleynik, I.I., Conroy, M., Zybin, S.V., Zhang, L., Van Duin, A.C., Goddard III, W.A., White, C.T.","Energetic materials at high compression: First-principles density functional theory and reactive force field studies",2006,"AIP Conference Proceedings","845 I",,,"573","576",,4,10.1063/1.2263387,"https://www.scopus.com/inward/record.uri?eid=2-s2.0-33846233472&doi=10.1063%2f1.2263387&partnerID=40&md5=4e165cb3b659321bfce6e1aba918ad16",Conference Paper,Scopus,2-s2.0-33846233472
"Goddard III, W.A., Merinov, B., Jang, S.S., Deng, W.Q., Van Duin, A.C., Voecks, G.","Multi-paradigm simulations toward the design of improved fuel cell catalysts and membranes",2006,"AIChE Annual Meeting, Conference Proceedings",,,,"","",1,,,"https://www.scopus.com/inward/record.uri?eid=2-s2.0-58049117891&partnerID=40&md5=8b6eb19db6fb9962fbbd7bb7dba09495",Conference Paper,Scopus,2-s2.0-58049117891
"Van Duin, A.C.T., Zybin, S.V., Chenoweth, K., Zhang, L., Han, S., Strachan, A., Goddard III, W.A.","Reactive force fields based on quantum mechanics for applications to materials at extreme conditions",2006,"AIP Conference Proceedings","845 I",,,"581","584",,7,10.1063/1.2263389,"https://www.scopus.com/inward/record.uri?eid=2-s2.0-33846224810&doi=10.1063%2f1.2263389&partnerID=40&md5=bec27c7b3fa92dab141193dbad495df0",Conference Paper,Scopus,2-s2.0-33846224810
"Zhang, Q., Van Duin, A.C.T., Cagin, T., Goddard III, W.A., Martin, J.M., De Barros-Bouchet, M.I., Le Mogne, T., Sagawa, T., Okuda, S.","The structure and sliding friction of diamond-like carbon surfaces from molecular dynamics simulations",2006,"Proceedings of STLE/ASME International Joint Tribology Conference, IJTC 2006","2006",,,"","",10,1,,"https://www.scopus.com/inward/record.uri?eid=2-s2.0-33751370827&partnerID=40&md5=baaa4729316931442e2b198869b42fd9",Conference Paper,Scopus,2-s2.0-33751370827
"Persson, P., Lundqvist, M.J., Nilsing, M., Van Duin, A.C.T., Goddard III, W.A.","Quantum-chemical calculations of dye-sensitized semiconductor nanocrystals",2006,"Proceedings of SPIE - The International Society for Optical Engineering","6325",, 63250P,"","",,1,10.1117/12.681717,"https://www.scopus.com/inward/record.uri?eid=2-s2.0-33751116982&doi=10.1117%2f12.681717&partnerID=40&md5=cc8c8f8e373624750984e84dde6ed79b",Conference Paper,Scopus,2-s2.0-33751116982
"Goddard III, W.A., Van Duin, A., Chenoweth, K., Cheng, M.-J., Pudar, S., Oxgaard, J., Merinov, B., Jang, Y.H., Persson, P.","Development of the ReaxFF reactive force field for mechanistic studies of catalytic selective oxidation processes on BiMoO<inf>x</inf>",2006,"Topics in Catalysis","38","1-3",,"93","103",,67,10.1007/s11244-006-0074-x,"https://www.scopus.com/inward/record.uri?eid=2-s2.0-33749150817&doi=10.1007%2fs11244-006-0074-x&partnerID=40&md5=0948dd9a223a5690286fabab1c9444fe",Article,Scopus,2-s2.0-33749150817
"Buehler, M.J., Dodson, J., Van Duin, A.C.T., Meulbroek, P., Goddard III, W.A.","The Computational Materials Design Facility (CMDF): A powerful framework for multi-paradigm multi-scale simulations",2006,"Materials Research Society Symposium Proceedings","894",,,"327","332",,11,,"https://www.scopus.com/inward/record.uri?eid=2-s2.0-33745373074&partnerID=40&md5=d0de071f0420127f6243097cad9d69b1",Conference Paper,Scopus,2-s2.0-33745373074
"Hudson, T.S., Nguyen-Manh, D., van Duin, A.C.T., Sutton, A.P.","Grand canonical Monte Carlo simulations of intergranular glassy films in β silicon nitride",2006,"Materials Science and Engineering A","422","1-2",,"123","135",,17,10.1016/j.msea.2006.01.014,"https://www.scopus.com/inward/record.uri?eid=2-s2.0-33645950105&doi=10.1016%2fj.msea.2006.01.014&partnerID=40&md5=a78ff54ff7c9f08eb9070b720f3ea7cc",Article,Scopus,2-s2.0-33645950105
"Buehler, M.J., Van Duin, A.C.T., Goddard III, W.A.","Multiparadigm modeling of dynamical crack propagation in silicon using a reactive force field",2006,"Physical Review Letters","96","9", 095505,"","",,150,10.1103/PhysRevLett.96.095505,"https://www.scopus.com/inward/record.uri?eid=2-s2.0-33644894526&doi=10.1103%2fPhysRevLett.96.095505&partnerID=40&md5=4b5786aef14510977257a1b6fc0261bc",Article,Scopus,2-s2.0-33644894526
"Ludwig, J., Vlachos, D.G., Van Duin, A.C.T., Goddard III, W.A.","Dynamics of the dissociation of hydrogen on stepped platinum surfaces using the ReaxFF reactive force field",2006,"Journal of Physical Chemistry B","110","9",,"4274","4282",,89,10.1021/jp0561064,"https://www.scopus.com/inward/record.uri?eid=2-s2.0-33645686437&doi=10.1021%2fjp0561064&partnerID=40&md5=4afc6e7fccb4b9bc8724f89fc6d1309b",Article,Scopus,2-s2.0-33645686437
