Authors,Title,Year,Source title,Volume,Issue,Art. No.,Page start,Page end,Page count,Cited by,DOI,Link,Document Type,Source,EID
"Sum, A.K., Sandler, S.I., Bukowski, R., Szalewicz, K.","Prediction of the phase behavior of acetonitrile and methanol with ab initio pair potentials. I. Pure components",2002,"Journal of Chemical Physics","116","17",,"7627","7636",,29,10.1063/1.1464822,"https://www.scopus.com/inward/record.uri?eid=2-s2.0-0036573179&doi=10.1063%2f1.1464822&partnerID=40&md5=f719483bceb765e8c49234f1ba16d8b0",Article,Scopus,2-s2.0-0036573179
"Sum, A.K., Sandler, S.I., Bukowski, R., Szalewicz, K.","Prediction of the phase behavior of acetonitrile and methanol with ab initio pair potentials. II. The mixture",2002,"Journal of Chemical Physics","116","17",,"7637","7644",,21,10.1063/1.1464823,"https://www.scopus.com/inward/record.uri?eid=2-s2.0-0036573186&doi=10.1063%2f1.1464823&partnerID=40&md5=8153cc938ed544d77c7e1f9bb33de098",Article,Scopus,2-s2.0-0036573186
"Murdachaew, G., Szalewicz, K., Bukowski, R.","Efficient generation of flexible-monomer intermolecular potential energy surfaces",2002,"Physical Review Letters","88","12",,"1232021","1232024",,10,,"https://www.scopus.com/inward/record.uri?eid=2-s2.0-0037171239&partnerID=40&md5=ad6dd3b497cc90c7ae6eaca5fcf6c14e",Article,Scopus,2-s2.0-0037171239
"Murdachaew, G., Szalewicz, K.","Intermolecular potentials with flexible monomers",2001,"Faraday Discussions","118",,,"121","142",,13,,"https://www.scopus.com/inward/record.uri?eid=2-s2.0-0007754820&partnerID=40&md5=0ef42e511eedb87551796f643ff99c99",Conference Paper,Scopus,2-s2.0-0007754820
"Patkowski, K., Jeziorski, B., Szalewicz, K.","Symmetry-adapted perturbation theory with regularized coulomb potential",2001,"Journal of Molecular Structure: THEOCHEM","547",,,"293","307",,23,10.1016/S0166-1280(01)00478-X,"https://www.scopus.com/inward/record.uri?eid=2-s2.0-0035939380&doi=10.1016%2fS0166-1280%2801%2900478-X&partnerID=40&md5=db54dc6a2f6e68cfd601485a03170d04",Article,Scopus,2-s2.0-0035939380
"Smit, M.J., Groenenboom, G.C., Wormer, P.E.S., Van Der Avoird, A., Bukowski, R., Szalewicz, K.","Vibrations, tunneling, and transition dipole moments in the water dimer",2001,"Journal of Physical Chemistry A","105","25",,"6212","6225",,52,10.1021/jp004609y,"https://www.scopus.com/inward/record.uri?eid=2-s2.0-0035963808&doi=10.1021%2fjp004609y&partnerID=40&md5=7b2e4aa60dbed9306c8bcf53e6a73254",Article,Scopus,2-s2.0-0035963808
"Cencek, W., Szalewicz, K., Jeziorski, B.","Breit-Pauli and direct perturbation theory calculations of relativistic helium polarizability",2001,"Physical Review Letters","86","25",,"5675","5678",,53,10.1103/PhysRevLett.86.5675,"https://www.scopus.com/inward/record.uri?eid=2-s2.0-0035908059&doi=10.1103%2fPhysRevLett.86.5675&partnerID=40&md5=73cb7e636d01754b562d2a88134e2ee1",Article,Scopus,2-s2.0-0035908059
"Bukowski, R., Szalewicz, K.","Complete ab initio three-body nonadditive potential in Monte Carlo simulations of vapor-liquid equilibria and pure phases of argon",2001,"Journal of Chemical Physics","114","21",,"9518","9531",,57,10.1063/1.1370084,"https://www.scopus.com/inward/record.uri?eid=2-s2.0-0035367518&doi=10.1063%2f1.1370084&partnerID=40&md5=ca5ad76cf89b0c781abcbb534f5c1dec",Article,Scopus,2-s2.0-0035367518
"Jankowski, P., Tsang, S.N., Klemperer, W., Szalewicz, K.","Spectra of N<inf>2</inf>-HF from symmetry-adapted perturbation theory potential",2001,"Journal of Chemical Physics","114","20",,"8948","8963",,14,10.1063/1.1362326,"https://www.scopus.com/inward/record.uri?eid=2-s2.0-0035932877&doi=10.1063%2f1.1362326&partnerID=40&md5=85c4309c2e22f229b614a87bde771eee",Article,Scopus,2-s2.0-0035932877
"Murdachaew, G., Misquitta, A.J., Bukowski, R., Szalewicz, K.","Intermolecular potential energy surfaces and spectra of Ne-HCN complex from ab initio calculations",2001,"Journal of Chemical Physics","114","2",,"764","779",,40,10.1063/1.1331101,"https://www.scopus.com/inward/record.uri?eid=2-s2.0-0035128147&doi=10.1063%2f1.1331101&partnerID=40&md5=8ff304b9bdc5cca40628c1f708143bc6",Article,Scopus,2-s2.0-0035128147
"Groenenboom, G.C., Wormer, P.E.S., Van Der Avoird, A., Mas, E.M., Bukowski, R., Szalewicz, K.","Water pair potential of near spectroscopic accuracy. II. Vibration-rotation-tunneling levels of the water dimer",2000,"Journal of Chemical Physics","113","16",,"6702","6715",,85,10.1063/1.1311290,"https://www.scopus.com/inward/record.uri?eid=2-s2.0-0034296628&doi=10.1063%2f1.1311290&partnerID=40&md5=65540cdbbc107261a54d363800d81f3f",Article,Scopus,2-s2.0-0034296628
"Mas, E.M., Bukowski, R., Szalewicz, K., Groenenboom, G.C., Wormer, P.E.S., Van Der Avoird, A.","Water pair potential of near spectroscopic accuracy. I. Analysis of potential surface and virial coefficients",2000,"Journal of Chemical Physics","113","16",,"6687","6701",,131,10.1063/1.1311289,"https://www.scopus.com/inward/record.uri?eid=2-s2.0-0034295241&doi=10.1063%2f1.1311289&partnerID=40&md5=1bfb431948d609c0b6ca297b24687f20",Article,Scopus,2-s2.0-0034295241
"Jeziorska, M., Jankowski, P., Szalewicz, K., Jeziorski, B.","On the optimal choice of monomer geometry in calculations of intermolecular interaction energies: rovibrational spectrum of Ar-HF from two- and three-dimensional potentials",2000,"Journal of Chemical Physics","113","8",,"2957","2968",,80,,"https://www.scopus.com/inward/record.uri?eid=2-s2.0-0034702699&partnerID=40&md5=29882d1dfeeb17d286e55c4e641f6526",Article,Scopus,2-s2.0-0034702699
"Groenenboom, G.C., Mas, E.M., Bukowski, R., Szalewicz, K., Wormer, P.E.S., Van der Avoird, A.","Water Pair and Three-Body Potential of Spectroscopic Quality from Ab Initio Calculations",2000,"Physical Review Letters","84","18",,"4072","4075",,87,,"https://www.scopus.com/inward/record.uri?eid=2-s2.0-0000035334&partnerID=40&md5=4350ffcb1733e0491e4d3ba732b50059",Article,Scopus,2-s2.0-0000035334
"Misquitta, A.J., Bukowski, R., Szalewicz, K.","Spectra of Ar-CO<inf>2</inf> from ab initio potential energy surfaces",2000,"Journal of Chemical Physics","112","12",,"5308","5319",,53,,"https://www.scopus.com/inward/record.uri?eid=2-s2.0-0001340861&partnerID=40&md5=4a0de1813e8a274ad2a80fc0138ec4e7",Article,Scopus,2-s2.0-0001340861
"Bakalov, D., Jeziorski, B., Korona, T., Szalewicz, K., Tchoukova, E.","Density Shift and Broadening of Transition Lines in Antiprotonic Helium",2000,"Physical Review Letters","84","11",,"2350","2353",,30,,"https://www.scopus.com/inward/record.uri?eid=2-s2.0-0001376445&partnerID=40&md5=bdc64c5390a35611bc0a89a28e58f1ae",Article,Scopus,2-s2.0-0001376445
"Lotrich, V.F., Szalewicz, K.","Perturbation theory of three-body exchange nonadditivity and application to helium trimer",2000,"Journal of Chemical Physics","112","1",,"112","121",,54,,"https://www.scopus.com/inward/record.uri?eid=2-s2.0-0000810214&partnerID=40&md5=b01c190decf04aea22330545289f6b04",Article,Scopus,2-s2.0-0000810214
"Bukowski, R., Szalewicz, K., Chabalowski, C.F.","Ab Initio Interaction Potentials for Simulations of Dimethylnitramine Solutions in Supercritical Carbon Dioxide with Cosolvents",1999,"Journal of Physical Chemistry A","103","36",,"7322","7340",,68,,"https://www.scopus.com/inward/record.uri?eid=2-s2.0-0000861692&partnerID=40&md5=eb92de6828b57c9d21c3328f5e4796a7",Article,Scopus,2-s2.0-0000861692
"Mas, E.M., Lotrich, V.F., Szalewicz, K.","Third virial coefficient of argon",1999,"Journal of Chemical Physics","110","14",,"6694","6701",,24,,"https://www.scopus.com/inward/record.uri?eid=2-s2.0-0000072913&partnerID=40&md5=ad9799bb790bcd189693aaefdc5756cb",Article,Scopus,2-s2.0-0000072913
"Bukowski, R., Jeziorski, B., Szalewicz, K.","Gaussian geminals in explicitly correlated coupled cluster theory including single and double excitations",1999,"Journal of Chemical Physics","110","9",,"4165","4183",,58,,"https://www.scopus.com/inward/record.uri?eid=2-s2.0-0001731455&partnerID=40&md5=1f0ed5185dfbf24830fedf8028fe0ac4",Article,Scopus,2-s2.0-0001731455
"Bukowski, R., Sadlej, J., Jeziorski, B., Jankowski, P., Szalewicz, K., Kucharski, S.A., Williams, H.L., Rice, B.M.","Intermolecular potential of carbon dioxide dimer from symmetry-adapted perturbation theory",1999,"Journal of Chemical Physics","110","8",,"3785","3803",,232,,"https://www.scopus.com/inward/record.uri?eid=2-s2.0-0000653431&partnerID=40&md5=77efc1e6097134eaf389aa9f9fc03b59",Article,Scopus,2-s2.0-0000653431
"Szalewicz, K., Jeziorski, B.","Comment on ""on the importance of the fragment relaxation energy terms in the estimation of the basis set superposition error correction to the intermolecular interaction energy"" [J. Chem. Phys. 104, 8821 (1996)]",1998,"Journal of Chemical Physics","109","3",,"1198","1200",,83,10.1063/1.476667,"https://www.scopus.com/inward/record.uri?eid=2-s2.0-0342354218&doi=10.1063%2f1.476667&partnerID=40&md5=b997125e5aaeebf08b1e18ff26711e87",Review,Scopus,2-s2.0-0342354218
"Lotrich, V.F., Szalewicz, K., Jeziorski, B.","Multiple electron exchanges in calculations of pairwise nonadditive contribution to trimer interaction energy",1998,"Polish Journal of Chemistry","72","7 SUPPL.",,"1826","1848",,8,,"https://www.scopus.com/inward/record.uri?eid=2-s2.0-0032340106&partnerID=40&md5=7eba44c9daf077581cbef00cc289818c",Article,Scopus,2-s2.0-0032340106
"Bukowski, R., Jeziorski, B., Szalewicz, K.","Analytic first-order properties from explicitly correlated many-body perturbation theory and Gaussian geminal basis",1998,"Journal of Chemical Physics","108","19",,"7946","7958",,9,,"https://www.scopus.com/inward/record.uri?eid=2-s2.0-0011957289&partnerID=40&md5=7feb6b504b23a5c9dfccf36a5e467cc3",Article,Scopus,2-s2.0-0011957289
"Komasa, J., Szalewicz, K., Leszczyński, J.","Does the methyl group form a hydrogen bond? Ab initio post-Hartree-Fock study on ethane-hydrogen cyanide complex",1998,"Chemical Physics Letters","285","5-6",,"449","454",,10,,"https://www.scopus.com/inward/record.uri?eid=2-s2.0-0000417924&partnerID=40&md5=2e06de79ee3f8593e2d48c4ad9a449db",Article,Scopus,2-s2.0-0000417924
"Lotrich, V.F., Jankowski, P., Szalewicz, K.","Symmetry-adapted perturbation theory of three-body nonadditivity in the Ar<inf>2</inf>HF trimer",1998,"Journal of Chemical Physics","108","12",,"4725","4738",,23,,"https://www.scopus.com/inward/record.uri?eid=2-s2.0-0000147339&partnerID=40&md5=1256877f0ad07b40e58e7f60d4273011",Article,Scopus,2-s2.0-0000147339
"Jankowski, P., Szalewicz, K.","Ab initio potential energy surface and infrared spectra of H<inf>2</inf>-CO and D<inf>2</inf>-CO van der Waals complexes",1998,"Journal of Chemical Physics","108","9",,"3554","3565",,79,,"https://www.scopus.com/inward/record.uri?eid=2-s2.0-0001356752&partnerID=40&md5=7765267049147b72fa0d8ff534732755",Article,Scopus,2-s2.0-0001356752
"Jeziorski, B., Bukowski, R., Szalewicz, K.","Completeness criteria for explicitly correlated Gaussian geminal bases of axial symmetry",1997,"International Journal of Quantum Chemistry","61","5",,"769","776",,21,,"https://www.scopus.com/inward/record.uri?eid=2-s2.0-0348011968&partnerID=40&md5=731d930958a53a5fe6449b387e52f225",Article,Scopus,2-s2.0-0348011968
"Mas, E.M., Szalewicz, K., Bukowski, R., Jeziorski, B.","Pair potential for water from symmetry-adapted perturbation theory",1997,"Journal of Chemical Physics","107","11",,"4207","4218",,120,,"https://www.scopus.com/inward/record.uri?eid=2-s2.0-0001125626&partnerID=40&md5=e4d74787928170af91404915b8509a28",Article,Scopus,2-s2.0-0001125626
"Lotrich, V.F., Szalewicz, K.","Three-body contribution to binding energy of solid argon and analysis of crystal structure",1997,"Physical Review Letters","79","7",,"1301","1304",,64,,"https://www.scopus.com/inward/record.uri?eid=2-s2.0-0001033523&partnerID=40&md5=458cd0857f97fe926608a77e4c75f271",Article,Scopus,2-s2.0-0001033523
"Lotrich, V.F., Szalewicz, K.","Symmetry-adapted perturbation theory of three-body nonadditivity of intermolecular interaction energy",1997,"Journal of Chemical Physics","106","23",,"9668","9687",,93,,"https://www.scopus.com/inward/record.uri?eid=2-s2.0-0031162549&partnerID=40&md5=1ffb5359d1d3eaf9874e747199d9670a",Article,Scopus,2-s2.0-0031162549
"Lotrich, V.F., Szalewicz, K.","Symmetry-adapted perturbation theory of three-body nonadditivity in Ar trimer",1997,"Journal of Chemical Physics","106","23",,"9688","9702",,79,,"https://www.scopus.com/inward/record.uri?eid=2-s2.0-0011064938&partnerID=40&md5=7e0810054327f3485bec5ede71698fa3",Article,Scopus,2-s2.0-0011064938
"Korona, T., Williams, H.L., Bukowski, R., Jeziorski, B., Szalewicz, K.","Helium dimer potential from symmetry-adapted perturbation theory calculations using large Gaussian geminal and orbital basis sets",1997,"Journal of Chemical Physics","106","12",,"5109","5122",,245,,"https://www.scopus.com/inward/record.uri?eid=2-s2.0-0000696242&partnerID=40&md5=84dd7e20420fb9b236d7a2d309e03cfc",Article,Scopus,2-s2.0-0000696242
"Mas, E.M., Szalewicz, K.","Effects of monomer geometry and basis set saturation on computed depth of water dimer potential",1996,"Journal of Chemical Physics","104","19",,"7606","7614",,135,,"https://www.scopus.com/inward/record.uri?eid=2-s2.0-0000645026&partnerID=40&md5=b6d7da631e1dbd6cb0f44c4ff55de397",Article,Scopus,2-s2.0-0000645026
"Bukowski, R., Jeziorski, B., Szalewicz, K.","Basis set superposition problem in interaction energy calculations with explicitly correlated bases: Saturated second- and third-order energies for He<inf>2</inf>",1996,"Journal of Chemical Physics","104","9",,"3306","3319",,71,,"https://www.scopus.com/inward/record.uri?eid=2-s2.0-0001764147&partnerID=40&md5=d09b1f9d4ec906111caca948908d3584",Article,Scopus,2-s2.0-0001764147
"Williams, H.L., Korona, T., Bukowski, R., Jeziorski, B., Szalewicz, K.","Helium dimer potential from symmetry-adapted perturbation theory",1996,"Chemical Physics Letters","262","3-4",,"431","436",,50,,"https://www.scopus.com/inward/record.uri?eid=2-s2.0-0030588741&partnerID=40&md5=9ab6e98e738099f5e47a89629261ba58",Article,Scopus,2-s2.0-0030588741
"Sohlberg, K., Szalewicz, K.","Dynamical coupling of the diatom vibrational motions in collisions of N2 with N+2",1996,"Chemical Physics","206","1-2",,"87","101",,2,,"https://www.scopus.com/inward/record.uri?eid=2-s2.0-0030558473&partnerID=40&md5=ce546f2362f37b00bc664e2510290e82",Article,Scopus,2-s2.0-0030558473
"Williams, H.L., Mas, E.M., Szalewicz, K., Jeziorski, B.","On the effectiveness of monomer-, dimer-, and bond-centered basis functions in calculations of intermolecular interaction energies",1995,"The Journal of Chemical Physics","103","17",,"7374","7391",,174,,"https://www.scopus.com/inward/record.uri?eid=2-s2.0-0004158374&partnerID=40&md5=22f69719dc19a92e57b14c20d70ddf03",Article,Scopus,2-s2.0-0004158374
"Bukowski, R., Jeziorski, B., Rybak, S., Szalewicz, K.","Second-order correlation energy for H<inf>2</inf>O using explicitly correlated Gaussian geminals",1995,"The Journal of Chemical Physics","102","2",,"888","897",,38,,"https://www.scopus.com/inward/record.uri?eid=2-s2.0-36448999435&partnerID=40&md5=4cd8eee1042e270009715e041cea76ed",Article,Scopus,2-s2.0-36448999435
"Williams, H.L., Szalewicz, K., Moszynski, R., Jeziorski, B.","Dispersion energy in the coupled pair approximation with noniterative inclusion of single and triple excitations",1995,"The Journal of Chemical Physics","103","11",,"4586","4599",,42,,"https://www.scopus.com/inward/record.uri?eid=2-s2.0-0001507547&partnerID=40&md5=b49937c11ba872fd56f26bf3340fced5",Article,Scopus,2-s2.0-0001507547
"Lotrich, V.F., Williams, H.L., Szalewicz, K., Jeziorski, B., Moszynski, R., Wormer, P.E.S., Van Der Avoird, A.","Intermolecular potential and rovibrational levels of Ar-HF from symmetry-adapted perturbation theory",1995,"The Journal of Chemical Physics","103","14",,"6076","6092",,53,,"https://www.scopus.com/inward/record.uri?eid=2-s2.0-0001007911&partnerID=40&md5=6808e569935619f2bb8b496598a83d9c",Article,Scopus,2-s2.0-0001007911
"Bukowski, R., Jeziorski, B., Szalewicz, K.","New effective strategy of generating Gaussian-type geminal basis sets for correlation energy calculations",1994,"The Journal of Chemical Physics","100","2",,"1366","1374",,23,,"https://www.scopus.com/inward/record.uri?eid=2-s2.0-0000725245&partnerID=40&md5=081aee24f6a5b2dbc459c30a6a0f24f5",Article,Scopus,2-s2.0-0000725245
"Moszynski, R., Jeziorski, B., Szalewicz, K.","Many-body theory of exchange effects in intermolecular interactions. Second-quantization approach and comparison with full configuration interaction results",1994,"The Journal of Chemical Physics","100","2",,"1312","1325",,96,,"https://www.scopus.com/inward/record.uri?eid=2-s2.0-0000841907&partnerID=40&md5=25c87783eaec46f602f5d4eae9f8dc08",Article,Scopus,2-s2.0-0000841907
"Moszynski, R., Jeziorski, B., Rybak, S., Szalewicz, K., Williams, H.L.","Many-body theory of exchange effects in intermolecular interactions. Density matrix approach and applications to He-F-, He-HF, H <inf>2</inf>-HF, and Ar-H<inf>2</inf> dimers",1994,"The Journal of Chemical Physics","100","7",,"5080","5092",,108,,"https://www.scopus.com/inward/record.uri?eid=2-s2.0-36449006441&partnerID=40&md5=1c46406e1c609836bda03f47b6f15f01",Article,Scopus,2-s2.0-36449006441
"Jeziorski, B., Moszynski, R., Szalewicz, K.","Perturbation Theory Approach to Intermolecular Potential Energy Surfaces of van der Waals Complexes",1994,"Chemical Reviews","94","7",,"1887","1930",,1349,10.1021/cr00031a008,"https://www.scopus.com/inward/record.uri?eid=2-s2.0-0001312393&doi=10.1021%2fcr00031a008&partnerID=40&md5=bf9009e8590d4c05695df46b348ab488",Article,Scopus,2-s2.0-0001312393
"Froelich, P., Flores-Riveros, A., Wallenius, J., Szalewicz, K.","Fusion in flight from the molecular continuum of dtμ",1994,"Physics Letters A","189","4",,"307","315",,1,10.1016/0375-9601(94)90101-5,"https://www.scopus.com/inward/record.uri?eid=2-s2.0-5544323955&doi=10.1016%2f0375-9601%2894%2990101-5&partnerID=40&md5=34a92718b5401f1eae9eb56846d1ef55",Article,Scopus,2-s2.0-5544323955
"Cwiok, T., Jeziorski, B., Kolos, W., Moszynski, R., Szalewicz, K.","Symmetry-adapted perturbation theory of potential-energy surfaces for weakly bound molecular complexes",1994,"Journal of Molecular Structure: THEOCHEM","307","C",,"135","151",,33,10.1016/0166-1280(94)80124-X,"https://www.scopus.com/inward/record.uri?eid=2-s2.0-0000072619&doi=10.1016%2f0166-1280%2894%2980124-X&partnerID=40&md5=9e1dbe6f601c5040be166ec1d52161db",Article,Scopus,2-s2.0-0000072619
"Williams, H.L., Szalewicz, K., Jeziorski, B., Moszynski, R., Rybak, S.","Symmetry-adapted perturbation theory calculation of the Ar-H<inf>2</inf> intermolecular potential energy surface",1993,"The Journal of Chemical Physics","98","2",,"1279","1292",,126,,"https://www.scopus.com/inward/record.uri?eid=2-s2.0-12144270308&partnerID=40&md5=c7b4f0399186de89ff0d15371d630078",Article,Scopus,2-s2.0-12144270308
"Moszynski, R., Jeziorski, B., Szalewicz, K.","Møller–Plesset expansion of the dispersion energy in the ring approximation",1993,"International Journal of Quantum Chemistry","45","5",,"409","431",,4,10.1002/qua.560450502,"https://www.scopus.com/inward/record.uri?eid=2-s2.0-84990642799&doi=10.1002%2fqua.560450502&partnerID=40&md5=8faa9aa3d67ab0dddb6b77d341e31b17",Article,Scopus,2-s2.0-84990642799
"Froelich, P., Jeziorski, B., Kolos, W., Monkhorst, H., Saenz, A., Szalewicz, K.","Probability distribution of excitations to the electronic continuum of HeT+ following the β decay of the T2 molecule",1993,"Physical Review Letters","71","18",,"2871","2874",,36,10.1103/PhysRevLett.71.2871,"https://www.scopus.com/inward/record.uri?eid=2-s2.0-0001410043&doi=10.1103%2fPhysRevLett.71.2871&partnerID=40&md5=5ae693ed75d3cb900947f9772dd68f6b",Article,Scopus,2-s2.0-0001410043
"Ćwiok, T., Jeziorski, B., Kołos, W., Moszynski, R., Szalewicz, K.","On the convergence of the symmetrized Rayleigh-Schrödinger perturbation theory for molecular interaction energies",1992,"The Journal of Chemical Physics","97","10",,"7555","7559",,54,,"https://www.scopus.com/inward/record.uri?eid=2-s2.0-0001150001&partnerID=40&md5=0c6d0a2da1635c4ce19f2c4de6b6b386",Article,Scopus,2-s2.0-0001150001
"Ryback, S., Szalewicz, K., Jeziorski, B., Corongiu, G.","Symmetry-adapted perturbation theory calculations of uracil-water interaction energy",1992,"Chemical Physics Letters","199","6",,"567","573",,19,10.1016/0009-2614(92)85011-X,"https://www.scopus.com/inward/record.uri?eid=2-s2.0-0001313680&doi=10.1016%2f0009-2614%2892%2985011-X&partnerID=40&md5=85bbc9bc1f01da4a2249044fc499eeb5",Article,Scopus,2-s2.0-0001313680
"Moszynski, R., Jeziorski, B., Szalewicz, K.","Many-body symmetry-adapted perturbation theory study of the He⋯F- interaction",1992,"Chemical Physics","166","3",,"329","339",,25,10.1016/0301-0104(92)80093-B,"https://www.scopus.com/inward/record.uri?eid=2-s2.0-0040737483&doi=10.1016%2f0301-0104%2892%2980093-B&partnerID=40&md5=d9400b4a49bea890b174c3643632c8e3",Article,Scopus,2-s2.0-0040737483
"Ćwiok, T., Jeziorski, B., Kołos, W., Moszynski, R., Rychlewski, J., Szalewicz, K.","Convergence properties and large-order behavior of the polarization expansion for the interaction energy of hydrogen atoms",1992,"Chemical Physics Letters","195","1",,"67","76",,36,10.1016/0009-2614(92)85912-T,"https://www.scopus.com/inward/record.uri?eid=2-s2.0-0002246466&doi=10.1016%2f0009-2614%2892%2985912-T&partnerID=40&md5=7e8448e37331de9cb04236fe87036a6e",Article,Scopus,2-s2.0-0002246466
"Sohlberg, K., Futrell, J., Szalewicz, K.","The role of symmetry in collisions of N<inf>2</inf> with N<inf>2</inf>+",1991,"The Journal of Chemical Physics","94","10",,"6500","6507",,13,,"https://www.scopus.com/inward/record.uri?eid=2-s2.0-0040938786&partnerID=40&md5=44e9e6ea80e5facf2181d2b01544fdf8",Article,Scopus,2-s2.0-0040938786
"Rybak, S., Jeziorski, B., Szalewicz, K.","Many-body symmetry-adapted perturbation theory of intermolecular interactions. H<inf>2</inf>O and HF dimers",1991,"The Journal of Chemical Physics","95","9",,"6576","6601",,241,,"https://www.scopus.com/inward/record.uri?eid=2-s2.0-36449004185&partnerID=40&md5=c1a95c48217e67f56c770b415b12b2a0",Article,Scopus,2-s2.0-36449004185
"Jeziorski, B., Szalewicz, K.","Phase-space calculation of the three-particle decay rate of dtμ and the sudden approximation theory of sticking in muon catalyzed fusion",1991,"Physics Letters A","152","5-6",,"240","244",,2,10.1016/0375-9601(91)90098-S,"https://www.scopus.com/inward/record.uri?eid=2-s2.0-44949286024&doi=10.1016%2f0375-9601%2891%2990098-S&partnerID=40&md5=dcbf7be6c142ddb34a9d5a7ad735d239",Article,Scopus,2-s2.0-44949286024
"Szalewicz, K., Jeziorski, B., Rybak, S.","Perturbation theory calculations of intermolecular interaction energies",1991,"International Journal of Quantum Chemistry","40","18 S",,"23","36",,,10.1002/qua.560400708,"https://www.scopus.com/inward/record.uri?eid=2-s2.0-84987067802&doi=10.1002%2fqua.560400708&partnerID=40&md5=f93341c3cd5ea7049ffb402ad8359655",Article,Scopus,2-s2.0-84987067802
"Jeziorski, B., Szalewicz, K., Scrinzi, A., Zhao, X., Moszynski, R., Kolos, W., Velenik, A.","Muon sticking fractions for S states of the td muon including the effects of nuclear interactions",1991,"Physical Review A","43","3",,"1640","1643",,13,10.1103/PhysRevA.43.1640,"https://www.scopus.com/inward/record.uri?eid=2-s2.0-33646737430&doi=10.1103%2fPhysRevA.43.1640&partnerID=40&md5=377dbf6c96dd73d16a4d14f81870bc9f",Article,Scopus,2-s2.0-33646737430
"Jankowski, P., Jeziorski, B., Rybak, S., Szalewicz, K.","Symmetry-adapted perturbation theory calculation of the intra-atomic correlation contribution to the short-range repulsion of helium atoms",1990,"The Journal of Chemical Physics","92","12",,"7441","7447",,42,,"https://www.scopus.com/inward/record.uri?eid=2-s2.0-0011397081&partnerID=40&md5=3027e686624991acdc93f031448d03f4",Article,Scopus,2-s2.0-0011397081
"Alexander, S.A., Monkhorst, H.J., Roeland, R., Szalewicz, K.","Obtaining microhartree accuracy for two-electron systems with random-tempered Gaussian-type geminals",1990,"The Journal of Chemical Physics","93","6",,"4230","4235",,52,,"https://www.scopus.com/inward/record.uri?eid=2-s2.0-36549092625&partnerID=40&md5=eb411dee7c400b9271a92d23f0064e8c",Article,Scopus,2-s2.0-36549092625
"Sohlberg, K., Szalewicz, K.","Fusion rates for deuterium in titanium clusters",1990,"Physics Letters A","144","6-7",,"365","370",,3,10.1016/0375-9601(90)90142-B,"https://www.scopus.com/inward/record.uri?eid=2-s2.0-26544454040&doi=10.1016%2f0375-9601%2890%2990142-B&partnerID=40&md5=68aeff0f7a17fc9668e8671c52f3d3bd",Article,Scopus,2-s2.0-26544454040
"Stodden, C.D., Monkhorst, H.J., Szalewicz, K., Winter, T.G.","Muon reactivation in muon-catalyzed d-t fusion from accurate p-He+ stripping and excitation cross sections",1990,"Physical Review A","41","3",,"1281","1292",,36,10.1103/PhysRevA.41.1281,"https://www.scopus.com/inward/record.uri?eid=2-s2.0-33646746808&doi=10.1103%2fPhysRevA.41.1281&partnerID=40&md5=e4b22c19aee72c5c16b12ad0565901bf",Article,Scopus,2-s2.0-33646746808
"Szalewicz, K., Jeziorski, B., Scrinzi, A., Zhao, X., Moszynski, R., Kolos, W., Froelich, P., Monkhorst, H.J., Velenik, A.","Effects of nuclear forces in muon-catalyzed fusion: Nonadiabatic treatment of energy shifts and fusion rates for S states of tdμ",1990,"Physical Review A","42","7",,"3768","3778",,20,10.1103/PhysRevA.42.3768,"https://www.scopus.com/inward/record.uri?eid=2-s2.0-4243397880&doi=10.1103%2fPhysRevA.42.3768&partnerID=40&md5=3ead6459079aeef60f99d958a23357b7",Article,Scopus,2-s2.0-4243397880
"Rybak, S., Szalewicz, K., Jeziorski, B.","An accurate calculation of the first-order interaction energy for the helium dimer",1989,"The Journal of Chemical Physics","91","8",,"4779","4784",,40,,"https://www.scopus.com/inward/record.uri?eid=2-s2.0-0001531243&partnerID=40&md5=33aa7ef3ca60822f10fdf9ce51bcdb3a",Article,Scopus,2-s2.0-0001531243
