Authors,Title,Year,Source title,Volume,Issue,Art. No.,Page start,Page end,Page count,Cited by,DOI,Link,Document Type,Source,EID
"Cencek, W., Patkowski, K., Szalewicz, K.","Full-configuration-interaction calculation of three-body nonadditive contribution to helium interaction potential",2009,"Journal of Chemical Physics","131","6", 064105,"","",,24,10.1063/1.3204319,"https://www.scopus.com/inward/record.uri?eid=2-s2.0-69149089130&doi=10.1063%2f1.3204319&partnerID=40&md5=ca4b27bb3888339bc9bf97f2a4f85415",Article,Scopus,2-s2.0-69149089130
"Pernal, K., Szalewicz, K.","Third-order dispersion energy from response functions",2009,"Journal of Chemical Physics","130","3", 034103,"","",,1,10.1063/1.3058477,"https://www.scopus.com/inward/record.uri?eid=2-s2.0-58749108298&doi=10.1063%2f1.3058477&partnerID=40&md5=3b34cce0a212f0ed325e9c1086cb61a6",Article,Scopus,2-s2.0-58749108298
"Podeszwa, R., Rice, B.M., Rob, F., Szalewicz, K.","Crystal structures from nonempirical force fields",2008,"2008 Proceedings of the Department of Defense High Performance Computing Modernization Program: Users Group Conference - Solving the Hard Problems",,, 4755863,"187","190",,,10.1109/DoD.HPCMP.UGC.2008.31,"https://www.scopus.com/inward/record.uri?eid=2-s2.0-63249115704&doi=10.1109%2fDoD.HPCMP.UGC.2008.31&partnerID=40&md5=28e8cea452dd7999bc70337d6be36c15",Conference Paper,Scopus,2-s2.0-63249115704
"Cencek, W., Szalewicz, K.","Ultra-high accuracy calculations for hydrogen molecule and helium dimer",2008,"International Journal of Quantum Chemistry","108","12 SPEC. ISS.",,"2191","2198",,43,10.1002/qua.21740,"https://www.scopus.com/inward/record.uri?eid=2-s2.0-50849113111&doi=10.1002%2fqua.21740&partnerID=40&md5=6ca32296bd9bd42dfcc3523bf2e216b0",Article,Scopus,2-s2.0-50849113111
"Jeziorska, M., Cencek, W., Patkowski, K., Jeziorski, B., Szalewicz, K.","Complete basis set extrapolations of dispersion, exchange, and coupled-clusters contributions to the interaction energy: A helium dimer study",2008,"International Journal of Quantum Chemistry","108","12 SPEC. ISS.",,"2053","2075",,22,10.1002/qua.21722,"https://www.scopus.com/inward/record.uri?eid=2-s2.0-50849101407&doi=10.1002%2fqua.21722&partnerID=40&md5=c225aab1c5ed1939db89649b9ab778ad",Article,Scopus,2-s2.0-50849101407
"Patkowski, K., Cencek, W., Jankowski, P., Szalewicz, K., Mehl, J.B., Garberoglio, G., Harvey, A.H.","Potential energy surface for interactions between two hydrogen molecules",2008,"Journal of Chemical Physics","129","9", 094304,"","",,67,10.1063/1.2975220,"https://www.scopus.com/inward/record.uri?eid=2-s2.0-51349109551&doi=10.1063%2f1.2975220&partnerID=40&md5=fa924f6d73a358999d4681c123b7ba98",Article,Scopus,2-s2.0-51349109551
"Podeszwa, R., Rice, B.M., Szalewicz, K.","Predicting structure of molecular crystals from first principles",2008,"Physical Review Letters","101","11", 115503,"","",,88,10.1103/PhysRevLett.101.115503,"https://www.scopus.com/inward/record.uri?eid=2-s2.0-51749104769&doi=10.1103%2fPhysRevLett.101.115503&partnerID=40&md5=8cbe8027e863e28e3d6b0d4ce811415e",Article,Scopus,2-s2.0-51749104769
"Zuchowski, P.S., Podeszwa, R., Moszyński, R., Jeziorski, B., Szalewicz, K.","Symmetry-adapted perturbation theory utilizing density functional description of monomers for high-spin open-shell complexes",2008,"Journal of Chemical Physics","129","8", 084101,"","",,29,10.1063/1.2968556,"https://www.scopus.com/inward/record.uri?eid=2-s2.0-50849107613&doi=10.1063%2f1.2968556&partnerID=40&md5=1665990c8fef6065338499c9bdf2dd70",Article,Scopus,2-s2.0-50849107613
"Cencek, W., Szalewicz, K., Leforestier, C., Van Harrevelt, R., Van Der Avoird, A.","An accurate analytic representation of the water pair potential",2008,"Physical Chemistry Chemical Physics","10","32",,"4716","4731",,64,10.1039/b809435g,"https://www.scopus.com/inward/record.uri?eid=2-s2.0-49349095830&doi=10.1039%2fb809435g&partnerID=40&md5=4a2aab52ecfa346e0752993c0546e3f8",Article,Scopus,2-s2.0-49349095830
"Jankowski, P., Szalewicz, K.","Effects of monomer flexibility on spectra of N<inf>2</inf>-HF",2008,"Chemical Physics Letters","459","1-6",,"60","64",,4,10.1016/j.cplett.2008.05.047,"https://www.scopus.com/inward/record.uri?eid=2-s2.0-45449083994&doi=10.1016%2fj.cplett.2008.05.047&partnerID=40&md5=d4848da0e25e3ffa6b5906ff53bdf4aa",Article,Scopus,2-s2.0-45449083994
"Podeszwa, R., Szalewicz, K.","Physical origins of interactions in dimers of polycyclic aromatic hydrocarbons",2008,"Physical Chemistry Chemical Physics","10","19",,"2735","2746",,77,10.1039/b719725j,"https://www.scopus.com/inward/record.uri?eid=2-s2.0-43449085507&doi=10.1039%2fb719725j&partnerID=40&md5=d5a3a00abe4a950f9e4a9cd561ab1afa",Article,Scopus,2-s2.0-43449085507
"Szalewicz, K.","Interplay between theory and experiment in investigations of molecules embedded in superfluid helium nanodroplets",2008,"International Reviews in Physical Chemistry","27","2",,"273","316",,50,10.1080/01442350801933485,"https://www.scopus.com/inward/record.uri?eid=2-s2.0-41849123819&doi=10.1080%2f01442350801933485&partnerID=40&md5=09dfc6c21286d82dc40e17f8a7571fac",Review,Scopus,2-s2.0-41849123819
"Bukowski, R., Szalewicz, K., Groenenboom, G.C., Van Der Avoird, A.","Polarizable interaction potential for water from coupled cluster calculations. II. Applications to dimer spectra, virial coefficients, and simulations of liquid water",2008,"Journal of Chemical Physics","128","9", 094314,"","",,67,10.1063/1.2832858,"https://www.scopus.com/inward/record.uri?eid=2-s2.0-40549121992&doi=10.1063%2f1.2832858&partnerID=40&md5=52f79cc8fc5cef5823920c1d440ef9ec",Article,Scopus,2-s2.0-40549121992
"Bukowski, R., Szalewicz, K., Groenenboom, G.C., Van Der Avoird, A.","Polarizable interaction potential for water from coupled cluster calculations. I. Analysis of dimer potential energy surface",2008,"Journal of Chemical Physics","128","9", 094313,"","",,48,10.1063/1.2832746,"https://www.scopus.com/inward/record.uri?eid=2-s2.0-40549120342&doi=10.1063%2f1.2832746&partnerID=40&md5=3fcbabaebca0e82853ffa01ee0de0091",Article,Scopus,2-s2.0-40549120342
"Van Der Avoird, A., Szalewicz, K.","Water trimer torsional spectrum from accurate ab initio and semiempirical potentials",2008,"Journal of Chemical Physics","128","1", 014302,"","",,17,10.1063/1.2812556,"https://www.scopus.com/inward/record.uri?eid=2-s2.0-38049078600&doi=10.1063%2f1.2812556&partnerID=40&md5=92db08aabb73883e0aecb9d266f6fb43",Article,Scopus,2-s2.0-38049078600
"Patkowski, K., Podeszwa, R., Szalewicz, K.","Interactions in diatomic dimers involving closed-shell metals",2007,"Journal of Physical Chemistry A","111","49",,"12822","12838",,63,10.1021/jp076412c,"https://www.scopus.com/inward/record.uri?eid=2-s2.0-38049170918&doi=10.1021%2fjp076412c&partnerID=40&md5=70fe45f70426e92936290b05f6679c42",Article,Scopus,2-s2.0-38049170918
"Podeszwa, R., Szalewicz, K., Rice, B.M., Bukowski, R.","Predictions of crystal structures from first principles",2007,"Department of Defense - Proceedings of the HPCMP Users Group Conference 2007; High Performance Computing Modernization Program: A Bridge to Future Defense, DoD HPCMP UGC",,, 4437988,"216","221",,,10.1109/HPCMP-UGC.2007.62,"https://www.scopus.com/inward/record.uri?eid=2-s2.0-49949119897&doi=10.1109%2fHPCMP-UGC.2007.62&partnerID=40&md5=11a33f9dad75d382f08b37a4f350f91d",Conference Paper,Scopus,2-s2.0-49949119897
"Cencek, W., Jeziorska, M., Akin-Ojo, O., Szalewicz, K.","Three-body contribution to the helium interaction potential",2007,"Journal of Physical Chemistry A","111","44",,"11311","11319",,35,10.1021/jp072106n,"https://www.scopus.com/inward/record.uri?eid=2-s2.0-36349027987&doi=10.1021%2fjp072106n&partnerID=40&md5=e74a1a544e60de765d86ad19e5a5faed",Article,Scopus,2-s2.0-36349027987
"Patkowski, K., Szalewicz, K.","Frozen core and effective core potentials in symmetry-adapted perturbation theory",2007,"Journal of Chemical Physics","127","16", 164103,"","",,20,10.1063/1.2784391,"https://www.scopus.com/inward/record.uri?eid=2-s2.0-36049049228&doi=10.1063%2f1.2784391&partnerID=40&md5=6d70730edb4f7b571ef5c973f78e5ba3",Article,Scopus,2-s2.0-36049049228
"Podeszwa, R., Bukowski, R., Rice, B.M., Szalewicz, K.","Potential energy surface for cyclotrimethylene trinitramine dimer from symmetry-adapted perturbation theory",2007,"Physical Chemistry Chemical Physics","9","41",,"5561","5569",,54,10.1039/b709192c,"https://www.scopus.com/inward/record.uri?eid=2-s2.0-35448960037&doi=10.1039%2fb709192c&partnerID=40&md5=3267a1c8a899b4d17604a3cc2f08f325",Article,Scopus,2-s2.0-35448960037
"Jeziorska, M., Cencek, W., Patkowski, K., Jeziorski, B., Szalewicz, K.","Pair potential for helium from symmetry-adapted perturbation theory calculations and from supermolecular data",2007,"Journal of Chemical Physics","127","12", 124303,"","",,100,10.1063/1.2770721,"https://www.scopus.com/inward/record.uri?eid=2-s2.0-34848907650&doi=10.1063%2f1.2770721&partnerID=40&md5=bc1dec00350bbe64249042a80fc94562",Article,Scopus,2-s2.0-34848907650
"Rob, F., Podeszwa, R., Szalewicz, K.","Electrostatic interaction energies with overlap effects from a localized approach",2007,"Chemical Physics Letters","445","4-6",,"315","320",,9,10.1016/j.cplett.2007.07.065,"https://www.scopus.com/inward/record.uri?eid=2-s2.0-34548457756&doi=10.1016%2fj.cplett.2007.07.065&partnerID=40&md5=ebcaa69958089b16010534a3bb1b4791",Article,Scopus,2-s2.0-34548457756
"Patkowski, K., Cencek, W., Jeziorska, M., Jeziorski, B., Szalewicz, K.","Accurate pair interaction energies for helium from supermolecular Gaussian geminal calculations",2007,"Journal of Physical Chemistry A","111","31",,"7611","7623",,42,10.1021/jp071437x,"https://www.scopus.com/inward/record.uri?eid=2-s2.0-34548036058&doi=10.1021%2fjp071437x&partnerID=40&md5=26b443e7abd94266a3aff52e5c8342d2",Article,Scopus,2-s2.0-34548036058
"Podeszwa, R., Szalewicz, K.","Three-body symmetry-adapted perturbation theory based on Kohn-Sham description of the monomers",2007,"Journal of Chemical Physics","126","19", 194101,"","",,50,10.1063/1.2733648,"https://www.scopus.com/inward/record.uri?eid=2-s2.0-34249063631&doi=10.1063%2f1.2733648&partnerID=40&md5=01a592372b5687d0abf457264d82f645",Article,Scopus,2-s2.0-34249063631
"Bukowski, R., Szalewicz, K., Groenenboom, G.C., Van Der Avoird, A.","Predictions of the properties of water from first principles",2007,"Science","315","5816",,"1249","1252",,254,10.1126/science.1136371,"https://www.scopus.com/inward/record.uri?eid=2-s2.0-33847673546&doi=10.1126%2fscience.1136371&partnerID=40&md5=b3a510a82e661d0cb55714d39651fb1c",Article,Scopus,2-s2.0-33847673546
"Podeszwa, R., Bukowski, R., Szalewicz, K.","Density-fitting method in symmetry-adapted perturbation theory based on Kohn-Sham description of monomers",2006,"Proceedings - HPCMP Users Group Conference, UGC 2006",,, 4134053,"189","192",,2,10.1109/HPCMP-UGC.2006.17,"https://www.scopus.com/inward/record.uri?eid=2-s2.0-48649094914&doi=10.1109%2fHPCMP-UGC.2006.17&partnerID=40&md5=2b88d61241ebfeb99c5e879741f68b6c",Conference Paper,Scopus,2-s2.0-48649094914
"Podeszwa, R., Bukowski, R., Szalewicz, K.","Density-fitting method in symmetry-adapted perturbation theory based on Kohn-Sham description of monomers",2006,"Journal of Chemical Theory and Computation","2","2",,"400","412",,111,10.1021/ct050304h,"https://www.scopus.com/inward/record.uri?eid=2-s2.0-33746818153&doi=10.1021%2fct050304h&partnerID=40&md5=3dedc93636cd6e6ebb43f3e16720d864",Article,Scopus,2-s2.0-33746818153
"Patkowski, K., Szalewicz, K., Jeziorski, B.","Third-order interactions in symmetry-adapted perturbation theory",2006,"Journal of Chemical Physics","125","15", 154107,"","",,56,10.1063/1.2358353,"https://www.scopus.com/inward/record.uri?eid=2-s2.0-33750155094&doi=10.1063%2f1.2358353&partnerID=40&md5=4ed6a2d659b8842508893d4b856bf915",Article,Scopus,2-s2.0-33750155094
"Podeszwa, R., Bukowski, R., Szalewicz, K.","Potential energy surface for the benzene dimer and perturbational analysis of π-π interactions",2006,"Journal of Physical Chemistry A","110","34",,"10345","10354",,238,10.1021/jp064095o,"https://www.scopus.com/inward/record.uri?eid=2-s2.0-33748771965&doi=10.1021%2fjp064095o&partnerID=40&md5=9fad4cbd310dd0a8c9ba63c97e027e45",Article,Scopus,2-s2.0-33748771965
"Bukowski, R., Szalewicz, K., Groenenboom, G., Van Der Avoird, A.","Interaction potential for water dimer from symmetry-adapted perturbation theory based on density functional description of monomers",2006,"Journal of Chemical Physics","125","4", 044301,"","",,52,10.1063/1.2220040,"https://www.scopus.com/inward/record.uri?eid=2-s2.0-33746799274&doi=10.1063%2f1.2220040&partnerID=40&md5=a236f045b6308d61febaf9abac6fb5e8",Article,Scopus,2-s2.0-33746799274
"Akin-Ojo, O., Harvey, A.H., Szalewicz, K.","Methane-water cross second virial coefficient with quantum corrections from an ab initio potential",2006,"Journal of Chemical Physics","125","1", 014314,"","",,8,10.1063/1.2207139,"https://www.scopus.com/inward/record.uri?eid=2-s2.0-33745766055&doi=10.1063%2f1.2207139&partnerID=40&md5=91ac363483a1daa38a961021e9cc1b69",Article,Scopus,2-s2.0-33745766055
"Bukowski, R., Cencek, W., Patkowski, K., Jankowski, P., Jeziorska, M., Kołaski, M., Szalewicz, K.","Portable parallel implementation of symmetry-adapted perturbation theory code",2006,"Molecular Physics","104","13-14",,"2241","2262",,11,10.1080/00268970600693395,"https://www.scopus.com/inward/record.uri?eid=2-s2.0-33745598835&doi=10.1080%2f00268970600693395&partnerID=40&md5=02f74159dfb391926be3f8147d8a1d3e",Article,Scopus,2-s2.0-33745598835
"Li, X., Volkov, A.V., Szalewicz, K., Coppens, P.","Interaction energies between glycopeptide antibiotics and substrates in complexes determined by X-ray crystallography: Application of a theoretical databank of aspherical atoms and a symmetry-adapted perturbation theory-based set of interatomic potentials",2006,"Acta Crystallographica Section D: Biological Crystallography","62","6",,"639","647",,29,10.1016/j.radmeas.2006.01.002,"https://www.scopus.com/inward/record.uri?eid=2-s2.0-33744463879&doi=10.1016%2fj.radmeas.2006.01.002&partnerID=40&md5=d43f01231faccac76473a0289bd47d4c",Article,Scopus,2-s2.0-33744463879
"Wernli, M., Valiron, P., Faure, A., Wiesenfeld, L., Jankowski, P., Szalewicz, K.","Improved low-temperature rate constants for rotational excitation of CO by H<inf>2</inf>",2006,"Astronomy and Astrophysics","446","1",,"367","372",,74,10.1051/0004-6361:20053919,"https://www.scopus.com/inward/record.uri?eid=2-s2.0-30944469205&doi=10.1051%2f0004-6361%3a20053919&partnerID=40&md5=7d9dbda685ba6e5a3c87798db865433f",Article,Scopus,2-s2.0-30944469205
"Jiang, H., Sarsa, A., Murdachaew, G., Szalewicz, K., Bačić, Z.","(HCI) 2 and (HF) 2 in small helium clusters: Quantum solvation of hydrogen-bonded dimers",2005,"Journal of Chemical Physics","123","22", 224313,"","",,3,10.1063/1.2136358,"https://www.scopus.com/inward/record.uri?eid=2-s2.0-29144519314&doi=10.1063%2f1.2136358&partnerID=40&md5=4c7519cd9c403dfb23fafa5875d78737",Article,Scopus,2-s2.0-29144519314
"Misquitta, A.J., Podeszwa, R., Jeziorski, B., Szalewicz, K.","Intermolecular potentials based on symmetry-adapted perturbation theory with dispersion energies from time-dependent density-functional calculations",2005,"Journal of Chemical Physics","123","21", 214103,"","",,286,10.1063/1.2135288,"https://www.scopus.com/inward/record.uri?eid=2-s2.0-28844492655&doi=10.1063%2f1.2135288&partnerID=40&md5=0871979bdcec56336373aa7036899a56",Article,Scopus,2-s2.0-28844492655
"Jiang, H., Sarsa, A., Murdachaew, G., Szalewicz, K., Bacić, Z.","(HCl)2 and (HF)2 in small helium clusters: quantum solvation of hydrogen-bonded dimers.",2005,"The Journal of chemical physics","123","22",,"224313","",,10,,"https://www.scopus.com/inward/record.uri?eid=2-s2.0-33745771007&partnerID=40&md5=694e7a0a627462452ee3bc5e0c468742",Article,Scopus,2-s2.0-33745771007
"Cencek, W., Komasa, J., Pachucki, K., Szalewicz, K.","Relativistic correction to the helium dimer interaction energy",2005,"Physical Review Letters","95","23", 233004,"","",,26,10.1103/PhysRevLett.95.233004,"https://www.scopus.com/inward/record.uri?eid=2-s2.0-28844473807&doi=10.1103%2fPhysRevLett.95.233004&partnerID=40&md5=265d463e593b93f3f97c45b3dc93ff73",Article,Scopus,2-s2.0-28844473807
"Szalewicz, K., Bukowski, R., Jeziorski, B.","On the importance of many-body forces in clusters and condensed phase",2005,"Theory and Applications of Computational Chemistry",,,,"919","962",,2,10.1016/B978-044451719-7/50076-7,"https://www.scopus.com/inward/record.uri?eid=2-s2.0-84885161066&doi=10.1016%2fB978-044451719-7%2f50076-7&partnerID=40&md5=e1ad527ceb41a75d6fc5605e8acddd18",Book Chapter,Scopus,2-s2.0-84885161066
"Szalewicz, K., Patkowski, K., Jeziorski, B.","Intermolecular interactions via perturbation theory: From diatoms to biomolecules",2005,"Structure and Bonding","116",,,"43","117",,97,10.1007/430_004,"https://www.scopus.com/inward/record.uri?eid=2-s2.0-33748511534&doi=10.1007%2f430_004&partnerID=40&md5=b7b81ab8addfcf6ad16547f3b286aca7",Article,Scopus,2-s2.0-33748511534
"Akin-Ojo, O., Szalewicz, K.","Potential energy surface and second virial coefficient of methane-water from ab initio calculations",2005,"Journal of Chemical Physics","123","13", 134311,"","",,29,10.1063/1.2033667,"https://www.scopus.com/inward/record.uri?eid=2-s2.0-26444528412&doi=10.1063%2f1.2033667&partnerID=40&md5=2c4ca10ee2d4a0493609d24a76b4c7f2",Article,Scopus,2-s2.0-26444528412
"Bukowski, R., Podeszwa, R., Szalewicz, K.","Efficient calculation of coupled Kohn-Sham dynamic susceptibility functions and dispersion energies with density fitting",2005,"Chemical Physics Letters","414","1-3",,"111","116",,69,10.1016/j.cplett.2005.08.048,"https://www.scopus.com/inward/record.uri?eid=2-s2.0-28844443869&doi=10.1016%2fj.cplett.2005.08.048&partnerID=40&md5=c3e6089e7c35dd4c69ad9878fee6e4e5",Article,Scopus,2-s2.0-28844443869
"Jankowski, P., Szalewicz, K.","A new ab initio interaction energy surface and high-resolution spectra of the H <inf>2</inf> -CO van der Waals complex",2005,"Journal of Chemical Physics","123","10", 104301,"","",,76,10.1063/1.2008216,"https://www.scopus.com/inward/record.uri?eid=2-s2.0-25144489090&doi=10.1063%2f1.2008216&partnerID=40&md5=0069bc81b79032639e08ca5c2a37d55e",Article,Scopus,2-s2.0-25144489090
"Podeszwa, R., Szalewicz, K.","Accurate interaction energies for argon, krypton, and benzene dimers from perturbation theory based on the Kohn-Sham model",2005,"Chemical Physics Letters","412","4-6",,"488","493",,75,10.1016/j.cplett.2005.07.029,"https://www.scopus.com/inward/record.uri?eid=2-s2.0-23944434896&doi=10.1016%2fj.cplett.2005.07.029&partnerID=40&md5=de29092e3c61fd944ac56c241f15d6e3",Article,Scopus,2-s2.0-23944434896
"Patkowski, K., Murdachaew, G., Fou, C.-M., Szalewicz, K.","Accurate ab initio potential for argon dimer including highly repulsive region",2005,"Molecular Physics","103","15-16",,"2031","2045",,63,10.1080/00268970500130241,"https://www.scopus.com/inward/record.uri?eid=2-s2.0-23944466215&doi=10.1080%2f00268970500130241&partnerID=40&md5=59678d19801297bfe86524fa6067796d",Article,Scopus,2-s2.0-23944466215
"Misquitta, A.J., Szalewicz, K.","Symmetry-adapted perturbation-theory calculations of intermolecular forces employing density-functional description of monomers",2005,"Journal of Chemical Physics","122","21", 214109,"","",,104,10.1063/1.1924593,"https://www.scopus.com/inward/record.uri?eid=2-s2.0-21244446228&doi=10.1063%2f1.1924593&partnerID=40&md5=48b9605900ba29b51f3a581a44b458b7",Article,Scopus,2-s2.0-21244446228
"Murdachaew, G., Szalewicz, K., Jiang, H., Bačić, Z.","Intermolecular potential energy surface and spectra of He-HCl with generalization to other rare gas-hydrogen halide complexes",2004,"Journal of Chemical Physics","121","23", 17,"11839","11855",,30,10.1063/1.1809604,"https://www.scopus.com/inward/record.uri?eid=2-s2.0-11044238181&doi=10.1063%2f1.1809604&partnerID=40&md5=157ffb49e59b458fe4acd97136712b39",Article,Scopus,2-s2.0-11044238181
"Łach, G., Jeziorski, B., Szalewicz, K.","Radiative corrections to the polarizability of helium",2004,"Physical Review Letters","92","23",,"233001","1",,48,10.1103/PhysRevLett.92.233001,"https://www.scopus.com/inward/record.uri?eid=2-s2.0-3242675380&doi=10.1103%2fPhysRevLett.92.233001&partnerID=40&md5=01497fde2c1f8983df024ce12735a3ec",Article,Scopus,2-s2.0-3242675380
"Patkowski, K., Jeziorski, B., Szalewicz, K.","Unified treatment of chemical and van der waals forces via symmetry-adapted perturbation expansion",2004,"Journal of Chemical Physics","120","15",,"6849","6862",,33,10.1063/1.1676119,"https://www.scopus.com/inward/record.uri?eid=2-s2.0-2342512930&doi=10.1063%2f1.1676119&partnerID=40&md5=b1d69027c29052f43080a2a14d7dbdd5",Article,Scopus,2-s2.0-2342512930
"Cencek, W., Jeziorska, M., Bukowski, R., Jaszuński, M., Jeziorski, B., Szalewicz, K.","Helium Dimer Interaction Energies from Gaussian Geminal and Orbital Calculations",2004,"Journal of Physical Chemistry A","108","15",,"3211","3224",,47,10.1021/jp037544i,"https://www.scopus.com/inward/record.uri?eid=2-s2.0-2342517577&doi=10.1021%2fjp037544i&partnerID=40&md5=3ef546fc897309c931291b758e93a471",Article,Scopus,2-s2.0-2342517577
"Akin-Ojo, O., Szalewicz, K.","Can accurate properties of methane clathrates be obtained from molecular simulations using ab initio force fields?",2004,"ACS National Meeting Book of Abstracts","228","2",,"PHYS","356",,,,"https://www.scopus.com/inward/record.uri?eid=2-s2.0-5044250194&partnerID=40&md5=24fa619efec1560774b68da266323eb8",Abstract Report,Scopus,2-s2.0-5044250194
"Obreshkov, B.D., Bakalov, D.D., Lepetit, B., Szalewicz, K.","Collisional quenching of antiprotonic helium atoms in gaseous helium",2004,"Physical Review A - Atomic, Molecular, and Optical Physics","69","4", 042701,"042701","1-042701-6",,8,10.1103/PhysRevA.69.042701,"https://www.scopus.com/inward/record.uri?eid=2-s2.0-2942620297&doi=10.1103%2fPhysRevA.69.042701&partnerID=40&md5=c58182c35a08ce1b9394afb46a71cc8d",Article,Scopus,2-s2.0-2942620297
"Chang, B.T., Akin-Ojo, O., Bukowski, R., Szalewicz, K.","Potential energy surface and rovibrational spectrum of He-N<inf>2</inf>O dimer",2003,"Journal of Chemical Physics","119","22",,"11654","11670",,36,10.1063/1.1624061,"https://www.scopus.com/inward/record.uri?eid=2-s2.0-0347682284&doi=10.1063%2f1.1624061&partnerID=40&md5=f937d4bb80ce6b1595063675c38d22f4",Article,Scopus,2-s2.0-0347682284
"Akin-Ojo, O., Bukowski, R., Szalewicz, K.","Ab initio studies of He-HCCCN interaction",2003,"Journal of Chemical Physics","119","16",,"8379","8396",,38,10.1063/1.1612475,"https://www.scopus.com/inward/record.uri?eid=2-s2.0-0242425930&doi=10.1063%2f1.1612475&partnerID=40&md5=c8eb7aa474b5e6baacfd233693c88bb8",Article,Scopus,2-s2.0-0242425930
"Misquitta, A.J., Jeziorski, B., Szalewicz, K.","Dispersion energy from density-functional theory description of monomers",2003,"Physical Review Letters","91","3",,"033201/1","033201/4",,241,,"https://www.scopus.com/inward/record.uri?eid=2-s2.0-0042386558&partnerID=40&md5=f8e5dc33da42a530394f61b86884d5f4",Article,Scopus,2-s2.0-0042386558
"Mas, E.M., Bukowski, R., Szalewicz, K.","Ab initio three-body interactions for water. I. Potential and structure of water trimer",2003,"Journal of Chemical Physics","118","10",,"4386","4403",,94,10.1063/1.1542871,"https://www.scopus.com/inward/record.uri?eid=2-s2.0-0037426223&doi=10.1063%2f1.1542871&partnerID=40&md5=2f3b0fcd657c19f34a79aa8f9c5002bb",Article,Scopus,2-s2.0-0037426223
"Mas, E.M., Bukowski, R., Szalewicz, K.","Ab initio three-body interactions for water. II. Effects on structure and energetics of liquid",2003,"Journal of Chemical Physics","118","10",,"4404","4413",,53,10.1063/1.1542872,"https://www.scopus.com/inward/record.uri?eid=2-s2.0-0037426224&doi=10.1063%2f1.1542872&partnerID=40&md5=8cdf6bb0a0bb666e3fe5de5ad6060bdb",Article,Scopus,2-s2.0-0037426224
"Jeziorska, M., Bukowski, R., Cencek, W., Jaszuński, M., Jeziorski, B., Szalewicz, K.","On the performance of bond functions and basis set extrapolation techniques in high-accuracy calculations of interatomic potentials. A helium dimer study",2003,"Collection of Czechoslovak Chemical Communications","68","3",,"463","488",,49,10.1135/cccc20030463,"https://www.scopus.com/inward/record.uri?eid=2-s2.0-0038292164&doi=10.1135%2fcccc20030463&partnerID=40&md5=71aff3c3325943d812cd0d42860a0e59",Article,Scopus,2-s2.0-0038292164
"Patkowski, K., Jeziorski, B., Korona, T., Szalewicz, K.","Symmetry-forcing procedure and convergence behavior of perturbation expansions for molecular interaction energies",2002,"Journal of Chemical Physics","117","11",,"5124","5134",,15,10.1063/1.1499488,"https://www.scopus.com/inward/record.uri?eid=2-s2.0-0037106525&doi=10.1063%2f1.1499488&partnerID=40&md5=21218efbb96e84257f727d7fe408749b",Article,Scopus,2-s2.0-0037106525
"Patkowski, K., Korona, T., Moszynski, R., Jeziorski, B., Szalewicz, K.","Ab initio potential energy surface and second virial coefficient for He-H<inf>2</inf>O complex",2002,"Journal of Molecular Structure: THEOCHEM","591",,,"231","243",,45,10.1016/S0166-1280(02)00244-0,"https://www.scopus.com/inward/record.uri?eid=2-s2.0-0037200304&doi=10.1016%2fS0166-1280%2802%2900244-0&partnerID=40&md5=9d8ecf615a0ddb589217316095aedc28",Article,Scopus,2-s2.0-0037200304
"Misquitta, A.J., Szalewicz, K.","Intermolecular forces from asymptotically corrected density functional description of monomers",2002,"Chemical Physics Letters","357","3-4",,"301","306",,198,10.1016/S0009-2614(02)00533-X,"https://www.scopus.com/inward/record.uri?eid=2-s2.0-0037052557&doi=10.1016%2fS0009-2614%2802%2900533-X&partnerID=40&md5=367903ca43fd8265de344325ac61f0c5",Article,Scopus,2-s2.0-0037052557
