Authors,Title,Year,Source title,Volume,Issue,Art. No.,Page start,Page end,Page count,Cited by,DOI,Link,Document Type,Source,EID
"Levine, C.R., Cogbill, C.V., Collins, B.M., Larson, A.J., Lutz, J.A., North, M.P., Restaino, C.M., Safford, H.D., Stephens, S.L., Battles, J.J.","Evaluating a new method for reconstructing forest conditions from General Land Office survey records:",2017,"Ecological Applications","27","5",,"1498","1513",,1,10.1002/eap.1543,"https://www.scopus.com/inward/record.uri?eid=2-s2.0-85019254601&doi=10.1002%2feap.1543&partnerID=40&md5=37d42322239dd4540dd8efaafec405bb",Article,Scopus,2-s2.0-85019254601
"Hopkinson, P., Huber, A., Saah, D.S., Battles, J.J.","A Word to the Wise: Advice for Scientists Engaged in Collaborative Adaptive Management",2017,"Environmental Management","59","5",,"752","761",,,10.1007/s00267-017-0825-4,"https://www.scopus.com/inward/record.uri?eid=2-s2.0-85010789156&doi=10.1007%2fs00267-017-0825-4&partnerID=40&md5=269809e938e3bacc6bab939486ab9de5",Article,Scopus,2-s2.0-85010789156
"Maguire, T.J., Templer, P.H., Battles, J.J., Fulweiler, R.W.","Winter climate change and fine root biogenic silica in sugar maple trees (Acer saccharum): Implications for silica in the Anthropocene",2017,"Journal of Geophysical Research: Biogeosciences","122","3",,"708","715",,,10.1002/2016JG003755,"https://www.scopus.com/inward/record.uri?eid=2-s2.0-85016545995&doi=10.1002%2f2016JG003755&partnerID=40&md5=ef8e1685f421d11cb50e00de781600b6",Article,Scopus,2-s2.0-85016545995
"Wason, J.W., Dovciak, M., Beier, C.M., Battles, J.J.","Tree growth is more sensitive than species distributions to recent changes in climate and acidic deposition in the northeastern United States",2017,"Journal of Applied Ecology",,,,"","",,,10.1111/1365-2664.12899,"https://www.scopus.com/inward/record.uri?eid=2-s2.0-85017109955&doi=10.1111%2f1365-2664.12899&partnerID=40&md5=317432a06529899984501e21d4d0ed6e",Article in Press,Scopus,2-s2.0-85017109955
"Saksa, P.C., Conklin, M.H., Battles, J.J., Tague, C.L., Bales, R.C.","Forest thinning impacts on the water balance of Sierra Nevada mixed-conifer headwater basins",2017,"Water Resources Research",,,,"","",,,10.1002/2016WR019240,"https://www.scopus.com/inward/record.uri?eid=2-s2.0-85021748669&doi=10.1002%2f2016WR019240&partnerID=40&md5=9f462fae786b318980c35de3b673d922",Article in Press,Scopus,2-s2.0-85021748669
"Clymans, W., Conley, D.J., Battles, J.J., Frings, P.J., Koppers, M.M., Likens, G.E., Johnson, C.E.","Silica uptake and release in live and decaying biomass in a northern hardwood forest",2016,"Ecology","97","11",,"3044","3057",,2,10.1002/ecy.1542,"https://www.scopus.com/inward/record.uri?eid=2-s2.0-84994608016&doi=10.1002%2fecy.1542&partnerID=40&md5=b65e63c0f385ad887cf8ae4bd38a12f5",Article,Scopus,2-s2.0-84994608016
"Ziervogel, K., Dike, C., Asper, V., Montoya, J., Battles, J., D'souza, N., Passow, U., Diercks, A., Esch, M., Joye, S., Dewald, C., Arnosti, C.","Enhanced particle fluxes and heterotrophic bacterial activities in Gulf of Mexico bottom waters following storm-induced sediment resuspension",2016,"Deep-Sea Research Part II: Topical Studies in Oceanography","129",,,"77","88",,4,10.1016/j.dsr2.2015.06.017,"https://www.scopus.com/inward/record.uri?eid=2-s2.0-84933564309&doi=10.1016%2fj.dsr2.2015.06.017&partnerID=40&md5=3410c2e88a3668d599cf84febb8f502a",Article,Scopus,2-s2.0-84933564309
"Glassman, S.I., Levine, C.R., Dirocco, A.M., Battles, J.J., Bruns, T.D.","Ectomycorrhizal fungal spore bank recovery after a severe forest fire: Some like it hot",2016,"ISME Journal","10","5",,"1228","1239",,7,10.1038/ismej.2015.182,"https://www.scopus.com/inward/record.uri?eid=2-s2.0-84945231930&doi=10.1038%2fismej.2015.182&partnerID=40&md5=ba941e217abe5981e46446b73ada7620",Article,Scopus,2-s2.0-84945231930
"Su, Y., Guo, Q., Fry, D.L., Collins, B.M., Kelly, M., Flanagan, J.P., Battles, J.J.","A Vegetation Mapping Strategy for Conifer Forests by Combining Airborne LiDAR Data and Aerial Imagery",2016,"Canadian Journal of Remote Sensing","42","1",,"1","15",,5,10.1080/07038992.2016.1131114,"https://www.scopus.com/inward/record.uri?eid=2-s2.0-84958041066&doi=10.1080%2f07038992.2016.1131114&partnerID=40&md5=a5475d463a4be67d0a45ebb6f7fc1c0a",Article,Scopus,2-s2.0-84958041066
"Levine, C.R., Krivak-Tetley, F., van Doorn, N.S., Ansley, J.-A.S., Battles, J.J.","Long-term demographic trends in a fire-suppressed mixed-conifer forest",2016,"Canadian Journal of Forest Research","46","5",,"745","752",,1,10.1139/cjfr-2015-0406,"https://www.scopus.com/inward/record.uri?eid=2-s2.0-84964733876&doi=10.1139%2fcjfr-2015-0406&partnerID=40&md5=1041c052a8f8c8a8c71aaba1cf79af1b",Note,Scopus,2-s2.0-84964733876
"Fahey, T.J., Heinz, A.K., Battles, J.J., Fisk, M.C., Driscoll, C.T., Blum, J.D., Johnson, C.E.","Fine root biomass declined in response to restoration of soil calcium in a northern hardwood forest",2016,"Canadian Journal of Forest Research","46","5",,"738","744",,1,10.1139/cjfr-2015-0434,"https://www.scopus.com/inward/record.uri?eid=2-s2.0-84964763165&doi=10.1139%2fcjfr-2015-0434&partnerID=40&md5=8eaf64e88aee170b64f9c342ca9a9e70",Article,Scopus,2-s2.0-84964763165
"Shao, S., Driscoll, C.T., Johnson, C.E., Fahey, T.J., Battles, J.J., Blum, J.D.","Long-term responses in soil solution and stream-water chemistry at Hubbard Brook after experimental addition of wollastonite",2016,"Environmental Chemistry","13","3",,"528","540",,4,10.1071/EN15113,"https://www.scopus.com/inward/record.uri?eid=2-s2.0-84971451009&doi=10.1071%2fEN15113&partnerID=40&md5=56084873ebd63e95444e094ecf55d303",Article,Scopus,2-s2.0-84971451009
"Tempel, D.J., Gutiérrez, R.J., Battles, J.J., Fry, D.L., Su, Y., Guo, Q., Reetz, M.J., Whitmore, S.A., Jones, G.M., Collins, B.M., Stephens, S.L., Kelly, M., Berigan, W.J., Peery, M.Z.","Evaluating short- and long-term impacts of fuels treatments and simulated wildfire on an old-forest species",2015,"Ecosphere","6","12", 261,"","",,11,10.1890/ES15-00234.1,"https://www.scopus.com/inward/record.uri?eid=2-s2.0-84949764266&doi=10.1890%2fES15-00234.1&partnerID=40&md5=f440fd4711df92ccdb70f505554425b3",Article,Scopus,2-s2.0-84949764266
"Eitzel, M.V., Battles, J., York, R., De Valpine, P.","Can't see the trees for the forest: Complex factors influence tree survival in a temperate second growth forest",2015,"Ecosphere","6","11", 247,"","",,,10.1890/ES15-00105.1,"https://www.scopus.com/inward/record.uri?eid=2-s2.0-84948759343&doi=10.1890%2fES15-00105.1&partnerID=40&md5=9e6043cdd1aa08d85ee3dc74e54aceee",Article,Scopus,2-s2.0-84948759343
"Cousins, S.J.M., Battles, J.J., Sanders, J.E., York, R.A.","Decay patterns and carbon density of standing dead trees in California mixed conifer forests",2015,"Forest Ecology and Management","353",,,"136","147",,4,10.1016/j.foreco.2015.05.030,"https://www.scopus.com/inward/record.uri?eid=2-s2.0-84937972340&doi=10.1016%2fj.foreco.2015.05.030&partnerID=40&md5=ba4606463dd2e5bfe6fa775611900238",Article,Scopus,2-s2.0-84937972340
"Gonzalez, P., Battles, J.J., Collins, B.M., Robards, T., Saah, D.S.","Aboveground live carbon stock changes of California wildland ecosystems, 2001-2010",2015,"Forest Ecology and Management","348",,,"68","77",,14,10.1016/j.foreco.2015.03.040,"https://www.scopus.com/inward/record.uri?eid=2-s2.0-84927627498&doi=10.1016%2fj.foreco.2015.03.040&partnerID=40&md5=990fb14fb16681fc8dc116c108b6de94",Article,Scopus,2-s2.0-84927627498
"Falster, D.S., Duursma, R.A., Ishihara, M.I., Barneche, D.R., FitzJohn, R.G., Vårhammar, A., Aiba, M., Ando, M., Anten, N., Aspinwall, M.J., Baltzer, J.L., Baraloto, C., Battaglia, M., Battles, J.J., Lamberty, B.B., Van Breugel, M., Camac, J., Claveau, Y., Coll, L., Dannoura, M., Delagrange, S., Domec, J.C., Fatemi, F., Feng, W., Gargaglione, V., Goto, Y., Hagihara, A., Hall, J.S., Hamilton, S., Harja, D., Hiura, T., Holdaway, R., Hutley, L.B., Ichie, T., Jokela, E.J., Kantola, A., Kelly, J.W.G., Kenzo, T., King, D., Kloeppel, B.D., Kohyama, T., Komiyama, A., Laclau, J.P., Lusk, C.H., Maguire, D.A., Le Maire, G., Mäkelä, A., Markesteijn, L., Marshall, J., McCulloh, K., Miyata, I., Mokany, K., Mori, S., Myster, R.W., Nagano, M., Naidu, S.L., Nouvellon, Y., O'Grady, A.P., O'Hara, K.L., Ohtsuka, T., Osada, N., Osunkoya, O.O., Peri, P.L., Petritan, A.M., Poorter, L., Portsmuth, A., Potvin, C., Ransijn, J., Reid, D., Ribeiro, S.C., Roberts, S.D., Rodríguez, R., Acosta, A.S., Santa-Regina, I., Sasa, K., Selaya, N.G., Sillett, S.C., Sterck, F., Takagi, K., Tange, T., Tanouchi, H., Tissue, D., Umehara, T., Utsugi, H., Vadeboncoeur, M.A., Valladares, F., Vanninen, P., Wang, J.R., Wenk, E., Williams, R., De Aquino Ximenes, F., Yamaba, A., Yamada, T., Yamakura, T., Yanai, R.D., York, R.A.","BAAD: a Biomass And Allometry Database for woody plants",2015,"Ecology","96","5",,"1445","",,11,10.1890/141889.1,"https://www.scopus.com/inward/record.uri?eid=2-s2.0-84981550270&doi=10.1890%2f141889.1&partnerID=40&md5=2bcc0edac2785a5df9cf0ae1950ba2e0",Article,Scopus,2-s2.0-84981550270
"Jones, D.A., O'Hara, K.L., Battles, J.J., Gersonde, R.F.","Leaf area prediction using three alternative sampling methods for seven sierra nevada conifer species",2015,"Forests","6","8",,"2631","2654",,1,10.3390/f6082631,"https://www.scopus.com/inward/record.uri?eid=2-s2.0-84940552621&doi=10.3390%2ff6082631&partnerID=40&md5=b0f2d44933df8c68788536ab5f975712",Article,Scopus,2-s2.0-84940552621
"Dufour, S., Hayden, M., Stella, J., Battles, J., Piegay, H.","Maintaining channel abandonment processes increases riparian plant diversity within fluvial corridors",2015,"Ecohydrology","8","5",,"780","791",,2,10.1002/eco.1546,"https://www.scopus.com/inward/record.uri?eid=2-s2.0-84937873223&doi=10.1002%2feco.1546&partnerID=40&md5=3006e58cacf0acdc0c0f4c3e2b3ff818",Article,Scopus,2-s2.0-84937873223
"Fahey, T.J., Templer, P.H., Anderson, B.T., Battles, J.J., Campbell, J.L., Driscoll, C.T., Fusco, A.R., Green, M.B., Kassam, K.-A.S., Rodenhouse, N.L., Rustad, L., Schaberg, P.G., Vadeboncoeur, M.A.","The promise and peril of intensive-site-based ecological research: Insights from the Hubbard Brook ecosystem study",2015,"Ecology","96","4",,"885","901",,6,,"https://www.scopus.com/inward/record.uri?eid=2-s2.0-84929166092&partnerID=40&md5=159618e21ea4ca31cd583dbbce85fc1a",Article,Scopus,2-s2.0-84929166092
"Battles, J.J., Fahey, T.J., Driscoll, C.T., Blum, J.D., Johnson, C.E.","Restoring Soil Calcium Reverses Forest Decline",2014,"Environmental Science and Technology Letters","1","1",,"15","19",,21,10.1021/ez400033d,"https://www.scopus.com/inward/record.uri?eid=2-s2.0-84969286321&doi=10.1021%2fez400033d&partnerID=40&md5=fdb9d38dc3d286e6ba4560e5a0e9b63b",Article,Scopus,2-s2.0-84969286321
"Eschtruth, A.K., Battles, J.J.","Ephemeral disturbances have long-lasting impacts on forest invasion dynamics",2014,"Ecology","95","7",,"1770","1779",,7,10.1890/13-1980.1,"https://www.scopus.com/inward/record.uri?eid=2-s2.0-84904344165&doi=10.1890%2f13-1980.1&partnerID=40&md5=cf12e12aebb8226fc423107746f87dbe",Article,Scopus,2-s2.0-84904344165
"Roman, L.A., Battles, J.J., McBride, J.R.","The balance of planting and mortality in a street tree population",2014,"Urban Ecosystems","17","2",,"387","404",,9,10.1007/s11252-013-0320-5,"https://www.scopus.com/inward/record.uri?eid=2-s2.0-84901253742&doi=10.1007%2fs11252-013-0320-5&partnerID=40&md5=7ced23c0a80fd7c69229f97c5afddd6b",Article,Scopus,2-s2.0-84901253742
"Cleavitt, N.L., Battles, J.J., Fahey, T.J., Blum, J.D.","Determinants of survival over 7 years for a natural cohort of sugar maple seedlings in a northern hardwood forest",2014,"Canadian Journal of Forest Research","44","9",,"1112","1121",,3,10.1139/cjfr-2014-0177,"https://www.scopus.com/inward/record.uri?eid=2-s2.0-84906702921&doi=10.1139%2fcjfr-2014-0177&partnerID=40&md5=d9254dd47cf5f4d6392c3a8bcd94f23c",Article,Scopus,2-s2.0-84906702921
"Roman, L.A., Battles, J.J., McBride, J.R.","Determinants of establishment survival for residential trees in Sacramento County, CA",2014,"Landscape and Urban Planning","129",,,"22","31",,10,10.1016/j.landurbplan.2014.05.004,"https://www.scopus.com/inward/record.uri?eid=2-s2.0-84904760253&doi=10.1016%2fj.landurbplan.2014.05.004&partnerID=40&md5=3b34f1bbd1b7f0419053c41d44363db4",Article,Scopus,2-s2.0-84904760253
"Johnson, C.E., Driscoll, C.T., Blum, J.D., Fahey, T.J., Battles, J.J.","Soil chemical dynamics after calcium silicate addition to a northern hardwood forest",2014,"Soil Science Society of America Journal","78","4",,"1458","1468",,14,10.2136/sssaj2014.03.0114,"https://www.scopus.com/inward/record.uri?eid=2-s2.0-84906272158&doi=10.2136%2fsssaj2014.03.0114&partnerID=40&md5=197f88a37177674ac2d009d949b09d84",Article,Scopus,2-s2.0-84906272158
"Collins, B.M., Das, A.J., Battles, J.J., Fry, D.L., Krasnow, K.D., Stephens, S.L.","Beyond reducing fire hazard: Fuel treatment impacts on overstory tree survival",2014,"Ecological Applications","24","8",,"1879","1886",,11,,"https://www.scopus.com/inward/record.uri?eid=2-s2.0-84919389209&partnerID=40&md5=c5c9bfb09f70a0c175a35470d4491d84",Article,Scopus,2-s2.0-84919389209
"Lydersen, J.M., Collins, B.M., Ewell, C.M., Reiner, A.L., Fites, J.A., Dow, C.B., Gonzalez, P., Saah, D.S., Battles, J.J.","Using field data to assess model predictions of surface and ground fuel consumption by wildfire in coniferous forests of California",2014,"Journal of Geophysical Research: Biogeosciences","119","3",,"223","235",,2,10.1002/2013JG002475,"https://www.scopus.com/inward/record.uri?eid=2-s2.0-84898880941&doi=10.1002%2f2013JG002475&partnerID=40&md5=be3b40717853c4b91a392ce10d08b6d3",Article,Scopus,2-s2.0-84898880941
"Crespo-Medina, M., Meile, C.D., Hunter, K.S., Diercks, A.-R., Asper, V.L., Orphan, V.J., Tavormina, P.L., Nigro, L.M., Battles, J.J., Chanton, J.P., Shiller, A.M., Joung, D.-J., Amon, R.M.W., Bracco, A., Montoya, J.P., Villareal, T.A., Wood, A.M., Joye, S.B.","The rise and fall of methanotrophy following a deepwater oil-well blowout",2014,"Nature Geoscience","7","6",,"423","427",,31,10.1038/ngeo2156,"https://www.scopus.com/inward/record.uri?eid=2-s2.0-84901716046&doi=10.1038%2fngeo2156&partnerID=40&md5=7c5867c1e1e840994d9c2246b7f1379d",Article,Scopus,2-s2.0-84901716046
"McLauchlan, K.K., Higuera, P.E., Gavin, D.G., Perakis, S.S., Mack, M.C., Alexander, H., Battles, J., Biondi, F., Buma, B., Colombaroli, D., Enders, S.K., Engstrom, D.R., Hu, F.S., Marlon, J.R., Marshall, J., McGlone, M., Morris, J.L., Nave, L.E., Shuman, B., Smithwick, E.A.H., Urrego, D.H., Wardle, D.A., Williams, C.J., Williams, J.J.","Reconstructing disturbances and their biogeochemical consequences over multiple timescales",2014,"BioScience","64","2",,"105","116",,22,10.1093/biosci/bit017,"https://www.scopus.com/inward/record.uri?eid=2-s2.0-84899026562&doi=10.1093%2fbiosci%2fbit017&partnerID=40&md5=3bbd9de65156387dfeaafa5e732efd1b",Review,Scopus,2-s2.0-84899026562
"Eschtruth, A.K., Evans, R.A., Battles, J.J.","Patterns and predictors of survival in Tsuga canadensis populations infested by the exotic pest Adelges tsugae: 20years of monitoring",2013,"Forest Ecology and Management","305",,,"195","203",,11,10.1016/j.foreco.2013.05.047,"https://www.scopus.com/inward/record.uri?eid=2-s2.0-84879733090&doi=10.1016%2fj.foreco.2013.05.047&partnerID=40&md5=dc0b9784489b2f8353ca13a614b6e24f",Article,Scopus,2-s2.0-84879733090
"Green, M.B., Bailey, A.S., Bailey, S.W., Battles, J.J., Campbell, J.L., Driscoll, C.T., Fahey, T.J., Lepine, L.C., Likens, G.E., Ollinger, S.È., Schaberg, P.G.","Reply to Smith and Shortle: Lacking eèidence of hydraulic efficiency changes",2013,"Proceedings of the National Academy of Sciences of the United States of America","110","40",,"","",,,10.1073/pnas.1312130110,"https://www.scopus.com/inward/record.uri?eid=2-s2.0-84885060179&doi=10.1073%2fpnas.1312130110&partnerID=40&md5=7f627f7e1503483ef08eeff59174d3d0",Letter,Scopus,2-s2.0-84885060179
"Eitzel, M., Battles, J., York, R., Knape, J., De Valpine, P.","Estimating tree growth from complex forest monitoring data",2013,"Ecological Applications","23","6",,"1288","1296",,3,10.1890/12-0504.1,"https://www.scopus.com/inward/record.uri?eid=2-s2.0-84884270542&doi=10.1890%2f12-0504.1&partnerID=40&md5=83488384b8f9be54c0f555c8af983142",Article,Scopus,2-s2.0-84884270542
"Green, M.B., Bailey, A.S., Bailey, S.W., Battles, J.J., Campbell, J.L., Driscoll, C.T., Fahey, T.J., Lepine, L.C., Likens, G.E., Ollinger, S.V., Schaberg, P.G.","Decreased water flowing from a forest amended with calcium silicate",2013,"Proceedings of the National Academy of Sciences of the United States of America","110","15",,"5999","6003",,20,10.1073/pnas.1302445110,"https://www.scopus.com/inward/record.uri?eid=2-s2.0-84876053186&doi=10.1073%2fpnas.1302445110&partnerID=40&md5=0ab66cfa2ba0bc197c8625001c330c06",Article,Scopus,2-s2.0-84876053186
"York, R.A., O'hara, K.L., Battles, J.J.","Density effects on giant sequoia (Sequoiadendron giganteum) growth through 22 years: Implications for restoration and plantation management",2013,"Western Journal of Applied Forestry","28","1",,"30","36",,3,10.5849/wjaf.12-017,"https://www.scopus.com/inward/record.uri?eid=2-s2.0-84872696721&doi=10.5849%2fwjaf.12-017&partnerID=40&md5=c9163c8050f9e64f4c8f17e8314aba30",Article,Scopus,2-s2.0-84872696721
"Sherman, R.E., Fahey, T.J., Martin, P.H., Battles, J.J.","Patterns of growth, recruitment, mortality and biomass across an altitudinal gradient in a neotropical montane forest, Dominican Republic",2012,"Journal of Tropical Ecology","28","5",,"483","495",,6,10.1017/S0266467412000478,"https://www.scopus.com/inward/record.uri?eid=2-s2.0-84865800057&doi=10.1017%2fS0266467412000478&partnerID=40&md5=21c3164e417362d77001e26b2ec7451f",Article,Scopus,2-s2.0-84865800057
"Chen, Q., Vaglio Laurin, G., Battles, J.J., Saah, D.","Integration of airborne lidar and vegetation types derived from aerial photography for mapping aboveground live biomass",2012,"Remote Sensing of Environment","121",,,"108","117",,38,10.1016/j.rse.2012.01.021,"https://www.scopus.com/inward/record.uri?eid=2-s2.0-84857126911&doi=10.1016%2fj.rse.2012.01.021&partnerID=40&md5=4b05a63332ed0ab93163f858a9bedd75",Article,Scopus,2-s2.0-84857126911
"York, R.A., Battles, J.J., Wenk, R.C., Saah, D.","A gap-based approach for regenerating pine species and reducing surface fuels in multi-aged mixed conifer stands in the Sierra Nevada, California",2012,"Forestry","85","2",,"203","213",,3,10.1093/forestry/cpr058,"https://www.scopus.com/inward/record.uri?eid=2-s2.0-84859622449&doi=10.1093%2fforestry%2fcpr058&partnerID=40&md5=e27ea688d78e5a38adf1963cd3ac450e",Article,Scopus,2-s2.0-84859622449
"Stella, J.C., Hayden, M.K., Battles, J.J., Piégay, H., Dufour, S., Fremier, A.K.","The Role of Abandoned Channels as Refugia for Sustaining Pioneer Riparian Forest Ecosystems",2011,"Ecosystems","14","5",,"776","790",,24,10.1007/s10021-011-9446-6,"https://www.scopus.com/inward/record.uri?eid=2-s2.0-79960332424&doi=10.1007%2fs10021-011-9446-6&partnerID=40&md5=2184a6fa41c5c68e3cff636264b85b87",Article,Scopus,2-s2.0-79960332424
"van Doorn, N.S., Battles, J.J., Fahey, T.J., Siccama, T.G., Schwarz, P.A.","Links between biomass and tree demography in a northern hardwood forest: A decade of stability and change in Hubbard Brook Valley, New Hampshire",2011,"Canadian Journal of Forest Research","41","7",,"1369","1379",,25,10.1139/x11-063,"https://www.scopus.com/inward/record.uri?eid=2-s2.0-79960768663&doi=10.1139%2fx11-063&partnerID=40&md5=12a320117335b32ec62b138caa80d4c8",Article,Scopus,2-s2.0-79960768663
"Eschtruth, A.K., Battles, J.J.","The importance of quantifying propagule pressure to understand invasion: An examination of riparian forest invasibility",2011,"Ecology","92","6",,"1314","1322",,30,10.1890/10-0857.1,"https://www.scopus.com/inward/record.uri?eid=2-s2.0-79959917920&doi=10.1890%2f10-0857.1&partnerID=40&md5=f31df8d3829c53bf43fd6572aa64d5a0",Article,Scopus,2-s2.0-79959917920
"Obrist, D., Johnson, D.W., Lindberg, S.E., Luo, Y., Hararuk, O., Bracho, R., Battles, J.J., Dail, D.B., Edmonds, R.L., Monson, R.K., Ollinger, S.V., Pallardy, S.G., Pregitzer, K.S., Todd, D.E.","Mercury distribution across 14 U.S. Forests. Part I: Spatial patterns of concentrations in biomass, litter, and soils",2011,"Environmental Science and Technology","45","9",,"3974","3981",,80,10.1021/es104384m,"https://www.scopus.com/inward/record.uri?eid=2-s2.0-79952772100&doi=10.1021%2fes104384m&partnerID=40&md5=5be445bbd2a22ac3cf98e8b355752a13",Article,Scopus,2-s2.0-79952772100
"Das, A., Battles, J., Stephenson, N.L., van Mantgem, P.J.","The contribution of competition to tree mortality in old-growth coniferous forests",2011,"Forest Ecology and Management","261","7",,"1203","1213",,48,10.1016/j.foreco.2010.12.035,"https://www.scopus.com/inward/record.uri?eid=2-s2.0-79951948183&doi=10.1016%2fj.foreco.2010.12.035&partnerID=40&md5=75dfc483b96c71374df5e454edec80ad",Article,Scopus,2-s2.0-79951948183
"Collins, B.M., Stephens, S.L., Roller, G.B., Battles, J.J.","Simulating fire and forest dynamics for a landscape fuel treatment project in the Sierra Nevada",2011,"Forest Science","57","2",,"77","88",,28,,"https://www.scopus.com/inward/record.uri?eid=2-s2.0-84856218479&partnerID=40&md5=12fa89e09c6cc7cb141ad5cf0349e19a",Article,Scopus,2-s2.0-84856218479
"van Mantgem, P.J., Stephenson, N.L., Knapp, E., Battles, J., Keeley, J.E.","Long-term effects of prescribed fire on mixed conifer forest structure in the Sierra Nevada, California",2011,"Forest Ecology and Management","261","6",,"989","994",,32,10.1016/j.foreco.2010.12.013,"https://www.scopus.com/inward/record.uri?eid=2-s2.0-79551531009&doi=10.1016%2fj.foreco.2010.12.013&partnerID=40&md5=a0865e0bc457fd2a8183e2e16d66a5c8",Article,Scopus,2-s2.0-79551531009
"Cleavitt, N.L., Fahey, T.J., Battles, J.J.","Regeneration ecology of sugar maple (Acer saccharum): Seedling survival in relation to nutrition, site factors, and damage by insects and pathogens",2011,"Canadian Journal of Forest Research","41","2",,"235","244",,26,10.1139/X10-210,"https://www.scopus.com/inward/record.uri?eid=2-s2.0-78951484338&doi=10.1139%2fX10-210&partnerID=40&md5=6d9f5d1a6bfc45865fe130696bc29ffb",Article,Scopus,2-s2.0-78951484338
"York, R.A., Battles, J.J., Eschtruth, A.K., Schurr, F.G.","Giant Sequoia (Sequoiadendron giganteum) Regeneration in Experimental Canopy Gaps",2011,"Restoration Ecology","19","1",,"14","23",,14,10.1111/j.1526-100X.2009.00537.x,"https://www.scopus.com/inward/record.uri?eid=2-s2.0-78651229974&doi=10.1111%2fj.1526-100X.2009.00537.x&partnerID=40&md5=af417b3fc4c43f83332f707dfee1656c",Article,Scopus,2-s2.0-78651229974
"Stella, J.C., Battles, J.J., McBride, J.R., Orr, B.K.","Riparian Seedling Mortality from Simulated Water Table Recession, and the Design of Sustainable Flow Regimes on Regulated Rivers",2010,"Restoration Ecology","18","SUPPL. 2",,"284","294",,25,10.1111/j.1526-100X.2010.00651.x,"https://www.scopus.com/inward/record.uri?eid=2-s2.0-78449232899&doi=10.1111%2fj.1526-100X.2010.00651.x&partnerID=40&md5=2f8c2d98719be9c35fd94ad03839e9af",Article,Scopus,2-s2.0-78449232899
"York, R.A., Fuchs, D., Battles, J.J., Stephens, S.L.","Radial growth responses to gap creation in large, old Sequoiadendron giganteum",2010,"Applied Vegetation Science","13","4",,"498","509",,11,10.1111/j.1654-109X.2010.01089.x,"https://www.scopus.com/inward/record.uri?eid=2-s2.0-77956330339&doi=10.1111%2fj.1654-109X.2010.01089.x&partnerID=40&md5=c48127986491fbf1816c93ff49ab1b5f",Article,Scopus,2-s2.0-77956330339
"Gonzalez, P., Asner, G.P., Battles, J.J., Lefsky, M.A., Waring, K.M., Palace, M.","Forest carbon densities and uncertainties from Lidar, QuickBird, and field measurements in California",2010,"Remote Sensing of Environment","114","7",,"1561","1575",,109,10.1016/j.rse.2010.02.011,"https://www.scopus.com/inward/record.uri?eid=2-s2.0-77951111081&doi=10.1016%2fj.rse.2010.02.011&partnerID=40&md5=5a274c7e853218fa20e4f24f275e16f5",Article,Scopus,2-s2.0-77951111081
"Fahey, T.J., Woodbury, P.B., Battles, J.J., Goodale, C.L., Hamburg, S.P., Ollinger, S.V., Woodall, C.W.","Forest carbon storage: Ecology, management, and policy",2010,"Frontiers in Ecology and the Environment","8","5",,"245","252",,112,10.1890/080169,"https://www.scopus.com/inward/record.uri?eid=2-s2.0-77953338090&doi=10.1890%2f080169&partnerID=40&md5=1cbfc7f1f47896e0f81450a0fdd8c1cb",Review,Scopus,2-s2.0-77953338090
"Stella, J.C., Battles, J.J.","How do riparian woody seedlings survive seasonal drought?",2010,"Oecologia","164","3",,"579","590",,28,10.1007/s00442-010-1657-6,"https://www.scopus.com/inward/record.uri?eid=2-s2.0-77958015571&doi=10.1007%2fs00442-010-1657-6&partnerID=40&md5=c676714a8605cfec53b10f8a8ca69364",Article,Scopus,2-s2.0-77958015571
"Yanai, R.D., Battles, J.J., Richardson, A.D., Blodgett, C.A., Wood, D.M., Rastetter, E.B.","Estimating uncertainty in ecosystem budget calculations",2010,"Ecosystems","13","2",,"239","248",,39,10.1007/s10021-010-9315-8,"https://www.scopus.com/inward/record.uri?eid=2-s2.0-77951769202&doi=10.1007%2fs10021-010-9315-8&partnerID=40&md5=66969ec3243a84f4f9d0b836b92199d3",Article,Scopus,2-s2.0-77951769202
"Collins, B.M., Stephens, S.L., Moghaddas, J.J., Battles, J.","Challenges and approaches in planning fuel treatments across fire-excluded forested landscapes",2010,"Journal of Forestry","108","1",,"24","31",,76,,"https://www.scopus.com/inward/record.uri?eid=2-s2.0-74549205202&partnerID=40&md5=fb99d32b0733b9ccd6083844eae6a29e",Article,Scopus,2-s2.0-74549205202
"Eschtruth, A.K., Battles, J.J.","Assessing the relative importance of disturbance, herbivory, diversity, and propagule pressure in exotic plant invasion",2009,"Ecological Monographs","79","2",,"265","280",,102,10.1890/08-0221.1,"https://www.scopus.com/inward/record.uri?eid=2-s2.0-66149144336&doi=10.1890%2f08-0221.1&partnerID=40&md5=f8842ff4bc5efe2e7e4924733e459c57",Article,Scopus,2-s2.0-66149144336
