Authors,Title,Year,Source title,Volume,Issue,Art. No.,Page start,Page end,Page count,Cited by,DOI,Link,Document Type,Source,EID
"Jeon, D., Dong, Q., Kim, Y., Wang, X., Chen, S., Yu, H., Blaauw, D., Sylvester, D.","A 23-mW Face Recognition Processor with Mostly-Read 5T Memory in 40-nm CMOS",2017,"IEEE Journal of Solid-State Circuits","52","6", 7859309,"1628","1642",,,10.1109/JSSC.2017.2661838,"https://www.scopus.com/inward/record.uri?eid=2-s2.0-85013642538&doi=10.1109%2fJSSC.2017.2661838&partnerID=40&md5=2201589297c36287f35309eb505cd051",Article,Scopus,2-s2.0-85013642538
"Lee, I., Sylvester, D., Blaauw, D.","A subthreshold voltage reference with scalable output voltage for low-power IoT systems",2017,"IEEE Journal of Solid-State Circuits","52","5", 7837687,"1443","1449",,,10.1109/JSSC.2017.2654326,"https://www.scopus.com/inward/record.uri?eid=2-s2.0-85011661557&doi=10.1109%2fJSSC.2017.2654326&partnerID=40&md5=00ee58c566fa7601c1e186750d471233",Article,Scopus,2-s2.0-85011661557
"Pinckney, N., Jeloka, S., Dreslinski, R., Mudge, T., Sylvester, D., Blaauw, D., Shifren, L., Cline, B., Sinha, S.","Impact of FinFET on near-threshold voltage scalability",2017,"IEEE Design and Test","34","2", 7747444,"31","38",,,10.1109/MDAT.2016.2630303,"https://www.scopus.com/inward/record.uri?eid=2-s2.0-85014671730&doi=10.1109%2fMDAT.2016.2630303&partnerID=40&md5=1157394a1518e888c9f74dd9b126636f",Article,Scopus,2-s2.0-85014671730
"Wu, X., Shi, Y., Jeloka, S., Yang, K., Lee, I., Lee, Y., Sylvester, D., Blaauw, D.","A 20-pW Discontinuous Switched-Capacitor Energy Harvester for Smart Sensor Applications",2017,"IEEE Journal of Solid-State Circuits","52","4", 7829281,"972","984",,,10.1109/JSSC.2016.2645741,"https://www.scopus.com/inward/record.uri?eid=2-s2.0-85010670340&doi=10.1109%2fJSSC.2016.2645741&partnerID=40&md5=00c04e63101f0ef723da3410f7c0e6f5",Article,Scopus,2-s2.0-85010670340
"Shim, M., Jeong, S., Myers, P.D., Bang, S., Shen, J., Kim, C., Sylvester, D., Blaauw, D., Jung, W.","Edge-Pursuit Comparator: An Energy-Scalable Oscillator Collapse-Based Comparator with Application in a 74.1 dB SNDR and 20 kS/s 15 b SAR ADC",2017,"IEEE Journal of Solid-State Circuits","52","4", 7815388,"1077","1090",,,10.1109/JSSC.2016.2631299,"https://www.scopus.com/inward/record.uri?eid=2-s2.0-85009876169&doi=10.1109%2fJSSC.2016.2631299&partnerID=40&md5=f94b7200c619c4f85235f902b42417aa",Article,Scopus,2-s2.0-85009876169
"Yang, K., Dong, Q., Blaauw, D., Sylvester, D.","A 553F2 2-transistor amplifier-based Physically Unclonable Function (PUF) with 1.67% native instability",2017,"Digest of Technical Papers - IEEE International Solid-State Circuits Conference","60",, 7870303,"146","147",,1,10.1109/ISSCC.2017.7870303,"https://www.scopus.com/inward/record.uri?eid=2-s2.0-85016302001&doi=10.1109%2fISSCC.2017.7870303&partnerID=40&md5=f6732188d0de2bb2c787b4bdb3e12bf4",Conference Paper,Scopus,2-s2.0-85016302001
"Lim, W., Sylvester, D., Blaauw, D.","A sub-nW 80mlx-to-1.26Mlx self-referencing light-to-digital converter with AlGaAs photodiode",2017,"Digest of Technical Papers - IEEE International Solid-State Circuits Conference","60",, 7870266,"72","73",,,10.1109/ISSCC.2017.7870266,"https://www.scopus.com/inward/record.uri?eid=2-s2.0-85016285959&doi=10.1109%2fISSCC.2017.7870266&partnerID=40&md5=78e0d99e7bab2157a163c98f9d42c3ed",Conference Paper,Scopus,2-s2.0-85016285959
"Wu, X., Choo, K., Shi, Y., Chuo, L.-X., Sylvester, D., Blaauw, D.","A fully integrated counter-flow energy reservoir for 70%-efficient peak-power delivery in ultra-low-power systems",2017,"Digest of Technical Papers - IEEE International Solid-State Circuits Conference","60",, 7870420,"380","381",,,10.1109/ISSCC.2017.7870420,"https://www.scopus.com/inward/record.uri?eid=2-s2.0-85016304123&doi=10.1109%2fISSCC.2017.7870420&partnerID=40&md5=840d8dfcf7ffb4c440326511240f5f60",Conference Paper,Scopus,2-s2.0-85016304123
"Jang, T., Jeong, S., Jeon, D., Choo, K.D., Sylvester, D., Blaauw, D.","A 2.5ps 0.8-to-3.2GHz bang-bang phase- and frequency-detector-based all-digital PLL with noise self-adjustment",2017,"Digest of Technical Papers - IEEE International Solid-State Circuits Conference","60",, 7870304,"148","149",,,10.1109/ISSCC.2017.7870304,"https://www.scopus.com/inward/record.uri?eid=2-s2.0-85016232571&doi=10.1109%2fISSCC.2017.7870304&partnerID=40&md5=9eda61cafc4bdcbc5a96b55f79672c0a",Conference Paper,Scopus,2-s2.0-85016232571
"Jeong, S., Chen, Y., Jang, T., Tsai, J., Blaauw, D., Kim, H.-S., Sylvester, D.","A 12nW always-on acoustic sensing and object recognition microsystem using frequency-domain feature extraction and SVM classification",2017,"Digest of Technical Papers - IEEE International Solid-State Circuits Conference","60",, 7870411,"362","363",,,10.1109/ISSCC.2017.7870411,"https://www.scopus.com/inward/record.uri?eid=2-s2.0-85016286880&doi=10.1109%2fISSCC.2017.7870411&partnerID=40&md5=6aa9ad8cb8b563f505a8012e564c25cd",Conference Paper,Scopus,2-s2.0-85016286880
"Yang, K., Dong, Q., Jung, W., Zhang, Y., Choi, M., Blaauw, D., Sylvester, D.","A 0.6nJ -0.22/+0.19°C inaccuracy temperature sensor using exponential subthreshold oscillation dependence",2017,"Digest of Technical Papers - IEEE International Solid-State Circuits Conference","60",, 7870310,"160","161",,1,10.1109/ISSCC.2017.7870310,"https://www.scopus.com/inward/record.uri?eid=2-s2.0-85016332407&doi=10.1109%2fISSCC.2017.7870310&partnerID=40&md5=22a992a2857a2128614361195c25dfd0",Conference Paper,Scopus,2-s2.0-85016332407
"Li, Z., Dong, Q., Saligane, M., Kempke, B., Yang, S., Zhang, Z., Dreslinski, R., Sylvester, D., Blaauw, D., Kim, H.S.","A 1920×1080 30fps 2.3TOPS/W stereo-depth processor for robust autonomous navigation",2017,"Digest of Technical Papers - IEEE International Solid-State Circuits Conference","60",, 7870261,"62","63",,,10.1109/ISSCC.2017.7870261,"https://www.scopus.com/inward/record.uri?eid=2-s2.0-85016258242&doi=10.1109%2fISSCC.2017.7870261&partnerID=40&md5=ee803597580c2fe236e60e027ff8b34f",Conference Paper,Scopus,2-s2.0-85016258242
"Bang, S., Wang, J., Li, Z., Gao, C., Kim, Y., Dong, Q., Chen, Y.-P., Fick, L., Sun, X., Dreslinski, R., Mudge, T., Kim, H.S., Blaauw, D., Sylvester, D.","A 288µW programmable deep-learning processor with 270KB on-chip weight storage using non-uniform memory hierarchy for mobile intelligence",2017,"Digest of Technical Papers - IEEE International Solid-State Circuits Conference","60",, 7870355,"250","251",,1,10.1109/ISSCC.2017.7870355,"https://www.scopus.com/inward/record.uri?eid=2-s2.0-85016332091&doi=10.1109%2fISSCC.2017.7870355&partnerID=40&md5=86731627115136c1b3d068c8786c847b",Conference Paper,Scopus,2-s2.0-85016332091
"Dong, Q., Kim, Y., Lee, I., Choi, M., Li, Z., Wang, J., Yang, K., Chen, Y.-P., Dong, J., Cho, M., Kim, G., Chang, W.-K., Chen, Y.-S., Chih, Y.-D., Blaauw, D., Sylvester, D.","A 1Mb embedded NOR flash memory with 39µW program power for mm-scale high-temperature sensor nodes",2017,"Digest of Technical Papers - IEEE International Solid-State Circuits Conference","60",, 7870329,"198","199",,,10.1109/ISSCC.2017.7870329,"https://www.scopus.com/inward/record.uri?eid=2-s2.0-85016271364&doi=10.1109%2fISSCC.2017.7870329&partnerID=40&md5=8efb1bfcec656ee778d9a73c0dad1f03",Conference Paper,Scopus,2-s2.0-85016271364
"Dong, Q., Yang, K., Fick, L., Fick, D., Blaauw, D., Sylvester, D.","Low-power and compact analog-to-digital converter using spintronic racetrack memory devices",2017,"IEEE Transactions on Very Large Scale Integration (VLSI) Systems","25","3", 7765085,"907","918",,,10.1109/TVLSI.2016.2622224,"https://www.scopus.com/inward/record.uri?eid=2-s2.0-85001124716&doi=10.1109%2fTVLSI.2016.2622224&partnerID=40&md5=ea6a25870386a0c1d48b6caa8a180596",Article,Scopus,2-s2.0-85001124716
"Zeinolabedin, S.M.A., Do, A.T., Jeon, D., Sylvester, D., Kim, T.T.-H.","Live demonstration: A 128-channel spike sorting processor featuring 0.175 μw and 0.0033 mm2 per Channel in 65-nm CMOS",2017,"2016 IEEE Asia Pacific Conference on Circuits and Systems, APCCAS 2016",,, 7804030,"734","735",,,10.1109/APCCAS.2016.7804030,"https://www.scopus.com/inward/record.uri?eid=2-s2.0-85011016511&doi=10.1109%2fAPCCAS.2016.7804030&partnerID=40&md5=8bc926f230ed58a11ea6e1edd9dd72b6",Conference Paper,Scopus,2-s2.0-85011016511
"Sylvester, D., Marković, D., Genov, R., Kawasumi, A., Mitra, S.","Introduction to the January Special Issue on the 2016 IEEE International Solid-State Circuits Conference",2017,"IEEE Journal of Solid-State Circuits","52","1", 7797558,"3","7",,,10.1109/JSSC.2016.2635358,"https://www.scopus.com/inward/record.uri?eid=2-s2.0-85010042421&doi=10.1109%2fJSSC.2016.2635358&partnerID=40&md5=70ec411515dbc19c23c5416fbc2bdba5",Editorial,Scopus,2-s2.0-85010042421
"Chen, Y., Cho, M., Jeong, S., Blaauw, D., Sylvester, D., Kim, H.-S.","A dual-stage, ultra-low power acoustic event detection system",2016,"IEEE Workshop on Signal Processing Systems, SiPS: Design and Implementation",,, 7780099,"213","218",,,10.1109/SiPS.2016.45,"https://www.scopus.com/inward/record.uri?eid=2-s2.0-85013177978&doi=10.1109%2fSiPS.2016.45&partnerID=40&md5=7e0c20e3942c79ddcc2edf8afb86bc5a",Conference Paper,Scopus,2-s2.0-85013177978
"Choi, M., Jang, T., Jeong, J., Jeong, S., Blaauw, D., Sylvester, D.","A Resonant Current-Mode Wireless Power Receiver and Battery Charger With-32 dBm Sensitivity for Implantable Systems",2016,"IEEE Journal of Solid-State Circuits","51","12", 7552535,"2880","2892",,,10.1109/JSSC.2016.2598224,"https://www.scopus.com/inward/record.uri?eid=2-s2.0-84983607434&doi=10.1109%2fJSSC.2016.2598224&partnerID=40&md5=c0c8ec2819e2cfbb27a78d28338e2cf3",Article,Scopus,2-s2.0-84983607434
"Shah, M., Arunachalam, S., Wang, J., Blaauw, D., Sylvester, D., Kim, H.-S., Seo, J.-S., Chakrabarti, C.","A Fixed-Point Neural Network Architecture for Speech Applications on Resource Constrained Hardware",2016,"Journal of Signal Processing Systems",,,,"1","15",,,10.1007/s11265-016-1202-x,"https://www.scopus.com/inward/record.uri?eid=2-s2.0-84997079626&doi=10.1007%2fs11265-016-1202-x&partnerID=40&md5=0df02deeb21b4971023a90d1f9aef10e",Article in Press,Scopus,2-s2.0-84997079626
"Pinckney, N., Sylvester, D., Blaauw, D.","Supply boosting for high-performance processors in flip-chip packages",2016,"European Solid-State Circuits Conference","2016-October",, 7598344,"473","476",,,10.1109/ESSCIRC.2016.7598344,"https://www.scopus.com/inward/record.uri?eid=2-s2.0-84994417501&doi=10.1109%2fESSCIRC.2016.7598344&partnerID=40&md5=79942e18d2af9618e6444bcac95044a2",Conference Paper,Scopus,2-s2.0-84994417501
"Dong, Q., Yang, K., Blaauw, D., Sylvester, D.","A 114-pW PMOS-only, trim-free voltage reference with 0.26% within-wafer inaccuracy for nW systems",2016,"IEEE Symposium on VLSI Circuits, Digest of Technical Papers","2016-September",, 7573494,"","",,2,10.1109/VLSIC.2016.7573494,"https://www.scopus.com/inward/record.uri?eid=2-s2.0-84990889299&doi=10.1109%2fVLSIC.2016.7573494&partnerID=40&md5=ead0f85d14402f8334abfbe24eb5fff9",Conference Paper,Scopus,2-s2.0-84990889299
"Zeinolabedin, S.M.A., Do, A.T., Jeon, D., Sylvester, D., Kim, T.T.-H.","A 128-channel spike sorting processor featuring 0.175 μw and 0.0033 mm2 per channel in 65-nm CMOS",2016,"IEEE Symposium on VLSI Circuits, Digest of Technical Papers","2016-September",, 7573467,"","",,1,10.1109/VLSIC.2016.7573467,"https://www.scopus.com/inward/record.uri?eid=2-s2.0-84990956947&doi=10.1109%2fVLSIC.2016.7573467&partnerID=40&md5=7d9710e0da2fe7e1aefa8e4fa68a9109",Conference Paper,Scopus,2-s2.0-84990956947
"Zhang, Y., Yang, K., Saligane, M., Blaauw, D., Sylvester, D.","A compact 446 Gbps/W AES accelerator for mobile SoC and IoT in 40nm",2016,"IEEE Symposium on VLSI Circuits, Digest of Technical Papers","2016-September",, 7573553,"","",,2,10.1109/VLSIC.2016.7573553,"https://www.scopus.com/inward/record.uri?eid=2-s2.0-84990966346&doi=10.1109%2fVLSIC.2016.7573553&partnerID=40&md5=8ae64e08280ac185638262212d330aac",Conference Paper,Scopus,2-s2.0-84990966346
"Wu, X., Shi, Y., Jeloka, S., Yang, K., Lee, I., Sylvester, D., Blaauw, D.","A 66pW discontinuous switch-capacitor energy harvester for self-sustaining sensor applications",2016,"IEEE Symposium on VLSI Circuits, Digest of Technical Papers","2016-September",, 7573490,"","",,2,10.1109/VLSIC.2016.7573490,"https://www.scopus.com/inward/record.uri?eid=2-s2.0-84990998441&doi=10.1109%2fVLSIC.2016.7573490&partnerID=40&md5=d4b0c0d279ce016a7b264da9c1909212",Conference Paper,Scopus,2-s2.0-84990998441
"Lim, W., Jang, T., Lee, I., Kim, H.-S., Sylvester, D., Blaauw, D.","A 380pW dual mode optical wake-up receiver with ambient noise cancellation",2016,"IEEE Symposium on VLSI Circuits, Digest of Technical Papers","2016-September",, 7573481,"","",,,10.1109/VLSIC.2016.7573481,"https://www.scopus.com/inward/record.uri?eid=2-s2.0-84990978806&doi=10.1109%2fVLSIC.2016.7573481&partnerID=40&md5=caca724e8cc99750545e9c424d55082d",Conference Paper,Scopus,2-s2.0-84990978806
"Oh, S., Ba, N.L., Bang, S., Jeong, J., Blaauw, D., Kim, T.T., Sylvester, D.","A 260μW infrared gesture recognition system-on-chip for smart devices",2016,"IEEE Symposium on VLSI Circuits, Digest of Technical Papers","2016-September",, 7573546,"","",,,10.1109/VLSIC.2016.7573546,"https://www.scopus.com/inward/record.uri?eid=2-s2.0-84990927864&doi=10.1109%2fVLSIC.2016.7573546&partnerID=40&md5=29211f4802c9cddff7d8d93107020e20",Conference Paper,Scopus,2-s2.0-84990927864
"Shim, M., Jeong, S., Myers, P., Bang, S., Kim, C., Sylvester, D., Blaauw, D., Jung, W.","An oscillator collapse-based comparator with application in a 74.1dB SNDR, 20KS/s 15b SAR ADC",2016,"IEEE Symposium on VLSI Circuits, Digest of Technical Papers","2016-September",, 7573518,"","",,,10.1109/VLSIC.2016.7573518,"https://www.scopus.com/inward/record.uri?eid=2-s2.0-84990925786&doi=10.1109%2fVLSIC.2016.7573518&partnerID=40&md5=3ea4ecbc94c59e9066af419993d5db74",Conference Paper,Scopus,2-s2.0-84990925786
"Choi, M., Jang, T., Bang, S., Shi, Y., Blaauw, D., Sylvester, D.","A 110 nW resistive frequency locked on-chip oscillator with 34.3 ppm/°C temperature stability for system-on-chip designs",2016,"IEEE Journal of Solid-State Circuits","51","9", 7523273,"2106","2118",,2,10.1109/JSSC.2016.2586178,"https://www.scopus.com/inward/record.uri?eid=2-s2.0-84979766174&doi=10.1109%2fJSSC.2016.2586178&partnerID=40&md5=a93a03a72bb04c0593b89ca6f5f67c1e",Article,Scopus,2-s2.0-84979766174
"Yang, K., Hicks, M., Dong, Q., Austin, T., Sylvester, D.","A2: Analog Malicious Hardware",2016,"Proceedings - 2016 IEEE Symposium on Security and Privacy, SP 2016",,, 7546493,"18","37",,7,10.1109/SP.2016.10,"https://www.scopus.com/inward/record.uri?eid=2-s2.0-84987642016&doi=10.1109%2fSP.2016.10&partnerID=40&md5=c2895ae84466edd592b535a41d4a9455",Conference Paper,Scopus,2-s2.0-84987642016
"Lee, Y., Blaauw, D., Sylvester, D.","Ultralow Power Circuit Design for Wireless Sensor Nodes for Structural Health Monitoring",2016,"Proceedings of the IEEE","104","8", 7515276,"1529","1546",,4,10.1109/JPROC.2016.2547946,"https://www.scopus.com/inward/record.uri?eid=2-s2.0-84982279539&doi=10.1109%2fJPROC.2016.2547946&partnerID=40&md5=967965c55839c6749a8ffa83c65ae294",Article,Scopus,2-s2.0-84982279539
"Jang, T., Choi, M., Shi, Y., Lee, I., Sylvester, D., Blaauw, D.","Millimeter-scale computing platform for next generation of internet of things",2016,"2016 IEEE International Conference on RFID, RFID 2016",,, 7487997,"","",,,10.1109/RFID.2016.7487997,"https://www.scopus.com/inward/record.uri?eid=2-s2.0-84978761960&doi=10.1109%2fRFID.2016.7487997&partnerID=40&md5=0f8b6548db38e968a097efb462142d99",Conference Paper,Scopus,2-s2.0-84978761960
"Pinckney, N., Shifren, L., Cline, B., Sinha, S., Jeloka, S., Dreslinski, R.G., Mudge, T., Sylvester, D., Blaauw, D.","Near-threshold computing in FinFET technologies: Opportunities for improved voltage scalability",2016,"Proceedings - Design Automation Conference","05-09-June-2016",, a76,"","",,2,10.1145/2897937.2898049,"https://www.scopus.com/inward/record.uri?eid=2-s2.0-84977110747&doi=10.1145%2f2897937.2898049&partnerID=40&md5=0964ec12a7b29c28ef07ea3e34767eca",Conference Paper,Scopus,2-s2.0-84977110747
"Frustaci, F., Blaauw, D., Sylvester, D., Alioto, M.","Approximate SRAMs with Dynamic Energy-Quality Management",2016,"IEEE Transactions on Very Large Scale Integration (VLSI) Systems","24","6", 7372479,"2128","2141",,3,10.1109/TVLSI.2015.2503733,"https://www.scopus.com/inward/record.uri?eid=2-s2.0-84953219674&doi=10.1109%2fTVLSI.2015.2503733&partnerID=40&md5=9735f220bd8a6725ed5c1d71b1128da2",Article,Scopus,2-s2.0-84953219674
"Dreslinski, R.G., Fick, D., Giridhar, B., Kim, G., Seo, S., Fojtik, M., Satpathy, S., Lee, Y., Kim, D., Liu, N., Wieckowski, M., Chen, G., Mudge, T., Sylvester, D., Blaauw, D.","Centip3De: A 64-core, 3D stacked, near-threshold system",2016,"2012 IEEE Hot Chips 24 Symposium, HCS 2012",,, 7476490,"","",,,10.1109/HOTCHIPS.2012.7476490,"https://www.scopus.com/inward/record.uri?eid=2-s2.0-84980042475&doi=10.1109%2fHOTCHIPS.2012.7476490&partnerID=40&md5=eaa79e1d0c8e7539f35bdeb8abbfa63f",Conference Paper,Scopus,2-s2.0-84980042475
"Dreslinski, R., Sewell, K., Manville, T., Satpathy, S., Pinckney, N., Blake, G., Cieslak, M., Das, R., Wenisch, T., Sylvester, D., Blaauw, D., Mudge, T.","Swizzle Switch: A self-arbitrating high-radix crossbar for NoC systems",2016,"2012 IEEE Hot Chips 24 Symposium, HCS 2012",,, 7476481,"","",,,10.1109/HOTCHIPS.2012.7476481,"https://www.scopus.com/inward/record.uri?eid=2-s2.0-84979995274&doi=10.1109%2fHOTCHIPS.2012.7476481&partnerID=40&md5=bfce4267a39b72b39eb1515975f01771",Conference Paper,Scopus,2-s2.0-84979995274
"Jeloka, S., Akesh, N.B., Sylvester, D., Blaauw, D.","A 28 nm Configurable Memory (TCAM/BCAM/SRAM) Using Push-Rule 6T Bit Cell Enabling Logic-in-Memory",2016,"IEEE Journal of Solid-State Circuits","51","4", 7400984,"1009","1021",,6,10.1109/JSSC.2016.2515510,"https://www.scopus.com/inward/record.uri?eid=2-s2.0-84969351876&doi=10.1109%2fJSSC.2016.2515510&partnerID=40&md5=f4f3744648072f4ed5a83120860df240",Article,Scopus,2-s2.0-84969351876
"Yang, K., Blaauw, D., Sylvester, D.","An All-Digital Edge Racing True Random Number Generator Robust Against PVT Variations",2016,"IEEE Journal of Solid-State Circuits","51","4", 7422712,"1022","1031",,3,10.1109/JSSC.2016.2519383,"https://www.scopus.com/inward/record.uri?eid=2-s2.0-84960157362&doi=10.1109%2fJSSC.2016.2519383&partnerID=40&md5=fb723516dd7bb784b108f4d00f9b0a8f",Article,Scopus,2-s2.0-84960157362
"Bang, S., Seo, J.-S., Chang, L., Blaauw, D., Sylvester, D.","A Low Ripple Switched-Capacitor Voltage Regulator Using Flying Capacitance Dithering",2016,"IEEE Journal of Solid-State Circuits","51","4", 7387666,"919","929",,1,10.1109/JSSC.2015.2507361,"https://www.scopus.com/inward/record.uri?eid=2-s2.0-84955112341&doi=10.1109%2fJSSC.2015.2507361&partnerID=40&md5=d0138654f294ebb6e6ff41248f24e223",Article,Scopus,2-s2.0-84955112341
"Lee, I., Sylvester, D., Blaauw, D.","A Constant Energy-Per-Cycle Ring Oscillator Over a Wide Frequency Range for Wireless Sensor Nodes",2016,"IEEE Journal of Solid-State Circuits","51","3", 7396932,"697","711",,4,10.1109/JSSC.2016.2517133,"https://www.scopus.com/inward/record.uri?eid=2-s2.0-84979464681&doi=10.1109%2fJSSC.2016.2517133&partnerID=40&md5=e366b8a683c48dc15c9e00e4ede58fce",Article,Scopus,2-s2.0-84979464681
"Jung, W., Sylvester, D., Blaauw, D.","A rational-conversion-ratio switched-capacitor DC-DC converter using negative-output feedback",2016,"Digest of Technical Papers - IEEE International Solid-State Circuits Conference","59",, 7417985,"218","219",,3,10.1109/ISSCC.2016.7417985,"https://www.scopus.com/inward/record.uri?eid=2-s2.0-84962909713&doi=10.1109%2fISSCC.2016.7417985&partnerID=40&md5=335a679824a4b5dcfbf81e002551b5bd",Conference Paper,Scopus,2-s2.0-84962909713
"Khayatzadeh, M., Saligane, M., Wang, J., Alioto, M., Blaauw, D., Sylvester, D.","A reconfigurable dual-port memory with error detection and correction in 28nm FDSOI",2016,"Digest of Technical Papers - IEEE International Solid-State Circuits Conference","59",, 7418031,"310","312",,2,10.1109/ISSCC.2016.7418031,"https://www.scopus.com/inward/record.uri?eid=2-s2.0-84962839143&doi=10.1109%2fISSCC.2016.7418031&partnerID=40&md5=f70ee96518e1553bfc11f8ef387f327e",Conference Paper,Scopus,2-s2.0-84962839143
"Lee, I., Lim, W., Teran, A., Phillips, J., Sylvester, D., Blaauw, D.","A &gt;78%-efficient light harvester over 100-to-100klux with reconfigurable PV-cell network and MPPT circuit",2016,"Digest of Technical Papers - IEEE International Solid-State Circuits Conference","59",, 7418061,"370","371",,6,10.1109/ISSCC.2016.7418061,"https://www.scopus.com/inward/record.uri?eid=2-s2.0-84962821224&doi=10.1109%2fISSCC.2016.7418061&partnerID=40&md5=ef267a7403f82c8adf17793db397fe50",Conference Paper,Scopus,2-s2.0-84962821224
"Jang, T., Choi, M., Jeong, S., Bang, S., Sylvester, D., Blaauw, D.","A 4.7nW 13.8ppm/°C self-biased wakeup timer using a switched-resistor scheme",2016,"Digest of Technical Papers - IEEE International Solid-State Circuits Conference","59",, 7417927,"102","103",,5,10.1109/ISSCC.2016.7417927,"https://www.scopus.com/inward/record.uri?eid=2-s2.0-84962920499&doi=10.1109%2fISSCC.2016.7417927&partnerID=40&md5=f3a377c9f81df711cec016c833b3b434",Conference Paper,Scopus,2-s2.0-84962920499
"Choi, M., Jang, T., Jeong, J., Jeong, S., Blaauw, D., Sylvester, D.","A current-mode wireless power receiver with optimal resonant cycle tracking for implantable systems",2016,"Digest of Technical Papers - IEEE International Solid-State Circuits Conference","59",, 7418062,"372","373",,8,10.1109/ISSCC.2016.7418062,"https://www.scopus.com/inward/record.uri?eid=2-s2.0-84962846953&doi=10.1109%2fISSCC.2016.7418062&partnerID=40&md5=1d1e16acd6aa12a2e6987d05a50b949e",Conference Paper,Scopus,2-s2.0-84962846953
"Skrzyniarz, S., Fick, L., Shah, J., Kim, Y., Sylvester, D., Blaauw, D., Fick, D., Henry, M.B.","A 36.8 2b-TOPS/W self-calibrating GPS accelerator implemented using analog calculation in 65nm LP CMOS",2016,"Digest of Technical Papers - IEEE International Solid-State Circuits Conference","59",, 7418086,"420","422",,1,10.1109/ISSCC.2016.7418086,"https://www.scopus.com/inward/record.uri?eid=2-s2.0-84962888116&doi=10.1109%2fISSCC.2016.7418086&partnerID=40&md5=58d1a22f63497a63cea976ead3a55f04",Conference Paper,Scopus,2-s2.0-84962888116
"Zhang, Y., Khayatzadeh, M., Yang, K., Saligane, M., Pinckney, N., Alioto, M., Blaauw, D., Sylvester, D.","iRazor: 3-transistor current-based error detection and correction in an ARM Cortex-R4 processor",2016,"Digest of Technical Papers - IEEE International Solid-State Circuits Conference","59",, 7417956,"160","162",,9,10.1109/ISSCC.2016.7417956,"https://www.scopus.com/inward/record.uri?eid=2-s2.0-84962812155&doi=10.1109%2fISSCC.2016.7417956&partnerID=40&md5=089d0f256669a5bd7b098ef9eec151b6",Conference Paper,Scopus,2-s2.0-84962812155
"Jung, W., Gu, J., Myers, P.D., Shim, M., Jeong, S., Yang, K., Choi, M., Foo, Z., Bang, S., Oh, S., Sylvester, D., Blaauw, D.","A 60%-efficiency 20nW-500µW tri-output fully integrated power management unit with environmental adaptation and load-proportional biasing for IoT systems",2016,"Digest of Technical Papers - IEEE International Solid-State Circuits Conference","59",, 7417953,"154","155",,5,10.1109/ISSCC.2016.7417953,"https://www.scopus.com/inward/record.uri?eid=2-s2.0-84962812271&doi=10.1109%2fISSCC.2016.7417953&partnerID=40&md5=3207b7ef61a5340ec2bce443d6701050",Conference Paper,Scopus,2-s2.0-84962812271
"Bang, S., Blaauw, D., Sylvester, D.","A Successive-Approximation Switched-Capacitor DC-DC Converter With Resolution of V<inf>IN</inf>/2N for a Wide Range of Input and Output Voltages",2016,"IEEE Journal of Solid-State Circuits","51","2", 7383216,"543","556",,1,10.1109/JSSC.2015.2501985,"https://www.scopus.com/inward/record.uri?eid=2-s2.0-84954567809&doi=10.1109%2fJSSC.2015.2501985&partnerID=40&md5=9c4b74e4aec8c16616b97521ac107772",Article,Scopus,2-s2.0-84954567809
"Yoon, D., Jang, T., Sylvester, D., Blaauw, D.","A 5.58 nW Crystal Oscillator Using Pulsed Driver for Real-Time Clocks",2016,"IEEE Journal of Solid-State Circuits","51","2", 7370766,"509","522",,2,10.1109/JSSC.2015.2501982,"https://www.scopus.com/inward/record.uri?eid=2-s2.0-84953279439&doi=10.1109%2fJSSC.2015.2501982&partnerID=40&md5=70524791d599588154dc79312aa91628",Article,Scopus,2-s2.0-84953279439
"Wang, J., Pinckney, N., Blaauw, D., Sylvester, D.","Reconfigurable self-timed regenerators for wide-range voltage scaled interconnect",2016,"2015 IEEE Asian Solid-State Circuits Conference, A-SSCC 2015 - Proceedings",,, 7387475,"","",,1,10.1109/ASSCC.2015.7387475,"https://www.scopus.com/inward/record.uri?eid=2-s2.0-84963854337&doi=10.1109%2fASSCC.2015.7387475&partnerID=40&md5=c597c8711cdcf36fa8e99bc5de253114",Conference Paper,Scopus,2-s2.0-84963854337
"Lee, I., Lee, Y., Sylvester, D., Blaauw, D.","Battery Voltage Supervisors for Miniature IoT Systems",2016,"IEEE Journal of Solid-State Circuits","PP","99", 7560875,"","",,,10.1109/JSSC.2016.2600565,"https://www.scopus.com/inward/record.uri?eid=2-s2.0-84988409819&doi=10.1109%2fJSSC.2016.2600565&partnerID=40&md5=97447a944d6a1c9b4f7539128cff6a5c",Article,Scopus,2-s2.0-84988409819
"Frustaci, F., Blaauw, D., Sylvester, D., Alioto, M.","Better-than-voltage scaling energy reduction in approximate SRAMs via bit dropping and bit reuse",2015,"Proceedings - 2015 25th International Workshop on Power and Timing Modeling, Optimization and Simulation, PATMOS 2015",,, 7347598,"132","139",,,10.1109/PATMOS.2015.7347598,"https://www.scopus.com/inward/record.uri?eid=2-s2.0-84959431457&doi=10.1109%2fPATMOS.2015.7347598&partnerID=40&md5=c9ebaffe7fe60a41333d6a59c28ccd8d",Conference Paper,Scopus,2-s2.0-84959431457
