Authors,Title,Year,Source title,Volume,Issue,Art. No.,Page start,Page end,Page count,Cited by,DOI,Link,Document Type,Source,EID
"Coons, S.W., Pearl, D.K.","Mitosis identification in diffuse gliomas: Implications for tumor grading",1998,"Cancer","82","8",,"1550","1555",,22,10.1002/(SICI)1097-0142(19980415)82:8&lt;1550::AID-CNCR17&gt;3.0.CO;2-3,"https://www.scopus.com/inward/record.uri?eid=2-s2.0-0032522971&doi=10.1002%2f%28SICI%291097-0142%2819980415%2982%3a8%26lt%3b1550%3a%3aAID-CNCR17%26gt%3b3.0.CO%3b2-3&partnerID=40&md5=e068023ea5fd5495aa5b64ca44b6feec",Article,Scopus,2-s2.0-0032522971
"Coons, S.W., Johnson, P.C., Pearl, D.K.","The prognostic significance of Ki-67 labeling indices for oligodendrogliomas",1997,"Neurosurgery","41","4",,"878","885",,88,10.1097/00006123-199710000-00021,"https://www.scopus.com/inward/record.uri?eid=2-s2.0-0030820140&doi=10.1097%2f00006123-199710000-00021&partnerID=40&md5=b3c8e243de65548046cce7768aa38090",Article,Scopus,2-s2.0-0030820140
"Bartoszyński, R., Pearl, D.K., Lawrence, J.","A Multidimensional Goodness-of-Fit Test Based on Interpoint Distances",1997,"Journal of the American Statistical Association","92","438",,"577","586",,14,10.1080/01621459.1997.10474010,"https://www.scopus.com/inward/record.uri?eid=2-s2.0-0040086703&doi=10.1080%2f01621459.1997.10474010&partnerID=40&md5=d5f5b22e4ba5f0efb145e3b71b4528bc",Article,Scopus,2-s2.0-0040086703
"Farooqui, T., Franklin, T., Pearl, D.K., Yates, A.J.","Ganglioside GM1 enhances induction by nerve growth factor of a putative dimer of TrkA",1997,"Journal of Neurochemistry","68","6",,"2348","2355",,74,,"https://www.scopus.com/inward/record.uri?eid=2-s2.0-0030929378&partnerID=40&md5=c3650f3977737420a58ac6d197e5a48e",Article,Scopus,2-s2.0-0030929378
"Coons, S.W., Johnson, P.C., Scheithauer, B.W., Yates, A.J., Pearl, D.K.","Improving diagnostic accuracy and interobserver concordance in the classification and grading of primary gliomas",1997,"Cancer","79","7",,"1381","1393",,414,10.1002/(SICI)1097-0142(19970401)79:7&lt;1381::AID-CNCR16&gt;3.0.CO;2-W,"https://www.scopus.com/inward/record.uri?eid=2-s2.0-0030903111&doi=10.1002%2f%28SICI%291097-0142%2819970401%2979%3a7%26lt%3b1381%3a%3aAID-CNCR16%26gt%3b3.0.CO%3b2-W&partnerID=40&md5=1302c066e952d57a695948db93dd3208",Article,Scopus,2-s2.0-0030903111
"Critchlow, D.E., Pearl, D.K., Qian, C.","The triples distance for rooted bifurcating phylogenetic trees",1996,"Systematic Biology","45","3",,"323","334",,54,,"https://www.scopus.com/inward/record.uri?eid=2-s2.0-0030311519&partnerID=40&md5=6fa9ad0704dc939f0a27d022bea9e14b",Article,Scopus,2-s2.0-0030311519
"Bradley Welling, D., Guida, M., Goll, F., Pearl, D.K., Glasscock, M.E., Pappas, D.G., Linthicum, F.H., Rogers, D., Prior, T.W.","Mutational spectrum in the neurofibromatosis type 2 gene in sporadic and familial schwannomas",1996,"Human Genetics","98","2",,"189","193",,48,10.1007/s004390050188,"https://www.scopus.com/inward/record.uri?eid=2-s2.0-8944256090&doi=10.1007%2fs004390050188&partnerID=40&md5=66f3a1660d0d3d37be885070e7073244",Article,Scopus,2-s2.0-8944256090
"McAndrew, P.E., Brandt, J.T., Pearl, D.K., Prior, T.W.","The incidence of the gene for thermolabile methylene tetrahydrofolate reductase in African Americans",1996,"Thrombosis Research","83","2",,"195","198",,79,10.1016/0049-3848(96)00121-1,"https://www.scopus.com/inward/record.uri?eid=2-s2.0-0005775025&doi=10.1016%2f0049-3848%2896%2900121-1&partnerID=40&md5=e7303dd342874be5a097466e16b1cecb",Article,Scopus,2-s2.0-0005775025
"Sung, C.-C., Collins, R., Li, J., Pearl, D.K., Coons, S.W., Scheithauer, B.W., Johnson, P.C., Yates, A.J.","Glycolipids and myelin proteins in human oligodendrogliomas",1996,"Glycoconjugate Journal","13","3",,"433","443",,30,10.1007/BF00731476,"https://www.scopus.com/inward/record.uri?eid=2-s2.0-0029975461&doi=10.1007%2fBF00731476&partnerID=40&md5=41baab6d6607f65916bffd547ade75ed",Article,Scopus,2-s2.0-0029975461
"Maa, J.-F., Pearl, D.K., Bartoszyński, R.","Reducing multidimensional two-sample data to one-dimensional interpoint comparisons",1996,"Annals of Statistics","24","3",,"1069","1074",,31,,"https://www.scopus.com/inward/record.uri?eid=2-s2.0-0030522371&partnerID=40&md5=2f444ceb996af4fb534e98c527fd6f25",Article,Scopus,2-s2.0-0030522371
"Malarkey, W.B., Pearl, D.K., Demers, L.M., Kiecolt-Glaser, J.K., Glaser, R.","Influence of academic stress and season on 24-hour mean concentrations of ACTH, cortisol, and β-endorphin",1995,"Psychoneuroendocrinology","20","5",,"499","508",,90,10.1016/0306-4530(94)00077-N,"https://www.scopus.com/inward/record.uri?eid=2-s2.0-0028989431&doi=10.1016%2f0306-4530%2894%2900077-N&partnerID=40&md5=e1c5a089ba471181cd4312f09de57a8d",Article,Scopus,2-s2.0-0028989431
"Sung, C.‐C., Pearl, D.K., Coons, S.W., Scheithauer, B.W., Johnson, P.C., Zheng, M., Yates, A.J.","Correlation of ganglioside patterns of primary brain tumors with survival",1995,"Cancer","75","3",,"851","859",,22,10.1002/1097-0142(19950201)75:3&lt;851::AID-CNCR2820750317&gt;3.0.CO;2-H,"https://www.scopus.com/inward/record.uri?eid=2-s2.0-0028798249&doi=10.1002%2f1097-0142%2819950201%2975%3a3%26lt%3b851%3a%3aAID-CNCR2820750317%26gt%3b3.0.CO%3b2-H&partnerID=40&md5=881d6bbd95e300415ce541622c8152ba",Article,Scopus,2-s2.0-0028798249
"Prior, T.W., Bartolo, C., Pearl, D.K., Papp, A.C., Snyder, P.J., Sedra, M.S., Burghes, A.H.M., Mendell, J.R.","Spectrum of small mutations in the dystrophin coding region",1995,"American Journal of Human Genetics","57","1",,"22","33",,86,,"https://www.scopus.com/inward/record.uri?eid=2-s2.0-0029073192&partnerID=40&md5=a61ea0b2216de013ea6a2b7cfc1e2b18",Article,Scopus,2-s2.0-0029073192
"Singh, L.P.K., Pearl, D.K., Franklin, T.K., Spring, P.M., Scheithauer, B.W., Coons, S.W., Johnson, P.C., Pfeiffer, S.E., Li, J., Knott, J.C.A., Yates, A.J.","Neutral glycolipid composition of primary human brain tumors",1994,"Molecular and Chemical Neuropathology","21","2-3",,"241","257",,11,10.1007/BF02815353,"https://www.scopus.com/inward/record.uri?eid=2-s2.0-0028235254&doi=10.1007%2fBF02815353&partnerID=40&md5=a1b1b14088a4802fac449262b16be0d5",Article,Scopus,2-s2.0-0028235254
"Glaser, R., Pearl, D.K., Kiecolt-Glaser, J.K., Malarkey, W.B.","Plasma cortisol levels and reactivation of latent Epstein-Barr virus in response to examination stress",1994,"Psychoneuroendocrinology","19","8",,"765","772",,109,10.1016/0306-4530(94)90023-X,"https://www.scopus.com/inward/record.uri?eid=2-s2.0-0028031432&doi=10.1016%2f0306-4530%2894%2990023-X&partnerID=40&md5=230cc8f8c016c95eb23e288b220e91fa",Article,Scopus,2-s2.0-0028031432
"Li, J., Pearl, D.K., Pfeiffer, S.E., Yates, A.J.","Patterns of reactivity with anti‐glycolipid antibodies in human primary brain tumors",1994,"Journal of Neuroscience Research","39","2",,"148","158",,14,10.1002/jnr.490390205,"https://www.scopus.com/inward/record.uri?eid=2-s2.0-0028064741&doi=10.1002%2fjnr.490390205&partnerID=40&md5=2f5befc6fa09ebb6db88c41ad7dd3a82",Article,Scopus,2-s2.0-0028064741
"Malarkey, W.B., Kiecolt-Glaser, J.K., Pearl, D., Glaser, R.","Hostile behavior during marital conflict alters pituitary and adrenal hormones",1994,"Psychosomatic Medicine","56","1",,"41","51",,124,,"https://www.scopus.com/inward/record.uri?eid=2-s2.0-0028157363&partnerID=40&md5=4703c3254269685d252dbed8a7a62a22",Article,Scopus,2-s2.0-0028157363
"Coons, S.W., Johnson, P.C., Pearl, D.K.","Prognostic significance of flow cytometry deoxyribonucleic acid analysis of human astrocytomas",1994,"Neurosurgery","35","1",,"119","126",,31,,"https://www.scopus.com/inward/record.uri?eid=2-s2.0-0028025437&partnerID=40&md5=3ae9abddf3b87cd7405690b2da320edf",Article,Scopus,2-s2.0-0028025437
"Newton, H.B., Newton, C., Pearl, D., Davidson, T.","Swallowing assessment in primary brain tumor patients with dysphagia",1994,"Neurology","44","10",,"1927","1932",,15,,"https://www.scopus.com/inward/record.uri?eid=2-s2.0-0028000006&partnerID=40&md5=8cd34ef4577628fa42159b1813b8b560",Article,Scopus,2-s2.0-0028000006
"Coons, S.W., Johnson, P.C., Pearl, D.K., Olafsen, A.G.","Prognostic significance of flow cytometry deoxyribonucleic acid analysis of human oligodendrogliomas",1994,"Neurosurgery","34","4",,"680","687",,31,,"https://www.scopus.com/inward/record.uri?eid=2-s2.0-0028273801&partnerID=40&md5=ecd8a47481d982a9e0e170424ab54a07",Article,Scopus,2-s2.0-0028273801
"SGOUTAS‐EMCH, S.A., CACIOPPO, J.T., UCHINO, B.N., MALARKEY, W., PEARL, D., KIECOLT‐GLASER, J.K., GLASER, R.","The effects of an acute psychological stressor on cardiovascular, endocrine, and cellular immune response: A prospective study of individuals high and low in heart rate reactivity",1994,"Psychophysiology","31","3",,"264","271",,124,10.1111/j.1469-8986.1994.tb02215.x,"https://www.scopus.com/inward/record.uri?eid=2-s2.0-0028202452&doi=10.1111%2fj.1469-8986.1994.tb02215.x&partnerID=40&md5=da71635690fe9fc9920a59a98eea7a01",Article,Scopus,2-s2.0-0028202452
"Aguis, L., Hadjiconstantinou, M., Qu, Z.-X., Neff, N.H., Pearl, D.K., Yates, A.J.","Gm1 ganglioside and darkly staining neurons in brains of rats subjected to neonatal hypoxia-ischemia",1994,"International Journal of Developmental Neuroscience","12","7",,"623","630",,3,10.1016/0736-5748(94)90014-0,"https://www.scopus.com/inward/record.uri?eid=2-s2.0-0028130234&doi=10.1016%2f0736-5748%2894%2990014-0&partnerID=40&md5=bc9bebd5a395b54c6008a91b310c0009",Article,Scopus,2-s2.0-0028130234
"Sung, C.‐C., Pearl, D.K., Coons, S.W., Scheithauer, B.W., Johnson, P.C., Yates, A.J.","Gangliosides as diagnostic markers of human astrocytomas and primitive neuroectodermal tumors",1994,"Cancer","74","11",,"3010","3022",,32,10.1002/1097-0142(19941201)74:11&lt;3010::AID-CNCR2820741119&gt;3.0.CO;2-I,"https://www.scopus.com/inward/record.uri?eid=2-s2.0-0028100129&doi=10.1002%2f1097-0142%2819941201%2974%3a11%26lt%3b3010%3a%3aAID-CNCR2820741119%26gt%3b3.0.CO%3b2-I&partnerID=40&md5=f4f614cecca692f1b4b748f18e778eab",Article,Scopus,2-s2.0-0028100129
"Zwilling, B.S., Brown, D., Feng, N.G., Sheridan, J., Pearl, D.","The Effect of Adrenalectomy on the Restraint Stressed Induced Suppression of MHC Class II Expression by Murine Peritoneal Macrophages",1993,"Brain Behavior and Immunity","7","1",,"29","35",,34,10.1006/brbi.1993.1003,"https://www.scopus.com/inward/record.uri?eid=2-s2.0-0027321424&doi=10.1006%2fbrbi.1993.1003&partnerID=40&md5=67555e196628912ba5df2926d03dc066",Article,Scopus,2-s2.0-0027321424
"Brown, D.H., Sheridan, J., Pearl, D., Zwilling, B.S.","Regulation of mycobacterial growth by the hypothalamus-pituitary-adrenal axis: Differential responses of Mycobacterium bovis BCG-resistant and - susceptible mice",1993,"Infection and Immunity","61","11",,"4793","4800",,51,,"https://www.scopus.com/inward/record.uri?eid=2-s2.0-0027370697&partnerID=40&md5=5d703e92aab59ff03f8140d017ee687f",Article,Scopus,2-s2.0-0027370697
"Peng, N., Pearl, D.K., Chan, W., Bartoszyński, R.","Linear birth and death processes under the influence of disasters with time-dependent killing probabilities",1993,"Stochastic Processes and their Applications","45","2",,"243","258",,4,10.1016/0304-4149(93)90072-C,"https://www.scopus.com/inward/record.uri?eid=2-s2.0-38249003280&doi=10.1016%2f0304-4149%2893%2990072-C&partnerID=40&md5=a49b656c4d0b014f294e8df183884aa8",Article,Scopus,2-s2.0-38249003280
"Saqr, H.E., Pearl, D.K., Yates, A.J.","A Review and Predictive Models of Gang ioside Uptake by Biological Membranes",1993,"Journal of Neurochemistry","61","2",,"395","441",,96,10.1111/j.1471-4159.1993.tb02140.x,"https://www.scopus.com/inward/record.uri?eid=2-s2.0-0027179047&doi=10.1111%2fj.1471-4159.1993.tb02140.x&partnerID=40&md5=4c1b61d583e9c7c816a048ba4a078ce0",Article,Scopus,2-s2.0-0027179047
"Libet, B., Wright, E.W., Feinstein, B., Pearl, D.K.","Retroactive enhancement of a skin sensation by a delayed cortical stimulus in man: Evidence for delay of a conscious sensory experience",1992,"Consciousness and Cognition","1","3",,"367","375",,10,10.1016/1053-8100(92)90069-M,"https://www.scopus.com/inward/record.uri?eid=2-s2.0-33750312724&doi=10.1016%2f1053-8100%2892%2990069-M&partnerID=40&md5=12d4bf3d14f6d28dcd91d5e0314d7fc2",Article,Scopus,2-s2.0-33750312724
"Zwilling, B.S., Lafuse, W.P., Brown, D., Pearl, D.","Characterization of ACTH mediated suppression of MHC class II expression by murine peritoneal macrophages",1992,"Journal of Neuroimmunology","39","1-2",,"133","138",,11,10.1016/0165-5728(92)90182-K,"https://www.scopus.com/inward/record.uri?eid=2-s2.0-0026650389&doi=10.1016%2f0165-5728%2892%2990182-K&partnerID=40&md5=21394ba3acae496ed5af5f0e72ad7562",Article,Scopus,2-s2.0-0026650389
"Zwilling, B.S., Brown, D., Pearl, D.","Induction of major histocompatibility complex class II glycoproteins by interferon-γ: attenuation of the effects of restraint stress",1992,"Journal of Neuroimmunology","37","1-2",,"115","122",,30,10.1016/0165-5728(92)90162-E,"https://www.scopus.com/inward/record.uri?eid=2-s2.0-0026584411&doi=10.1016%2f0165-5728%2892%2990162-E&partnerID=40&md5=957c51ad23b5ac1c3289a7f30a052a97",Article,Scopus,2-s2.0-0026584411
"MCPEEK, M., SALKOWTTZ, J., LAUFMAN, H., PEARL, D., ZWILLING, B.S.","The expression of HLA‐DR by monocytes from black and from white donors: different requirements for protein synthesis",1992,"Clinical &amp; Experimental Immunology","87","1",,"163","168",,4,10.1111/j.1365-2249.1992.tb06431.x,"https://www.scopus.com/inward/record.uri?eid=2-s2.0-0026571692&doi=10.1111%2fj.1365-2249.1992.tb06431.x&partnerID=40&md5=b8c122dca1c21b36e248de4471623cb0",Article,Scopus,2-s2.0-0026571692
"El Sayed, H., Agudelo, J.D., Pearl, D.K., Yates, A.J.","Effects of GM1 and 2-Deoxy-2,3-dehydro-N-acetylneuraminic acid (NeuAc2en) on neuroblastoma (Neuro 2a) and human glioma cells (U1242 MG)",1991,"Journal of Neuro-Oncology","11","3",,"199","205",,2,10.1007/BF00165527,"https://www.scopus.com/inward/record.uri?eid=2-s2.0-0026332524&doi=10.1007%2fBF00165527&partnerID=40&md5=8fbcfb3444240a51e16a5d8a134e585f",Article,Scopus,2-s2.0-0026332524
"Zwilling, B.S., Salkowitz, J., Laufman, H., Pearl, D.","Differences in the expression of histocompatibility antigen-DR and in anti-Mycobacterial activity of monocytes from HIV-infected individuals",1991,"AIDS","5","11",,"1327","1332",,7,,"https://www.scopus.com/inward/record.uri?eid=2-s2.0-0026004712&partnerID=40&md5=263a113694a4b52ab548ed1da5498626",Article,Scopus,2-s2.0-0026004712
"Libet, B., Pearl, D.K., Morledge, D.E., Gleason, C.A., Hosobuchi, Y., Barbaro, N.M.","Control of the transition from sensory detection to sensory awareness in man by the duration of a thalamic stimulus: The CEREBRAL 'time-on' factor",1991,"Brain","114","4",,"1731","1757",,92,10.1093/brain/114.4.1731,"https://www.scopus.com/inward/record.uri?eid=2-s2.0-0025788585&doi=10.1093%2fbrain%2f114.4.1731&partnerID=40&md5=f17802bf96f22d69889be627d0b27d56",Article,Scopus,2-s2.0-0025788585
"Salgaller, M., Pearl, D., Stephens, R.","In situ hybridization with single-stranded RNA probes to demonstrate infrequently elevated gli mRNA and no increased ras mRNA levels in meningiomas and astrocytomas",1991,"Cancer Letters","57","3",,"243","253",,19,10.1016/0304-3835(91)90164-D,"https://www.scopus.com/inward/record.uri?eid=2-s2.0-0025730271&doi=10.1016%2f0304-3835%2891%2990164-D&partnerID=40&md5=1f297cce80a3aff09fe12939f0a1550c",Article,Scopus,2-s2.0-0025730271
"Malarkey, W.B., Hall, J.C., Pearl, D.K., Kiecolt-Glaser, J.K., Glaser, R.","The Influence of Academic Stress and Season on 24-Hour Concentrations of Growth Hormone and Prolactin",1991,"Journal of Clinical Endocrinology and Metabolism","73","5",,"1089","1092",,46,10.1210/jcem-73-5-1089,"https://www.scopus.com/inward/record.uri?eid=2-s2.0-0025787688&doi=10.1210%2fjcem-73-5-1089&partnerID=40&md5=e460cfa79ee3fbb0227da865b88c9e33",Article,Scopus,2-s2.0-0025787688
"Salgaller, M., Agius, L., Yates, A., Pearl, D., Roberts, W., Stephens, R.","Application of automated image analysis to demonstrate the correlation between ras p21 expression and severity of gliomas",1990,"Biochemical and Biophysical Research Communications","169","2",,"482","491",,17,10.1016/0006-291X(90)90357-S,"https://www.scopus.com/inward/record.uri?eid=2-s2.0-0025323865&doi=10.1016%2f0006-291X%2890%2990357-S&partnerID=40&md5=5e03aceb873d99c17e84c667c619ecbb",Article,Scopus,2-s2.0-0025323865
"Fuller, K.A., Pearl, D., Whitacre, C.C.","Oral tolerance in experimental autoimmune encephalomyelitis: serum and salivary antibody responses",1990,"Journal of Neuroimmunology","28","1",,"15","26",,23,10.1016/0165-5728(90)90037-N,"https://www.scopus.com/inward/record.uri?eid=2-s2.0-0025266658&doi=10.1016%2f0165-5728%2890%2990037-N&partnerID=40&md5=8b04561d6c28830b8e0ab780b441e557",Article,Scopus,2-s2.0-0025266658
"Zwilling, B.S., Darrow, R., McPeek, M., Laufman, H., Pearl, D.","HLA class II glycoprotein expression by monocytes from HIV-infected individuals: Differences in response to interferon-gamma",1990,"Clinical and Experimental Immunology","82","3",,"553","558",,3,,"https://www.scopus.com/inward/record.uri?eid=2-s2.0-0025222503&partnerID=40&md5=07b08e2724109408f0d81c5f7c09a224",Article,Scopus,2-s2.0-0025222503
"Guzman-Harty, M., Warner, J.K., Mancini, M.E., Pearl, D.K., Yates, A.J.","Effect of crush lesion on ganglioside radiolabelling patterns in rat sciatic nerve",1990,"Journal of Neuropathology and Experimental Neurology","49","3",,"225","236",,9,,"https://www.scopus.com/inward/record.uri?eid=2-s2.0-0025216267&partnerID=40&md5=ef01f2e5fe896cbdac283e0c3414da83",Article,Scopus,2-s2.0-0025216267
"Zwilling, B.S., Dinkins, M., Christner, R., Faris, M., Griffin, A., Hilburger, M., McPeek, M., Pearl, D.","Restraint stress-induced suppression of major histocompatibility complex class II expression by murine peritoneal macrophages",1990,"Journal of Neuroimmunology","29","1-3",,"125","130",,38,10.1016/0165-5728(90)90154-F,"https://www.scopus.com/inward/record.uri?eid=2-s2.0-0025076689&doi=10.1016%2f0165-5728%2890%2990154-F&partnerID=40&md5=682ed3c2d3890027adaa87efe7f07818",Article,Scopus,2-s2.0-0025076689
"Pearl, D.K., Bartôszyński, R., Horn, D.J.","A stochastic model for simulation of interactions between phytophagous spider mites and their phytoseiid predators",1989,"Experimental &amp; Applied Acarology","7","2",,"143","151",,8,10.1007/BF01270434,"https://www.scopus.com/inward/record.uri?eid=2-s2.0-0024886915&doi=10.1007%2fBF01270434&partnerID=40&md5=929a0e2c5f00c9f0ae577fbbb9b61a0f",Article,Scopus,2-s2.0-0024886915
"Kazimer, R.M., Whisler, R.L., Stephens, R.E., Pearl, D.K., Yates, A.J.","Sensitivity of glioma and fetal brain cell lines to natural killer cytolysis in a monolayer assay",1989,"Journal of Neuro-Oncology","7","2",,"145","152",,8,10.1007/BF00165099,"https://www.scopus.com/inward/record.uri?eid=2-s2.0-0024406808&doi=10.1007%2fBF00165099&partnerID=40&md5=f41f40aa90f3a588643e6e3d75910070",Article,Scopus,2-s2.0-0024406808
"Bartoszynski, R., Bühler, W.J., Chan, W., Pearl, D.K.","Population processes under the influence of disasters occurring independently of population size",1989,"Journal of Mathematical Biology","27","2",,"167","178",,15,10.1007/BF00276101,"https://www.scopus.com/inward/record.uri?eid=2-s2.0-0001155126&doi=10.1007%2fBF00276101&partnerID=40&md5=f48000167b216a1557ee253acfd17ccb",Article,Scopus,2-s2.0-0001155126
"Whitacre, C.C., Kundu, K., Pearl, D., Paterson, P.Y., Yates, A.J.","The glycolipid composition of activated rat lymphocytes and lymphocyte supernates in experimental allergic encephalomyelitis",1988,"Neurochemical Pathology","8","1",,"1","13",,,10.1007/BF03160131,"https://www.scopus.com/inward/record.uri?eid=2-s2.0-0024148830&doi=10.1007%2fBF03160131&partnerID=40&md5=f88db8ac56c2161e1801173666acf788",Article,Scopus,2-s2.0-0024148830
"Yates, A.J., Markowitz, D.L., Stephens, R.E., Pearl, D.K., Whisler, R.L.","Growth inhibition of cultured human glioma cells by beta-interferon is not dependent on changes in ganglioside composition",1988,"Journal of Neuropathology and Experimental Neurology","47","2",,"119","127",,8,,"https://www.scopus.com/inward/record.uri?eid=2-s2.0-0023832450&partnerID=40&md5=dc9fbd286b2fe9fbf5c68e70e15710c3",Article,Scopus,2-s2.0-0023832450
"Guzman‐Harty, M., Warner, J.K., Mancini, M.E., Pearl, D.K., Yates, A.J.","Effect of Crush Lesion on Radiolabelling of Ganglioside in Rat Peripheral Nerve",1988,"Journal of Neurochemistry","50","1",,"237","242",,6,10.1111/j.1471-4159.1988.tb13255.x,"https://www.scopus.com/inward/record.uri?eid=2-s2.0-0023831649&doi=10.1111%2fj.1471-4159.1988.tb13255.x&partnerID=40&md5=845beaff561d8395287313284b41db57",Article,Scopus,2-s2.0-0023831649
"Sickle‐Santanello, B.J., Farrar, W.B., Decenzo, J.F., Keyhani‐Rofagha, S., Klein, J., Pearl, D., Laufman, H., O'Toole, R.V.","Technical and statistical improvements for flow cytometric DNA analysis of paraffin‐embedded tissue",1988,"Cytometry","9","6",,"594","599",,22,10.1002/cyto.990090613,"https://www.scopus.com/inward/record.uri?eid=2-s2.0-0023756011&doi=10.1002%2fcyto.990090613&partnerID=40&md5=30a11f19128b40f54b1acbf07cd42506",Article,Scopus,2-s2.0-0023756011
"Pearl, D.K., Scott, E.L.","The anatomical distribution of skin cancers",1986,"International Journal of Epidemiology","15","4",,"502","506",,92,10.1093/ije/15.4.502,"https://www.scopus.com/inward/record.uri?eid=2-s2.0-0022844705&doi=10.1093%2fije%2f15.4.502&partnerID=40&md5=1b77426c285f210ce6ba72f835726486",Article,Scopus,2-s2.0-0022844705
"Pearl, D.K., Fairley, D.","Testing for the potential for nonresponse bias in sample surveys",1985,"Public Opinion Quarterly","49","4",,"553","560",,39,10.1086/268950,"https://www.scopus.com/inward/record.uri?eid=2-s2.0-0001475969&doi=10.1086%2f268950&partnerID=40&md5=7ccf6aef51ac83991156b8ac9fd2bbf0",Article,Scopus,2-s2.0-0001475969
"Fairley, D., Pearl, D.K.","The bahadur efficiency of paired versus joint ranking procedures for pairwise multiple comparisons",1984,"Communications in Statistics - Theory and Methods","13","12",,"1471","1481",,4,10.1080/03610928408828770,"https://www.scopus.com/inward/record.uri?eid=2-s2.0-84886996150&doi=10.1080%2f03610928408828770&partnerID=40&md5=9fb91ddbd2b69c39318780cc2e37e9ed",Article,Scopus,2-s2.0-84886996150
"Libet, B., Gleason, C.A., Wright, E.W., Pearl, D.K.","Time of conscious intention to act in relation to onset of cerebral activity (readiness-potential): The unconscious initiation of a freely voluntary act",1983,"Brain","106","3",,"623","642",,1069,10.1093/brain/106.3.623,"https://www.scopus.com/inward/record.uri?eid=2-s2.0-0020592345&doi=10.1093%2fbrain%2f106.3.623&partnerID=40&md5=bcad5512ff82fe76464c63e08a816310",Article,Scopus,2-s2.0-0020592345
"Holmquist, R., Pearl, D.","Theoretical foundations for quantitative paleogenetics - Part III: The Molecular Divergence of Nucleic Acids and Proteins for the Case of Genetic Events of Unequal Probability",1981,"Journal of Molecular Evolution","17","1",,"56","57",,1,10.1007/BF01792426,"https://www.scopus.com/inward/record.uri?eid=2-s2.0-34250246967&doi=10.1007%2fBF01792426&partnerID=40&md5=5e93688af68c7d85069288b0cb2aa291",Erratum,Scopus,2-s2.0-34250246967
"Holmquist, R., Pearl, D.","Theoretical foundations for quantitative paleogenetics - PART III: The Molecular Divergence of Nucleic Acids and Proteins for the Case of Genetic Events of Unequal Probability",1980,"Journal Of Molecular Evolution","16","3-4",,"211","267",,19,10.1007/BF01804977,"https://www.scopus.com/inward/record.uri?eid=2-s2.0-0019126419&doi=10.1007%2fBF01804977&partnerID=40&md5=61112338e6e0575b3738aec200f4fafc",Article,Scopus,2-s2.0-0019126419
"Libet, B., Wright, E.W., Feinstein, B., Pearl, D.K.","Subjective referral of the timing for a conscious sensory experience: A functional role for the somatosensory specific projection system in-man",1979,"Brain","102","1",,"193","224",,336,10.1093/brain/102.1.193,"https://www.scopus.com/inward/record.uri?eid=2-s2.0-0018352296&doi=10.1093%2fbrain%2f102.1.193&partnerID=40&md5=cca171d1ee559086312bc6537eb8feed",Article,Scopus,2-s2.0-0018352296
