Authors,Title,Year,Source title,Volume,Issue,Art. No.,Page start,Page end,Page count,Cited by,DOI,Link,Document Type,Source,EID
"Sharma, R.I., Kohn, J., Moghe, P.V.","Engineering cell motility via substrate incorporation of poly(ethylene glycol)",2002,"Annual International Conference of the IEEE Engineering in Medicine and Biology - Proceedings","1",,,"765","766",,,,"https://www.scopus.com/inward/record.uri?eid=2-s2.0-0036917055&partnerID=40&md5=cf845afbc9419fc71d907585b6aa637f",Conference Paper,Scopus,2-s2.0-0036917055
"Tjia, J.S., Moghe, P.V.","Cell migration on cell-internalizable ligand microdepots: A phenomenological model",2002,"Annals of Biomedical Engineering","30","6",,"851","866",,6,10.1114/1.1492814,"https://www.scopus.com/inward/record.uri?eid=2-s2.0-0035982814&doi=10.1114%2f1.1492814&partnerID=40&md5=1e1195ac386805fed614cb79a020c62a",Article,Scopus,2-s2.0-0035982814
"Tjia, J.S., Moghe, P.V.","Regulation of cell motility on polymer substrates via ""dynamic,"" cell internalizable, ligand microinterfaces",2002,"Tissue Engineering","8","2",,"247","261",,18,10.1089/107632702753725012,"https://www.scopus.com/inward/record.uri?eid=2-s2.0-0036244993&doi=10.1089%2f107632702753725012&partnerID=40&md5=ff7d2debfb0f17c5d4ed2ee7b9bd7542",Article,Scopus,2-s2.0-0036244993
"Rosenson-Schloss, R.S., Chang, C.C., Constantinides, A., Moghe, P.V.","Alteration of leukocyte motility on plasma-conditioned prosthetic biomaterial, ePTFE, via a flow-responsive cell adhesion molecule, CD43",2002,"Journal of Biomedical Materials Research","60","1",,"8","19",,2,10.1002/jbm.1278,"https://www.scopus.com/inward/record.uri?eid=2-s2.0-0036159783&doi=10.1002%2fjbm.1278&partnerID=40&md5=179b610360552728f680a39044c66aa4",Article,Scopus,2-s2.0-0036159783
"Semler, E.J., Moghe, P.V.","Engineering hepatocyte functional fate through growth factor dynamics: The role of cell morphologic priming",2001,"Biotechnology and Bioengineering","75","5",,"510","520",,21,10.1002/bit.10113,"https://www.scopus.com/inward/record.uri?eid=2-s2.0-0035814341&doi=10.1002%2fbit.10113&partnerID=40&md5=c602fcdc568598d1403d3a1ced7772df",Article,Scopus,2-s2.0-0035814341
"Brieva, T.A., Moghe, P.V.","Functional engineering of hepatocytes via heterocellular presentation of a homoadhesive molecule, E-cadherin",2001,"Biotechnology and Bioengineering","76","4",,"295","302",,28,10.1002/bit.10041,"https://www.scopus.com/inward/record.uri?eid=2-s2.0-0035829833&doi=10.1002%2fbit.10041&partnerID=40&md5=a44412430ac749ed0589fcaac2a114ba",Article,Scopus,2-s2.0-0035829833
"Ranucci, C.S., Moghe, P.V.","Substrate microtopography can enhance cell adhesive and migratory responsiveness to matrix ligand density",2001,"Journal of Biomedical Materials Research","54","2",,"149","161",,70,10.1002/1097-4636(200102)54:2&lt;149::AID-JBM1&gt;3.0.CO;2-O,"https://www.scopus.com/inward/record.uri?eid=2-s2.0-0035255299&doi=10.1002%2f1097-4636%28200102%2954%3a2%26lt%3b149%3a%3aAID-JBM1%26gt%3b3.0.CO%3b2-O&partnerID=40&md5=40e0db68a84aa57bdd1d9e9d2e290c5c",Article,Scopus,2-s2.0-0035255299
"Chang, C.C., S. Rosenson-Schloss, R., Bhoj, T.D., Moghe, P.V.","Leukocyte chemosensory migration on vascular prosthetic biomaterial is mediated by an integrin β<inf>2</inf> receptor chain",2000,"Biomaterials","21","22",,"2305","2313",,8,10.1016/S0142-9612(00)00157-5,"https://www.scopus.com/inward/record.uri?eid=2-s2.0-0034670177&doi=10.1016%2fS0142-9612%2800%2900157-5&partnerID=40&md5=067f7270c3f34bafd741ebe74b12af76",Article,Scopus,2-s2.0-0034670177
"Semler, E.J., Ranucci, C.S., Moghe, P.V.","Mechanochemical manipulation of hepatocyte aggregation can selectively induce or repress liver-specific function",2000,"Biotechnology and Bioengineering","69","4",,"359","369",,89,,"https://www.scopus.com/inward/record.uri?eid=2-s2.0-0034238092&partnerID=40&md5=46eec5c74ab324e1ed5c9b92e6860582",Article,Scopus,2-s2.0-0034238092
"Ranucci, C.S., Kumar, A., Batra, S.P., Moghe, P.V.","Control of hepatocyte function on collagen foams: Sizing matrix pores toward selective induction of 2-D and 3-D cellular morphogenesis",2000,"Biomaterials","21","8",,"783","793",,120,10.1016/S0142-9612(99)00238-0,"https://www.scopus.com/inward/record.uri?eid=2-s2.0-0033993819&doi=10.1016%2fS0142-9612%2899%2900238-0&partnerID=40&md5=20d7c8bd21fdeb34b127a6d8a0e64da1",Article,Scopus,2-s2.0-0033993819
"Tziampazis, E., Kohn, J., Moghe, P.V.","PEG-variant biomaterials as selectively adhesive protein templates: Model surfaces for controlled cell adhesion and migration",2000,"Biomaterials","21","5",,"511","520",,165,10.1016/S0142-9612(99)00212-4,"https://www.scopus.com/inward/record.uri?eid=2-s2.0-0033969118&doi=10.1016%2fS0142-9612%2899%2900212-4&partnerID=40&md5=a7e0df7d6b17c95e5f1740732f23f70e",Article,Scopus,2-s2.0-0033969118
"Chang, C.C., Lieberman, S.M., Moghe, P.V.","Quantitative analysis of the regulation of leukocyte chemosensory migration by a vascular prosthetic biomaterial",2000,"Journal of Materials Science: Materials in Medicine","11","6",,"337","344",,5,10.1023/A:1008925722623,"https://www.scopus.com/inward/record.uri?eid=2-s2.0-0034123482&doi=10.1023%2fA%3a1008925722623&partnerID=40&md5=df730a682beee088275d3678faa2f9c0",Article,Scopus,2-s2.0-0034123482
"Tziampazis, Evangelos, Cassaday, Jason A., Kohn, Joachim, Moghe, Prabhas V.","Selective regulation of protein bioactivity and cell adhesion &amp; migration via PEG microdomains on biopolymers",1999,"Annual International Conference of the IEEE Engineering in Medicine and Biology - Proceedings","2",,,"743","",,1,,"https://www.scopus.com/inward/record.uri?eid=2-s2.0-0033335146&partnerID=40&md5=43f39dbd470dc90c3abcdc76943006bb",Conference Paper,Scopus,2-s2.0-0033335146
"Tjia, J.S., Aneskievich, B.J., Moghe, P.V.","Induction of cell migration on synthetic polymer substrates through tailored cell-substrate matrix reciprocity",1999,"Annual International Conference of the IEEE Engineering in Medicine and Biology - Proceedings","1",,,"102","",,,,"https://www.scopus.com/inward/record.uri?eid=2-s2.0-0033344210&partnerID=40&md5=2525f0069abc4241ee574be035b2d7b6",Conference Paper,Scopus,2-s2.0-0033344210
"Tjia, J.S., Aneskievich, B.J., Moghe, P.V.","Substrate-adsorbed collagen and cell secreted fibronectin concertedly induce cell migration on poly(lactide-glycolide) substrates",1999,"Biomaterials","20","23-24",,"2223","2233",,50,10.1016/S0142-9612(99)00153-2,"https://www.scopus.com/inward/record.uri?eid=2-s2.0-0032728826&doi=10.1016%2fS0142-9612%2899%2900153-2&partnerID=40&md5=42a1f8f09e6c6727e611206049157fe9",Article,Scopus,2-s2.0-0032728826
"Ranucci, C.S., Moghe, P.V.","Polymer substrate topography actively regulates the multicellular organization and liver-specific functions of cultured hepatocytes",1999,"Tissue Engineering","5","5",,"407","420",,65,10.1089/ten.1999.5.407,"https://www.scopus.com/inward/record.uri?eid=2-s2.0-0032749087&doi=10.1089%2ften.1999.5.407&partnerID=40&md5=b271b936f0a86df999375261509f8099",Article,Scopus,2-s2.0-0032749087
"Rosenson-Schloss, R.S., Vitolo, J.L., Moghe, P.V.","Flow-mediated cell stress induction in adherent leukocytes is accompanied by modulation of morphology and phagocytic function",1999,"Medical and Biological Engineering and Computing","37","2",,"257","263",,7,,"https://www.scopus.com/inward/record.uri?eid=2-s2.0-0033031516&partnerID=40&md5=d564500ce3a97de452a24b592efd1448",Article,Scopus,2-s2.0-0033031516
"Chang, C.C., Lieberman, S.M., Moghe, P.V.","Leukocyte spreading behavior on vascular biomaterial surfaces: Consequences of chemoattractant stimulation",1999,"Biomaterials","20","3",,"273","281",,14,10.1016/S0142-9612(98)00171-9,"https://www.scopus.com/inward/record.uri?eid=2-s2.0-0033081644&doi=10.1016%2fS0142-9612%2898%2900171-9&partnerID=40&md5=2c566d31db5f15a15eb8c490162966b4",Article,Scopus,2-s2.0-0033081644
"Tjia, J.S., Moghe, P.V.","Analysis of 3-D microstructure of porous poly(lactide-glycolide) matrices using confocal microscopy",1998,"Journal of Biomedical Materials Research","43","3",,"291","299",,19,,"https://www.scopus.com/inward/record.uri?eid=2-s2.0-0032171228&partnerID=40&md5=19d44162139f8c46fad8ea7e3c82bf79",Article,Scopus,2-s2.0-0032171228
"Moghe, P.V., Coger, R.N., Toner, M., Yarmush, M.L.","Cell-cell interactions are essential for maintenance of hepatocyte function in collagen gel but not on matrigel",1997,"Biotechnology and Bioengineering","56","6",,"706","711",,57,10.1002/(SICI)1097-0290(19971220)56:6&lt;706::AID-BIT14&gt;3.0.CO;2-5,"https://www.scopus.com/inward/record.uri?eid=2-s2.0-0342437102&doi=10.1002%2f%28SICI%291097-0290%2819971220%2956%3a6%26lt%3b706%3a%3aAID-BIT14%26gt%3b3.0.CO%3b2-5&partnerID=40&md5=644aa8dbf0766297002c9e90337d45d8",Article,Scopus,2-s2.0-0342437102
"Chang, C.W., Moghe, P.V.","In situ analysis of leukocyte motility on vascular graft biomaterials",1997,"FASEB Journal","11","3",,"","",,,,"https://www.scopus.com/inward/record.uri?eid=2-s2.0-33750100218&partnerID=40&md5=28caeb465accb252c5245bb85b2e6262",Article,Scopus,2-s2.0-33750100218
"Moghe, P.V., Tjia, J.S., Semler, E.J.","Novel quantitation of tissue analog microstructure",1997,"FASEB Journal","11","3",,"","",,,,"https://www.scopus.com/inward/record.uri?eid=2-s2.0-33750092773&partnerID=40&md5=d8a29a9f7c2253f5a9624e21e47b5249",Article,Scopus,2-s2.0-33750092773
"Coger, R., Toner, M., Moghe, P., Ezzell, R.M., Yarmush, M.L.","Hepatocyte aggregation and reorganization of EHS matrix gel",1997,"Tissue Engineering","3","4",,"375","390",,21,10.1089/ten.1997.3.375,"https://www.scopus.com/inward/record.uri?eid=2-s2.0-0031471583&doi=10.1089%2ften.1997.3.375&partnerID=40&md5=2440e246ae5e91975dc84a1711ae3ac7",Article,Scopus,2-s2.0-0031471583
"Semler, E.J., Tjia, J.S., Moghe, P.V.","Analysis of surface microtopography of biodegradable polymer matrices using confocal reflection microscopy",1997,"Biotechnology Progress","13","5",,"630","634",,15,10.1021/bp9700871,"https://www.scopus.com/inward/record.uri?eid=2-s2.0-0031239974&doi=10.1021%2fbp9700871&partnerID=40&md5=5ae950169ab59041709aadeb44062db4",Article,Scopus,2-s2.0-0031239974
"Moghe, P.V., Ezzell, R.M., Toner, M., Tompkins, R.G., Yarmush, M.L.","Role of β1 integrin distribution in morphology and function of collagen-sandwiched hepatocytes",1997,"Tissue Engineering","3","1",,"1","16",,11,10.1089/ten.1997.3.1,"https://www.scopus.com/inward/record.uri?eid=2-s2.0-0030893447&doi=10.1089%2ften.1997.3.1&partnerID=40&md5=59e389d53729744c4ec68faf779acd8e",Article,Scopus,2-s2.0-0030893447
"Tjia, Jane S., Semler, Eric J., Moghe, Prabhas V.","Novel analyses of bulk and topological microstructure of biodegradable polymeric tissue analogs",1997,"American Society of Mechanical Engineers, Bioengineering Division (Publication) BED","35",,,"415","416",,,,"https://www.scopus.com/inward/record.uri?eid=2-s2.0-0030687383&partnerID=40&md5=fdbf363e647acc88c75ed4ecbaf2b82c",Conference Paper,Scopus,2-s2.0-0030687383
"Berthiaume, F., Moghe, P.V., Toner, M., Yarmush, M.L.","Effect of extracellular matrix topology on cell structure, function, and physiological responsiveness: Hepatocytes cultured in a sandwich configuration",1996,"FASEB Journal","10","13",,"1471","1484",,293,,"https://www.scopus.com/inward/record.uri?eid=2-s2.0-0029852524&partnerID=40&md5=7ef8c10a40561556b961275dfa9bff8e",Review,Scopus,2-s2.0-0029852524
"Moghe, P.V.","Soft-tissue analogue design and tissue engineering of liver",1996,"MRS Bulletin","21","11",,"52","54",,3,,"https://www.scopus.com/inward/record.uri?eid=2-s2.0-0030283683&partnerID=40&md5=5714334c485924f31a6f2c1f79f774b7",Article,Scopus,2-s2.0-0030283683
"Moghe, P.V., Berthiaume, F., Ezzell, R.M., Toner, M., Tompkins, R.G., Yarmush, M.L.","Culture matrix configuration and composition in the maintenance of hepatocyte polarity and function",1996,"Biomaterials","17","3",,"373","385",,152,10.1016/0142-9612(96)85576-1,"https://www.scopus.com/inward/record.uri?eid=2-s2.0-0030070103&doi=10.1016%2f0142-9612%2896%2985576-1&partnerID=40&md5=2796652728eefc2b07c7465eb0640fbe",Article,Scopus,2-s2.0-0030070103
"Moghe, P.V., Tranquillo, R.T.","Stochasticity in membrane-localized ""ligand-receptor-G protein"" binding: Consequences for leukocyte movement behavior",1995,"Annals of Biomedical Engineering","23","3",,"257","267",,5,10.1007/BF02584427,"https://www.scopus.com/inward/record.uri?eid=2-s2.0-0029007856&doi=10.1007%2fBF02584427&partnerID=40&md5=1c4e0f5971f1319d3cb48815530c5fa5",Article,Scopus,2-s2.0-0029007856
"Moghe, P.V., Nelson, R.D., Tranquillo, R.T.","Cytokine-stimulated chemotaxis of human neutrophils in a 3-D conjoined fibrin gel assay",1995,"Journal of Immunological Methods","180","2",,"193","211",,78,10.1016/0022-1759(94)00314-M,"https://www.scopus.com/inward/record.uri?eid=2-s2.0-0028908051&doi=10.1016%2f0022-1759%2894%2900314-M&partnerID=40&md5=e6734933d0b4d679086396c3ff51b094",Article,Scopus,2-s2.0-0028908051
"Moghe, P.V., Tranquillo, R.T.","Stochastic model of chemoattractant receptor dynamics in leukocyte chemosensory movement",1994,"Bulletin of Mathematical Biology","56","6",,"1041","1093",,7,10.1007/BF02460287,"https://www.scopus.com/inward/record.uri?eid=2-s2.0-0028535382&doi=10.1007%2fBF02460287&partnerID=40&md5=afd25c6be0aad2f04ea5617c66205c87",Article,Scopus,2-s2.0-0028535382
