Authors,Title,Year,Source title,Volume,Issue,Art. No.,Page start,Page end,Page count,Cited by,DOI,Link,Document Type,Source,EID
"Cherry, J.F., Carlson, A.L., Benarba, F.L., Sommerfeld, S.D., Verma, D., Loers, G., Kohn, J., Schachner, M., Moghe, P.V.","Oriented, multimeric biointerfaces of the L1 cell adhesion molecule: An approach to enhance neuronal and neural stem cell functions on 2-D and 3-D polymer substrates",2012,"Biointerphases","7","1-4",,"1","16",,2,10.1007/s13758-012-0022-1,"https://www.scopus.com/inward/record.uri?eid=2-s2.0-84864091160&doi=10.1007%2fs13758-012-0022-1&partnerID=40&md5=f48fba3050a4198e77fdcec58e1cba3a",Article,Scopus,2-s2.0-84864091160
"McNamara, L.E., Sjöström, T., Burgess, K.V., Kim, J., Liu, E., Moghe, P.V., Oreffo, R.O.C., Meek, R.M.D., Su, B., Dalby, M.J.","Metabolomic analysis of mesenchymal stem cell responses to titania nanopillars for orthopaedics",2011,"24th European Conference on Biomaterials - Annual Conference of the European Society for Biomaterials",,,,"","",1,,,"https://www.scopus.com/inward/record.uri?eid=2-s2.0-84886996941&partnerID=40&md5=a1afd0860518664e2894a4c41ae179cf",Conference Paper,Scopus,2-s2.0-84886996941
"Iverson, N.M., Plourde, N.M., Sparks, S.M., Wang, J., Patel, E.N., Shah, P.S., Lewis, D.R., Zablocki, K.R., Nackman, G.B., Uhrich, K.E., Moghe, P.V.","Dual use of amphiphilic macromolecules as cholesterol efflux triggers and inhibitors of macrophage athero-inflammation",2011,"Biomaterials","32","32",,"8319","8327",,14,10.1016/j.biomaterials.2011.07.039,"https://www.scopus.com/inward/record.uri?eid=2-s2.0-80052372756&doi=10.1016%2fj.biomaterials.2011.07.039&partnerID=40&md5=d80b4c4c3a55eb9c152423a7c096dd6f",Article,Scopus,2-s2.0-80052372756
"Liu, E., Vega, S., Treiser, M.D., Sung, H.-J., Moghe, P.V.","Fluorescence imaging of cell-biomaterial interactions",2011,"Comprehensive Biomaterials","3",,,"291","303",,,,"https://www.scopus.com/inward/record.uri?eid=2-s2.0-84906592167&partnerID=40&md5=a2e3b6ca24a487eceb1c7ae2315bc837",Book Chapter,Scopus,2-s2.0-84906592167
"McNamara, L.E., Sjöström, T., Burgess, K.E.V., Kim, J.J.W., Liu, E., Gordonov, S., Moghe, P.V., Meek, R.M.D., Oreffo, R.O.C., Su, B., Dalby, M.J.","Skeletal stem cell physiology on functionally distinct titania nanotopographies",2011,"Biomaterials","32","30",,"7403","7410",,46,10.1016/j.biomaterials.2011.06.063,"https://www.scopus.com/inward/record.uri?eid=2-s2.0-80051552440&doi=10.1016%2fj.biomaterials.2011.06.063&partnerID=40&md5=c69326374d543e7b38f2e15af29cf7f6",Article,Scopus,2-s2.0-80051552440
"Lewis, D.R., Kamisoglu, K., York, A.W., Moghe, P.V.","Polymer-based therapeutics: Nanoassemblies and nanoparticles for management of atherosclerosis",2011,"Wiley Interdisciplinary Reviews: Nanomedicine and Nanobiotechnology","3","4",,"400","420",,35,10.1002/wnan.145,"https://www.scopus.com/inward/record.uri?eid=2-s2.0-79958253666&doi=10.1002%2fwnan.145&partnerID=40&md5=348ca332cdc549ff81c34b001253d558",Review,Scopus,2-s2.0-79958253666
"McNamara, L.E., Sjöström, T., Burgess, K.V., Kim, J., Liu, E., Gordonov, S., Moghe, P., Oreffo, R.O.C., Su, B., Dalby, M.J.","Metabolomic investigation of MSC responses to titania nanopillars",2011,"European Cells and Materials","22","SUPPL.3",,"74","",,,,"https://www.scopus.com/inward/record.uri?eid=2-s2.0-84860820086&partnerID=40&md5=86e5e90322f52dd1569936cd6d5a4625",Conference Paper,Scopus,2-s2.0-84860820086
"Sharma, R.I., Schwarzbauer, J.E., Moghe, P.V.","Nanomaterials can dynamically steer cell responses to biological ligands",2011,"Small","7","2",,"242","251",,3,10.1002/smll.201001518,"https://www.scopus.com/inward/record.uri?eid=2-s2.0-78651310353&doi=10.1002%2fsmll.201001518&partnerID=40&md5=2e5ba1e9afd8e9c7f05a21b972add257",Article,Scopus,2-s2.0-78651310353
"Hulshof, F., Liu, E., Negro, A., Gobaa, S., Lutolf, M., Moghe, P.V., Fernandes, H.","High–content imaging",2011,"Materiomics: High-Throughput Screening of Biomaterial Properties",,,,"85","100",,,10.1017/CBO9781139061414.007,"https://www.scopus.com/inward/record.uri?eid=2-s2.0-84923413094&doi=10.1017%2fCBO9781139061414.007&partnerID=40&md5=cd4518c07840d7d12162e2fabe2e0bbc",Book Chapter,Scopus,2-s2.0-84923413094
"Fernandes, H., Beijersbergen, R., Ferreira, L., Dechering, K., Moghe, P., Maniura-Weber, K.","Bioassay development",2011,"Materiomics: High-Throughput Screening of Biomaterial Properties",,,,"67","84",,,10.1017/CBO9781139061414.006,"https://www.scopus.com/inward/record.uri?eid=2-s2.0-84923437225&doi=10.1017%2fCBO9781139061414.006&partnerID=40&md5=29adecb68690507e8a1026e5c7a72257",Book Chapter,Scopus,2-s2.0-84923437225
"Sung, H.-J., Luk, A., Murthy, N.S., Liu, E., Jois, M., Joy, A., Bushman, J., Moghe, P.V., Kohn, J.","Poly(ethylene glycol) as a sensitive regulator of cell survival fate on polymeric biomaterials: The interplay of cell adhesion and pro-oxidant signaling mechanisms",2010,"Soft Matter","6","20",,"5196","5205",,17,10.1039/c0sm00172d,"https://www.scopus.com/inward/record.uri?eid=2-s2.0-77957721688&doi=10.1039%2fc0sm00172d&partnerID=40&md5=f6cb55d825f8d3cf27c0f2bdc01f4b2c",Article,Scopus,2-s2.0-77957721688
"Naczynski, D.J., Andelman, T., Pal, D., Chen, S., Riman, R.E., Roth, C.M., Moghe, P.V.","Albumin nanoshell encapsulation of near-infrared-excitable rare-earth nanoparticles enhances biocompatibility and enables targeted cell imaging",2010,"Small","6","15",,"1631","1640",,43,10.1002/smll.200902403,"https://www.scopus.com/inward/record.uri?eid=2-s2.0-77955212868&doi=10.1002%2fsmll.200902403&partnerID=40&md5=35906a818848a2c7b8e486131f8e6a16",Article,Scopus,2-s2.0-77955212868
"Iverson, N.M., Sparks, S.M., Demirdirek, B., Uhrich, K.E., Moghe, P.V.","Controllable inhibition of cellular uptake of oxidized low-density lipoprotein: Structure-function relationships for nanoscale amphiphilic polymers",2010,"Acta Biomaterialia","6","8",,"3081","3091",,26,10.1016/j.actbio.2010.02.019,"https://www.scopus.com/inward/record.uri?eid=2-s2.0-77956642537&doi=10.1016%2fj.actbio.2010.02.019&partnerID=40&md5=66ab66632e63e554a7891322800ea561",Article,Scopus,2-s2.0-77956642537
"Liu, E., Gordonov, S., Treiser, M.D., Moghe, P.V.","Parsing the early cytoskeletal and nuclear organizational cues that demarcate stem cell lineages",2010,"Cell Cycle","9","11",,"2108","2117",,12,10.4161/cc.9.11.11864,"https://www.scopus.com/inward/record.uri?eid=2-s2.0-77953573816&doi=10.4161%2fcc.9.11.11864&partnerID=40&md5=f919c9c745b98c0e87309693a8e3a19b",Review,Scopus,2-s2.0-77953573816
"Johnson, P.A., Luk, A., Demtchouk, A., Patel, H., Sung, H.-J., Treiser, M.D., Gordonov, S., Sheihet, L., Bolikal, D., Kohn, J., Moghe, P.V.","Interplay of anionic charge, poly(ethylene glycol), and iodinated tyrosine incorporation within tyrosine-derived polycarbonates: Effects on vascular smooth muscle cell adhesion, proliferation, and motility",2010,"Journal of Biomedical Materials Research - Part A","93","2",,"505","514",,13,10.1002/jbm.a.32544,"https://www.scopus.com/inward/record.uri?eid=2-s2.0-77950270951&doi=10.1002%2fjbm.a.32544&partnerID=40&md5=21285e375fe5b877959d3223ef0045ea",Article,Scopus,2-s2.0-77950270951
"Treiser, M.D., Yang, E.H., Gordonov, S., Cohen, D.M., Androulakis, I.P., Kohn, J., Chen, C.S., Moghe, P.V.","Cytoskeleton-based forecasting of stem cell lineage fates",2010,"Proceedings of the National Academy of Sciences of the United States of America","107","2",,"610","615",,145,10.1073/pnas.0909597107,"https://www.scopus.com/inward/record.uri?eid=2-s2.0-76249131225&doi=10.1073%2fpnas.0909597107&partnerID=40&md5=bc30798cd03770f01b25a2d966017abc",Article,Scopus,2-s2.0-76249131225
"Andelman, T., Gordonov, S., Busto, G., Moghe, P.V., Riman, R.E.","Synthesis and cytotoxicity of Y <inf>2</inf>O <inf>3</inf> Nanoparticles of various morphologies",2010,"Nanoscale Research Letters","5","2",,"263","273",,37,10.1007/s11671-009-9445-0,"https://www.scopus.com/inward/record.uri?eid=2-s2.0-77952886845&doi=10.1007%2fs11671-009-9445-0&partnerID=40&md5=1d961bf5244cfb6688174699293e2456",Article,Scopus,2-s2.0-77952886845
"Rossi, M.P., Xu, J., Schwarzbauer, J., Moghe, P.V.","Plasma-micropatterning of albumin nanoparticles: Substrates for enhanced cell-interactive display of ligands",2010,"Biointerphases","5","4",,"105","113",,2,10.1116/1.3507236,"https://www.scopus.com/inward/record.uri?eid=2-s2.0-78751564007&doi=10.1116%2f1.3507236&partnerID=40&md5=163d59b40a9379e15d07d57330129396",Article,Scopus,2-s2.0-78751564007
"Briggs, T., Treiser, M.D., Holmes, P.F., Kohn, J., Moghe, P.V., Arinzeh, T.L.","Osteogenic differentiation of human mesenchymal stem cells on poly(ethylene glycol)-variant biomaterials",2009,"Journal of Biomedical Materials Research - Part A","91","4",,"975","984",,29,10.1002/jbm.a.32310,"https://www.scopus.com/inward/record.uri?eid=2-s2.0-70450164409&doi=10.1002%2fjbm.a.32310&partnerID=40&md5=8ed237fc398e34bdc6d9473b463cd8a3",Article,Scopus,2-s2.0-70450164409
"Liu, E., Treiser, M.D., Patel, H., Sung, H.-J., Roskov, K.E., Kohn, J., Becker, M.L., Moghe, P.V.","High-content profiling of cell responsiveness to graded substrates based on combinatorially variant polymers",2009,"Combinatorial Chemistry and High Throughput Screening","12","7",,"646","655",,12,10.2174/138620709788923737,"https://www.scopus.com/inward/record.uri?eid=2-s2.0-67650961871&doi=10.2174%2f138620709788923737&partnerID=40&md5=9290d505a77ce466bc25ef17735834ee",Article,Scopus,2-s2.0-67650961871
"Moore, R.N., Moghe, P.V.","Expedited growth factor-mediated specification of human embryonic stem cells toward the hepatic lineage",2009,"Stem Cell Research","3","1",,"51","62",,11,10.1016/j.scr.2009.04.004,"https://www.scopus.com/inward/record.uri?eid=2-s2.0-67649873120&doi=10.1016%2fj.scr.2009.04.004&partnerID=40&md5=222da8eff38e97485627bcf2bef069f3",Article,Scopus,2-s2.0-67649873120
"Plourde, N.M., Kortagere, S., Welsh, W., Moghe, P.V.","Structure-activity relations of nanolipoblockers with the atherogenic domain of human macrophage scavenger receptor A",2009,"Biomacromolecules","10","6",,"1381","1391",,21,10.1021/bm8014522,"https://www.scopus.com/inward/record.uri?eid=2-s2.0-67049117928&doi=10.1021%2fbm8014522&partnerID=40&md5=bd9fba668373e2a47cbf5bdc41e328c3",Article,Scopus,2-s2.0-67049117928
"Sung, H.-J., Chandra, P., Treiser, M.D., Liu, E., Iovine, C.P., Moghe, P.V., Kohn, J.","Synthetic polymeric substrates as potent pro-oxidant versus anti-oxidant regulators of cytoskeletal remodeling and cell apoptosis",2009,"Journal of Cellular Physiology","218","3",,"549","557",,17,10.1002/jcp.21629,"https://www.scopus.com/inward/record.uri?eid=2-s2.0-58149386889&doi=10.1002%2fjcp.21629&partnerID=40&md5=aedc675f0025b3094c1231aa94ec8e9b",Article,Scopus,2-s2.0-58149386889
"Moore, R.N., Dasgupta, A., Rajaei, N., Yarmush, M.L., Toner, M., Larue, L., Moghe, P.V.","Enhanced differentiation of embryonic stem cells using co-cultivation with hepatocytes",2008,"Biotechnology and Bioengineering","101","6",,"1332","1343",,24,10.1002/bit.21987,"https://www.scopus.com/inward/record.uri?eid=2-s2.0-56749127893&doi=10.1002%2fbit.21987&partnerID=40&md5=89aef77b54b14d2f1b8bdc60a08b453c",Article,Scopus,2-s2.0-56749127893
"Moghe, P.V., Treiser, M.D., Kohn, J., Knight, D.","Parsing stem cell behaviors on complex biomaterials via high content imaging and systems modeling",2008,"8th World Biomaterials Congress 2008","3",,,"1511","",,,,"https://www.scopus.com/inward/record.uri?eid=2-s2.0-84869020621&partnerID=40&md5=c7eda28bd87929e1c724c1e2da77e04f",Conference Paper,Scopus,2-s2.0-84869020621
"Anthony, L., Palius, M., Maher, C., Moghe, P.","Discourse-based communities of practice: Developing graduate students' abilities to communicate their research across disparate disciplines and experience levels",2008,"ASEE Annual Conference and Exposition, Conference Proceedings",,,,"","",16,,,"https://www.scopus.com/inward/record.uri?eid=2-s2.0-80053887344&partnerID=40&md5=f079b7dec9d5605d70f73f567708da5e",Conference Paper,Scopus,2-s2.0-80053887344
"Liu, E., Patel, H., Sung, H.-J., Kohn, J., Moghe, P.","Combinatorial biomaterials as an engineered niche platform for inhibition of stem cell transformation and promotion of stem cell-based regeneration",2008,"AIChE Annual Meeting, Conference Proceedings",,,,"","",1,,,"https://www.scopus.com/inward/record.uri?eid=2-s2.0-79952291544&partnerID=40&md5=f32ac4eaadfcbc95ea49297f71cf0479",Conference Paper,Scopus,2-s2.0-79952291544
"Treiser, M.D., Yang, E., Androulakis, I.P., Kohn, J., Chen, C.S., Moghe, P.V.","Parsing stem cell behaviors on complex biomaterials via high content imaging and modeling",2008,"AIChE Annual Meeting, Conference Proceedings",,,,"","",1,,,"https://www.scopus.com/inward/record.uri?eid=2-s2.0-79952294339&partnerID=40&md5=1e1873d77824fe90ab5c96edde70de3c",Conference Paper,Scopus,2-s2.0-79952294339
"Sung, H.-J., Chandra, P., Luk, A., Iovine, C., Moghe, P., Kohn., J.","Biomaterial surface chemistry-driven oxidative cellular response",2008,"8th World Biomaterials Congress 2008","2",,,"797","",,,,"https://www.scopus.com/inward/record.uri?eid=2-s2.0-84869009091&partnerID=40&md5=aaeebb25feb48826a77bf553d2b97adb",Conference Paper,Scopus,2-s2.0-84869009091
"Moghe, P.V., Rossi, M.P., Sharma, R., Figueroa, V., Langowski, B., Uhrich, K.","Microscale plasma-permissive patterning of biofunctionalized organic nanoparticles",2008,"8th World Biomaterials Congress 2008","3",,,"1513","",,,,"https://www.scopus.com/inward/record.uri?eid=2-s2.0-84869071701&partnerID=40&md5=b5e8ce7784dde95ca27ed3da66792cee",Conference Paper,Scopus,2-s2.0-84869071701
"Cherry, J.F., Carlson, A., Moore, R.N., Florek, C., Ricupero, C., Mathur, V., Schachner, M., Grumet, M.L., Kohn, J., Moghe, P.V.","Directed differentiation of human embryonic stem cells via 3-D biofunctionalized substrates",2008,"AIChE Annual Meeting, Conference Proceedings",,,,"","",1,,,"https://www.scopus.com/inward/record.uri?eid=2-s2.0-79952305986&partnerID=40&md5=c98da1bdb26b7cf23e7fbf123894ce31",Conference Paper,Scopus,2-s2.0-79952305986
"Johnson, P.A., Luk, A., Demtchouk, A., Patel, H., Gordonov, S., Sheihet, L., Bolikal, D., Kohn, J., Moghe, P.V.","Multifunctional tyrosine-derived polycarbonates: Effect of chemistry on smooth muscle cell adhesion and motility",2008,"AIChE Annual Meeting, Conference Proceedings",,,,"","",1,,,"https://www.scopus.com/inward/record.uri?eid=2-s2.0-79952305802&partnerID=40&md5=a68a389b680e315d32a972e62ff69161",Conference Paper,Scopus,2-s2.0-79952305802
"Sharma, R.I., Shreiber, D.I., Moghe, P.V.","Nanoscale variation of bioadhesive substrates as a tool for engineering of cell matrix assembly",2008,"Tissue Engineering - Part A.","14","7",,"1237","1250",,5,10.1089/ten.tea.2007.0279,"https://www.scopus.com/inward/record.uri?eid=2-s2.0-46449123874&doi=10.1089%2ften.tea.2007.0279&partnerID=40&md5=1209c1700fc1b04a6656aaac32d6b470",Article,Scopus,2-s2.0-46449123874
"Iverson, N., Plourde, N., Chnari, E., Nackman, G.B., Moghe, P.V.","Convergence of nanotechnology and cardiovascular medicine: Progress and emerging prospects",2008,"BioDrugs","22","1",,"1","10",,30,,"https://www.scopus.com/inward/record.uri?eid=2-s2.0-38549178361&partnerID=40&md5=4dc6d58666381bee6f19593f8996771b",Review,Scopus,2-s2.0-38549178361
"Wang, J., Plourde, N.M., Iverson, N., Moghe, P.V., Uhrich, K.E.","Nanoscale amphiphilic macromolecules as lipoprotein inhibitors: The role of charge and architecture",2007,"International Journal of Nanomedicine","2","4",,"697","705",,20,,"https://www.scopus.com/inward/record.uri?eid=2-s2.0-62149083134&partnerID=40&md5=a66124b2de004e65349e5347a336f3a8",Article,Scopus,2-s2.0-62149083134
"Treiser, M.D., Liu, E., Dubin, R.A., Sung, H.-J., Kohn, J., Moghe, P.V.","Profiling cell-biomaterial interactions via cell-based fluororeporter imaging",2007,"BioTechniques","43","3",,"361","368",,17,10.2144/000112533,"https://www.scopus.com/inward/record.uri?eid=2-s2.0-34548704279&doi=10.2144%2f000112533&partnerID=40&md5=23356d55d68774debc865dc5efa956fd",Article,Scopus,2-s2.0-34548704279
"Liu, E., Treiser, M.D., Johnson, P.A., Patel, P., Rege, A., Kohn, J., Moghe, P.V.","Quantitative biorelevant profiling of material microstructure within 3D porous scaffolds via multiphoton fluorescence microscopy",2007,"Journal of Biomedical Materials Research - Part B Applied Biomaterials","82","2",,"284","297",,14,10.1002/jbm.b.30732,"https://www.scopus.com/inward/record.uri?eid=2-s2.0-34547108088&doi=10.1002%2fjbm.b.30732&partnerID=40&md5=b93b2e7677c073d7c2bcbfc092af7e51",Article,Scopus,2-s2.0-34547108088
"Anthony, L.J., Palius, M.F., Maher, C.A., Moghe, P.V.","Using discourse analysis to study a cross-disciplinary learning community: Insights from an IGERT training program",2007,"Journal of Engineering Education","96","2",,"141","156",,10,,"https://www.scopus.com/inward/record.uri?eid=2-s2.0-40749122877&partnerID=40&md5=0f105786f49ac06df7ffd9a27945a0ce",Conference Paper,Scopus,2-s2.0-40749122877
"Pereira, M., Sharma, R.I., Penkala, R., Gentzel, T.A., Schwarzbauer, J.E., Moghe, P.V.","Engineered cell-adhesive nanoparticles nucleate extracellular matrix assembly",2007,"Tissue Engineering","13","3",,"567","578",,9,10.1089/ten.2006.0228,"https://www.scopus.com/inward/record.uri?eid=2-s2.0-34147201089&doi=10.1089%2ften.2006.0228&partnerID=40&md5=935ab0fb25df40ce924336f38afad67f",Article,Scopus,2-s2.0-34147201089
"Moghe, P.V., Roth, C.M.","Multidisciplinary graduate curriculum on integrative biointerfacial engineering",2006,"Chemical Engineering Education","40","4",,"251","258",,1,,"https://www.scopus.com/inward/record.uri?eid=2-s2.0-33751523575&partnerID=40&md5=ea618df1f78e1d6e5f165406a2d4aac4",Article,Scopus,2-s2.0-33751523575
"Bae, Y.H., Johnson, P.A., Florek, C.A., Kohn, J., Moghe, P.V.","Minute changes in composition of polymer substrates produce amplified differences in cell adhesion and motility via optimal ligand conditioning",2006,"Acta Biomaterialia","2","5",,"473","482",,11,10.1016/j.actbio.2006.04.001,"https://www.scopus.com/inward/record.uri?eid=2-s2.0-33746834913&doi=10.1016%2fj.actbio.2006.04.001&partnerID=40&md5=382a4cf54f275f54fd4147c93354fa5a",Article,Scopus,2-s2.0-33746834913
"Semler, E.J., Ranucci, C.S., Moghe, P.V.","Tissue assembly guided via substrate biophysics: Applications to hepatocellular engineering",2006,"Advances in Biochemical Engineering/Biotechnology","102",,,"1","46",,9,10.1007/10_012,"https://www.scopus.com/inward/record.uri?eid=2-s2.0-33750281413&doi=10.1007%2f10_012&partnerID=40&md5=d360bf0fa0281766313947a0df003998",Review,Scopus,2-s2.0-33750281413
"Sharma, R.I., Pereira, M., Schwarzbauer, J.E., Moghe, P.V.","Albumin-derived nanocarriers: Substrates for enhanced cell adhesive ligand display and cell motility",2006,"Biomaterials","27","19",,"3589","3598",,14,10.1016/j.biomaterials.2006.02.007,"https://www.scopus.com/inward/record.uri?eid=2-s2.0-33645881087&doi=10.1016%2fj.biomaterials.2006.02.007&partnerID=40&md5=804e2f4e42d23470ae341cfa0cbc3924",Article,Scopus,2-s2.0-33645881087
"Chnari, E., Nikitczuk, J.S., Wang, J., Uhrich, K.E., Moghe, P.V.","Engineered polymeric nanoparticles for receptor-targeted blockage of oxidized low density lipoprotein uptake and atherogenesis in macrophages",2006,"Biomacromolecules","7","6",,"1796","1805",,31,10.1021/bm0600872,"https://www.scopus.com/inward/record.uri?eid=2-s2.0-33745619265&doi=10.1021%2fbm0600872&partnerID=40&md5=f148ccb62c667f201ca25b4c962d3a2b",Article,Scopus,2-s2.0-33745619265
"Chnari, E., Nikitczuk, J.S., Uhrich, K.E., Moghe, P.V.","Nanoscale anionic macromolecules can inhibit cellular uptake of differentialy oxidized LDL",2006,"Biomacromolecules","7","2",,"597","603",,37,10.1021/bm0506905,"https://www.scopus.com/inward/record.uri?eid=2-s2.0-33644598009&doi=10.1021%2fbm0506905&partnerID=40&md5=7a65f21fc23525ae60d2c6257bdec4b5",Article,Scopus,2-s2.0-33644598009
"Dunn, S.M., Constantinides, A., Moghe, P.V.","Numerical Methods in Biomedical Engineering",2006,"Numerical Methods in Biomedical Engineering",,,,"","",615,11,10.1016/B978-0-12-186031-8.X5000-6,"https://www.scopus.com/inward/record.uri?eid=2-s2.0-85013856670&doi=10.1016%2fB978-0-12-186031-8.X5000-6&partnerID=40&md5=920bff80329512efc958c3ec27be8123",Book,Scopus,2-s2.0-85013856670
"Sharma, R.I., Pereira, M., Schwarzbauer, J.E., Moghe, P.V.","Albumin-derived nanocarriers for the display of extracellular matrix ligands &amp; engineering cell adhesion and motility",2005,"AIChE Annual Meeting, Conference Proceedings",,,,"5188","",,,,"https://www.scopus.com/inward/record.uri?eid=2-s2.0-33645641693&partnerID=40&md5=b65da6f450d2c3b4b386e5d0ba778143",Conference Paper,Scopus,2-s2.0-33645641693
"Johnson, P.A., Bae, Y.H., Dubin, R., Kohn, J., Moghe, P.","Evaluation of the effect of the chemistry of biodegradable polycarbonate polymers containing iodine and peg on cellular responses of vascular cell lines",2005,"AIChE Annual Meeting, Conference Proceedings",,,,"4689","",,,,"https://www.scopus.com/inward/record.uri?eid=2-s2.0-33645637006&partnerID=40&md5=d073b704061cd2ac229ec9364028f230",Conference Paper,Scopus,2-s2.0-33645637006
"Plourde, N.M., Iverson, N., Chnari, E., Wang, J., Urich, K., Moghe, P.","Nanoscale macromolecules for modulating cell-Ldl interactions",2005,"AIChE Annual Meeting, Conference Proceedings",,,,"9217","",,,,"https://www.scopus.com/inward/record.uri?eid=2-s2.0-33645648588&partnerID=40&md5=860e3cc9bb29941e783fc7b026fe363d",Conference Paper,Scopus,2-s2.0-33645648588
"Dasgupta, A., Hughey, R., Lancin, P., Larue, L., Moghe, P.V.","E-cadherin synergistically induces hepatospecific phenotype and maturation of embryonic stem cells in conjunction with hepatotrophic factors",2005,"Biotechnology and Bioengineering","92","3",,"257","266",,26,10.1002/bit.20676,"https://www.scopus.com/inward/record.uri?eid=2-s2.0-27744499693&doi=10.1002%2fbit.20676&partnerID=40&md5=90419f11b0b07d14012b15dcd2e78870",Article,Scopus,2-s2.0-27744499693
"Chnari, E., Lari, H.B., Tian, L., Uhrich, K.E., Moghe, P.V.","Nanoscale anionic macromolecules for selective retention of low-density lipoproteins",2005,"Biomaterials","26","17",,"3749","3758",,33,10.1016/j.biomaterials.2004.09.038,"https://www.scopus.com/inward/record.uri?eid=2-s2.0-11144327477&doi=10.1016%2fj.biomaterials.2004.09.038&partnerID=40&md5=8dba68bb96a9e136606e0ebe5e5c6c27",Article,Scopus,2-s2.0-11144327477
"Semler, E.J., Dasgupta, A., Moghe, P.V.","Cytomimetic engineering of hepatocyte morphogenesis and function by substrate-based presentation of acellular E-cadherin",2005,"Tissue Engineering","11","5-6",,"734","750",,16,10.1089/ten.2005.11.734,"https://www.scopus.com/inward/record.uri?eid=2-s2.0-21844459207&doi=10.1089%2ften.2005.11.734&partnerID=40&md5=e9b9b1cc7b42c9275c2a679e71f91e0e",Article,Scopus,2-s2.0-21844459207
"Semler, E.J., Lancin, P.A., Dasgupta, A., Moghe, P.V.","Engineering hepatocellular morphogenesis and function via ligand-presenting hydrogels with graded mechanical compliance",2005,"Biotechnology and Bioengineering","89","3",,"296","307",,52,10.1002/bit.20328,"https://www.scopus.com/inward/record.uri?eid=2-s2.0-14244265297&doi=10.1002%2fbit.20328&partnerID=40&md5=95c7f876fb6d51959982430186277e1a",Article,Scopus,2-s2.0-14244265297
"Rosenson-Schloss, R.S., Chnari, E., Brieva, T.A., Dang, A., Moghe, P.V.","Glutathione preconditioning attenuates Ac-LDL-induced macrophage apoptosis via protein kinase C-dependent Ac-LDL trafficking",2005,"Experimental Biology and Medicine","230","1",,"40","48",,8,,"https://www.scopus.com/inward/record.uri?eid=2-s2.0-11144300192&partnerID=40&md5=accc2a9fccfd506403305f98d3dd8f30",Article,Scopus,2-s2.0-11144300192
"Sharma, R.I., Pereira, M., Kohn, J., Schwarzbauer, J., Moghe, P.V.","Novel nanoscale biodynamic substrates for engineering cell motility",2004,"Transactions - 7th World Biomaterials Congress",,,,"264","",,,,"https://www.scopus.com/inward/record.uri?eid=2-s2.0-13844298552&partnerID=40&md5=cac7af88e42d1d8ab47a89b133af3f1c",Conference Paper,Scopus,2-s2.0-13844298552
"Sharma, R.I., Kohn, J., Moghe, P.V.","Poly(ethylene glycol) enhances cell motility on protein-based poly(ethylene glycol)-polycarbonate substrates: A mechanism for cell-guided ligand remodeling",2004,"Journal of Biomedical Materials Research - Part A","69","1",,"114","123",,19,,"https://www.scopus.com/inward/record.uri?eid=2-s2.0-1642295037&partnerID=40&md5=9f918894271cd3bfca929ae520604348",Article,Scopus,2-s2.0-1642295037
"Brieva, T.A., Moghe, P.V.","Engineering the Hepatocyte Differentiation-Proliferation Balance by Acellular Cadherin Micropresentation",2004,"Tissue Engineering","10","3-4",,"553","564",,20,10.1089/107632704323061915,"https://www.scopus.com/inward/record.uri?eid=2-s2.0-2342628506&doi=10.1089%2f107632704323061915&partnerID=40&md5=da277f1d3f2baab60063ba345cf080a1",Conference Paper,Scopus,2-s2.0-2342628506
"Brieva, T.A., Moghe, P.V.","Exogenous Cadherin Microdisplay Can Interfere with Endogenous Signaling and Reprogram Gene Expression in Cultured Hepatocytes",2004,"Biotechnology and Bioengineering","85","3",,"283","292",,12,10.1002/bit.10855,"https://www.scopus.com/inward/record.uri?eid=2-s2.0-0842300397&doi=10.1002%2fbit.10855&partnerID=40&md5=c3094b4b67915a564473445be30c9e6d",Article,Scopus,2-s2.0-0842300397
"Chnari, E., Moghe, P.V.","Nanoscale engineering of LDL-retentive substrates",2002,"Annual International Conference of the IEEE Engineering in Medicine and Biology - Proceedings","2",,,"1656","1657",,,,"https://www.scopus.com/inward/record.uri?eid=2-s2.0-0036916047&partnerID=40&md5=d532ca1ea1246f6b4e5a72847f0141d6",Conference Paper,Scopus,2-s2.0-0036916047
"Brieva, T.A., Moghe, P.V.","Hepatocellular engineering via acellular cadherin-derived microinterfaces",2002,"Annual International Conference of the IEEE Engineering in Medicine and Biology - Proceedings","1",,,"778","779",,,,"https://www.scopus.com/inward/record.uri?eid=2-s2.0-0036907837&partnerID=40&md5=ff5064277605501985dff22257fc0818",Conference Paper,Scopus,2-s2.0-0036907837
