Authors,Title,Year,Source title,Volume,Issue,Art. No.,Page start,Page end,Page count,Cited by,DOI,Link,Document Type,Source,EID
"Lee, C.O., Luhmann, J.G., Odstrcil, D., MacNeice, P.J., De Pater, I., Riley, P., Arge, C.N.","The solar wind at 1 AU during the declining phase of solar cycle 23: Comparison of 3D numerical model results with observations",2009,"Solar Physics","254","1",,"155","183",,36,10.1007/s11207-008-9280-y,"https://www.scopus.com/inward/record.uri?eid=2-s2.0-57849119578&doi=10.1007%2fs11207-008-9280-y&partnerID=40&md5=85172f2125c0a2af97c4569c81d138c5",Article,Scopus,2-s2.0-57849119578
"Remuan, A.J., Milam, S.N., Womack, M., Apponi, A.J., Ziurys, L.M., Wyckoff, S., A'hearn, M.F., De Pater, I., Forster, J.R., Friedel, D.N., Palmer, P., Snyder, L.E., Veal, J.M., Woodney, L.M., Wright, M.C.H.","The distribution, excitation, and formation of cometary molecules: Methanol, methyl cyanide, and ethylene glycol",2008,"Astrophysical Journal","689","1",,"613","621",,2,10.1086/592242,"https://www.scopus.com/inward/record.uri?eid=2-s2.0-58149123038&doi=10.1086%2f592242&partnerID=40&md5=8ed52d6658415e4446b3809c55d563aa",Article,Scopus,2-s2.0-58149123038
"Laver, C., de Pater, I.","Spatially resolved SO<inf>2</inf> ice on Io, observed in the near IR",2008,"Icarus","195","2",,"752","757",,9,10.1016/j.icarus.2007.12.023,"https://www.scopus.com/inward/record.uri?eid=2-s2.0-43249083881&doi=10.1016%2fj.icarus.2007.12.023&partnerID=40&md5=53863009b4754c073377ee1ea84c9855",Article,Scopus,2-s2.0-43249083881
"de Pater, I., Showalter, M.R., Macintosh, B.","Keck observations of the 2002-2003 jovian ring plane crossing",2008,"Icarus","195","1",,"348","360",,5,10.1016/j.icarus.2007.11.029,"https://www.scopus.com/inward/record.uri?eid=2-s2.0-42049114476&doi=10.1016%2fj.icarus.2007.11.029&partnerID=40&md5=4d3689d3d05fdc4ef8dc699e74c16437",Article,Scopus,2-s2.0-42049114476
"Showalter, M.R., de Pater, I., Verbanac, G., Hamilton, D.P., Burns, J.A.","Properties and dynamics of Jupiter's gossamer rings from Galileo, Voyager, Hubble and Keck images",2008,"Icarus","195","1",,"361","377",,8,10.1016/j.icarus.2007.12.012,"https://www.scopus.com/inward/record.uri?eid=2-s2.0-42049096762&doi=10.1016%2fj.icarus.2007.12.012&partnerID=40&md5=dafe58b929ded5e262ba77d056f9845a",Article,Scopus,2-s2.0-42049096762
"Sánchez-Lavega, A., Orton, G.S., Hueso, R., García-Melendo, E., Pérez-Hoyos, S., Simon-Miller, A., Rojas, J.F., Gómez, J.M., Yanamandra-Fisher, P., Fletcher, L., Joels, J., Kemerer, J., Hora, J., Karkoschka, E., De Pater, I., Wong, M.H., Marcus, P.S., Pinilla-Alonso, N., Carvalho, F., Go, C., Parker, D., Salway, M., Valimberti, M., Wesley, A., Pujic, Z.","Depth of a strong jovian jet from a planetary-scale disturbance driven by storms (Nature (2008) 451, (437-440))",2008,"Nature","451","7181",,"1022","",,,10.1038/nature06807,"https://www.scopus.com/inward/record.uri?eid=2-s2.0-39749192629&doi=10.1038%2fnature06807&partnerID=40&md5=52b7fb4d07447879aa6e60b193827b79",Erratum,Scopus,2-s2.0-39749192629
"Ádámkovics, M., de Pater, I., Hartung, M., Eisenhauer, F., Genzel, R., Griffith, C.A.","Erratum: ""Titan's bright spots: Multiband spectroscopic measurement of surface diversity and hazes"" (Journal of Geophysical Research (2006) vol. 111 10.1029/2005JE002610)",2008,"Journal of Geophysical Research E: Planets","113","2", E02S90,"","",,,10.1029/2007JE003029,"https://www.scopus.com/inward/record.uri?eid=2-s2.0-42949113522&doi=10.1029%2f2007JE003029&partnerID=40&md5=f2a3b34bab6cf62439caf08bd1594a12",Erratum,Scopus,2-s2.0-42949113522
"Kloosterman, J.L., Butler, B., de Pater, I.","VLA observations of synchrotron radiation at 15 GHz",2008,"Icarus","193","2",,"644","648",,8,10.1016/j.icarus.2007.10.013,"https://www.scopus.com/inward/record.uri?eid=2-s2.0-38949114956&doi=10.1016%2fj.icarus.2007.10.013&partnerID=40&md5=ca41942cdd279b92d391de1396cffdc4",Article,Scopus,2-s2.0-38949114956
"Sánchez-Lavega, A., Orton, G.S., Hueso, R., García-Melendo, E., Pérez-Hoyos, S., Simon-Miller, A., Rojas, J.F., Gómez, J.M., Yanamandra-Fisher, P., Fletcher, L., Joels, J., Kemerer, J., Hora, J., Karkoschka, E., De Pater, I., Wong, M.H., Marcus, P.S., Pinilla-Alonso, N., Carvalho, F., Go, C., Parker, D., Salway, M., Valimberti, M., Wesley, A., Pujic, Z.","Depth of a strong jovian jet from a planetary-scale disturbance driven by storms",2008,"Nature","451","7177",,"437","440",,47,10.1038/nature06533,"https://www.scopus.com/inward/record.uri?eid=2-s2.0-38549086266&doi=10.1038%2fnature06533&partnerID=40&md5=415ede9138a6e6ccdae80173f9bd2423",Article,Scopus,2-s2.0-38549086266
"Zhang, Z.-W., Bianco, F.B., Lehner, M.J., Coehlo, N.K., Wang, J.-H., Mondal, S., Alcock, C., Axelrod, T., Byun, Y.-I., Chen, W.P., Cook, K.H., Dave, R., De Pater, I., Porrata, R., Kim, D.-W., King, S.-K., Lee, T., Lin, H.-C., Lissauer, J.J., Marshall, S.L., Protopapas, P., Rice, J.A., Schwamb, M.E., Wang, S.-Y., Wen, C.-Y.","First results from the Taiwanese-American occultation survey (TAOS)",2008,"Astrophysical Journal","685","2 PART 2",,"L157","L160",,22,10.1086/592741,"https://www.scopus.com/inward/record.uri?eid=2-s2.0-62649142564&doi=10.1086%2f592741&partnerID=40&md5=3044cbcce3f05c921696e348ab555304",Article,Scopus,2-s2.0-62649142564
"Sromovsky, L.A., Fry, P.M., Hammel, H.B., de Pater, I., Rages, K.A., Showalter, M.R.","Dynamics, evolution, and structure of Uranus' brightest cloud feature",2007,"Icarus","192","2",,"558","575",,15,10.1016/j.icarus.2007.05.015,"https://www.scopus.com/inward/record.uri?eid=2-s2.0-36549063399&doi=10.1016%2fj.icarus.2007.05.015&partnerID=40&md5=f0af6fbe09fd4f07e2f0e8e0b0a465ba",Article,Scopus,2-s2.0-36549063399
"de Pater, I., Kurth, W.S.","The Solar System at Radio Wavelengths",2007,"Encyclopedia of the Solar System",,,,"695","718",,1,10.1016/B978-012088589-3/50042-6,"https://www.scopus.com/inward/record.uri?eid=2-s2.0-84882393997&doi=10.1016%2fB978-012088589-3%2f50042-6&partnerID=40&md5=b50507e965a044ed7d460f0bb45ee105",Book Chapter,Scopus,2-s2.0-84882393997
"Dunn, D.E., de Pater, I., Molnar, L.A.","Examining the wake structure in Saturn's rings from microwave observations over varying ring opening angles and wavelengths",2007,"Icarus","192","1",,"56","76",,8,10.1016/j.icarus.2007.06.017,"https://www.scopus.com/inward/record.uri?eid=2-s2.0-36049016123&doi=10.1016%2fj.icarus.2007.06.017&partnerID=40&md5=70b2d803e16dc3a05892fa9a412f17e8",Article,Scopus,2-s2.0-36049016123
"Laver, C., de Pater, I., Marchis, F.","Tvashtar awakening detected in April 2006 with OSIRIS at the W.M. Keck Observatory",2007,"Icarus","191","2",,"749","754",,15,10.1016/j.icarus.2007.06.022,"https://www.scopus.com/inward/record.uri?eid=2-s2.0-35449006599&doi=10.1016%2fj.icarus.2007.06.022&partnerID=40&md5=c60b826c4c05e6505a8c424c61706680",Article,Scopus,2-s2.0-35449006599
"Ádámkovics, M., Wong, M.H., Laver, C., De Pater, I.","Widespread morning drizzle on Titan",2007,"Science","318","5852",,"962","965",,44,10.1126/science.1146244,"https://www.scopus.com/inward/record.uri?eid=2-s2.0-36048954409&doi=10.1126%2fscience.1146244&partnerID=40&md5=f8783e0bd2e5075aaead1f4c50acc30b",Article,Scopus,2-s2.0-36048954409
"de Pater, I., Laver, C., Marchis, F., Roe, H.G., Macintosh, B.A.","Spatially resolved observations of the forbidden SO a1 Δ → X3 Σ- rovibronic transition on Io during an eclipse and a volcanic eruption at Ra Patera",2007,"Icarus","191","1",,"172","182",,9,10.1016/j.icarus.2007.04.011,"https://www.scopus.com/inward/record.uri?eid=2-s2.0-35248838254&doi=10.1016%2fj.icarus.2007.04.011&partnerID=40&md5=1fa65f95d56545b59cb360c3b4439fb5",Article,Scopus,2-s2.0-35248838254
"De Pater, I., Hammel, H.B., Showalter, M.R., Van Dam, M.A.","The dark side of the rings of Uranus",2007,"Science","317","5846",,"1888","1890",,13,10.1126/science.1148103,"https://www.scopus.com/inward/record.uri?eid=2-s2.0-34848878123&doi=10.1126%2fscience.1148103&partnerID=40&md5=ed57a050a82e64b0ae08410842ada181",Article,Scopus,2-s2.0-34848878123
"Laver, C., de Pater, I., Roe, H., Strobel, D.F.","Temporal behavior of the SO 1.707 μm ro-vibronic emission band in Io's atmosphere",2007,"Icarus","189","2",,"401","408",,4,10.1016/j.icarus.2007.02.008,"https://www.scopus.com/inward/record.uri?eid=2-s2.0-34447274752&doi=10.1016%2fj.icarus.2007.02.008&partnerID=40&md5=399688f67ee2c4a171210830ca203f41",Article,Scopus,2-s2.0-34447274752
"Hammel, H.B., Sitko, M.L., Lynch, D.K., Orton, G.S., Russell, R.W., Geballe, T.R., De Pater, I.","Distribution of ethane and methane emission on neptune",2007,"Astronomical Journal","134","2",,"637","641",,16,10.1086/519382,"https://www.scopus.com/inward/record.uri?eid=2-s2.0-34547987673&doi=10.1086%2f519382&partnerID=40&md5=ec7ed64b0fbfd56dc42e742c0b92ac68",Article,Scopus,2-s2.0-34547987673
"Wong, M.H., de Pater, I., Showalter, M.R., Roe, H.G., Macintosh, B., Verbanac, G.","Ground-based near infrared spectroscopy of Jupiter's ring and moons",2006,"Icarus","185","2",,"403","415",,4,10.1016/j.icarus.2006.07.007,"https://www.scopus.com/inward/record.uri?eid=2-s2.0-33751087183&doi=10.1016%2fj.icarus.2006.07.007&partnerID=40&md5=066000422afe4f2e9988d25f67501586",Article,Scopus,2-s2.0-33751087183
"Marchis, F., Kaasalainen, M., Hom, E.F.Y., Berthier, J., Enriquez, J., Hestroffer, D., Le Mignant, D., de Pater, I.","Shape, size and multiplicity of main-belt asteroids. I. Keck Adaptive Optics survey",2006,"Icarus","185","1",,"39","63",,58,10.1016/j.icarus.2006.06.001,"https://www.scopus.com/inward/record.uri?eid=2-s2.0-33749340983&doi=10.1016%2fj.icarus.2006.06.001&partnerID=40&md5=04c02202a9e9d781071427d30141336f",Article,Scopus,2-s2.0-33749340983
"Milam, S.N., Remijan, A.J., Womack, M., Abrell, L., Ziurys, L.M., Wyckoff, S., Apponi, A.J., Friedel, D.N., Snyder, L.E., Veal, J.M., Palmer, P., Woodney, L.M., A'Hearn, M.F., Forster, J.R., Wright, M.C.H., De Pater, I., Choi, S., Gesmundo, M.","Formaldehyde in comets C/1995 O1 (Hale-Bopp), C/2002 T7 (LINEAR), and C/2001 Q4 (NEAT): Investigating the cometary origin of H<inf>2</inf>CO",2006,"Astrophysical Journal","649","2 I",,"1169","1177",,22,10.1086/506501,"https://www.scopus.com/inward/record.uri?eid=2-s2.0-33751530964&doi=10.1086%2f506501&partnerID=40&md5=fd04a2f7a3fb33bc4eee2656a6aeff6d",Article,Scopus,2-s2.0-33751530964
"Lehner, M.J., Alcock, C., Axelrod, T., Bianco, F., Byun, Y.-I., Chen, W.-P., Cook, K.H., Dave, R., De Pater, I., Giammarco, J., King, S.-K., Lee, T., Lissauer, J., Marshall, S.L., Mondal, S., Nihei, T., Rice, J., Schwamb, M., Wang, A., Wang, S.-Y., Wen, C.-Y., Zhang, Z.-W.","TAOS - The taiwanese-American occultation survey",2006,"Astronomische Nachrichten","327","8",,"814","817",,8,10.1002/asna.200610688,"https://www.scopus.com/inward/record.uri?eid=2-s2.0-33748879821&doi=10.1002%2fasna.200610688&partnerID=40&md5=a495d87f2b84123c46a6bd117fdc94b3",Article,Scopus,2-s2.0-33748879821
"Grün, E., de Pater, I., Showalter, M., Spahn, F., Srama, R.","Physics of dusty rings: History and perspective",2006,"Planetary and Space Science","54","9-10",,"837","843",,1,10.1016/j.pss.2006.05.005,"https://www.scopus.com/inward/record.uri?eid=2-s2.0-33746852989&doi=10.1016%2fj.pss.2006.05.005&partnerID=40&md5=1c31ca0ba69397b6387e7925fbb94d42",Editorial,Scopus,2-s2.0-33746852989
"Chen, W.P., Alcock, C., Axelrod, T., Bianco, F.B., Byun, Y.I., Chang, Y.H., Cook, K.H., Dave, R., Giammarco, J., Kim, D.W., King, S.K., Lee, T., Lehner, M., Lin, C.C., Lin, H.C., Lissauer, J.J., Marshall, S., Meinshausen, N., Mondal, S., De Pater, I., Porrata, R., Rice, J., Schwamb, M.E., Wang, A., Wang, S.Y., Wen, C.Y., Zhang, Z.W.","Search for small trans-Neptunian objects by the TAOS project",2006,"Proceedings of the International Astronomical Union","2","S236",,"65","68",,1,10.1017/S1743921307003079,"https://www.scopus.com/inward/record.uri?eid=2-s2.0-37049025969&doi=10.1017%2fS1743921307003079&partnerID=40&md5=c8213272b269292afb6815bffd599bb5",Conference Paper,Scopus,2-s2.0-37049025969
"Ádámkovics, M., de Pater, I., Hartung, M., Eisenhauer, F., Genzel, R., Griffith, C.A.","Titan's bright spots: Multiband spectroscopic measurement of surface diversity and hazes",2006,"Journal of Geophysical Research E: Planets","111","7", E07S06,"","",,15,10.1029/2005JE002610,"https://www.scopus.com/inward/record.uri?eid=2-s2.0-33751087482&doi=10.1029%2f2005JE002610&partnerID=40&md5=f0738c0c26aeb800cbfd7f7aaeba9e28",Article,Scopus,2-s2.0-33751087482
"de Pater, I., Ádámkovics, M., Bouchez, A.H., Brown, M.E., Gibbard, S.G., Marchis, F., Roe, H.G., Schaller, E.L., Young, E.","Titan imagery with Keck adaptive optics during and after probe entry",2006,"Journal of Geophysical Research E: Planets","111","7", E07S05,"","",,16,10.1029/2005JE002620,"https://www.scopus.com/inward/record.uri?eid=2-s2.0-33751077295&doi=10.1029%2f2005JE002620&partnerID=40&md5=de3559b969977e2d858dfc69ba18cc55",Article,Scopus,2-s2.0-33751077295
"Lorenz, R.D., Witasse, O., Lebreton, J.-P., Blancquaert, T., de Pater, I., Mazoue, F., Roe, H., Lemmon, M.T., Burratti, B.J., Holmes, S., Noll, K.","Huygens entry emission: Observation campaign, results, and lessons learned",2006,"Journal of Geophysical Research E: Planets","111","7", E07S11,"","",,4,10.1029/2005JE002603,"https://www.scopus.com/inward/record.uri?eid=2-s2.0-33751094298&doi=10.1029%2f2005JE002603&partnerID=40&md5=af39df58bdef9ccbb060909e180a6b07",Article,Scopus,2-s2.0-33751094298
"Witasse, O., Lebreton, J.-P., Bird, M.K., Dutta-Roy, R., Folkner, W.M., Preston, R.A., Asmar, S.W., Gurvits, L.I., Pogrebenko, S.V., Avruch, I.M., Campbell, R.M., Bignall, H.E., Garrett, M.A., van Langevelde, H.J., Parsley, S.M., Reynolds, C., Szomoru, A., Reynolds, J.E., Phillips, C.J., Sault, R.J., Tzioumis, A.K., Ghigo, F., Langston, G., Brisken, W., Romney, J.D., Mujunen, A., Ritakari, J., Tingay, S.J., Dodson, R.G., van't Klooster, C.G.M., Blancquaert, T., Coustenis, A., Gendron, E., Sicardy, B., Hirtzig, M., Luz, D., Negrao, A., Kostiuk, T., Livengood, T.A., Hartung, M., de Pater, I., Ádámkovics, M., Lorenz, R.D., Roe, H., Schaller, E., Brown, M., Bouchez, A.H., Trujillo, C.A., Buratti, B.J., Caillaut, L., Magin, T., Bourdon, A., Laux, C.","Overview of the coordinated ground-based observations of Titan during the Huygens mission",2006,"Journal of Geophysical Research E: Planets","111","7", E07S01,"","",,17,10.1029/2005JE002640,"https://www.scopus.com/inward/record.uri?eid=2-s2.0-33751086154&doi=10.1029%2f2005JE002640&partnerID=40&md5=33d43acb07ada2f3ddc35b66ee57487b",Review,Scopus,2-s2.0-33751086154
"Remijan, A.J., Friedel, D.N., De Pater, I., Hogerheijde, M.R., Snyder, L.E., A'Hearn, M.F., Blake, G.A., Dickel, H.R., Forster, J.R., Kraybill, C., Looney, L.W., Palmer, P., Wright, M.C.H.","A BIMA array survey of molecules in comets linear (C/2002 T7) and NEAT (C/2001 Q4)",2006,"Astrophysical Journal","643","1 I",,"567","572",,20,10.1086/502713,"https://www.scopus.com/inward/record.uri?eid=2-s2.0-33745836107&doi=10.1086%2f502713&partnerID=40&md5=88432706b08153dc957d1c3202560a65",Article,Scopus,2-s2.0-33745836107
"De Pater, I., Hammel, H.B., Gibbard, S.G., Showalter, M.R.","New dust belts of Uranus: One ring, two ring, red ring, blue ring",2006,"Science","312","5770",,"92","94",,20,10.1126/science.1125110,"https://www.scopus.com/inward/record.uri?eid=2-s2.0-33645679772&doi=10.1126%2fscience.1125110&partnerID=40&md5=f67a49afc9386384c259d61ac6d40b2c",Article,Scopus,2-s2.0-33645679772
"Marchis, F., Hestroffer, D., Descamps, P., Berthier, J., Bouchez, A.H., Campbell, R.D., Chin, J.C.Y., Van Dam, M.A., Hartman, S.K., Johansson, E.M., Lafon, R.E., Le Mignant, D., De Pater, I., Stomski, P.J., Summers, D.M., Vachier, F., Wizinovich, P.L., Wong, M.H.","A low density of 0.8 g cm-3 for the Trojan binary asteroid 617 Patroclus",2006,"Nature","439","7076",,"565","567",,71,10.1038/nature04350,"https://www.scopus.com/inward/record.uri?eid=2-s2.0-31844455442&doi=10.1038%2fnature04350&partnerID=40&md5=27151ac18bc9c1e6667cf6c0a964c17d",Article,Scopus,2-s2.0-31844455442
"de Pater, I., Gibbard, S.G., Hammel, H.B.","Evolution of the dusty rings of Uranus",2006,"Icarus","180","1",,"186","200",,22,10.1016/j.icarus.2005.08.011,"https://www.scopus.com/inward/record.uri?eid=2-s2.0-28844448894&doi=10.1016%2fj.icarus.2005.08.011&partnerID=40&md5=4db0c68b5523d40817b76ea3d77623dd",Article,Scopus,2-s2.0-28844448894
"King, S.-K., Alcock, C., Axelrod, T., Bianco, F.B., Byun, Y.I., Chen, W.-P., Cook, K.H., Chang, Y.-H., Dave, R., Giammarco, J., Lee, T., Lehner, M., Lissauer, J., Marshall, S., Mondal, S., De Pater, I., Porrata, R., Rice, J., Schwamb, M.E., Wang, A., Wang, S.-Y., Wen, C.-Y., Zhang, Z.-W.","Status of the taos project and a simulator for tno occultation",2006,"Advances in Geosciences: Volume 3: Planetary Science (PS)",,,,"357","358",,,10.1142/9789812707192_0032,"https://www.scopus.com/inward/record.uri?eid=2-s2.0-84970983982&doi=10.1142%2f9789812707192_0032&partnerID=40&md5=99e4819801c38208c36886f9d8961809",Book Chapter,Scopus,2-s2.0-84970983982
"Kloosterman, J.L., Dunn, D.E., De Pater, I.","Jupiter's synchrotron radiation mapped with the very large array from 1981 to 1998",2005,"Astrophysical Journal, Supplement Series","161","2",,"520","550",,4,10.1086/491601,"https://www.scopus.com/inward/record.uri?eid=2-s2.0-31144449780&doi=10.1086%2f491601&partnerID=40&md5=618104cbc8c6a20c4a449fc9696b4234",Article,Scopus,2-s2.0-31144449780
"Marchis, F., Hestroffer, D., Descamps, P., Berthier, J., Laver, C., de Pater, I.","Mass and density of Asteroid 121 Hermione from an analysis of its companion orbit",2005,"Icarus","178","2",,"450","464",,28,10.1016/j.icarus.2005.05.003,"https://www.scopus.com/inward/record.uri?eid=2-s2.0-27644442377&doi=10.1016%2fj.icarus.2005.05.003&partnerID=40&md5=047271891042accb25bd8b369f9c7ce4",Article,Scopus,2-s2.0-27644442377
"Zellner, N.E.B., Gibbard, S., de Pater, I., Marchis, F., Gaffey, M.J.","Near-IR imaging of Asteroid 4 Vesta",2005,"Icarus","177","1",,"190","195",,14,10.1016/j.icarus.2005.03.024,"https://www.scopus.com/inward/record.uri?eid=2-s2.0-23744444470&doi=10.1016%2fj.icarus.2005.03.024&partnerID=40&md5=6cd705cb8f5ab338f330856728c207d3",Article,Scopus,2-s2.0-23744444470
"Friedel, D.N., Remijan, A.J., Snyder, L.E., A'Hearn, M.F., Blake, G.A., De Pater, I., Dickel, H.R., Forster, J.R., Hogerheude, M.R., Kraybill, C., Looney, L.W., Palmer, P., Wright, M.C.H.","BIMA array detections of HCN in comets linear (C/2002 T7) and NEAT (C/2001 Q4)",2005,"Astrophysical Journal","630","1 I",,"623","630",,13,10.1086/432107,"https://www.scopus.com/inward/record.uri?eid=2-s2.0-26844499150&doi=10.1086%2f432107&partnerID=40&md5=2dc72c3eba146d22ea6ebea8e705ecbb",Article,Scopus,2-s2.0-26844499150
"Marchis, F., Le Mignant, D., Chaffee, F.H., Davies, A.G., Kwok, S.H., Prangé, R., de Pater, I., Amico, P., Campbell, R., Fusco, T., Goodrich, R.W., Conrad, A.","Keck AO survey of Io global volcanic activity between 2 and 5 μm",2005,"Icarus","176","1",,"96","122",,48,10.1016/j.icarus.2004.12.014,"https://www.scopus.com/inward/record.uri?eid=2-s2.0-18844418239&doi=10.1016%2fj.icarus.2004.12.014&partnerID=40&md5=c3b4f9a68b5c9ba55edda366c789a562",Article,Scopus,2-s2.0-18844418239
"Hammel, H.B., de Pater, I., Gibbard, S., Lockwood, G.W., Rages, K.","Uranus in 2003: Zonal winds, banded structure, and discrete features",2005,"Icarus","175","2",,"534","545",,34,10.1016/j.icarus.2004.11.012,"https://www.scopus.com/inward/record.uri?eid=2-s2.0-17044379986&doi=10.1016%2fj.icarus.2004.11.012&partnerID=40&md5=10081b242fc893cb1de1a1b7f33f0c7e",Article,Scopus,2-s2.0-17044379986
"Hammel, H.B., de Pater, I., Gibbard, S.G., Lockwood, G.W., Rages, K.","New cloud activity on Uranus in 2004: First detection of a southern feature at 2.2 μm",2005,"Icarus","175","1",,"284","288",,16,10.1016/j.icarus.2004.11.016,"https://www.scopus.com/inward/record.uri?eid=2-s2.0-17044366518&doi=10.1016%2fj.icarus.2004.11.016&partnerID=40&md5=d4b4d2e173cdc4c7d5ba826895d4e7a7",Article,Scopus,2-s2.0-17044366518
"Showman, A.P., de Pater, I.","Dynamical implications of Jupiter's tropospheric ammonia abundance",2005,"Icarus","174","1",,"192","204",,25,10.1016/j.icarus.2004.10.004,"https://www.scopus.com/inward/record.uri?eid=2-s2.0-14844334545&doi=10.1016%2fj.icarus.2004.10.004&partnerID=40&md5=d7881a90372811587c84fefecddf95d4",Article,Scopus,2-s2.0-14844334545
"Verbanac, G., de Pater, I., Showalter, M.R., Lissauer, J.J.","Keck infrared observations of Saturn's main rings bracketing earth's August 1995 ring plane crossing",2005,"Icarus","174","1",,"241","252",,2,10.1016/j.icarus.2004.10.008,"https://www.scopus.com/inward/record.uri?eid=2-s2.0-14844307593&doi=10.1016%2fj.icarus.2004.10.008&partnerID=40&md5=facaef31d0a4222b1d416d2ab6f7b057",Article,Scopus,2-s2.0-14844307593
"Gibbard, S.G., de Pater, I., Hammel, H.B.","Near-infrared adaptive optics imaging of the satellites and individual rings of Uranus",2005,"Icarus","174","1",,"253","262",,15,10.1016/j.icarus.2004.09.008,"https://www.scopus.com/inward/record.uri?eid=2-s2.0-14844296962&doi=10.1016%2fj.icarus.2004.09.008&partnerID=40&md5=65340a74029dffa2d1b0b1b9aac24747",Article,Scopus,2-s2.0-14844296962
"de Pater, I., Gibbard, S.G., Chiang, E., Hammel, H.B., Macintosh, B., Marchis, F., Martin, S.C., Roe, H.G., Showalter, M.","The dynamic neptunian ring arcs: Evidence for a gradual disappearance of Liberté and resonant jump of courage",2005,"Icarus","174","1",,"263","272",,22,10.1016/j.icarus.2004.10.020,"https://www.scopus.com/inward/record.uri?eid=2-s2.0-14844283115&doi=10.1016%2fj.icarus.2004.10.020&partnerID=40&md5=eee5d134caf2c021f6dd3fb11a3863b5",Article,Scopus,2-s2.0-14844283115
"Gibson, J., Welch, W.J., de Pater, I.","Accurate jovian radio flux density measurements show ammonia to be subsaturated in the upper troposphere",2005,"Icarus","173","2",,"439","446",,14,10.1016/j.icarus.2004.06.020,"https://www.scopus.com/inward/record.uri?eid=2-s2.0-14044257180&doi=10.1016%2fj.icarus.2004.06.020&partnerID=40&md5=6fed9026a795093fdbc414e5845a225d",Article,Scopus,2-s2.0-14044257180
"de Pater, I., DeBoer, D., Marley, M., Freedman, R., Young, R.","Retrieval of water in Jupiter's deep atmosphere using microwave spectra of its brightness temperature",2005,"Icarus","173","2",,"425","438",,21,10.1016/j.icarus.2004.06.019,"https://www.scopus.com/inward/record.uri?eid=2-s2.0-14044252812&doi=10.1016%2fj.icarus.2004.06.019&partnerID=40&md5=8a80e54116d7d448be7ab3538e7303e2",Article,Scopus,2-s2.0-14044252812
"Dunn, D.E., De Pater, I., Wright, M., Hogerheijde, M.R., Molnar, L.A.","High-quality BIMA-OVRO images of saturn and its rings at 1.3 and 3 millimeters",2005,"Astronomical Journal","129","2",,"1109","1116",,8,10.1086/424536,"https://www.scopus.com/inward/record.uri?eid=2-s2.0-15244360559&doi=10.1086%2f424536&partnerID=40&md5=b80c1a888d2cd4072734ee2670216803",Article,Scopus,2-s2.0-15244360559
"De Pater, I.","LOFAR and Jupiter's radio (synchrotron) emissions",2004,"Planetary and Space Science","52","15",,"1449","1454",,7,10.1016/j.pss.2004.09.012,"https://www.scopus.com/inward/record.uri?eid=2-s2.0-9944235713&doi=10.1016%2fj.pss.2004.09.012&partnerID=40&md5=6146c095e8b7c26d7aefd0c67b8eb00f",Article,Scopus,2-s2.0-9944235713
"de Pater, I., Martin, S.C., Showalter, M.R.","Keck near-infrared observations of Saturn's E and G rings during Earth's ring plane crossing in August 1995",2004,"Icarus","172","2",,"446","454",,31,10.1016/j.icarus.2004.07.012,"https://www.scopus.com/inward/record.uri?eid=2-s2.0-11144308936&doi=10.1016%2fj.icarus.2004.07.012&partnerID=40&md5=8cdd2a8e935f42dc5adfd499a149118d",Article,Scopus,2-s2.0-11144308936
"Butler, B.J., Campbell, D.B., de Pater, I., Gary, D.E.","Solar system science with SKA",2004,"New Astronomy Reviews","48","11-12",,"1511","1535",,5,10.1016/j.newar.2004.09.031,"https://www.scopus.com/inward/record.uri?eid=2-s2.0-10644228440&doi=10.1016%2fj.newar.2004.09.031&partnerID=40&md5=ea3235d875ad5446ca80e47e252ee7e3",Article,Scopus,2-s2.0-10644228440
"De Pater, I., Ádámkovics, M., Gibbard, S., Roe, H.G., Griffith, C.A.","Flight through Titan's atmosphere",2004,"European Space Agency, (Special Publication) ESA SP",,"1278",,"313","321",,1,,"https://www.scopus.com/inward/record.uri?eid=2-s2.0-23844482858&partnerID=40&md5=15df9f4833c3c98114c96d72d92bc6a9",Conference Paper,Scopus,2-s2.0-23844482858
"Marchis, F., Berthier, J., Descamps, P., Hestroffer, D., Vachier, F., Laver, C., De Pater, I., Gavel, D.","Studying binary asteroids with NGS and LGS AO systems",2004,"Proceedings of SPIE - The International Society for Optical Engineering","5490","PART 1", 47,"338","350",,4,10.1117/12.550624,"https://www.scopus.com/inward/record.uri?eid=2-s2.0-11144287170&doi=10.1117%2f12.550624&partnerID=40&md5=435d3a5fbd455054cdb4aa2584c79201",Conference Paper,Scopus,2-s2.0-11144287170
"Pitman, J., Duncan, A., Stubbs, D., Sigler, R., Kendrick, R., Smith, E., Mason, J., Delory, G., Lipps, J.H., Manga, M., Graham, J., De Pater, I., Reiboldt, S., Marcus, P., Bierhaus, E., Dalton, J.B., Fienup, J., Yu, J.","Multiple Instrument Distributed Aperture Sensor (MIDAS) for planetary remote sensing",2004,"Proceedings of SPIE - The International Society for Optical Engineering","5660",, 26,"168","180",,4,10.1117/12.578430,"https://www.scopus.com/inward/record.uri?eid=2-s2.0-20344406814&doi=10.1117%2f12.578430&partnerID=40&md5=ada5cc6275eb921eff3c7b9570f0fc05",Conference Paper,Scopus,2-s2.0-20344406814
"Pitman, J., Duncan, A., Stubbs, D., Sigler, R., Kendrick, R., Smith, E., Mason, J., Delory, G., Lipps, J.H., Manga, M., Graham, J., De Pater, I., Reiboldt, S., Bierhaus, E., Dalton, J.B., Fienup, J., Yu, J.","Multiple Instrument Distributed Aperture Sensor (MIDAS) for remote sensing",2004,"Proceedings of SPIE - The International Society for Optical Engineering","5570",, 26,"218","227",,,10.1117/12.565710,"https://www.scopus.com/inward/record.uri?eid=2-s2.0-20144389730&doi=10.1117%2f12.565710&partnerID=40&md5=587ccf59e0b118a0c67c80ea1569ff9c",Conference Paper,Scopus,2-s2.0-20144389730
