Authors,Title,Year,Source title,Volume,Issue,Art. No.,Page start,Page end,Page count,Cited by,DOI,Link,Document Type,Source,EID
"Pitman, J., Duncan, A., Stubbs, D., Sigler, R., Kendrick, R., Smith, E., Mason, J., Delory, G., Lipps, J.H., Manga, M., Graham, J., De Pater, I., Reiboldt, S., Bierhaus, E., Dalton, J.B., Fienup, J., Yu, J.","Remote sensing space science enabled by the Multiple Instrument Distributed Aperture Sensor (MIDAS) concept",2004,"Proceedings of SPIE - The International Society for Optical Engineering","5555",, 31,"301","311",,8,10.1117/12.560290,"https://www.scopus.com/inward/record.uri?eid=2-s2.0-20144384853&doi=10.1117%2f12.560290&partnerID=40&md5=303ee499823a66addc259104a3078beb",Conference Paper,Scopus,2-s2.0-20144384853
"de Pater, I.","Introduction to special section: Titan: Pre-Cassini view",2004,"Geophysical Research Letters","31","17",,"L17S01 1","4",,1,10.1029/2004GL020742,"https://www.scopus.com/inward/record.uri?eid=2-s2.0-9744223534&doi=10.1029%2f2004GL020742&partnerID=40&md5=cd3f86865e1b257eccf4034c005a9786",Article,Scopus,2-s2.0-9744223534
"Perron, J.T., de Pater, I.","Dynamics of an ice continent on Titan",2004,"Geophysical Research Letters","31","17",,"L17S04 1","5",,9,10.1029/2004GL019802,"https://www.scopus.com/inward/record.uri?eid=2-s2.0-9744226362&doi=10.1029%2f2004GL019802&partnerID=40&md5=05498c6dd12b191f844917e1f47e8d18",Article,Scopus,2-s2.0-9744226362
"Ádámkovics, M., de Pater, I., Roe, H.G., Gibbard, S.G., Griffith, C.A.","Spatially-resolved spectroscopy at 1.6 μm of titan's atmosphere and surface",2004,"Geophysical Research Letters","31","17",,"L17S05 1","4",,13,10.1029/2004GL019929,"https://www.scopus.com/inward/record.uri?eid=2-s2.0-9744240172&doi=10.1029%2f2004GL019929&partnerID=40&md5=10ec1585c7b2e61f3d3ee5cb2171acef",Article,Scopus,2-s2.0-9744240172
"Gibbard, S.G., de Pater, I., Macintosh, B.A., Roe, H.G., Max, C.E., Young, E.F., McKay, C.P.","Titan's 2 μm surface albedo and haze optical depth in 1996-2004",2004,"Geophysical Research Letters","31","17",,"L17S02 1","4",,20,10.1029/2004GL019803,"https://www.scopus.com/inward/record.uri?eid=2-s2.0-2942628799&doi=10.1029%2f2004GL019803&partnerID=40&md5=ec7e4518757f151ae5fb01300e763f8b",Article,Scopus,2-s2.0-2942628799
"Roe, H.G., de Pater, I., Gibbard, S.G., Macintosh, B.A., Max, C.E., Young, E.F., Brown, M.E., Bouchez, A.H.","A new 1.6-micron map of Titan's surface",2004,"Geophysical Research Letters","31","17",,"L17S03 1","4",,14,10.1029/2004GL019871,"https://www.scopus.com/inward/record.uri?eid=2-s2.0-9744277446&doi=10.1029%2f2004GL019871&partnerID=40&md5=422a1b59d1fd72e2a67b0ab2d2481b75",Article,Scopus,2-s2.0-9744277446
"Dunn, D.E., Molnar, L.A., Niehof, J.T., de Pater, I., Lissauer, J.J.","Microwave observations of Saturn's rings: Anisotropy in directly transmitted and scattered saturnian thermal emission",2004,"Icarus","171","1",,"183","198",,18,10.1016/j.icarus.2004.04.008,"https://www.scopus.com/inward/record.uri?eid=2-s2.0-4344650321&doi=10.1016%2fj.icarus.2004.04.008&partnerID=40&md5=793c4206e76e19c71684af8bd182e6fa",Article,Scopus,2-s2.0-4344650321
"Roe, H.G., de Pater, I., McKay, C.P.","Seasonal variation of Titan's stratospheric ethylene (C<inf>2</inf>H<inf>4</inf>) observed",2004,"Icarus","169","2",,"440","461",,36,10.1016/j.icarus.2004.01.002,"https://www.scopus.com/inward/record.uri?eid=2-s2.0-2942619998&doi=10.1016%2fj.icarus.2004.01.002&partnerID=40&md5=7f024f6e41fceed2626d7574d4a462cf",Article,Scopus,2-s2.0-2942619998
"Gibbard, S.G., Macintosh, B., Gavel, D., Max, C.E., de Pater, I., Roe, H.G., Ghez, A.M., Young, E.F., McKay, C.P.","Speckle imaging of Titan at 2 microns: Surface albedo, haze optical depth, and tropospheric clouds 1996-1998",2004,"Icarus","169","2",,"429","439",,32,10.1016/j.icarus.2003.12.026,"https://www.scopus.com/inward/record.uri?eid=2-s2.0-2942597461&doi=10.1016%2fj.icarus.2003.12.026&partnerID=40&md5=2c3bb365b1a4beac12ead6725702f2f7",Article,Scopus,2-s2.0-2942597461
"de Pater, I., Marchis, F., Macintosh, B.A., Roe, H.G., Le Mignant, D., Graham, J.R., Davies, A.G.","Keck AO observations of Io in and out of eclipse",2004,"Icarus","169","1",,"250","263",,40,10.1016/j.icarus.2003.08.025,"https://www.scopus.com/inward/record.uri?eid=2-s2.0-2442651280&doi=10.1016%2fj.icarus.2003.08.025&partnerID=40&md5=c51ec5eef111de9f59ed68bf6450d18d",Article,Scopus,2-s2.0-2442651280
"Liang, C.-L., Rice, J.A., De Pater, I., Alcock, C., Axelrod, T., Wang, A., Marshall, S.","Statistical methods for detecting stellar occultations by Kuiper belt objects: The Taiwanese-American occultation survey",2004,"Statistical Science","19","2",,"265","274",,13,10.1214/088342304000000378,"https://www.scopus.com/inward/record.uri?eid=2-s2.0-14544294364&doi=10.1214%2f088342304000000378&partnerID=40&md5=4978f6961cc186b4fe3bf10ce62d6b75",Review,Scopus,2-s2.0-14544294364
"Sault, R.J., Engel, C., de Pater, I.","Longitude-resolved imaging of Jupiter at λ = 2 cm",2004,"Icarus","168","2",,"336","343",,15,10.1016/j.icarus.2003.11.014,"https://www.scopus.com/inward/record.uri?eid=2-s2.0-1842832793&doi=10.1016%2fj.icarus.2003.11.014&partnerID=40&md5=75c97fe0a2d0e07a855124d09430c6ec",Article,Scopus,2-s2.0-1842832793
"Hogerheijde, M.R., De Pater, I., Wright, M., Forster, J.R., Snyder, L.E., Remijan, A., Woodney, L.M., A'Hearn, M.F., Palmer, P., Kuan, Y.-J., Huang, H.-C., Blake, G.A., Qi, C., Kessler, J., Liu, S.-Y.","Combined BIMA and OVRO observations of comet C/1999 S4 (LINEAR)",2004,"Astronomical Journal","127","4 1780",,"2406","2412",,3,10.1086/382710,"https://www.scopus.com/inward/record.uri?eid=2-s2.0-17544385962&doi=10.1086%2f382710&partnerID=40&md5=d7176329f3591ae3cdc20764b5367340",Article,Scopus,2-s2.0-17544385962
"Bower, G.C., Plambeck, R.L., Bolatto, A., McCrady, N., Graham, J.R., De Pater, I., Liu, M.C., Baganoff, F.K.","A giant outburst at millimeter wavelengths in the Orion nebula",2003,"Astrophysical Journal","598","2 I",,"1140","1150",,46,10.1086/379101,"https://www.scopus.com/inward/record.uri?eid=2-s2.0-0347594416&doi=10.1086%2f379101&partnerID=40&md5=73c53389a8d39c1f7688e94a2198f420",Article,Scopus,2-s2.0-0347594416
"Chen, W.P., Zhang, Z.W., King, S.K., Alcock, C., Byun, Y.I., Cook, K.H., Dave, R., Giammarco, J., Lee, T., Lehner, M., Liang, C., Lissauer, J., Marshall, S., De Pater, I., Porrata, R., Rice, J., Wang, A., Wang, S.Y., Wen, C.Y.","Fast CCD photometry in the Taiwan-America occultation survey",2003,"Baltic Astronomy","12","4",,"568","573",,5,,"https://www.scopus.com/inward/record.uri?eid=2-s2.0-27244456784&partnerID=40&md5=3be223983d0147828c0fa0ef0a663762",Article,Scopus,2-s2.0-27244456784
"Renno, N.O., Wong, A.-S., Atreya, S.K., de Pater, I., Roos-Serote, M.","Electrical discharges and broadband radio emission by Martian dust devils and dust storms",2003,"Geophysical Research Letters","30","22",,"PLA 1","1 - PLA 1-4",,24,,"https://www.scopus.com/inward/record.uri?eid=2-s2.0-0942299883&partnerID=40&md5=6fdfc9ca63261ee8f5bfc4f773565d29",Article,Scopus,2-s2.0-0942299883
"Dunn, D.E., de Pater, I., Sault, R.J.","Search for secular changes in the 3D profile of the synchrotron radiation around Jupiter",2003,"Icarus","165","1",,"121","136",,8,10.1016/S0019-1035(03)00193-3,"https://www.scopus.com/inward/record.uri?eid=2-s2.0-0038246137&doi=10.1016%2fS0019-1035%2803%2900193-3&partnerID=40&md5=5d31c8fc1f7bbbcad5e7507474c0fdc0",Article,Scopus,2-s2.0-0038246137
"Marchis, F., Descamps, P., Hestroffer, D., Berthier, J., Vachier, F., Boccaletti, A., de Pater, I., Gavel, D.","A three-dimensional solution for the orbit of the asteroidal satellite of 22 Kalliope",2003,"Icarus","165","1",,"112","120",,28,10.1016/S0019-1035(03)00195-7,"https://www.scopus.com/inward/record.uri?eid=2-s2.0-1542530917&doi=10.1016%2fS0019-1035%2803%2900195-7&partnerID=40&md5=769b675d97bdd7c68cd7d19499f27639",Article,Scopus,2-s2.0-1542530917
"Macintosh, B.A., Gavel, D., Gibbard, S.G., Max, C.E., Eckart, M., de Pater, I., Ghez, A.M., Spencer, J.","Speckle imaging of volcanic hotspots on Io with the Keck telescope",2003,"Icarus","165","1",,"137","143",,22,10.1016/S0019-1035(03)00168-4,"https://www.scopus.com/inward/record.uri?eid=2-s2.0-1542741070&doi=10.1016%2fS0019-1035%2803%2900168-4&partnerID=40&md5=5427ef8e0b44fb6e6b348b1bb9016791",Article,Scopus,2-s2.0-1542741070
"de Pater, I., Dunn, D.E.","VLA observations of Jupiter's synchrotron radiation at 15 and 22 GHz",2003,"Icarus","163","2",,"449","455",,22,10.1016/S0019-1035(03)00068-X,"https://www.scopus.com/inward/record.uri?eid=2-s2.0-0038600658&doi=10.1016%2fS0019-1035%2803%2900068-X&partnerID=40&md5=66d5be9a6fa918c687d4f529a61a1fb0",Article,Scopus,2-s2.0-0038600658
"de Pater, I., Butler, B.J.","Low-frequency VLA observations of Jupiter",2003,"Icarus","163","2",,"428","433",,7,10.1016/S0019-1035(03)00066-6,"https://www.scopus.com/inward/record.uri?eid=2-s2.0-0037924400&doi=10.1016%2fS0019-1035%2803%2900066-6&partnerID=40&md5=0bbf1aefb1f6666cc18498f5f7431804",Article,Scopus,2-s2.0-0037924400
"de Pater, I., Butler, B.J., Green, D.A., Strom, R., Millan, R., Klein, M.J., Bird, M.K., Funke, O., Neidhöfer, J., Maddalena, R., Sault, R.J., Kesteven, M., Smits, D.P., Hunstead, R.","Jupiter's radio spectrum from 74 MHz up to 8 GHz",2003,"Icarus","163","2",,"434","448",,29,10.1016/S0019-1035(03)00067-8,"https://www.scopus.com/inward/record.uri?eid=2-s2.0-0037924399&doi=10.1016%2fS0019-1035%2803%2900067-8&partnerID=40&md5=e4b3e00110ef2943e3e01a7159e25a3b",Review,Scopus,2-s2.0-0037924399
"Alcock, C., Dave, R., Giammarco, J., Goldader, J., Lehner, M., King, S.-K., Lee, T., Wang, A., Wang, S.-Y., Wen, C.-Y., Chen, W.P., Cook, K., Marshall, S., Porrata, R., Byun, Y.-I, De Pater, I., Rice, J., Lissauer, J., Porrata, R., Byun, Y.-I., De Pater, I., Rice, J., Lissauer, J.","TAOS: The Taiwanese-American Occultation Survey",2003,"Earth, Moon and Planets","92","1-4",,"459","464",,14,10.1023/B:MOON.0000031960.82021.26,"https://www.scopus.com/inward/record.uri?eid=2-s2.0-3242777621&doi=10.1023%2fB%3aMOON.0000031960.82021.26&partnerID=40&md5=a0d8b5fc282cbe72d390b9beae66cce5",Article,Scopus,2-s2.0-3242777621
"Max, C.E., Macintosh, B.A., Gibbard, S.G., Gavel, D.T., Roe, H.G., De Pater, I., Ghez, A.M., Acton, D.S., Lai, O., Stomski, P., Wizinowich, P.L.","Cloud structures on neptune observed with keck telescope adaptive optics",2003,"Astronomical Journal","125","1 1765",,"364","375",,17,10.1086/344943,"https://www.scopus.com/inward/record.uri?eid=2-s2.0-0042260643&doi=10.1086%2f344943&partnerID=40&md5=d4b1d8c7c45b33cf00ad7c38ac07ed12",Article,Scopus,2-s2.0-0042260643
"Roe, H.G., De Pater, I., Macintosh, B.A., McKay, C.P.","Titan's clouds from Gemini and Keck adaptive optics imaging",2002,"Astrophysical Journal","581","2 I",,"1399","1406",,97,10.1086/344403,"https://www.scopus.com/inward/record.uri?eid=2-s2.0-0038189330&doi=10.1086%2f344403&partnerID=40&md5=7b54025a86ff351849be744796073822",Article,Scopus,2-s2.0-0038189330
"De Pater, I., Gibbard, S.G., Macintosh, B.A., Roe, H.G., Gavel, D.T., Max, C.E.","Keck adaptive optics images of Uranus and its rings",2002,"Icarus","160","2",,"359","374",,20,10.1006/icar.2002.6966,"https://www.scopus.com/inward/record.uri?eid=2-s2.0-0036948510&doi=10.1006%2ficar.2002.6966&partnerID=40&md5=f1eef9812de7475857c3e172669a4711",Article,Scopus,2-s2.0-0036948510
"De Pater, I., Marchis, F., Macintosh, B., Roe, H.G., Le Mignant, D., Graham, J.R.","Keck AO observations of Io in and out of eclipse",2002,"Proceedings of SPIE - The International Society for Optical Engineering","4834",,,"139","149",,2,10.1117/12.457096,"https://www.scopus.com/inward/record.uri?eid=2-s2.0-0038736812&doi=10.1117%2f12.457096&partnerID=40&md5=71cd44e6310954e0f5ba9c10e841d347",Conference Paper,Scopus,2-s2.0-0038736812
"Le Mignant, D., Marchis, F., Kwok, S., Amico, P., Campbell, R., Chaffee, F., Conrad, A., Contos, A., Goodrich, R., Hill, G., Sprayberry, D., Stomski, P.J., Wizinowich, P., De Pater, I.","Io, the movie",2002,"Proceedings of SPIE - The International Society for Optical Engineering","4834",,,"319","328",,4,10.1117/12.457108,"https://www.scopus.com/inward/record.uri?eid=2-s2.0-0038274159&doi=10.1117%2f12.457108&partnerID=40&md5=0754d95d64c9f154aad01464548af335",Conference Paper,Scopus,2-s2.0-0038274159
"Marchis, F., de Pater, I., Davies, A.G., Roe, H.G., Fusco, T., Le Mignant, D., Descamps, P., Macintosh, B.A., Prangé, R.","High-resolution keck adaptive optics imaging of violent volcanic activity on lo",2002,"Icarus","160","1",,"124","131",,52,10.1006/icar.2002.6955,"https://www.scopus.com/inward/record.uri?eid=2-s2.0-0036854814&doi=10.1006%2ficar.2002.6955&partnerID=40&md5=9a69a361039071f698c6768bede6d92c",Article,Scopus,2-s2.0-0036854814
"Marchis, F., Descamps, P., Hestroffer, D., Berthier, J., De Pater, I., Gavel, D.","Adaptive optics observations of the binary system (22) Kalliope: A three dimensional orbit solution",2002,"European Space Agency, (Special Publication) ESA SP",,"500",,"725","728",,1,,"https://www.scopus.com/inward/record.uri?eid=2-s2.0-0036664492&partnerID=40&md5=cfe2e4bcf90ee8f157fab1ea3c79647f",Conference Paper,Scopus,2-s2.0-0036664492
"Woodney, L.M., A'Hearn, M.F., Schleicher, D.G., Farnham, T.L., McMullin, J.P., Wright, M.C.H., Veal, J.M., Snyder, L.E., De Pater, I., Forster, J.R., Palmer, P., Kuan, Y.-J., Williams, W.R., Cheung, C.C., Smith, B.R.","Morphology of HCN and CN in Comet Hale-Bopp (1995 O1)",2002,"Icarus","157","1",,"193","204",,32,10.1006/icar.2001.6798,"https://www.scopus.com/inward/record.uri?eid=2-s2.0-0036083890&doi=10.1006%2ficar.2001.6798&partnerID=40&md5=77802674686de80ed85741b062024f65",Article,Scopus,2-s2.0-0036083890
"De Pater, I., Roe, H., Graham, J.R., Strobel, D.F., Bernath, P.","Detection of the forbidden so a1 Δ ₒ X3Σ− rovibronic transition on lo at 1.7 μm",2002,"Icarus","156","1",,"296","301",,19,10.1006/icar.2001.6787,"https://www.scopus.com/inward/record.uri?eid=2-s2.0-0036261669&doi=10.1006%2ficar.2001.6787&partnerID=40&md5=f14b43478e60bd4426a2e403d6332994",Article,Scopus,2-s2.0-0036261669
"Roe, H.G., De Pater, I., Macintosh, B.A., Gibbard, S.G., Max, C.E., McKay, C.P.","Titan's atmosphere in late Southern Spring observed with adaptive optics on the W.M. Keck II 10-meter telescope",2002,"Icarus","157","1", 96831,"254","258",,32,10.1006/icar.2002.6831,"https://www.scopus.com/inward/record.uri?eid=2-s2.0-0036083971&doi=10.1006%2ficar.2002.6831&partnerID=40&md5=69da0b2486bf160cb94a769a74954195",Article,Scopus,2-s2.0-0036083971
"Gibbard, S.G., Roe, H., De Pater, I., Macintosh, B., Gavel, D., Max, C.E., Baines, K.H., Ghez, A.","High-resolution infrared imaging of neptune from the Keck telescope",2002,"Icarus","156","1", 96766,"1","15",,8,10.1006/icar.2001.6766,"https://www.scopus.com/inward/record.uri?eid=2-s2.0-0036264766&doi=10.1006%2ficar.2001.6766&partnerID=40&md5=8b9c90ef6ebad199b874b61d193b1cfa",Article,Scopus,2-s2.0-0036264766
"Burger, M.H., Schneider, N.M., De Pater, I., Brown, M.E., Bouchez, A.H., Trafton, L.M., Sheffer, Y., Barker, E.S., Mallama, A.","Mutual event observations of Io's sodium corona",2001,"Astrophysical Journal","563","2 PART 1",,"1063","1074",,3,10.1086/323944,"https://www.scopus.com/inward/record.uri?eid=2-s2.0-0035924292&doi=10.1086%2f323944&partnerID=40&md5=0eb2f872d54ca581e8f11663f9230148",Article,Scopus,2-s2.0-0035924292
"Hammel, H.B., Rages, K., Lockwood, G.W., Karkoschka, E., De Pater, I.","New Measurements of the winds of Uranus",2001,"Icarus","153","2",,"229","235",,33,10.1006/icar.2001.6689,"https://www.scopus.com/inward/record.uri?eid=2-s2.0-0035198042&doi=10.1006%2ficar.2001.6689&partnerID=40&md5=c542f440961dc2821ca14f3b37c49fd0",Article,Scopus,2-s2.0-0035198042
"Roe, H.G., Gavel, D., Max, C., De Pater, I., Gibbard, S., Macintosh, B., Baines, K.H.","Near-infrared observations of Neptune's tropospheric cloud layer with the Lick Observatory adaptive optics system",2001,"Astronomical Journal","122","3",,"1636","1643",,8,10.1086/322125,"https://www.scopus.com/inward/record.uri?eid=2-s2.0-0041768445&doi=10.1086%2f322125&partnerID=40&md5=4a1cc75d2d68a8df28ebdeef2aaf7de6",Article,Scopus,2-s2.0-0041768445
"Roe, H.G., Graham, J.R., Mclean, I.S., De Pater, I., Becklin, E.E., Figer, D.F., Gilbert, A.M., Larkin, J.E., Levenson, N.A., Teplitz, H.I., Wilcox, M.K.","The altitude of an infrared-bright cloud feature on Neptune from near-infrared spectroscopy",2001,"Astronomical Journal","122","2",,"1023","1029",,6,10.1086/321157,"https://www.scopus.com/inward/record.uri?eid=2-s2.0-18044370840&doi=10.1086%2f321157&partnerID=40&md5=66f9326efd0e2041d9e411a4bc3855d7",Article,Scopus,2-s2.0-18044370840
"De Pater, I., Brecht, S.H.","SL9 Impacts and Simulations of Enhanced Radial Diffusion",2001,"Icarus","151","1",,"39","50",,7,10.1006/icar.2001.6602,"https://www.scopus.com/inward/record.uri?eid=2-s2.0-0038584740&doi=10.1006%2ficar.2001.6602&partnerID=40&md5=0eb10cb6a093c1fe775a614d9bcf188a",Article,Scopus,2-s2.0-0038584740
"De Pater, I., Brecht, S.H.","SL9 Impacts: VLA High-Resolution Observations at λ=20 cm",2001,"Icarus","151","1",,"1","24",,9,10.1006/icar.2001.6600,"https://www.scopus.com/inward/record.uri?eid=2-s2.0-0041849750&doi=10.1006%2ficar.2001.6600&partnerID=40&md5=f0f5ffa7d847d148b27438055d1718a9",Article,Scopus,2-s2.0-0041849750
"Snyder, L.E., Veal, J.M., Woodney, L.M., Wright, M.C.H., Palmer, P., A'Hearn, M.F., Kuan, Y.-J., De Pater, I., Forster, J.R.","Bima array photodissociation measurements of HCN and CS in comet Hale-Bopp (C/1995 O1)",2001,"Astronomical Journal","121","2",,"1147","1154",,19,10.1086/318756,"https://www.scopus.com/inward/record.uri?eid=2-s2.0-0039298069&doi=10.1086%2f318756&partnerID=40&md5=452d6a1fab24b363f1cc78a3a39f5616",Article,Scopus,2-s2.0-0039298069
"De Pater, I., Dunn, D., Romani, P., Zahnle, K.","Reconciling Galileo Probe Data and Ground-Based Radio Observations of Ammonia on Jupiter",2001,"Icarus","149","1",,"66","78",,48,10.1006/icar.2000.6527,"https://www.scopus.com/inward/record.uri?eid=2-s2.0-0002297743&doi=10.1006%2ficar.2000.6527&partnerID=40&md5=c2351b137a90f821b9d194bca1ef4c99",Article,Scopus,2-s2.0-0002297743
"Brecht, S.H., De Pater, I., Larson, D.J., Pesses, M.E.","Modification of the Jovian Radiation Belts by Shoemaker-Levy 9: An Explanation of the Data",2001,"Icarus","151","1",,"25","38",,9,10.1006/icar.2001.6601,"https://www.scopus.com/inward/record.uri?eid=2-s2.0-0041849751&doi=10.1006%2ficar.2001.6601&partnerID=40&md5=1f47f55197bd3f76b083a3543818b1dd",Article,Scopus,2-s2.0-0041849751
"Veal, J.M., Snyder, L.E., Wright, M., Woodney, L.M., Palmer, P., Forster, J.R., De Pater, I., A'Hearn, M.F., Kuan, Y.-J.","An interferometric study of HCN in comet Hale-Bopp (C/1995 O1)",2000,"Astronomical Journal","119","3",,"1498","1511",,21,,"https://www.scopus.com/inward/record.uri?eid=2-s2.0-0040184012&partnerID=40&md5=c333ce68d853097fe6630568d54c2a2c",Article,Scopus,2-s2.0-0040184012
"Max, C.E., Macintosh, B.A., Gibbard, S., Gavel, D.T., Roe, H., de Pater, I., Ghez, A.M., Acton, S., Wizinowich, P.L., Keck, W.M., Lai, O.","Neptune and Titan observed with Keck Telescope adaptive optics",2000,"Proceedings of SPIE - The International Society for Optical Engineering","4007",,,"II/","",,3,,"https://www.scopus.com/inward/record.uri?eid=2-s2.0-0033725447&partnerID=40&md5=abed5d733ca53eeeccff046e616c8dad",Conference Paper,Scopus,2-s2.0-0033725447
"Atreya, S.K., Wong, M.H., Owen, T.C., Mahaffy, P.R., Niemann, H.B., De Pater, I., Drossart, P., Encrenaz, Th.","A comparison of the atmospheres of Jupiter and Saturn: Deep atmospheric composition, cloud structure, vertical mixing, and origin",1999,"Planetary and Space Science","47","10-11",,"1243","1262",,136,,"https://www.scopus.com/inward/record.uri?eid=2-s2.0-0033206095&partnerID=40&md5=d11a7d37e2c526330284193fb7306900",Review,Scopus,2-s2.0-0033206095
"Owen, T., Mahaffy, P., Niemann, H.B., Atroya, S., Donahue, T., Bar-Nun, A., De Pater, I.","A low-temperature origin for the planetesimals that formed Jupiter",1999,"Nature","402","6759",,"269","270",,155,10.1038/46232,"https://www.scopus.com/inward/record.uri?eid=2-s2.0-0033581846&doi=10.1038%2f46232&partnerID=40&md5=b370b53638a1830954ae1c8af93f1137",Article,Scopus,2-s2.0-0033581846
"Van Der Tak, F., De Pater, I., Silva, A., Millan, R.","Time Variability in the Radio Brightness Distribution of Saturn",1999,"Icarus","142","1",,"125","147",,19,10.1006/icar.1999.6194,"https://www.scopus.com/inward/record.uri?eid=2-s2.0-0001471396&doi=10.1006%2ficar.1999.6194&partnerID=40&md5=dcf18e7e97478a6de830fb87f0056687",Article,Scopus,2-s2.0-0001471396
"Gibbard, S.G., Levy, E.H., Lunine, J.I., De Pater, I.","Lightning on Neptune",1999,"Icarus","139","2",,"227","234",,10,10.1006/icar.1999.6101,"https://www.scopus.com/inward/record.uri?eid=2-s2.0-0009591906&doi=10.1006%2ficar.1999.6101&partnerID=40&md5=b7c8cbe64cc7cbd28071082534dbbfbf",Article,Scopus,2-s2.0-0009591906
"Gibbard, S.G., MacIntosh, B., Gavel, D., Max, C.E., De Pater, I., Ghez, A.M., Young, E.F., McKay, C.P.","Titan: High-Resolution Speckle Images from the Keck Telescope",1999,"Icarus","139","2",,"189","201",,69,10.1006/icar.1999.6095,"https://www.scopus.com/inward/record.uri?eid=2-s2.0-0001699372&doi=10.1006%2ficar.1999.6095&partnerID=40&md5=56b400467d9572015137873dc2412603",Article,Scopus,2-s2.0-0001699372
"Burns, J.A., Showalter, M.R., Hamilton, D.P., Nicholson, P.D., De Pater, I., Ockert-Bell, M.E., Thomas, P.C.","The formation of Jupiter's faint rings",1999,"Science","284","5417",,"1146","1150",,71,10.1126/science.284.5417.1146,"https://www.scopus.com/inward/record.uri?eid=2-s2.0-0033553654&doi=10.1126%2fscience.284.5417.1146&partnerID=40&md5=c19d3c831f3592e57adf8f7b857d88c5",Article,Scopus,2-s2.0-0033553654
"De Pater, I., Showalter, M.R., Burns, J.A., Nicholson, P.D., Liu, M.C., Hamilton, D.P., Graham, J.R.","Keck Infrared Observations of Jupiter's Ring System near Earth's 1997 Ring Plane Crossing",1999,"Icarus","138","2",,"214","223",,32,10.1006/icar.1998.6068,"https://www.scopus.com/inward/record.uri?eid=2-s2.0-0001664003&doi=10.1006%2ficar.1998.6068&partnerID=40&md5=0196e65863b2426f660c66fe45111692",Article,Scopus,2-s2.0-0001664003
"De Pater, I., Sault, R.J.","An intercomparison of three-dimensional reconstruction techniques using data and models of Jupiter's synchrotron radiation",1998,"Journal of Geophysical Research E: Planets","103","3339",,"19973","19984",,10,,"https://www.scopus.com/inward/record.uri?eid=2-s2.0-0032581843&partnerID=40&md5=d24693951d15179143b576ba1bc7aa2f",Article,Scopus,2-s2.0-0032581843
"Silva, A.V.R., Lin, R.P., De Pater, I., White, S.M., Shibasaki, K., Nakajima, H.","Images of gradual millimeter emission and multi-wavelength observations of the 17 August 1994 solar flare",1998,"Solar Physics","183","2",,"389","405",,1,,"https://www.scopus.com/inward/record.uri?eid=2-s2.0-0032259715&partnerID=40&md5=979ddea3c6997de4514a531e7419bc86",Article,Scopus,2-s2.0-0032259715
"Wright, M.C.H., De Pater, I., Forster, J.R., Palmer, P., Snyder, L.E., Veal, J.M., A'Hearn, M.F., Woodney, L.M., Jackson, W.M., Kuan, Y.-J., Lovell, A.J.","Mosaicked images and spectra of J = 1 → 0 HCN and HCO + emission from comet Hale-Bopp (1995 O1)",1998,"Astronomical Journal","116","6",,"3018","3028",,28,,"https://www.scopus.com/inward/record.uri?eid=2-s2.0-0012745394&partnerID=40&md5=04b7aa21605a6d60418f084b42afb499",Article,Scopus,2-s2.0-0012745394
"De Pater, I., Forster, J.R., Wright, M., Butler, B.J., Palmer, P., Veal, J.M., A'Hearn, M.F., Snyder, L.E.","BIMA and VLA observations of comet Hale-Bopp at 22-115 GHz",1998,"Astronomical Journal","116","2",,"987","996",,16,,"https://www.scopus.com/inward/record.uri?eid=2-s2.0-0009972693&partnerID=40&md5=1d090e232ea4098f2d03d32d2a746ef2",Article,Scopus,2-s2.0-0009972693
"Millan, R., Smits, D., De Pater, I.","Observations of Jupiter at 3.5 cm and 6.0 cm Associated with the Impact of Comet P/Shoemaker-Levy 9",1998,"Icarus","133","2",,"184","191",,7,10.1006/icar.1998.5936,"https://www.scopus.com/inward/record.uri?eid=2-s2.0-0038246136&doi=10.1006%2ficar.1998.5936&partnerID=40&md5=7b15496ce4478434f28c785780146ccb",Article,Scopus,2-s2.0-0038246136
"Sukumar, S., De Pater, I., Strom, R.G.","Effects on Jupiter's Synchrotron Radio Emission at λ90 cm Due to the Infall of Comet D/Shoemaker-Levy 9",1998,"Icarus","131","2",,"358","371",,6,10.1006/icar.1997.5869,"https://www.scopus.com/inward/record.uri?eid=2-s2.0-0038246128&doi=10.1006%2ficar.1997.5869&partnerID=40&md5=1866eaf3b368fe71989e70ff0a84a0b7",Article,Scopus,2-s2.0-0038246128
"De Pater, I., Schulz, M., Brecht, S.H.","Synchrotron evidence for Amalthea's influence on Jupiter's electron radiation belt",1997,"Journal of Geophysical Research A: Space Physics","102","A10", 97JA00311,"22043","22064",,40,,"https://www.scopus.com/inward/record.uri?eid=2-s2.0-37149018416&partnerID=40&md5=5e591a72d456e1e58360f293829c7662",Article,Scopus,2-s2.0-37149018416
"Funke, O., Bird, M.K., Neidhöfer, J., De Pater, I.","Effelsberg observations of the evolution of Jupiter's radio brightness during and after the impacts of comet Shoemaker - Levy 9",1997,"Planetary and Space Science","45","10",,"1177","1181",,9,,"https://www.scopus.com/inward/record.uri?eid=2-s2.0-0037570448&partnerID=40&md5=d9dcc41dc50b4456558c7ede98e0a491",Article,Scopus,2-s2.0-0037570448
"Silva, A.V.R., Gary, D.E., White, S.M., Lin, R.P., De Pater, I.","First images of impulsive millimeter emission and spectral analysis of the 1994 August 18 solar flare",1997,"Solar Physics","175","1",,"157","173",,14,,"https://www.scopus.com/inward/record.uri?eid=2-s2.0-0031524480&partnerID=40&md5=c849fbd1cdf4c56e836b83b3d9804724",Article,Scopus,2-s2.0-0031524480
