Authors,Title,Year,Source title,Volume,Issue,Art. No.,Page start,Page end,Page count,Cited by,DOI,Link,Document Type,Source,EID
"Arridge, C.S., Agnor, C.B., André, N., Baines, K.H., Fletcher, L.N., Gautier, D., Hofstadter, M.D., Jones, G.H., Lamy, L., Langevin, Y., Mousis, O., Nettelmann, N., Russell, C.T., Stallard, T., Tiscareno, M.S., Tobie, G., Bacon, A., Chaloner, C., Guest, M., Kemble, S., Peacocke, L., Achilleos, N., Andert, T.P., Banfield, D., Barabash, S., Barthelemy, M., Bertucci, C., Brandt, P., Cecconi, B., Chakrabarti, S., Cheng, A.F., Christensen, U., Christou, A., Coates, A.J., Collinson, G., Cooper, J.F., Courtin, R., Dougherty, M.K., Ebert, R.W., Entradas, M., Fazakerley, A.N., Fortney, J.J., Galand, M., Gustin, J., Hedman, M., Helled, R., Henri, P., Hess, S., Holme, R., Karatekin, O., Krupp, N., Leisner, J., Martin-Torres, J., Masters, A., Melin, H., Miller, S., Müller-Wodarg, I., Noyelles, B., Paranicas, C., de Pater, I., Pätzold, M., Prangé, R., Quémerais, E., Roussos, E., Rymer, A.M., Sánchez-Lavega, A., Saur, J., Sayanagi, K.M., Schenk, P., Schubert, G., Sergis, N., Sohl, F., Sittler Jr., E.C., Teanby, N.A., Tellmann, S., Turtle, E.P., Vinatier, S., Wahlund, J.-E., Zarka, P.","Uranus Pathfinder: Exploring the origins and evolution of Ice Giant planets",2012,"Experimental Astronomy","33","2-3",,"753","791",,22,10.1007/s10686-011-9251-4,"https://www.scopus.com/inward/record.uri?eid=2-s2.0-84860219661&doi=10.1007%2fs10686-011-9251-4&partnerID=40&md5=d09e378874f4affd7cb6db477f2d1be0",Article,Scopus,2-s2.0-84860219661
"Orton, G.S., Fletcher, L.N., Liu, J., Schneider, T., Yanamandra-Fisher, P.A., De Pater, I., Edwards, M., Geballe, T.R., Hammel, H.B., Fujiyoshi, T., Encrenaz, T., Pantin, E., Mousis, O., Fuse, T.","Recovery and characterization of Neptunes near-polar stratospheric hot spot",2012,"Planetary and Space Science","61","1",,"161","167",,7,10.1016/j.pss.2011.06.013,"https://www.scopus.com/inward/record.uri?eid=2-s2.0-84856231280&doi=10.1016%2fj.pss.2011.06.013&partnerID=40&md5=a862101b868f723212f25ee7fd4528be",Conference Paper,Scopus,2-s2.0-84856231280
"Martin, S.C., de Pater, I., Marcus, P.","Neptune's zonal winds from near-IR Keck adaptive optics imaging in August 2001",2012,"Astrophysics and Space Science","337","1",,"65","78",,10,10.1007/s10509-011-0847-y,"https://www.scopus.com/inward/record.uri?eid=2-s2.0-84855689546&doi=10.1007%2fs10509-011-0847-y&partnerID=40&md5=92efaf2ff4757d33eb399f495054d1af",Article,Scopus,2-s2.0-84855689546
"Anderson, M.M., Siemion, A.P.V., Barott, W.C., Bower, G.C., Delory, G.T., De Pater, I., Werthimer, D.","The Allen telescope array search for electrostatic discharges on mars",2012,"Astrophysical Journal","744","1", 15,"","",,5,10.1088/0004-637X/744/1/15,"https://www.scopus.com/inward/record.uri?eid=2-s2.0-83755186070&doi=10.1088%2f0004-637X%2f744%2f1%2f15&partnerID=40&md5=466916c8ce55af450393c01c4dfe8fa4",Article,Scopus,2-s2.0-83755186070
"Wong, M.H., de Pater, I., Asay-Davis, X., Marcus, P.S., Go, C.Y.","Vertical structure of Jupiter's Oval BA before and after it reddened: What changed?",2011,"Icarus","215","1",,"211","225",,14,10.1016/j.icarus.2011.06.032,"https://www.scopus.com/inward/record.uri?eid=2-s2.0-80052021275&doi=10.1016%2fj.icarus.2011.06.032&partnerID=40&md5=5db8265b59a58f72266e542fe1cd04c4",Article,Scopus,2-s2.0-80052021275
"De Pater, I., Sromovsky, L.A., Hammel, H.B., Fry, P.M., LeBeau, R.P., Rages, K., Showalter, M., Matthews, K.","Post-equinox observations of Uranus: Berg's evolution, vertical structure, and track towards the equator",2011,"Icarus","215","1",,"332","345",,12,10.1016/j.icarus.2011.06.022,"https://www.scopus.com/inward/record.uri?eid=2-s2.0-80052035924&doi=10.1016%2fj.icarus.2011.06.022&partnerID=40&md5=c0aaad0d141963dbe212f8f54ebf424e",Article,Scopus,2-s2.0-80052035924
"Sánchez-Lavega, A., Orton, G.S., Hueso, R., Pérez-Hoyos, S., Fletcher, L.N., García-Melendo, E., Gomez-Forrellad, J.M., de Pater, I., Wong, M., Hammel, H.B., Yanamandra-Fisher, P., Simon-Miller, A., Barrado-Izagirre, N., Marchis, F., Mousis, O., Ortiz, J.L., García-Rojas, J., Cecconi, M., Clarke, J.T., Noll, K., Pedraz, S., Wesley, A., Kalas, P., McConnell, N., Golisch, W., Griep, D., Sears, P., Volquardsen, E., Reddy, V., Shara, M., Binzel, R., Grundy, W., Emery, J., Rivkin, A., Thomas, C., Trilling, D., Bjorkman, K., Burgasser, A.J., Campins, H., Sato, T.M., Kasaba, Y., Ziffer, J., Mirzoyan, R., Fitzgerald, M., Bouy, H.","Long-term evolution of the aerosol debris cloud produced by the 2009 impact on Jupiter",2011,"Icarus","214","2",,"462","476",,5,10.1016/j.icarus.2011.03.015,"https://www.scopus.com/inward/record.uri?eid=2-s2.0-80051471161&doi=10.1016%2fj.icarus.2011.03.015&partnerID=40&md5=fc0a5cd8700038543b35130054de46ff",Article,Scopus,2-s2.0-80051471161
"De Pater, I., Wong, M.H., de Kleer, K., Hammel, H.B., Ádámkovics, M., Conrad, A.","Keck adaptive optics images of Jupiter's north polar cap and Northern Red Oval",2011,"Icarus","213","2",,"559","563",,8,10.1016/j.icarus.2011.03.006,"https://www.scopus.com/inward/record.uri?eid=2-s2.0-79956194883&doi=10.1016%2fj.icarus.2011.03.006&partnerID=40&md5=87eae9891b325b528a2fbd1653adce02",Article,Scopus,2-s2.0-79956194883
"Fletcher, L.N., Orton, G.S., Rogers, J.H., Simon-Miller, A.A., de Pater, I., Wong, M.H., Mousis, O., Irwin, P.G.J., Jacquesson, M., Yanamandra-Fisher, P.A.","Jovian temperature and cloud variability during the 2009-2010 fade of the South Equatorial Belt",2011,"Icarus","213","2",,"564","580",,20,10.1016/j.icarus.2011.03.007,"https://www.scopus.com/inward/record.uri?eid=2-s2.0-79956216440&doi=10.1016%2fj.icarus.2011.03.007&partnerID=40&md5=89823e61a3063be3a92a87aa3076f76b",Article,Scopus,2-s2.0-79956216440
"Lee, C.O., Luhmann, J.G., Hoeksema, J.T., Sun, X., Arge, C.N., de Pater, I.","Coronal Field Opens at Lower Height During the Solar Cycles 22 and 23 Minimum Periods: IMF Comparison Suggests the Source Surface Should Be Lowered",2011,"Solar Physics","269","2",,"367","388",,34,10.1007/s11207-010-9699-9,"https://www.scopus.com/inward/record.uri?eid=2-s2.0-79952699726&doi=10.1007%2fs11207-010-9699-9&partnerID=40&md5=195ec567e4cc283775506f58a980f438",Article,Scopus,2-s2.0-79952699726
"Asay-Davis, X.S., Marcus, P.S., Wong, M.H., de Pater, I.","Changes in Jupiter's zonal velocity between 1979 and 2008",2011,"Icarus","211","2",,"1215","1232",,19,10.1016/j.icarus.2010.11.018,"https://www.scopus.com/inward/record.uri?eid=2-s2.0-79151472481&doi=10.1016%2fj.icarus.2010.11.018&partnerID=40&md5=e4a7602e0b40b88edff0afdc65595619",Article,Scopus,2-s2.0-79151472481
"Descamps, P., Marchis, F., Berthier, J., Emery, J.P., Duchêne, G., de Pater, I., Wong, M.H., Lim, L., Hammel, H.B., Vachier, F., Wiggins, P., Teng-Chuen-Yu, J.-P., Peyrot, A., Pollock, J., Assafin, M., Vieira-Martins, R., Camargo, J.I.B., Braga-Ribas, F., Macomber, B.","Triplicity and physical characteristics of Asteroid (216) Kleopatra",2011,"Icarus","211","2",,"1022","1033",,61,10.1016/j.icarus.2010.11.016,"https://www.scopus.com/inward/record.uri?eid=2-s2.0-79151485433&doi=10.1016%2fj.icarus.2010.11.016&partnerID=40&md5=7c99c77895fd4d311b142524522c147e",Article,Scopus,2-s2.0-79151485433
"Fletcher, L.N., Orton, G.S., de Pater, I., Edwards, M.L., Yanamandra-Fisher, P.A., Hammel, H.B., Lisse, C.M., Fisher, B.M.","The aftermath of the July 2009 impact on Jupiter: Ammonia, temperatures and particulates from Gemini thermal infrared spectroscopy",2011,"Icarus","211","1",,"568","586",,13,10.1016/j.icarus.2010.09.012,"https://www.scopus.com/inward/record.uri?eid=2-s2.0-78650934339&doi=10.1016%2fj.icarus.2010.09.012&partnerID=40&md5=e98a8891584ba2a71ed05467b0bbd599",Article,Scopus,2-s2.0-78650934339
"Orton, G.S., Fletcher, L.N., Lisse, C.M., Chodas, P.W., Cheng, A., Yanamandra-Fisher, P.A., Baines, K.H., Fisher, B.M., Wesley, A., Perez-Hoyos, S., De Pater, I., Hammel, H.B., Edwards, M.L., Ingersoll, A.P., Mousis, O., Marchis, F., Golisch, W., Sanchez-Lavega, A., Simon-Miller, A.A., Hueso, R., Momary, T.W., Greene, Z., Reshetnikov, N., Otto, E., Villar, G., Lai, S., Wong, M.H.","The atmospheric influence, size and possible asteroidal nature of the July 2009 Jupiter impactor",2011,"Icarus","211","1",,"587","602",,19,10.1016/j.icarus.2010.10.010,"https://www.scopus.com/inward/record.uri?eid=2-s2.0-78650940505&doi=10.1016%2fj.icarus.2010.10.010&partnerID=40&md5=cb5c9e8dea443578dc3a33cd48016e50",Article,Scopus,2-s2.0-78650940505
"McEnulty, T.R., Luhmann, J.G., De Pater, I., Brain, D.A., Fedorov, A., Zhang, T.L., Dubinin, E.","Interplanetary coronal mass ejection influence on high energy pick-up ions at Venus",2010,"Planetary and Space Science","58","14-15",,"1784","1791",,16,10.1016/j.pss.2010.07.019,"https://www.scopus.com/inward/record.uri?eid=2-s2.0-78449279597&doi=10.1016%2fj.pss.2010.07.019&partnerID=40&md5=0aa4a3b737abcabcf7849daea3804f98",Article,Scopus,2-s2.0-78449279597
"de Pater, I., Wong, M.H., Marcus, P., Luszcz-Cook, S., Ádámkovics, M., Conrad, A., Asay-Davis, X., Go, C.","Persistent rings in and around Jupiter's anticyclones - Observations and theory",2010,"Icarus","210","2",,"742","762",,30,10.1016/j.icarus.2010.07.027,"https://www.scopus.com/inward/record.uri?eid=2-s2.0-78049528206&doi=10.1016%2fj.icarus.2010.07.027&partnerID=40&md5=c458fd6277ce782c094e0aee3ae8ad76",Article,Scopus,2-s2.0-78049528206
"de Pater, I., Fletcher, L.N., Pérez-Hoyos, S., Hammel, H.B., Orton, G.S., Wong, M.H., Luszcz-Cook, S., Sánchez-Lavega, A., Boslough, M.","A multi-wavelength study of the 2009 impact on Jupiter: Comparison of high resolution images from Gemini, Keck and HST",2010,"Icarus","210","2",,"722","741",,22,10.1016/j.icarus.2010.07.010,"https://www.scopus.com/inward/record.uri?eid=2-s2.0-78049528957&doi=10.1016%2fj.icarus.2010.07.010&partnerID=40&md5=d4a276117f4761c8e450bc1b521d5062",Article,Scopus,2-s2.0-78049528957
"Marchis, F., Lainey, V., Descamps, P., Berthier, J., Van Dam, M., de Pater, I., Macomber, B., Baek, M., Le Mignant, D., Hammel, H.B., Showalter, M., Vachier, F.","A dynamical solution of the triple asteroid system (45) Eugenia",2010,"Icarus","210","2",,"635","643",,23,10.1016/j.icarus.2010.08.005,"https://www.scopus.com/inward/record.uri?eid=2-s2.0-78049527139&doi=10.1016%2fj.icarus.2010.08.005&partnerID=40&md5=833dde2281945e135a6d2165dfef542e",Article,Scopus,2-s2.0-78049527139
"Fletcher, L.N., Orton, G.S., De Pater, I., Mousis, O.","Jupiter's stratospheric hydrocarbons and temperatures after the July 2009 impact from VLT infrared spectroscopy",2010,"Astronomy and Astrophysics","524","2", A46,"","",,10,10.1051/0004-6361/201015464,"https://www.scopus.com/inward/record.uri?eid=2-s2.0-78649379287&doi=10.1051%2f0004-6361%2f201015464&partnerID=40&md5=e7ea96dca925d6956e4eb894f3470e0d",Article,Scopus,2-s2.0-78649379287
"Delory, G.T., Laver, C., De Pater, I., Pitman, J., Duncan, A.","High resolution remote sensing observations for missions to the Jovian system: Io as a case study",2010,"Planetary and Space Science","58","13",,"1699","1707",,2,10.1016/j.pss.2010.08.007,"https://www.scopus.com/inward/record.uri?eid=2-s2.0-77957960321&doi=10.1016%2fj.pss.2010.08.007&partnerID=40&md5=bc87ae74a5f3cd47b3180897df24ab5f",Conference Paper,Scopus,2-s2.0-77957960321
"Hueso, R., Wesley, A., Go, C., Pérez-Hoyos, S., Wong, M.H., Fletcher, L.N., Sánchez-Lavega, A., Boslough, M.B.E., De Pater, I., Orton, G.S., Simon-Miller, A.A., Djorgovski, S.G., Edwards, M.L., Hammel, H.B., Clarke, J.T., Noll, K.S., Yanamandra-Fisher, P.A.","First Earth-based detection of a superbolide on Jupiter",2010,"Astrophysical Journal Letters","721","2 PART 2",,"L129","L133",,16,10.1088/2041-8205/721/2/L129,"https://www.scopus.com/inward/record.uri?eid=2-s2.0-78649278853&doi=10.1088%2f2041-8205%2f721%2f2%2fL129&partnerID=40&md5=508c76a935e3d4dbbafc81f520b82d48",Article,Scopus,2-s2.0-78649278853
"Luszcz-Cook, S.H., de Pater, I., Ádámkovics, M., Hammel, H.B.","Seeing double at Neptune's south pole",2010,"Icarus","208","2",,"938","944",,13,10.1016/j.icarus.2010.03.007,"https://www.scopus.com/inward/record.uri?eid=2-s2.0-77954620806&doi=10.1016%2fj.icarus.2010.03.007&partnerID=40&md5=cb7d0c6bd26d6513b5397ff119b04b00",Article,Scopus,2-s2.0-77954620806
"Dunn, D.E., de Pater, I., Stam, D.","Modeling the uranian rings at 2.2μm: Comparison with Keck AO data from July 2004",2010,"Icarus","208","2",,"927","937",,3,10.1016/j.icarus.2010.03.027,"https://www.scopus.com/inward/record.uri?eid=2-s2.0-77954659834&doi=10.1016%2fj.icarus.2010.03.027&partnerID=40&md5=508cc35c239b72c372826547f9d63284",Article,Scopus,2-s2.0-77954659834
"Ádámkovics, M., Barnes, J.W., Hartung, M., de Pater, I.","Observations of a stationary mid-latitude cloud system on Titan",2010,"Icarus","208","2",,"868","877",,11,10.1016/j.icarus.2010.03.006,"https://www.scopus.com/inward/record.uri?eid=2-s2.0-77954630629&doi=10.1016%2fj.icarus.2010.03.006&partnerID=40&md5=66c0e6bdc855609dbac9a5f30c0d5937",Article,Scopus,2-s2.0-77954630629
"Lehner, M.J., Coehlo, N.K., Zhang, Z.-W., Bianco, F.B., Wang, J.-H., Rice, J.A., Rotopapas, P.P., Alcock, C., Axelrod, T., Byun, Y.-I., Chen, W.P., Cook, K.H., De Pater, I., Kim, D.-W., King, S.-K., Ee, T.L., Marshall, S.L., Schwamb, M.E., Wang, S.-Y., Wen, C.-Y.","The TAOS project: Statistical analysis of multi-telescope time series data",2010,"Publications of the Astronomical Society of the Pacific","122","894",,"959","975",,7,10.1086/655443,"https://www.scopus.com/inward/record.uri?eid=2-s2.0-77955601304&doi=10.1086%2f655443&partnerID=40&md5=97744fad830ea499257635b7330b5830",Article,Scopus,2-s2.0-77955601304
"Lee, C.O., Luhmann, J.G., de Pater, I., Mason, G.M., Haggerty, D., Richardson, I.G., Cane, H.V., Jian, L.K., Russell, C.T., Desai, M.I.","Organization of energetic particles by the solar wind structure during the declining to minimum phase of solar cycle 23",2010,"Solar Physics","263","1",,"239","261",,5,10.1007/s11207-010-9556-x,"https://www.scopus.com/inward/record.uri?eid=2-s2.0-77951971072&doi=10.1007%2fs11207-010-9556-x&partnerID=40&md5=0831f7940ef632a977c530f064b3037f",Article,Scopus,2-s2.0-77951971072
"Bianco, F.B., Zhang, Z.-W., Lehner, M.J., Mondal, S., King, S.-K., Giammarco, J., Holman, M.J., Coehlo, N.K., Wang, J.-H., Alcock, C., Axelrod, T., Byun, Y.-I., Chen, W.P., Cook, K.H., Dave, R., De Pater, I., Kim, D.-W., Lee, T., Lin, H.-C., Lissauer, J.J., Marshall, S.L., Protopapas, P., Rice, J.A., Schwamb, M.E., Wang, S.-Y., Wen, C.-Y.","The taos project: Upper bounds on the population of small kuiper belt objects and tests of models of formation and evolution of the outer solar system",2010,"Astronomical Journal","139","4",,"1499","1514",,25,10.1088/0004-6256/139/4/1499,"https://www.scopus.com/inward/record.uri?eid=2-s2.0-77949517127&doi=10.1088%2f0004-6256%2f139%2f4%2f1499&partnerID=40&md5=afc95d239afeeeca324ac56d85401d49",Article,Scopus,2-s2.0-77949517127
"Davis, W.L., de Pater, I., McKay, C.P.","Rain infiltration and crust formation in the extreme arid zone of the Atacama Desert, Chile",2010,"Planetary and Space Science","58","4",,"616","622",,14,10.1016/j.pss.2009.08.011,"https://www.scopus.com/inward/record.uri?eid=2-s2.0-76349085416&doi=10.1016%2fj.pss.2009.08.011&partnerID=40&md5=9351da6623984768cdf723e1fab614d4",Article,Scopus,2-s2.0-76349085416
"Sánchez-Lavega, A., Wesley, A., Orton, G., Hueso, R., Perez-Hoyos, S., Fletcher, L.N., Yanamandra-Fisher, P., Legarreta, J., De Pater, I., Hammel, H., Simon-Miller, A., Gomez-Forrellad, J.M., Ortiz, J.L., García-Melendo, E., Puetter, R.C., Chodas, P.","The impact of a large object on Jupiter in 2009 July",2010,"Astrophysical Journal Letters","715","2 PART 2",,"L155","L159",,30,10.1088/2041-8205/715/2/L155,"https://www.scopus.com/inward/record.uri?eid=2-s2.0-77952804295&doi=10.1088%2f2041-8205%2f715%2f2%2fL155&partnerID=40&md5=bd58a67aa045e40ef96be58e88301de8",Article,Scopus,2-s2.0-77952804295
"Hammel, H.B., Wong, M.H., Clarke, J.T., De Pater, I., Fletcher, L.N., Hueso, R., Noll, K., Orton, G.S., Pérez-Hoyos, S., Sánchez-Lavega, A., Simon-Miller, A.A., Yanamandra-Fisher, P.A.","Jupiter after the 2009 impact: Hubble space telescope imaging of the impact-generated debris and its temporal evolution",2010,"Astrophysical Journal Letters","715","2 PART 2",,"L150","L154",,22,10.1088/2041-8205/715/2/L150,"https://www.scopus.com/inward/record.uri?eid=2-s2.0-77952840124&doi=10.1088%2f2041-8205%2f715%2f2%2fL150&partnerID=40&md5=b265ad3d7cba7a3932567265bd0ef8d0",Article,Scopus,2-s2.0-77952840124
"Laver, C., de Pater, I., Marchis, F., Ádámkovics, M., Wong, M.H.","Component-resolved near-infrared spectra of the (22) Kalliope system",2009,"Icarus","204","2",,"574","579",,10,10.1016/j.icarus.2009.07.002,"https://www.scopus.com/inward/record.uri?eid=2-s2.0-70350416657&doi=10.1016%2fj.icarus.2009.07.002&partnerID=40&md5=efeaa54dc1fb611904241b754cefe5f5",Article,Scopus,2-s2.0-70350416657
"Zhang, Z.-W., Kim, D.-W., Wang, J.-H., Lehner, M.J., Chen, W.P., Byun, Y.-I., Alcock, C., Axelrod, T., Bianco, F.B., Coehlo, N.K., Cook, K.H., Dave, R., De Pater, I., Giammarco, J., King, S.-K., Lee, T., Lin, H.-C., Marshall, S.L., Porrata, R., Protopapas, P., Rice, J.A., Schwamb, M.E., Wang, S.-Y., Wen, C.-Y.","The TAOS Project: High-Speed Crowded Field Aperture Photometry",2009,"Publications of the Astronomical Society of the Pacific","121","886",,"1429","1439",,7,10.1086/649507,"https://www.scopus.com/inward/record.uri?eid=2-s2.0-73549098906&doi=10.1086%2f649507&partnerID=40&md5=4fac2704a008caa9f949cbab9c386169",Article,Scopus,2-s2.0-73549098906
"Wang, J.-H., Lehner, M.J., Zhang, Z.-W., Bianco, F.B., Alcock, C., Chen, W.-P., Axelrod, T., Byun, Y.-I., Coehlo, N.K., Cook, K.H., Dave, R., De Pater, I., Porrata, R., Kim, D.-W., King, S.-K., Lee, T., Lin, H.-C., Lissauer, J.J., Marshall, S.L., Protopapas, P., Rice, J.A., Schwamb, M.E., Wang, S.-Y., Wen, C.-Y.","Upper limits on the number of small bodies in Sedna-like orbits by the TAOS project",2009,"Astronomical Journal","138","6",,"1893","1901",,10,10.1088/0004-6256/138/6/1893,"https://www.scopus.com/inward/record.uri?eid=2-s2.0-78049513763&doi=10.1088%2f0004-6256%2f138%2f6%2f1893&partnerID=40&md5=517fc21b0811b4d3234cf2bbb6ef9b04",Article,Scopus,2-s2.0-78049513763
"Ádámkovics, M., de Pater, I., Hartung, M., Barnes, J.W.","Evidence for condensed-phase methane enhancement over Xanadu on Titan",2009,"Planetary and Space Science","57","13",,"1586","1595",,8,10.1016/j.pss.2009.07.001,"https://www.scopus.com/inward/record.uri?eid=2-s2.0-70350615870&doi=10.1016%2fj.pss.2009.07.001&partnerID=40&md5=4018d80976678a72c04c04bf13877671",Article,Scopus,2-s2.0-70350615870
"Asay-Davis, X.S., Marcus, P.S., Wong, M.H., de Pater, I.","Jupiter's shrinking Great Red Spot and steady Oval BA: Velocity measurements with the 'Advection Corrected Correlation Image Velocimetry' automated cloud-tracking method",2009,"Icarus","203","1",,"164","188",,38,10.1016/j.icarus.2009.05.001,"https://www.scopus.com/inward/record.uri?eid=2-s2.0-68749107996&doi=10.1016%2fj.icarus.2009.05.001&partnerID=40&md5=db093791fdc2dc6a8eda9710bb6e6ddf",Article,Scopus,2-s2.0-68749107996
"Sromovsky, L.A., Fry, P.M., Hammel, H.B., Ahue, W.M., de Pater, I., Rages, K.A., Showalter, M.R., van Dam, M.A.","Uranus at equinox: Cloud morphology and dynamics",2009,"Icarus","203","1",,"265","286",,27,10.1016/j.icarus.2009.04.015,"https://www.scopus.com/inward/record.uri?eid=2-s2.0-68749110488&doi=10.1016%2fj.icarus.2009.04.015&partnerID=40&md5=400772c1b77ddf9269eb51f839c232d6",Article,Scopus,2-s2.0-68749110488
"Gehrz, R.D., Becklin, E.E., de Pater, I., Lester, D.F., Roellig, T.L., Woodward, C.E.","A new window on the cosmos: The Stratospheric Observatory for Infrared Astronomy (SOFIA)",2009,"Advances in Space Research","44","4",,"413","432",,24,10.1016/j.asr.2009.04.011,"https://www.scopus.com/inward/record.uri?eid=2-s2.0-67650535917&doi=10.1016%2fj.asr.2009.04.011&partnerID=40&md5=49a17455f0364b3ea5ade9ae22a1d344",Article,Scopus,2-s2.0-67650535917
"Hogerheijde, M.R., Qi, C., De Pater, I., Blake, G.A., Friedel, D.N., Forster, J.R., Palmer, P., Remijan, A.J., Snyder, L.E., Wright, M.C.H.","Simultaneous observations of comet C/2002 T7 (LINEAR) with the Berkeley-Illinois-Maryland Association and Owens Valley Radio Observatory interferometers: HCN and CH3OH",2009,"Astronomical Journal","137","6",,"4837","4845",,8,10.1088/0004-6256/137/6/4837,"https://www.scopus.com/inward/record.uri?eid=2-s2.0-84856230523&doi=10.1088%2f0004-6256%2f137%2f6%2f4837&partnerID=40&md5=c25d58654a54503061a4373b4de3e8e0",Article,Scopus,2-s2.0-84856230523
"Laver, C., de Pater, I.","The global distribution of sulfur dioxide ice on Io, observed with OSIRIS on the W.M. Keck telescope",2009,"Icarus","201","1",,"172","181",,5,10.1016/j.icarus.2008.12.037,"https://www.scopus.com/inward/record.uri?eid=2-s2.0-63949086843&doi=10.1016%2fj.icarus.2008.12.037&partnerID=40&md5=92c9548f87113885704cd316515abba9",Article,Scopus,2-s2.0-63949086843
"Lee, C.O., Luhmann, J.G., Zhao, X.P., Liu, Y., Riley, P., Arge, C.N., Russell, C.T., De Pater, I.","Effects of the weak polar fields of solar cycle 23: Investigation using OMNI for the STEREO mission period",2009,"Solar Physics","256","1-2",,"345","363",,44,10.1007/s11207-009-9345-6,"https://www.scopus.com/inward/record.uri?eid=2-s2.0-67349252273&doi=10.1007%2fs11207-009-9345-6&partnerID=40&md5=2c37efa3cf9d1c015056153064bee8ef",Article,Scopus,2-s2.0-67349252273
"Hammel, H.B., Sromovsky, L.A., Fry, P.M., Rages, K., Showalter, M., de Pater, I., van Dam, M.A., LeBeau, R.P., Deng, X.","The Dark Spot in the atmosphere of Uranus in 2006: Discovery, description, and dynamical simulations",2009,"Icarus","201","1",,"257","271",,19,10.1016/j.icarus.2008.08.019,"https://www.scopus.com/inward/record.uri?eid=2-s2.0-63749097439&doi=10.1016%2fj.icarus.2008.08.019&partnerID=40&md5=abd04fbfdf48d8ede14b28696bf3d994",Article,Scopus,2-s2.0-63749097439
"Lin, C.-L., Zhang, Z.-W., Chen, W.P., King, S.-K., Lin, H.-C., Wang, J.-H., Mondal, S., Alcock, C., Axelrod, T., Bianco, F.B., Byun, Y.-I., Coehlo, N.K., Cook, K.H., Dave, R., De Pater, I., Descamps, P., Lehner, M.J., Kim, D.-W., Lee, T., Lissauer, J.J., Marshall, S.L., Porrata, R., Protopapas, P., Rice, J.A., Schwamb, M.E., Wang, S.-Y., Wen, C.-Y.","A close binary star resolved from occultation by 87 sylvia",2009,"Publications of the Astronomical Society of the Pacific","121","878",,"359","364",,1,10.1086/598968,"https://www.scopus.com/inward/record.uri?eid=2-s2.0-67650683032&doi=10.1086%2f598968&partnerID=40&md5=38f06b0bd4d5ef2e6952376f83aa7b16",Article,Scopus,2-s2.0-67650683032
"Lehner, M.J., Wen, C.-Y., Wang, J.-H., Marshall, S.L., Schwamb, M.E., Zhang, Z.-W., Bianco, F.B., Giammarco, J., Porrata, R., Alcock, C., Axelrod, T., Byun, Y.-I., Chen, W.P., Cook, K.H., Dave, R., King, S.-K., Lee, T., Lin, H.-C., Wang, S.-Y., Rice, J.A., De Pater, I.","The taiwanese-american occultation survey: The multi-telescope robotic observatory",2009,"Publications of the Astronomical Society of the Pacific","121","876",,"138","152",,26,10.1086/597516,"https://www.scopus.com/inward/record.uri?eid=2-s2.0-62649107649&doi=10.1086%2f597516&partnerID=40&md5=cbd7cd8bbdacaf5f46629f0a82e30f9d",Article,Scopus,2-s2.0-62649107649
"Coustenis, A., Atreya, S.K., Balint, T., Brown, R.H., Dougherty, M.K., Ferri, F., Fulchignoni, M., Gautier, D., Gowen, R.A., Griffith, C.A., Gurvits, L.I., Jaumann, R., Langevin, Y., Leese, M.R., Lunine, J.I., McKay, C.P., Moussas, X., Müller-Wodarg, I., Neubauer, F., Owen, T.C., Raulin, F., Sittler, E.C., Sohl, F., Sotin, C., Tobie, G., Tokano, T., Turtle, E.P., Wahlund, J.-E., Waite, J.H., Baines, K.H., Blamont, J., Coates, A.J., Dandouras, I., Krimigis, T., Lellouch, E., Lorenz, R.D., Morse, A., Porco, C.C., Hirtzig, M., Saur, J., Spilker, T., Zarnecki, J.C., Choi, E., Achilleos, N., Amils, R., Annan, P., Atkinson, D.H., Bénilan, Y., Bertucci, C., Bézard, B., Bjoraker, G.L., Blanc, M., Boireau, L., Bouman, J., Cabane, M., Capria, M.T., Chassefière, E., Coll, P., Combes, M., Cooper, J.F., Coradini, A., Crary, F., Cravens, T., Daglis, I.A., de Angelis, E., de Bergh, C., de Pater, I., Dunford, C., Durry, G., Dutuit, O., Fairbrother, D., Flasar, F.M., Fortes, A.D., Frampton, R., Fujimoto, M., Galand, M., Grasset, O., Grott, M., Haltigin, T., Herique, A., Hersant, F., Hussmann, H., Ip, W., Johnson, R., Kallio, E., Kempf, S., Knapmeyer, M., Kofman, W., Koop, R., Kostiuk, T., Krupp, N., Küppers, M., Lammer, H., Lara, L.-M., Lavvas, P., Le Mouélic, S., Lebonnois, S., Ledvina, S., Li, J., Livengood, T.A., Lopes, R.M., Lopez-Moreno, J.-J., Luz, D., Mahaffy, P.R., Mall, U., Martinez-Frias, J., Marty, B., McCord, T., Salvan, C.M., Milillo, A., Mitchell, D.G., Modolo, R., Mousis, O., Nakamura, M., Neish, C.D., Nixon, C.A., Mvondo, D.N., Orton, G., Paetzold, M., Pitman, J., Pogrebenko, S., Pollard, W., Prieto-Ballesteros, O., Rannou, P., Reh, K., Richter, L., Robb, F.T., Rodrigo, R., Rodriguez, S., Romani, P., Bermejo, M.R., Sarris, E.T., Schenk, P., Schmitt, B., Schmitz, N., Schulze-Makuch, D., Schwingenschuh, K., Selig, A., Sicardy, B., Soderblom, L., Spilker, L.J., Stam, D., Steele, A., Stephan, K., Strobel, D.F., Szego, K., Szopa, C., Thissen, R., Tomasko, M.G., Toublanc, D., Vali, H., Vardavas, I., Vuitton, V., West, R.A., Yelle, R., Young, E.F.","TandEM: Titan and Enceladus mission",2009,"Experimental Astronomy","23","3",,"893","946",,40,10.1007/s10686-008-9103-z,"https://www.scopus.com/inward/record.uri?eid=2-s2.0-67349188697&doi=10.1007%2fs10686-008-9103-z&partnerID=40&md5=1371e6448c700614571b94735fe6d625",Article,Scopus,2-s2.0-67349188697
