Authors,Title,Year,Source title,Volume,Issue,Art. No.,Page start,Page end,Page count,Cited by,DOI,Link,Document Type,Source,EID
"Loksa, D., Ko, A.J.","The role of self-regulation in programming problem solving process and success",2016,"ICER 2016 - Proceedings of the 2016 ACM Conference on International Computing Education Research",,,,"83","91",,1,10.1145/2960310.2960334,"https://www.scopus.com/inward/record.uri?eid=2-s2.0-85000761553&doi=10.1145%2f2960310.2960334&partnerID=40&md5=7b604e795cd5895b2afd5c9cdcd74a72",Conference Paper,Scopus,2-s2.0-85000761553
"Myers, B.A., Ko, A.J., Latoza, T.D., Yoon, Y.","Programmers Are Users Too: Human-centered methods for improving programming tools",2016,"Computer","49","7", 7503516,"44","52",,1,10.1109/MC.2016.200,"https://www.scopus.com/inward/record.uri?eid=2-s2.0-84978698482&doi=10.1109%2fMC.2016.200&partnerID=40&md5=758d2e6417542860400bb931539de11b",Article,Scopus,2-s2.0-84978698482
"Loksa, D., Ko, A.J., Jernigan, W., Oleson, A., Mendez, C.J., Burnett, M.M.","Programming, problem solving, and self-awareness: Effects of explicit guidance",2016,"Conference on Human Factors in Computing Systems - Proceedings",,,,"1449","1461",,1,10.1145/2858036.2858252,"https://www.scopus.com/inward/record.uri?eid=2-s2.0-85015105452&doi=10.1145%2f2858036.2858252&partnerID=40&md5=45b14d1d0b207ffa426f211abc4144a2",Conference Paper,Scopus,2-s2.0-85015105452
"Jernigan, W., Horvath, A., Lee, M., Burnett, M., Cuilty, T., Kuttal, S., Peters, A., Kwan, I., Bahmani, F., Ko, A.","A principled evaluation for a principled idea garden",2015,"Proceedings of IEEE Symposium on Visual Languages and Human-Centric Computing, VL/HCC","2015-December",, 7357222,"235","243",,5,10.1109/VLHCC.2015.7357222,"https://www.scopus.com/inward/record.uri?eid=2-s2.0-84959906196&doi=10.1109%2fVLHCC.2015.7357222&partnerID=40&md5=52f4e0e3216e6a4f6da41355b2885faf",Conference Paper,Scopus,2-s2.0-84959906196
"Burg, B., Ko, A.J., Ernst, M.D.","Explaining visual changes in web interfaces",2015,"UIST 2015 - Proceedings of the 28th Annual ACM Symposium on User Interface Software and Technology",,,,"259","269",,4,10.1145/2807442.2807473,"https://www.scopus.com/inward/record.uri?eid=2-s2.0-84959261398&doi=10.1145%2f2807442.2807473&partnerID=40&md5=2c366421021f82d7dc519becf8f11a7b",Conference Paper,Scopus,2-s2.0-84959261398
"Li, P.L., Ko, A.J., Zhu, J.","What makes a great software engineer?",2015,"Proceedings - International Conference on Software Engineering","1",, 7194618,"700","710",,8,10.1109/ICSE.2015.335,"https://www.scopus.com/inward/record.uri?eid=2-s2.0-84951867219&doi=10.1109%2fICSE.2015.335&partnerID=40&md5=116f4e796d5bd91390a5f60107ba1ab4",Conference Paper,Scopus,2-s2.0-84951867219
"Lee, M.J., Ko, A.J.","Comparing the effectiveness of online learning approaches on CS1 learning outcomes",2015,"ICER 2015 - Proceedings of the 2015 ACM Conference on International Computing Education Research",,,,"237","246",,9,10.1145/2787622.2787709,"https://www.scopus.com/inward/record.uri?eid=2-s2.0-84959307036&doi=10.1145%2f2787622.2787709&partnerID=40&md5=0f44d3083341968b6ba8b286c696b37c",Conference Paper,Scopus,2-s2.0-84959307036
"Chilana, P.K., Ko, A.J., Wobbrock, J.O.","From user-centered to adoption-centered design: A case study of an HCI research innovation becoming a product",2015,"Conference on Human Factors in Computing Systems - Proceedings","2015-April",,,"1749","1758",,1,10.1145/2702123.2702412,"https://www.scopus.com/inward/record.uri?eid=2-s2.0-84951070652&doi=10.1145%2f2702123.2702412&partnerID=40&md5=9ba4d4d601020b71514965119360a271",Conference Paper,Scopus,2-s2.0-84951070652
"Ko, A.J., LaToza, T.D., Burnett, M.M.","A practical guide to controlled experiments of software engineering tools with human participants",2015,"Empirical Software Engineering","20","1",,"110","141",,9,10.1007/s10664-013-9279-3,"https://www.scopus.com/inward/record.uri?eid=2-s2.0-84921699316&doi=10.1007%2fs10664-013-9279-3&partnerID=40&md5=dceb4d832ecb625fdfa48bae0cb2d5aa",Article in Press,Scopus,2-s2.0-84921699316
"Ko, A.J., Dosono, B., Duriseti, N.","Thirty years of software problems in the news!",2014,"8th International Workshop on Cooperative and Human Aspects of Software Engineering, CHASE 2014 - Proceedings",,,,"32","39",,,10.1145/2593702.2593719,"https://www.scopus.com/inward/record.uri?eid=2-s2.0-84963971904&doi=10.1145%2f2593702.2593719&partnerID=40&md5=3bc6c38a17d82a54c101d07b2c6833cf",Conference Paper,Scopus,2-s2.0-84963971904
"Lee, M.J., Ko, A.J.","A demonstration of gidget, a debugging game for computing education",2014,"Proceedings of IEEE Symposium on Visual Languages and Human-Centric Computing, VL/HCC",,, 6883060,"211","212",,1,10.1109/VLHCC.2014.6883060,"https://www.scopus.com/inward/record.uri?eid=2-s2.0-84907397018&doi=10.1109%2fVLHCC.2014.6883060&partnerID=40&md5=21cf8c16dcad44141cbb33f5ca1ad843",Conference Paper,Scopus,2-s2.0-84907397018
"Charters, P., Lee, M.J., Ko, A.J., Loksa, D.","Challenging stereotypes and changing attitudes: The effect of a brief programming encounter on adults' attitudes toward programming",2014,"SIGCSE 2014 - Proceedings of the 45th ACM Technical Symposium on Computer Science Education",,,,"653","658",,8,10.1145/2538862.2538938,"https://www.scopus.com/inward/record.uri?eid=2-s2.0-84899720558&doi=10.1145%2f2538862.2538938&partnerID=40&md5=37f6c77d65cd28733528e8f6e0608d77",Conference Paper,Scopus,2-s2.0-84899720558
"Lee, M.J., Bahmani, F., Kwan, I., Laferte, J., Charters, P., Horvath, A., Luor, F., Cao, J., Law, C., Beswetherick, M., Long, S., Burnett, M., Ko, A.J.","Principles of a debugging-first puzzle game for computing education",2014,"Proceedings of IEEE Symposium on Visual Languages and Human-Centric Computing, VL/HCC",,, 6883023,"57","64",,14,10.1109/VLHCC.2014.6883023,"https://www.scopus.com/inward/record.uri?eid=2-s2.0-84907420068&doi=10.1109%2fVLHCC.2014.6883023&partnerID=40&md5=786bdd2381f7c8a77dd6dadeb249dd92",Conference Paper,Scopus,2-s2.0-84907420068
"Burg, B., Bailey, R., Ko, A.J., Ernst, M.D.","Interactive record/replay for web application debugging",2013,"UIST 2013 - Proceedings of the 26th Annual ACM Symposium on User Interface Software and Technology",,,,"473","483",,36,10.1145/2501988.2502050,"https://www.scopus.com/inward/record.uri?eid=2-s2.0-84887569600&doi=10.1145%2f2501988.2502050&partnerID=40&md5=fcfb666932af69a647e4e83b89c87cf8",Conference Paper,Scopus,2-s2.0-84887569600
"Lee, M.J., Ko, A.J., Kwan, I.","In-game assessments increase novice programmers' engagement and level completion speed",2013,"ICER 2013 - Proceedings of the 2013 ACM Conference on International Computing Education Research",,,,"153","160",,21,10.1145/2493394.2493410,"https://www.scopus.com/inward/record.uri?eid=2-s2.0-84883499948&doi=10.1145%2f2493394.2493410&partnerID=40&md5=7410511a6912aea3c4d1bc390c58878d",Conference Paper,Scopus,2-s2.0-84883499948
"Ko, A., Su, D.K., Born, D., Desantis, A., Failor, R.A., Ferreira Jr., M.","Two patients with primary sellar leiomyomas, a rare entity",2013,"Journal of Clinical Neuroscience","20","6",,"897","901",,1,10.1016/j.jocn.2012.07.001,"https://www.scopus.com/inward/record.uri?eid=2-s2.0-84891877879&doi=10.1016%2fj.jocn.2012.07.001&partnerID=40&md5=12ede7cc4e558c19450fe3918f1bdad8",Article,Scopus,2-s2.0-84891877879
"Chilana, P.K., Ko, A.J., Wobbrock, J.O., Grossman, T.","A multi-site field study of crowdsourced contextual help: Usage and perspectives of end users and software teams",2013,"Conference on Human Factors in Computing Systems - Proceedings",,,,"217","226",,2,10.1145/2470654.2470685,"https://www.scopus.com/inward/record.uri?eid=2-s2.0-84877981892&doi=10.1145%2f2470654.2470685&partnerID=40&md5=a0e3ae166665d2de24d0b6d1566ffcdf",Conference Paper,Scopus,2-s2.0-84877981892
"Lee, M.J., Ko, A.J.","Investigating the role of purposeful goals on novices' engagement in a programming game",2012,"Proceedings of IEEE Symposium on Visual Languages and Human-Centric Computing, VL/HCC",,, 6344507,"163","166",,10,10.1109/VLHCC.2012.6344507,"https://www.scopus.com/inward/record.uri?eid=2-s2.0-84870880939&doi=10.1109%2fVLHCC.2012.6344507&partnerID=40&md5=dc1dedf5dba378723409b6478c1ae3a4",Conference Paper,Scopus,2-s2.0-84870880939
"Lee, M.J., Ko, A.J.","Representations of user feedback in an agile, collocated software team",2012,"2012 5th International Workshop on Co-operative and Human Aspects of Software Engineering, CHASE 2012 - Proceedings",,, 6223028,"76","82",,,10.1109/CHASE.2012.6223028,"https://www.scopus.com/inward/record.uri?eid=2-s2.0-84864153027&doi=10.1109%2fCHASE.2012.6223028&partnerID=40&md5=1afcd634447463f30b94d2c7970d30d2",Conference Paper,Scopus,2-s2.0-84864153027
"Ko, A.J.","Mining whining in support forums with frictionary",2012,"Conference on Human Factors in Computing Systems - Proceedings",,,,"191","200",,7,10.1145/2212776.2212797,"https://www.scopus.com/inward/record.uri?eid=2-s2.0-84862697397&doi=10.1145%2f2212776.2212797&partnerID=40&md5=c3748404fdea6179ec0cfebe10424365",Conference Paper,Scopus,2-s2.0-84862697397
"Chilana, P.K., Holsberry, C., Oliveira, F., Ko, A.J.","Designing for a billion users: A case study of Facebook",2012,"Conference on Human Factors in Computing Systems - Proceedings",,,,"419","431",,3,10.1145/2212776.2212819,"https://www.scopus.com/inward/record.uri?eid=2-s2.0-84862703629&doi=10.1145%2f2212776.2212819&partnerID=40&md5=f38d5cd2348bc1ad1dc24c39650a4b9a",Conference Paper,Scopus,2-s2.0-84862703629
"Chilana, P.K., Ko, A.J., Wobbrock, J.O.","LemonAid: Selection-based crowdsourced contextual help for web applications",2012,"Conference on Human Factors in Computing Systems - Proceedings",,,,"1549","1558",,22,10.1145/2207676.2208620,"https://www.scopus.com/inward/record.uri?eid=2-s2.0-84862086427&doi=10.1145%2f2207676.2208620&partnerID=40&md5=8a8e3ec27130c41a6ae3b8f603bec868",Conference Paper,Scopus,2-s2.0-84862086427
"Kriplean, T., Toomim, M., Morgan, J., Borning, A., Ko, A.J.","Is this what you meant? Promoting listening on the web with Reflect",2012,"Conference on Human Factors in Computing Systems - Proceedings",,,,"1559","1568",,20,10.1145/2207676.2208621,"https://www.scopus.com/inward/record.uri?eid=2-s2.0-84862104186&doi=10.1145%2f2207676.2208621&partnerID=40&md5=87bbb4b1fe7441f83f5021441cfec7cf",Conference Paper,Scopus,2-s2.0-84862104186
"Ko, A.J., Riche, Y.","The role of conceptual knowledge in API usability",2011,"Proceedings - 2011 IEEE Symposium on Visual Languages and Human Centric Computing, VL/HCC 2011",,, 6070395,"173","176",,9,10.1109/VLHCC.2011.6070395,"https://www.scopus.com/inward/record.uri?eid=2-s2.0-82855169268&doi=10.1109%2fVLHCC.2011.6070395&partnerID=40&md5=b525320f771e267b08c5e91d17b4f00b",Conference Paper,Scopus,2-s2.0-82855169268
"Myers, B.A., Costagliola, G., Ko, A., Cypher, A., Nichols, J., Scaffidi, C., Kelleher, C.","Proceedings - 2011 IEEE Symposium on Visual Languages and Human Centric Computing, VL/HCC 2011: Foreword",2011,"Proceedings - 2011 IEEE Symposium on Visual Languages and Human Centric Computing, VL/HCC 2011",,, 6070369,"","",,,10.1109/VLHCC.2011.6070369,"https://www.scopus.com/inward/record.uri?eid=2-s2.0-82855181176&doi=10.1109%2fVLHCC.2011.6070369&partnerID=40&md5=8068bc8f7baec49f1189132e5cba9f9f",Conference Paper,Scopus,2-s2.0-82855181176
"Lee, M.J., Ko, A.J.","Personifying programming tool feedback improves novice programmers' learning",2011,"ICER'11 - Proceedings of the ACM SIGCSE 2011 International Computing Education Research Workshop",,,,"109","116",,45,10.1145/2016911.2016934,"https://www.scopus.com/inward/record.uri?eid=2-s2.0-80053304064&doi=10.1145%2f2016911.2016934&partnerID=40&md5=d0c3a146af12cc6d166cbe4c078c2ebb",Conference Paper,Scopus,2-s2.0-80053304064
"Li, P.L., Kivett, R., Zhan, Z., Jeon, S.-E., Nagappan, N., Murphy, B., Ko, A.J.","Characterizing the differences between pre- and post- release versions of software",2011,"Proceedings - International Conference on Software Engineering",,,,"716","725",,12,10.1145/1985793.1985894,"https://www.scopus.com/inward/record.uri?eid=2-s2.0-79959914473&doi=10.1145%2f1985793.1985894&partnerID=40&md5=dfeb107f3eec7d975d558d2ebcc7b82b",Conference Paper,Scopus,2-s2.0-79959914473
"Ko, A.J., Lee, M.J., Ferrari, V., Ip, S., Tran, C.","A case study of post-deployment user feedback triage",2011,"Proceedings - International Conference on Software Engineering",,,,"1","8",,10,10.1145/1984642.1984644,"https://www.scopus.com/inward/record.uri?eid=2-s2.0-79959434054&doi=10.1145%2f1984642.1984644&partnerID=40&md5=541c233e3c72f747edfa7739f1f16068",Conference Paper,Scopus,2-s2.0-79959434054
"Ko, A.J., Zhang, X.","FeedLack detects missing feedback in web applications",2011,"Conference on Human Factors in Computing Systems - Proceedings",,,,"2177","2186",,5,10.1145/1978942.1979260,"https://www.scopus.com/inward/record.uri?eid=2-s2.0-79958120057&doi=10.1145%2f1978942.1979260&partnerID=40&md5=5a29d4a1c895ec54d32ea1a62b69e5cf",Conference Paper,Scopus,2-s2.0-79958120057
"Chilana, P.K., Ko, A.J., Wobbrock, J.O., Grossman, T., Fitzmaurice, G.","Post-deployment usability: A survey of current practices",2011,"Conference on Human Factors in Computing Systems - Proceedings",,,,"2243","2246",,12,10.1145/1978942.1979270,"https://www.scopus.com/inward/record.uri?eid=2-s2.0-79958152925&doi=10.1145%2f1978942.1979270&partnerID=40&md5=6c6ac31914d561d4af8ebabf67897f57",Conference Paper,Scopus,2-s2.0-79958152925
"Ko, A.J., Abraham, R., Beckwith, L., Blackwell, A., Burnett, M., Erwig, M., Scaffidi, C., Lawrance, J., Lieberman, H., Myers, B., Rosson, M.B., Rothermel, G., Shaw, M., Wiedenbeck, S.","The state of the art in end-user software engineering",2011,"ACM Computing Surveys","43","3", 21,"","",,174,10.1145/1922649.1922658,"https://www.scopus.com/inward/record.uri?eid=2-s2.0-79955668292&doi=10.1145%2f1922649.1922658&partnerID=40&md5=613fbeccff17b63221a78d522d4b7f5e",Article,Scopus,2-s2.0-79955668292
"Ko, A.J., Chilana, P.K.","Design, discussion, and dissent in open bug reports",2011,"ACM International Conference Proceeding Series",,,,"106","113",,16,10.1145/1940761.1940776,"https://www.scopus.com/inward/record.uri?eid=2-s2.0-79952576408&doi=10.1145%2f1940761.1940776&partnerID=40&md5=77c1f9d52d085f6b5ea49dc598a4ef27",Conference Paper,Scopus,2-s2.0-79952576408
"Kulesza, T., Stumpf, S., Wong, W.-K., Burnett, M.M., Perona, S., Ko, A., Oberst, I.","Why-oriented end-user debugging of naive Bayes text classification",2011,"ACM Transactions on Interactive Intelligent Systems","1","1", 2,"","",,7,10.1145/2030365.2030367,"https://www.scopus.com/inward/record.uri?eid=2-s2.0-84983579946&doi=10.1145%2f2030365.2030367&partnerID=40&md5=59ec1e5da6bdd6682a42298a59eb55e3",Article,Scopus,2-s2.0-84983579946
"Patel, K., Bancroft, N., Drucker, S.M., Fogarty, J., Ko, A.J., Landay, J.A.","Gestalt: Integrated support for implementation and analysis in machine learning",2010,"UIST 2010 - 23rd ACM Symposium on User Interface Software and Technology",,,,"37","46",,29,10.1145/1866029.1866038,"https://www.scopus.com/inward/record.uri?eid=2-s2.0-78649593360&doi=10.1145%2f1866029.1866038&partnerID=40&md5=d14c64020d49f020f4200bb3c828df53",Conference Paper,Scopus,2-s2.0-78649593360
"Ko, A.J., Wobbrock, J.O.","Cleanroom: Edit-time error detection with the uniqueness heuristic",2010,"Proceedings - 2010 IEEE Symposium on Visual Languages and Human-Centric Computing, VL/HCC 2010",,, 5635293,"7","14",,3,10.1109/VLHCC.2010.11,"https://www.scopus.com/inward/record.uri?eid=2-s2.0-79952045315&doi=10.1109%2fVLHCC.2010.11&partnerID=40&md5=66ac2817aceba4f891452119a3885ed9",Conference Paper,Scopus,2-s2.0-79952045315
"Chilana, P.K., Ko, A.J., Wobbrock, J.O.","Understanding expressions of unwanted behaviors in open bug reporting",2010,"Proceedings - 2010 IEEE Symposium on Visual Languages and Human-Centric Computing, VL/HCC 2010",,, 5635225,"203","206",,3,10.1109/VLHCC.2010.35,"https://www.scopus.com/inward/record.uri?eid=2-s2.0-79952051520&doi=10.1109%2fVLHCC.2010.35&partnerID=40&md5=b3c0a14a2af3542bcfd22ec0dbed8048",Conference Paper,Scopus,2-s2.0-79952051520
"Ko, A.J., Myers, B.A.","Extracting and answering why and why not questions about Java program output",2010,"ACM Transactions on Software Engineering and Methodology","20","2", 4,"","",,13,10.1145/1824760.1824761,"https://www.scopus.com/inward/record.uri?eid=2-s2.0-77956536785&doi=10.1145%2f1824760.1824761&partnerID=40&md5=1776435841e148320121b9fef7485389",Article,Scopus,2-s2.0-77956536785
"Ko, A.J., Chilana, P.K.","How power users help and hinder open bug reporting",2010,"Conference on Human Factors in Computing Systems - Proceedings","3",,,"1665","1674",,32,10.1145/1753326.1753576,"https://www.scopus.com/inward/record.uri?eid=2-s2.0-77953967494&doi=10.1145%2f1753326.1753576&partnerID=40&md5=6954d3288f222a6d0d98c910b66687a1",Conference Paper,Scopus,2-s2.0-77953967494
"Chilana, P.K., Wobbrock, J.O., Ko, A.J.","Understanding usability practices in complex domains",2010,"Conference on Human Factors in Computing Systems - Proceedings","4",,,"2337","2346",,36,10.1145/1753326.1753678,"https://www.scopus.com/inward/record.uri?eid=2-s2.0-77954017458&doi=10.1145%2f1753326.1753678&partnerID=40&md5=7a3203b70484e82d16eef3d896a40282",Conference Paper,Scopus,2-s2.0-77954017458
"Myers, B.A., Burnett, M.M., Ko, A.J., Rosson, M.B., Scaffidi, C., Wiedenbeck, S.","End user software engineering: CHI 2010 special interest group meeting",2010,"Conference on Human Factors in Computing Systems - Proceedings",,,,"3189","3192",,,10.1145/1753846.1753953,"https://www.scopus.com/inward/record.uri?eid=2-s2.0-77953106298&doi=10.1145%2f1753846.1753953&partnerID=40&md5=8dcedf08ed45b4c646bd3b7a294cce7f",Conference Paper,Scopus,2-s2.0-77953106298
"Ko, A.J.","Attitudes and self-efficacy in young adults' computing autobiographies",2009,"2009 IEEE Symposium on Visual Languages and Human-Centric Computing, VL/HCC 2009",,, 5295297,"67","74",,4,10.1109/VLHCC.2009.5295297,"https://www.scopus.com/inward/record.uri?eid=2-s2.0-73449093809&doi=10.1109%2fVLHCC.2009.5295297&partnerID=40&md5=c65768d03032fc857c1830a83ce3b402",Conference Paper,Scopus,2-s2.0-73449093809
"Ko, A., Myers, B.A.","Finding causes of program output with the java whyline",2009,"Conference on Human Factors in Computing Systems - Proceedings",,,,"1569","1578",,41,10.1145/1518701.1518942,"https://www.scopus.com/inward/record.uri?eid=2-s2.0-84892468995&doi=10.1145%2f1518701.1518942&partnerID=40&md5=0ca766b55a644574841ddd1b617d93d5",Conference Paper,Scopus,2-s2.0-84892468995
"Ko, A.J., Good, J.","Democratizing access to computational tools: The 7 th annual VL/HCC graduate student consortium",2009,"2009 IEEE Symposium on Visual Languages and Human-Centric Computing, VL/HCC 2009",,, 5295254,"241","",,,10.1109/VLHCC.2009.5295254,"https://www.scopus.com/inward/record.uri?eid=2-s2.0-73449095214&doi=10.1109%2fVLHCC.2009.5295254&partnerID=40&md5=d741680909806c6eb4261f7720f21998",Conference Paper,Scopus,2-s2.0-73449095214
"Chilana, P.K., Palmer, C.L., Ko, A.J.","Comparing bioinformatics software development by computer scientists and biologists: An exploratory study",2009,"Proceedings of the 2009 ICSE Workshop on Software Engineering for Computational Science and Engineering, SECSE 2009",,, 5069165,"72","79",,7,10.1109/SECSE.2009.5069165,"https://www.scopus.com/inward/record.uri?eid=2-s2.0-70349912088&doi=10.1109%2fSECSE.2009.5069165&partnerID=40&md5=479e4223e4c2ff3fb95731aa2a838428",Conference Paper,Scopus,2-s2.0-70349912088
"Chilana, P.K., Ko, A.J., Wobbrock, J.O.","Designing software for unfamiliar domains",2009,"Proceedings of the 2009 ICSE Workshop on Cooperative and Human Aspects on Software Engineering, CHASE 2009",,, 5071405,"22","",,1,10.1109/CHASE.2009.5071405,"https://www.scopus.com/inward/record.uri?eid=2-s2.0-70349737686&doi=10.1109%2fCHASE.2009.5071405&partnerID=40&md5=af7abda45bb2cf13d917a6dd186b6210",Conference Paper,Scopus,2-s2.0-70349737686
"Myers, B.A., Ko, A.J., Burnett, M.M., Rosson, M.B., Wiedenbeck, S.","End user software engineering: CHI'2009 special interest group meeting",2009,"Conference on Human Factors in Computing Systems - Proceedings",,,,"2731","2734",,,10.1145/1520340.1520393,"https://www.scopus.com/inward/record.uri?eid=2-s2.0-70349173222&doi=10.1145%2f1520340.1520393&partnerID=40&md5=1050d1524dccca82799fa467f88392bd",Conference Paper,Scopus,2-s2.0-70349173222
"Kulesza, T., Wong, W.-K., Stumpf, S., Perona, S., White, R., Burnett, M.M., Oberst, I., Ko, A.J.","Fixing the program my computer learned: Barriers for end users, challenges for the machine",2009,"International Conference on Intelligent User Interfaces, Proceedings IUI",,,,"187","196",,34,10.1145/1502650.1502678,"https://www.scopus.com/inward/record.uri?eid=2-s2.0-77953869226&doi=10.1145%2f1502650.1502678&partnerID=40&md5=59bdf0f33bf2ab9ec93751b0a342132f",Conference Paper,Scopus,2-s2.0-77953869226
"Ko, A.J.","Automating the web with CoScripter: An interview with Tessa Lau",2009,"IEEE Software","26","5",,"52","53",,,10.1109/MS.2009.122,"https://www.scopus.com/inward/record.uri?eid=2-s2.0-70049088830&doi=10.1109%2fMS.2009.122&partnerID=40&md5=e58ea25a2d37964936c78734d4fda328",Article,Scopus,2-s2.0-70049088830
"Ko, A.J., Abraham, R., Burnett, M.M., Myers, B.A.","Guest editors' introduction: End-user software engineering",2009,"IEEE Software","26","5",,"16","17",,8,10.1109/MS.2009.129,"https://www.scopus.com/inward/record.uri?eid=2-s2.0-70049117916&doi=10.1109%2fMS.2009.129&partnerID=40&md5=f83274c8b902ce55800e8a2ff3b36d4e",Editorial,Scopus,2-s2.0-70049117916
"Wobbrock, J.O., Ko, A.J., Kientz, J.A.","Reflections on the future of iSchools from inspired junior faculty",2009,"Interactions","16","5",,"69","71",,4,10.1145/1572626.1572641,"https://www.scopus.com/inward/record.uri?eid=2-s2.0-70349087756&doi=10.1145%2f1572626.1572641&partnerID=40&md5=72c277e0e77025b2f5248f18c580c4e7",Article,Scopus,2-s2.0-70349087756
"Ko, A.J., Myers, B.A.","Debugging reinvented: Asking and answering why and why not questions about program behavior",2008,"Proceedings - International Conference on Software Engineering",,,,"301","310",,119,10.1145/1368088.1368130,"https://www.scopus.com/inward/record.uri?eid=2-s2.0-57349156958&doi=10.1145%2f1368088.1368130&partnerID=40&md5=3cc120a8acecd49cdda58add7465a891",Conference Paper,Scopus,2-s2.0-57349156958
"Myers, B.A., Burnett, M.M., Rosson, M.B., Ko, A.J., Blackwell, A.","End user software engineering: CHI'2008 special interest group meeting",2008,"Conference on Human Factors in Computing Systems - Proceedings",,,,"2371","2374",,3,10.1145/1358628.1358687,"https://www.scopus.com/inward/record.uri?eid=2-s2.0-57049104078&doi=10.1145%2f1358628.1358687&partnerID=40&md5=8f643f829edbf7fd23213119c9c91aa3",Conference Paper,Scopus,2-s2.0-57049104078
"Myers, B.A., Ko, A., Park, S.Y., Stylos, J., LaToza, T.D., Beaton, J.","More Natural end-user software engineering",2008,"Proceedings - International Conference on Software Engineering",,, 1370854,"30","34",,10,10.1145/1370847.1370854,"https://www.scopus.com/inward/record.uri?eid=2-s2.0-57049171494&doi=10.1145%2f1370847.1370854&partnerID=40&md5=e4494858a92257f0d325df374306d89b",Conference Paper,Scopus,2-s2.0-57049171494
"Ko, A.J., Myers, B.A.","Source-level debugging with the whyline",2008,"Proceedings - International Conference on Software Engineering",,,,"69","72",,,10.1145/1370114.1370132,"https://www.scopus.com/inward/record.uri?eid=2-s2.0-77953576541&doi=10.1145%2f1370114.1370132&partnerID=40&md5=0d0ed0ddf5719c1404ab5ea61136e382",Conference Paper,Scopus,2-s2.0-77953576541
"Park, S.Y., Myers, B., Ko, A.J.","Designers' natural descriptions of interactive behaviors",2008,"Proceedings - 2008 IEEE Symposium on Visual Languages and Human-Centric Computing, VL/HCC 2008",,, 4639082,"185","188",,7,10.1109/VLHCC.2008.4639082,"https://www.scopus.com/inward/record.uri?eid=2-s2.0-56349145290&doi=10.1109%2fVLHCC.2008.4639082&partnerID=40&md5=a4a7285c1ffb3dd14b1d0234d8f854b8",Conference Paper,Scopus,2-s2.0-56349145290
"Myers, B., Park, S.Y., Nakano, Y., Mueller, G., Ko, A.","How designers design and program interactive behaviors",2008,"Proceedings - 2008 IEEE Symposium on Visual Languages and Human-Centric Computing, VL/HCC 2008",,, 4639081,"177","184",,58,10.1109/VLHCC.2008.4639081,"https://www.scopus.com/inward/record.uri?eid=2-s2.0-56349114035&doi=10.1109%2fVLHCC.2008.4639081&partnerID=40&md5=455dddd6b4b31813ad86117b5f035f62",Conference Paper,Scopus,2-s2.0-56349114035
"Cherubini, M., Venolia, G., Deline, R., Ko, A.J.","Let's go to the whiteboard: How and why software developers use drawings",2007,"Conference on Human Factors in Computing Systems - Proceedings",,,,"557","566",,117,10.1145/1240624.1240714,"https://www.scopus.com/inward/record.uri?eid=2-s2.0-35348861472&doi=10.1145%2f1240624.1240714&partnerID=40&md5=a9be03c1faad1c580496087433c5f215",Conference Paper,Scopus,2-s2.0-35348861472
"Myers, B.A., Burnett, M.M., Wiedenbeck, S., Ko, A.J.","End user software engineering: CHI 2007 special interest group meeting",2007,"Conference on Human Factors in Computing Systems - Proceedings",,,,"2125","2128",,3,10.1145/1240866.1240964,"https://www.scopus.com/inward/record.uri?eid=2-s2.0-35348861886&doi=10.1145%2f1240866.1240964&partnerID=40&md5=0a93c344ad5f48afaf997ad54e29b5a5",Conference Paper,Scopus,2-s2.0-35348861886
"Ko, A.J., DeLine, R., Venolia, G.","Information needs in collocated software development teams",2007,"Proceedings - International Conference on Software Engineering",,, 4222596,"344","353",,229,10.1109/ICSE.2007.45,"https://www.scopus.com/inward/record.uri?eid=2-s2.0-34548742277&doi=10.1109%2fICSE.2007.45&partnerID=40&md5=4c43bd1ffdc8ee12e13ea89ceb5062fd",Conference Paper,Scopus,2-s2.0-34548742277
