Authors,Title,Year,Source title,Volume,Issue,Art. No.,Page start,Page end,Page count,Cited by,DOI,Link,Document Type,Source,EID
"Liu, L., Barber, G.D., Shuba, M.V., Yuwen, Y., Lakhtakia, A., Mallouk, T.E., Mayer, T.S.","Planar Light Concentration in Micro-Si Solar Cells Enabled by a Metallic Grating-Photonic Crystal Architecture",2016,"ACS Photonics","3","4",,"604","610",,5,10.1021/acsphotonics.5b00706,"https://www.scopus.com/inward/record.uri?eid=2-s2.0-84966447593&doi=10.1021%2facsphotonics.5b00706&partnerID=40&md5=0ae13df5664df30c281674ab48c30c07",Article,Scopus,2-s2.0-84966447593
"Solano, M.E., Barber, G.D., Lakhtakia, A., Faryad, M., Monk, P.B., Mallouk, T.E.","Buffer layer between a planar optical concentrator and a solar cell",2015,"AIP Advances","5","9", 097150,"","",,7,10.1063/1.4931386,"https://www.scopus.com/inward/record.uri?eid=2-s2.0-84942057728&doi=10.1063%2f1.4931386&partnerID=40&md5=391ac637be3d0553ceb53238cb0e28b7",Article,Scopus,2-s2.0-84942057728
"Erten, S., Lakhtakia, A., Barber, G.D.","The circular Bragg phenomenon for oblique incidence",2015,"Proceedings of SPIE - The International Society for Optical Engineering","9371",, 93710J,"","",,,10.1117/12.2084970,"https://www.scopus.com/inward/record.uri?eid=2-s2.0-84928818255&doi=10.1117%2f12.2084970&partnerID=40&md5=640d1c66c676365f46141faca9ab1a7a",Conference Paper,Scopus,2-s2.0-84928818255
"Erten, S., Lakhtakia, A., Barber, G.D.","Experimental investigation of circular Bragg phenomenon for oblique incidence",2015,"Journal of the Optical Society of America A: Optics and Image Science, and Vision","32","5",,"764","770",,2,10.1364/JOSAA.32.000764,"https://www.scopus.com/inward/record.uri?eid=2-s2.0-84982175031&doi=10.1364%2fJOSAA.32.000764&partnerID=40&md5=e9e1d38f19c57006a0a06b052ecda370",Article,Scopus,2-s2.0-84982175031
"Fan, L., Faryad, M., Barber, G.D., Mallouk, T.E., Monk, P.B., Lakhtakia, A.","Optimization of a spectrum splitter using differential evolution algorithm for solar cell applications",2015,"Journal of Photonics for Energy","5","1", 055099,"","",,2,10.1117/1.JPE.5.055099,"https://www.scopus.com/inward/record.uri?eid=2-s2.0-84941694721&doi=10.1117%2f1.JPE.5.055099&partnerID=40&md5=2947948e75b6f925e1bb9530decd4fef",Article,Scopus,2-s2.0-84941694721
"Liu, L., Faryad, M., Hall, A.S., Barber, G.D., Erten, S., Mallouk, T.E., Lakhtakia, A., Mayer, T.S.","Experimental excitation of multiple surface-plasmon-polariton waves and waveguide modes in a one-dimensional photonic crystal atop a two-dimensional metal grating",2015,"Journal of Nanophotonics","9","1", 093593,"","",,9,10.1117/1.JNP.9.093593,"https://www.scopus.com/inward/record.uri?eid=2-s2.0-84926215008&doi=10.1117%2f1.JNP.9.093593&partnerID=40&md5=163d09d8a844d03d6845981828f85af8",Article,Scopus,2-s2.0-84926215008
"Qin, D.-D., Bi, Y.-P., Feng, X.-J., Wang, W., Barber, G.D., Wang, T., Song, Y.-M., Lu, X.-Q., Mallouk, T.E.","Hydrothermal Growth and Photoelectrochemistry of Highly Oriented, Crystalline Anatase TiO&lt;inf&gt;2&lt;/inf&gt; Nanorods on Transparent Conducting Electrodes",2015,"Chemistry of Materials","27","12",,"4180","4183",,15,10.1021/acs.chemmater.5b00782,"https://www.scopus.com/inward/record.uri?eid=2-s2.0-84934925273&doi=10.1021%2facs.chemmater.5b00782&partnerID=40&md5=0560ddd76f92d187ce37e13dfdf70380",Article,Scopus,2-s2.0-84934925273
"Swierk, J.R., McCool, N.S., Saunders, T.P., Barber, G.D., Mallouk, T.E.","Effects of electron trapping and protonation on the efficiency of water-splitting dye-sensitized solar cells",2014,"Journal of the American Chemical Society","136","31",,"10974","10982",,26,10.1021/ja5040705,"https://www.scopus.com/inward/record.uri?eid=2-s2.0-84905716489&doi=10.1021%2fja5040705&partnerID=40&md5=21c84cfdbc80cd0b5ef5a1cb30b45137",Article,Scopus,2-s2.0-84905716489
"Swierk, J.R., McCool, N.S., Saunders, T.P., Barber, G.D., Strayer, M.E., Vargas-Barbosa, N.M., Mallouk, T.E.","Photovoltage effects of sintered IrO<inf>2</inf> nanoparticle catalysts in water-splitting dye-sensitized photoelectrochemical cells",2014,"Journal of Physical Chemistry C","118","30",,"17046","17053",,19,10.1021/jp500589n,"https://www.scopus.com/inward/record.uri?eid=2-s2.0-84905472463&doi=10.1021%2fjp500589n&partnerID=40&md5=3ed6dd1e8e7cccb98f305a85c3430194",Article,Scopus,2-s2.0-84905472463
"Fan, L., Faryad, M., Barber, G.D., Mallouk, T.E., Monk, P.B., Lakhtakia, A.","Optimization of a spectrum splitter using differential evolution algorithm for solar cell applications",2014,"Proceedings of SPIE - The International Society for Optical Engineering","9191",, 91910I,"","",,,10.1117/12.2064026,"https://www.scopus.com/inward/record.uri?eid=2-s2.0-84922664030&doi=10.1117%2f12.2064026&partnerID=40&md5=d138e1b9392810e3b30540207fda15d0",Conference Paper,Scopus,2-s2.0-84922664030
"Liu, L., Faryad, M., Hall, A.S., Barber, G.D., Erten, S., Mallouk, T.E., Lakhtakia, A., Mayer, T.S.","Excitation of multiple surface-plasmon-polariton waves and waveguide modes in a 1D photonic crystal atop a 2D metal grating",2014,"Proceedings of SPIE - The International Society for Optical Engineering","9191",, 919104,"","",,,10.1117/12.2061876,"https://www.scopus.com/inward/record.uri?eid=2-s2.0-84922613882&doi=10.1117%2f12.2061876&partnerID=40&md5=ca3200a8475b75c09c2d277f00c0fbff",Conference Paper,Scopus,2-s2.0-84922613882
"Hess, A., Barber, G., Chen, C., Mallouk, T.E., Allcock, H.R.","Organophosphates as solvents for electrolytes in electrochemical devices",2013,"ACS Applied Materials and Interfaces","5","24",,"13029","13034",,6,10.1021/am403924t,"https://www.scopus.com/inward/record.uri?eid=2-s2.0-84891382836&doi=10.1021%2fam403924t&partnerID=40&md5=a54522415265d03ed423d9090622b7ca",Article,Scopus,2-s2.0-84891382836
"Hall, A.S., Faryad, M., Barber, G.D., Liu, L., Erten, S., Mayer, T.S., Lakhtakia, A., Mallouk, T.E.","Broadband light absorption with multiple surface plasmon polariton waves excited at the interface of a metallic grating and photonic crystal",2013,"ACS Nano","7","6",,"4995","5007",,29,10.1021/nn4003488,"https://www.scopus.com/inward/record.uri?eid=2-s2.0-84879677651&doi=10.1021%2fnn4003488&partnerID=40&md5=f006c5c06d9506ad514242d5abfdeb58",Article,Scopus,2-s2.0-84879677651
"Hall, A.S., Faryad, M., Barber, G.D., Lakhtakia, A., Mallouk, T.E.","Effect of grating period on the excitation of multiple surface-plasmon- polariton waves guided by the interface of a metal grating and a photonic crystal",2013,"Proceedings of SPIE - The International Society for Optical Engineering","8620",, 862003,"","",,3,10.1117/12.2005973,"https://www.scopus.com/inward/record.uri?eid=2-s2.0-84878538007&doi=10.1117%2f12.2005973&partnerID=40&md5=41746b65b5fddca5c89ecb88cd2f8f07",Conference Paper,Scopus,2-s2.0-84878538007
"Faryad, M., Hall, A.S., Barber, G.D., Mallouk, T.E., Lakhtakia, A.","Excitation of multiple surface-plasmon-polariton waves guided by the periodically corrugated interface of a metal and a periodic multilayered isotropic dielectric material",2012,"Journal of the Optical Society of America B: Optical Physics","29","4",,"704","713",,19,10.1364/JOSAB.29.000704,"https://www.scopus.com/inward/record.uri?eid=2-s2.0-84861373078&doi=10.1364%2fJOSAB.29.000704&partnerID=40&md5=cf79cd296ca202316e702ed1a281c52d",Article,Scopus,2-s2.0-84861373078
"Chen, C., Hess, A.R., Jones, A.R., Liu, X., Barber, G.D., Mallouk, T.E., Allcock, H.R.","Synthesis of new polyelectrolytes via backbone quaternization of poly(aryloxy- and alkoxyphosphazenes) and their small molecule counterparts",2012,"Macromolecules","45","3",,"1182","1189",,7,10.1021/ma202619j,"https://www.scopus.com/inward/record.uri?eid=2-s2.0-84863135684&doi=10.1021%2fma202619j&partnerID=40&md5=984eec2f66ada29710f20277f2a28727",Article,Scopus,2-s2.0-84863135684
"Barber, G.D., Hoertz, P.G., Lee, S.-H.A., Abrams, N.M., Mikulca, J., Mallouk, T.E., Liska, P., Zakeeruddin, S.M., Grätzel, M., Ho-Baillie, A., Green, M.A.","Utilization of direct and diffuse sunlight in a dye-sensitized solar cell - Silicon photovoltaic hybrid concentrator system",2011,"Journal of Physical Chemistry Letters","2","6",,"581","585",,29,10.1021/jz200112m,"https://www.scopus.com/inward/record.uri?eid=2-s2.0-79952779281&doi=10.1021%2fjz200112m&partnerID=40&md5=7ba9e0f6647998c038b66ec3caa49eed",Article,Scopus,2-s2.0-79952779281
"Kendrick, C.E., Yoon, H.P., Yuwen, Y.A., Barber, G.D., Shen, H., Mallouk, T.E., Dickey, E.C., Mayer, T.S., Redwing, J.M.","Radial junction silicon wire array solar cells fabricated by gold-catalyzed vapor-liquid-solid growth",2010,"Applied Physics Letters","97","14", 143108,"","",,71,10.1063/1.3496044,"https://www.scopus.com/inward/record.uri?eid=2-s2.0-77958033766&doi=10.1063%2f1.3496044&partnerID=40&md5=69d1c5ed0990215be0d8ad7936e6de9a",Article,Scopus,2-s2.0-77958033766
"Yoon, H.P., Yuwen, Y.A., Kendrick, C.E., Barber, G.D., Podraza, N.J., Redwing, J.M., Mallouk, T.E., Wronski, C.R., Mayer, T.S.","Enhanced conversion efficiencies for pillar array solar cells fabricated from crystalline silicon with short minority carrier diffusion lengths",2010,"Applied Physics Letters","96","21", 213503,"","",,93,10.1063/1.3432449,"https://www.scopus.com/inward/record.uri?eid=2-s2.0-77956243336&doi=10.1063%2f1.3432449&partnerID=40&md5=ce4758fe98da052077645024f70c76f8",Article,Scopus,2-s2.0-77956243336
"Lee, S.-H.A., Abrams, N.M., Hoertz, P.G., Barber, G.D., Halaoui, L.I., Mallouk, T.E.","Coupling of titania inverse opals to nanocrystalline titania layers in dye-sensitized solar cells",2008,"Journal of Physical Chemistry B","112","46",,"14415","14421",,142,10.1021/jp802692u,"https://www.scopus.com/inward/record.uri?eid=2-s2.0-57249091494&doi=10.1021%2fjp802692u&partnerID=40&md5=593203841ab407f6e7419d3b89303597",Article,Scopus,2-s2.0-57249091494
"Perez-Blanco, J.M., Barber, G.D.","Ambient atmosphere bonding of titanium foil to a transparent conductive oxide and anodic growth of titanium dioxide nanotubes",2008,"Solar Energy Materials and Solar Cells","92","9",,"997","1002",,5,10.1016/j.solmat.2008.02.041,"https://www.scopus.com/inward/record.uri?eid=2-s2.0-45049083748&doi=10.1016%2fj.solmat.2008.02.041&partnerID=40&md5=32493876e9316fb58fc815b1c248a375",Article,Scopus,2-s2.0-45049083748
"Sofo, J.O., Chaudhari, A.S., Barber, G.D.","Graphane: A two-dimensional hydrocarbon",2007,"Physical Review B - Condensed Matter and Materials Physics","75","15", 153401,"","",,1064,10.1103/PhysRevB.75.153401,"https://www.scopus.com/inward/record.uri?eid=2-s2.0-34247137175&doi=10.1103%2fPhysRevB.75.153401&partnerID=40&md5=fb01531b88c4379bf59f4cfd075d6ab7",Article,Scopus,2-s2.0-34247137175
"Barber, G.D., Yarbrough, W.A.","Growth rate of diamond on polycrystalline 〈110〉 diamond substrates from carbon disulfide in hydrogen by hot-filament-assisted chemical vapor deposition",1997,"Journal of the American Ceramic Society","80","6",,"1560","1566",,20,,"https://www.scopus.com/inward/record.uri?eid=2-s2.0-0031161909&partnerID=40&md5=3faab605ca8bc0d88284bb40579f162c",Article,Scopus,2-s2.0-0031161909
"Barber, G.D., Yarbrough, W.A.","Synthesis of Diamond from Carbon Disulfide in Hydrogen",1995,"Journal of the American Ceramic Society","78","12",,"3390","3392",,8,10.1111/j.1151-2916.1995.tb07983.x,"https://www.scopus.com/inward/record.uri?eid=2-s2.0-0029516608&doi=10.1111%2fj.1151-2916.1995.tb07983.x&partnerID=40&md5=2d1d9344ccea73799fa0095f9b354741",Article,Scopus,2-s2.0-0029516608
