Authors,Title,Year,Source title,Volume,Issue,Art. No.,Page start,Page end,Page count,Cited by,DOI,Link,Document Type,Source,EID
"Kwan, E.X., Wang, X.S., Amemiya, H.M., Brewer, B.J., Raghuraman, M.K.","rDNA copy number variants are frequent passenger mutations in saccharomyces cerevisiae deletion collections and de novo transformants",2016,"G3: Genes, Genomes, Genetics","6","9",,"2829","2838",,1,10.1534/g3.116.030296,"https://www.scopus.com/inward/record.uri?eid=2-s2.0-84994351454&doi=10.1534%2fg3.116.030296&partnerID=40&md5=664dbb9de5c1828fdac999ea0bd5f73b",Article,Scopus,2-s2.0-84994351454
"Merrikh, C.N., Brewer, B.J., Merrikh, H.","The B. subtilis Accessory Helicase PcrA Facilitates DNA Replication through Transcription Units",2015,"PLoS Genetics","11","6", e1005289,"","",25,11,10.1371/journal.pgen.1005289,"https://www.scopus.com/inward/record.uri?eid=2-s2.0-84937793079&doi=10.1371%2fjournal.pgen.1005289&partnerID=40&md5=2cbb49c2371a35f671a34e5478342953",Article,Scopus,2-s2.0-84937793079
"Brewer, B.J., Payen, C., Di Rienzi, S.C., Higgins, M.M., Ong, G., Dunham, M.J., Raghuraman, M.K.","Origin-Dependent Inverted-Repeat Amplification: Tests of a Model for Inverted DNA Amplification",2015,"PLoS Genetics","11","12", e1005699,"","",24,2,10.1371/journal.pgen.1005699,"https://www.scopus.com/inward/record.uri?eid=2-s2.0-84953321898&doi=10.1371%2fjournal.pgen.1005699&partnerID=40&md5=b424e98bcc0b654f65677565b437d883",Article,Scopus,2-s2.0-84953321898
"Hiraga, S.-I., Alvino, G.M., Chang, F., Lian, H.-Y., Sridhar, A., Kubota, T., Brewer, B.J., Weinreich, M., Raghuraman, M.K., Donaldson, A.D.","Rif1 controls DNA replication by directing Protein Phosphatase 1 to reverse Cdc7- mediated phosphorylation of the MCM complex",2014,"Genes and Development","28","4",,"372","383",,60,10.1101/gad.231258.113,"https://www.scopus.com/inward/record.uri?eid=2-s2.0-84893920696&doi=10.1101%2fgad.231258.113&partnerID=40&md5=e59c11f785fc9f85851d7864df33e3a9",Article,Scopus,2-s2.0-84893920696
"Liachko, I., Youngblood, R.A., Tsui, K., Bubb, K.L., Queitsch, C., Raghuraman, M.K., Nislow, C., Brewer, B.J., Dunham, M.J.","GC-Rich DNA Elements Enable Replication Origin Activity in the Methylotrophic Yeast Pichia pastoris",2014,"PLoS Genetics","10","3", e1004169,"","",,13,10.1371/journal.pgen.1004169,"https://www.scopus.com/inward/record.uri?eid=2-s2.0-84897385484&doi=10.1371%2fjournal.pgen.1004169&partnerID=40&md5=68ab5c01524d628542d08b94135af10a",Article,Scopus,2-s2.0-84897385484
"Payen, C., Di Rienzi, S.C., Ong, G.T., Pogachar, J.L., Sanchez, J.C., Sunshine, A.B., Raghuraman, M.K., Brewer, B.J., Dunham, M.J.","The Dynamics of Diverse Segmental Amplifications in Populations of Saccharomyces cerevisiae Adapting to Strong Selection",2014,"G3: Genes, Genomes, Genetics","4","3",,"399","409",,24,10.1534/g3.113.009365,"https://www.scopus.com/inward/record.uri?eid=2-s2.0-84897008356&doi=10.1534%2fg3.113.009365&partnerID=40&md5=1f0f6522a5faa3d796638014f2628ffe",Article,Scopus,2-s2.0-84897008356
"Kwan, E.X., Foss, E.J., Tsuchiyama, S., Alvino, G.M., Kruglyak, L., Kaeberlein, M., Raghuraman, M.K., Brewer, B.J., Kennedy, B.K., Bedalov, A.","A Natural Polymorphism in rDNA Replication Origins Links Origin Activation with Calorie Restriction and Lifespan",2013,"PLoS Genetics","9","3", e1003329,"","",,35,10.1371/journal.pgen.1003329,"https://www.scopus.com/inward/record.uri?eid=2-s2.0-84875976775&doi=10.1371%2fjournal.pgen.1003329&partnerID=40&md5=766d0affb8de279351f4dfb29811a6a1",Article,Scopus,2-s2.0-84875976775
"Pohl, T.J., Kolor, K., Fangman, W.L., Brewer, B.J., Raghuraman, M.K.","A DNA sequence element that advances replication origin activation time in saccharomyces cerevisiae",2013,"G3: Genes, Genomes, Genetics","3","11",,"1955","1963",,7,10.1534/g3.113.008250,"https://www.scopus.com/inward/record.uri?eid=2-s2.0-84888987643&doi=10.1534%2fg3.113.008250&partnerID=40&md5=5e0ad553e762d1dd83869c2edc9f2c23",Article,Scopus,2-s2.0-84888987643
"Di Rienzi, S.C., Lindstrom, K.C., Mann, T., Noble, W.S., Raghuraman, M.K., Brewer, B.J.","Maintaining replication origins in the face of genomic change",2012,"Genome Research","22","10",,"1940","1952",,28,10.1101/gr.138248.112,"https://www.scopus.com/inward/record.uri?eid=2-s2.0-84867185642&doi=10.1101%2fgr.138248.112&partnerID=40&md5=cce574a50fadd71a2b3a66c243648582",Article,Scopus,2-s2.0-84867185642
"Pohl, T.J., Brewer, B.J., Raghuraman, M.K.","Functional centromeres determine the activation time of pericentric origins of DNA replication in Saccharomyces cerevisiae",2012,"PLoS Genetics","8","5", e1002677,"","",,32,10.1371/journal.pgen.1002677,"https://www.scopus.com/inward/record.uri?eid=2-s2.0-84863643914&doi=10.1371%2fjournal.pgen.1002677&partnerID=40&md5=3e270c50476087fd3cddf138d321698a",Article,Scopus,2-s2.0-84863643914
"Feng, W., Di Rienzi, S.C., Raghuraman, M.K., Brewer, B.J.","Replication stress-induced chromosome breakage is correlated with replication fork progression and is preceded by single-stranded DNA formation",2011,"G3: Genes, Genomes, Genetics","1","5",,"327","335",,23,10.1534/g3.111.000554,"https://www.scopus.com/inward/record.uri?eid=2-s2.0-84868130069&doi=10.1534%2fg3.111.000554&partnerID=40&md5=1dfb9ca968c6453d7ab0e5dc4553b408",Article,Scopus,2-s2.0-84868130069
"Lian, H.-Y., Robertson, E.D., Hiraga, S.-I., Alvino, G.M., Collingwood, D., McCune, H.J., Sridhar, A., Brewer, B.J., Raghuraman, M.K., Donaldson, A.D.","The effect of Ku on telomere replication time is mediated by telomere length but is independent of histone tail acetylation",2011,"Molecular Biology of the Cell","22","10",,"1753","1765",,42,10.1091/mbc.E10-06-0549,"https://www.scopus.com/inward/record.uri?eid=2-s2.0-79955957615&doi=10.1091%2fmbc.E10-06-0549&partnerID=40&md5=854be8fb5ae709288eef0a366c88df48",Article,Scopus,2-s2.0-79955957615
"Brewer, B.J., Payen, C., Raghuraman, M.K., Dunham, M.J.","Origin-dependent inverted-repeat amplification: A replication-based model for generating palindromic amplicons",2011,"PLoS Genetics","7","3", e1002016,"","",,24,10.1371/journal.pgen.1002016,"https://www.scopus.com/inward/record.uri?eid=2-s2.0-79953747267&doi=10.1371%2fjournal.pgen.1002016&partnerID=40&md5=8a19f0538143df1bce6a9a16a91a766d",Article,Scopus,2-s2.0-79953747267
"Di Rienzi, S.C., Lindstrom, K.C., Lancaster, R., Rolczynski, L., Raghuraman, M.K., Brewer, B.J.","Genetic, genomic, and molecular tools for studying the protoploid yeast, L. waltii",2011,"Yeast","28","2",,"137","151",,10,10.1002/yea.1826,"https://www.scopus.com/inward/record.uri?eid=2-s2.0-78751510883&doi=10.1002%2fyea.1826&partnerID=40&md5=ec539f287189c0eff29eb49b2c07a8bd",Article,Scopus,2-s2.0-78751510883
"Raghuraman, M.K., Brewer, B.J.","Molecular analysis of the replication program in unicellular model organisms",2010,"Chromosome Research","18","1",,"19","34",,26,10.1007/s10577-009-9099-x,"https://www.scopus.com/inward/record.uri?eid=2-s2.0-77649233017&doi=10.1007%2fs10577-009-9099-x&partnerID=40&md5=0b40086fa29fabaddfd78f57660b99d3",Review,Scopus,2-s2.0-77649233017
"Feng, W., Bachant, J., Collingwood, D., Raghuraman, M.K., Brewer, B.J.","Centromere replication timing determines different forms of genomic instability in Saccharomyces cerevisiae checkpoint mutants during replication stress",2009,"Genetics","183","4",,"1249","1260",,30,10.1534/genetics.109.107508,"https://www.scopus.com/inward/record.uri?eid=2-s2.0-71549122891&doi=10.1534%2fgenetics.109.107508&partnerID=40&md5=58f5da7bbaa6d437fe3cdfa0f50f5f47",Article,Scopus,2-s2.0-71549122891
"McCune, H.J., Danielson, L.S., Alvino, G.M., Collingwood, D., Delrow, J.J., Fangman, W.L., Brewer, B.J., Raghuraman, M.K.","The temporal program of chromosome replication: Genomewide replication in clb5Δ Saccharomyces cerevisiae",2008,"Genetics","180","4",,"1833","1847",,69,10.1534/genetics.108.094359,"https://www.scopus.com/inward/record.uri?eid=2-s2.0-61849083545&doi=10.1534%2fgenetics.108.094359&partnerID=40&md5=ca4199140bf7a890a70990e45a1bfe0f",Article,Scopus,2-s2.0-61849083545
"Hoang, M.L., Leon, R.P., Pessoa-Brandao, L., Hunt, S., Raghuraman, M.K., Fangman, W.L., Brewer, B.J., Sclafani, R.A.","Structural changes in Mcm5 protein bypass Cdc7-Dbf4 function and reduce replication origin efficiency in Saccharomyces cerevisiae",2007,"Molecular and Cellular Biology","27","21",,"7594","7602",,32,10.1128/MCB.00997-07,"https://www.scopus.com/inward/record.uri?eid=2-s2.0-35648944221&doi=10.1128%2fMCB.00997-07&partnerID=40&md5=fea115d21e14b32df57c6d244c31809e",Article,Scopus,2-s2.0-35648944221
"Alvino, G.M., Collingwood, D., Murphy, J.M., Delrow, J., Brewer, B.J., Raghuraman, M.K.","Replication in hydroxyurea: It's a matter of time",2007,"Molecular and Cellular Biology","27","18",,"6396","6406",,129,10.1128/MCB.00719-07,"https://www.scopus.com/inward/record.uri?eid=2-s2.0-34548789595&doi=10.1128%2fMCB.00719-07&partnerID=40&md5=c376e80a9066419ed49419e9b38e27ae",Article,Scopus,2-s2.0-34548789595
"Feng, W., Raghuraman, M.K., Brewer, B.J.","Mapping yeast origins of replication via single-stranded DNA detection",2007,"Methods","41","2",,"151","157",,8,10.1016/j.ymeth.2006.07.023,"https://www.scopus.com/inward/record.uri?eid=2-s2.0-33845676749&doi=10.1016%2fj.ymeth.2006.07.023&partnerID=40&md5=ff7f4ef76070ea0a534987f09705999c",Article,Scopus,2-s2.0-33845676749
"Feng, W., Collingwood, D., Boeck, M.E., Fox, L.A., Alvino, G.M., Fangman, W.L., Raghuraman, M.K., Brewer, B.J.","Genomic mapping of single-stranded DNA in hydroxyurea-challenged yeasts identifies origins of replication",2006,"Nature Cell Biology","8","2",,"148","155",,156,10.1038/ncb1358,"https://www.scopus.com/inward/record.uri?eid=2-s2.0-33645152790&doi=10.1038%2fncb1358&partnerID=40&md5=a74c406b306705a9056b9a8da79acbeb",Article,Scopus,2-s2.0-33645152790
"Vogelauer, M., Rubbi, L., Lucas, I., Brewer, B.J., Grunstein, M.","Histone acetylation regulates the time of replication origin firing",2002,"Molecular Cell","10","5",,"1223","1233",,281,10.1016/S1097-2765(02)00702-5,"https://www.scopus.com/inward/record.uri?eid=2-s2.0-0036863542&doi=10.1016%2fS1097-2765%2802%2900702-5&partnerID=40&md5=3227e7753a87dc0d102945f183c88b1d",Article,Scopus,2-s2.0-0036863542
"Raghuraman, M.K., Winzeler, E.A., Collingwood, D., Hunt, S., Wodicka, L., Conway, A., Lockhart, D.J., Davis, R.W., Brewer, B.J., Fangman, W.L.","Replication dynamics of the yeast genome",2001,"Science","294","5540",,"115","121",,510,10.1126/science.294.5540.115,"https://www.scopus.com/inward/record.uri?eid=2-s2.0-0035812808&doi=10.1126%2fscience.294.5540.115&partnerID=40&md5=65687c881432a0e217e80f9da5859484",Article,Scopus,2-s2.0-0035812808
"Van Brabant, A.J., Buchanan, C.D., Charboneau, E., Fangman, W.L., Brewer, B.J.","An origin-deficient yeast artificial chromosome triggers a cell cycle checkpoint",2001,"Molecular Cell","7","4",,"705","713",,38,10.1016/S1097-2765(01)00216-7,"https://www.scopus.com/inward/record.uri?eid=2-s2.0-0035012653&doi=10.1016%2fS1097-2765%2801%2900216-7&partnerID=40&md5=fec285825f1ba64a69ea77a1bf4e92c6",Article,Scopus,2-s2.0-0035012653
"Ward, T.R., Hoang, M.L., Prusty, R., Lau, C.K., Keil, R.L., Fangman, W.L., Brewer, B.J.","Ribosomal DNA replication fork barrier and HOT1 recombination hot spot: Shared sequences but independent activities",2000,"Molecular and Cellular Biology","20","13",,"4948","4957",,49,10.1128/MCB.20.13.4948-4957.2000,"https://www.scopus.com/inward/record.uri?eid=2-s2.0-0034085624&doi=10.1128%2fMCB.20.13.4948-4957.2000&partnerID=40&md5=bf939dc34a30a8899649f199f9e5b448",Article,Scopus,2-s2.0-0034085624
"Van Brabant, A.J., Fangman, W.L., Brewer, B.J.","Active role of a human genomic insert in replication of a yeast artificial chromosome",1999,"Molecular and Cellular Biology","19","6",,"4231","4240",,10,,"https://www.scopus.com/inward/record.uri?eid=2-s2.0-0033050070&partnerID=40&md5=d7212fdb04bd803a346e105cefa626df",Article,Scopus,2-s2.0-0033050070
"Donaldson, A.D., Raghuraman, M.K., Friedman, K.L., Cross, F.R., Brewer, B.J., Fangman, W.L.","CLB5-dependent activation of late replication origins in S. cerevisiae",1998,"Molecular Cell","2","2",,"173","182",,148,,"https://www.scopus.com/inward/record.uri?eid=2-s2.0-0032134456&partnerID=40&md5=54b6199b4ef41b6d218f2d22916b06df",Article,Scopus,2-s2.0-0032134456
"Van Brabant, A.J., Hunt, S.Y., Fangman, W.L., Brewer, B.J.","Identifying sites of replication initiation in yeast chromosomes: Looking for origins in all the right places",1998,"Electrophoresis","19","8-9",,"1239","1246",,10,10.1002/elps.1150190803,"https://www.scopus.com/inward/record.uri?eid=2-s2.0-0031860955&doi=10.1002%2felps.1150190803&partnerID=40&md5=87906a8a8f2cebf9ce23942da0f82f03",Conference Paper,Scopus,2-s2.0-0031860955
"Donaldson, A.D., Fangman, W.L., Brewer, B.J.","Cdc7 is required throughout the yeast S phase to activate replication origins",1998,"Genes and Development","12","4",,"491","501",,169,,"https://www.scopus.com/inward/record.uri?eid=2-s2.0-0032520181&partnerID=40&md5=dc8143284d0cf183e72094b7830e68be",Article,Scopus,2-s2.0-0032520181
"Friedman, K.L., Brewer, B.J., Fangman, W.L., Yamamoto, M.","Replication profile of Saccharomyces cerevisiae chromosome VI",1997,"Genes to Cells","2","11",,"667","678",,137,,"https://www.scopus.com/inward/record.uri?eid=2-s2.0-0031265756&partnerID=40&md5=63a249e4ad5d12dfd8e50c30f35a1365",Article,Scopus,2-s2.0-0031265756
"Raghuraman, M.K., Brewer, B.J., Fangman, W.L.","Cell cycle-dependent establishment of a late replication program",1997,"Science","276","5313",,"806","809",,122,10.1126/science.276.5313.806,"https://www.scopus.com/inward/record.uri?eid=2-s2.0-0031005357&doi=10.1126%2fscience.276.5313.806&partnerID=40&md5=d33bb8507d5f482d518583abc5a97b76",Article,Scopus,2-s2.0-0031005357
"Friedman, K.L., Diller, J.D., Ferguson, B.M., Nyland, S.V.M., Brewer, B.J., Fangman, W.L.","Multiple determinants controlling activation of yeast replication origins late in S phase",1996,"Genes and Development","10","13",,"1595","1607",,127,,"https://www.scopus.com/inward/record.uri?eid=2-s2.0-0029781449&partnerID=40&md5=fbac0496300b31032fa7ed54eac21cbf",Article,Scopus,2-s2.0-0029781449
"Lockshon, D., Zweifel, S.G., Freeman-Cook, L.L., Lorimer, H.E., Brewer, B.J., Fangman, W.L.","A role for recombination junctions in the segregation of mitochondrial DNA in yeast",1995,"Cell","81","6",,"947","955",,131,10.1016/0092-8674(95)90014-4,"https://www.scopus.com/inward/record.uri?eid=2-s2.0-0029060751&doi=10.1016%2f0092-8674%2895%2990014-4&partnerID=40&md5=f25e5fb92430a033f19cf266aeabdd99",Article,Scopus,2-s2.0-0029060751
"Friedman, K.L., Brewer, B.J.","Analysis of Replication Intermediates by Two-Dimensional Agarose Gel Electrophoresis",1995,"Methods in Enzymology","262","C",,"613","627",,176,10.1016/0076-6879(95)62048-6,"https://www.scopus.com/inward/record.uri?eid=2-s2.0-0028851598&doi=10.1016%2f0076-6879%2895%2962048-6&partnerID=40&md5=110009a7c3be66e9cc4cfd673d1f0c19",Article,Scopus,2-s2.0-0028851598
"Lorimer, H.E., Brewer, B.J., Fangman, W.L.","A test of the transcription model for biased inheritance of yeast mitochondrial DNA",1995,"Molecular and Cellular Biology","15","9",,"4803","4809",,31,,"https://www.scopus.com/inward/record.uri?eid=2-s2.0-0029147736&partnerID=40&md5=7fa3a61c45cb96019867627fb42232df",Article,Scopus,2-s2.0-0029147736
"Friedman, K.L., Raghuraman, M.K., Fangman, W.L., Brewer, B.J.","Analysis of the temporal program of replication initiation in yeast chromosomes",1995,"Journal of Cell Science","108","SUPPL. 19",,"51","58",,22,,"https://www.scopus.com/inward/record.uri?eid=2-s2.0-0029441492&partnerID=40&md5=26da9ba11875a33c183f0954d78790a0",Article,Scopus,2-s2.0-0029441492
"Brewer, B.J., Fangman, W.L.","Initiation preference at a yeast origin of replication",1994,"Proceedings of the National Academy of Sciences of the United States of America","91","8",,"3418","3422",,53,,"https://www.scopus.com/inward/record.uri?eid=2-s2.0-0028346546&partnerID=40&md5=e8baa670d53d76b35db9f5f15828fe06",Article,Scopus,2-s2.0-0028346546
"Raghuraman, M.K., Brewer, B.J., Fangman, W.L.","Activation of a yeast replication origin near a double-stranded DNA break",1994,"Genes and Development","8","5",,"554","562",,26,,"https://www.scopus.com/inward/record.uri?eid=2-s2.0-0028229994&partnerID=40&md5=b330622ff13c4d9314f77cb34fa9e899",Article,Scopus,2-s2.0-0028229994
"Brewer, B.J.","Intergenic DNA and the sequence requirements for replication initiation in eukaryotes",1994,"Current Opinion in Genetics and Development","4","2",,"196","202",,27,10.1016/S0959-437X(05)80045-0,"https://www.scopus.com/inward/record.uri?eid=2-s2.0-0028314982&doi=10.1016%2fS0959-437X%2805%2980045-0&partnerID=40&md5=069f826d0bf065a02b11ecf876110390",Article,Scopus,2-s2.0-0028314982
"Brewer, B.J., Fangman, W.L.","Initiation at closely spaced replication origins in a yeast chromosome",1993,"Science","262","5140",,"1728","1731",,78,,"https://www.scopus.com/inward/record.uri?eid=2-s2.0-0027731437&partnerID=40&md5=3f4a0f94a9a20dc11cf12e077a210a95",Article,Scopus,2-s2.0-0027731437
"Brewer, B.J., Diller, J.D., Friedman, K.L., Kolor, K.M., Raghuraman, M.K., Fangman, W.L.","The topography of chromosome replication in yeast",1993,"Cold Spring Harbor Symposia on Quantitative Biology","58",,,"425","434",,20,,"https://www.scopus.com/inward/record.uri?eid=2-s2.0-0027820572&partnerID=40&md5=a4c121b7d4c25c6df40694f895395a15",Conference Paper,Scopus,2-s2.0-0027820572
"Fangman, W.L., Brewer, B.J.","A question of time: Replication origins of eukaryotic chromosomes",1992,"Cell","71","3",,"363","366",,98,10.1016/0092-8674(92)90505-7,"https://www.scopus.com/inward/record.uri?eid=2-s2.0-0026492019&doi=10.1016%2f0092-8674%2892%2990505-7&partnerID=40&md5=4f3a94ab19d1a43159481cab3af00a6f",Short Survey,Scopus,2-s2.0-0026492019
"Brewer, B.J., Lockshon, D., Fangman, W.L.","The arrest of replication forks in the rDNA of yeast occurs independently of transcription",1992,"Cell","71","2",,"267","276",,165,10.1016/0092-8674(92)90355-G,"https://www.scopus.com/inward/record.uri?eid=2-s2.0-0026645804&doi=10.1016%2f0092-8674%2892%2990355-G&partnerID=40&md5=0a98db742a389c4574a6d565a649c354",Article,Scopus,2-s2.0-0026645804
"Ferguson, B.M., Brewer, B.J., Fangman, W.L.","Temporal control of DNA replication in yeast",1991,"Cold Spring Harbor Symposia on Quantitative Biology","56",,,"293","302",,8,,"https://www.scopus.com/inward/record.uri?eid=2-s2.0-0026399093&partnerID=40&md5=aec309747692eb824c790687be1d87ac",Conference Paper,Scopus,2-s2.0-0026399093
"Ferguson, B.M., Brewer, B.J., Reynolds, A.E., Fangman, W.L.","A yeast origin of replication is activated late in S phase",1991,"Cell","65","3",,"507","515",,132,10.1016/0092-8674(91)90468-E,"https://www.scopus.com/inward/record.uri?eid=2-s2.0-0025756992&doi=10.1016%2f0092-8674%2891%2990468-E&partnerID=40&md5=7b5eff694be635b6bc171d7906383933",Article,Scopus,2-s2.0-0025756992
"Fangman, W.L., Brewer, B.J.","Activation of replication origins within yeast chromosomes",1991,"Annual Review of Cell Biology","7",,,"375","402",,110,,"https://www.scopus.com/inward/record.uri?eid=2-s2.0-0025719475&partnerID=40&md5=89a7150ad8d2c4a089ecf26f81d2cd46",Review,Scopus,2-s2.0-0025719475
"Brewer, B.J., Fangman, W.L.","Mapping replication origins in yeast chromosomes",1991,"BioEssays","13","7",,"317","322",,63,10.1002/bies.950130702,"https://www.scopus.com/inward/record.uri?eid=2-s2.0-0026193910&doi=10.1002%2fbies.950130702&partnerID=40&md5=72481f0f774b79f03d74ad4470480907",Review,Scopus,2-s2.0-0026193910
"Fangman, W.L., Henly, J.W., Brewer, B.J.","RPO41-independent maintenance of [rho-] mitochondrial DNA in Saccharomyces cerevisiae",1990,"Molecular and Cellular Biology","10","1",,"10","15",,45,,"https://www.scopus.com/inward/record.uri?eid=2-s2.0-0025192467&partnerID=40&md5=3c2285e41aa1edd9ef96d278416467fa",Article,Scopus,2-s2.0-0025192467
"Fangman, W.L., Henly, J.W., Churchill, G., Brewer, B.J.","Stable maintenance of a 35-base-pair yeast mitochondrial genome",1989,"Molecular and Cellular Biology","9","5",,"1917","1921",,44,,"https://www.scopus.com/inward/record.uri?eid=2-s2.0-0024582669&partnerID=40&md5=43db99ce3ba35141f634dd0afb9de35f",Article,Scopus,2-s2.0-0024582669
"Brewer, B.J., Fangman, W.L.","A replication fork barrier at the 3′ end of yeast ribosomal RNA genes",1988,"Cell","55","4",,"637","643",,318,10.1016/0092-8674(88)90222-X,"https://www.scopus.com/inward/record.uri?eid=2-s2.0-0024291357&doi=10.1016%2f0092-8674%2888%2990222-X&partnerID=40&md5=4c36d45ac50ef1436e7d68502409f54e",Article,Scopus,2-s2.0-0024291357
"Brewer, B.J.","When polymerases collide: Replication and the transcriptional organization of the E. coli chromosome",1988,"Cell","53","5",,"679","686",,233,10.1016/0092-8674(88)90086-4,"https://www.scopus.com/inward/record.uri?eid=2-s2.0-0024276903&doi=10.1016%2f0092-8674%2888%2990086-4&partnerID=40&md5=8b6f9b8c47194297bb5ac49a7ca1ad99",Review,Scopus,2-s2.0-0024276903
"Brewer, B.J., Fangman, W.L.","The localization of replication origins on ARS plasmids in S. cerevisiae",1987,"Cell","51","3",,"463","471",,689,10.1016/0092-8674(87)90642-8,"https://www.scopus.com/inward/record.uri?eid=2-s2.0-0023646792&doi=10.1016%2f0092-8674%2887%2990642-8&partnerID=40&md5=6f72e22228f5f8e958b76b34e6e2f87c",Article,Scopus,2-s2.0-0023646792
"Brewer, B.J., Chlebowicz-Sledziewska, E., Fangman, W.L.","Cell cycle phases in the unequal mother/daughter cell cycles of Saccharomyces cerevisiae",1984,"Molecular and Cellular Biology","4","11",,"2529","2531",,38,,"https://www.scopus.com/inward/record.uri?eid=2-s2.0-0021690298&partnerID=40&md5=59fe070cfd0be02c89eb17972ba60df0",Article,Scopus,2-s2.0-0021690298
"Brewer, B.J., Martin, S.R., Champoux, J.J.","A cellular single-stranded DNA-dependent ATPase associated with simian virus 40 chromatin.",1983,"Journal of Biological Chemistry","258","7",,"4496","4502",,5,,"https://www.scopus.com/inward/record.uri?eid=2-s2.0-0021099380&partnerID=40&md5=d997b46e471efa7a793b88e992434f66",Article,Scopus,2-s2.0-0021099380
"Brewer, B.J., Fangman, W.L.","Preferential inclusion of extrachromosomal genetic elements in yeast meiotic spores",1980,"Proceedings of the National Academy of Sciences of the United States of America","77","9 II",,"5380","5384",,29,,"https://www.scopus.com/inward/record.uri?eid=2-s2.0-0019138107&partnerID=40&md5=8fbb9029b93b9596218376d6d019e9ea",Article,Scopus,2-s2.0-0019138107
"Brewer, B.J., Zakian, V.A., Fangman, W.L.","Replication and meiotic transmission of yeast ribosomal RNA genes",1980,"Proceedings of the National Academy of Sciences of the United States of America","77","11 I",,"6739","6743",,18,,"https://www.scopus.com/inward/record.uri?eid=2-s2.0-0019256392&partnerID=40&md5=ab2a91bd9de4d20a660b4ecf442ae4b9",Article,Scopus,2-s2.0-0019256392
"Zakian, V.A., Brewer, B.J., Fangman, W.L.","Replication of each copy of the yeast 2 micron DNA plasmid occurs during the S phase",1979,"Cell","17","4",,"923","934",,108,10.1016/0092-8674(79)90332-5,"https://www.scopus.com/inward/record.uri?eid=2-s2.0-0018291839&doi=10.1016%2f0092-8674%2879%2990332-5&partnerID=40&md5=814663c4d39ac33d2a778ddb4c8d32e0",Article,Scopus,2-s2.0-0018291839
