Authors,Title,Year,Source title,Volume,Issue,Art. No.,Page start,Page end,Page count,Cited by,DOI,Link,Document Type,Source,EID
"Lyda, T.A., Wagner, E.L., Bourg, A.X., Peng, C., Tomaraei, G.N., Dean, D., Kennedy, M.S., Marcotte, W.R.","A Leishmania secretion system for the expression of major ampullate spidroin mimics",2017,"PLoS ONE","12","5", e0178201,"","",,,10.1371/journal.pone.0178201,"https://www.scopus.com/inward/record.uri?eid=2-s2.0-85019560890&doi=10.1371%2fjournal.pone.0178201&partnerID=40&md5=fd77121855f89494ac3c448afca3afd5",Article,Scopus,2-s2.0-85019560890
"Chowdhury, A.N., Vo, H.T., Olang, S., Mappus, E., Peterson, B., Hlavac, N., Harvey, T., Dean, D.","A customizable chamber for measuring cell migration",2017,"Journal of Visualized Experiments","2017","121", e55264,"","",,,10.3791/55264,"https://www.scopus.com/inward/record.uri?eid=2-s2.0-85017139829&doi=10.3791%2f55264&partnerID=40&md5=c318b679eeec29bf4bc763ec0f18dbc4",Article,Scopus,2-s2.0-85017139829
"Kawano, S.M., Economy, D.R., Kennedy, M.S., Dean, D., Blob, R.W.","Comparative limb bone loading in the humerus and femur of the tiger salamander: Testing the 'mixed-chain' hypothesis for skeletal safety factors",2016,"Journal of Experimental Biology","219","3",,"341","353",,2,10.1242/jeb.125799,"https://www.scopus.com/inward/record.uri?eid=2-s2.0-84962562564&doi=10.1242%2fjeb.125799&partnerID=40&md5=52c6f70bb111d37b31d5f54adaabbe79",Article,Scopus,2-s2.0-84962562564
"Lance, A., Yang, C.-C., Swamydas, M., Dean, D., Deitch, S., Burg, K.J.L., Dréau, D.","Increased extracellular matrix density decreases MCF10A breast cell acinus formation in 3D culture conditions",2016,"Journal of Tissue Engineering and Regenerative Medicine","10","1",,"71","80",,1,10.1002/term.1675,"https://www.scopus.com/inward/record.uri?eid=2-s2.0-84954401453&doi=10.1002%2fterm.1675&partnerID=40&md5=56035a5c4fc38352d3a29223ecc652c0",Article,Scopus,2-s2.0-84954401453
"Catoe, J., Hafner, K., Maeser, H., Ross, O., Kays, L., Stoner, C., Ellison, M., Dean, D., Kennedy, M.","Understanding factors influencing cellular response to spider silk",2016,"Fiber Society 2016 Spring Conference: Textile Innovations - Opportunities and Challenges",,,,"","",,,,"https://www.scopus.com/inward/record.uri?eid=2-s2.0-85014097198&partnerID=40&md5=12b273ae2610dfeb43c3c3a574e230e6",Conference Paper,Scopus,2-s2.0-85014097198
"Gainey Wilson, K., Ovington, P., Dean, D.","A Low-Cost Inkjet-Printed Glucose Test Strip System for Resource-Poor Settings",2015,"Journal of diabetes science and technology","9","6",,"1275","1281",,2,10.1177/1932296815589755,"https://www.scopus.com/inward/record.uri?eid=2-s2.0-85018235027&doi=10.1177%2f1932296815589755&partnerID=40&md5=d1992ac1da7efccaf487b165f25f5100",Article,Scopus,2-s2.0-85018235027
"Medlin, D., Heffron, W., Siegel, A., Wilson, K., Klingenberger, A., Gall, A., Rusin, M., Dean, D., Takacs, E.","Development of an x-ray irradiation port for biomedical applications at the CUEBIT facility",2015,"Journal of Physics: Conference Series","583",, 012048,"","",,1,10.1088/1742-6596/583/1/012048,"https://www.scopus.com/inward/record.uri?eid=2-s2.0-84938493753&doi=10.1088%2f1742-6596%2f583%2f1%2f012048&partnerID=40&md5=616f3e4eaacdca0b148a3adc87f4a9df",Conference Paper,Scopus,2-s2.0-84938493753
"Klingenberger, J., Schott, M., Kimmel, T., Medlin, D., Gall, A., Rusin, M., Dean, D., Takacs, E.","Modeling low energy x-ray interactions with biological material at the CUEBIT",2015,"Journal of Physics: Conference Series","583",, 012046,"","",,,10.1088/1742-6596/583/1/012046,"https://www.scopus.com/inward/record.uri?eid=2-s2.0-84938505147&doi=10.1088%2f1742-6596%2f583%2f1%2f012046&partnerID=40&md5=f3334dbc14ffc48afe10a507e25b9f94",Conference Paper,Scopus,2-s2.0-84938505147
"Rojas, F.P., Batista, M.A., Lindburg, C.A., Dean, D., Grodzinsky, A.J., Ortiz, C., Han, L.","Molecular adhesion between cartilage extracellular matrix macromolecules",2014,"Biomacromolecules","15","3",,"772","780",,4,10.1021/bm401611b,"https://www.scopus.com/inward/record.uri?eid=2-s2.0-84896783730&doi=10.1021%2fbm401611b&partnerID=40&md5=a550ad2e03e1abcfc43b38fa5a9cbcbe",Article,Scopus,2-s2.0-84896783730
"Liu, H., Chen, R., Yang, H., Qin, W., Borg, T.K., Dean, D., Xu, M., Gao, B.Z.","Enzyme-etching technique to fabricate micropatterns of aligned collagen fibrils",2014,"Biotechnology Letters","36","6",,"1245","1252",,,10.1007/s10529-014-1469-6,"https://www.scopus.com/inward/record.uri?eid=2-s2.0-84899973366&doi=10.1007%2fs10529-014-1469-6&partnerID=40&md5=3a818f1351a2322cc6b4c45f441e7823",Article,Scopus,2-s2.0-84899973366
"Lindburg, C.A., Willey, J.S., Dean, D.","Effects of low dose X-ray irradiation on porcine articular cartilage explants",2013,"Journal of Orthopaedic Research","31","11",,"1780","1785",,5,10.1002/jor.22406,"https://www.scopus.com/inward/record.uri?eid=2-s2.0-84884904814&doi=10.1002%2fjor.22406&partnerID=40&md5=f2cca224658db4ae635a759b2547b95b",Article,Scopus,2-s2.0-84884904814
"Luedicke, N., Burghardt, E., Hodge, J., Thomas, R., Barrett, A., Nagatomi, J., Dean, D.","Novel central venous catheterization simulation for medical training",2013,"Proceedings - 29th Southern Biomedical Engineering Conference, SBEC 2013",,, 6525692,"93","94",,,10.1109/SBEC.2013.55,"https://www.scopus.com/inward/record.uri?eid=2-s2.0-84880911267&doi=10.1109%2fSBEC.2013.55&partnerID=40&md5=a5117df2cd6e55eae4cb607693d56450",Conference Paper,Scopus,2-s2.0-84880911267
"Trent, E.A., Bailey, L., Meeh, F., Raikar, V.P., Shanley, E., Thigpen, C.A., Dean, D., Kwartowitz, D.M.","Assessment and characterization of in situ rotator cuff biomechanics",2013,"Progress in Biomedical Optics and Imaging - Proceedings of SPIE","8672",, 86721M,"","",,2,10.1117/12.2007437,"https://www.scopus.com/inward/record.uri?eid=2-s2.0-84878295719&doi=10.1117%2f12.2007437&partnerID=40&md5=9282bedb95d1e1a23ad1671c17b838dc",Conference Paper,Scopus,2-s2.0-84878295719
"Wood, S.T., Dean, B.C., Dean, D.","A linear programming approach to reconstructing subcellular structures from confocal images for automated generation of representative 3D cellular models",2013,"Medical Image Analysis","17","3",,"337","347",,7,10.1016/j.media.2012.12.002,"https://www.scopus.com/inward/record.uri?eid=2-s2.0-84875260191&doi=10.1016%2fj.media.2012.12.002&partnerID=40&md5=2c94a879653d3b1e6ffa6afe397d9499",Article,Scopus,2-s2.0-84875260191
"Wood, S.T., Dean, B.C., Dean, D.","A computational approach to understand phenotypic structure and constitutive mechanics relationships of single cells",2013,"Annals of Biomedical Engineering","41","3",,"630","644",,2,10.1007/s10439-012-0690-5,"https://www.scopus.com/inward/record.uri?eid=2-s2.0-84876195211&doi=10.1007%2fs10439-012-0690-5&partnerID=40&md5=adf555e0c49ce72d27da49621855729e",Article,Scopus,2-s2.0-84876195211
"Tan, H., Biechler, S., Junor, L., Yost, M.J., Dean, D., Li, J., Potts, J.D., Goodwin, R.L.","Fluid flow forces and rhoA regulate fibrous development of the atrioventricular valves",2013,"Developmental Biology","374","2",,"345","356",,19,10.1016/j.ydbio.2012.11.023,"https://www.scopus.com/inward/record.uri?eid=2-s2.0-84872947606&doi=10.1016%2fj.ydbio.2012.11.023&partnerID=40&md5=4744c3ced393f2c724a8d44e99ba36d8",Article,Scopus,2-s2.0-84872947606
"Faugas, B., Ellison, M., Kennedy, M., Dean, D.","Characterization of nephila clavipes dragline surface II: Amino acid mapping",2013,"International Symposium on Fibers Interfacing the World",,,,"","",,,,"https://www.scopus.com/inward/record.uri?eid=2-s2.0-84969776679&partnerID=40&md5=c8763d72cd6b8837cc6a5285cf445fc6",Conference Paper,Scopus,2-s2.0-84969776679
"Deitch, S., Gao, B.Z., Dean, D.","Effect of matrix on cardiomyocyte viscoelastic properties in 2D culture",2012,"MCB Molecular and Cellular Biomechanics","9","3",,"227","249",,2,,"https://www.scopus.com/inward/record.uri?eid=2-s2.0-84872473990&partnerID=40&md5=961716352e38b699dfa04f71bfd47344",Article,Scopus,2-s2.0-84872473990
"Owczarczak, A.B., Shuford, S.O., Wood, S.T., Deitch, S., Dean, D.","Creating transient cell membrane pores using a standard inkjet printer.",2012,"Journal of visualized experiments : JoVE",,"61",,"","",,1,,"https://www.scopus.com/inward/record.uri?eid=2-s2.0-84862599597&partnerID=40&md5=6410d70b758bd648b941ec6035d11ffb",Article,Scopus,2-s2.0-84862599597
"Von White, G., Kerscher, P., Brown, R.M., Morella, J.D., McAllister, W., Dean, D., Kitchens, C.L.","Green synthesis of robust, biocompatible silver nanoparticles using garlic extract",2012,"Journal of Nanomaterials","2012",, 730746,"","",,29,10.1155/2012/730746,"https://www.scopus.com/inward/record.uri?eid=2-s2.0-84862275863&doi=10.1155%2f2012%2f730746&partnerID=40&md5=7e91e6673fd232ec1aad8f3510c629c2",Article,Scopus,2-s2.0-84862275863
"Faugas, B., Ellison, M., Kennedy, M., Dean, D.","Surface roughness characterization of Nephila Clavipes dragline silk with atomic force microscopy",2012,"Fiber Society 2012 Spring Conference: Fiber Research for Tomorrow's Applications",,,,"","",,,,"https://www.scopus.com/inward/record.uri?eid=2-s2.0-84903187456&partnerID=40&md5=70c4ea5bb13e10a4fd4a36edee8da1d6",Conference Paper,Scopus,2-s2.0-84903187456
"Zimmerman, B., Chow, J., Abbott, A.G., Ellison, M.S., Kennedy, M.S., Dean, D.","Variation of surface charge along the surface of wool fibers assessed by high-resolution force spectroscopy",2011,"Journal of Engineered Fibers and Fabrics","6","2",,"61","66",,2,,"https://www.scopus.com/inward/record.uri?eid=2-s2.0-79958182006&partnerID=40&md5=4d8ff2f0becae7ff75dafb54df5409df",Article,Scopus,2-s2.0-79958182006
"Dean, D., Hemmer, J., Vertegel, A., LaBerge, M.","Frictional behavior of individual vascular smooth muscle cells assessed by lateral force microscopy",2010,"Materials","3","9",,"4668","4680",,5,10.3390/ma3094668,"https://www.scopus.com/inward/record.uri?eid=2-s2.0-84865830450&doi=10.3390%2fma3094668&partnerID=40&md5=904fe29f3108742043f4c072c5fc5976",Article,Scopus,2-s2.0-84865830450
"Cui, X., Dean, D., Ruggeri, Z.M., Boland, T.","Cell damage evaluation of thermal inkjet printed chinese hamster ovary cells",2010,"Biotechnology and Bioengineering","106","6",,"963","969",,90,10.1002/bit.22762,"https://www.scopus.com/inward/record.uri?eid=2-s2.0-77955689253&doi=10.1002%2fbit.22762&partnerID=40&md5=7ae0f54e37738e30159ffad083af4a3d",Article,Scopus,2-s2.0-77955689253
"Zimmerman, B., Datko, L., Cupelli, M., Alapati, S., Dean, D., Kennedy, M.","Alteration of dentin-enamel mechanical properties due to dental whitening treatments",2010,"Journal of the Mechanical Behavior of Biomedical Materials","3","4",,"339","346",,17,10.1016/j.jmbbm.2010.01.005,"https://www.scopus.com/inward/record.uri?eid=2-s2.0-77949659632&doi=10.1016%2fj.jmbbm.2010.01.005&partnerID=40&md5=6ca40b25c6efb24c050593fdad0f0096",Article,Scopus,2-s2.0-77949659632
"Zimmerman, B., Chow, J., Abbott, B., Ellison, M., Kennedy, M., Dean, D.","Wool fiber surface high-resolution force spectroscopy",2010,"Fiber Society 2010 Fall Meeting and Technical Conference",,,,"","",,,,"https://www.scopus.com/inward/record.uri?eid=2-s2.0-84969772288&partnerID=40&md5=840d91153c56e999c48d737e81ea5d51",Conference Paper,Scopus,2-s2.0-84969772288
"Yun, J.X., Zhang, L., Dean, D., Laberge, M., Yao, H.","Mechanical properties of TMJ disc cells measured by atomic force microscopy",2009,"Proceedings of the ASME Summer Bioengineering Conference, SBC2008",,"PART B",,"1075","1076",,,,"https://www.scopus.com/inward/record.uri?eid=2-s2.0-77952651413&partnerID=40&md5=252206d25349ef2e08f6748b1fc7ad0e",Conference Paper,Scopus,2-s2.0-77952651413
"Liu, H., Yun, J.X., Pirlo, R.K., Dean, D., Yao, H., Laberge, M., Gao, B.Z.","The dependence of mechanical properties of adult rat myocytes on cell alignment",2009,"Proceedings of the ASME Summer Bioengineering Conference, SBC2008",,"PART B",,"573","574",,,,"https://www.scopus.com/inward/record.uri?eid=2-s2.0-77952637757&partnerID=40&md5=1666de0818685ba7281d9663d558255b",Conference Paper,Scopus,2-s2.0-77952637757
"Hemmer, J.D., Nagatomi, J., Wood, S.T., Vertegel, A.A., Dean, D., LaBerge, M.","Role of cytoskeletal components in stress-relaxation behavior of adherent vascular smooth muscle cells",2009,"Journal of Biomechanical Engineering","131","4",,"","",,13,10.1115/1.3049860,"https://www.scopus.com/inward/record.uri?eid=2-s2.0-67049160158&doi=10.1115%2f1.3049860&partnerID=40&md5=e34c4af9726fdf925bf1e373b480f9d1",Article,Scopus,2-s2.0-67049160158
"Deitch, S., Kunkle, C., Cui, X., Boland, T., Dean, D.","Collagen matrix alignment using inkjet printer technology",2008,"Materials Research Society Symposium Proceedings","1094",,,"52","57",,11,,"https://www.scopus.com/inward/record.uri?eid=2-s2.0-77953959556&partnerID=40&md5=8f9114370b6d2176efacbc4b4ecd245b",Conference Paper,Scopus,2-s2.0-77953959556
"Han, L., Dean, D., Daher, L.A., Grodzinsky, A.J., Ortiz, C.","Cartilage aggrecan can undergo self-adhesion",2008,"Biophysical Journal","95","10",,"4862","4870",,20,10.1529/biophysj.107.128389,"https://www.scopus.com/inward/record.uri?eid=2-s2.0-58149299895&doi=10.1529%2fbiophysj.107.128389&partnerID=40&md5=0a79710bc623213d18c09570cfe9769e",Article,Scopus,2-s2.0-58149299895
"Hemmer, J.D., Dean, D., Vertegel, A., Langan, E., Laberge III, M.","Effects of serum deprivation on the mechanical properties of adherent vascular smooth muscle cells",2008,"Proceedings of the Institution of Mechanical Engineers, Part H: Journal of Engineering in Medicine","222","5",,"761","772",,11,10.1243/09544119JEIM371,"https://www.scopus.com/inward/record.uri?eid=2-s2.0-54749125126&doi=10.1243%2f09544119JEIM371&partnerID=40&md5=f48ecc906da623983473eb7d4bdc2682",Article,Scopus,2-s2.0-54749125126
"Han, L., Dean, D., Mao, P., Ortiz, C., Grodzinsky, A.J.","Nanoscale shear deformation mechanisms of opposing cartilage aggrecan macromolecules",2007,"Biophysical Journal","93","5",,"L23","L25",,18,10.1529/biophysj.107.114025,"https://www.scopus.com/inward/record.uri?eid=2-s2.0-34548648016&doi=10.1529%2fbiophysj.107.114025&partnerID=40&md5=a349188f73f7b3ec0432c3cd80a43f7c",Article,Scopus,2-s2.0-34548648016
"Han, L., Dean, D., Ortiz, C., Grodzinsky, A.J.","Lateral nanomechanics of cartilage aggrecan macromolecules",2007,"Biophysical Journal","92","4",,"1384","1398",,53,10.1529/biophysj.106.091397,"https://www.scopus.com/inward/record.uri?eid=2-s2.0-33846839235&doi=10.1529%2fbiophysj.106.091397&partnerID=40&md5=b0390054b1c01c24b55be7486c33af87",Article,Scopus,2-s2.0-33846839235
"Dean, D., Han, L., Grodzinsky, A.J., Ortiz, C.","Compressive nanomechanics of opposing aggrecan macromolecules",2006,"Journal of Biomechanics","39","14",,"2555","2565",,54,10.1016/j.jbiomech.2005.09.007,"https://www.scopus.com/inward/record.uri?eid=2-s2.0-33749053614&doi=10.1016%2fj.jbiomech.2005.09.007&partnerID=40&md5=6d96351667136fe020823f0f9079ffc0",Article,Scopus,2-s2.0-33749053614
"Pirlo, R.K., Dean, D.M.D., Knapp, D.R., Gao, B.Z.","Cell deposition system based on laser guidance",2006,"Biotechnology Journal","1","9",,"1007","1013",,34,10.1002/biot.200600127,"https://www.scopus.com/inward/record.uri?eid=2-s2.0-34548429081&doi=10.1002%2fbiot.200600127&partnerID=40&md5=42d872079fee2ebcb45d20c68a6cd2dc",Article,Scopus,2-s2.0-34548429081
"Vandiver, J., Dean, D., Patel, N., Botelho, C., Best, S., Santos, J.D., Lopes, M.A., Bonfield, W., Ortiz, C.","Silicon addition to hydroxyapatite increases nanoscale electrostatic, van der Waals, and adhesive interactions",2006,"Journal of Biomedical Materials Research - Part A","78","2",,"352","363",,39,10.1002/jbm.a.30737,"https://www.scopus.com/inward/record.uri?eid=2-s2.0-33745965657&doi=10.1002%2fjbm.a.30737&partnerID=40&md5=1933c9a6962fecdd7e51ec450e0fde76",Article,Scopus,2-s2.0-33745965657
"Seog, J., Dean, D., Rolauffs, B., Wu, T., Genzer, J., Plaas, A.H.K., Grodzinsky, A.J., Ortiz, C.","Nanomechanics of opposing glycosaminoglycan macromolecules",2005,"Journal of Biomechanics","38","9",,"1789","1797",,31,10.1016/j.jbiomech.2004.09.010,"https://www.scopus.com/inward/record.uri?eid=2-s2.0-22044438115&doi=10.1016%2fj.jbiomech.2004.09.010&partnerID=40&md5=06fcd7f967170098a45da864c7bee768",Article,Scopus,2-s2.0-22044438115
"Dean, D., Han, L., Ortiz, C., Grodzinsky, A.J.","Nanoscale conformation and compressibility of cartilage aggrecan using microcontact printing and atomic force microscopy",2005,"Macromolecules","38","10",,"4047","4049",,30,10.1021/ma047626k,"https://www.scopus.com/inward/record.uri?eid=2-s2.0-19944423120&doi=10.1021%2fma047626k&partnerID=40&md5=bc322e62cf978fa2f7e86c243cb5f4c3",Article,Scopus,2-s2.0-19944423120
"Vandiver, J., Dean, D., Patel, N., Bonfield, W., Ortiz, C.","Nanoscale variation in surface charge of synthetic hydroxyapatite detected by chemically and spatially specific high-resolution force spectroscopy",2005,"Biomaterials","26","3",,"271","283",,70,10.1016/j.biomaterials.2004.02.053,"https://www.scopus.com/inward/record.uri?eid=2-s2.0-3242720511&doi=10.1016%2fj.biomaterials.2004.02.053&partnerID=40&md5=5fc2b219ffef413eef3ea838e47fc9a9",Article,Scopus,2-s2.0-3242720511
"Fitzgerald, J.B., Jin, M., Dean, D., Wood, D.J., Zheng, M.H., Grodzinsky, A.J.","Mechanical Compression of Cartilage Explants Induces Multiple Time-dependent Gene Expression Patterns and Involves Intracellular Calcium and Cyclic AMP",2004,"Journal of Biological Chemistry","279","19",,"19502","19511",,147,10.1074/jbc.M400437200,"https://www.scopus.com/inward/record.uri?eid=2-s2.0-2442531856&doi=10.1074%2fjbc.M400437200&partnerID=40&md5=acaacec990c988da5efefa0ca7389731",Article,Scopus,2-s2.0-2442531856
"Seog, J., Dean, D.M., Frank, E.H., Ortiz, C., Grodzinsky, A.J.","Preparation of end-grafted polyelectrolyte brushes on nanoscale probe tips using an electric field",2004,"Macromolecules","37","3",,"1156","1158",,6,,"https://www.scopus.com/inward/record.uri?eid=2-s2.0-1342326078&partnerID=40&md5=ff680956b89fd491d38c04b41bb3bd1d",Article,Scopus,2-s2.0-1342326078
"Rixman, M.A., Dean, D., Ortiz, C.","Nanoscale Intermolecular Interactions between Human Serum Albumin and Low Grafting Density Surfaces of Poly(ethylene oxide)",2003,"Langmuir","19","22",,"9357","9372",,62,10.1021/la034057l,"https://www.scopus.com/inward/record.uri?eid=2-s2.0-0242709508&doi=10.1021%2fla034057l&partnerID=40&md5=4a4f99786f3e33dcbc08aa1d04ed689d",Article,Scopus,2-s2.0-0242709508
"Rixman, M.A., Dean, D., Macias, C.E., Ortiz, C.","Nanoscale intermolecular interactions between human serum albumin and alkanethiol self-assembled monolayers",2003,"Langmuir","19","15",,"6202","6218",,33,10.1021/la026551f,"https://www.scopus.com/inward/record.uri?eid=2-s2.0-0041705240&doi=10.1021%2fla026551f&partnerID=40&md5=4536749c7a6087e71c0f0c15556be1ae",Article,Scopus,2-s2.0-0041705240
"Dean, D., Seog, J., Ortiz, C., Grodzinsky, A.J.","Molecular-level theoretical model for electrostatic interactions within polyelectrolyte brushes: Applications to charged glycosaminoglycans",2003,"Langmuir","19","13",,"5526","5539",,45,10.1021/la027001k,"https://www.scopus.com/inward/record.uri?eid=2-s2.0-0038142722&doi=10.1021%2fla027001k&partnerID=40&md5=d11419d0ada252f3468dad0b00c74940",Article,Scopus,2-s2.0-0038142722
"Seog, J., Dean, D., Plaas, A.H.K., Wong-Palms, S., Grodzinsky, A.J., Ortiz, C.","Direct measurement of glycosaminoglycan intermolecular interactions via high-resolution force spectroscopy",2002,"Macromolecules","35","14",,"5601","5615",,81,10.1021/ma0121621,"https://www.scopus.com/inward/record.uri?eid=2-s2.0-0037008080&doi=10.1021%2fma0121621&partnerID=40&md5=9c1befd572a6ee05d676de4413630293",Article,Scopus,2-s2.0-0037008080
