Authors,Title,Year,Source title,Volume,Issue,Art. No.,Page start,Page end,Page count,Cited by,DOI,Link,Document Type,Source,EID
"Hyun, S., Sun, K., Ning, P.","FEC-Seluge: Efficient, reliable, and secure large data dissemination using erasure codes",2017,"Computer Communications","104",,,"191","203",,1,10.1016/j.comcom.2017.01.005,"https://www.scopus.com/inward/record.uri?eid=2-s2.0-85009761422&doi=10.1016%2fj.comcom.2017.01.005&partnerID=40&md5=6930960bdbf677d3c4bcac4854dc7fef",Article,Scopus,2-s2.0-85009761422
"Wang, R., Azab, A.M., Enck, W., Li, N., Ning, P., Chen, X., Shen, W., Cheng, Y.","SPOKE: Scalable knowledge collection and attack surface analysis of access control policy for security enhanced android",2017,"ASIA CCS 2017 - Proceedings of the 2017 ACM Asia Conference on Computer and Communications Security",,,,"612","624",,,10.1145/3052973.3052991,"https://www.scopus.com/inward/record.uri?eid=2-s2.0-85022028688&doi=10.1145%2f3052973.3052991&partnerID=40&md5=9da89dd4c2a67b0fc57e5b466f2eba56",Conference Paper,Scopus,2-s2.0-85022028688
"He, X., Dai, H., Ning, P., Dutta, R.","A Leader-Follower Controlled Markov Stopping Game for Delay Tolerant and Opportunistic Resource Sharing Networks",2017,"IEEE Journal on Selected Areas in Communications","35","3", 7835172,"615","627",,,10.1109/JSAC.2017.2659581,"https://www.scopus.com/inward/record.uri?eid=2-s2.0-85018914068&doi=10.1109%2fJSAC.2017.2659581&partnerID=40&md5=ff8ae9f6910e561526fec07e9e852bc2",Article,Scopus,2-s2.0-85018914068
"He, X., Dai, H., Ning, P., Dutta, R.","A multi-player Markov stopping game for delay-tolerant and opportunistic resource sharing networks",2016,"Proceedings - IEEE INFOCOM","2016-July",, 7524350,"","",,1,10.1109/INFOCOM.2016.7524350,"https://www.scopus.com/inward/record.uri?eid=2-s2.0-84983353611&doi=10.1109%2fINFOCOM.2016.7524350&partnerID=40&md5=c102d54c5c029fb0a74869519fc56dc1",Conference Paper,Scopus,2-s2.0-84983353611
"Fang, S., Liu, Y., Ning, P.","Mimicry Attacks Against Wireless Link Signature and New Defense Using Time-Synched Link Signature",2016,"IEEE Transactions on Information Forensics and Security","11","7", 7432029,"1515","1527",,,10.1109/TIFS.2016.2541307,"https://www.scopus.com/inward/record.uri?eid=2-s2.0-84964876672&doi=10.1109%2fTIFS.2016.2541307&partnerID=40&md5=ecba1ba4bb4a030f62893c30f7ea94cf",Article,Scopus,2-s2.0-84964876672
"He, X., Dai, H., Ning, P.","Faster Learning and Adaptation in Security Games by Exploiting Information Asymmetry",2016,"IEEE Transactions on Signal Processing","64","13", 7445244,"3429","3443",,1,10.1109/TSP.2016.2548987,"https://www.scopus.com/inward/record.uri?eid=2-s2.0-84976367385&doi=10.1109%2fTSP.2016.2548987&partnerID=40&md5=a56e908428d96e63e509aef398bf5a58",Article,Scopus,2-s2.0-84976367385
"Fang, S., Liu, Y., Ning, P.","Wireless Communications under Broadband Reactive Jamming Attacks",2016,"IEEE Transactions on Dependable and Secure Computing","13","3", 7029611,"394","408",,6,10.1109/TDSC.2015.2399304,"https://www.scopus.com/inward/record.uri?eid=2-s2.0-84970003978&doi=10.1109%2fTDSC.2015.2399304&partnerID=40&md5=be14a7c15239c357500b5f2fdaf1f34d",Article,Scopus,2-s2.0-84970003978
"He, X., Dai, H., Ning, P., Dutta, R.","Zero-determinant Strategies for Multi-player Multi-action Iterated Games",2016,"IEEE Signal Processing Letters","23","3", 7381622,"311","315",,,10.1109/LSP.2016.2517640,"https://www.scopus.com/inward/record.uri?eid=2-s2.0-84962286141&doi=10.1109%2fLSP.2016.2517640&partnerID=40&md5=6d25ea780777622c5e0b88e92b054837",Article,Scopus,2-s2.0-84962286141
"He, X., Dai, H., Shen, W., Ning, P., Dutta, R.","Toward Proper Guard Zones for Link Signature",2016,"IEEE Transactions on Wireless Communications","15","3", 7321830,"2104","2117",,3,10.1109/TWC.2015.2498621,"https://www.scopus.com/inward/record.uri?eid=2-s2.0-84963546084&doi=10.1109%2fTWC.2015.2498621&partnerID=40&md5=bc64cce3d511f984641f987a9cf1d174",Article,Scopus,2-s2.0-84963546084
"Shen, W., Liu, Y., He, X., Dai, H., Ning, P.","No time to demodulate - Fast physical layer verification of friendly jamming",2015,"Proceedings - IEEE Military Communications Conference MILCOM","2015-December",, 7357518,"653","658",,2,10.1109/MILCOM.2015.7357518,"https://www.scopus.com/inward/record.uri?eid=2-s2.0-84959290791&doi=10.1109%2fMILCOM.2015.7357518&partnerID=40&md5=a1dc2be534ae5b9852fe09d155090ae6",Conference Paper,Scopus,2-s2.0-84959290791
"He, X., Dai, H., Ning, P., Dutta, R.","A stochastic multi-channel spectrum access game with incomplete information",2015,"IEEE International Conference on Communications","2015-September",, 7249082,"4799","4804",,2,10.1109/ICC.2015.7249082,"https://www.scopus.com/inward/record.uri?eid=2-s2.0-84953721439&doi=10.1109%2fICC.2015.7249082&partnerID=40&md5=61172df9a10020632052b6e8472aeb9e",Conference Paper,Scopus,2-s2.0-84953721439
"He, X., Dai, H., Ning, P.","Improving learning and adaptation in security games by exploiting information asymmetry",2015,"Proceedings - IEEE INFOCOM","26",, 7218560,"1787","1795",,4,10.1109/INFOCOM.2015.7218560,"https://www.scopus.com/inward/record.uri?eid=2-s2.0-84953800487&doi=10.1109%2fINFOCOM.2015.7218560&partnerID=40&md5=acd868049a4c10765294070b053f2a5a",Conference Paper,Scopus,2-s2.0-84953800487
"Xiong, K., Ning, P.","Cost-efficient and attack-resilient approaches for state estimation in power grids",2015,"Proceedings of the ACM Symposium on Applied Computing","13-17-April-2015",,,"2192","2197",,,10.1145/2695664.2695937,"https://www.scopus.com/inward/record.uri?eid=2-s2.0-84955449726&doi=10.1145%2f2695664.2695937&partnerID=40&md5=8ddccd00ff77e2cd023b884cfe9654a7",Conference Paper,Scopus,2-s2.0-84955449726
"Wang, Q., Ren, K., Ning, P., Hu, S.","Jamming-resistant multi-radio multi-channel opportunistic spectrum access in cognitive radio networks",2015,"IEEE Transactions on Vehicular Technology","PP","99", 7362239,"","",,1,10.1109/TVT.2015.2511071,"https://www.scopus.com/inward/record.uri?eid=2-s2.0-84990932691&doi=10.1109%2fTVT.2015.2511071&partnerID=40&md5=476539962143c357f41b5acc72a68d93",Article,Scopus,2-s2.0-84990932691
"Yu, X., Ning, P., Vouk, M.A.","Enhancing security of Hadoop in a public cloud",2015,"2015 6th International Conference on Information and Communication Systems, ICICS 2015",,, 7103198,"38","43",,3,10.1109/IACS.2015.7103198,"https://www.scopus.com/inward/record.uri?eid=2-s2.0-84933528969&doi=10.1109%2fIACS.2015.7103198&partnerID=40&md5=b8be38f59e6022b70af34a02823b268c",Conference Paper,Scopus,2-s2.0-84933528969
"He, X., Dai, H., Ning, P., Dutta, R.","Dynamic IDS configuration in the presence of intruder type uncertainty",2015,"2015 IEEE Global Communications Conference, GLOBECOM 2015",,, 7417158,"","",,2,10.1109/GLOCOM.2014.7417158,"https://www.scopus.com/inward/record.uri?eid=2-s2.0-84964860704&doi=10.1109%2fGLOCOM.2014.7417158&partnerID=40&md5=e8c3c859bc4cddd5ddce162505de0935",Conference Paper,Scopus,2-s2.0-84964860704
"Gionta, J., Enck, W., Ning, P.","HideM: Protecting the contents of userspace memory in the face of disclosure vulnerabilities",2015,"CODASPY 2015 - Proceedings of the 5th ACM Conference on Data and Application Security and Privacy",,,,"325","336",,21,10.1145/2699026.2699107,"https://www.scopus.com/inward/record.uri?eid=2-s2.0-84928142971&doi=10.1145%2f2699026.2699107&partnerID=40&md5=f80efa959cbc737a6aea2a1ba3ef5e44",Conference Paper,Scopus,2-s2.0-84928142971
"Gionta, J., Azab, A., Enck, W., Ning, P., Zhang, X.","SEER: Practical memory virus scanning as a service",2014,"ACM International Conference Proceeding Series","2014-December","December",,"186","195",,3,10.1145/2664243.2664271,"https://www.scopus.com/inward/record.uri?eid=2-s2.0-84954526812&doi=10.1145%2f2664243.2664271&partnerID=40&md5=06e113001b50ac7d04a065955cb62541",Conference Paper,Scopus,2-s2.0-84954526812
"Zhang, Y., Yang, M., Yang, Z., Gu, G., Ning, P., Zang, B.","Permission use analysis for vetting undesirable behaviors in android apps",2014,"IEEE Transactions on Information Forensics and Security","9","11", 2347206,"1828","1842",,9,10.1109/TIFS.2014.2347206,"https://www.scopus.com/inward/record.uri?eid=2-s2.0-84908068169&doi=10.1109%2fTIFS.2014.2347206&partnerID=40&md5=401a5d2c71eafcba8b806ad3186d8068",Article,Scopus,2-s2.0-84908068169
"Ren, K., Samarati, P., Gruteser, M., Ning, P., Liu, Y.","Guest editorial special issue on security for IoT: The state of the art",2014,"IEEE Internet of Things Journal","1","5", 6932562,"369","371",,1,10.1109/JIOT.2014.2361608,"https://www.scopus.com/inward/record.uri?eid=2-s2.0-84908397545&doi=10.1109%2fJIOT.2014.2361608&partnerID=40&md5=d17d13ca25431df6d1242c2672cf9b74",Editorial,Scopus,2-s2.0-84908397545
"Yu, X., Ning, P., Vouk, M.A.","Securing hadoop in cloud",2014,"ACM International Conference Proceeding Series",,, 26,"","",,1,10.1145/2600176.2600202,"https://www.scopus.com/inward/record.uri?eid=2-s2.0-84906810301&doi=10.1145%2f2600176.2600202&partnerID=40&md5=8529785b9414a45d57f39b050de158b4",Conference Paper,Scopus,2-s2.0-84906810301
"He, X., Dai, H., Ning, P.","Dynamic adaptive anti-jamming via controlled mobility",2014,"IEEE Transactions on Wireless Communications","13","8", 6807812,"4374","4388",,5,10.1109/TWC.2014.2320973,"https://www.scopus.com/inward/record.uri?eid=2-s2.0-84906256386&doi=10.1109%2fTWC.2014.2320973&partnerID=40&md5=fe4a278e83dd568abdfca06df08b064e",Article,Scopus,2-s2.0-84906256386
"Shen, W., Ning, P., He, X., Dai, H., Liu, Y.","MCR Decoding: A MIMO approach for defending against wireless jamming attacks",2014,"2014 IEEE Conference on Communications and Network Security, CNS 2014",,, 6997478,"133","138",,4,10.1109/CNS.2014.6997478,"https://www.scopus.com/inward/record.uri?eid=2-s2.0-84921498554&doi=10.1109%2fCNS.2014.6997478&partnerID=40&md5=5707851df1c57b9ffa9852118163c2bd",Conference Paper,Scopus,2-s2.0-84921498554
"He, X., Dai, H., Huang, Y., Wang, D., Shen, W., Ning, P.","The security of link signature: A view from channel models",2014,"2014 IEEE Conference on Communications and Network Security, CNS 2014",,, 6997473,"103","108",,6,10.1109/CNS.2014.6997473,"https://www.scopus.com/inward/record.uri?eid=2-s2.0-84921502602&doi=10.1109%2fCNS.2014.6997473&partnerID=40&md5=eee950191895636d02cf4308d1ca28a9",Conference Paper,Scopus,2-s2.0-84921502602
"Azab, A.M., Ning, P., Shah, J., Chen, Q., Bhutkar, R., Ganesh, G., Ma, J., Shen, W.","Hypervision across worlds: Real-time kernel protection from the ARM trustzone secure world",2014,"Proceedings of the ACM Conference on Computer and Communications Security",,,,"90","102",,42,10.1145/2660267.2660350,"https://www.scopus.com/inward/record.uri?eid=2-s2.0-84910673981&doi=10.1145%2f2660267.2660350&partnerID=40&md5=e7f336b9e86a9415dd6500aa5f8e963e",Conference Paper,Scopus,2-s2.0-84910673981
"Yang, Z., Yang, M., Zhang, Y., Gu, G., Ning, P., Wang, X.S.","AppIntent: Analyzing sensitive data transmission in Android for privacy leakage detection",2013,"Proceedings of the ACM Conference on Computer and Communications Security",,,,"1043","1054",,100,10.1145/2508859.2516676,"https://www.scopus.com/inward/record.uri?eid=2-s2.0-84889041424&doi=10.1145%2f2508859.2516676&partnerID=40&md5=a49289e75b0694e9cfeb98cd0803d496",Conference Paper,Scopus,2-s2.0-84889041424
"Zhang, Y., Yang, M., Xu, B., Yang, Z., Gu, G., Ning, P., Wang, X.S., Zang, B.","Vetting undesirable behaviors in Android apps with permission use analysis",2013,"Proceedings of the ACM Conference on Computer and Communications Security",,,,"611","622",,107,10.1145/2508859.2516689,"https://www.scopus.com/inward/record.uri?eid=2-s2.0-84889068951&doi=10.1145%2f2508859.2516689&partnerID=40&md5=a3d30f5c40f441bed720a6ec0ec54d85",Conference Paper,Scopus,2-s2.0-84889068951
"He, X., Dai, H., Ning, P.","HMM-based malicious user detection for robust collaborative spectrum sensing",2013,"IEEE Journal on Selected Areas in Communications","31","11", 6635249,"2196","2208",,18,10.1109/JSAC.2013.131119,"https://www.scopus.com/inward/record.uri?eid=2-s2.0-84886666121&doi=10.1109%2fJSAC.2013.131119&partnerID=40&md5=bdfdd03a7097f5a20e1c4ff7f9f1aa71",Article,Scopus,2-s2.0-84886666121
"He, X., Dai, H., Shen, W., Ning, P.","Is link signature dependable for wireless security?",2013,"Proceedings - IEEE INFOCOM",,, 6566763,"200","204",,21,10.1109/INFCOM.2013.6566763,"https://www.scopus.com/inward/record.uri?eid=2-s2.0-84883075684&doi=10.1109%2fINFCOM.2013.6566763&partnerID=40&md5=57f4afdb3983c438fcf74a913b3c9096",Conference Paper,Scopus,2-s2.0-84883075684
"Shen, W., Ning, P., He, X., Dai, H.","Ally friendly jamming: How to jam your enemy and maintain your own wireless connectivity at the same time",2013,"Proceedings - IEEE Symposium on Security and Privacy",,, 6547109,"174","188",,22,10.1109/SP.2013.22,"https://www.scopus.com/inward/record.uri?eid=2-s2.0-84881223293&doi=10.1109%2fSP.2013.22&partnerID=40&md5=28c4341355f88f1ed5c2acc084cb2965",Conference Paper,Scopus,2-s2.0-84881223293
"He, X., Dai, H., Ning, P.","A byzantine attack defender in cognitive radio networks: The conditional frequency check",2013,"IEEE Transactions on Wireless Communications","12","5", 6485035,"2512","2523",,22,10.1109/TWC.2013.031313.121551,"https://www.scopus.com/inward/record.uri?eid=2-s2.0-84878663742&doi=10.1109%2fTWC.2013.031313.121551&partnerID=40&md5=a32b588d63646868af6c0038a003360b",Article,Scopus,2-s2.0-84878663742
"Dong, Q., Liu, D., Ning, P.","Providing dos resistance for signature-based broadcast authentication in sensor networks",2013,"Transactions on Embedded Computing Systems","12","3", 73,"","",,3,10.1145/2442116.2442123,"https://www.scopus.com/inward/record.uri?eid=2-s2.0-84878502033&doi=10.1145%2f2442116.2442123&partnerID=40&md5=5602420545f6ac06230fc440d78b0b5a",Article,Scopus,2-s2.0-84878502033
"He, X., Dai, H., Ning, P.","Dynamic adaptive anti-jamming via controlled mobility",2013,"2013 IEEE Conference on Communications and Network Security, CNS 2013",,, 6682686,"1","9",,2,10.1109/CNS.2013.6682686,"https://www.scopus.com/inward/record.uri?eid=2-s2.0-84893630983&doi=10.1109%2fCNS.2013.6682686&partnerID=40&md5=de18de843466b2e6f98f2bfa1679eb79",Conference Paper,Scopus,2-s2.0-84893630983
"He, X., Dai, H., Ning, P.","A Byzantine attack defender: The conditional frequency check",2012,"IEEE International Symposium on Information Theory - Proceedings",,, 6284709,"975","979",,6,10.1109/ISIT.2012.6284709,"https://www.scopus.com/inward/record.uri?eid=2-s2.0-84867514395&doi=10.1109%2fISIT.2012.6284709&partnerID=40&md5=9786fbd45336a2a62e5972ba037b9317",Conference Paper,Scopus,2-s2.0-84867514395
"Li, C., Dai, H., Xiao, L., Ning, P.","Communication efficiency of anti-jamming broadcast in large-scale multi-channel wireless networks",2012,"IEEE Transactions on Signal Processing","60","10", 6227371,"5281","5292",,12,10.1109/TSP.2012.2206589,"https://www.scopus.com/inward/record.uri?eid=2-s2.0-84866510726&doi=10.1109%2fTSP.2012.2206589&partnerID=40&md5=9f165fe9174bbdd307fb92f8b6b65e03",Article,Scopus,2-s2.0-84866510726
"Yavuz, A.A., Ning, P., Reiter, M.K.","Efficient, compromise resilient and append-only cryptographic schemes for secure audit logging",2012,"Lecture Notes in Computer Science (including subseries Lecture Notes in Artificial Intelligence and Lecture Notes in Bioinformatics)","7397 LNCS",,,"148","163",,5,10.1007/978-3-642-32946-3_12,"https://www.scopus.com/inward/record.uri?eid=2-s2.0-84865827663&doi=10.1007%2f978-3-642-32946-3_12&partnerID=40&md5=d87a1529d3ca168f1b147c79fbbed6fc",Conference Paper,Scopus,2-s2.0-84865827663
"Yavuz, A.A., Ning, P.","Self-sustaining, efficient and forward-secure cryptographic constructions for Unattended Wireless Sensor Networks",2012,"Ad Hoc Networks","10","7",,"1204","1220",,8,10.1016/j.adhoc.2012.03.006,"https://www.scopus.com/inward/record.uri?eid=2-s2.0-84861961943&doi=10.1016%2fj.adhoc.2012.03.006&partnerID=40&md5=18a69080a59ef522a8bd6e47e3b96168",Article,Scopus,2-s2.0-84861961943
"Zeng, W., Chow, M.-Y., Ning, P.","Secure distributed control in unreliable D-NCS",2012,"IEEE International Symposium on Industrial Electronics",,, 6237375,"1858","1863",,14,10.1109/ISIE.2012.6237375,"https://www.scopus.com/inward/record.uri?eid=2-s2.0-84864842763&doi=10.1109%2fISIE.2012.6237375&partnerID=40&md5=217f9ea6c46c3f6cbd0bb380c366d821",Conference Paper,Scopus,2-s2.0-84864842763
"Gionta, J., Ning, P., Zhang, X.","iHTTP: Efficient authentication of non-confidential HTTP traffic",2012,"Lecture Notes in Computer Science (including subseries Lecture Notes in Artificial Intelligence and Lecture Notes in Bioinformatics)","7341 LNCS",,,"381","399",,3,10.1007/978-3-642-31284-7_23,"https://www.scopus.com/inward/record.uri?eid=2-s2.0-84863496960&doi=10.1007%2f978-3-642-31284-7_23&partnerID=40&md5=77e45a9d9ca11a5272a85690f5442f61",Conference Paper,Scopus,2-s2.0-84863496960
"Yavuz, A.A., Ning, P., Reiter, M.K.","BAF and FI-BAF: Efficient and publicly verifiable cryptographic schemes for secure logging in resource-constrained systems",2012,"ACM Transactions on Information and System Security","15","2", 9,"","",,8,10.1145/2240276.2240280,"https://www.scopus.com/inward/record.uri?eid=2-s2.0-84878574973&doi=10.1145%2f2240276.2240280&partnerID=40&md5=8038735d91d41d607996c9155a9400d7",Article,Scopus,2-s2.0-84878574973
"Xiong, K., Wang, R., Du, W., Ning, P.","Containing bogus packet insertion attacks for broadcast authentication in sensor networks",2012,"ACM Transactions on Sensor Networks","8","3", 20,"","",,2,10.1145/2240092.2240094,"https://www.scopus.com/inward/record.uri?eid=2-s2.0-84866380261&doi=10.1145%2f2240092.2240094&partnerID=40&md5=4b12de47433466bc78e2106ee3d7ba01",Article,Scopus,2-s2.0-84866380261
"Liu, Y., Ning, P.","BitTrickle: Defending against broadband and high-power reactive jamming attacks",2012,"Proceedings - IEEE INFOCOM",,, 6195840,"909","917",,18,10.1109/INFCOM.2012.6195840,"https://www.scopus.com/inward/record.uri?eid=2-s2.0-84861602103&doi=10.1109%2fINFCOM.2012.6195840&partnerID=40&md5=26fe26cbe6f9bac6f12cf3a48645a432",Conference Paper,Scopus,2-s2.0-84861602103
"Liu, Y., Ning, P.","Enhanced wireless channel authentication using time-synched link signature",2012,"Proceedings - IEEE INFOCOM",,, 6195669,"2636","2640",,16,10.1109/INFCOM.2012.6195669,"https://www.scopus.com/inward/record.uri?eid=2-s2.0-84861598237&doi=10.1109%2fINFCOM.2012.6195669&partnerID=40&md5=1e132a11c951be0bf31d66f71ace0d2d",Conference Paper,Scopus,2-s2.0-84861598237
"Natarajan, A., Ning, P., Liu, Y., Jajodia, S., Hutchinson, S.E.","NSDMiner: Automated discovery of network service dependencies",2012,"Proceedings - IEEE INFOCOM",,, 6195642,"2507","2515",,15,10.1109/INFCOM.2012.6195642,"https://www.scopus.com/inward/record.uri?eid=2-s2.0-84861608741&doi=10.1109%2fINFCOM.2012.6195642&partnerID=40&md5=d8c383e802b81d1c8c123e580db7ae89",Conference Paper,Scopus,2-s2.0-84861608741
"Xiao, L., Dai, H., Ning, P.","MAC design of uncoordinated FH-based collaborative broadcast",2012,"IEEE Wireless Communications Letters","1","3", 6186722,"261","264",,6,10.1109/WCL.2012.041012.120162,"https://www.scopus.com/inward/record.uri?eid=2-s2.0-84863002844&doi=10.1109%2fWCL.2012.041012.120162&partnerID=40&md5=d5d22ab222e10fa022615379d014d317",Article,Scopus,2-s2.0-84863002844
"Kim, M., Iyer, V.K.S., Ning, P.","MrFair: Misbehavior-resistant fair scheduling in wireless mesh networks",2012,"Ad Hoc Networks","10","3",,"299","316",,3,10.1016/j.adhoc.2011.07.001,"https://www.scopus.com/inward/record.uri?eid=2-s2.0-84856556871&doi=10.1016%2fj.adhoc.2011.07.001&partnerID=40&md5=2044dacf1c1e1882449917d473448e27",Article,Scopus,2-s2.0-84856556871
"Pyun, Y.J., Park, Y., Reeves, D.S., Wang, X., Ning, P.","Interval-based flow watermarking for tracing interactive traffic",2012,"Computer Networks","56","5",,"1646","1665",,10,10.1016/j.comnet.2012.01.017,"https://www.scopus.com/inward/record.uri?eid=2-s2.0-84862800623&doi=10.1016%2fj.comnet.2012.01.017&partnerID=40&md5=8a0d1491474077f592b9d6a29c38e396",Article,Scopus,2-s2.0-84862800623
"Xiao, L., Dai, H., Ning, P.","Jamming-resistant collaborative broadcast using uncoordinated frequency hopping",2012,"IEEE Transactions on Information Forensics and Security","7","1 PART 2", 5995292,"297","309",,25,10.1109/TIFS.2011.2165948,"https://www.scopus.com/inward/record.uri?eid=2-s2.0-84855955465&doi=10.1109%2fTIFS.2011.2165948&partnerID=40&md5=927b7a78dfad900534d6fa205fc85fb7",Article,Scopus,2-s2.0-84855955465
"Ning, P., Jajodia, S.","Intrusion-Detection Systems",2012,"Handbook of Computer Networks","3",,,"403","420",,,10.1002/9781118256107.ch26,"https://www.scopus.com/inward/record.uri?eid=2-s2.0-84886118825&doi=10.1002%2f9781118256107.ch26&partnerID=40&md5=f125a8749483badc4106376f9260a351",Book Chapter,Scopus,2-s2.0-84886118825
"Wang, Q., Ren, K., Ning, P.","Anti-jamming communication in cognitive radio networks with unknown channel statistics",2011,"Proceedings - International Conference on Network Protocols, ICNP",,, 6089079,"393","402",,23,10.1109/ICNP.2011.6089079,"https://www.scopus.com/inward/record.uri?eid=2-s2.0-84055181431&doi=10.1109%2fICNP.2011.6089079&partnerID=40&md5=a713c68321daf8fab560fb7e963fa48a",Conference Paper,Scopus,2-s2.0-84055181431
"Xiao, L., Dai, H., Ning, P.","Jamming-resistant collaborative broadcast in wireless networks, Part II: Multihop networks",2011,"GLOBECOM - IEEE Global Telecommunications Conference",,, 6133541,"","",,3,10.1109/GLOCOM.2011.6133541,"https://www.scopus.com/inward/record.uri?eid=2-s2.0-84857213246&doi=10.1109%2fGLOCOM.2011.6133541&partnerID=40&md5=fb830866a5da51ea69b80b86702aa859",Conference Paper,Scopus,2-s2.0-84857213246
"Tran, M., Etheridge, M., Bletsch, T., Jiang, X., Freeh, V., Ning, P.","On the expressiveness of return-into-libc attacks",2011,"Lecture Notes in Computer Science (including subseries Lecture Notes in Artificial Intelligence and Lecture Notes in Bioinformatics)","6961 LNCS",,,"121","141",,26,10.1007/978-3-642-23644-0_7,"https://www.scopus.com/inward/record.uri?eid=2-s2.0-84857304973&doi=10.1007%2f978-3-642-23644-0_7&partnerID=40&md5=a86f7e443c9ac12be9d3ca666c45358b",Conference Paper,Scopus,2-s2.0-84857304973
"Qi, H., Wang, X., Tolbert, L.M., Li, F., Peng, F.Z., Ning, P., Amin, M.","A resilient real-time system design for a secure and reconfigurable power grid",2011,"IEEE Transactions on Smart Grid","2","4", 6003812,"770","781",,28,10.1109/TSG.2011.2159819,"https://www.scopus.com/inward/record.uri?eid=2-s2.0-82155173477&doi=10.1109%2fTSG.2011.2159819&partnerID=40&md5=dc27219908863a8310918291e89ddf65",Article,Scopus,2-s2.0-82155173477
"Azab, A.M., Ning, P., Zhang, X.","SICE: A hardware-level strongly isolated computing environment for x86 multi-core platforms",2011,"Proceedings of the ACM Conference on Computer and Communications Security",,,,"375","388",,67,10.1145/2046707.2046752,"https://www.scopus.com/inward/record.uri?eid=2-s2.0-80755169488&doi=10.1145%2f2046707.2046752&partnerID=40&md5=291d00faeab9dc24c0b6cbf4b34baadb",Conference Paper,Scopus,2-s2.0-80755169488
"Hyun, S., Ning, P., Liu, A.","Mitigating wireless jamming attacks via channel migration",2011,"Proceedings - International Conference on Distributed Computing Systems",,, 5961505,"313","322",,4,10.1109/ICDCSW.2011.32,"https://www.scopus.com/inward/record.uri?eid=2-s2.0-80052403406&doi=10.1109%2fICDCSW.2011.32&partnerID=40&md5=47fe782014f862e39227857c9a02b7c4",Conference Paper,Scopus,2-s2.0-80052403406
"Liu, Y., Ning, P., Reiter, M.K.","False data injection attacks against state estimation in electric power grids",2011,"ACM Transactions on Information and System Security","14","1", 13,"","",,284,10.1145/1952982.1952995,"https://www.scopus.com/inward/record.uri?eid=2-s2.0-79959856672&doi=10.1145%2f1952982.1952995&partnerID=40&md5=ad414b85e3cbaea2e87d42fa740d7342",Conference Paper,Scopus,2-s2.0-79959856672
"Kim, M., Ning, P.","SeCA: A framework for secure channel assignment in wireless mesh networks",2011,"Computer Communications","34","4",,"567","576",,3,10.1016/j.comcom.2010.05.008,"https://www.scopus.com/inward/record.uri?eid=2-s2.0-79151481224&doi=10.1016%2fj.comcom.2010.05.008&partnerID=40&md5=e1be108d927a2226a77f6e396f881c64",Article,Scopus,2-s2.0-79151481224
"Zhou, T., Choudhury, R.R., Ning, P., Chakrabarty, K.","P2DAP - Sybil attacks detection in vehicular ad hoc networks",2011,"IEEE Journal on Selected Areas in Communications","29","3", 5719270,"582","594",,44,10.1109/JSAC.2011.110308,"https://www.scopus.com/inward/record.uri?eid=2-s2.0-79951967501&doi=10.1109%2fJSAC.2011.110308&partnerID=40&md5=4f193d632af15990ce5e42723300f605",Article,Scopus,2-s2.0-79951967501
"Azab, A.M., Ning, P., Wang, Z., Jiang, X., Zhang, X., Skalsky, N.C.","HyperSentry: Enabling stealthy in-context measurement of hypervisor integrity",2010,"Proceedings of the ACM Conference on Computer and Communications Security",,,,"38","49",,145,10.1145/1866307.1866313,"https://www.scopus.com/inward/record.uri?eid=2-s2.0-78650019783&doi=10.1145%2f1866307.1866313&partnerID=40&md5=b839429c376f0148478ff852874d4e84",Conference Paper,Scopus,2-s2.0-78650019783
"Ning, P., Xu, D.","Toward automated intrusion alert analysis",2010,"Network Security",,,,"175","205",,1,10.1007/978-0-387-73821-5_8,"https://www.scopus.com/inward/record.uri?eid=2-s2.0-84860670029&doi=10.1007%2f978-0-387-73821-5_8&partnerID=40&md5=68e36c51061e8a6c094f1313510a2754",Book Chapter,Scopus,2-s2.0-84860670029
"Ning, P., Lou, W.","Message from ICDCS-SPCC 2010 Workshop Program co-chairs",2010,"Proceedings - International Conference on Distributed Computing Systems",,, 5628816,"","",,,10.1109/ICDCSW.2010.10,"https://www.scopus.com/inward/record.uri?eid=2-s2.0-79952023801&doi=10.1109%2fICDCSW.2010.10&partnerID=40&md5=7b9575254c838a543200f7330f1277bf",Editorial,Scopus,2-s2.0-79952023801
