Authors,Title,Year,Source title,Volume,Issue,Art. No.,Page start,Page end,Page count,Cited by,DOI,Link,Document Type,Source,EID
"Liu, D., Ning, P., Zhu, S., Jajodia, S.","Practical broadcast authentication in sensor networks",2005,"MobiQuitous 2005: Second Annual International Conference on Mobile and Ubiquitous Systems -Networking and Services",,, 1540993,"118","129",,105,10.1109/MOBIQUITOUS.2005.49,"https://www.scopus.com/inward/record.uri?eid=2-s2.0-33749513007&doi=10.1109%2fMOBIQUITOUS.2005.49&partnerID=40&md5=f5ba5813aba2caca3c22f6645a5e7acd",Conference Paper,Scopus,2-s2.0-33749513007
"Liu, D., Ning, P., Du, W.K.","Attack-resistant location estimation in sensor networks",2005,"2005 4th International Symposium on Information Processing in Sensor Networks, IPSN 2005","2005",, 1440904,"99","106",,179,10.1109/IPSN.2005.1440904,"https://www.scopus.com/inward/record.uri?eid=2-s2.0-33144467903&doi=10.1109%2fIPSN.2005.1440904&partnerID=40&md5=047da5b2f0b4b5991de64670fe41985b",Conference Paper,Scopus,2-s2.0-33144467903
"Xu, J., Ning, P., Kil, C., Zhai, Y., Bookholt, C.","Automatic diagnosis and response to memory corruption vulnerabilities",2005,"Proceedings of the ACM Conference on Computer and Communications Security",,,,"223","234",,51,,"https://www.scopus.com/inward/record.uri?eid=2-s2.0-33745803872&partnerID=40&md5=1b342d95ba71a5f3845307f5081763fa",Conference Paper,Scopus,2-s2.0-33745803872
"Liu, D., Ning, P.","Improving Key Predistribution with Deployment Knowledge in Static Sensor Networks",2005,"ACM Transactions on Sensor Networks","1","2",,"204","239",,122,10.1145/1105688.1105691,"https://www.scopus.com/inward/record.uri?eid=2-s2.0-84866860550&doi=10.1145%2f1105688.1105691&partnerID=40&md5=54118924cce9f0c8ef95599c9e91dd59",Article,Scopus,2-s2.0-84866860550
"Ning, P., Sun, K.","How to misuse AODV: A case study of insider attacks against mobile ad-hoc routing protocols",2005,"Ad Hoc Networks","3","6",,"795","819",,49,10.1016/j.adhoc.2004.04.001,"https://www.scopus.com/inward/record.uri?eid=2-s2.0-24144437206&doi=10.1016%2fj.adhoc.2004.04.001&partnerID=40&md5=a9ae69dd2261a5005ef849958a5ce396",Article,Scopus,2-s2.0-24144437206
"Fang, L., Du, W., Ning, P.","A beacon-less location discovery scheme for wireless sensor networks",2005,"Proceedings - IEEE INFOCOM","1",,,"161","171",,87,,"https://www.scopus.com/inward/record.uri?eid=2-s2.0-25844493197&partnerID=40&md5=0510a580d49820bf69de919318395435",Conference Paper,Scopus,2-s2.0-25844493197
"Ning, P., Liu, D.","Broadcast Authentication and Key Management for Secure Sensor Networks",2005,"Handbook of Sensor Networks: Algorithms and Architectures",,,,"141","172",,2,10.1002/047174414X.ch5,"https://www.scopus.com/inward/record.uri?eid=2-s2.0-84856673852&doi=10.1002%2f047174414X.ch5&partnerID=40&md5=34f428677136708a8a953c6518a63851",Book Chapter,Scopus,2-s2.0-84856673852
"Sun, K., Ning, P., Wang, C.","Fault-tolerant cluster-wise clock synchronization for wireless sensor networks",2005,"IEEE Transactions on Dependable and Secure Computing","2","3",,"177","189",,43,10.1109/TDSC.2005.36,"https://www.scopus.com/inward/record.uri?eid=2-s2.0-27644548026&doi=10.1109%2fTDSC.2005.36&partnerID=40&md5=c2714aea9e98c24b1ff4bc0c3c5a51df",Article,Scopus,2-s2.0-27644548026
"Liu, D., Ning, P., Rongfang, L.I.","Establishing pairwise keys in distributed sensor networks",2005,"ACM Transactions on Information and System Security","8","1",,"41","77",,408,10.1145/1053283.1053287,"https://www.scopus.com/inward/record.uri?eid=2-s2.0-16644374371&doi=10.1145%2f1053283.1053287&partnerID=40&md5=fe16754f3b51805cbf4a174fdf0e2fe1",Article,Scopus,2-s2.0-16644374371
"Liu, D., Ning, P., Du, W.","Detecting malicious beacon nodes for secure location discovery in wireless sensor networks",2005,"Proceedings - International Conference on Distributed Computing Systems",,,,"609","619",,126,,"https://www.scopus.com/inward/record.uri?eid=2-s2.0-27944459744&partnerID=40&md5=702527f8795e1017b4368419fdc44c20",Conference Paper,Scopus,2-s2.0-27944459744
"Xu, D., Ning, P.","Alert correlation through triggering events and common resources",2004,"Proceedings - Annual Computer Security Applications Conference, ACSAC",,,,"360","369",,44,10.1109/CSAC.2004.5,"https://www.scopus.com/inward/record.uri?eid=2-s2.0-21644452488&doi=10.1109%2fCSAC.2004.5&partnerID=40&md5=936ae7db0ef75bd210022cd3562de794",Conference Paper,Scopus,2-s2.0-21644452488
"Jiang, Q., Reeves, D.S., Ning, P.","Improving robustness of PGP keyrings by conflict detection",2004,"Lecture Notes in Computer Science (including subseries Lecture Notes in Artificial Intelligence and Lecture Notes in Bioinformatics)","2964",,,"194","207",,5,,"https://www.scopus.com/inward/record.uri?eid=2-s2.0-34248346949&partnerID=40&md5=b43d77c6424d2e5a05ec089af41e9ba1",Article,Scopus,2-s2.0-34248346949
"Zhai, Y., Ning, P., Iyer, P., Reeves, D.S.","Reasoning about complementary intrusion evidence",2004,"Proceedings - Annual Computer Security Applications Conference, ACSAC",,,,"39","48",,27,10.1109/CSAC.2004.29,"https://www.scopus.com/inward/record.uri?eid=2-s2.0-21644435323&doi=10.1109%2fCSAC.2004.29&partnerID=40&md5=2010412893b30b3f48fa3389d95591cf",Conference Paper,Scopus,2-s2.0-21644435323
"Jiang, Q., Reeves, D.S., Ning, P.","Certificate recommendations to improve the robustness of web of trust",2004,"Lecture Notes in Computer Science (including subseries Lecture Notes in Artificial Intelligence and Lecture Notes in Bioinformatics)","3225",,,"292","303",,2,,"https://www.scopus.com/inward/record.uri?eid=2-s2.0-35048873384&partnerID=40&md5=2c1a003617acc05ff253c6856e12022e",Article,Scopus,2-s2.0-35048873384
"Wang, P., Ning, P., Reeves, D.S.","Storage-efficient stateless group key revocation",2004,"Lecture Notes in Computer Science (including subseries Lecture Notes in Artificial Intelligence and Lecture Notes in Bioinformatics)","3225",,,"25","38",,11,,"https://www.scopus.com/inward/record.uri?eid=2-s2.0-35048833938&partnerID=40&md5=d35be2cc7b28b9d7c92eb57b324d9f91",Article,Scopus,2-s2.0-35048833938
"Ning, P., Xu, D.","Hypothesizing and reasoning about attacks missed by intrusion detection systems",2004,"ACM Transactions on Information and System Security","7","4",,"591","627",,32,10.1145/1042031.1042036,"https://www.scopus.com/inward/record.uri?eid=2-s2.0-14544283296&doi=10.1145%2f1042031.1042036&partnerID=40&md5=1619fb52f170d430646cfec9cdb04fc0",Article,Scopus,2-s2.0-14544283296
"Zhu, S., Setia, S., Jajodia, S., Ning, P.","An interleaved hop-by-hop authentication scheme for filtering of injected false data in sensor networks",2004,"Proceedings - IEEE Symposium on Security and Privacy","2004",,,"259","271",,339,,"https://www.scopus.com/inward/record.uri?eid=2-s2.0-3543056512&partnerID=40&md5=d5ac81ee6b47c95dd3ed9df90e890f1a",Conference Paper,Scopus,2-s2.0-3543056512
"Ning, P., Cui, Y., Reeves, D.S., Xu, D.","Techniques and tools for analyzing intrusion alerts",2004,"ACM Transactions on Information and System Security","7","2",,"274","318",,162,10.1145/996943.996947,"https://www.scopus.com/inward/record.uri?eid=2-s2.0-3142632087&doi=10.1145%2f996943.996947&partnerID=40&md5=2b54fc24bfb97cbc506735e5e0d3c6d3",Review,Scopus,2-s2.0-3142632087
"Liu, D., Ning, P.","Multilevel μTESLA: Broadcast Authentication for Distributed Sensor Networks",2004,"ACM Transactions on Embedded Computing Systems","3","4",,"800","836",,219,10.1145/1027794.1027800,"https://www.scopus.com/inward/record.uri?eid=2-s2.0-85000276942&doi=10.1145%2f1027794.1027800&partnerID=40&md5=a288bd4e1992ef5755438b3e8b64350e",Article,Scopus,2-s2.0-85000276942
"Ning, P., Xu, D.","Adapting query optimization techniques for efficient alert correlation",2004,"IFIP Advances in Information and Communication Technology","142",,,"75","88",,1,,"https://www.scopus.com/inward/record.uri?eid=2-s2.0-84902482261&partnerID=40&md5=9ee23dd55c4bccad7ad14469414f2db3",Conference Paper,Scopus,2-s2.0-84902482261
"Ning, P., Xu, D.","Learning attack strategies from intrusion alerts",2003,"Proceedings of the ACM Conference on Computer and Communications Security",,,,"200","209",,109,,"https://www.scopus.com/inward/record.uri?eid=2-s2.0-10444243686&partnerID=40&md5=e17bfda2befc125dc83dcc6f43ce93b5",Conference Paper,Scopus,2-s2.0-10444243686
"Liu, D., Ning, P.","Establishing pairwise keys in distributed sensor networks",2003,"Proceedings of the ACM Conference on Computer and Communications Security",,,,"52","61",,946,,"https://www.scopus.com/inward/record.uri?eid=2-s2.0-3042822764&partnerID=40&md5=d623db0ac8ddfc0aac1e4a638d59b711",Conference Paper,Scopus,2-s2.0-3042822764
"Liu, D., Ning, P.","Location-based pairwise key establishments for static sensor networks",2003,"Proceedings of the 1st ACM Workshop on Security of Ad Hoc and Security of Ad Hoc and Sensor Networks (in Association with 10th ACM Conference on Computer and Communications Security)",,,,"72","82",,376,,"https://www.scopus.com/inward/record.uri?eid=2-s2.0-4544293215&partnerID=40&md5=986e3d57a9de8d87fefb81b10e71f62b",Conference Paper,Scopus,2-s2.0-4544293215
"Liu, D., Ning, P., Sun, K.","Efficient self-healing group key distribution with revocation capability",2003,"Proceedings of the ACM Conference on Computer and Communications Security",,,,"231","240",,144,,"https://www.scopus.com/inward/record.uri?eid=2-s2.0-3543050471&partnerID=40&md5=d340beb00f6558484a38e25f6bf35845",Conference Paper,Scopus,2-s2.0-3543050471
"Li, Y., Ning, P., Wang, X.S., Jajodia, S.","Discovering calendar-based temporal association rules",2003,"Data and Knowledge Engineering","44","2",,"193","218",,85,10.1016/S0169-023X(02)00135-0,"https://www.scopus.com/inward/record.uri?eid=2-s2.0-0037293307&doi=10.1016%2fS0169-023X%2802%2900135-0&partnerID=40&md5=fba430fd0e2ef6c0df98e99cbcd73139",Article,Scopus,2-s2.0-0037293307
"Ning, P., Sun, K.","How to misuse AODV: A case study of insider attacks against mobile ad-hoc routing protocols",2003,"IEEE Systems, Man and Cybernetics Society Information Assurance Workshop",,, 1232402,"60","67",,66,10.1109/SMCSIA.2003.1232402,"https://www.scopus.com/inward/record.uri?eid=2-s2.0-84903836776&doi=10.1109%2fSMCSIA.2003.1232402&partnerID=40&md5=85bf76d6514a8e02026599ade9ceefac",Conference Paper,Scopus,2-s2.0-84903836776
"Ning, P., Cui, Y., Reeves, D.S.","Constructing attack scenarios through correlation of intrusion alerts",2002,"Proceedings of the ACM Conference on Computer and Communications Security",,,,"245","254",,308,,"https://www.scopus.com/inward/record.uri?eid=2-s2.0-0038011185&partnerID=40&md5=1847f58475209c1e15c3c5bc29e88ad6",Conference Paper,Scopus,2-s2.0-0038011185
"Ning, P., Wang, X.S., Jajodia, S.","An algebraic representation of calendars",2002,"Annals of Mathematics and Artificial Intelligence","36","1-2",,"5","38",,48,10.1023/A:1015835418881,"https://www.scopus.com/inward/record.uri?eid=2-s2.0-0036079980&doi=10.1023%2fA%3a1015835418881&partnerID=40&md5=cc1f25c2f5791ef262e7b10d14581c64",Conference Paper,Scopus,2-s2.0-0036079980
"Ning, P., Jajodia, S., Wang, X.S.","Design and implementation of a decentralized prototype system for detecting distributed attacks",2002,"Computer Communications","25","15",,"1374","1391",,11,10.1016/S0140-3664(02)00039-7,"https://www.scopus.com/inward/record.uri?eid=2-s2.0-0037105913&doi=10.1016%2fS0140-3664%2802%2900039-7&partnerID=40&md5=4ab51e3814921dbdc378e350e25fddff",Article,Scopus,2-s2.0-0037105913
"Ning, P., Cui, Y., Reeves, D.S.","Analyzing intensive intrusion alerts via correlation",2002,"Lecture Notes in Computer Science (including subseries Lecture Notes in Artificial Intelligence and Lecture Notes in Bioinformatics)","2516",,,"74","94",,20,10.1007/3-540-36084-0_5,"https://www.scopus.com/inward/record.uri?eid=2-s2.0-84958963784&doi=10.1007%2f3-540-36084-0_5&partnerID=40&md5=be466021088168c756aee9c1814661ce",Conference Paper,Scopus,2-s2.0-84958963784
"Li, Y., Ning, P., Wang, X.S., Jajodia, S.","Discovering calendar-based temporal association rules",2001,"Proceedings of the International Workshop on Temporal Representation and Reasoning",,, 930706,"111","118",,58,10.1109/TIME.2001.930706,"https://www.scopus.com/inward/record.uri?eid=2-s2.0-0041454634&doi=10.1109%2fTIME.2001.930706&partnerID=40&md5=3add41068344a60437d38fe9d899fcbb",Conference Paper,Scopus,2-s2.0-0041454634
"Liu, P., Ning, P., Jajodia, S.","Avoiding loss of fairness owing to failures in fair data exchange systems",2001,"Decision Support Systems","31","3",,"337","350",,11,10.1016/S0167-9236(00)00141-X,"https://www.scopus.com/inward/record.uri?eid=2-s2.0-0035426976&doi=10.1016%2fS0167-9236%2800%2900141-X&partnerID=40&md5=7fbc2d32a7d7f4d31cc8c2424cda6f2d",Article,Scopus,2-s2.0-0035426976
"Ning, P., Yin, Y.L.","Efficient software implementation for finite field multiplication in normal basis",2001,"Lecture Notes in Computer Science (including subseries Lecture Notes in Artificial Intelligence and Lecture Notes in Bioinformatics)","2229",,,"177","188",,18,,"https://www.scopus.com/inward/record.uri?eid=2-s2.0-84956974817&partnerID=40&md5=a0da0246122b4dafd59d5e09de0ddea8",Conference Paper,Scopus,2-s2.0-84956974817
"Ning, P., Jajodia, S., Wang, X.S.","Abstraction-Based Intrusion Detection in Distributed Environments",2001,"ACM Transactions on Information and System Security","4","4",,"407","452",,47,10.1145/503339.503342,"https://www.scopus.com/inward/record.uri?eid=2-s2.0-84883386223&doi=10.1145%2f503339.503342&partnerID=40&md5=aa7a94d2d1da0beadd43c5e41bd3c1d4",Article,Scopus,2-s2.0-84883386223
"Liu, P., Ning, P., Jajodia, S.","Avoiding loss of fairness owing to process crashes in fair data exchange protocols",2000,"Proceedings of the 2002 International Conference on Dependable Systems and Networks",,,,"631","640",,12,10.1109/ICDSN.2000.857600,"https://www.scopus.com/inward/record.uri?eid=2-s2.0-0034590192&doi=10.1109%2fICDSN.2000.857600&partnerID=40&md5=22bf4b8eb8e804075d67c9126c364e0e",Conference Paper,Scopus,2-s2.0-0034590192
"Ning, P., Wang, X.S., Jajodia, S.","Modeling requests among cooperating intrusion detection systems",2000,"Computer Communications","23","17",,"1702","1715",,8,10.1016/S0140-3664(00)00256-5,"https://www.scopus.com/inward/record.uri?eid=2-s2.0-0034316644&doi=10.1016%2fS0140-3664%2800%2900256-5&partnerID=40&md5=7fe08ff38f49932df0dcc0ad9d7e449f",Article,Scopus,2-s2.0-0034316644
